a nawa bányászati kft. ahhoz a nawa cégcsoporthoz tartozott , amely a taxisblokád idején jelentette be , hogy az akkor hordónként 29 dolláros világpiaci árnál olcsóbban , 22-23 dollárért tud olajat szerezni .	a nawa bányászati kft. az a nawa cégcsoport tartozik , amely a taxisblokád idő jelent be , hogy az akkor hordó 29 dolláros világpiaci ár olcsó , 22-23 dollár tud olaj szerez .	DEF;DET NOM;PROPN;SG NOM;PROPN;SG NOM;PROPN;SG 3;AT+ALL;PRO;SG DEF;DET NOM;PROPN;SG AT+ALL;N;SG 3;ACT;FIN;IND;INDF;PST;SG;V _ 3;NOM;PRO;SG DEF;DET N;NOM;SG N;ON+ESS;PSS3S;SG 3;ACT;DEF;FIN;IND;PST;SG;V ADV _ CONJ DEF;DET ADV DIST;N;SG NOM;NUM;SG ADJ;NOM;SG ADJ;NOM;SG AT+ESS;N;SG ADJ;CMPR;FRML;SG _ NOM;NUM;SG N;SG 3;ACT;FIN;IND;INDF;PRS;SG;V ACC;N;SG ACT;NFIN;V _
bár a németországi hannoverben játszik a világ legjobb nyolc férfi teniszezője , tegnap mégis egy magyar futballista körül forgott minden a 2000-es világkiállításra készülő városban .	bár a németországi hannover játszik a világ jó nyolc férfi teniszező , tegnap mégis egy magyar futballista körül forog minden a 2000-es világkiállítás készülő város .	CONJ DEF;DET ADJ;NOM;PSSD;SG IN+ESS;PROPN;PSSD;SG 3;ACT;FIN;IND;INDF;PRS;SG;V DEF;DET N;NOM;PSSD;SG ADJ;NOM;PSSD;RL;SG NOM;NUM;PSSD;SG N;NOM;PSSD;SG N;NOM;PSS3S;SG _ ADV ADV DET;INDF ADJ;NOM;PSSD;SG N;NOM;PSSD;SG ADP 3;ACT;FIN;IND;INDF;PST;SG;V 3;NOM;PRO;PSSD;SG DEF;DET ADJ;NOM;PSSD;SG N;ON+ALL;PSSD;SG ADJ;NOM;PSSD;SG IN+ESS;N;PSSD;SG _
a földrengés ellenére az ankarai kormány a múlt héten megerősítette elkötelezettségét a deficitet enyhítő és az inflációt mérséklő stabilizációs program , illetve a privatizációval egybekötött szerkezetátalakítás mellett .	a földrengés ellenére az ankarai kormány a múlt hét megerősít elkötelezettség a deficit enyhítő és az infláció mérséklő stabilizációs program , illetve a privatizáció egybekötött szerkezetátalakítás mellett .	DEF;DET N;NOM;SG ADP DEF;DET ADJ;NOM;SG N;NOM;SG DEF;DET ADJ;NOM;SG N;ON+ESS;SG 3;ACT;DEF;FIN;IND;PST;SG;V ACC;N;PSS3S;SG DEF;DET ACC;N;SG ADJ;NOM;SG CONJ DEF;DET ACC;N;SG ADJ;NOM;SG ADJ;NOM;SG N;NOM;SG _ CONJ DEF;DET INS;N;SG ADJ;NOM;SG N;NOM;SG ADP _
a népszavában megjelent írással kapcsolatban belső vizsgálatot rendeltek el .	a népszava megjelent írás kapcsolat belső vizsgálat rendel el .	DEF;DET IN+ESS;PROPN;PSSD;SG ADJ;NOM;PSSD;SG INS;N;PSSD;SG IN+ESS;N;PSSD;SG ADJ;NOM;PSSD;SG ACC;N;PSSD;SG 3;ACT;FIN;IND;INDF;PL;PST;V ADV _
mellette a közelmúltban átalakult gyár művészeti stúdiójában készült , kézzel festett legszebb egyedi darabjai láthatók .	mellett a közelmúlt átalakult gyár művészeti stúdió készült , kéz festett szép egyedi darab látható .	3;NOM;PRO;PSSD;SG DEF;DET IN+ESS;N;PSSD;SG ADJ;NOM;PSSD;SG N;NOM;PSSD;SG ADJ;NOM;PSSD;SG IN+ESS;N;PSS3S;SG ADJ;NOM;PSSD;SG _ INS;N;PSSD;SG ADJ;NOM;PSSD;SG ADJ;NOM;PSSD;RL;SG ADJ;NOM;PSSD;SG N;NOM;PL;PSS3S ADJ;NOM;PL;PSSD _
a tervezett bezárás 75 diákot és 17 pedagógust érint .	a tervezett bezárás 75 diák és 17 pedagógus érint .	DEF;DET ADJ;NOM;PSSD;SG N;NOM;PSSD;SG NOM;NUM;PSSD;SG ACC;N;PSSD;SG CONJ NOM;NUM;PSSD;SG ACC;N;PSSD;SG 3;ACT;FIN;IND;INDF;PRS;SG;V _
pedig schultz az üstökösszerű karriert befutott internetes aukciós cég , az ebay mögött álló befektetői csoport egyik tagjaként a világhálóhoz kapcsolódó üzlet jó ismerőjének számít , ám a befektetők mégsem bíznak a terveiben .	pedig schultz az üstökösszerű karrier befutott internetes aukciós cég , az ebay mögött álló befektetői csoport egyik tag a világháló kapcsolódó üzlet jó ismerő számít , ám a befektető mégsem bízik a terv .	CONJ NOM;PROPN;SG DEF;DET ADJ;NOM;SG ACC;N;SG ADJ;NOM;SG ADJ;NOM;SG ADJ;NOM;SG N;NOM;SG _ DEF;DET NOM;PROPN;SG ADP ADJ;NOM;SG ADJ;NOM;SG N;NOM;SG 3;NOM;PRO;SG ABS;N;PSS3S;SG DEF;DET AT+ALL;N;SG ADJ;NOM;SG N;NOM;SG ADJ;NOM;SG ADJ;DAT;PSS3S;SG 3;ACT;FIN;IND;INDF;PRS;SG;V _ CONJ DEF;DET N;NOM;PL ADV 3;ACT;FIN;IND;INDF;PL;PRS;V DEF;DET IN+ESS;N;PL;PSS3S _
a rendőrség az y2k problémát egyébként saját hatáskörében már megoldotta , fennakadásra nem számítanak .	a rendőrség az y2k probléma egyébként saját hatáskör már meg+old , fennakadás nem számít .	DEF;DET N;NOM;PSSD;SG DEF;DET N;NOM;PSSD;SG ACC;N;PSSD;SG ADV DEF;DET IN+ESS;N;PSS3S;SG ADV 3;ACT;DEF;FIN;IND;PST;SG;V _ N;ON+ALL;PSSD;SG ADV 3;ACT;FIN;IND;INDF;PL;PRS;V _
az 1944. március 19-e után elindított csoportba került e történet hőse is , a már majdnem orvos fiatalember .	az 1944. március 19. után elindított csoport kerül e történet hős is , a már majdnem orvos fiatalember .	DEF;DET ADJ;NOM;PSSD;SG N;NOM;PSSD;SG N;NOM;PSS3S;SG ADP ADJ;NOM;PSSD;SG IN+ALL;N;PSSD;SG 3;ACT;FIN;IND;INDF;PST;SG;V 3;DET;NOM;PSSD;SG N;NOM;PSSD;SG N;NOM;PSS3S;SG CONJ _ DEF;DET ADV ADV N;NOM;PSSD;SG N;NOM;PSSD;SG _
ez utóbbi egyébként pest megye , veszprém megye és fejér megye közkedvelt közlekedési eszközének számít .	ez utóbbi egyébként pest megye , veszprém megye és fejér megye közkedvelt közlekedési eszköz számít .	3;DET;NOM;PSSD;SG N;NOM;PSSD;SG ADV NOM;PROPN;PSSD;SG NOM;PROPN;PSSD;SG _ NOM;PROPN;PSSD;SG NOM;PROPN;PSSD;SG CONJ NOM;PROPN;PSSD;SG NOM;PROPN;PSSD;SG ADJ;NOM;PSSD;SG ADJ;NOM;PSSD;SG DAT;N;PSS3S;SG 3;ACT;FIN;IND;INDF;PRS;SG;V _
az ágazatra nagyfokú koncentráció jellemző , hiszen 220 cég adja a termelési érték 85 százalékát .	az ágazat nagyfokú koncentráció jellemző , hiszen 220 cég ad a termelési érték 85 százalék .	DEF;DET N;ON+ALL;PSSD;SG ADJ;NOM;PSSD;SG N;NOM;PSSD;SG ADJ;NOM;PSSD;SG _ CONJ NOM;NUM;PSSD;SG N;NOM;PSSD;SG 3;ACT;DEF;FIN;IND;PRS;SG;V DEF;DET ADJ;NOM;PSSD;SG N;NOM;PSSD;SG NOM;NUM;PSSD;SG ACC;N;PSS3S;SG _
— azért nem lehetett olyan rossz közelről élvezni a nehézsúly lewis-holyfield-csúcsrangadóját !	— azért nem lehet olyan rossz közelről élvez a nehézsúly lewis-holyfield-csúcsrangadó !	_ CONJ ADV 3;ACT;FIN;IND;INDF;PST;SG;V ADV ADJ;NOM;PSSD;SG ADV ACT;NFIN;V DEF;DET N;NOM;PSSD;SG ACC;N;PSS3S;SG _
elmaradt a várakozásoktól a pepsicóval együtt szupermarketekben forgalmazott kávéital , a frappuccino népszerűsége is .	elmarad a várakozás a pepsicó együtt szupermarket forgalmazott kávéital , a frappuccino népszerűség is .	3;ACT;FIN;IND;INDF;PST;SG;V DEF;DET AT+ABL;N;PL DEF;DET INS;PROPN;SG ADP IN+ESS;N;PL ADJ;NOM;SG N;NOM;SG _ DEF;DET NOM;PROPN;SG N;NOM;PSS3S;SG CONJ _
nisen kívül pirot városa részesül még az " energia a demokratizálódáshoz " elnevezésű akció keretén belül nyújtandó fűtőolaj-szállítmányból .	nis kívül pirot város részesül még az " energia a demokratizálódáshoz " elnevezésű akció keret belül nyújtandó fűtőolaj-szállítmány .	ON+ESS;PROPN;PSSD;SG ADP NOM;PROPN;PSSD;SG N;NOM;PSS3S;SG 3;ACT;FIN;IND;INDF;PRS;SG;V ADV DEF;DET _ NOM;PROPN;PSSD;SG NOM;PROPN;PSSD;SG NOM;PROPN;PSSD;SG _ ADJ;NOM;PSSD;SG N;NOM;PSSD;SG N;ON+ESS;PSS3S;SG ADP ADJ;NOM;PSSD;SG IN+ABL;N;PSSD;SG _
emberfeletti feladat volt , hiszen minden hangjegyre meg volt a kötelező mozdulat .	emberfeletti feladat van , hiszen minden hangjegy meg van a kötelező mozdulat .	ADJ;NOM;PSSD;SG N;NOM;PSSD;SG 3;ACT;FIN;IND;INDF;PST;SG;V _ CONJ DET;INDF N;ON+ALL;PSSD;SG PART 3;ACT;FIN;IND;INDF;PST;SG;V DEF;DET ADJ;NOM;PSSD;SG N;NOM;PSSD;SG _
" hiába próbálunk mi segíteni , ha egymást sem becsülik az emberek .	" hiába próbál mi segít , ha egymás sem becsül az ember .	_ ADV 1;ACT;FIN;IND;INDF;PL;PRS;V 1;NOM;PL;PRO;PSSD ACT;NFIN;V _ CONJ 3;ACC;PRO;PSSD;SG CONJ 3;ACT;DEF;FIN;IND;PL;PRS;V DEF;DET N;NOM;PL;PSSD _
a mamutcégek átszervezéséhez ugyanakkor elengedhetetlen , hogy folytatódjék az utóbbi hónapok gazdasági fellendülése .	a mamutcég átszervezés ugyanakkor elengedhetetlen , hogy folytatódik az utóbbi hónap gazdasági fellendülés .	DEF;DET N;NOM;PL AT+ALL;N;PSS3S;SG ADV ADJ;NOM;SG _ CONJ 3;ACT;FIN;IMP;INDF;PRS;SG;V DEF;DET ADJ;CMPR;NOM;SG N;NOM;PL ADJ;NOM;SG N;NOM;PSS3S;SG _
a visszaéléseket látván gyerev stábja a voksolás bojkottálására szólított fel , ezért számos cserkesz településen és néhány oroszok lakta vidéken ki sem nyitották a szavazóhelyiségeket .	a visszaélés látván gyerev stáb a voksolás bojkottálás szólít fel , ezért számos cserkesz település és néhány orosz lakta vidék ki sem nyit a szavazóhelyiség .	DEF;DET ACC;N;PL ADV;V.CVB NOM;PROPN;SG N;NOM;PSS3S;SG DEF;DET N;NOM;SG N;ON+ALL;PSS3S;SG 3;ACT;FIN;IND;INDF;PST;SG;V ADV _ ADV NOM;NUM;SG ADJ;NOM;SG N;ON+ESS;SG CONJ 3;NOM;PRO;SG N;NOM;PL ADJ;NOM;SG N;ON+ESS;SG ADV ADV 3;ACT;DEF;FIN;IND;PL;PST;V DEF;DET ACC;N;PL _
ezért is fontos , hogy a viszony a korrektségen , a kiszámíthatóságon , egymás érdekeinek kölcsönös tiszteletben tartásán alapuljon .	ezért is fontos , hogy a viszony a korrektség , a kiszámíthatóság , egymás érdek kölcsönös tisztelet tartás alapul .	ADV ADV ADJ;NOM;PSSD;SG _ CONJ DEF;DET N;NOM;PSSD;SG DEF;DET N;ON+ESS;PSSD;SG _ DEF;DET N;ON+ESS;PSSD;SG _ 3;NOM;PRO;PSSD;SG GEN;N;PL;PSS3S ADJ;NOM;PSSD;SG IN+ESS;N;PSSD;SG N;ON+ESS;PSS3S;SG 3;ACT;FIN;IMP;INDF;PRS;SG;V _
a gazdaság ilyen mértékű fejlődését több folyamat gerjeszti , többek között a magánosítás elterjedése és a tőkekoncentráció .	a gazdaság ilyen mértékű fejlődés több folyamat gerjeszt , több között a magánosítás elterjedés és a tőkekoncentráció .	DEF;DET N;NOM;PSSD;SG 3;DET;NOM;PSSD;SG ADJ;NOM;PSSD;SG ACC;N;PSS3S;SG DET;INDF N;NOM;PSSD;SG 3;ACT;DEF;FIN;IND;PRS;SG;V _ DET;INDF ADP DEF;DET N;NOM;PSSD;SG N;NOM;PSS3S;SG CONJ DEF;DET N;NOM;PSSD;SG _
brüszszelben nem is tagadják : a folytatás attól függ , hogy az elkövetkezendő tíz napban rendben megérkeznek -e nisbe és pirotba a szállítmányok .	brüsszel nem is tagad : a folytatás az függ , hogy az elkövetkezendő tíz nap rend meg+érkezik -e nis és pirot a szállítmány .	IN+ESS;PROPN;PSSD;SG ADV ADV 3;ACT;DEF;FIN;IND;PL;PRS;V _ DEF;DET N;NOM;PSSD;SG 3;AT+ABL;PRO;PSSD;SG 3;ACT;FIN;IND;INDF;PRS;SG;V _ CONJ DEF;DET ADJ;NOM;PSSD;SG NOM;NUM;PSSD;SG IN+ESS;N;PSSD;SG IN+ESS;N;PSSD;SG 3;ACT;FIN;IND;INDF;PL;PRS;V ADV IN+ALL;PROPN;PSSD;SG CONJ IN+ALL;PROPN;PSSD;SG DEF;DET N;NOM;PL;PSSD _
" ő a mi emberünk ! " — lelkesedett rankovic .	" ő a mi ember ! " — lelkesedik rankovic .	_ 3;NOM;PRO;PSSD;SG DEF;DET 1;NOM;PL;PRO;PSSD N;NOM;PSS1P;SG _ _ _ 3;ACT;FIN;IND;INDF;PST;SG;V NOM;PROPN;PSSD;SG _
az állami televíziófelügyelet például átmenetileg némaságra ítélte az egyik kereskedelmi csatornát , mert az élesen bírálta a kabinetet a válságkezelés hiánya miatt .	az állami televíziófelügyelet például átmeneti némaság ítél az egyik kereskedelmi csatorna , mert az éles bírál a kabinet a válságkezelés hiány miatt .	DEF;DET ADJ;NOM;SG N;NOM;SG ADV ADJ;FRML;SG N;ON+ALL;SG 3;ACT;DEF;FIN;IND;PST;SG;V DEF;DET 3;NOM;PRO;SG ADJ;NOM;SG ACC;N;SG _ CONJ 3;NOM;PRO;SG ADJ;FRML;SG 3;ACT;DEF;FIN;IND;PST;SG;V DEF;DET ACC;N;SG DEF;DET N;NOM;SG N;NOM;PSS3S;SG ADP _
a nemzetközi pénzintézet szeptemberben küldi embereit ankarába , és várhatóan még az év vége előtt megszülethet az egyezség egy 5-10 milliárd dolláros hitelkeretről .	a nemzetközi pénzintézet szeptember küld ember ankara , és várható még az év vég előtt megszülethet az egyezség egy 5-10 milliárd dolláros hitelkeret .	DEF;DET ADJ;NOM;SG N;NOM;SG IN+ESS;N;SG 3;ACT;DEF;FIN;IND;PRS;SG;V ACC;N;PL;PSS3S IN+ALL;PROPN;SG _ CONJ ADJ;FRML;SG ADV DEF;DET N;NOM;SG N;NOM;PSS3S;SG ADP 3;ACT;FIN;INDF;POT;PRS;SG;V DEF;DET N;NOM;SG DET;INDF NOM;NUM;SG NOM;NUM;SG ADJ;NOM;SG N;SG _
— jövő héten hamburgba utazom dariusz michalczewski világbajnoki címvédő mérkőzésére .	— jövő hét hamburg utazik dariusz michalczewski világbajnoki címvédő mérkőzés .	_ ADJ;NOM;PSSD;SG N;ON+ESS;PSSD;SG IN+ALL;PROPN;PSSD;SG 1;ACT;FIN;IND;INDF;PRS;SG;V NOM;PROPN;PSSD;SG NOM;PROPN;PSSD;SG ADJ;NOM;PSSD;SG ADJ;NOM;PSSD;SG N;ON+ALL;PSS3S;SG _
— kétszer is .	— két is .	_ ADV CONJ _
nagy számban fordulnak elő a koszorúk okozta munkahelyi tűzesetek .	nagy szám fordul elő a koszorú okozta munkahelyi tűzeset .	ADJ;NOM;PSSD;SG IN+ESS;N;PSSD;SG 3;ACT;FIN;IND;INDF;PL;PRS;V ADV DEF;DET N;NOM;PL;PSSD ADJ;NOM;PSSD;SG ADJ;NOM;PSSD;SG N;NOM;PL;PSSD _
dr. zacher gábor főorvos arról tájékoztatott , hogy megerősített ügyeletet tartanak .	dr. zacher gábor főorvos az tájékozódik , hogy megerősített ügyelet tart .	N;NOM;PSSD;SG NOM;PROPN;PSSD;SG NOM;PROPN;PSSD;SG N;NOM;PSSD;SG 3;PRO;PSSD;SG 3;CAUS;FIN;IND;INDF;PST;SG;V _ CONJ ADJ;NOM;PSSD;SG ACC;N;PSSD;SG 3;ACT;FIN;IND;INDF;PL;PRS;V _
felsenstein elégedett lehetett velem , mert a bemutató után óriási havi fizetést ajánlott , és felkért , vállaljam el berlinben a falstaffot is .	felsenstein elégedett lehet vele , mert a bemutató után óriási havi fizetés ajánl , és fel+kér , vállal el berlin a falstaff is .	NOM;PROPN;PSSD;SG ADJ;NOM;PSSD;SG 3;ACT;FIN;IND;INDF;PST;SG;V 1;INS;PRO;PSSD;SG _ CONJ DEF;DET N;NOM;PSSD;SG ADP ADJ;NOM;PSSD;SG ADJ;NOM;PSSD;SG ACC;N;PSSD;SG 3;ACT;FIN;IND;INDF;PST;SG;V _ CONJ 3;ACT;FIN;IND;INDF;PST;SG;V _ 1;ACT;DEF;FIN;IMP;PRS;SG;V ADV IN+ESS;PROPN;PSSD;SG DEF;DET ACC;PROPN;PSSD;SG CONJ _
ha beigazolódik a jóslata , és tíz éven belül háromszorosára nő a jelenlegi 350 ezres fővárosi járműpark , akkor mindenki , legyen az kormányfő vagy főpolgármester , a saját bőrén tapasztalja , hogy az elmúlt évek fejlesztési üteme megegyezik a csúcsidőben araszoló autók sebességével .	ha be+igazolódik a jóslat , és tíz év belül háromszoros nő a jelenlegi 350 ezres fővárosi járműpark , akkor mindenki , lesz az kormányfő vagy főpolgármester , a saját bőr tapasztal , hogy az elmúlt év fejlesztési ütem meg+egyezik a csúcsidő araszoló autó sebesség .	CONJ 3;ACT;FIN;IND;INDF;PRS;SG;V DEF;DET N;NOM;PSS3S;SG _ CONJ NOM;NUM;PSSD;SG N;ON+ESS;PSSD;SG ADP ADJ;ON+ALL;PSS3S;SG 3;ACT;FIN;IND;INDF;PRS;SG;V DEF;DET ADJ;NOM;PSSD;SG NOM;NUM;PSSD;SG ADJ;NOM;PSSD;SG ADJ;NOM;PSSD;SG N;NOM;PSSD;SG _ ADV 3;NOM;PRO;PSSD;SG _ 3;ACT;FIN;IMP;INDF;PRS;SG;V 3;NOM;PRO;PSSD;SG N;NOM;PSSD;SG CONJ N;NOM;PSSD;SG _ DEF;DET DEF;DET N;ON+ESS;PSS3S;SG 3;ACT;DEF;FIN;IND;PRS;SG;V _ CONJ DEF;DET ADJ;NOM;PSSD;SG N;NOM;PL;PSSD ADJ;NOM;PSSD;SG N;NOM;PSS3S;SG 3;ACT;FIN;IND;INDF;PRS;SG;V DEF;DET IN+ESS;N;PSSD;SG ADJ;NOM;PSSD;SG N;NOM;PL;PSSD INS;N;PSS3S;SG _
de legalább bebizonyosodhat , hogy a fidesz-birodalomban hiába van nagy többséggel megválasztott elnök vagy sikeres helyi politikus , ha ellentétbe keveredsz az országos vezetéssel , akkor minden eszközzel megpróbálnak lejáratni . "	de legalább be+bizonyosodik , hogy a fidesz-birodalom hiába van nagy többség megválasztott elnök vagy sikeres helyi politikus , ha ellentét keveredik az országos vezetés , akkor minden eszköz meg+próbál le+járat . "	CONJ ADV 3;ACT;FIN;INDF;POT;PRS;SG;V _ CONJ DEF;DET IN+ESS;N;PSSD;SG ADV 3;ACT;FIN;IND;INDF;PRS;SG;V ADJ;NOM;PSSD;SG INS;N;PSSD;SG ADJ;NOM;PSSD;SG N;NOM;PSSD;SG CONJ ADJ;NOM;PSSD;SG ADJ;NOM;PSSD;SG N;NOM;PSSD;SG _ CONJ IN+ALL;N;PSSD;SG 2;ACT;FIN;IND;INDF;PRS;SG;V DEF;DET ADJ;NOM;PSSD;SG INS;N;PSSD;SG _ ADV DET;INDF INS;N;PSSD;SG 3;ACT;FIN;IND;INDF;PL;PRS;V ACT;NFIN;V _ _
persze vezetőjét hiába kérlelik a közúti hómunkások .	persze vezető hiába kérlel a közúti hómunkás .	ADV ACC;N;PSS3S;SG ADV 3;ACT;DEF;FIN;IND;PL;PRS;V DEF;DET ADJ;NOM;PSSD;SG N;NOM;PL;PSSD _
a másik kocsinak már a nyomai sem látszanak .	a másik kocsi már a nyom sem látszik .	DEF;DET DET;INDF GEN;N;PSSD;SG ADV DEF;DET N;NOM;PL;PSS3S ADV 3;ACT;FIN;IND;INDF;PL;PRS;V _
aztán persze mi ássuk ki őket a 110-120 centis hóbuckákból " — mondja kovács zsolt .	aztán persze mi ás ki ők a 110-120 centis hóbucka " — mond kovács zsolt .	ADV ADV 1;NOM;PL;PRO;PSSD 1;ACT;DEF;FIN;IND;PL;PRS;V ADV 3;ACC;PL;PRO;PSSD DEF;DET NOM;NUM;PSSD;SG ADJ;NOM;PSSD;SG IN+ABL;N;PL;PSSD _ _ 3;ACT;DEF;FIN;IND;PRS;SG;V NOM;PROPN;PSSD;SG NOM;PROPN;PSSD;SG _
" az atrocitások száma folyamatosan csökken , s mérséklődik a komoly bűncselekmények aránya is " — jelentette ki elégedetten a napokban mike jackson tábornok , a koszovóban szolgálatot teljesítő , 40 ezer főből álló kfor-erők parancsnoka .	" az atrocitás szám folyamatos csökken , s mérséklődik a komoly bűncselekmény arány is " — jelent ki elégedett a nap mike jackson tábornok , a koszovó szolgálat teljesítő , 40 ezer fő álló kfor-erők parancsnok .	_ DEF;DET N;NOM;PL N;NOM;PSS3S;SG ADJ;FRML;SG 3;ACT;FIN;IND;INDF;PRS;SG;V _ CONJ 3;ACT;FIN;IND;INDF;PRS;SG;V DEF;DET ADJ;NOM;SG N;NOM;PL N;NOM;PSS3S;SG CONJ _ _ 3;ACT;DEF;FIN;IND;PST;SG;V ADV ADJ;FRML;SG DEF;DET IN+ESS;N;PL NOM;PROPN;SG NOM;PROPN;SG N;NOM;SG _ DEF;DET IN+ESS;PROPN;SG ACC;N;SG ADJ;NOM;SG _ NOM;NUM;SG NOM;NUM;SG IN+ABL;N;SG ADJ;NOM;SG N;NOM;PL N;NOM;PSS3S;SG _
ezért minden más szervezettől elhatárolódva " tégy a magyargyűlölet ellen ! " feliratú táblákkal állnak majd sorfalat a parlament előtt .	ezért minden más szervezet elhatárolódva " tesz a magyargyűlölet ellen ! " feliratú tábla áll majd sorfal a parlament előtt .	ADV DET;INDF DET;INDF AT+ABL;N;PSSD;SG ADV;V.CVB _ 2;ACT;FIN;IMP;INDF;PRS;SG;V DEF;DET N;NOM;PSSD;SG ADP _ _ ADJ;NOM;PSSD;SG INS;N;PL;PSSD 3;ACT;FIN;IND;INDF;PL;PRS;V ADV ACC;N;PSSD;SG DEF;DET N;NOM;PSSD;SG ADP _
a verseny kiéleződését jelzi , hogy a 20 legnagyobb élelmiszerkereskedelmi lánc eladási értéke két év alatt 22 százalékkal nőtt .	a verseny kiéleződés jelez , hogy a 20 nagy élelmiszer-kereskedelmi lánc eladási érték két év alatt 22 százalék nő .	DEF;DET N;NOM;PSSD;SG ACC;N;PSS3S;SG 3;ACT;DEF;FIN;IND;PRS;SG;V _ CONJ DEF;DET NOM;NUM;PSSD;SG ADJ;NOM;PSSD;RL;SG ADJ;NOM;PSSD;SG N;NOM;PSSD;SG ADJ;NOM;PSSD;SG N;NOM;PSS3S;SG NOM;NUM;PSSD;SG N;NOM;PSSD;SG ADP NOM;NUM;PSSD;SG INS;N;PSSD;SG 3;ACT;FIN;IND;INDF;PST;SG;V _
a veszteségek fő okozója egy tavaly kötött határidős részvényügylet ; erre az állami pénz- és tőkepiaci felügyelet májusban indult s hamarosan lezáruló vizsgálata derített fényt .	a veszteség fő okozó egy tavaly kötött határidős részvényügylet ; ez az állami pénz- és tőkepiaci felügyelet május indult s hamarosan lezáruló vizsgálat derít fény .	DEF;DET N;NOM;PL ADJ;NOM;SG N;NOM;PSS3S;SG DET;INDF ADV ADJ;NOM;SG ADJ;NOM;SG N;NOM;SG _ 3;ON+ALL;PRO;SG DEF;DET NOM;PROPN;SG NOM;PROPN;SG CONJ NOM;PROPN;SG NOM;PROPN;SG IN+ESS;N;SG ADJ;NOM;SG CONJ ADV ADJ;NOM;SG N;NOM;PSS3S;SG 3;ACT;FIN;IND;INDF;PST;SG;V ACC;N;SG _
jorge faliba atya a rendőrségen bevallotta , hogy ez már az ötödik nemzetközi csempészútja lett volna , ám jó ügyet szolgál .	jorge faliba atya a rendőrség be+vall , hogy ez már az ötödik nemzetközi csempészút lesz volna , ám jó ügy szolgál .	NOM;PROPN;PSSD;SG NOM;PROPN;PSSD;SG N;NOM;PSSD;SG DEF;DET N;ON+ESS;PSSD;SG 3;ACT;DEF;FIN;IND;PST;SG;V _ CONJ 3;NOM;PRO;PSSD;SG ADV DEF;DET ADJ;NOM;PSSD;SG ADJ;NOM;PSSD;SG N;NOM;PSS3S;SG 3;ACT;FIN;IND;INDF;PST;SG;V 3;ACT;COND;INDF;PRS;SG;V _ CONJ ADJ;NOM;PSSD;SG ACC;N;PSSD;SG 3;ACT;FIN;IND;INDF;PRS;SG;V _
a bérek hét-nyolc év alatt bekövetkezett 36-37 százalékos reálértékvesztését , valamint a versenyszféra és az oktatási ágazat indokolatlan és jelentős bérszínvonal-különbségét azonban nem lehet évenkénti néhány százalékos reálkereset-növekedéssel kiegyenlíteni — vélte a psz titkára .	a bér hét-nyolc év alatt bekövetkezett 36-37 százalékos reálértékvesztés , valamint a versenyszféra és az oktatási ágazat indokolatlan és jelentős bérszínvonal-különbség azonban nem lesz évenkénti néhány százalékos reálkereset-növekedés ki+egyenlít — vél a psz titkár .	DEF;DET N;NOM;PL;PSSD NOM;NUM;PSSD;SG N;NOM;PSSD;SG ADP ADJ;NOM;PSSD;SG NOM;NUM;PSSD;SG ADJ;NOM;PSSD;SG ACC;N;PSS3S;SG _ CONJ DEF;DET N;NOM;PSSD;SG CONJ DEF;DET ADJ;NOM;PSSD;SG N;NOM;PSSD;SG ADJ;NOM;PSSD;SG CONJ ADJ;NOM;PSSD;SG ACC;N;PSS3S;SG CONJ ADV 3;ACT;FIN;INDF;POT;PRS;SG;V ADJ;NOM;PSSD;SG DET;INDF ADJ;NOM;PSSD;SG INS;N;PSSD;SG ACT;NFIN;V _ 3;ACT;DEF;FIN;IND;PST;SG;V DEF;DET NOM;PROPN;PSSD;SG N;NOM;PSS3S;SG _
az elmúlt esztendőkben azonban jelentősen megváltoztak ünneplési szokásaink , s lángoló fenyőkhöz csak elvétve hívják a tűzoltókat .	az elmúlt esztendő azonban jelentős meg+változik ünneplési szokás , s lángoló fenyő csak elvétve hív a tűzoltó .	DEF;DET ADJ;NOM;PSSD;SG IN+ESS;N;PL;PSSD CONJ ADJ;FRML;PSSD;SG 3;ACT;FIN;IND;INDF;PL;PST;V ADJ;NOM;PSSD;SG N;NOM;PL;PSS1P _ CONJ ADJ;NOM;PSSD;SG AT+ALL;N;PL;PSSD ADV ADV 3;ACT;DEF;FIN;IND;PL;PRS;V DEF;DET ACC;N;PL;PSSD _
emlékezni jó .	emlékezik jó .	ACT;NFIN;V ADJ;NOM;SG _
ugyanakkor mind szlovákia szociáldemokrata pártja elnöke , jaroslav volf parlamenti képviselő , mind a párt és a dubcek család jogásza , liboslav leksa ismételten kifejtették gyanújukat : nem baleset áldozata lett " a legnagyobb szlovák " — ahogyan ezekben a napokban dubceket emlegetik — , hanem merényletet követtek el ellene .	ugyanakkor mind szlovákia szociáldemokrata pártja elnök , jaroslav volf parlamenti képviselő , mind a párt és a dubcek család jogász , liboslav leksa ismételt ki+fejt gyanú : nem baleset áldozat lesz " a nagy szlovák " — ahogyan ez a nap dubcek emleget — , hanem merénylet követ el ellen .	ADV CONJ NOM;PROPN;PSSD;SG NOM;PROPN;PSSD;SG NOM;PROPN;PSSD;SG N;NOM;PSS3S;SG _ NOM;PROPN;PSSD;SG NOM;PROPN;PSSD;SG ADJ;NOM;PSSD;SG N;NOM;PSSD;SG _ CONJ DEF;DET N;NOM;PSSD;SG CONJ DEF;DET NOM;PROPN;PSSD;SG N;NOM;PSSD;SG N;NOM;PSS3S;SG _ NOM;PROPN;PSSD;SG NOM;PROPN;PSSD;SG ADJ;FRML;PSSD;SG 3;ACT;DEF;FIN;IND;PL;PST;V ACC;N;PSS3P;SG _ ADV N;NOM;PSSD;SG N;NOM;PSS3S;SG 3;ACT;FIN;IND;INDF;PST;SG;V _ DEF;DET ADJ;NOM;PSSD;RL;SG ADJ;NOM;PSSD;SG _ _ ADV 3;DET;IN+ESS;PL;PSSD DEF;DET IN+ESS;N;PL;PSSD ACC;PROPN;PSSD;SG 3;ACT;DEF;FIN;IND;PL;PRS;V _ _ CONJ ACC;N;PSSD;SG 3;ACT;FIN;IND;INDF;PL;PST;V ADV 3;NOM;PRO;PSSD;SG _
a tupras jövő márciusra tervezett eladásából egymilliárd dollárnyi bevételt remélt a kabinet , s bár az izmiti finomítóban négy hónap múlva teljes kapacitással folyhat a termelés , a tűzkárok helyreállítása még akár egy évet is igénybe vehet .	a tupras jövő március tervezett eladás egymilliárd dollárnyi bevétel remél a kabinet , s bár az izmiti finomító négy hónap múlva teljes kapacitás folyhat a termelés , a tűzkár helyreállítás még akár egy év is igény vehet .	DEF;DET NOM;PROPN;SG ADJ;NOM;SG N;ON+ALL;SG ADJ;NOM;SG IN+ABL;N;PSS3S;SG NOM;NUM;SG ADJ;NOM;SG ACC;N;SG 3;ACT;FIN;IND;INDF;PST;SG;V DEF;DET N;NOM;SG _ CONJ CONJ DEF;DET ADJ;NOM;SG IN+ESS;N;SG NOM;NUM;SG N;NOM;SG ADP ADJ;NOM;SG INS;N;SG 3;ACT;FIN;INDF;POT;PRS;SG;V DEF;DET N;NOM;SG _ DEF;DET N;NOM;PL N;NOM;PSS3S;SG ADV ADV NOM;NUM;SG ACC;N;SG CONJ IN+ALL;N;SG 3;ACT;FIN;INDF;POT;PRS;SG;V _
a szezont mindenképpen befejezzük , s a hét végén játékra alkalmas pályával várjuk a siófokot .	a szezon mindenképpen be+fejez , s a hét vég játék alkalmas pálya vár a siófok .	DEF;DET ACC;N;PSSD;SG ADV 1;ACT;DEF;FIN;IND;PL;PRS;V _ CONJ DEF;DET N;NOM;PSSD;SG N;ON+ESS;PSS3S;SG N;ON+ALL;PSSD;SG ADJ;NOM;PSSD;SG INS;N;PSSD;SG 1;ACT;DEF;FIN;IND;PL;PRS;V DEF;DET ACC;PROPN;PSSD;SG _
vagyis a háromhetes munkarenddel kapcsolatosan triumfálásra semmi ok , hiszen azóta számottevően csökkent a törvényhozás produktivitása : 1995 első fél évében 53 , az idén hat hónap alatt csak 35 " igazi " törvényt alkotott a képviselőház .	vagyis a háromhetes munkarend kapcsolatos triumfálás semmi ok , hiszen azóta számottevő csökken a törvényhozás produktivitás : 1995 első fél év 53 , az idén hat hónap alatt csak 35 " igazi " törvény alkot a képviselőház .	CONJ DEF;DET ADJ;NOM;SG INS;N;SG ADJ;FRML;SG N;ON+ALL;SG 3;NOM;PRO;SG N;NOM;SG _ CONJ ADV ADJ;FRML;SG 3;ACT;FIN;IND;INDF;PST;SG;V DEF;DET N;NOM;SG N;NOM;PSS3S;SG _ NOM;NUM;SG ADJ;NOM;SG NOM;NUM;SG IN+ESS;N;PSS3S;SG NOM;NUM;SG _ DEF;DET ADV NOM;NUM;SG N;NOM;SG ADP ADV NOM;NUM;SG _ ADJ;NOM;SG _ ACC;N;SG 3;ACT;FIN;IND;INDF;PST;SG;V DEF;DET N;NOM;SG _
robert hübner , a németek egykori világbajnokjelöltje 1967-ben nyert először bajnokságot , és az 51 éves nagymester 32 év után ünnepelhette második bajnoki címét .	robert hübner , a német egykori világbajnokjelölt 1967 nyer először bajnokság , és az 51 éves nagymester 32 év után ünnepel második bajnoki cím .	NOM;PROPN;PSSD;SG NOM;PROPN;PSSD;SG _ DEF;DET N;NOM;PL;PSSD ADJ;NOM;PSSD;SG N;NOM;PSS3S;SG IN+ESS;NUM;PSSD;SG 3;ACT;FIN;IND;INDF;PST;SG;V ADV ACC;N;PSSD;SG _ CONJ DEF;DET NOM;NUM;PSSD;SG ADJ;NOM;PSSD;SG N;NOM;PSSD;SG NOM;NUM;PSSD;SG N;NOM;PSSD;SG ADP 3;ACT;DEF;FIN;POT;PST;SG;V ADJ;NOM;PSSD;SG ADJ;NOM;PSSD;SG ACC;N;PSS3S;SG _
a legutóbbi munkám kamondi zoltán az alkimista és a szűz című filmjének kísérőzenéje volt , s most éppen gödrös frigyes glamour című alkotásához írok zenét ; a filmet a jövő februári filmszemlén mutatják be .	a legutóbbi munka kamondi zoltán az alkimista és a szűz című film kísérőzene van , s most éppen gödrös frigyes glamour című alkotás ír zene ; a film a jövő februári filmszemle mutat be .	DEF;DET ADJ;NOM;PSSD;SG N;NOM;PSS1S;SG NOM;PROPN;PSSD;SG NOM;PROPN;PSSD;SG NOM;PROPN;PSSD;SG NOM;PROPN;PSSD;SG NOM;PROPN;PSSD;SG NOM;PROPN;PSSD;SG NOM;PROPN;PSSD;SG ADJ;NOM;PSSD;SG GEN;N;PSS3S;SG N;NOM;PSS3S;SG 3;ACT;FIN;IND;INDF;PST;SG;V _ CONJ ADV ADV NOM;PROPN;PSSD;SG NOM;PROPN;PSSD;SG NOM;PROPN;PSSD;SG ADJ;NOM;PSSD;SG AT+ALL;N;PSS3S;SG 1;ACT;FIN;IND;INDF;PRS;SG;V ACC;N;PSSD;SG _ DEF;DET ACC;N;PSSD;SG DEF;DET ADJ;NOM;PSSD;SG ADJ;NOM;PSSD;SG N;ON+ESS;PSSD;SG 3;ACT;DEF;FIN;IND;PL;PRS;V ADV _
