wisinger istván , a magyar újságírók szövetségének elnöke " furcsállja " , hogy a levelet magánjellegűnek tekinti a külügyminisztérium .	wisinger istván , a magyar újságírók szövetsége elnök " furcsáll " , hogy a levél magánjellegű tekint a külügyminisztérium .	NOM;PROPN;PSSD;SG NOM;PROPN;PSSD;SG _ DEF;DET NOM;PROPN;PSSD;SG NOM;PROPN;PSSD;SG GEN;PROPN;PSSD;SG N;NOM;PSS3S;SG _ 3;ACT;DEF;FIN;IND;PRS;SG;V _ _ CONJ DEF;DET ACC;N;PSSD;SG ADJ;DAT;PSSD;SG 3;ACT;DEF;FIN;IND;PRS;SG;V DEF;DET N;NOM;PSSD;SG _
a törökországi földrengés áldozatainak száma hétfőn hivatalos közlések szerint több mint 14 ezer , de még mindig nem tudni pontosan , hogy az összedőlt házak hány embert temettek el élve .	a törökországi földrengés áldozat szám hétfő hivatalos közlés szerint több mint 14 ezer , de még mindig nem tud pontos , hogy az összedőlt ház hány ember temet el élve .	DEF;DET ADJ;NOM;SG N;NOM;SG GEN;N;PL;PSS3S N;NOM;PSS3S;SG N;ON+ESS;SG ADJ;NOM;SG N;NOM;PL ADP NOM;NUM;SG CONJ NOM;NUM;SG NOM;NUM;SG _ CONJ ADV ADV ADV ACT;NFIN;V ADJ;FRML;SG _ CONJ DEF;DET ADJ;NOM;SG N;NOM;PL 3;NOM;PRO;SG ACC;N;SG 3;ACT;FIN;IND;INDF;PL;PST;V ADV ADV;V.CVB _
éppen ellenkezőleg , jelentésüket megcsúfolta , egyeseket betiltott , másokat az értelmetlenségig kiürített .	éppen ellenkezőleg , jelentés meg+csúfol , egyes be+tilt , más az értelmetlenség kiürít .	ADV ADV _ ACC;N;PSS3P;SG 3;ACT;DEF;FIN;IND;PST;SG;V _ ACC;N;PL;PSSD 3;ACT;FIN;IND;INDF;PST;SG;V _ 3;ACC;PL;PRO;PSSD DEF;DET N;PSSD;SG 3;ACT;FIN;IND;INDF;PST;SG;V _
a kávébárok népszerűeknek bizonyultak , számuk 1991-re száz fölé emelkedett , ám csak az usa északnyugati részén és chicagóban volt belőlük .	a kávébár népszerű bizonyul , szám 1991 száz fölé emelkedik , ám csak az usa északnyugati rész és chicago van belőle .	DEF;DET N;NOM;PL ADJ;DAT;PL 3;ACT;FIN;IND;INDF;PL;PST;V _ N;NOM;PSS3P;SG NUM;ON+ALL;SG NOM;NUM;SG ADP 3;ACT;FIN;IND;INDF;PST;SG;V _ CONJ ADV DEF;DET NOM;PROPN;SG ADJ;NOM;SG N;ON+ESS;PSS3S;SG CONJ IN+ESS;PROPN;SG 3;ACT;FIN;IND;INDF;PST;SG;V 3;IN+ABL;PL;PRO _
a hadiipari kutatások eredményeit a korábbi 3-4 év helyett ma már hat hónap múlva felhasználják a polgári termelésben .	a hadiipari kutatás eredmény a korábbi 3-4 év helyett ma már hat hónap múlva fel+használ a polgári termelés .	DEF;DET ADJ;NOM;PSSD;SG N;NOM;PL;PSSD ACC;N;PL;PSS3S DEF;DET ADJ;CMPR;NOM;PSSD;SG NOM;NUM;PSSD;SG N;NOM;PSSD;SG ADP ADV ADV NOM;NUM;PSSD;SG N;NOM;PSSD;SG ADP 3;ACT;DEF;FIN;IND;PL;PRS;V DEF;DET ADJ;NOM;PSSD;SG IN+ESS;N;PSSD;SG _
az államháztartási mérleg részeként közölt központi költségvetési bevételek és kiadások — a dokumentum szerint — a tavaly decemberben elfogadott 1999. évi költségvetési előirányzatokhoz képest mindössze 6 százalékkal növekednének 2000-ben , az egészségbiztosítási kiadások pedig csak 3,5 százalékkal , s a növekedési sort vezető nyugdíj-biztosítási alap kiadásai is csak 8,9-del , miközben a gazdaság jövőre is gyorsan , a feltételezések szerint 4-5 százalékkal gyarapodik , s a fogyasztói árak legalább 6 százalékkal másznak majd felfelé .	az államháztartási mérleg rész közölt központi költségvetési bevétel és kiadás — a dokumentum szerint — a tavaly december elfogadott 1999. évi költségvetési előirányzat képest mindössze 6 százalék növekszik 2000 , az egészségbiztosítási kiadás pedig csak 3,5 százalék , s a növekedési sor vezető nyugdíj-biztosítási alap kiadás is csak 8,9 , miközben a gazdaság jövőre is gyors , a feltételezés szerint 4-5 százalék gyarapodik , s a fogyasztói ár legalább 6 százalék mászik majd felfelé .	DEF;DET ADJ;NOM;SG N;NOM;SG ABS;N;PSS3S;SG ADJ;NOM;SG ADJ;NOM;SG ADJ;NOM;SG N;NOM;PL CONJ N;NOM;PL _ DEF;DET N;NOM;SG ADP _ DEF;DET ADV IN+ESS;N;SG ADJ;NOM;SG ADJ;NOM;SG ADJ;NOM;SG ADJ;NOM;SG AT+ALL;N;PL ADP ADV NOM;NUM;SG INS;N;SG 3;ACT;COND;FIN;INDF;PL;PRS;V IN+ESS;NUM;SG _ DEF;DET ADJ;NOM;SG N;NOM;PL CONJ ADV NOM;NUM;SG INS;N;SG _ CONJ DEF;DET ADJ;NOM;SG ACC;N;SG ADJ;NOM;SG ADJ;NOM;SG N;NOM;SG N;NOM;PL;PSS3S CONJ ADV INS;NUM;SG _ ADV DEF;DET N;NOM;SG ADV CONJ ADJ;FRML;SG _ DEF;DET N;NOM;PL ADP NOM;NUM;SG INS;N;SG 3;ACT;FIN;IND;INDF;PRS;SG;V _ CONJ DEF;DET ADJ;NOM;SG N;NOM;PL ADV NOM;NUM;SG INS;N;SG 3;ACT;FIN;IND;INDF;PL;PRS;V ADV ADV _
termelésük növelésére szólította fel tegnap az olajat exportáló országokat william ramsey , aki az egyesült államokat képviseli a nemzetközi energiaügynökségben , miután irak a hét elején bejelentette : nem újítja meg olajszállítási szerződéseit .	termelés növelés szólít fel tegnap az olaj exportáló ország william ramsey , aki az egyesült államok képvisel a nemzetközi energiaügynökség , miután irak a hét eleje be+jelent : nem újít meg olajszállítási szerződés .	N;NOM;PSS3P;SG N;ON+ALL;PSS3S;SG 3;ACT;DEF;FIN;IND;PST;SG;V ADV ADV DEF;DET ACC;N;PSSD;SG ADJ;NOM;PSSD;SG ACC;N;PL;PSSD NOM;PROPN;PSSD;SG NOM;PROPN;PSSD;SG _ 3;NOM;PRO;PSSD;SG DEF;DET NOM;PROPN;PSSD;SG ACC;PROPN;PSSD;SG 3;ACT;DEF;FIN;IND;PRS;SG;V DEF;DET NOM;PROPN;PSSD;SG IN+ESS;PROPN;PSSD;SG _ CONJ NOM;PROPN;PSSD;SG DEF;DET N;NOM;PSSD;SG N;ON+ESS;PSS3S;SG 3;ACT;DEF;FIN;IND;PST;SG;V _ ADV 3;ACT;DEF;FIN;IND;PRS;SG;V PART ADJ;NOM;PSSD;SG ACC;N;PL;PSS3S _
a hyundai a legtöbb tevékenységi területén piacvezető , gazdálkodása nyereséges , adósságainak nagy része pedig nem rövid lejáratú .	a hyundai a legtöbb tevékenységi terület piacvezető , gazdálkodás nyereséges , adósság nagy rész pedig nem rövid lejáratú .	DEF;DET NOM;PROPN;SG DEF;DET NOM;NUM;SG ADJ;NOM;SG N;ON+ESS;PSS3S;SG ADJ;NOM;SG _ N;NOM;PSS3S;SG ADJ;NOM;SG _ GEN;N;PL;PSS3S ADJ;NOM;SG N;NOM;PSS3S;SG CONJ ADV ADJ;NOM;SG ADJ;NOM;SG _
a kereslet élénkülése felhajtotta az árakat is , hiszen a 25 legnagyobb tejipari vállalkozás eladási értéke hat év alatt 25 százalékkal nőtt .	a kereslet élénkülés fel+hajt az ár is , hiszen a 25 nagy tejipari vállalkozás eladási érték hat év alatt 25 százalék nő .	DEF;DET N;NOM;PSSD;SG N;NOM;PSS3S;SG 3;ACT;DEF;FIN;IND;PST;SG;V DEF;DET ACC;N;PL;PSSD CONJ _ CONJ DEF;DET NOM;NUM;PSSD;SG ADJ;NOM;PSSD;RL;SG ADJ;NOM;PSSD;SG N;NOM;PSSD;SG ADJ;NOM;PSSD;SG N;NOM;PSS3S;SG NOM;NUM;PSSD;SG N;NOM;PSSD;SG ADP NOM;NUM;PSSD;SG INS;N;PSSD;SG 3;ACT;FIN;IND;INDF;PST;SG;V _
a levél írója a hagyomány embere .	a levél író a hagyomány ember .	DEF;DET N;NOM;PSSD;SG N;NOM;PSS3S;SG DEF;DET N;NOM;PSSD;SG N;NOM;PSS3S;SG _
mindaz a képzeletszülte meseelem , ami a gorillacsaládban nevelkedő embergyerek regénybeli történetének kalandos feszültséget és romantikus lendületet kölcsönzött , ezúttal a rajzfilm műfajában levetette az élő megjelenítés korlátait .	mindaz a képzeletszülte meseelem , ami a gorillacsalád nevelkedő embergyerek regénybeli történet kalandos feszültség és romantikus lendület kölcsönöz , ezúttal a rajzfilm műfaj le+vet az élő megjelenítés korlát .	3;DET;NOM;PSSD;SG DEF;DET ADJ;NOM;PSSD;SG N;NOM;PSSD;SG _ 3;NOM;PRO;PSSD;SG DEF;DET IN+ESS;N;PSSD;SG ADJ;NOM;PSSD;SG N;NOM;PSSD;SG ADJ;NOM;PSSD;SG GEN;N;PSS3S;SG ADJ;NOM;PSSD;SG ACC;N;PSSD;SG CONJ ADJ;NOM;PSSD;SG ACC;N;PSSD;SG 3;ACT;FIN;IND;INDF;PST;SG;V _ ADV DEF;DET N;NOM;PSSD;SG IN+ESS;N;PSS3S;SG 3;ACT;DEF;FIN;IND;PST;SG;V DEF;DET ADJ;NOM;PSSD;SG N;NOM;PSSD;SG ACC;N;PL;PSS3S _
az amerikai the wall street journal gazdasági napilap felmérése szerint azonban a szendvicsek és saláták nem ütik meg a starbucks-kávéktól megszokott minőséget .	az amerikai the wall street journal gazdasági napilap felmérés szerint azonban a szendvics és saláta nem üt meg a starbucks-kávé megszokott minőség .	DEF;DET ADJ;NOM;SG NOM;PROPN;SG NOM;PROPN;SG NOM;PROPN;SG NOM;PROPN;SG ADJ;NOM;SG N;NOM;SG N;NOM;PSS3S;SG ADP CONJ DEF;DET N;NOM;PL CONJ N;NOM;PL ADV 3;ACT;DEF;FIN;IND;PL;PRS;V PART DEF;DET AT+ABL;N;PL ADJ;NOM;SG ACC;N;SG _
a " legkevésbé ismert " stimmel , a " kultikust " a romantika kedvéért teszik hozzá általam ismeretlen egyének .	a " kevésbé ismert " stimmel , a " kultikus " a romantika kedv tesz ő által ismeretlen egyén .	DEF;DET _ ADV ADJ;NOM;PSSD;SG _ 3;ACT;FIN;IND;INDF;PRS;SG;V _ DEF;DET _ ACC;ADJ;PSSD;SG _ DEF;DET N;NOM;PSSD;SG N;PSS3S;SG 3;ACT;DEF;FIN;IND;PL;PRS;V 3;AT+ALL;PRO;PSSD;SG 1;NOM;PRO;PSSD;SG ADJ;NOM;PSSD;SG N;NOM;PL;PSSD _
elemzők úgy vélik , a területi megosztást szorgalmazó javaslat olyan aduvá válhat a nemzetközi közösség képviselőinek a kezében , amely alkalmas lehet az albánok féken tartására : ha thaciék nem hajlandóak engedményekre , akkor a nagyhatalmak végül igent mondhatnak a kantonizáció megvalósítására .	elemző úgy vél , a területi megosztás szorgalmazó javaslat olyan adu válhat a nemzetközi közösség képviselő a kéz , amely alkalmas lehet az albán fék tartás : ha thaci nem hajlandó engedmény , akkor a nagyhatalom végül igen mondhat a kantonizáció megvalósítás .	N;NOM;PL ADV 3;ACT;DEF;FIN;IND;PL;PRS;V _ DEF;DET ADJ;NOM;SG ACC;N;SG ADJ;NOM;SG N;NOM;SG 3;NOM;PRO;SG N;SG;TRANS 3;ACT;FIN;INDF;POT;PRS;SG;V DEF;DET ADJ;NOM;SG N;NOM;SG GEN;N;PL;PSS3S DEF;DET IN+ESS;N;PSS3S;SG _ 3;NOM;PRO;SG ADJ;NOM;SG 3;ACT;FIN;INDF;POT;PRS;SG;V DEF;DET N;NOM;PL N;ON+ESS;SG N;ON+ALL;PSS3S;SG _ CONJ NOM;PL;PROPN ADV ADJ;NOM;PL N;ON+ALL;PL _ ADV DEF;DET N;NOM;PL ADV ACC;N;SG 3;ACT;FIN;INDF;PL;POT;PRS;V DEF;DET N;NOM;SG N;ON+ALL;PSS3S;SG _
a szakemberek szerint ugyan az nem vitatható , hogy vagyonvédelmi és biztonsági okokból sok helyen szükség van kamerákra , azonban sokszor semmi nem indokolja , hogy az alkalmazottakra fókuszáljon a rendszer .	a szakember szerint ugyan az nem vitatható , hogy vagyonvédelmi és biztonsági ok sok hely szükség van kamera , azonban sokszor semmi nem indokol , hogy az alkalmazott fókuszál a rendszer .	DEF;DET N;NOM;PL;PSSD ADP ADV 3;NOM;PRO;PSSD;SG ADV ADJ;NOM;PSSD;SG _ CONJ ADJ;NOM;PSSD;SG CONJ ADJ;NOM;PSSD;SG IN+ABL;N;PL;PSSD DET;INDF N;ON+ESS;PSSD;SG N;NOM;PSSD;SG 3;ACT;FIN;IND;INDF;PRS;SG;V N;ON+ALL;PL;PSSD _ CONJ ADV 3;NOM;PRO;PSSD;SG ADV 3;ACT;DEF;FIN;IND;PRS;SG;V _ CONJ DEF;DET N;ON+ALL;PL;PSSD 3;ACT;FIN;IMP;INDF;PRS;SG;V DEF;DET N;NOM;PSSD;SG _
a közlekedési , hírközlési és vízügyi minisztérium által koordinált testület vezetője a tárca közigazgatási államtitkára , bán tamás .	a közlekedési , hírközlési és vízügyi minisztérium által koordinált testület vezető a tárca közigazgatási államtitkár , bán tamás .	DEF;DET NOM;PROPN;PSSD;SG NOM;PROPN;PSSD;SG NOM;PROPN;PSSD;SG NOM;PROPN;PSSD;SG NOM;PROPN;PSSD;SG NOM;PROPN;PSSD;SG ADP ADJ;NOM;PSSD;SG N;NOM;PSSD;SG N;NOM;PSS3S;SG DEF;DET N;NOM;PSSD;SG ADJ;NOM;PSSD;SG N;NOM;PSS3S;SG _ NOM;PROPN;PSSD;SG NOM;PROPN;PSSD;SG _
" ami történt , oly mély sebeket ejtett — írta a radikal című lap szemleírója , erol katircioglu — , hogy a földrengés után törökország már soha nem lesz az , ami előtte volt . "	" ami történik , oly mély seb ejt — ír a radikal című lap szemleíró , erol katircioglu — , hogy a földrengés után törökország már soha nem lesz az , ami előtte van . "	_ 3;NOM;PRO;SG 3;ACT;FIN;IND;INDF;PST;SG;V _ 3;NOM;PRO;SG ADJ;NOM;SG ACC;N;PL 3;ACT;FIN;IND;INDF;PST;SG;V _ 3;ACT;DEF;FIN;IND;PST;SG;V DEF;DET NOM;PROPN;SG ADJ;NOM;SG N;NOM;SG N;NOM;PSS3S;SG _ NOM;PROPN;SG NOM;PROPN;SG _ _ CONJ DEF;DET N;NOM;SG ADP NOM;PROPN;SG ADV ADV ADV 3;ACT;FIN;IND;INDF;PRS;SG;V 3;NOM;PRO;SG _ 3;NOM;PRO;SG 3;NOM;PRO;SG 3;ACT;FIN;IND;INDF;PST;SG;V _ _
a c és a d csoport mérkőzéseire tegnap , első kiadásunk zárása után került sor .	a c és a d csoport mérkőzés tegnap , első kiadás zárás után kerül sor .	DEF;DET N;NOM;PSSD;SG CONJ DEF;DET N;NOM;PSSD;SG N;NOM;PSSD;SG N;ON+ALL;PL;PSS3S ADV _ ADJ;NOM;PSSD;SG N;NOM;PSS1P;SG N;NOM;PSS3S;SG ADP 3;ACT;FIN;IND;INDF;PST;SG;V N;NOM;PSSD;SG _
hátrányos változás volt , hogy a makrogazdasági mutatók romlottak .	hátrányos változás van , hogy a makrogazdasági mutató romlik .	ADJ;NOM;PSSD;SG N;NOM;PSSD;SG 3;ACT;FIN;IND;INDF;PST;SG;V _ CONJ DEF;DET ADJ;NOM;PSSD;SG N;NOM;PL;PSSD 3;ACT;FIN;IND;INDF;PL;PST;V _
a vezér egyetlen országot sem nevezett meg , a talibán mindazonáltal főként iránt és oroszországot vádolja az utolsó , még talpon maradt ellenségének , ahmed sah maszúd tádzsik hadúrnak a támogatásával .	a vezér egyetlen ország sem nevez meg , a talibán mindazonáltal főként irán és oroszország vádol az utolsó , még talp maradt ellenség , ahmed sah maszúd tádzsik hadúr a támogatás .	DEF;DET N;NOM;SG ADJ;NOM;SG ACC;N;SG ADV 3;ACT;FIN;IND;INDF;PST;SG;V PART _ DEF;DET NOM;PROPN;SG CONJ ADV ACC;PROPN;SG CONJ ACC;PROPN;SG 3;ACT;DEF;FIN;IND;PRS;SG;V DEF;DET ADJ;NOM;SG _ ADV N;ON+ESS;SG ADJ;NOM;SG GEN;N;PSS3S;SG _ NOM;PROPN;SG NOM;PROPN;SG NOM;PROPN;SG ADJ;NOM;SG GEN;N;SG DEF;DET INS;N;PSS3S;SG _
( az oktatási intézményekben nem tanárként dolgozók bére például átlagosan 12 százalékkal nőtt az idén ) .	( az oktatási intézmény nem tanár dolgozó bér például átlagos 12 százalék nő az idén ) .	_ DEF;DET ADJ;NOM;PSSD;SG IN+ESS;N;PL;PSSD ADV ABS;N;PSSD;SG ADJ;NOM;PL;PSSD N;NOM;PSS3S;SG ADV ADJ;FRML;PSSD;SG NOM;NUM;PSSD;SG INS;N;PSSD;SG 3;ACT;FIN;IND;INDF;PST;SG;V DEF;DET ADV _ _
a tíz kis , zömében szabolcsi konzervgyár hiteleire adott 2,33 milliárd forintnyi állami garancia után ( hvg , 1999.június 19. ) a kormány újabb 5 milliárd forint értékben vállalt készfizető kezességet tartósítóipari cégek hiteleire .	a tíz kis , zöm szabolcsi konzervgyár hitel adott 2,33 milliárd forintnyi állami garancia után ( hvg , 1999.június 19. ) a kormány új 5 milliárd forint érték vállal készfizető kezesség tartósítóipari cég hitel .	DEF;DET NOM;NUM;SG ADJ;NOM;SG _ IN+ESS;N;PSS3S;SG ADJ;NOM;SG N;NOM;SG N;ON+ALL;PL;PSS3S ADJ;NOM;SG NOM;NUM;SG NOM;NUM;SG ADJ;NOM;SG ADJ;NOM;SG N;NOM;SG ADP _ NOM;PROPN;SG _ NOM;PROPN;SG N;NOM;PSS3S;SG _ DEF;DET N;NOM;SG ADJ;CMPR;NOM;SG NOM;NUM;SG NOM;NUM;SG N;NOM;SG IN+ESS;N;SG 3;ACT;FIN;IND;INDF;PST;SG;V ADJ;NOM;SG ACC;N;SG ADJ;NOM;SG N;NOM;PL N;ON+ALL;PL;PSS3S _
— ez a jaguár korántsem fenyegető , hanem szelid , harmonikus .	— ez a jaguár korántsem fenyegető , hanem szelíd , harmonikus .	_ 3;DET;NOM;PSSD;SG DEF;DET N;NOM;PSSD;SG ADV ADJ;NOM;PSSD;SG _ CONJ ADJ;NOM;PSSD;SG _ ADJ;NOM;PSSD;SG _
a színiirodalom legszebb szerepeit alakította .	a színiirodalom szép szerep alakít .	DEF;DET N;NOM;PSSD;SG ADJ;NOM;PSSD;RL;SG ACC;N;PL;PSS3S 3;ACT;DEF;FIN;IND;PST;SG;V _
az esethez riasztották a váci , a balassagyarmati és a gödöllői tűzoltókat is , a rossz útviszonyok miatt azonban csak a váciak jutottak el a helyszínre , ám akkorra már a helyiek eloltották a tüzet .	az eset riaszt a váci , a balassagyarmati és a gödöllői tűzoltó is , a rossz útviszonyok miatt azonban csak a váci jut el a helyszín , ám akkorra már a helyi el+olt a tűz .	DEF;DET AT+ALL;N;PSSD;SG 3;ACT;DEF;FIN;IND;PL;PST;V DEF;DET ADJ;NOM;PSSD;SG _ DEF;DET ADJ;NOM;PSSD;SG CONJ DEF;DET ADJ;NOM;PSSD;SG ACC;N;PL;PSSD CONJ _ DEF;DET ADJ;NOM;PSSD;SG N;NOM;PL;PSSD ADP CONJ ADV DEF;DET N;NOM;PL;PSSD 3;ACT;FIN;IND;INDF;PL;PST;V ADV DEF;DET N;ON+ALL;PSSD;SG _ CONJ ADV ADV DEF;DET N;NOM;PL;PSSD 3;ACT;DEF;FIN;IND;PL;PST;V DEF;DET ACC;N;PSSD;SG _
az államháztartás , valamint a külkereskedelmi mérleg hiánya nagyobb lesz a vártnál , a külföldről érkező tőke idén nem pótolja a folyó fizetési mérleg hiányát .	az államháztartás , valamint a külkereskedelmi mérleg hiány nagy lesz a várt , a külföld érkező tőke idén nem pótol a folyó fizetési mérleg hiány .	DEF;DET N;NOM;PSSD;SG _ CONJ DEF;DET ADJ;NOM;PSSD;SG N;NOM;PSSD;SG N;NOM;PSS3S;SG ADJ;CMPR;NOM;PSSD;SG 3;ACT;FIN;IND;INDF;PRS;SG;V DEF;DET ADJ;AT+ESS;PSSD;SG _ DEF;DET N;PSSD;SG ADJ;NOM;PSSD;SG N;NOM;PSSD;SG ADV ADV 3;ACT;DEF;FIN;IND;PRS;SG;V DEF;DET ADJ;NOM;PSSD;SG ADJ;NOM;PSSD;SG N;NOM;PSSD;SG ACC;N;PSS3S;SG _
a gazdaságkutatók azonban a forint 9-10 százalékos romlását prognosztizálják arra az esetre , ha a " fekete arany " ára 20 dollár feletti szinten stabilizálódik .	a gazdaságkutató azonban a forint 9-10 százalékos romlás prognosztizál az az eset , ha a " fekete arany " ár 20 dollár feletti szint stabilizálódik .	DEF;DET N;NOM;PL;PSSD CONJ DEF;DET N;NOM;PSSD;SG NOM;NUM;PSSD;SG ADJ;NOM;PSSD;SG ACC;N;PSS3S;SG 3;ACT;DEF;FIN;IND;PL;PRS;V 3;DET;ON+ALL;PSSD;SG DEF;DET N;ON+ALL;PSSD;SG _ CONJ DEF;DET _ ADJ;NOM;PSSD;SG N;NOM;PSSD;SG _ N;NOM;PSS3S;SG NOM;NUM;PSSD;SG N;NOM;PSSD;SG ADJ;NOM;PSSD;SG N;ON+ESS;PSSD;SG 3;ACT;FIN;IND;INDF;PRS;SG;V _
" nem kell túl nagy fantázia ezek után ahhoz , hogy kitaláljuk , milyen vitát is szeretne a kormány . lehetőleg semmilyent " — ahogyan orbán viktor 1991 decemberében mondta .	" nem kell túl nagy fantázia ez után az , hogy kitalál , milyen vita is szeret a kormány . lehetőleg semmilyen " — ahogyan orbán viktor 1991 december mond .	_ ADV 3;ACT;FIN;IND;INDF;PRS;SG;V ADV ADJ;NOM;SG N;NOM;SG 3;NOM;PL;PRO ADP 3;AT+ALL;PRO;SG _ CONJ 1;ACT;DEF;FIN;IMP;PL;PRS;V _ 3;NOM;PRO;SG ACC;N;SG ADV 3;ACT;COND;FIN;INDF;PRS;SG;V DEF;DET N;NOM;SG _ ADV 3;ACC;PRO;SG _ _ ADV NOM;PROPN;SG NOM;PROPN;SG NOM;NUM;SG IN+ESS;N;PSS3S;SG 3;ACT;DEF;FIN;IND;PST;SG;V _
az egyik gyermekkorunk hőse , tarzan , a másik felnőttkorunk hérosza , james bond .	az egyik gyermekkor hős , tarzan , a másik felnőttkor hérosz , james bond .	DEF;DET 3;NOM;PRO;PSSD;SG N;NOM;PSS1P;SG N;NOM;PSS3S;SG _ NOM;PROPN;PSSD;SG _ DEF;DET 3;NOM;PRO;PSSD;SG N;NOM;PSS1P;SG N;NOM;PSS3S;SG _ NOM;PROPN;PSSD;SG NOM;PROPN;PSSD;SG _
mint szűcs andrástól , a khvm munkatársától megtudtuk , nem terveznek korlátozást .	mint szűcs andrás , a khvm munkatárs meg+tud , nem tervez korlátozás .	ADV NOM;PROPN;PSSD;SG AT+ABL;PROPN;PSSD;SG _ DEF;DET NOM;PROPN;PSSD;SG AT+ABL;N;PSS3S;SG 1;ACT;DEF;FIN;IND;PL;PST;V _ ADV 3;ACT;FIN;IND;INDF;PL;PRS;V ACC;N;PSSD;SG _
s úgy kell játszanunk , hogy aki először van operában , az name azzal az élménnyel menjen haza , hogy itt csak három órán át ordibáltak , s emellett az előadásunkkal annak is újdonságot kell nyújtanunk , aki sokadszor ül be ugyanarra a produkcióra , és minden apróságot észrevesz .	s úgy kell játszik , hogy aki először van opera , az ne az az élmény megy haza , hogy itt csak három óra át ordibál , s emellett az előadás az is újdonság kell nyújt , aki sokadszor ül be ugyanaz a produkció , és minden apróság észrevesz .	CONJ ADV 3;ACT;FIN;IND;INDF;PRS;SG;V 1;ACT;NFIN;PL;V _ CONJ 3;NOM;PRO;PSSD;SG ADV 3;ACT;FIN;IND;INDF;PRS;SG;V IN+ESS;N;PSSD;SG _ 3;NOM;PRO;PSSD;SG ADV 3;DET;INS;PSSD;SG DEF;DET INS;N;PSSD;SG 3;ACT;FIN;IMP;INDF;PRS;SG;V ADV _ CONJ ADV ADV NOM;NUM;PSSD;SG N;ON+ESS;PSSD;SG ADP 3;ACT;FIN;IND;INDF;PL;PST;V _ CONJ ADV DEF;DET INS;N;PSS1P;SG 3;DAT;PRO;PSSD;SG CONJ ACC;N;PSSD;SG 3;ACT;FIN;IND;INDF;PRS;SG;V 1;ACT;NFIN;PL;V _ 3;NOM;PRO;PSSD;SG ADV 3;ACT;FIN;IND;INDF;PRS;SG;V ADV 3;ON+ALL;PRO;PSSD;SG DEF;DET N;ON+ALL;PSSD;SG _ CONJ DET;INDF ACC;N;PSSD;SG 3;ACT;FIN;IND;INDF;PRS;SG;V _
eredmények , bajnokok ligája , 2. kör , 1. forduló .	eredmény , bajnokok ligája , 2. kör , 1. forduló .	N;NOM;PL;PSSD _ NOM;PROPN;PSSD;SG NOM;PROPN;PSSD;SG _ ADJ;NOM;PSSD;SG N;NOM;PSSD;SG _ ADJ;NOM;PSSD;SG N;NOM;PSSD;SG _
tetejükig hóba süppedt autókat és utasaikat mentették egész éjjel ( és szerdán napközben is ) .	tető hó süppedt autó és utas ment egész éjjel ( és szerda napközben is ) .	N;PSS3P;SG IN+ALL;N;PSSD;SG ADJ;NOM;PSSD;SG ACC;N;PL;PSSD CONJ ACC;N;PL;PSS3P 3;ACT;DEF;FIN;IND;PL;PST;V ADV ADV _ CONJ N;ON+ESS;PSSD;SG ADV CONJ _ _
a karacsáj- és cserkeszfölddel határos kabard-balkár köztársaságban például a kabardok a cserkeszek , a balkárok a karacsájok mellett vannak , az adige köztársaság parlamentje már korábban támogatásáról biztosította gyerevet , ruszlan ausev ingus elnök szemjonov mellett lépett fel , míg dagesztán két legnépesebb etnikuma , a kumikok és az avarok közül az előbbiek — türkök lévén — a karacsájoknak , az utóbbiak a cserkeszeknek szurkolnak .	a karacsáj- és cserkeszföld határos kabard-balkár köztársaság például a kabard a cserkesz , a balkár a karacsáj mellett van , az adige köztársaság parlament már korán támogatás biztosít gyerev , ruszlan ausev ingus elnök szemjonov mellett lép fel , míg dagesztán két népes etnikum , a kumik és az avar közül az előbbi — türk lévén — a karacsáj , az utóbbi a cserkesz szurkol .	DEF;DET NOM;PROPN;SG CONJ INS;PROPN;SG ADJ;NOM;SG NOM;PROPN;SG IN+ESS;PROPN;SG ADV DEF;DET N;NOM;PL DEF;DET N;NOM;PL _ DEF;DET N;NOM;PL DEF;DET N;NOM;PL ADP 3;ACT;FIN;IND;INDF;PL;PRS;V _ DEF;DET NOM;PROPN;SG NOM;PROPN;SG N;NOM;PSS3S;SG ADV ADV;CMPR N;PSS3S;SG 3;ACT;DEF;FIN;IND;PST;SG;V ACC;PROPN;SG _ NOM;PROPN;SG NOM;PROPN;SG ADJ;NOM;SG N;NOM;SG NOM;PROPN;SG ADP 3;ACT;FIN;IND;INDF;PST;SG;V ADV _ ADV NOM;PROPN;SG NOM;NUM;SG ADJ;NOM;RL;SG N;NOM;PSS3S;SG _ DEF;DET N;NOM;PL CONJ DEF;DET N;NOM;PL ADP DEF;DET N;NOM;PL _ N;NOM;PL ADV;V.CVB _ DEF;DET DAT;N;PL _ DEF;DET N;NOM;PL DEF;DET DAT;N;PL 3;ACT;FIN;IND;INDF;PL;PRS;V _
mihail kaszjanov pénzügyminiszter hangsúlyozta , hogy az illeték emelését nem fiskális szempontok indokolták , hanem az utóbbi hónapokban országszerte tapasztalható üzemanyaghiány megszüntetése , illetve az áremelkedés letörése .	mihail kaszjanov pénzügyminiszter hangsúlyoz , hogy az illeték emelés nem fiskális szempont indokol , hanem az utóbbi hónap országszerte tapasztalható üzemanyaghiány megszüntetés , illetve az áremelkedés letörés .	NOM;PROPN;SG NOM;PROPN;SG N;NOM;SG 3;ACT;DEF;FIN;IND;PST;SG;V _ CONJ DEF;DET N;NOM;SG ACC;N;PSS3S;SG ADV N;NOM;SG N;NOM;PL 3;ACT;DEF;FIN;IND;PL;PST;V _ CONJ DEF;DET ADJ;CMPR;NOM;SG IN+ESS;N;PL ADV ADJ;NOM;SG N;NOM;SG N;NOM;PSS3S;SG _ CONJ DEF;DET N;NOM;SG N;NOM;PSS3S;SG _
mert kétségtelen tény , hogy minél szélesebb körben terítik a terheket , annál könnyebb összeszedni a hiányzó pénzt — de annál nagyobb az érintett választók száma is .	mert kétségtelen tény , hogy minél széles kör terít a teher , annál könnyű összeszed a hiányzó pénz — de annál nagy az érintett választó szám is .	CONJ ADJ;NOM;SG N;NOM;SG _ CONJ CONJ ADJ;CMPR;NOM;SG IN+ESS;N;SG 3;ACT;DEF;FIN;IND;PL;PRS;V DEF;DET ACC;N;PL _ ADV ADJ;CMPR;NOM;SG ACT;NFIN;V DEF;DET ADJ;NOM;SG ACC;N;SG _ CONJ ADV ADJ;CMPR;NOM;SG DEF;DET ADJ;NOM;SG N;NOM;PL N;NOM;PSS3S;SG CONJ _
tényleg hihetetlen , de edgar rice burroughs híres regényhőse eddig már vagy ötvenszer kelt életre a mozivásznon , de rajzfilmen most először elevenednek meg kalandjai a walt disney stúdió produkciójában .	tényleg hihetetlen , de edgar rice burroughs híres regényhős eddig már vagy ötven kel élet a mozivászon , de rajzfilm most először elevenedik meg kaland a walt disney stúdió produkció .	ADV ADJ;NOM;PSSD;SG _ CONJ NOM;PROPN;PSSD;SG NOM;PROPN;PSSD;SG NOM;PROPN;PSSD;SG ADJ;NOM;PSSD;SG N;NOM;PSS3S;SG ADV ADV ADV ADV 3;ACT;FIN;IND;INDF;PST;SG;V N;ON+ALL;PSSD;SG DEF;DET N;ON+ESS;PSSD;SG _ CONJ N;ON+ESS;PSSD;SG ADV ADV 3;ACT;FIN;IND;INDF;PL;PRS;V PART N;NOM;PL;PSS3S DEF;DET NOM;PROPN;PSSD;SG NOM;PROPN;PSSD;SG NOM;PROPN;PSSD;SG IN+ESS;N;PSS3S;SG _
utolsó tulajdonosa majse buchmann szabómester volt , akit családjával együtt 1942-ben a németek elhurcoltak .	utolsó tulajdonos majse buchmann szabómester van , aki család együtt 1942 a német el+hurcol .	ADJ;NOM;PSSD;SG N;NOM;PSS3S;SG NOM;PROPN;PSSD;SG NOM;PROPN;PSSD;SG N;NOM;PSSD;SG 3;ACT;FIN;IND;INDF;PST;SG;V _ 3;ACC;PRO;PSSD;SG INS;N;PSS3S;SG ADP IN+ESS;NUM;PSSD;SG DEF;DET N;NOM;PL;PSSD 3;ACT;FIN;IND;INDF;PL;PST;V _
a nagykövet levele egy , a magyarországi romákról szóló amerikai újságcikkre reagál , melyben az amerikai szerző többek között intézményes rasszizmusról ír .	a nagykövet levél egy , a magyarországi roma szóló amerikai újságcikk reagál , mely az amerikai szerző több között intézményes rasszizmus ír .	DEF;DET N;NOM;PSSD;SG N;NOM;PSS3S;SG DET;INDF _ DEF;DET ADJ;NOM;PSSD;SG N;PL;PSSD ADJ;NOM;PSSD;SG ADJ;NOM;PSSD;SG N;ON+ALL;PSSD;SG 3;ACT;FIN;IND;INDF;PRS;SG;V _ 3;IN+ESS;PRO;PSSD;SG DEF;DET ADJ;NOM;PSSD;SG N;NOM;PSSD;SG DET;INDF ADP ADJ;NOM;PSSD;SG N;PSSD;SG 3;ACT;FIN;IND;INDF;PRS;SG;V _
vagyis nulla .	vagyis nulla .	CONJ NOM;NUM;SG _
a két évtizede tartó változások következtében a török gazdaság szinte lokomotívként száguldott , teljesítményét pontosan mérni sem lehetett a feketegazdaság hatalmas volumene miatt .	a két évtized tartó változás következtében a török gazdaság szinte lokomotív száguld , teljesítmény pontos mér sem lehet a feketegazdaság hatalmas volumen miatt .	DEF;DET NOM;NUM;SG N;NOM;PSS3S;SG ADJ;NOM;SG N;NOM;PL ADP DEF;DET ADJ;NOM;SG N;NOM;SG ADV ABS;N;SG 3;ACT;FIN;IND;INDF;PST;SG;V _ ACC;N;PSS3S;SG ADJ;FRML;SG ACT;NFIN;V ADV 3;ACT;FIN;IND;INDF;PST;SG;V DEF;DET N;NOM;SG ADJ;NOM;SG N;NOM;PSS3S;SG ADP _
ázsiában ezzel szemben mind több sikerrel veszik fel az aids-szel szembeni küzdelmet .	ázsia ez szemben mind több siker vesz fel az aids szembeni küzdelem .	IN+ESS;PROPN;PSSD;SG 3;INS;PRO;PSSD;SG ADP ADV DET;INDF INS;N;PSSD;SG 3;ACT;DEF;FIN;IND;PL;PRS;V ADV DEF;DET INS;N;PSSD;SG ADJ;NOM;PSSD;SG ACC;N;PSSD;SG _
