három , kábítószer-árusítással alaposan gyanúsítható huszonéves fiatalt vett őrizetbe kedden éjjel a rendőrség a fővárosban , a xviii. kerületben .	három , kábítószer-árusítás alapos gyanúsítható huszonéves fiatal vesz őrizet kedd éjjel a rendőrség a főváros , a 18. kerület .	NOM;NUM;PSSD;SG _ INS;N;PSSD;SG ADJ;FRML;PSSD;SG ADJ;NOM;PSSD;SG ADJ;NOM;PSSD;SG ACC;N;PSSD;SG 3;ACT;FIN;IND;INDF;PST;SG;V IN+ALL;N;PSSD;SG N;ON+ESS;PSSD;SG ADV DEF;DET N;NOM;PSSD;SG DEF;DET IN+ESS;N;PSSD;SG _ DEF;DET ADJ;NOM;PSSD;SG IN+ESS;N;PSSD;SG _
az elmúlt nyolc hónapban , amelyből összesen hatot kényszerűségből szabadságon töltött a parlamenti ellenzék , megváltozott itthon a hatalommegosztás 1990-ben kialakított rendszere : az e héten audienciát tartó kormányfő gyakorlatilag kivonta magát az országgyűlés ellenőrzése alól .	az elmúlt nyolc hónap , amely összesen hat kényszerűség szabadság tölt a parlamenti ellenzék , megváltozik itthon a hatalommegosztás 1990 kialakított rendszer : az e hét audiencia tartó kormányfő gyakorlati kivon maga az országgyűlés ellenőrzés alól .	DEF;DET ADJ;NOM;SG NOM;NUM;SG IN+ESS;N;SG _ 3;IN+ABL;PRO;SG ADV ACC;NUM;SG IN+ABL;N;SG N;ON+ESS;SG 3;ACT;FIN;IND;INDF;PST;SG;V DEF;DET ADJ;NOM;SG N;NOM;SG _ 3;ACT;FIN;IND;INDF;PST;SG;V ADV DEF;DET N;NOM;SG IN+ESS;NUM;SG ADJ;NOM;SG N;NOM;PSS3S;SG _ DEF;DET 3;NOM;PRO;SG N;ON+ESS;SG ACC;N;SG ADJ;NOM;SG N;NOM;SG ADJ;FRML;SG 3;ACT;DEF;FIN;IND;PST;SG;V 3;ACC;PRO;REFL;SG DEF;DET NOM;PROPN;SG N;NOM;PSS3S;SG ADP _
szent-györgyi albert segített rajta , apja barátja .	szent-györgyi albert segít rajta , apa barát .	NOM;PROPN;PSSD;SG NOM;PROPN;PSSD;SG 3;ACT;FIN;IND;INDF;PST;SG;V 3;ON+ESS;PRO;PSSD;SG _ N;NOM;PSS3S;SG N;NOM;PSS3S;SG _
érthetné , ha érvényes volna számára a pilinszky számára még érvényes nyelvi univerzum , ahol a szavak jelentésének van egy , ha úgy tetszik , transzcendens köre , melyben erkölcs , modor , szokás , illem , gondolkodói autonómia találhat helyet .	ért , ha érvényes van számára a pilinszky számára még érvényes nyelvi univerzum , ahol a szó jelentés van egy , ha úgy tetszik , transzcendens kör , mely erkölcs , modor , szokás , illem , gondolkodói autonómia talál hely .	3;ACT;DEF;FIN;PRS;SG;V;{COND/POT} _ CONJ ADJ;NOM;PSSD;SG 3;ACT;COND;FIN;INDF;PRS;SG;V 3;NOM;PRO;PSSD;SG DEF;DET NOM;PROPN;PSSD;SG ADP ADV ADJ;NOM;PSSD;SG ADJ;NOM;PSSD;SG N;NOM;PSSD;SG _ ADV DEF;DET N;NOM;PL;PSSD GEN;N;PSS3S;SG 3;ACT;FIN;IND;INDF;PRS;SG;V DET;INDF _ CONJ ADV 3;ACT;FIN;IND;INDF;PRS;SG;V _ ADJ;NOM;PSSD;SG N;NOM;PSS3S;SG _ 3;IN+ESS;PRO;PSSD;SG N;NOM;PSSD;SG _ N;NOM;PSSD;SG _ N;NOM;PSSD;SG _ N;NOM;PSSD;SG _ ADJ;NOM;PSSD;SG N;NOM;PSSD;SG 3;ACT;FIN;INDF;POT;PRS;SG;V ACC;N;PSSD;SG _
jó kis elfoglaltság , hiszen félóránként nyugodtan meg lehet ismételni .	jó kis elfoglaltság , hiszen fél_óra nyugodt meg lesz ismétel .	ADV ADJ;NOM;PSSD;SG N;NOM;PSSD;SG _ CONJ DIST;N;PSSD;SG ADJ;FRML;PSSD;SG PART 3;ACT;FIN;INDF;POT;PRS;SG;V ACT;NFIN;V _
indonéziában például az autóeladások már közelítik az 1997 előtti szintet , dél-koreában újból megugrott a személyi számítógépek iránti igény , thaiföldön az idei első fél évben 80 százalékkal több import-szeszesital fogyott , mint egy évvel korábban .	indonézia például az autóeladás már közelít az 1997 előtti szint , dél-korea újból megugrik a személyi számítógép iránti igény , thaiföld az idei első fél év 80 százalék több import-szeszesital fogy , mint egy év korán .	IN+ESS;PROPN;SG ADV DEF;DET N;NOM;PL ADV 3;ACT;DEF;FIN;IND;PL;PRS;V DEF;DET NOM;NUM;SG ADJ;NOM;SG ACC;N;SG _ IN+ESS;PROPN;SG ADV 3;ACT;FIN;IND;INDF;PST;SG;V DEF;DET ADJ;NOM;SG N;NOM;PL ADJ;NOM;SG N;NOM;SG _ ON+ESS;PROPN;SG DEF;DET ADJ;NOM;SG ADJ;NOM;SG NOM;NUM;SG IN+ESS;N;SG NOM;NUM;SG INS;N;SG NOM;NUM;SG N;NOM;SG 3;ACT;FIN;IND;INDF;PST;SG;V _ CONJ NOM;NUM;SG INS;N;SG ADV;CMPR _
egyébként lassan már két évtizede foglalkozom film- és színházi zenével , s nagyon szeretem csinálni .	egyébként lassú már két évtized foglalkozik film- és színházi zene , s nagyon szeret csinál .	ADV ADJ;FRML;PSSD;SG ADV NOM;NUM;PSSD;SG N;NOM;PSS3S;SG 1;ACT;FIN;IND;INDF;PRS;SG;V N;NOM;PSSD;SG CONJ ADJ;NOM;PSSD;SG INS;N;PSSD;SG _ CONJ ADV 1;ACT;DEF;FIN;IND;PRS;SG;V ACT;NFIN;V _
a termelés fellendülésének hátterében elemzők szerint a kereslet élénkülése áll , a cégek többsége hozzálátott tavaly kiürült készleteinek a feltöltéséhez .	a termelés fellendülés háttér elemző szerint a kereslet élénkülés áll , a cég többség hozzálát tavaly kiürült készlet a feltöltés .	DEF;DET N;NOM;SG GEN;N;PSS3S;SG IN+ESS;N;PSS3S;SG N;NOM;PL ADP DEF;DET N;NOM;SG N;NOM;PSS3S;SG 3;ACT;FIN;IND;INDF;PRS;SG;V _ DEF;DET N;NOM;PL N;NOM;PSS3S;SG 3;ACT;FIN;IND;INDF;PST;SG;V ADV ADJ;NOM;SG GEN;N;PL;PSS3S DEF;DET AT+ALL;N;PSS3S;SG _
az atp-világbajnokság második napjára steffi graf , akit éppen tegnap választottak meg az évszázad legjobb német sportolónőjének , megérkezett hannoverbe .	az atp-világbajnokság második nap steffi graf , aki éppen tegnap választ meg az évszázad jó német sportolónő , meg+érkezik hannover .	DEF;DET N;NOM;PSSD;SG ADJ;NOM;PSSD;SG N;ON+ALL;PSS3S;SG NOM;PROPN;PSSD;SG NOM;PROPN;PSSD;SG _ 3;ACC;PRO;PSSD;SG ADV ADV 3;ACT;FIN;IND;INDF;PL;PST;V PART DEF;DET N;NOM;PSSD;SG ADJ;NOM;PSSD;RL;SG ADJ;NOM;PSSD;SG DAT;N;PSS3S;SG _ 3;ACT;FIN;IND;INDF;PST;SG;V IN+ALL;PROPN;PSSD;SG _
a szobát , ahol a 66 éves kobajasi sinicsi teteme volt , a szekta két híve bérelte .	a szoba , ahol a 66 éves kobajasi sinicsi tetem van , a szekta két hív bérel .	DEF;DET ACC;N;PSSD;SG _ ADV DEF;DET NOM;NUM;PSSD;SG ADJ;NOM;PSSD;SG NOM;PROPN;PSSD;SG NOM;PROPN;PSSD;SG N;NOM;PSS3S;SG 3;ACT;FIN;IND;INDF;PST;SG;V _ DEF;DET N;NOM;PSSD;SG NOM;NUM;PSSD;SG N;NOM;PSS3S;SG 3;ACT;DEF;FIN;IND;PST;SG;V _
buza szerint azonban néhány ülés után az albizottság átadhatja a már beszerzett dokumentumokat , vallomásokat , s így már a magasabb szintű parlamenti testület folytathatja a vizsgálatokat .	buza szerint azonban néhány ülés után az albizottság át+ad a már beszerzett dokumentum , vallomás , s így már a magas szintű parlamenti testület folytat a vizsgálat .	NOM;PROPN;PSSD;SG ADP CONJ DET;INDF N;NOM;PSSD;SG ADP DEF;DET N;NOM;PSSD;SG 3;ACT;DEF;FIN;POT;PRS;SG;V DEF;DET ADV ADJ;NOM;PSSD;SG ACC;N;PL;PSSD _ ACC;N;PL;PSSD _ CONJ ADV ADV DEF;DET ADJ;CMPR;NOM;PSSD;SG ADJ;NOM;PSSD;SG ADJ;NOM;PSSD;SG N;NOM;PSSD;SG 3;ACT;DEF;FIN;POT;PRS;SG;V DEF;DET ACC;N;PL;PSSD _
mádl ildikó , lakos nikolett és grábics mónika az élő-pontszámaikat tekintve a nyolcadikok a mezőnyben .	mádl ildikó , lakos nikolett és grábics mónika az élő-pontszám tekintve a nyolcadik a mezőny .	NOM;PROPN;PSSD;SG NOM;PROPN;PSSD;SG _ NOM;PROPN;PSSD;SG NOM;PROPN;PSSD;SG CONJ NOM;PROPN;PSSD;SG NOM;PROPN;PSSD;SG DEF;DET ACC;N;PL;PSS3P ADV;V.CVB DEF;DET ADJ;NOM;PL;PSSD DEF;DET IN+ESS;N;PSSD;SG _
a természet nem könnyű ellenfél .	a természet nem könnyű ellenfél .	DEF;DET N;NOM;PSSD;SG ADV ADJ;NOM;PSSD;SG N;NOM;PSSD;SG _
ez a szerep nem egy embert , hanem egy tucatot kívánt .	ez a szerep nem egy ember , hanem egy tucat kíván .	3;DET;NOM;PSSD;SG DEF;DET N;NOM;PSSD;SG ADV NOM;NUM;PSSD;SG ACC;N;PSSD;SG _ CONJ DET;INDF ACC;N;PSSD;SG 3;ACT;FIN;IND;INDF;PST;SG;V _
az ipari termelés 22,6 százalékkal nőtt , a nagy- és kiskereskedelmi eladások értéke 10,8 százalékkal haladja meg az előző évi eredményt , a gyárak kihasználtsága a tavalyi második negyedéves 71,3 százalékról 76,8-ra javult .	az ipari termelés 22,6 százalék nő , a nagy- és kiskereskedelmi eladás érték 10,8 százalék halad meg az előző évi eredmény , a gyár kihasználtság a tavalyi második negyedéves 71,3 százalék 76,8 javul .	DEF;DET ADJ;NOM;SG N;NOM;SG NOM;NUM;SG INS;N;SG 3;ACT;FIN;IND;INDF;PST;SG;V _ DEF;DET N;NOM;SG CONJ ADJ;NOM;SG N;NOM;PL N;NOM;PSS3S;SG NOM;NUM;SG INS;N;SG 3;ACT;DEF;FIN;IND;PRS;SG;V PART DEF;DET ADJ;NOM;SG ADJ;NOM;SG ACC;N;SG _ DEF;DET N;NOM;PL N;NOM;PSS3S;SG DEF;DET ADJ;NOM;SG ADJ;NOM;SG ADJ;NOM;SG NOM;NUM;SG N;SG NUM;ON+ALL;SG 3;ACT;FIN;IND;INDF;PST;SG;V _
aztán amikor kiderült , hogy a pszichiáternek van egy kis származási eltérése , ráadásul itáliai egyetemi gyakorlata , ő , aki fiuméban évekig dolgozott olaszokkal , megenyhült .	aztán amikor ki+derül , hogy a pszichiáter van egy kis származási eltérés , ráadás itáliai egyetemi gyakorlat , ő , aki fiume év dolgozik olasz , meg+enyhül .	CONJ ADV 3;ACT;FIN;IND;INDF;PST;SG;V _ CONJ DEF;DET GEN;N;PSSD;SG 3;ACT;FIN;IND;INDF;PRS;SG;V DET;INDF ADJ;NOM;PSSD;SG ADJ;NOM;PSSD;SG N;NOM;PSS3S;SG _ FRML;N;PSSD;SG ADJ;NOM;PSSD;SG ADJ;NOM;PSSD;SG N;NOM;PSS3S;SG _ 3;NOM;PRO;PSSD;SG _ 3;NOM;PRO;PSSD;SG IN+ESS;PROPN;PSSD;SG N;PL;PSSD 3;ACT;FIN;IND;INDF;PST;SG;V INS;N;PL;PSSD _ 3;ACT;FIN;IND;INDF;PST;SG;V _
az egyes országok között meglehetősen nagyok az eltérések , korántsem egységes a kínálati piac .	az egyes ország között meglehetős nagy az eltérés , korántsem egységes a kínálati piac .	DEF;DET ADJ;NOM;PSSD;SG N;NOM;PL;PSSD ADP ADJ;FRML;PSSD;SG ADJ;NOM;PL;PSSD DEF;DET N;NOM;PL;PSSD _ ADV ADJ;NOM;PSSD;SG DEF;DET ADJ;NOM;PSSD;SG N;NOM;PSSD;SG _
ezt este visszavonta a cég .	ez este vissza+von a cég .	3;ACC;PRO;PSSD;SG ADV 3;ACT;DEF;FIN;IND;PST;SG;V DEF;DET N;NOM;PSSD;SG _
a támadásokkal párhuzamosan folytatódik a " rábeszélés " is : az albánok számtalanszor érdeklődnek szerb szomszédaiknál , eladó -e az ingatlan .	a támadás párhuzamos folytatódik a " rábeszélés " is : az albán számtalan érdeklődik szerb szomszéd , eladó -e az ingatlan .	DEF;DET INS;N;PL ADJ;FRML;SG 3;ACT;FIN;IND;INDF;PRS;SG;V DEF;DET _ N;NOM;SG _ CONJ _ DEF;DET N;NOM;PL NOM;NUM;SG 3;ACT;FIN;IND;INDF;PL;PRS;V ADJ;NOM;SG AT+ESS;N;PL;PSS3P _ ADJ;NOM;SG ADV DEF;DET N;NOM;SG _
találtak ugyan hiányosságokat , de olyat nem , amely gátolná a terminál biztonságos üzemeltetését .	talál ugyan hiányosság , de oly nem , amely gátol a terminál biztonságos üzemeltetés .	3;ACT;FIN;IND;INDF;PL;PST;V CONJ ACC;N;PL;PSSD _ CONJ 3;ACC;PRO;PSSD;SG ADV _ 3;NOM;PRO;PSSD;SG 3;ACT;COND;DEF;FIN;PRS;SG;V DEF;DET N;NOM;PSSD;SG ADJ;NOM;PSSD;SG ACC;N;PSS3S;SG _
az évi 200 poharas teljesítménnyel ázsiában komoly kávéivónak számító japánok jelentette kereslet kielégítésére az amerikai cég 2003 végéig összesen 250 egységesre tervezi kibővíteni szigetországi láncát .	az évi 200 poharas teljesítmény ázsia komoly kávéivó számító japán jelent kereslet kielégítés az amerikai cég 2003 vég összesen 250 egységes tervez kibővít szigetországi lánc .	DEF;DET ADJ;NOM;SG NOM;NUM;SG ADJ;NOM;SG INS;N;SG IN+ESS;PROPN;SG ADJ;NOM;SG DAT;N;SG ADJ;NOM;SG N;NOM;PL ADJ;NOM;SG N;NOM;SG N;ON+ALL;PSS3S;SG DEF;DET ADJ;NOM;SG N;NOM;SG NOM;NUM;SG N;PSS3S;SG ADV NOM;NUM;SG ADJ;ON+ALL;SG 3;ACT;DEF;FIN;IND;PRS;SG;V ACT;NFIN;V ADJ;NOM;SG ACC;N;PSS3S;SG _
a másik oldalon a nemrég még lemondását felkínált giovanni trapattoni érthetően boldog volt : " a szezonban most játszottunk a legjobban !	a másik oldal a nemrég még lemondás felkínált giovanni trapattoni érthető boldog van : " a szezon most játszik a jól !	DEF;DET DET;INDF N;ON+ESS;PSSD;SG DEF;DET ADV ADV ACC;N;PSS3S;SG ADJ;NOM;PSSD;SG NOM;PROPN;PSSD;SG NOM;PROPN;PSSD;SG ADJ;FRML;PSSD;SG ADJ;NOM;PSSD;SG 3;ACT;FIN;IND;INDF;PST;SG;V _ _ DEF;DET IN+ESS;N;PSSD;SG ADV 1;ACT;FIN;IND;INDF;PL;PST;V DEF;DET ADV _
egyelőre nincs végleges válasz arra , milyen utat kövessenek a szociáldemokraták a jövő évezredben — de arra sem , hogyan veszik majd az ősszel esedékes tartományi és helyhatósági választások akadályait .	egyelőre nincs végleges válasz az , milyen út követ a szociáldemokrata a jövő évezred — de az sem , hogyan vesz majd az ősszel esedékes tartományi és helyhatósági választás akadály .	ADV 3;ACT;FIN;IND;INDF;PRS;SG;V ADJ;NOM;SG N;NOM;SG 3;ON+ALL;PRO;SG _ 3;NOM;PRO;SG ACC;N;SG 3;ACT;FIN;IMP;INDF;PL;PRS;V DEF;DET N;NOM;PL DEF;DET ADJ;NOM;SG IN+ESS;N;SG _ CONJ 3;ON+ALL;PRO;SG CONJ _ ADV 3;ACT;DEF;FIN;IND;PL;PRS;V ADV DEF;DET ADV ADJ;NOM;SG ADJ;NOM;SG CONJ ADJ;NOM;SG N;NOM;PL ACC;N;PL;PSS3S _
a szépet , a jót kell megmutatni .	a szép , a jó kell meg+mutat .	DEF;DET ACC;N;PSSD;SG _ DEF;DET ACC;ADJ;PSSD;SG 3;ACT;FIN;IND;INDF;PRS;SG;V ACT;NFIN;V _
s miközben törökország ásványkincsekben szegény , külkereskedelme gyors ütemben bővül .	s miközben törökország ásványkincs szegény , külkereskedelem gyors ütem bővül .	CONJ ADV NOM;PROPN;SG IN+ESS;N;PL ADJ;NOM;SG _ N;NOM;PSS3S;SG ADJ;NOM;SG IN+ESS;N;SG 3;ACT;FIN;IND;INDF;PRS;SG;V _
ennek fele a jegyzett tőkét gyarapítja , másik fele a tőketartalékba kerül .	ez fél a jegyzett tőke gyarapít , másik fél a tőketartalék kerül .	3;GEN;PRO;SG N;NOM;PSS3S;SG DEF;DET ADJ;NOM;SG ACC;N;SG 3;ACT;DEF;FIN;IND;PRS;SG;V _ 3;NOM;PRO;SG N;NOM;PSS3S;SG DEF;DET IN+ALL;N;SG 3;ACT;FIN;IND;INDF;PRS;SG;V _
mint dr. andics lászló , a budapesti mentőszervezet vezetője a népszavának elmondta , felkészülnek a várható többletfeladatok megoldására .	mint dr. andics lászló , a budapesti mentőszervezet vezető a népszava el+mond , fel+készül a várható többletfeladat megoldás .	ADV N;NOM;PSSD;SG NOM;PROPN;PSSD;SG NOM;PROPN;PSSD;SG _ DEF;DET ADJ;NOM;PSSD;SG N;NOM;PSSD;SG N;NOM;PSS3S;SG DEF;DET DAT;PROPN;PSSD;SG 3;ACT;DEF;FIN;IND;PST;SG;V _ 3;ACT;FIN;IND;INDF;PL;PRS;V DEF;DET ADJ;NOM;PSSD;SG N;NOM;PL;PSSD N;ON+ALL;PSS3S;SG _
emiatt az egyesülések célja elsősorban a verseny csökkentése , illetve a piaci hatalom erősítése .	emiatt az egyesülés cél elsősorban a verseny csökkentés , illetve a piaci hatalom erősítés .	ADV DEF;DET N;NOM;PL;PSSD N;NOM;PSS3S;SG ADV DEF;DET N;NOM;PSSD;SG N;NOM;PSS3S;SG _ CONJ DEF;DET ADJ;NOM;PSSD;SG N;NOM;PSSD;SG N;NOM;PSS3S;SG _
akad , aki félreáll , hogy elhagyott hóláncát keresgélje , mások csúszkálva igyekeznek kikerülni egymást .	akad , aki félre+áll , hogy el+hagyott hólánc keresgél , más csúszkálva igyekezik ki+kerül egymás .	3;ACT;FIN;IND;INDF;PRS;SG;V _ 3;NOM;PRO;PSSD;SG 3;ACT;FIN;IND;INDF;PRS;SG;V _ CONJ ADJ;NOM;PSSD;SG ACC;N;PSS3S;SG 3;ACT;DEF;FIN;IMP;PRS;SG;V _ 3;NOM;PL;PRO;PSSD ADV;V.CVB 3;ACT;FIN;IND;INDF;PL;PRS;V ACT;NFIN;V 3;ACC;PRO;PSSD;SG _
az üzemanyag belföldi fogyasztói árának növekedése azonban növelheti az állam bevételeit , ugyanis a hajtóanyag árának csaknem 70 százalékát a különböző adófajták teszik ki .	az üzemanyag belföldi fogyasztói ár növekedés azonban növel az állam bevétel , ugyanis a hajtóanyag ár csaknem 70 százalék a különböző adófajta tesz ki .	DEF;DET N;NOM;PSSD;SG ADJ;NOM;PSSD;SG ADJ;NOM;PSSD;SG GEN;N;PSS3S;SG N;NOM;PSS3S;SG CONJ 3;ACT;DEF;FIN;POT;PRS;SG;V DEF;DET N;NOM;PSSD;SG ACC;N;PL;PSS3S _ CONJ DEF;DET N;NOM;PSSD;SG GEN;N;PSS3S;SG ADV NOM;NUM;PSSD;SG ACC;N;PSS3S;SG DEF;DET ADJ;NOM;PSSD;SG N;NOM;PL;PSSD 3;ACT;DEF;FIN;IND;PL;PRS;V ADV _
simicska akkor formálisan nem vett részt a mahir rt. 1994. eleji privatizációjában , ám hamarosan átvette a cég irányítását , amelynek 1998-ig áttételesen résztulajdonosa is volt .	simicska akkor formális nem vesz rész a mahir rt. 1994. eleji privatizáció , ám hamarosan átvesz a cég irányítás , amely 1998 áttételes résztulajdonos is van .	NOM;PROPN;SG ADV ADJ;FRML;SG ADV 3;ACT;FIN;IND;INDF;PST;SG;V ACC;N;SG DEF;DET NOM;PROPN;SG NOM;PROPN;SG ADJ;NOM;SG ADJ;NOM;SG IN+ESS;N;PSS3S;SG _ CONJ ADV 3;ACT;DEF;FIN;IND;PST;SG;V DEF;DET N;NOM;SG ACC;N;PSS3S;SG _ 3;GEN;PRO;SG NUM;SG ADJ;FRML;SG N;NOM;PSS3S;SG CONJ 3;ACT;FIN;IND;INDF;PST;SG;V _
a tv 2-nél azt feltételezik , hogy azért , mert a műsor nézettsége az utóbbi hetekben nem éri el a tv 2-n sugárzott jó estét, magyarország! című műsor nézettségének a felét sem .	a tv 2 az feltételez , hogy azért , mert a műsor nézettség az utóbbi hét nem ér el a tv 2 sugárzott jó estét, magyarország! című műsor nézettség a fél sem .	DEF;DET NOM;PROPN;PSSD;SG AT+ESS;PROPN;PSSD;SG 3;ACC;PRO;PSSD;SG 3;ACT;DEF;FIN;IND;PL;PRS;V _ CONJ ADV _ CONJ DEF;DET N;NOM;PSSD;SG N;NOM;PSS3S;SG DEF;DET ADJ;CMPR;NOM;PSSD;SG IN+ESS;N;PL;PSSD ADV 3;ACT;DEF;FIN;IND;PRS;SG;V ADV DEF;DET NOM;PROPN;PSSD;SG ON+ESS;PROPN;PSSD;SG ADJ;NOM;PSSD;SG NOM;PROPN;PSSD;SG NOM;PROPN;PSSD;SG NOM;PROPN;PSSD;SG ADJ;NOM;PSSD;SG N;NOM;PSSD;SG GEN;N;PSS3S;SG DEF;DET ACC;N;PSS3S;SG ADV _
a betegség jóval kevésbé érinti a fejlett országokat .	a betegség jóval kevésbé érint a fejlett ország .	DEF;DET N;NOM;PSSD;SG ADV ADV 3;ACT;DEF;FIN;IND;PRS;SG;V DEF;DET ADJ;NOM;PSSD;SG ACC;N;PL;PSSD _
a járművek 80 százaléka az autók megjelenése előtt kialakult történelmi úthálózaton közlekedik .	a jármű 80 százalék az autó megjelenés előtt kialakult történelmi úthálózat közlekedik .	DEF;DET N;NOM;PL;PSSD NOM;NUM;PSSD;SG N;NOM;PSS3S;SG DEF;DET N;NOM;PL;PSSD N;NOM;PSS3S;SG ADP ADJ;NOM;PSSD;SG ADJ;NOM;PSSD;SG N;ON+ESS;PSSD;SG 3;ACT;FIN;IND;INDF;PRS;SG;V _
a megállapodás szerint a cseh kormány jelképes összegért : 1 , azaz egy cseh koronáért megvásárolja a cseh nemzeti banktól azt a 30 milliárd koronát kitevő szlovák adósságot , amely miatt prága a szövetségi csehszlovákia 1992 végén történt kettéválása óta , hétéves huzavona után sem volt hajlandó kiadni pozsonynak az egykor közös nemzeti bank prágai páncéltermeiben őrzött 4,2 tonna aranykincset .	a megállapodás szerint a cseh kormány jelképes összeg : 1 , azaz egy cseh korona meg+vásárol a cseh nemzeti bank az a 30 milliárd korona kitevő szlovák adósság , amely miatt prága a szövetségi csehszlovákia 1992 vég történt kettéválás óta , hétéves huzavona után sem van hajlandó ki+ad pozsony az egykor közös nemzeti bank prágai páncélterem őrzött 4,2 tonna aranykincs .	DEF;DET N;NOM;PSSD;SG ADP DEF;DET ADJ;NOM;PSSD;SG N;NOM;PSSD;SG ADJ;NOM;PSSD;SG N;PSSD;SG _ NOM;NUM;PSSD;SG _ CONJ NOM;NUM;PSSD;SG ADJ;NOM;PSSD;SG N;PSSD;SG 3;ACT;DEF;FIN;IND;PRS;SG;V DEF;DET NOM;PROPN;PSSD;SG NOM;PROPN;PSSD;SG AT+ABL;PROPN;PSSD;SG 3;ACC;DET;PSSD;SG DEF;DET NOM;NUM;PSSD;SG NOM;NUM;PSSD;SG ACC;N;PSSD;SG ADJ;NOM;PSSD;SG ADJ;NOM;PSSD;SG ACC;N;PSSD;SG _ 3;NOM;PRO;PSSD;SG ADP NOM;PROPN;PSSD;SG DEF;DET ADJ;NOM;PSSD;SG NOM;PROPN;PSSD;SG NOM;NUM;PSSD;SG N;ON+ESS;PSS3S;SG ADJ;NOM;PSSD;SG N;NOM;PSS3S;SG ADP _ ADJ;NOM;PSSD;SG N;NOM;PSSD;SG ADP ADV 3;ACT;FIN;IND;INDF;PST;SG;V ADJ;NOM;PSSD;SG ACT;NFIN;V DAT;PROPN;PSSD;SG DEF;DET ADV ADJ;NOM;PSSD;SG ADJ;NOM;PSSD;SG N;NOM;PSSD;SG ADJ;NOM;PSSD;SG IN+ESS;N;PL;PSS3S ADJ;NOM;PSSD;SG NOM;NUM;PSSD;SG N;NOM;PSSD;SG ACC;N;PSSD;SG _
a felelős kormánynak pedig először is meg kell teremtenie a feltételeket ahhoz , hogy a képviselők dönthessenek ebben a kérdésben , azután pedig alá kell vetnie magát ennek a döntésnek .	a felelős kormány pedig először is meg kell teremt a feltétel az , hogy a képviselő dönthet ez a kérdés , azután pedig alá kell vet maga ez a döntés .	DEF;DET ADJ;NOM;SG DAT;N;SG CONJ ADV ADV PART 3;ACT;FIN;IND;INDF;PRS;SG;V 3;ACT;NFIN;PRS;SG;V DEF;DET ACC;N;PL 3;AT+ALL;PRO;SG _ CONJ DEF;DET N;NOM;PL 3;ACT;FIN;INDF;PL;PRS;V;{IMP/POT} 3;IN+ESS;PRO;SG DEF;DET IN+ESS;N;SG _ CONJ CONJ ADV 3;ACT;FIN;IND;INDF;PRS;SG;V 3;ACT;NFIN;PRS;SG;V 3;ACC;PRO;REFL;SG 3;DAT;PRO;SG DEF;DET DAT;N;SG _
az előzetes nevezési listákon sok nagy név hiányzik , szerencsére nálunk mindenki ott van a fedélzeten !	az előzetes nevezési lista sok nagy név hiányzik , szerencsére mi mindenki ott van a fedélzet !	DEF;DET ADJ;NOM;PSSD;SG ADJ;NOM;PSSD;SG N;ON+ESS;PL;PSSD DET;INDF ADJ;NOM;PSSD;SG N;NOM;PSSD;SG 3;ACT;FIN;IND;INDF;PRS;SG;V _ ADV 1;AT+ESS;PL;PRO;PSSD 3;NOM;PRO;PSSD;SG ADV 3;ACT;FIN;IND;INDF;PRS;SG;V DEF;DET N;ON+ESS;PSSD;SG _
— valamikor 2000 végén , ha a menedzserek is úgy gondolják és intézik .	— valamikor 2000 vég , ha a menedzser is úgy gondol és intéz .	_ ADV NOM;NUM;PSSD;SG N;ON+ESS;PSS3S;SG _ CONJ DEF;DET N;NOM;PL;PSSD CONJ ADV 3;ACT;DEF;FIN;IND;PL;PRS;V CONJ 3;ACT;DEF;FIN;IND;PL;PRS;V _
batistuta csapott le a labdára , és ziccerben nem is hibázott .	batistuta csap le a labda , és ziccer nem is hibázik .	NOM;PROPN;PSSD;SG 3;ACT;FIN;IND;INDF;PST;SG;V ADV DEF;DET N;ON+ALL;PSSD;SG _ CONJ IN+ESS;N;PSSD;SG ADV ADV 3;ACT;FIN;IND;INDF;PST;SG;V _
végül " mindössze " annyiban találták bűnösnek őket , hogy hivatali hatalmukkal visszaélve nyomást gyakoroltak több bankra , nyújtsanak hiteleket az egyik gyengélkedő kisebb chaebolnak .	végül " mindössze " annyi talál bűnös ők , hogy hivatali hatalom visszaélve nyomás gyakorol több bank , nyújt hitel az egyik gyengélkedő kis chaebolnak .	ADV _ ADV _ 3;IN+ESS;PRO;SG 3;ACT;DEF;FIN;IND;PL;PST;V ADJ;DAT;SG 3;ACC;PL;PRO _ CONJ ADJ;NOM;SG INS;N;PSS3P;SG ADV;V.CVB ACC;N;SG 3;ACT;FIN;IND;INDF;PL;PST;V NOM;NUM;SG N;ON+ALL;SG _ 3;ACT;FIN;IMP;INDF;PL;PRS;V ACC;N;PL DEF;DET 3;NOM;PRO;SG ADJ;NOM;SG ADJ;CMPR;NOM;SG DAT;N;SG _
aki , ahogy eloltották a világháború lángjait , hazajött magyarországra .	aki , ahogy el+olt a világháború láng , haza+jön magyarország .	3;NOM;PRO;PSSD;SG _ ADV 3;ACT;DEF;FIN;IND;PL;PST;V DEF;DET N;NOM;PSSD;SG ACC;N;PL;PSS3S _ 3;ACT;FIN;IND;INDF;PST;SG;V ON+ALL;PROPN;PSSD;SG _
itt minden megtörténhet egy az egyben , még az is , hogy tarzan beszélget az állatokkal , hogy úgy mozog , mint ők , akiktől a dzsungelélet minden fortélyát el kellett tanulnia az életben maradáshoz .	itt minden meg+történik egy az egy , még az is , hogy tarzan beszélget az állat , hogy úgy mozog , mint ők , aki a dzsungelélet minden fortély el kell tanul az élet maradás .	ADV 3;NOM;PRO;PSSD;SG 3;ACT;FIN;INDF;POT;PRS;SG;V NOM;NUM;PSSD;SG DEF;DET IN+ESS;NUM;PSSD;SG _ ADV 3;NOM;PRO;PSSD;SG CONJ _ CONJ NOM;PROPN;PSSD;SG 3;ACT;FIN;IND;INDF;PRS;SG;V DEF;DET INS;N;PL;PSSD _ CONJ ADV 3;ACT;FIN;IND;INDF;PRS;SG;V _ CONJ 3;NOM;PL;PRO;PSSD _ 3;AT+ABL;PL;PRO;PSSD DEF;DET N;NOM;PSSD;SG DET;INDF ACC;N;PSS3S;SG ADV 3;ACT;FIN;IND;INDF;PST;SG;V 3;ACT;NFIN;SG;V DEF;DET IN+ESS;N;PSSD;SG AT+ALL;N;PSSD;SG _
hogy hat éven át tovább vívja borban megkezdett csatáját .	hogy hat év át tovább vív bor megkezdett csata .	CONJ NOM;NUM;PSSD;SG N;ON+ESS;PSSD;SG ADP ADV 3;ACT;DEF;FIN;IMP;PRS;SG;V IN+ESS;PROPN;PSSD;SG ADJ;NOM;PSSD;SG ACC;N;PSS3S;SG _
decemberben , a kolozsváriak tervezett vígszínház-beli vendégjátékán erről a budapesti közönség is megbizonyosodhat , amikor is majd shakespeare troilus és cressidájának teiresziászaként láthatjuk őt a magyar fővárosban .	december , a kolozsvári tervezett vígszínházbeli vendégjáték ez a budapesti közönség is meg+bizonyosodik , amikor is majd shakespeare troilus és cressida teiresziász lát ő a magyar főváros .	IN+ESS;N;PSSD;SG _ DEF;DET N;NOM;PL;PSSD ADJ;NOM;PSSD;SG ADJ;NOM;PSSD;SG N;ON+ESS;PSS3S;SG 3;PRO;PSSD;SG DEF;DET ADJ;NOM;PSSD;SG N;NOM;PSSD;SG CONJ 3;ACT;FIN;INDF;POT;PRS;SG;V _ ADV CONJ ADV NOM;PROPN;PSSD;SG NOM;PROPN;PSSD;SG NOM;PROPN;PSSD;SG GEN;PROPN;PSS3S;SG ABS;PROPN;PSS3S;SG 1;ACT;DEF;FIN;PL;POT;PRS;V 3;ACC;PRO;PSSD;SG DEF;DET ADJ;NOM;PSSD;SG IN+ESS;N;PSSD;SG _
a magyar fővárosban december 8-án a néprajzi múzeumban kerül sor az album 1-től 10-ig sorszámozott példányainak az aukciójára , míg bécsben várhatóan a jövő év februárjában rendezik meg a licitet .	a magyar főváros december 8. a néprajzi múzeum kerül sor az album 1 10 sorszámozott példány az aukció , míg bécs várható a jövő év február rendez meg a licit .	DEF;DET ADJ;NOM;PSSD;SG IN+ESS;N;PSSD;SG N;NOM;PSSD;SG N;ON+ESS;PSS3S;SG DEF;DET NOM;PROPN;PSSD;SG IN+ESS;PROPN;PSSD;SG 3;ACT;FIN;IND;INDF;PRS;SG;V N;NOM;PSSD;SG DEF;DET N;NOM;PSSD;SG AT+ABL;NUM;PSSD;SG NUM;PSSD;SG ADJ;NOM;PSSD;SG GEN;N;PL;PSS3S DEF;DET N;ON+ALL;PSS3S;SG _ ADV IN+ESS;PROPN;PSSD;SG ADJ;FRML;PSSD;SG DEF;DET ADJ;NOM;PSSD;SG N;NOM;PSSD;SG IN+ESS;N;PSS3S;SG 3;ACT;DEF;FIN;IND;PL;PRS;V PART DEF;DET ACC;N;PSSD;SG _
— többször dolgozott együtt az amadinda együttessel , számos darabjában kapnak fontos szerepet az ütőhangszerek ...	— több dolgozik együtt az amadinda együttes , számos darab kap fontos szerep az ütőhangszer ...	_ ADV 3;ACT;FIN;IND;INDF;PST;SG;V ADV DEF;DET NOM;PROPN;PSSD;SG INS;N;PSSD;SG _ DET;INDF IN+ESS;N;PSS3S;SG 3;ACT;FIN;IND;INDF;PL;PRS;V ADJ;NOM;PSSD;SG ACC;N;PSSD;SG DEF;DET N;NOM;PL;PSSD _
a szergej sztyepasin vezette kormány ugyanis bejelentette azt a szándékát , hogy négy helyett öt képviselőt delegál a gazprom 11 fős igazgatótanácsába , amelynek élére egyébként a júniusi közgyűlés után viktor csernomirgyin exkormányfő , a cég alapítója s az azt operatívan irányító igazgatóság jelenlegi elnöke , rem vjahirev elődje került .	a szergej sztyepasin vezette kormány ugyanis bejelent az a szándék , hogy négy helyett öt képviselő delegál a gazprom 11 fős igazgatótanács , amely él egyébként a júniusi közgyűlés után viktor csernomirgyin exkormányfő , a cég alapító s az az operatív irányító igazgatóság jelenlegi elnök , rem vjahirev előd kerül .	DEF;DET NOM;PROPN;SG NOM;PROPN;SG ADJ;NOM;SG N;NOM;SG CONJ 3;ACT;DEF;FIN;IND;PST;SG;V 3;ACC;PRO;SG DEF;DET ACC;N;PSS3S;SG _ CONJ NOM;NUM;SG ADP NOM;NUM;SG ACC;N;SG 3;ACT;FIN;IND;INDF;PRS;SG;V DEF;DET NOM;PROPN;SG NOM;NUM;SG ADJ;NOM;SG IN+ALL;N;PSS3S;SG _ 3;GEN;PRO;SG N;ON+ALL;PSS3S;SG ADV DEF;DET ADJ;NOM;SG N;NOM;SG ADP NOM;PROPN;SG NOM;PROPN;SG N;NOM;SG _ DEF;DET N;NOM;SG N;NOM;PSS3S;SG CONJ DEF;DET 3;ACC;PRO;SG ADJ;FRML;SG ADJ;NOM;SG N;NOM;SG ADJ;NOM;SG N;NOM;PSS3S;SG _ NOM;PROPN;SG NOM;PROPN;SG N;NOM;PSS3S;SG 3;ACT;FIN;IND;INDF;PST;SG;V _
