pelagéját mindazonáltal kedvelte , jóllehet , nem is ő , hanem rankovic mutatott férfiúi érzelmeket iránta , de hát ezt hogyan közölje a haragvó poszeidonnal ?	pelagéja mindazonáltal kedvel , jóllehet , nem is ő , hanem rankovic mutat férfiúi érzelem iránt , de hát ez hogyan közöl a haragvó poszeidon ?	ACC;PROPN;PSSD;SG CONJ 3;ACT;DEF;FIN;IND;PST;SG;V _ CONJ _ ADV ADV 3;NOM;PRO;PSSD;SG _ CONJ NOM;PROPN;PSSD;SG 3;ACT;FIN;IND;INDF;PST;SG;V ADJ;NOM;PSSD;SG ACC;N;PL;PSSD 3;NOM;PRO;PSSD;SG _ CONJ ADV 3;ACC;PRO;PSSD;SG ADV 3;ACT;DEF;FIN;IMP;PRS;SG;V DEF;DET ADJ;NOM;PSSD;SG INS;PROPN;PSSD;SG _
a horvát alkotmányban csak a tartós akadályoztatás fogalmát rögzítették , amely az államfő helyettesítésének esetére kötelezően előírta új elnökválasztás kiírását is .	a horvát alkotmány csak a tartós akadályoztatás fogalom rögzít , amely az államfő helyettesítés eset kötelező elő+ír új elnökválasztás kiírás is .	DEF;DET ADJ;NOM;PSSD;SG IN+ESS;N;PSSD;SG ADV DEF;DET ADJ;NOM;PSSD;SG N;NOM;PSSD;SG ACC;N;PSS3S;SG 3;ACT;DEF;FIN;IND;PL;PST;V _ 3;NOM;PRO;PSSD;SG DEF;DET N;NOM;PSSD;SG GEN;N;PSS3S;SG N;ON+ALL;PSS3S;SG ADJ;FRML;PSSD;SG 3;ACT;DEF;FIN;IND;PST;SG;V ADJ;NOM;PSSD;SG N;NOM;PSSD;SG ACC;N;PSS3S;SG CONJ _
az eladásra szánt vállalatok között szerepel továbbá a nemzeti légitársaság , a türk hava yollari — amelynek 30 százalékát kínálják fel — és a türk telekom is , amelynek privatizálásából 5,3 milliárd dollárt várnak .	az eladás szánt vállalat között szerepel továbbá a nemzeti légitársaság , a türk hava yollari — amely 30 százalék kínál fel — és a türk telekom is , amely privatizálás 5,3 milliárd dollár vár .	DEF;DET N;ON+ALL;SG ADJ;NOM;SG N;NOM;PL ADP 3;ACT;FIN;IND;INDF;PRS;SG;V ADV DEF;DET ADJ;NOM;SG N;NOM;SG _ DEF;DET NOM;PROPN;SG NOM;PROPN;SG NOM;PROPN;SG _ 3;GEN;PRO;SG NOM;NUM;SG ACC;N;PSS3S;SG 3;ACT;DEF;FIN;IND;PL;PRS;V ADV _ CONJ DEF;DET NOM;PROPN;SG NOM;PROPN;SG CONJ _ 3;GEN;PRO;SG IN+ABL;N;PSS3S;SG NOM;NUM;SG NOM;NUM;SG ACC;N;SG 3;ACT;FIN;IND;INDF;PL;PRS;V _
— ez alatt a fél évszázad alatt szinte az egész baritonrepertoárt elénekelte , egyedül wagner darabjaiban nem lépett színpadra .	— ez alatt a fél évszázad alatt szinte az egész baritonrepertoár el+énekel , egyedül wagner darab nem lép színpad .	_ 3;DET;NOM;PSSD;SG ADP DEF;DET NOM;NUM;PSSD;SG N;NOM;PSSD;SG ADP ADV DEF;DET ADJ;NOM;PSSD;SG ACC;N;PSSD;SG 3;ACT;DEF;FIN;IND;PST;SG;V _ ADV NOM;PROPN;PSSD;SG IN+ESS;N;PL;PSS3S ADV 3;ACT;FIN;IND;INDF;PST;SG;V N;ON+ALL;PSSD;SG _
a 2000. évi költségvetés tervezete nem az szja helyben maradó részét csökkentené , hanem a szabadon felhasználható részt — reagált az elmondottakra sió lászló , az oktatási minisztérium kabinetfőnöke .	a 2000. évi költségvetés tervezet nem az szja hely maradó rész csökkent , hanem a szabad felhasználható rész — reagál az elmondott sió lászló , az oktatási minisztérium kabinetfőnök .	DEF;DET ADJ;NOM;PSSD;SG ADJ;NOM;PSSD;SG N;NOM;PSSD;SG N;NOM;PSS3S;SG ADV DEF;DET N;NOM;PSSD;SG IN+ESS;N;PSSD;SG ADJ;NOM;PSSD;SG ACC;N;PSS3S;SG 3;ACT;COND;DEF;FIN;PRS;SG;V _ CONJ DEF;DET ADJ;FRML;PSSD;SG ADJ;NOM;PSSD;SG ACC;N;PSSD;SG _ 3;ACT;FIN;IND;INDF;PST;SG;V DEF;DET ADJ;ON+ALL;PL;PSSD NOM;PROPN;PSSD;SG NOM;PROPN;PSSD;SG _ DEF;DET NOM;PROPN;PSSD;SG NOM;PROPN;PSSD;SG N;NOM;PSS3S;SG _
a daewoo-átalakítás ugyanis a többfordulós tárgyalások alatt a vártnál és a szükségesnél jóval kevésbé fájdalmasra sikeredett , ugyanakkor a jelenleg is elnöklő cégalapító , kim vu csong nagy mestere a politikai és gazdasági útvesztőkből való kilábalásnak .	a daewoo-átalakítás ugyanis a többfordulós tárgyalás alatt a várt és a szükséges jóval kevésbé fájdalmas sikeredik , ugyanakkor a jelenleg is elnöklő cégalapító , kim vu csong nagy mester a politikai és gazdasági útvesztő való kilábalás .	DEF;DET N;NOM;SG CONJ DEF;DET ADJ;NOM;SG N;NOM;PL ADP DEF;DET ADJ;AT+ESS;SG CONJ DEF;DET ADJ;AT+ESS;SG ADV ADV;CMPR ADJ;ON+ALL;SG 3;ACT;FIN;IND;INDF;PST;SG;V _ ADV DEF;DET ADV CONJ ADJ;NOM;SG N;NOM;SG _ NOM;PROPN;SG NOM;PROPN;SG NOM;PROPN;SG ADJ;NOM;SG N;NOM;PSS3S;SG DEF;DET ADJ;NOM;SG CONJ ADJ;NOM;SG IN+ABL;N;PL ADJ;NOM;SG GEN;N;SG _
jelcin környezete régóta szeretne megszabadulni vjahirevtől , akinek túlságos önállósága és a jurij luzskov moszkvai polgármesterhez fűződő jó viszonya a választások közeledtével egyre kétségesebbé teszi , hogy vajon a kormányzat a kampány során bele tud -e nyúlni a gazprom kasszájába .	jelcin környezet régóta szeret megszabadul vjahirev , aki túlságos önállóság és a jurij luzskov moszkvai polgármester fűződő jó viszony a választás közeledte egyre kétséges tesz , hogy vajon a kormányzat a kampány sor bele tud -e nyúl a gazprom kassza .	NOM;PROPN;SG N;NOM;PSS3S;SG ADV 3;ACT;COND;FIN;INDF;PRS;SG;V ACT;NFIN;V AT+ABL;PROPN;SG _ 3;GEN;PRO;SG ADJ;NOM;SG N;NOM;PSS3S;SG CONJ DEF;DET NOM;PROPN;SG NOM;PROPN;SG ADJ;NOM;SG AT+ALL;N;SG ADJ;NOM;SG ADJ;NOM;SG N;NOM;PSS3S;SG DEF;DET N;NOM;PL INS;N;PSS3S;SG ADV ADJ;CMPR;SG;TRANS 3;ACT;DEF;FIN;IND;PRS;SG;V _ CONJ ADV DEF;DET N;NOM;SG DEF;DET N;NOM;SG N;ON+ESS;PSS3S;SG 3;IN+ALL;PRO;SG 3;ACT;FIN;IND;INDF;PRS;SG;V ADV ACT;NFIN;V DEF;DET NOM;PROPN;SG IN+ALL;N;PSS3S;SG _
hiszen már szeptemberben , sőt a nato-bombázások idején tudni lehetett : a szétlőtt finomítók egyhamar nem fognak teljes kapacitással működni , a tél viszont legalább olyan pontosan megérkezik , mint az újvidéki olajtartályokra a lézerirányítású bomba .	hiszen már szeptember , sőt a nato-bombázás idő tud lehet : a szétlőtt finomító egyhamar nem fog teljes kapacitás működik , a tél viszont legalább olyan pontos megérkezik , mint az újvidéki olajtartály a lézerirányítású bomba .	CONJ ADV IN+ESS;N;PSSD;SG _ CONJ DEF;DET N;NOM;PL;PSSD N;ON+ESS;PSS3S;SG ACT;NFIN;V 3;ACT;FIN;IND;INDF;PST;SG;V _ DEF;DET ADJ;NOM;PSSD;SG N;NOM;PL;PSSD ADV ADV 3;ACT;IND;INDF;PL;PRS;V ADJ;NOM;PSSD;SG INS;N;PSSD;SG ACT;NFIN;V _ DEF;DET N;NOM;PSSD;SG CONJ ADV ADV ADJ;FRML;PSSD;SG 3;ACT;FIN;IND;INDF;PRS;SG;V _ CONJ DEF;DET ADJ;NOM;PSSD;SG N;ON+ALL;PL;PSSD DEF;DET ADJ;NOM;PSSD;SG N;NOM;PSSD;SG _
de kaptam felkérést a budapesti csellóegyüttestől és egy férfi-énekszextettől is , úgyhogy szerencsére bőven el vagyok látva feladatokkal .	de kap felkérés a budapesti csellóegyüttes és egy férfi-énekszextett is , úgyhogy szerencsére bő el van látva feladat .	CONJ 1;ACT;FIN;IND;INDF;PST;SG;V ACC;N;PSSD;SG DEF;DET NOM;PROPN;PSSD;SG AT+ABL;PROPN;PSSD;SG CONJ DET;INDF AT+ABL;N;PSSD;SG CONJ _ CONJ ADV ADJ;FRML;PSSD;SG ADV 1;ACT;FIN;IND;INDF;PRS;SG;V ADV;V.CVB INS;N;PL;PSSD _
mindazonáltal az egyik nawa-tulajdonos , nádasdi istván volt az alapítója annak a zefirus-csoportnak , amely a nyírfa néven elhíresült megfigyelési akció egyik célpontja volt .	mindazonáltal az egyik nawa-tulajdonos , nádasdi istván van az alapító az a zefirus-csoport , amely a nyírfa név elhíresült megfigyelési akció egyik célpont van .	CONJ DEF;DET 3;NOM;PRO;SG N;NOM;SG _ NOM;PROPN;SG NOM;PROPN;SG 3;ACT;FIN;IND;INDF;PST;SG;V DEF;DET N;NOM;PSS3S;SG 3;GEN;PRO;SG DEF;DET GEN;N;SG _ 3;NOM;PRO;SG DEF;DET NOM;PROPN;SG N;ON+ESS;SG ADJ;NOM;SG ADJ;NOM;SG N;NOM;SG 3;NOM;PRO;SG N;NOM;PSS3S;SG 3;ACT;FIN;IND;INDF;PST;SG;V _
a közbeszéd szavai az évek során egyre csak torzultak , egyre értelmetlenebbé váltak , az értelmes közlés útján álló torlaszokat képeztek .	a közbeszéd szó az év sor egyre csak torzul , egyre értelmetlen válik , az értelmes közlés út álló torlasz képez .	DEF;DET N;NOM;PSSD;SG N;NOM;PL;PSS3S DEF;DET N;NOM;PL;PSSD N;ON+ESS;PSS3S;SG ADV ADV 3;ACT;FIN;IND;INDF;PL;PST;V _ ADV ADJ;CMPR;PSSD;SG;TRANS 3;ACT;FIN;IND;INDF;PL;PST;V _ DEF;DET ADJ;NOM;PSSD;SG N;NOM;PSSD;SG N;ON+ESS;PSS3S;SG ADJ;NOM;PSSD;SG ACC;N;PL;PSSD 3;ACT;FIN;IND;INDF;PL;PST;V _
mint mondta , utanként 30 ezer dollárt kapott , amit azután azonnal sao paulo egyik legszegényebb peremvárosi óvodájának adott .	mint mond , út 30 ezer dollár kap , ami azután azonnal sao paulo egyik szegény peremvárosi óvoda ad .	ADV 3;ACT;DEF;FIN;IND;PST;SG;V _ DIST;N;PSSD;SG NOM;NUM;PSSD;SG NOM;NUM;PSSD;SG ACC;N;PSSD;SG 3;ACT;FIN;IND;INDF;PST;SG;V _ 3;ACC;PRO;PSSD;SG ADV ADV NOM;PROPN;PSSD;SG NOM;PROPN;PSSD;SG DEF;DET ADJ;NOM;PSSD;RL;SG ADJ;NOM;PSSD;SG DAT;N;PSS3S;SG 3;ACT;FIN;IND;INDF;PST;SG;V _
közöttük is első helyen említik a szakértők a politikai nyomásra évtizedeken át puha hiteleket nyújtó bankszektor átalakítását .	közötte is első hely említ a szakértő a politikai nyomás évtized át puha hitel nyújtó bankszektor átalakítás .	3;NOM;PL;PRO CONJ ADJ;NOM;SG N;ON+ESS;SG 3;ACT;DEF;FIN;IND;PL;PRS;V DEF;DET N;NOM;PL DEF;DET ADJ;NOM;SG N;ON+ALL;SG N;ON+ESS;PL ADP ADJ;NOM;SG ACC;N;PL ADJ;NOM;SG N;NOM;SG ACC;N;PSS3S;SG _
a német bajnokságban a végeredmény szempontjából döntőnek bizonyult az ötödik fordulóban játszott hübner-hickl-összecsapás .	a német bajnokság a végeredmény szempont döntő bizonyul az ötödik forduló játszott hübner-hickl-összecsapás .	DEF;DET ADJ;NOM;PSSD;SG IN+ESS;N;PSSD;SG DEF;DET N;NOM;PSSD;SG IN+ABL;N;PSS3S;SG ADJ;DAT;PSSD;SG 3;ACT;FIN;IND;INDF;PST;SG;V DEF;DET ADJ;NOM;PSSD;SG IN+ESS;N;PSSD;SG ADJ;NOM;PSSD;SG N;NOM;PSSD;SG _
ha már így esett , és nem mond le , legalább annyit megtehetne a magánbűnbe süppedt közszereplő , hogy megköveti feljelentettjeit .	ha már így esik , és nem mond le , legalább annyi meg+tesz a magánbűn süppedt közszereplő , hogy meg+követ feljelentett .	CONJ ADV ADV 3;ACT;FIN;IND;INDF;PST;SG;V _ CONJ ADV 3;ACT;FIN;IND;INDF;PRS;SG;V ADV _ ADV 3;ACC;PRO;PSSD;SG 3;ACT;FIN;INDF;PRS;SG;V;{COND/POT} DEF;DET N;NOM;PSSD;SG ADJ;NOM;PSSD;SG N;NOM;PSSD;SG _ CONJ 3;ACT;DEF;FIN;IND;PRS;SG;V ACC;ADJ;PL;PSS3S _
a siófoki hotel albatroszt , amely korábban az ybl bankot csődbe vivő hepta-csoporté volt , most a reichardt család restaro kft. nevű cége , illetve a kovács tiborné vezette s az ő kisebbségi tulajdonában álló international gaming promotion kereskedelmi kft. jegyzi .	a siófoki hotel albatrosz , amely korán az ybl bank csőd vivő hepta-csoport van , most a reichardt család restaro kft. nevű cég , illetve a kovács tiborné vezette s az ő kisebbségi tulajdon álló international gaming promotion kereskedelmi kft. jegyez .	DEF;DET ADJ;NOM;SG NOM;PROPN;SG ACC;PROPN;SG _ 3;NOM;PRO;SG ADV;CMPR DEF;DET NOM;PROPN;SG ACC;PROPN;SG IN+ALL;N;SG ADJ;NOM;SG N;NOM;SG 3;ACT;FIN;IND;INDF;PST;SG;V _ ADV DEF;DET NOM;PROPN;SG N;NOM;SG NOM;PROPN;SG NOM;PROPN;SG ADJ;NOM;SG N;NOM;PSS3S;SG _ CONJ DEF;DET NOM;PROPN;SG NOM;PROPN;SG ADJ;NOM;SG CONJ DEF;DET 3;NOM;PRO;SG ADJ;NOM;SG IN+ESS;N;PSS3S;SG ADJ;NOM;SG NOM;PROPN;SG NOM;PROPN;SG NOM;PROPN;SG NOM;PROPN;SG NOM;PROPN;SG 3;ACT;DEF;FIN;IND;PRS;SG;V _
a szombathelyiek 30 éves versenyzője tudvalevőleg a legjobb szakítók közé tartozik , nyert már vb-ezüstöt , tehát okkal-joggal várt a pódiumra lépés előtt edzője , antalovits ferenc és ő maga is dobogós helyezést , de aranyra egyikőjük sem gondolt .	a szombathelyi 30 éves versenyző tudvalevő a jó szakító közé tartozik , nyer már vb-ezüst , tehát ok-jog vár a pódium lépés előtt edző , antalovits ferenc és ő maga is dobogós helyezés , de arany egyik sem gondol .	DEF;DET N;NOM;PL;PSSD NOM;NUM;PSSD;SG ADJ;NOM;PSSD;SG N;NOM;PSS3S;SG ADJ;FRML;PSSD;SG DEF;DET ADJ;NOM;PSSD;RL;SG ADJ;NOM;PL;PSSD ADP 3;ACT;FIN;IND;INDF;PRS;SG;V _ 3;ACT;FIN;IND;INDF;PST;SG;V ADV ACC;N;PSSD;SG _ CONJ INS;N;PSSD;SG 3;ACT;FIN;IND;INDF;PST;SG;V DEF;DET N;ON+ALL;PSSD;SG N;NOM;PSSD;SG ADP N;NOM;PSS3S;SG _ NOM;PROPN;PSSD;SG NOM;PROPN;PSSD;SG CONJ 3;NOM;PRO;PSSD;SG 3;NOM;PRO;PSSD;SG CONJ ADJ;NOM;PSSD;SG ACC;N;PSSD;SG _ CONJ N;ON+ALL;PSSD;SG 3;NOM;PRO;PSSD;SG ADV 3;ACT;FIN;IND;INDF;PST;SG;V _
a spanyol csapat hazája bajnokságában megverte a barcelonát , a deportivót és a real madridot , s mégis csak 14. !	a spanyol csapat haza bajnokság megver a barcelona , a deportivo és a real madrid , s mégis csak 14. !	DEF;DET ADJ;NOM;PSSD;SG N;NOM;PSSD;SG N;NOM;PSS3S;SG IN+ESS;N;PSS3S;SG 3;ACT;DEF;FIN;IND;PST;SG;V DEF;DET ACC;PROPN;PSSD;SG _ DEF;DET ACC;PROPN;PSSD;SG CONJ DEF;DET NOM;PROPN;PSSD;SG ACC;PROPN;PSSD;SG _ CONJ ADV ADV ADJ;NOM;PSSD;SG _
a javaslat értelmében a nyersolaj után tonnánként az év elején bevezetett illeték dupláját , azaz 10 eurót kell kifizetnie az exportőröknek .	a javaslat értelem a nyersolaj után tonna az év eleje bevezetett illeték dupla , azaz 10 euró kell kifizet az exportőr .	DEF;DET N;NOM;SG IN+ESS;N;PSS3S;SG DEF;DET N;NOM;SG ADP DIST;N;SG DEF;DET N;NOM;SG N;ON+ESS;PSS3S;SG ADJ;NOM;SG N;NOM;SG ACC;N;PSS3S;SG _ CONJ NOM;NUM;SG ACC;N;SG 3;ACT;FIN;IND;INDF;PRS;SG;V 3;ACT;NFIN;PRS;SG;V DEF;DET DAT;N;PL _
a világpiacon mértékadónak tekintett északi-tengeri brent típusú olaj hordónkénti ára az év elején jegyzett tíz dollár körüli árról mostanra 25 dollár fölé emelkedett , és egyes számítások szerint a jövő év első hónapjaira akár hordónkénti 30 dollárra is felmehet az ára .	a világpiac mértékadó tekintett északi-tengeri brent típusú olaj hordónkénti ár az év eleje jegyzett tíz dollár körüli ár mostanra 25 dollár fölé emelkedik , és egyes számítás szerint a jövő év első hónap akár hordónkénti 30 dollár is fel+megy az ár .	DEF;DET N;ON+ESS;PSSD;SG ADJ;DAT;PSSD;SG ADJ;NOM;PSSD;SG ADJ;NOM;PSSD;SG NOM;PROPN;PSSD;SG ADJ;NOM;PSSD;SG N;NOM;PSSD;SG ADJ;NOM;PSSD;SG N;NOM;PSS3S;SG DEF;DET N;NOM;PSSD;SG N;ON+ESS;PSS3S;SG ADJ;NOM;PSSD;SG NOM;NUM;PSSD;SG N;NOM;PSSD;SG ADJ;NOM;PSSD;SG N;PSSD;SG ADV NOM;NUM;PSSD;SG N;NOM;PSSD;SG ADP 3;ACT;FIN;IND;INDF;PST;SG;V _ CONJ ADJ;NOM;PSSD;SG N;NOM;PL;PSSD ADP DEF;DET ADJ;NOM;PSSD;SG N;NOM;PSSD;SG ADJ;NOM;PSSD;SG N;ON+ALL;PL;PSS3S ADV ADJ;NOM;PSSD;SG NOM;NUM;PSSD;SG N;ON+ALL;PSSD;SG CONJ 3;ACT;FIN;INDF;POT;PRS;SG;V DEF;DET N;NOM;PSS3S;SG _
a kiadványban a két város hasonlóságát és különbözőségét két alkotópáros mutatja be : bécset hernádi gyula író és szebeni andrás fotóművész láttatja magyar szemmel , míg budapestről gerhard tötschinger osztrák író-rendező mondja el a véleményét , s az immár 43 éve az osztrák fővárosban élő kalmár jános fotóművész fedezi fel a maga és az olvasók számára .	a kiadvány a két város hasonlóság és különbözőség két alkotópáros mutat be : bécs hernádi gyula író és szebeni andrás fotóművész lát magyar szem , míg budapest gerhard tötschinger osztrák író-rendező mond el a vélemény , s az immár 43 év az osztrák főváros élő kalmár jános fotóművész fedez fel a maga és az olvasó számára .	DEF;DET IN+ESS;N;PSSD;SG DEF;DET NOM;NUM;PSSD;SG N;NOM;PSSD;SG ACC;N;PSS3S;SG CONJ ACC;N;PSS3S;SG NOM;NUM;PSSD;SG N;NOM;PSSD;SG 3;ACT;DEF;FIN;IND;PRS;SG;V ADV _ ACC;PROPN;PSSD;SG NOM;PROPN;PSSD;SG NOM;PROPN;PSSD;SG N;NOM;PSSD;SG CONJ NOM;PROPN;PSSD;SG NOM;PROPN;PSSD;SG N;NOM;PSSD;SG 3;CAUS;DEF;FIN;IND;PRS;SG;V ADJ;NOM;PSSD;SG INS;N;PSSD;SG _ ADV PROPN;PSSD;SG NOM;PROPN;PSSD;SG NOM;PROPN;PSSD;SG ADJ;NOM;PSSD;SG N;NOM;PSSD;SG 3;ACT;DEF;FIN;IND;PRS;SG;V ADV DEF;DET ACC;N;PSS3S;SG _ CONJ DEF;DET ADV NOM;NUM;PSSD;SG N;NOM;PSS3S;SG DEF;DET ADJ;NOM;PSSD;SG IN+ESS;N;PSSD;SG ADJ;NOM;PSSD;SG NOM;PROPN;PSSD;SG NOM;PROPN;PSSD;SG N;NOM;PSSD;SG 3;ACT;DEF;FIN;IND;PRS;SG;V ADV DEF;DET 3;NOM;PRO;PSSD;SG CONJ DEF;DET N;NOM;PL;PSSD ADP _
az ensz francia koszovói különmegbízottja ismét felszólított a koszovói nemzetközi rendőrség létszámának növelésére .	az ensz francia koszovói különmegbízott ismét fel+szólít a koszovói nemzetközi rendőrség létszám növelés .	DEF;DET NOM;PROPN;PSSD;SG ADJ;NOM;PSSD;SG ADJ;NOM;PSSD;SG N;NOM;PSS3S;SG ADV 3;ACT;FIN;IND;INDF;PST;SG;V DEF;DET ADJ;NOM;PSSD;SG ADJ;NOM;PSSD;SG N;NOM;PSSD;SG GEN;N;PSS3S;SG N;ON+ALL;PSS3S;SG _
annak illusztrálására , hogy az új ülésezési rend " semmiféle fennakadást nem okozott " a parlament működésében , áder jános házelnök június végén bejelentette : a képviselők egy év alatt 137 törvényt fogadtak el a négy évvel korábbi 123 helyett .	az illusztrálás , hogy az új ülésezési rend " semmiféle fennakadás nem okoz " a parlament működés , áder jános házelnök június vég bejelent : a képviselő egy év alatt 137 törvény fogad el a négy év korábbi 123 helyett .	3;GEN;PRO;SG N;ON+ALL;PSS3S;SG _ CONJ DEF;DET ADJ;NOM;SG ADJ;NOM;SG N;NOM;SG _ 3;NOM;PRO;SG ACC;N;SG ADV 3;ACT;FIN;IND;INDF;PST;SG;V _ DEF;DET N;NOM;SG IN+ESS;N;PSS3S;SG _ NOM;PROPN;SG NOM;PROPN;SG N;NOM;SG N;NOM;SG N;ON+ESS;PSS3S;SG 3;ACT;DEF;FIN;IND;PST;SG;V _ DEF;DET N;NOM;PL NOM;NUM;SG N;NOM;SG ADP NOM;NUM;SG ACC;N;SG 3;ACT;FIN;IND;INDF;PL;PST;V ADV DEF;DET NOM;NUM;SG INS;N;SG ADJ;CMPR;NOM;SG NOM;NUM;SG ADP _
újabb csapást jelentett az is , hogy a hazai élelmiszer-fogyasztás alaposan lecsökkent .	új csapás jelent az is , hogy a hazai élelmiszer-fogyasztás alapos le+csökken .	ADJ;CMPR;NOM;PSSD;SG ACC;N;PSSD;SG 3;ACT;FIN;IND;INDF;PST;SG;V 3;NOM;PRO;PSSD;SG CONJ _ CONJ DEF;DET ADJ;NOM;PSSD;SG N;NOM;PSSD;SG ADJ;FRML;PSSD;SG 3;ACT;FIN;IND;INDF;PST;SG;V _
a magyar együttes 12-3-as , 19-7-es szériával kezdett , a félidőben 38-23 volt — ide .	a magyar együttes 12-3-as , 19-7-es széria kezd , a félidő 38-23 van — ide .	DEF;DET ADJ;NOM;PSSD;SG N;NOM;PSSD;SG ADJ;NOM;PSSD;SG _ ADJ;NOM;PSSD;SG INS;N;PSSD;SG 3;ACT;FIN;IND;INDF;PST;SG;V _ DEF;DET IN+ESS;N;PSSD;SG N;NOM;PSSD;SG 3;ACT;FIN;IND;INDF;PST;SG;V _ ADV _
a mentők , a tűzoltók és a rendőrség hagyományos , ingyenes , 104 ; 105 ; 107 számú - illetve a nemrég bevezetett 112-es segélyhívó központjai , ha átmenetileg valamennyi kezelőjük , diszpécserük foglalt , automatikusan sorrendbe állítják a várakozó hívásokat , aki tehát a gépi fogadószöveg hallatán nem vár , hanem türelmetlenül újra tárcsáz , ismételten a sor végére kerül .	a mentő , a tűzoltó és a rendőrség hagyományos , ingyenes , 104 ; 105 ; 107 számú - illetve a nemrég bevezetett 112-es segélyhívó központ , ha átmeneti valamennyi kezelő , diszpécser foglalt , automatikus sorrend állít a várakozó hívás , aki tehát a gépi fogadószöveg hallata nem vár , hanem türelmetlen újra tárcsáz , ismételt a sor vég kerül .	DEF;DET N;NOM;PL;PSSD _ DEF;DET N;NOM;PL;PSSD CONJ DEF;DET N;NOM;PSSD;SG ADJ;NOM;PSSD;SG _ ADJ;NOM;PSSD;SG _ NOM;NUM;PSSD;SG _ NOM;NUM;PSSD;SG _ NOM;NUM;PSSD;SG ADJ;NOM;PSSD;SG _ CONJ DEF;DET ADV ADJ;NOM;PSSD;SG ADJ;NOM;PSSD;SG ADJ;NOM;PSSD;SG N;NOM;PL;PSS3S _ CONJ ADJ;FRML;PSSD;SG DEF;DET N;NOM;PSS3P;SG _ N;NOM;PSS3P;SG ADJ;NOM;PSSD;SG _ ADJ;FRML;PSSD;SG IN+ALL;N;PSSD;SG 3;ACT;DEF;FIN;IND;PL;PRS;V DEF;DET ADJ;NOM;PSSD;SG ACC;N;PL;PSSD _ 3;NOM;PRO;PSSD;SG CONJ DEF;DET ADJ;NOM;PSSD;SG N;NOM;PSSD;SG N;ON+ESS;PSSD;SG ADV 3;ACT;FIN;IND;INDF;PRS;SG;V _ CONJ ADJ;FRML;PSSD;SG ADV 3;ACT;FIN;IND;INDF;PRS;SG;V _ ADJ;FRML;PSSD;SG DEF;DET N;NOM;PSSD;SG N;ON+ALL;PSS3S;SG 3;ACT;FIN;IND;INDF;PRS;SG;V _
a 6-os úton keletkezett torlódás miatt bizonytalan időre lezárták a dunaföldvári hidat .	a 6-os út keletkezett torlódás miatt bizonytalan idő le+zár a dunaföldvári híd .	DEF;DET ADJ;NOM;PSSD;SG N;ON+ESS;PSSD;SG ADJ;NOM;PSSD;SG N;NOM;PSSD;SG ADP ADJ;NOM;PSSD;SG N;ON+ALL;PSSD;SG 3;ACT;DEF;FIN;IND;PL;PST;V DEF;DET ADJ;NOM;PSSD;SG ACC;N;PSSD;SG _
ezért alexander dubcek halála körülményeinek tisztázására perújrafelvételt kezdeményeznek .	ezért alexander dubcek halál körülmény tisztázás perújrafelvétel kezdeményez .	ADV NOM;PROPN;PSSD;SG NOM;PROPN;PSSD;SG N;NOM;PSS3S;SG GEN;N;PL;PSS3S N;ON+ALL;PSS3S;SG ACC;N;PSSD;SG 3;ACT;FIN;IND;INDF;PL;PRS;V _
a levél írója figyelemre méltóan asszimilálódott a fideszes newspeak szabályaihoz .	a levél író figyelem méltó asszimilálódik a fideszes newspeak szabály .	DEF;DET N;NOM;PSSD;SG N;NOM;PSS3S;SG N;ON+ALL;PSSD;SG ADJ;FRML;PSSD;SG 3;ACT;FIN;IND;INDF;PST;SG;V DEF;DET ADJ;NOM;PSSD;SG _ AT+ALL;N;PL;PSS3S _
jóllehet hasonló terveket már korábban is hangoztatott , az elnök szavainak ezúttal az adott nyomatékot , hogy két héttel korábban kormánya nem volt hajlandó mentőövet dobni a második legnagyobb hazai chaebolnak , az eladósodott daewoonak , amelynek a feldarabolása már meg is kezdődött ( hvg , 1999. augusztus 28. ) .	jóllehet hasonló terv már korán is hangoztat , az elnök szó ezúttal az ad nyomaték , hogy két hét korán kormány nem van hajlandó mentőöv dob a második nagy hazai chaebolnak , az eladósodott daewoo , amely a feldarabolás már meg is kezdődik ( hvg , 1999. augusztus 28. ) .	CONJ ADJ;NOM;SG ACC;N;PL ADV ADV;CMPR CONJ 3;ACT;FIN;IND;INDF;PST;SG;V _ DEF;DET N;NOM;SG DAT;N;PL;PSS3S ADV 3;NOM;PRO;SG 3;ACT;FIN;IND;INDF;PST;SG;V ACC;N;SG _ CONJ NOM;NUM;SG INS;N;SG ADV;CMPR N;NOM;PSS3S;SG ADV 3;ACT;FIN;IND;INDF;PST;SG;V ADJ;NOM;SG ACC;N;SG ACT;NFIN;V DEF;DET ADJ;NOM;SG ADJ;NOM;RL;SG ADJ;NOM;SG DAT;N;SG _ DEF;DET ADJ;NOM;SG DAT;PROPN;SG _ 3;GEN;PRO;SG DEF;DET N;NOM;PSS3S;SG ADV PART ADV 3;ACT;FIN;IND;INDF;PST;SG;V _ NOM;PROPN;SG _ ADJ;NOM;SG N;NOM;SG N;NOM;PSS3S;SG _ _
a norvég védőnek nem ez az első fatális hibája , keane sem az ilyen megoldásairól híres , sir alex ferguson , a vendégek menedzsere mégsem kutatott bűnbakok után : " mezőnyjátékban kifejezetten jók voltunk , ám hátrányból nem mindig lehet fordítani .	a norvég védő nem ez az első fatális hiba , keane sem az ilyen megoldás híres , sir alex ferguson , a vendég menedzser mégsem kutat bűnbak után : " mezőnyjáték kifejezett jó van , ám hátrány nem mindig lesz fordít .	DEF;DET ADJ;NOM;PSSD;SG GEN;N;PSSD;SG ADV 3;NOM;PRO;PSSD;SG DEF;DET ADJ;NOM;PSSD;SG ADJ;NOM;PSSD;SG N;NOM;PSS3S;SG _ NOM;PROPN;PSSD;SG ADV DEF;DET ADJ;NOM;PSSD;SG N;PL;PSS3S ADJ;NOM;PSSD;SG _ NOM;PROPN;PSSD;SG NOM;PROPN;PSSD;SG NOM;PROPN;PSSD;SG _ DEF;DET N;NOM;PL;PSSD N;NOM;PSS3S;SG ADV 3;ACT;FIN;IND;INDF;PST;SG;V N;NOM;PL;PSSD ADP _ _ IN+ESS;N;PSSD;SG ADJ;FRML;PSSD;SG ADJ;NOM;PL;PSSD 1;ACT;FIN;IND;INDF;PL;PST;V _ CONJ IN+ABL;N;PSSD;SG ADV ADV 3;ACT;FIN;INDF;POT;PRS;SG;V ACT;NFIN;V _
a cd a budapesti music center kiadásában lát majd napvilágot .	a cd a budapesti music center kiadás lát majd napvilág .	DEF;DET N;NOM;PSSD;SG DEF;DET NOM;PROPN;PSSD;SG NOM;PROPN;PSSD;SG NOM;PROPN;PSSD;SG IN+ESS;N;PSS3S;SG 3;ACT;FIN;IND;INDF;PRS;SG;V ADV ACC;N;PSSD;SG _
még nem ismeretes , hogy a fenyves utcai iskolát tagozatként csatolnák -e a fillér utcaihoz , vagy mindkét intézményt megszüntetve új vezetőségi pályázatot írnának ki .	még nem ismeretes , hogy a fenyves utcai iskola tagozat csatol -e a fillér utcai , vagy mindkét intézmény megszüntetve új vezetőségi pályázat ír ki .	ADV ADV ADJ;NOM;PSSD;SG _ CONJ DEF;DET NOM;PROPN;PSSD;SG ADJ;NOM;PSSD;SG ACC;N;PSSD;SG ABS;N;PSSD;SG 3;ACT;COND;DEF;FIN;PL;PRS;V ADV DEF;DET NOM;PROPN;PSSD;SG ADJ;AT+ALL;PSSD;SG _ CONJ DEF;DET ACC;N;PSSD;SG ADV;V.CVB ADJ;NOM;PSSD;SG ADJ;NOM;PSSD;SG ACC;N;PSSD;SG 3;ACT;COND;FIN;INDF;PL;PRS;V ADV _
számos nagyszerű kötet kiadása , kiállítások és fesztiválok szervezése fűződik a nevükhöz , de most olyan vállalkozásba fogtak , amilyen korábban még nem volt magyarországon .	számos nagyszerű kötet kiadás , kiállítás és fesztivál szervezés fűződik a név , de most olyan vállalkozás fog , amilyen korán még nem van magyarország .	DET;INDF ADJ;NOM;PSSD;SG N;NOM;PSSD;SG N;NOM;PSS3S;SG _ N;NOM;PL;PSSD CONJ N;NOM;PL;PSSD N;NOM;PSS3S;SG 3;ACT;FIN;IND;INDF;PRS;SG;V DEF;DET AT+ALL;N;PSS3P;SG _ CONJ ADV ADJ;NOM;PSSD;SG IN+ALL;N;PSSD;SG 3;ACT;FIN;IND;INDF;PL;PST;V _ 3;NOM;PRO;PSSD;SG ADV ADV ADV 3;ACT;FIN;IND;INDF;PST;SG;V ON+ESS;PROPN;PSSD;SG _
a valencia ellen jobban kell koncentrálunk , s akkor nem lehet semmi probléma . "	a valencia ellen jól kell koncentrál , s akkor nem lesz semmi probléma . "	DEF;DET NOM;PROPN;PSSD;SG ADP ADV 3;ACT;FIN;IND;INDF;PRS;SG;V 1;ACT;FIN;IND;INDF;PL;PRS;V _ CONJ ADV ADV 3;ACT;FIN;INDF;POT;PRS;SG;V DET;INDF N;NOM;PSSD;SG _ _
isztambulból és ankarából , de az ország más pontjairól is a katasztrófát követően rengeteg fiatal kerekedett fel , hogy a nemzetközi segélyakciókhoz csatlakozzanak .	isztambul és ankara , de az ország más pont is a katasztrófa követő rengeteg fiatal kerekedik fel , hogy a nemzetközi segélyakció csatlakozik .	IN+ABL;PROPN;SG CONJ IN+ABL;PROPN;SG _ CONJ DEF;DET N;NOM;SG 3;NOM;PRO;SG N;PL;PSS3S CONJ DEF;DET ACC;N;SG ADJ;FRML;SG NOM;NUM;SG ADJ;NOM;SG 3;ACT;FIN;IND;INDF;PST;SG;V ADV _ CONJ DEF;DET ADJ;NOM;SG AT+ALL;N;PL 3;ACT;FIN;IMP;INDF;PL;PRS;V _
mint arról tegnap beszámoltunk , a nagykövet nem kíván lemondani tisztségéről .	mint az tegnap be+számol , a nagykövet nem kíván le+mond tisztség .	ADV 3;PRO;PSSD;SG ADV 1;ACT;FIN;IND;INDF;PL;PST;V _ DEF;DET N;NOM;PSSD;SG ADV 3;ACT;FIN;IND;INDF;PRS;SG;V ACT;NFIN;V N;PSS3S;SG _
a rendszerváltás tizedik évében eljutottunk oda , hogy a szavak elfutottak .	a rendszerváltás tizedik év el+jut oda , hogy a szó el+fut .	DEF;DET N;NOM;PSSD;SG ADJ;NOM;PSSD;SG IN+ESS;N;PSS3S;SG 1;ACT;FIN;IND;INDF;PL;PST;V ADV _ CONJ DEF;DET N;NOM;PL;PSSD 3;ACT;FIN;IND;INDF;PL;PST;V _
