ba sinamuso ko n yèrè woloden , o fana ka filen minè .	bá sìna.muso kó ń yɛ̀rɛ wólo.den , ò fána ká fílen mìnɛ .	N N V PRO DET N _ PRO PART V N V _
n bòra muru le numuden ! numuden , n na kònò to n bolo !	ń bɔra mùru dè numuden ! numuden , ń ná kɔ̀nɔ tó ń bólo !	PRO PFV;POS;V N PART N _ N _ 1;PRO;SG ADP N V 1;PRO;SG ADP _
ayiwa , dennin yèrè ba tògò ye nyèba .	áyiwa , dén.nin yɛ̀rɛ bá tɔ́gɔ yé ɲɛ̀ba .	INTJ _ N DET N N POS;V PROPN _
a tèmèna , a tagara sosow la .	à tɛmɛna , à tagara sosow lá .	3;PRO;SG PFV;POS;V _ 3;PRO;SG PFV;POS;V N;PL ADP _
fyèntòjigin kòlòn na , ele tògò namaramatu !	fíyen.tɔ.jigin kɔ̀lɔn ná , àle tɔ́gɔ namaramatu !	N N ADP _ 3;PRO;SG N PROPN _
a ye a tògò la ko n tògò ye barawulenin ye .	à yé à tɔ́gɔ dá kó ń tɔ́gɔ yé barawulenin yé .	3;PRO;SG PFV;POS;V 3;PRO;SG N V PART 1;PRO;SG N POS;V PROPN ADP _
a tagara , a ye bere janba tigè a tagara mininyan kan , mininyan ye i kanto ko e ko a dun kèra cogo di ?	à tagara , à yé bére janba tìgɛ à tagara míniɲan kàn , míniɲan ye í kánto kó ée kó à dún kɛra cógo dì ?	3;PRO;SG PFV;POS;V _ 3;PRO;SG PFV;POS;V N ADJ V 3;PRO;SG PFV;POS;V N ADP _ N PFV;POS;V PRO V PART INTJ PART 3;PRO;SG PART PFV;POS;V N PRO _
o tuma , jinèmusonin fana ye a fò a ye ko a ka na ko u ka taga a ka so ko , a bè taga dumuni di a ma .	ò tùma , jinɛmusonin fána yé à fɔ́ à yé kó à ká nà kó ù ká tága à ká só kó , à bɛ́ tága dúmuni dí à mà .	DET N _ N PART PFV;POS;V 3;PRO;SG V 3;PRO;SG ADP PART 3;PRO;SG V V PART 3;PL;PRO V V 3;PRO;SG ADP N PART _ 3;PRO;SG IPFV;POS;V V N V 3;PRO;SG ADP _
a bè kan ka o kè kolon na ka a bò ka a kè daga la .	à bɛ́ kàn kà ò kɛ́ kòlon ná kà à bɔ́ kà à kɛ́ dàga lá .	3;PRO;SG POS;V ADP V PRO V N ADP V 3;PRO;SG V V 3;PRO;SG V N ADP _
o tagara se kungo kònò .	ò tagara sé kúngo kɔ́nɔ .	PRO PFV;POS;V V N ADP _
i tè nin jègè minè , i ka a tobi ka a di u ma ?	í tɛ́ nìn jɛ́gɛ mìnɛ , í ká à tóbi kà à dí ù mà ?	PRO IPFV;NEG;V DEF;DET N V _ PRO V 3;PRO;SG V V 3;PRO;SG V 3;PL;PRO ADP _
a ye a siri a ko : bilali yo , bilali yo !	à ye à sìri à kó : bilali yó , bilali yó !	3;PRO;SG PFV;POS;V 3;PRO;SG V 3;PRO;SG V _ PROPN PART _ PROPN PART _
a ko yo !	à kó yó !	3;PRO;SG V INTJ _
u tagara , u tagara fo u sera u ka dugu la , ka taga fura nin di u fa ma , ka a fò amadu tara kòni kabini o bòra yan , ko o farala ko o tagara muso nyini dè , ko u ma a tagafan si dòn .	ù tagara , ù tagara fó ù sera ù ka dùgu lá , kà tága fúra nìn dí ù fà mà , kà à fɔ́ ámàdu tara kɔ̀ni kàbini ò bɔra yàn , kó ò farala kó ò tagara mùso ɲíni dɛ́ , kó ù ma à tagafan sí dɔ́n .	3;PL;PRO PFV;POS;V _ 3;PL;PRO PFV;POS;V CONJ 3;PL;PRO PFV;POS;V 3;PL;PRO ADP N ADP _ V V N DEF;DET V 3;PL;PRO N ADP _ V 3;PRO;SG V PROPN PROPN PART CONJ PRO PFV;POS;V ADV _ PART PRO PFV;POS;V PART PRO PFV;POS;V N V PART _ PART 3;PL;PRO NEG;PFV;V 3;PRO;SG N DET V _
o fana tagara .	ò fána tagara .	PRO PART PFV;POS;V _
dawuda sinna ka i yèrè yèlèma ka i kè a nò la , ko aw tun ma à fò ko ne ka segin wa ?	dáwuda sinna kà í yɛ̀rɛ yɛ̀lɛma kà í kɛ́ à nɔ̀ lá , kó áw tùn má à fɔ́ kó né ká sègin wà ?	PROPN PFV;POS;V V PRO DET V V PRO V 3;PRO;SG N ADP _ PART 2;PL;PRO PART;PST V 3;PRO;SG V PART 1;PRO;SG V V PART _
a ko n ba ka filen cira n bolo .	à kó ń bá ká fílen cira ń bólo .	3;PRO;SG V PRO N ADP N PFV;POS;V PRO ADP _
sani dugu ka jè minkè , cè ye a fò mayimuna ye ko a bè segin sani dugujè , ko sègè ka kan ka na a nòfè .	sá.ni dùgu ká jɛ́ mínkɛ , cɛ̀ yé à fɔ́ mayimuna yé kó à bɛ́ sègin sá.ni dùgu.jɛ , kó sɛ́gɛ ká kán kà nà à nɔ̀fɛ .	CONJ N V V CONJ _ N PFV;POS;V 3;PRO;SG V PROPN ADP PART 3;PRO;SG IPFV;POS;V V ADP N _ PART N POS;V V V V 3;PRO;SG ADP _
suruku ko a ko e dògò san !	súruku kó à kó ée dɔ́gɔ sàn !	N V 3;PRO;SG V INTJ N N _
a ko o tè baasi ye .	à kó ò tɛ́ báasi yé .	3;PRO;SG V PRO NEG;V N ADP _
a ye bamuso nyun .	à yé bá.muso ɲún .	3;PRO;SG PFV;POS;V N V _
a ko tin ye a minè .	à kó tìn ye à mìnɛ .	3;PRO;SG V N PFV;POS;V 3;PRO;SG V _
kusuba denkè wolo bè n kan !	kusuba dén.kɛ wòlo bɛ́ ń kàn !	PROPN N N POS;V PRO ADP _
o tuma dennin kasira ko a tè a fè , fa ko ee ko i bè a fè dè .	ò tùma dénnin kasira kó à tɛ́ à fɛ̀ , fà kó ée kó í bɛ́ à fɛ̀ dɛ́ .	DET N N PFV;POS;V PART 3;PRO;SG NEG;V 3;PRO;SG ADP _ N V INTJ PART 2;PRO;SG V 3;PRO;SG ADP PART _
amadu tara ye a ka taamakun bèè nyèfò a ye .	ámadù tara yé à ká taamakun bɛ́ɛ ɲɛ́.fɔ à yé .	PROPN PROPN PFV;POS;V 3;PRO;SG ADP N DET V 3;PRO;SG ADP _
jòni ye n tògò fò jeli ye , ko n tògò ko baninyègènè ?	jɔ́nì ye ń tɔ́gɔ fɔ́ jèli yé , kó ń tɔ́gɔ kó ba-ni-ɲɛgɛnɛ ?	PRO PFV;POS;V 1;PRO;SG N V N ADP _ PART 1;PRO;SG N V PROPN _
n bòra muru le , numuden ! numuden , n na kònò to n bolo !	ń bɔra mùru dè , numuden ! numuden , ń ná kɔ̀nɔ tó ń bólo !	PRO PFV;POS;V N PART _ N _ N _ 1;PRO;SG ADP N V 1;PRO;SG ADP _
a bamuso ye a fò ko a ka taga a fakè wele ka na .	à bá.muso yé à fɔ́ kó à ká tága à fà.kɛ wéle kà nà .	3;PRO;SG N PFV;POS;V 3;PRO;SG V PART 3;PRO;SG V V 3;PRO;SG N V V V _
ko muso kònòma dò tun tagara lògònyiniyòrò .	kó mùso kɔ́nɔma dɔ́ tùn tagara dɔ́gɔɲiniyɔrɔ .	PART N ADJ DET PART;PST PFV;POS;V N _
mama ngala ko ko n ka a sanba unhun kènè dò .	máma ŋála kó kó ń ka à sàma ùnhun kɛ́nɛ dɔ́ .	N N V PART 1;PRO;SG POS;SBJV;V 3;PRO;SG V N ADJ DET _
ni i ye jasun wele , ne tè i to !	ní í yé jasun wéle , né tɛ́ í tó !	CONJ PRO PFV;POS;V PROPN V _ 1;PRO;SG IPFV;NEG;V PRO V _
tinòò , na ye a falennò kè .	tinɔɔ , nà ye à falenni kɛ́ .	PROPN _ N PFV;POS;V 3;PRO;SG N;V.MSDR V _
o ye dògò caman di a ma .	ò yé dɔ́gɔ cá.man dí à mà .	PRO PFV;POS;V N ADJ V 3;PRO;SG ADP _
namaramatu tagara don numunkè dò fè , ko e ma a ye fulakè nin bè n gèn wa ?	namaramatu tagara dòn nùmu.kɛ dɔ́ fɛ̀ , kó é má à yé fulakɛ nìn bɛ́ ń gɛ́n wà ?	PROPN PFV;POS;V V N DET ADP _ PART 2;PRO;SG V 3;PRO;SG V N DEF;DET IPFV;POS;V PRO V PART _
n ma bòra kalakari wo kalakari .	ń má bɔra kàlakari ó kàlakari .	PRO N PFV;POS;V N CONJ N _
amadu tara tagara , bèè ye amadu tara deli ko a kana taga , ko ni o tè , ko a tè segin a faso la tuguni .	ámadù tara tagara , bɛ́ɛ yé ámadù tara déli kó à kàna tága , kó ní ò tɛ́ , kó à tɛ́ sègin à fà.so lá túguni .	PROPN PROPN PFV;POS;V _ PRO PFV;POS;V PROPN PROPN V PART 3;PRO;SG IMP;NEG;V V _ PART CONJ PRO NEG;V _ PART 3;PRO;SG IPFV;NEG;V V 3;PRO;SG N ADP ADV _
a ye i bolo jigin ka den bolo jigin .	à yé í bólo jìgin kà dén bólo jìgin .	3;PRO;SG PFV;POS;V PRO N V V N N V _
o bè kolo jalan kè kolon na ka a susu .	ò bɛ́ kólo jàlan kɛ́ kòlon ná kà à sùsu .	PRO IPFV;POS;V N ADJ V N ADP V 3;PRO;SG V _
zan tagara foro la , ko a bɛ t' a ɲɛ da sumanw kan .	_ _ _ _ _ _ _ _ _ _ _ _ _ _ _	PROPN V N ADP _ PART PRO V V PRO N V N ADP _
a ye ji kè buguri nin na .	à ye jí kɛ́ bùguri nìn ná .	3;PRO;SG PFV;POS;V N V N DEF;DET ADP _
ni i ye bin nin kè masaso nin kòrò , i ka dòònin kè n ta nin kòrò .	ní í ye bín nìn kɛ́ màsaso nìn kɔ́rɔ , í ka dɔ́ɔnin kɛ́ ń tá nìn kɔ́rɔ .	CONJ 2;PRO;SG PFV;POS;V N DEF;DET V N DEF;DET ADP _ 2;PRO;SG POS;SBJV;V N V 1;PRO;SG N DEF;DET ADP _
a lara sa .	à dára sá .	3;PRO;SG PFV;POS;V PART _
jamanatigi nana bana a banana kosèbè fo ka a da so kònò yen .	jàmana.tigi nana bàna à banana kósɛbɛ fó kà à dá só kɔ́nɔ yèn .	N PFV;POS;V V 3;PRO;SG PFV;POS;V ADV CONJ V 3;PRO;SG V N ADP ADV _
don dò tilegan fè tuguni bilali nana ni a ka so ye .	dón dɔ́ tìlegan fɛ̀ túguni bilali nana ni à ka sò yé .	N DET N ADP ADV PROPN PFV;POS;V ADP 3;PRO;SG ADP N ADP _
u tagara yenninnò .	ù tagara yèn.nìn.nɔ́ .	3;PL;PRO PFV;POS;V N _
ayiwa , a bè a ka so siri bilali ka so kèrè fè .	áyiwa , à bɛ à ka sò sìri bilali ka sò kɛ̀rɛ fɛ̀ .	INTJ _ 3;PRO;SG IPFV;POS;V 3;PRO;SG ADP N V PROPN ADP N N ADP _
ala ye a ta ka bin .	ála ye à tà kà bìn .	N PFV;POS;V 3;PRO;SG V V V _
a tagara sa .	à tagara sá .	3;PRO;SG PFV;POS;V PART _
n y' a ta yɔrɔ min n y' a bila yen .	ń y' à tà yɔ́rɔ mîn ń y' à bìla yèn .	1;PRO;SG PFV;POS;V 3;PRO;SG V N DET 1;PRO;SG PFV;POS;V 3;PRO;SG V ADV _
o ye o jègè minè ka o tobi .	ò yé ò jɛ́gɛ mìnɛ kà ò tóbi .	PRO PFV;POS;V DET N V V PRO V _
a ko ayi ko ne ta tè jeni ka a nyimi .	à kó àyi kó né tá tɛ́ jèni kà à ɲími .	3;PRO;SG V INTJ PART 1;PRO;SG N IPFV;NEG;V V V 3;PRO;SG V _
dennin ko : n ma , ne tè se ka yèlèn nin bala .	dén.nin kó : ń má , né tɛ́ sé kà yɛ̀lɛn nìn bála .	N V _ PRO N _ 1;PRO;SG IPFV;NEG;V V V V DEF;PRO ADP _
a ye muso ta ka a di a ma .	à yé mùso tà kà à dí à mà .	3;PRO;SG PFV;POS;V N V V 3;PRO;SG V 3;PRO;SG ADP _
a ye sin kelen biri .	à yé sín kélen bíri .	3;PRO;SG PFV;POS;V N NUM V _
ne tè a nyimi .	né tɛ́ à ɲími .	1;PRO;SG IPFV;NEG;V 3;PRO;SG V _
o kèra saw ani mininyan ye .	ò kɛra saw àni míni.ɲan yé .	PRO PFV;POS;V N;PL CONJ N ADP _
ni mògò o mògò nana , a bè a fò ko ni a sera ka den nin tògò fò , o tuma na , a bè den nin furu o tigi ma .	ní mɔ̀gɔ ô mɔ̀gɔ nana , à bɛ à fɔ́ kó ní à sera kà dén nìn tɔ́gɔ fɔ́ , ò tùma ná , à bɛ dén nìn fúru ò tìgi mà .	CONJ N CONJ N PFV;POS;V _ 3;PRO;SG IPFV;POS;V 3;PRO;SG V PART CONJ 3;PRO;SG PFV;POS;V V N DEF;DET N V _ DET N ADP _ 3;PRO;SG IPFV;POS;V N DEF;DET V PRO N ADP _
ala kana i ni hèra bèn !	ála kàna í ní hɛ́ra bɛ̀n !	N IMP;NEG;V PRO CONJ N V _
a ko n ba de ka filen cira n bolo .	à kó ń bá dè ká fílen cira ń bólo .	3;PRO;SG V PRO N PART ADP N PFV;POS;V PRO ADP _
ale ye jele ta , sujele ta , ka i jò dennin jukòrò ale bè dògò jukòròla kan ka a tigè .	àle yé jéle tà , sujele tà , kà í jɔ̀ dén.nin jù.kɔrɔ àlê bɛ́ dɔ́gɔ jùkɔrɔla kàn kà à tìgɛ .	3;PRO;SG PFV;POS;V N V _ N V _ V PRO V N ADP 3;PRO;SG V N N ADP V 3;PRO;SG V _
ayiwa , ni jònkè nana ni masakè ka so ye , a bè a ka nyòkalaso ta .	áyiwa , ní jɔnkɛ nana ni màsakɛ ka sò yé , à bɛ à ka ɲɔkalaso tà .	INTJ _ CONJ N PFV;POS;V ADP N ADP N ADP _ 3;PRO;SG IPFV;POS;V 3;PRO;SG ADP N V _
u tagara dòròn , u tagara sisan fo u tagara jègèminèyòrò .	ù tagara dɔ́rɔn , ù tagara sísàn fó ù tagara jɛgɛminɛyɔrɔ .	3;PL;PRO PFV;POS;V ADV _ 3;PL;PRO PFV;POS;V ADV CONJ 3;PL;PRO PFV;POS;V N _
a nana .	à nana .	3;PRO;SG PFV;POS;V _
a ko ònhòn , ne de ye a wolo .	à kó ɔ̀nhɔ́n , nê dè ye à wólo .	3;PRO;SG V INTJ _ 1;PRO;SG PART PFV;POS;V 3;PRO;SG V _
a bɛ fɔ ko kɔrɔtɔ ye sogosan ye .	_ _ _ _ _ _ _ _ _	PRO V V PART N V N ADP _
olu ka sòrò ka amadu labò .	ò.lú kà sɔ̀rɔ kà ámadù lá.bɔ .	PL;PRO V V V PROPN CAUS;V _
numunkèkàkilitigè , ele tògò namaramatu !	nùmu.kɛ.ka.kili.tigɛ , àle tɔ́gɔ namaramatu !	N _ 3;PRO;SG N PROPN _
a ye baba kunkolo tigè .	à yé bàba kùn.kolo tìgɛ .	3;PRO;SG PFV;POS;V N N V _
a ko an ka an suma !	à kó án ká án súma !	3;PRO;SG V 1;PL;PRO V 1;PL;PRO V _
o tuma na , a tagara u ye a jira dennin na , u tagara dennin ka so jira a la .	ò tùma ná , à tagara ù ye à jìra dénnin ná , ù tagara dénnin ka só jìra à lá .	DET N ADP _ 3;PRO;SG PFV;POS;V 3;PL;PRO PFV;POS;V 3;PRO;SG V N ADP _ 3;PL;PRO PFV;POS;V N ADP N V 3;PRO;SG ADP _
tasuma ye a minè .	tásuma ye à mìnɛ .	N PFV;POS;V 3;PRO;SG V _
kònòba bilen ye a fò : kònòba be dugu min na , su tè ko , dugu tè gè .	kɔnɔba bìlen yé à fɔ́ : kɔnɔba bɛ́ dùgu mín ná , sú tɛ́ kò , dùgu tɛ́ jɛ́ .	N PART PFV;POS;V 3;PRO;SG V _ N POS;V N DET ADP _ N IPFV;NEG;V V _ N IPFV;NEG;V V _
kusuba kanliba kusa kusa !	kusuba kànliba kusa kusa !	PROPN N;V.MSDR INTJ INTJ _
o tuma na , jinèmusonin seginna ni a ye ka na a sigi jiri nin kan ka a sigi kan .	ò tùma ná , jinɛmusonin seginna ní à yé kà nà à sìgi jíri nìn kàn kà à sìgi kàn .	DET N ADP _ N PFV;POS;V ADP 3;PRO;SG ADP V V 3;PRO;SG V N DEF;DET ADP V 3;PRO;SG V ADP _
sigi ye i kanto ko mun don ?	sìgi yé í kán.to kó mùn dòn ?	N PFV;POS;V PRO V PART PRO V _
o ni musokòrònin bènna ko n denkè , ko e bè taga min ?	ò ni mùsokɔrɔnin bɛnna kó ń dénkɛ , kó ê bɛ tága mîn ?	PRO CONJ N PFV;POS;V PART 1;PRO;SG N _ PART 2;PRO;SG IPFV;POS;V V PRO _
ni i ye bin nin kè masaso nin kòrò , i ka dòònin kè n ta nin kòrò .	ní í ye bín nìn kɛ́ màsaso nìn kɔ́rɔ , í ka dɔ́ɔnin kɛ́ ń tá nìn kɔ́rɔ .	CONJ 2;PRO;SG PFV;POS;V N DEF;DET V N DEF;DET ADP _ 2;PRO;SG POS;SBJV;V N V 1;PRO;SG N DEF;DET ADP _
ko mògò si ma se i tògò la , dòw nana , dòw ko fanta .	kó mɔ̀gɔ sí ma sé í tɔ́gɔ lá , dɔ́w nana , dɔ́w kó fanta .	CONJ N DET NEG;PFV;V V 2;PRO;SG N ADP _ PL;PRO PFV;POS;V _ PL;PRO V PROPN _
ko e ko nyèko bè n cè la ko a nyèkili fila man nyi ko ne bèna nyèkili fila nyini e fè !	kó é kó ɲɛ̀.ko bɛ́ ń cɛ̀ lá kó à ɲɛ́.kili fìla mán ɲì kó nê bɛ́na ɲɛ́kili fìla ɲíni ê fɛ̀ !	PART 3;PRO;SG V N POS;V PRO N ADP PART 3;PRO;SG N NUM NEG;V V PART 1;PRO;SG FUT;POS;V N NUM V 2;PRO;SG ADP _
sagakasikan !	sagakasikan !	N _
a tagara se a ka kòròkè sigilen ma ko n kòrò !	à tagara sé à ká kɔ̀rɔ.kɛ sigilen mà kó ń kɔ̀rɔ !	3;PRO;SG PFV;POS;V V 3;PRO;SG ADP N ADJ;PFV;V.PTCP ADP PART 1;PRO;SG N _
muso nin jiginnen dencè , baramuso ye kurun ta ka taga o di tinkòròsigimusow ma .	mùso nìn jiginnen dencɛ , báramuso ye kùrun tà kà tága ò dí tinkɔrɔsigimusow mà .	N DEF;DET PFV;V;V.PTCP N _ N PFV;POS;V N V V V PRO V N;PL ADP _
a ko munna ?	à kó mùnna ?	3;PRO;SG V PRO _
kòròkè tununna dugu jukòrò , hali sini a ma ye .	kɔ̀rɔ.kɛ tununna dùgu jù.kɔrɔ , háli síni à má yé .	N PFV;POS;V N ADP _ PART ADV 3;PRO;SG V V _
a ma a don a bè a kè cogoya min na .	à má à dɔ́n à bɛ́ à kɛ́ cógo.ya mín ná .	3;PRO;SG V 3;PRO;SG V 3;PRO;SG IPFV;POS;V 3;PRO;SG V N DET ADP _
a ko i sigi ka kè dòlòmin ye .	à kó í sìgi kà kɛ́ dɔ̀lɔ.min yé .	3;PRO;SG V PRO V V V N ADP _
ko a ye o minè .	kó à yé ò mìnɛ .	PART 3;PRO;SG PFV;POS;V PRO V _
dògò bè nòrò a nò la .	dɔ́gɔ bɛ́ nɔ́rɔ à nɔ̀ lá .	N IPFV;POS;V V 3;PRO;SG N ADP _
dugumasa ye i kanto , a ko yoo !	dùgumasa ye í kánto , à kó yó !	N PFV;POS;V PRO V _ 3;PRO;SG V INTJ _
numuden , n na kònò to n bolo !	numuden , ń ná kɔ̀nɔ tó ń bólo !	N _ PRO ADP N V PRO ADP _
kusuba denkè wolo bè n kan !	kusuba dén.kɛ wòlo bɛ́ ń kàn !	PROPN N N POS;V PRO ADP _
dennin yèlènna jiri bala .	dén.nin yɛlɛnna jíri bála .	N PFV;POS;V N ADP _
ni a ye a bolo kè fu la dòròn ka ba kò ko , bolo tigèra .	ní à yé à bólo kɛ́ fù lá dɔ́rɔn kà bá kɔ́ kò , bólo tigɛra .	CONJ 3;PRO;SG PFV;POS;V 3;PRO;SG N V N ADP ADV V N N V _ N PFV;POS;V _
siginònòkènè dò filè ti , nyamògòsanba !	sìginɔnɔkɛnɛ dɔ́ fílɛ tí , ɲɛ́mɔgɔsanba !	N DET V ADV _ N _
o tagara .	ò tagara .	PRO PFV;POS;V _
olu tun tagara ji nyini ka a di u ka sagaw ma .	ò.lú tùn tagara jí ɲíni kà à dí ù ká sagaw mà .	PL;PRO PART;PST PFV;POS;V N V V 3;PRO;SG V 3;PL;PRO ADP N;PL ADP _
n bòra muru le numuden ! numuden , n na kònò to n bolo !	ń bɔra mùru dè numuden ! numuden , ń ná kɔ̀nɔ tó ń bólo !	PRO PFV;POS;V N PART N _ N _ 1;PRO;SG ADP N V 1;PRO;SG ADP _
n na bòra kònò le n ma !	ń nà bɔra kɔ̀nɔ dè ń má !	PRO N PFV;POS;V N PART PRO N _
maaninfin dun bè kaba wolo ?	màaninfin dún bɛ kába wólo ?	N PART IPFV;POS;V N V _
furu bè siri , i bè taga a nòfè .	fúru bɛ sìri , í bɛ tága à nɔ̀fɛ̀ .	N IPFV;POS;V V _ 2;PRO;SG IPFV;POS;V V 3;PRO;SG ADP _
a tèmèna , a tagara warakalan sòrò .	à tɛmɛna , à tagara wára.nin.kalan sɔ̀rɔ .	3;PRO;SG PFV;POS;V _ 3;PRO;SG PFV;POS;V N V _
a jiginna dòròn , sègè dò nana ka na i jò a kòrò ka a yèrè kè mògò ye ka kuma a fè , ko a ka so di a ma .	à jiginna dɔ́rɔn , sɛ́gɛ dɔ́ nana kà nà í jɔ̀ à kɔ́rɔ kà à yɛ̀rɛ kɛ́ mɔ̀gɔ yé kà kúma à fɛ̀ , kó à ká sò dí à mà .	3;PRO;SG PFV;POS;V ADV _ N DET PFV;POS;V V V PRO V 3;PRO;SG ADP V 3;PRO;SG DET V N ADP V V 3;PRO;SG ADP _ PART 3;PRO;SG V N V 3;PRO;SG ADP _
n ye nsiirinin sòrò yòrò min , n ye a bila yen .	ń yé nsíirin.nin sɔ̀rɔ yɔ́rɔ mín , ń yé à bìla yèn .	PRO PFV;POS;V N V N DET _ PRO PFV;POS;V 3;PRO;SG V ADV _
ko : n na , ko ne kun li !	kó : ń nà , kó né kùn dí !	PART _ PRO N _ PART 1;PRO;SG N V _
nin ye ko kura ye .	nìn yé kó kúra yé .	DEF;PRO POS;V N ADJ ADP _
a ye o fana cogoya nyèfò jinèmuso nin ye .	à yé ò fána cógo.ya ɲɛ́.fɔ jinɛmuso nìn yé .	3;PRO;SG PFV;POS;V DET PART N V N DEF;DET ADP _
n bora kònò le n ma ! n ma bòra kalakari wo kalakari .	ń bɔra kɔ̀nɔ dè ń má ! ń má bɔra kàlakari ô kàlakari .	PRO PFV;POS;V N PART PRO N _ 1;PRO;SG N PFV;POS;V N CONJ N _
dugu jèlen , jinamusokòròba ye syèfan saba di a ma .	dùgu jɛlen , jínɛmusokɔrɔba yé syɛ̀.fan sàba dí à mà .	N PFV;V;V.PTCP _ N PFV;POS;V N NUM V 3;PRO;SG ADP _
a ko n ba sinamuso ka filen cira n bolo .	à kó ń bá sìna.muso ká fílen cira ń bólo .	3;PRO;SG V PRO N N ADP N PFV;POS;V PRO ADP _
a ko baba , na dumunni kè !	à kó bàba , nà dúmuni kɛ́ !	3;PRO;SG V N _ V N V _
dennin ka gaari bè nyini ka ban tigè la .	dén.nin ká gáari bɛ́ ɲíni kà bán tìgɛ lá .	N ADP N IPFV;POS;V V V V N ADP _
warakalan olu fana bè kan ka nyògòn dun .	wára.nin.kalan ò.lú fána bɛ́ kàn kà ɲɔ́gɔn dún .	N PL;PRO PART POS;V ADP V PRO V _
ko e na dumunni kè !	kó é nà dúmuni kɛ́ !	PART 2;PRO;SG V N V _
a ko fònhòn !	à kó fɔ̀nhɔn !	3;PRO;SG V INTJ _
a ko nin bere ye i kanto ko e mana i suma nin bereke nin ma , ko ale be janya i ye !	à kó nìn bére yé í kán.to kó é mána í súma nìn béreke nìn mà , kó àle bɛ́ jàn.ya í yé !	3;PRO;SG V DEF;DET N PFV;POS;V PRO V PART 3;PRO;SG COND;POS;V PRO V DEF;DET N DEF;DET ADP _ PART 3;PRO;SG IPFV;POS;V V PRO ADP _
a ko aw bè fèèrè kè , aw bè na ni mininyan nyanama ye , aw bè na ni siginònò kènè ye , aw bè na ni limògòbara fa ye , aw bè na ni sosobara fa ye	à kó áw bɛ fɛ̀ɛrɛ kɛ́ , áw bɛ nà ni míniɲan ɲɛ́nama yé , áw bɛ nà ni sìginɔnɔ kɛ́nɛ yé , áw bɛ nà ni límɔgɔbara fá yé , áw bɛ nà ni sòsobara fá yé	3;PRO;SG V 2;PL;PRO IPFV;POS;V N V _ 2;PL;PRO IPFV;POS;V V ADP N ADJ ADP _ 2;PL;PRO IPFV;POS;V V ADP N ADJ ADP _ 2;PL;PRO IPFV;POS;V V ADP N N ADP _ 2;PL;PRO IPFV;POS;V V ADP N N ADP
jinè ye a nyininka a sera jiri nin kan cogo min na .	jínɛ yé à ɲìninka à sera jíri nìn kàn cógo mín ná .	N PFV;POS;V 3;PRO;SG V 3;PRO;SG PFV;POS;V N DEF;DET ADP N DET ADP _
a kalayòrò ma ye .	à kalayɔrɔ má yé .	3;PRO;SG N V V _
i sera a fɔcogo la ” .	í sera à fɔ́cogo lá ” .	2;PRO;SG PFV;POS;V 3;PRO;SG N ADP _ _
a ko ni a ye kè ten , ne fana bè ala minè .	à kó ní à yé kɛ́ tèn , né fána bɛ́ ála mìnɛ .	3;PRO;SG V CONJ 3;PRO;SG PFV;POS;V V ADV _ 1;PRO;SG PART IPFV;POS;V N V _
a ye bugu dò ye yen , a jiginna ka taga , a ye tasuma mènèmènè ye o buguda la , a tagara o fan fè , ko a bè taga o tigi lajè dòròn , a nana a sòrò a ba de don .	à ye bùgu dɔ́ yé yèn , à jiginna kà tága , à ye tásuma mɛ́nɛmɛnɛ yé ò bùguda lá , à tagara ò fàn fɛ̀ , kó à bɛ tága ò tìgi lájɛ dɔ́rɔn , à nana à sɔ̀rɔ à bá dè dòn .	3;PRO;SG PFV;POS;V N DET V ADV _ 3;PRO;SG PFV;POS;V V V _ 3;PRO;SG PFV;POS;V N ADJ V PRO N ADP _ 3;PRO;SG PFV;POS;V PRO N ADP _ PART 3;PRO;SG IPFV;POS;V V PRO N CAUS;V ADV _ 3;PRO;SG PFV;POS;V 3;PRO;SG V 3;PRO;SG N PART V _
ayiwa , an bè na ko wèrè fana daminè ka o fò aw ye .	áyiwa , án bɛ nà kó wɛ́rɛ fána dámìnɛ kà ò fɔ́ áw yé .	INTJ _ 1;PL;PRO IPFV;POS;V V N DET PART V V PRO V 2;PL;PRO ADP _
a ye o fana ta , a ye o doni .	à yé ò fána tà , à yé ò dòni .	3;PRO;SG PFV;POS;V PRO PART V _ 3;PRO;SG PFV;POS;V PRO V _
a ko n bada ma nin ye .	à kó ń báda má nìn yé .	3;PRO;SG V PRO ADV V DEF;PRO V _
ko e na dumunni kè !	kó ê nà dúmuni kɛ́ !	PART 2;PRO;SG FUT;POS;V N V _
a tagara ji ta ba kònò ka na a sigi jinamuso ye .	à tagara jí tà bá kɔ́nɔ kà nà à sìgi jínɛmuso yé .	3;PRO;SG PFV;POS;V N V N ADP V V 3;PRO;SG V N ADP _
‐ ne ka so dun tè bin dun .	‐ nê ka sò dún tɛ bín dún .	_ 1;PRO;SG ADP N PART IPFV;NEG;V N V _
a ko a , n den , e bè taga min ?	à kó á , ń dén , é bɛ́ tága mín ?	3;PRO;SG V INTJ _ PRO N _ 2;PRO;SG IPFV;POS;V V PRO _
a natò , a ye kònònin fila minè ka na a di u ma .	à natɔ , à yé kɔnɔnin fìla mìnɛ kà nà à dí ù mà .	3;PRO;SG PROG;V;V.PTCP _ 3;PRO;SG PFV;POS;V N NUM V V V 3;PRO;SG V 3;PL;PRO ADP _
à kèra waraba ni suruku ye .	à kɛra wára.ba ní súruku yé .	3;PRO;SG PFV;POS;V N CONJ N ADP _
ala ani sonsannin	ála àni sonsannin	N CONJ N
a ko n ba ka filen cira n bolo .	à kó ń bá ká fílen cira ń bólo .	3;PRO;SG V PRO N ADP N PFV;POS;V PRO ADP _
jelikè muso ye baninyègènè !	jèlikɛ mùso yé ba-ni-ɲɛgɛnɛ !	N N POS;V PROPN _
maaninfin dun bè kaba wolo ?	màaninfin dún bɛ kába wólo ?	N PART IPFV;POS;V N V _
su kora subagamuso nin tagara a donna dawuda la kòròkè ka so kònò a ye baro kè .	sú kora subagamuso nìn tagara à donna dáwuda lá kɔ̀rɔkɛ ka só kɔ́nɔ à ye bàro kɛ́ .	N PFV;POS;V N DEF;DET PFV;POS;V 3;PRO;SG PFV;POS;V PROPN ADP N ADP N ADP 3;PRO;SG PFV;POS;V N V _
a ye a bugò .	à yé à bùgɔ .	3;PRO;SG PFV;POS;V 3;PRO;SG V _
ko e ma a fò ko kònònin te muso sòrò , kònònin te muso sòrò ?	kó é má à fɔ́ kó kɔnɔnin té mùso sɔ̀rɔ , kɔnɔnin té mùso sɔ̀rɔ ?	PART 2;PRO;SG V 3;PRO;SG V PART N IPFV;NEG;V N V _ N IPFV;NEG;V N V _
a fa sara , a ba sara ka a tò to a ba sinamuso ye .	à fà sara , à bá sara kà à tɔ̀ tó à bá sìna.muso yé .	3;PRO;SG N PFV;POS;V _ 3;PRO;SG N PFV;POS;V V 3;PRO;SG N V 3;PRO;SG N N ADP _
a ye a bò ka a di jinamuso ma .	à yé à bɔ́ kà à dí jínɛmuso mà .	3;PRO;SG PFV;POS;V 3;PRO;SG V V 3;PRO;SG V N ADP _
dògònin tagara .	dɔ́gɔnin tagara .	N PFV;POS;V _
jinèmusonin dò nana amadu tara sòrò jiri sanfè .	jinɛmusonin dɔ́ nana ámadù tara sɔ̀rɔ jíri sán.fɛ̀ .	N DET PFV;POS;V PROPN PROPN V N ADP _
a denkɛnin dɔ bɛ yen , o ma tɛmɛ daba ɲɛ saba kan , o fana ko : “ baa n bɛ taa bin na ka na ” .	à denkɛnin dɔ́ bɛ́ yèn , ò ma tɛ̀mɛ dàba ɲɛ́ sàba kàn , ò fána kó : “ bàa ń bɛ táa bín ná kà nà ” .	3;PRO;SG N DET V ADV _ PRO NEG;PFV;V V N N NUM ADP _ PRO PART V _ _ N 1;PRO;SG IPFV;POS;V V N ADP V V _ _
kusuba kanliba kusa kusa !	kusuba kànliba kusa kusa !	PROPN N;V.MSDR INTJ INTJ _
namaramatu ye a fò : - wiyan wiyan wiyan !	namaramatu ye à fɔ́ : - wiyan wiyan wiyan !	PROPN PFV;POS;V 3;PRO;SG V _ _ INTJ INTJ INTJ _
bèè ta ko tot tot !	bɛ́ɛ tá kó tot tot !	PRO N V INTJ INTJ _
ko fònhòn !	kó fɔ̀nhɔn !	PART INTJ _
a ko ne bè taga maromaro .	à kó né bɛ́ tága maromaro .	3;PRO;SG V 1;PRO;SG IPFV;POS;V V PROPN _
ntalen banna yen .	ntàlen banna yèn .	N PFV;POS;V ADV _
dawuda yèrè tagara ka i yèlèma ka kè saganin dò ye ka taga .	dáwuda yɛ̀rɛ tagara kà í yɛ̀lɛma kà kɛ́ saganin dɔ́ yé kà tága .	PROPN DET PFV;POS;V V PRO V V V N DET ADP V V _
n ma bòra kalakari wo kalakari .	ń má bɔra kàlakari ó kàlakari .	PRO N PFV;POS;V N CONJ N _
mininyan kènè dò filè ti , nyamògòsanba !	míniɲan kɛ́nɛ dɔ́ fílɛ tí , ɲamɔgɔsanba !	N ADJ DET V ADV _ N _
a kòròkèw tagara , ko e , ni a ye a sòrò an dògònin dawuda yèrè tun bè yan , ko an tun bè nin di a ma wa ?	à kɔrɔkɛw tagara , kó ée , ní à yé à sɔ̀rɔ án dɔ́gɔ.nin dáwuda yɛ̀rɛ tùn bɛ́ yàn , kó án tùn bɛ́ nìn dí à mà wà ?	3;PRO;SG N;PL PFV;POS;V _ PART INTJ _ CONJ 3;PRO;SG PFV;POS;V 3;PRO;SG V 1;PL;PRO N PROPN DET PART;PST POS;V ADV _ PART 1;PL;PRO PART;PST IPFV;POS;V DEF;PRO V 3;PRO;SG ADP PART _
