a nana ni amadu tara ye ka a sigi jiri kan .	à nana ní ámadù tara yé kà à sìgi jíri kàn .	3;PRO;SG PFV;POS;V ADP PROPN PROPN ADP V 3;PRO;SG V N ADP _
sani i bè taga yen , suruku bè sila rò , warakalan bè sila rò , jinajugu bè sila rò , gòòtèw bè sila rò .	sá.ni í bɛ́ tága yèn , súruku bɛ́ síra rɔ́ , wára.kalan bɛ́ síra rɔ́ , jínɛjugu bɛ́ síra rɔ́ , gɔ̀tɛw bɛ́ síra rɔ́ .	CONJ PRO IPFV;POS;V V ADV _ N POS;V N ADP _ N POS;V N ADP _ N POS;V N ADP _ N;PL POS;V N ADP _
a ko n ba ka sinamuso ka filen cira n bolo .	à kó ń bá ká sìna.muso ká fílen cira ń bólo .	3;PRO;SG V PRO N ADP N ADP N PFV;POS;V PRO ADP _
dawuda ye a kòròkèw ni a yèrè kè fònyòn ye , diye wuli ka taga .	dáwuda yé à kɔrɔkɛw ní à yɛ̀rɛ kɛ́ fíyɛn yé , dìyé wúli kà tága .	PROPN PFV;POS;V 3;PRO;SG N;PL CONJ 3;PRO;SG DET V N ADP _ V V V V _
n bòra segi le bòtu ! bòtu , n na muru to n bolo !	ń bɔra sègi dè bɔ̀.tu ! bɔ̀tu , ń ná mùru tó ń bólo !	PRO PFV;POS;V N PART N _ N _ 1;PRO;SG ADP N V 1;PRO;SG ADP _
a ye sin di o ma , o ye i da .	à yé sín dí ò mà , ò yé í dá .	3;PRO;SG PFV;POS;V N V PRO ADP _ PRO PFV;POS;V PRO V _
lenburu binna .	lènburu binna .	N PFV;POS;V _
o ye a ta dòròn , a ko tot tot !	ò ye à tà dɔ́rɔn , à kó tot tot !	PRO PFV;POS;V 3;PRO;SG V ADV _ 3;PRO;SG V INTJ INTJ _
u donna a kònò , u ye bara fa .	ù donna à kɔ́nɔ , ù yé bàra fá .	3;PL;PRO PFV;POS;V 3;PRO;SG ADP _ 3;PL;PRO PFV;POS;V N V _
amadu tara	ámàdu tara	PROPN PROPN
kònòba kunkolo ye woro ye , namaramatu kunkolo ye wolonfila ye , kònòba nana : kònòba be dugu min na , su tè ko , dugu tè gè .	kɔnɔba kùnkolo yé wɔ́ɔrɔ yé , namaramatu kùnkolo yé wólonfìla yé , kɔnɔba nana : kɔnɔba bɛ́ dùgu mîn ná , sú tɛ kò , dùgu tɛ jɛ́ .	N N POS;V NUM ADP _ PROPN N POS;V NUM ADP _ N PFV;POS;V _ N V N DET ADP _ N IPFV;NEG;V V _ N IPFV;NEG;V V _
hali ji kelen ma toni diye a bòn a nò na ko a fa !	háli jí kélen má tóni dìyé à bɔ̀n à nɔ̀ ná kó à fá !	PART N NUM V V V 3;PRO;SG V 3;PRO;SG N ADP PART 3;PRO;SG V _
a mana taga o bè kelen tigè , a ka suya bè bò a kònò , a dèsèra .	à mána tága ò bɛ kélen tìgɛ , à ka súya bɛ bɔ́ à kɔ́nɔ , à dɛsɛra .	3;PRO;SG COND;POS;V V PRO IPFV;POS;V NUM V _ 3;PRO;SG ADP N IPFV;POS;V V 3;PRO;SG ADP _ 3;PRO;SG PFV;POS;V _
ayiwa , galomuso a bè taga a ka nyòmugufyèyòrò .	áyiwa , gàlomuso à bɛ tága à ka ɲɔ̀mugufyɛyɔrɔ .	INTJ _ N 3;PRO;SG IPFV;POS;V V 3;PRO;SG ADP N _
ni u banna tuma min , o dennin , o bè na ka na ka dumunni kè .	ní ù banna tùma mín , ò dén.nin , ò bɛ́ nà kà nà kà dúmuni kɛ́ .	CONJ 3;PL;PRO PFV;POS;V N DET _ DET N _ PRO IPFV;POS;V V V V V N V _
kusuba denkè wolo bè n kan !	kusuba dén.kɛ wòlo bɛ́ ń kàn !	PROPN N N POS;V PRO ADP _
u fa ye muru dilan ka a di a ma .	ù fà yé mùru dílan kà à dí à mà .	3;PL;PRO N PFV;POS;V N V V 3;PRO;SG V 3;PRO;SG ADP _
u tagara , amadu tara tagara fo a kunna tòw la minkè , u sera sira fila sirafara yòrò nin na dòròn , a jòra ka bò a ka so kan , komi i n' a sòrò a bè nyègènè kè .	ù tagara , ámadù tara tagara fó à kunna tɔw lá mínkɛ , ù sera síra fìla sírafara yɔ́rɔ nìn ná dɔ́rɔn , à jɔra kà bɔ́ à ka sò kàn , kómi í n' à sɔ̀rɔ à bɛ ɲɛ́gɛnɛ kɛ́ .	3;PL;PRO PFV;POS;V _ PROPN PROPN PFV;POS;V CONJ 3;PRO;SG PFV;POS;V N;PL ADP CONJ _ 3;PL;PRO PFV;POS;V N NUM N N DEF;DET ADP ADV _ 3;PRO;SG PFV;POS;V V V 3;PRO;SG ADP N ADP _ CONJ 2;PRO;SG FUT;POS;V 3;PRO;SG V 3;PRO;SG IPFV;POS;V N V _
julaba , n na lògò to n bolo !	julaba , ń ná dɔ́gɔ tó ń bólo !	N _ PRO ADP N V PRO ADP _
a ye muso kònòntò furu .	à ye mùso kɔ̀nɔntɔn fúru .	3;PRO;SG PFV;POS;V N NUM V _
a ko a ma n kò ko .	á kó à mà ń kɔ́ kò .	2;PL;PRO V 3;PRO;SG ADP PRO N V _
olu ko ko mun kèra ?	ò.lú kó kó mùn kɛra ?	PL;PRO V PART PRO PFV;POS;V _
a ko : n ma , e ye nin ye wa ?	à kó : ń má , é yé nìn yé wà ?	3;PRO;SG V _ PRO N _ 2;PRO;SG POS;V DEF;PRO ADP PART _
n na kònò to n bolo ! n bòra kònò le n ma !	ń ná kɔ̀nɔ tó ń bólo ! ń bɔra kɔ̀nɔ dè ń má !	PRO ADP N V PRO ADP _ 1;PRO;SG PFV;POS;V N PART 1;PRO;SG N _
a ye bara ta .	à yé bàra tà .	3;PRO;SG PFV;POS;V N V _
o ye a sòrò dennin tagara a ko , dennin nana amadu tara sigilen sòrò dòròn a sinna ka a fò ko a bè cè min nyini , ko kabini a ye sigi nin bèè kè a ma a furu , ko o ye nin cè nin de ye , ko a bè nin cè nin de fè .	ò yé à sɔ̀rɔ dén.nin tagara à kò , dén.nin nana ámadù tara sigilen sɔ̀rɔ dɔ́rɔn à sinna kà à fɔ́ kó à bɛ cɛ̀ mîn ɲíni , kó kàbini à ye sìgi nìn bɛ́ɛ kɛ́ à ma à fúru , kó ò yé nìn cɛ̀ nìn dè yé , kó à bɛ́ nìn cɛ̀ nìn dè fɛ̀ .	PRO PFV;POS;V 3;PRO;SG V N PFV;POS;V 3;PRO;SG V _ N PFV;POS;V PROPN PROPN PFV;V;V.PTCP V ADV 3;PRO;SG PFV;POS;V V 3;PRO;SG V PART 3;PRO;SG IPFV;POS;V N DET V _ PART CONJ 3;PRO;SG PFV;POS;V N DEF;DET DET V 3;PRO;SG NEG;PFV;V 3;PRO;SG V _ PART PRO POS;V DEF;DET N DEF;DET PART ADP _ PART 3;PRO;SG V DEF;DET N DEF;DET PART ADP _
subagamuso ani a biranmuso	subagamuso àni à búranmuso	N CONJ 3;PRO;SG N
a bɛ san caman bɔ bi , a kɔlɔsira afiriki tilebinyanfan jamanaw kɔnɔ , ko yɛlɛma belebelew donna baloko jogow la an ka duw kɔnɔ , duguba ani togoda bɛɛ la .	_ _ _ _ _ _ _ _ _ _ _ _ _ _ _ _ _ _ _ _ _ _ _ _ _ _ _ _ _ _ _ _	PRO V N ADJ V ADV _ PRO V PROPN N N ADP _ PART N ADJ V N N ADP PRO ADP N ADP _ N CONJ N DET ADP _
a sera duda la yòrò min , a ye dò ci .	à sera duda lá yɔ́rɔ mín , à yé dɔ́ cì .	3;PRO;SG PFV;POS;V N ADP N DET _ 3;PRO;SG PFV;POS;V N V _
nsiirinin , nsiirinin	nsíirinnin , nsíirinnin	N _ N
a tagara ji ta ka na a di a ma .	à tagara jí tà kà nà à dí à mà .	3;PRO;SG PFV;POS;V N V V V 3;PRO;SG V 3;PRO;SG ADP _
dow bè a fò fanta , dow bè a fò manu , dow bè a fò jènèba , mògò si ma se ka den tògò fò .	dɔ̀w bɛ à fɔ́ fanta , dɔ̀w bɛ à fɔ́ manu , dɔ̀w bɛ à fɔ́ jɛ̀nɛba , mɔ̀gɔ sí ma sé kà dén tɔ́gɔ fɔ́ .	PL;PRO IPFV;POS;V 3;PRO;SG V PROPN _ PL;PRO IPFV;POS;V 3;PRO;SG V PROPN _ PL;PRO IPFV;POS;V 3;PRO;SG V PROPN _ N DET NEG;PFV;V V V N N V _
a tilala , a ye i sigi ka kasi ka kasi ka kasi .	à tilala , à yé í sìgi kà kàsi kà kàsi kà kàsi .	3;PRO;SG PFV;POS;V _ 3;PRO;SG PFV;POS;V PRO V V V V V V V _
e ye min don nin ba ye o don .	é yé mín dɔ̀n nìn bá yé ò dɔ̀n .	2;PRO;SG PFV;POS;V PRO V DEF;DET N PFV;POS;V PRO V _
tinòò , na fana taata kòmòn na .	tinɔɔ , nà fána taara kɔ̀mɔn ná .	PROPN _ N PART PFV;POS;V N ADP _
a ye den dò sòrò .	à ye dén dɔ́ sɔ̀rɔ .	3;PRO;SG PFV;POS;V N DET V _
ko n sòn n na kònò na , n sòn n na kònò na , numuden !	kó ń sɔ́n ń ná kɔ̀nɔ ná , ń sɔ́n ń ná kɔ̀nɔ ná , numuden !	PART PRO V PRO ADP N ADP _ PRO V PRO ADP N ADP _ N _
a tagara dugu filanan dò la , a ye u nyininkali kè yen .	à tagara dùgu fìla.nan dɔ́ lá , à yé ù ɲìninka.li kɛ́ yèn .	3;PRO;SG PFV;POS;V N ADJ DET ADP _ 3;PRO;SG PFV;POS;V 3;PL;PRO N;V.MSDR V ADV _
dugutigi ye mɔgɔ bila ka taga a fɔ sonsannin ye ko ɲɛnajɛ bɔtuma surunyana , ko a ka labɛnw kɛ .	_ _ _ _ _ _ _ _ _ _ _ _ _ _ _ _ _ _ _ _ _	N V N V V V PRO V N ADP PART N N V _ PART PRO ADP N V _
kònòba ta tora fila .	kɔnɔba tá tora fìla .	N N PFV;POS;V NUM _
a cira a bolo tuma min , ba ye i kanto ko ne ka filen , a tè sara la , i bè taga ni a ye dè ka taga fo maromaroko .	à cira à bólo tùma mín , bá yé í kán.to kó né ká fílen , à tɛ́ sàra lá , í bɛ́ tága ní à yé dɛ́ kà tága fó maromaroko .	3;PRO;SG PFV;POS;V 3;PRO;SG N N DET _ N PFV;POS;V PRO V CONJ 1;PRO;SG ADP N _ 3;PRO;SG IPFV;NEG;V N ADP _ PRO IPFV;POS;V V ADP 3;PRO;SG ADP PART V V ADP PROPN _
a ye to nyumannin tobi ka a di a ma .	à yé tò ɲumannin tóbi kà à dí à mà .	3;PRO;SG PFV;POS;V N ADJ V V 3;PRO;SG V 3;PRO;SG ADP _
dugu jèlen , a ye syè fan saba di o tigi ma , ko ni i tagara , ni i sera duguso kòfè , i bè nin ci .	dùgu jɛlen , à yé syɛ̀ fán sàba dí ò tìgi mà , kó ní í tagara , ní í sera duguso kɔ́.fɛ̀ , í bɛ́ nìn cì .	N PFV;V;V.PTCP _ 3;PRO;SG PFV;POS;V N N NUM V DET N ADP _ CONJ CONJ PRO PFV;POS;V _ CONJ PRO PFV;POS;V N ADP _ PRO IPFV;POS;V DEF;PRO V _
su kora o la , o ko : ni o ko ko o bè taga nyè fè , warabaw bè o dun , ni o ko ko o bè segin kò fè , warabaw bè o dun .	sú kora ò lá , ò kó : ní ò kó kó ò bɛ́ tága ɲɛ́ fɛ̀ , warabaw bɛ ò dún , ní ò kó kó ò bɛ sègin kó fɛ̀ , warabaw bɛ ò dún .	N PFV;POS;V PRO ADP _ PRO V _ CONJ PRO V CONJ PRO IPFV;POS;V V N ADP _ N;PL IPFV;POS;V PRO V _ CONJ PRO V PART PRO IPFV;POS;V V N ADP _ PL;PROPN IPFV;POS;V PRO V _
u ye a fò ko ko u bè yen , ko mè ko u bèè bè kaso la .	ù yé à fɔ́ kó kó ù bɛ́ yèn , kó mè kó ù bɛ́ɛ bɛ́ kàso lá .	3;PL;PRO PFV;POS;V 3;PRO;SG V PART PART 3;PL;PRO POS;V ADV _ PART CONJ PART 3;PL;PRO DET POS;V N ADP _
ayiwa , n ye o ta yòrò min , n ye o bila yen .	áyiwa , ń ye ò tà yɔ́rɔ mîn , ń ye ò bìla yèn .	INTJ _ 1;PRO;SG PFV;POS;V PRO V N DET _ 1;PRO;SG PFV;POS;V PRO V ADV _
a tagara a sòrò jinamuso nyakelen bè yen .	à tagara à sɔ̀rɔ jínɛmuso ɲakelen bɛ́ yèn .	3;PRO;SG PFV;POS;V 3;PRO;SG V N N POS;V ADV _
ko a tun bè to ka to nyumannin tobi ka a di ne ma n diye sunògò .	kó à tùn bɛ́ tó kà tò ɲumannin tóbi kà à dí né mà ń dìyé sùnɔgɔ .	PART 3;PRO;SG PART;PST IPFV;POS;V V V N ADJ V V 3;PRO;SG V 1;PRO;SG ADP 1;PRO;SG V V _
o tagara o fò o cènin fila bamuso fè , ko e ma ye ko a denw bè yèlèn na lemurusun na ?	ò tagara ò fɔ́ ò cɛ̀.nin fìla bá.muso fɛ̀ , kó é má yé kó à denw bɛ́ yɛ̀lɛn ná lemurusun ná ?	PRO PFV;POS;V PRO V DET N NUM N ADP _ PART 2;PRO;SG V V PART 3;PRO;SG N;PL IPFV;POS;V N ADP N ADP _
subagamuso nin mana a fò ko a bè a fa , a bèè bònna .	subagamuso nìn mána à fɔ́ kó à bɛ́ à fá , à bɛ́ɛ bɔnna .	N DEF;DET COND;POS;V 3;PRO;SG V PART 3;PRO;SG IPFV;POS;V 3;PRO;SG V _ 3;PRO;SG DET PFV;POS;V _
a bɛ k' i ta i tɛgɛ ma k' i bolonkɔniw kɛ taamashyɛn ye , ko “ i ma bolonkɔniw ye ? "	_ _ _ _ _ _ _ _ _ _ _ _ _ _ _ _ _ _ _ _ _ _ _	PRO V V PRO V PRO N ADP V PRO N V N ADP _ PART _ PRO V N V _ _
n bòra lògò le genju ! genju , n na tulu to n bolo !	ń bɔra dɔ́gɔ dè kùn.jɛ ! kùnjɛ , ń ná túlu tó ń bólo !	PRO PFV;POS;V N PART N _ N _ 1;PRO;SG ADP N V 1;PRO;SG ADP _
nsiirin nin banna .	nsíirin nìn banna .	N DEF;DET PFV;POS;V _
dennin ye kule la : e jasun , e jasun !	dén.nin yé kúle dá : ée jasun , ée jasun !	N PFV;POS;V N V _ INTJ PROPN _ INTJ PROPN _
a ko tèmèn ni e da ye .	à kó tɛ̀mɛn ní é dá yé .	3;PRO;SG V V ADP 2;PRO;SG N ADP _
a bè a ta ka yèlèn ni a ye san fè .	à bɛ à tà kà yɛ̀lɛn ni à yé sán fɛ̀ .	3;PRO;SG IPFV;POS;V 3;PRO;SG V V V ADP 3;PRO;SG ADP N ADP _
a ye a sòrò den saba tun bè subagamuso nin yèrè fè .	à yé à sɔ̀rɔ dén sàba tùn bɛ́ subagamuso nìn yɛ̀rɛ fɛ̀ .	3;PRO;SG PFV;POS;V 3;PRO;SG V N NUM PART;PST POS;V N DEF;DET DET ADP _
mama ngala ko ko n ka a sanba unhun kèndè dò .	máma ŋála kó kó ń ka à sàma ùnhun kɛ́ndɛ dɔ́ .	N N V PART 1;PRO;SG POS;SBJV;V 3;PRO;SG V N ADJ DET _
e ma a ye fulakè nin bè n gèn wa ?	é má à yé fulakɛ nìn bɛ́ ń gɛ́n wà ?	2;PRO;SG V 3;PRO;SG V N DEF;DET IPFV;POS;V PRO V PART _
a ko i bè taga min ?	à kó í bɛ́ tága mín ?	3;PRO;SG V PRO IPFV;POS;V V PRO _
a ko èè nin ye jòn den nyuman ye ?	à kó ée nìn yé jɔ́n dén ɲùman yé ?	3;PRO;SG V INTJ DEF;PRO POS;V PRO N ADJ ADP _
a tagara ni a ye fo dennin bonyara .	à tagara ni à yé fó dennin bonyara .	3;PRO;SG PFV;POS;V ADP 3;PRO;SG ADP CONJ N PFV;POS;V _
olu bè tulu camanba bò ka di a ma .	ò.lú bɛ́ túlu camanba bɔ́ kà dí à mà .	PL;PRO IPFV;POS;V N ADJ V V V 3;PRO;SG ADP _
den min bè a kònò , a ko : n na , ne wolo , ko ne bè e nyun .	dén mín bɛ́ à kɔ́nɔ , à kó : ń nà , né wólo , kó né bɛ́ é ɲún .	N DET POS;V 3;PRO;SG ADP _ 3;PRO;SG V _ PRO N _ 1;PRO;SG V _ PART 1;PRO;SG IPFV;POS;V 2;PRO;SG V _
a fɔ i dugudenw ye , ko u bɛɛ ka na ni basi sogo , kini , dɛgɛ , ani dumuni duman caman ye .	_ _ _ _ _ _ _ _ _ _ _ _ _ _ _ _ _ _ _ _ _ _ _ _ _	PRO V PRO N ADP _ PART PRO DET V V ADP N N _ N _ N _ CONJ N ADJ ADJ ADP _
o tuma , jelikè ye i tògò dòn an bè i di o ma .	ò tùma , jèlikɛ ye í tɔ́gɔ dɔ́n án bɛ í dí ò mà .	DET N _ N PFV;POS;V 2;PRO;SG N V 1;PL;PRO IPFV;POS;V 2;PRO;SG V PRO ADP _
a ye i sigi ka kasi ka kasi .	à yé í sìgi kà kàsi kà kàsi .	3;PRO;SG PFV;POS;V PRO V V V V V _
dennin nana i bolo da a kun ka kulè san fè , a ko : e jasun , e jasun !	dén.nin nana í bólo dá à kùn kà kúle sán fɛ̀ , à kó : ée jasun , ée jasun !	N PFV;POS;V PRO N V 3;PRO;SG ADP V V N ADP _ 3;PRO;SG V _ INTJ PROPN _ INTJ PROPN _
u ba ninw fana bèè furu sara .	ù bá ninw fána bɛ́ɛ fúru sara .	3;PL;PRO N DEF;DET;PL PART DET N PFV;POS;V _
genju ko ko mun kèra ?	kùn.jɛ kó kó mùn kɛra ?	N V PART PRO PFV;POS;V _
a sinna ka wuli , ka a den bèè kantigè .	à sinna kà wúli , kà à dén bɛ́ɛ kán.tigɛ .	3;PRO;SG PFV;POS;V V V _ V 3;PRO;SG N DET V _
a nalen , a fa ko a ma : “ e tun bɛ mun na yen , e ta tɔ tun tɛ bo kɛ ye bilen !	à nalen , à fà kó à mà : “ ê tùn bɛ́ mùn ná yèn , ê tá tɔ̀ tùn tɛ́ bò kɛ́ yé bìlen !	3;PRO;SG PFV;V;V.PTCP _ 3;PRO;SG N V 3;PRO;SG ADP _ _ 2;PRO;SG PART;PST V PRO ADP ADV _ 2;PRO;SG N N PART;PST NEG;V N N ADP ADV _
o kèra misi ye .	ò kɛra mìsi yé .	PRO PFV;POS;V N ADP _
ne ba dun ma kaba wolo sa .	nê bá dún ma kába wólo sá .	1;PRO;SG N PART NEG;PFV;V N V PART _
syèdennin yèlènna ka lenburusun yuguyugu .	syɛdennin yɛlɛnna kà lenburusun yúguyugu .	N PFV;POS;V V N V _
a ko a tè kala yòrò si fo ka na yan .	à kó à tɛ́ kála yɔ́rɔ sí fó kà nà yàn .	3;PRO;SG V 3;PRO;SG IPFV;NEG;V V N DET CONJ V V ADV _
ayiwa , a nana o ta , mògò min mana na , o bè a fò ko den nin tògò ?	áyiwa , à nana ò tà , mɔ̀gɔ mîn mánà nà , ò bɛ à fɔ́ kó dén nìn tɔ́gɔ ?	INTJ _ 3;PRO;SG PFV;POS;V PRO V _ N DET COND;POS;V V _ PRO IPFV;POS;V 3;PRO;SG V PART N DEF;DET N _
ko ayi .	kó àyi .	PART INTJ _
<> nsiiri sabanan </>	_ nsíiri sábanan _	_ N ADJ _
sosow ye i kanto ko e kòrò san ko a dun kèra cògò di ?	sosow yé í kán.to kó ée kɔ̀rɔ san kó à dùn kɛra cógo dì ?	N;PL PFV;POS;V PRO V PART INTJ N PROPN PART 3;PRO;SG PART PFV;POS;V N PRO _
namaramatu ta tora fila , a ta tora kelen .	namaramatu tá tora fìla , à tá tora kélen .	PROPN N PFV;POS;V NUM _ 3;PRO;SG N PFV;POS;V NUM _
a ko : e de ye nin ye wa ?	à kó : é dè yé nìn yé wà ?	3;PRO;SG V _ 2;PRO;SG PART POS;V DEF;PRO ADP PART _
‐ ne ka so dun tè bin dun ?	‐ nê ka sò dún tɛ bín dún ?	_ 1;PRO;SG ADP N PART IPFV;NEG;V N V _
masa ala ye kojugunin da n nyè .	màsa ála ye kojugunin dá ń ɲɛ́ .	N N PFV;POS;V N V 1;PRO;SG ADP _
a bamuso ko a ka taga a nyini , ko a ka taga nyèkili fila nyini ka na .	à bá.muso kó à ká tága à ɲíni , kó à ká tága ɲɛ́.kili fìla ɲíni kà nà .	3;PRO;SG N V 3;PRO;SG V V 3;PRO;SG V _ PART 3;PRO;SG V V N NUM V V V _
amadu tara terikè sèbè , o ka jeli nyuman minw bèè bè yen , ni a bè sòn olu ka kuma ma , u tagara olu deli ka kuma nin cogoya bèè fò olu ye , ko u ka taga a fò amadu tara fa ye , ko amadu tara bè yafa nyini a fa fè , a bè nyini a fè u ka nyògòn ye , a ka kuma kelen dòròn fò a ye , ko o tuma na , ko o bè diya a ye kosèbè .	ámàdu tara térikɛ sɛ̀bɛ , ò ka jèli ɲùman minw bɛ́ɛ bɛ́ yèn , ní à bɛ sɔ̀n òlû ka kúma mà , ù tagara òlû déli kà kúma nìn cógoya bɛ́ɛ fɔ́ òlû yé , kó ù ka tága à fɔ́ ámàdu tara fà yé , kó ámàdu tara bɛ yàfa ɲíni à fà fɛ̀ , à bɛ ɲíni à fɛ̀ ù ka ɲɔ́gɔn yé , à ka kúma kélen dɔ́rɔn fɔ́ à yé , kó ò tùma ná , kó ò bɛ díya à yé kósɛbɛ .	PROPN PROPN N ADJ _ PRO ADP N ADJ PL;PRO DET V ADV _ CONJ 3;PRO;SG IPFV;POS;V V PL;PRO ADP N ADP _ 3;PL;PRO PFV;POS;V PL;PRO V V N DEF;DET N DET V PL;PRO ADP _ PART 3;PL;PRO POS;SBJV;V V 3;PRO;SG V PROPN PROPN N ADP _ PART PROPN PROPN IPFV;POS;V N V 3;PRO;SG N ADP _ 3;PRO;SG IPFV;POS;V V 3;PRO;SG ADP 3;PL;PRO POS;SBJV;V PRO V _ 3;PRO;SG POS;SBJV;V N NUM DET V 3;PRO;SG ADP _ PART DET N ADP _ PART PRO IPFV;POS;V V 3;PRO;SG ADP ADV _
a ko ònhòn , i bè yèlèn n kan !	à kó ɔ̀nhɔ́n , í bɛ yɛ̀lɛn ń kàn !	3;PRO;SG V INTJ _ 2;PRO;SG IPFV;POS;V V 1;PRO;SG ADP _
ta ta ta ta ne ye a da gè !	ta ta ta ta nê ye à dá gɛ́n !	INTJ INTJ INTJ INTJ 1;PRO;SG PFV;POS;V 3;PRO;SG N V _
a ye kònòba nin faga .	à yé kɔnɔba nìn fàga .	3;PRO;SG PFV;POS;V N DEF;DET V _
n bada ma fèn nin ye .	ń báda má fɛ́n nìn yé .	PRO ADV V N DEF;DET V _
ko e , ko ale bilen ma sunògò ?	kó ée , kó àle bìlen má sùnɔgɔ ?	PART INTJ _ PART 3;PRO;SG PART V V _
musokòrònin ko ko a tè nin ye , ko nin don dè .	mùsokɔrɔnin kó kó à tɛ́ nìn yé , kó nìn dòn dɛ́ .	N V PART 3;PRO;SG NEG;V PRO ADP _ CONJ PRO V PART _
syèfan ani syèdennin	syɛ̀.fan àni syɛdennin	N CONJ N
n bòra kònò le n ma , n ma bòra kalakari wo kalakari .	ń bɔra kɔ̀nɔ dè ń má , ń má bɔra kàlakari ô kàlakari .	1;PRO;SG PFV;POS;V N PART 1;PRO;SG N _ 1;PRO;SG N PFV;POS;V N CONJ N _
dennin ye gaari tigè , dògò nòròla .	dénnin yé gáari tìgɛ , dɔ́gɔ nɔrɔla .	N PFV;POS;V N V _ N PFV;POS;V _
o ko mun kèra ?	ò kó mùn kɛra ?	PRO V PRO PFV;POS;V _
a lara .	à dára .	3;PRO;SG PFV;POS;V _
a bè ba nin sin ta ka a min .	à bɛ bá nìn sín tà kà à mìn .	3;PRO;SG IPFV;POS;V N DEF;DET N V V 3;PRO;SG V _
namaramatu ye a fò wiyan wiyan wiyan !	namaramatu yé à fɔ́ wiyan wiyan wiyan !	PROPN PFV;POS;V 3;PRO;SG V INTJ INTJ INTJ _
dennin ka gaari yèrè tò kelen tigèra sa ka o fili .	dén.nin kà gáari yɛ̀rɛ tɔ̀ kélen tigɛra sá kà ò fìli .	N ADP N DET N NUM PFV;POS;V PART V PRO V _
a taara kabini sɔgɔma fo tilelafana dun tuma .	à táara kàbini sɔ̀gɔmà fó tìlelafana dún tùma .	3;PRO;SG PFV;POS;V ADP N ADP N N N _
jamanatigi nin fana kènèyalen , a ye amadu tara ba furu sa , ka a gèn ka bò dugu yòrò bèè la fo ka taga a bila kungokolon kònò , ko mògò si kana se a bara yen , ko mògò si kana se a filè yen , ko hali dugumògò si .	jàmanatigi nìn fána kɛnɛyalen , à ye ámàdu tara bá fúru sà , kà à gɛ́n kà bɔ́ dùgu yɔ́rɔ bɛ́ɛ lá fó kà tága à bìla kúngokolon kɔ́nɔ , kó mɔ̀gɔ sí kànâ sé à bára yèn , kó mɔ̀gɔ sí kànâ sé à fílɛ yèn , kó hálì dugumɔgɔ sí .	N DEF;DET PART PFV;V;V.PTCP _ 3;PRO;SG PFV;POS;V PROPN PROPN N N V _ V 3;PRO;SG V V V N N DET ADP CONJ V V 3;PRO;SG V N ADP _ PART N DET IMP;NEG;V V 3;PRO;SG ADP ADV _ PART N DET IMP;NEG;V V 3;PRO;SG V ADV _ PART PART N DET _
o tuma na a ye denkè ninw bèè , a ye a denkè kònòntò ninw bèè wele ka u sigi ka kuma u fè .	ò tùma ná à yé dén.kɛ ninw bɛ́ɛ , à yé à dén.kɛ kɔ̀nɔntɔn ninw bɛ́ɛ wéle kà ù sìgi kà kúma ù fɛ̀ .	PRO N ADP 3;PRO;SG PFV;POS;V N DEF;DET;PL DET _ 3;PRO;SG PFV;POS;V 3;PRO;SG N NUM DEF;DET;PL DET V V 3;PL;PRO V V V 3;PL;PRO ADP _
mininyan ye i la bere fè yòrò min , a ye a ni bere siri kòrr !	míni.ɲan yé í dá bére fɛ̀ yɔ́rɔ mín , à yé à ní bére sìri kɔ́rr !	N PFV;POS;V PRO V N ADP N DET _ 3;PRO;SG PFV;POS;V 3;PRO;SG CONJ N V INTJ _
a ko an tè i faga an bè i nyininka dòròn .	à kó án tɛ í fàga án bɛ í ɲìninka dɔ́rɔn .	3;PRO;SG V 1;PL;PRO IPFV;NEG;V 2;PRO;SG V 1;PL;PRO IPFV;POS;V 2;PRO;SG V ADV _
a ko : bilali yo , bilali yo !	à kó : bilali yó , bilali yó !	3;PRO;SG V _ PROPN PART _ PROPN PART _
syèdennin ka yèlè ka yèlè ka yèlè .	syɛdennin ka yɛ́lɛ kà yɛ́lɛ kà yɛ́lɛ .	N POS;SBJV;V V V V V V _
a ko : è cènin wo , e tè sunògò wa ?	à kó : ɛ́ cɛ̀.nin wó , é tɛ́ sùnɔgɔ wà ?	3;PRO;SG V _ INTJ N PART _ 2;PRO;SG IPFV;NEG;V V PART _
dugu bèe ye nyògòn dalajè .	dùgu bɛ́ɛ ye ɲɔ́gɔn dálajɛ̀ .	N DET PFV;POS;V PRO CAUS;V _
a ko abada ko fo ale ka taga , ko ko ni a kòròkèw sara yòrò min , ko a bè sa yen .	à kó ábada kó fó àle kà tága , kó kó ní à kɔrɔkɛw sara yɔ́rɔ mín , kó à bɛ́ sà yèn .	3;PRO;SG V ADV PART CONJ 3;PRO;SG V V _ PART PART CONJ 3;PRO;SG N;PL PFV;POS;V N DET _ PART 3;PRO;SG IPFV;POS;V V ADV _
jinèmusonin fana tagara , ko a bè jamanatigi de nyini ko ka a ye , a tagara a fè yen ka a fò a ye ko ale ko ale furula dò de ma u ka jinèdugu yenninnò ko o tògò ye amadu tara , ko o tigi tun tagara fura nyini , ko ka na a di a fa de ma , ko a ye fura sòrò , ko a nana ko ale nana o tigi de nyini sisanninnò .	jinɛmusonin fána tagara , kó à bɛ jàmanatigi dè ɲíni kó kà à yé , à tagara à fɛ̀ yèn kà à fɔ́ à yé kó àlê kó àlê furula dɔ́ dè mà ù kà jinɛdugu yènninɔ kó ò tɔ́gɔ yé ámàdu tara , kó ò tìgi tùn tagara fúra ɲíni , kó kà nà à dí à fà dè mà , kó à ye fúra sɔ̀rɔ , kó à nana kó àlê nana ò tìgi dè ɲíni sísannìnnɔ́ .	N PART PFV;POS;V _ PART 3;PRO;SG IPFV;POS;V N PART V PART V 3;PRO;SG V _ 3;PRO;SG PFV;POS;V 3;PRO;SG ADP ADV V 3;PRO;SG V 3;PRO;SG ADP PART 3;PRO;SG V 3;PRO;SG PFV;POS;V N PART ADP 3;PL;PRO V N ADV PART PRO N POS;V PROPN PROPN _ PART PRO N PART;PST PFV;POS;V N V _ PART V V 3;PRO;SG V 3;PRO;SG N PART ADP _ PART 3;PRO;SG PFV;POS;V N V _ PART 3;PRO;SG PFV;POS;V PART 3;PRO;SG PFV;POS;V PRO N PART V N _
a ko e dakabanako !	à kó ée dakabanako !	3;PRO;SG V INTJ N _
o tuma na , a ko amadu tara ka yèlèn a kan , ko a bè taga o bila o jiri nin sanfè .	ò tùma ná , à kó ámadù tara ká yɛ̀lɛn à kàn , kó à bɛ́ tága ò bìla ò jíri nìn sán.fɛ̀ .	DET N ADP _ 3;PRO;SG V PROPN PROPN V V 3;PRO;SG ADP _ PART 3;PRO;SG IPFV;POS;V V PRO V DET N DEF;DET ADP _
a ye i sin ka taga kolonkala minè , a ye kolo nin susu ka a kè daga kònò .	à yé í sín kà tága kòlon.kala mìnɛ , à yé kólo nìn sùsu kà à kɛ́ dàga kɔ́nɔ .	3;PRO;SG PFV;POS;V PRO V V V N V _ 3;PRO;SG PFV;POS;V N DEF;DET V V 3;PRO;SG V N ADP _
o ma kaba wolo .	ò ma kába wólo .	PRO NEG;PFV;V N V _
a sinna ka taga jamanatigi wele ka amadu tara jira a la , ko bòn ko a denmuso ko ko a bè nin de fè , ko u bè furu siri .	à sinna kà tága jàmanatigi wéle kà ámàdu tara jìra à lá , kó bòn kó à dénmuso kó kó à bɛ́ nìn dè fɛ̀ , kó ù bɛ fúru sìri .	3;PRO;SG PFV;POS;V V V N V V PROPN PROPN V 3;PRO;SG ADP _ PART INTJ PART 3;PRO;SG N V PART 3;PRO;SG V PRO PART ADP _ PART 3;PL;PRO IPFV;POS;V N V _
a bè a ci a kòrò yòrò min sonsannin ye i pan ka taga i jò pak !	à bɛ à cì à kɔ́rɔ yɔ́rɔ mîn sonsannin ye í pán kà tága í jɔ̀ pak !	3;PRO;SG IPFV;POS;V 3;PRO;SG V 3;PRO;SG ADP N DET N PFV;POS;V PRO V V V PRO V INTJ _
bamusosinkelentigè , ele tògò namaramatu !	bá.muso.sin.kelen.tigɛ , àle tɔ́gɔ namaramatu !	N _ 3;PRO;SG N PROPN _
o fana nyaji kelen bè kan ka bò , kelen dò jalen bè .	ò fána ɲaji kélen bɛ́ kàn kà bɔ́ , kélen dɔ́ jalen bɛ́ .	PRO PART N NUM POS;V ADP V V _ NUM DET PFV;V;V.PTCP POS;V _
a ye segi minè ka a fa .	à yé sègi mìnɛ kà à fá .	3;PRO;SG PFV;POS;V N V V 3;PRO;SG V _
a ko filen nin bè kala .	à kó fílen nìn bɛ́ kála .	3;PRO;SG V N DEF;DET IPFV;POS;V V _
a ma sòn ka a tògò fò mògò si ye .	à ma sɔ̀n kà à tɔ́gɔ fɔ́ mɔ̀gɔ sí yé .	3;PRO;SG NEG;PFV;V V V 3;PRO;SG N V N DET ADP _
fulakè nana sunògò .	fulakɛ nana sùnɔgɔ .	N PFV;POS;V V _
o kèra dòròn , yirisun wulila ni cènin fila ye .	ò kɛra dɔ́rɔn , yirisun wulila ní cɛ̀.nin fìla yé .	PRO PFV;POS;V ADV _ N PFV;POS;V ADP N NUM ADP _
n bòra n na jègè le kògòji kògòji , n na kògò to n bolo	ń bɔra ń ná jɛ́gɛ dè kɔ̀gɔji kɔ̀gɔji , ń ná kɔ̀gɔ tó ń bólo	1;PRO;SG PFV;POS;V 1;PRO;SG ADP N PART N N _ 1;PRO;SG ADP N V 1;PRO;SG ADP
bòtu , n na muru to n bolo !	bɔ̀.tu , ń ná mùru tó ń bólo !	N _ PRO ADP N V PRO ADP _
