bir zamanlar latium'dan tüm i̇talya'ya yapıldığı gibi devletin ekonomik ve yargı mekanizmalarının akdeniz'de uygulanabileceği entegrasyonun temelini oluşturdu .	bir zaman latium tüm i̇talya' yap gibi devlet ekonomik ve yargı mekanizma akdeniz uygulanabil entegrasyon temel oluş .	DET;INDF;POS;SG N;PL AT+ABL;PROPN;SG DEF;DET;POS;SG DAT;PROPN;SG ADJ;POS;PSS3S;SG ADP GEN;N;SG ADJ;SG CONJ N;SG GEN;N;PL;PSS3S ESS;PROPN;SG ADJ;POS;PSS3S;SG GEN;N;SG ACC;N;PSS3S;SG 3;CAUS;IND;PFV;PST;SG;V _
nicholas stoller'ın yönettiği ve jason segel'in başrolde oynadığı 2012 yapımı five - year engagement filminde başrol oynadı .	nicholas stoller yönet ve jason segel başrol oyna 2012 yapı five - year engagement film başrol oyna .	PROPN;SG GEN;PROPN;SG ADJ;POS;PSS3S;SG CONJ PROPN;SG GEN;PROPN;SG ESS;N;SG ADJ;POS;PSS3S;SG N;SG N;PSS3S;SG _ _ _ _ ESS;N;PSS3S;SG N;SG 3;IND;PFV;PST;SG;V _
punta del este'de ki deniz feneri simgesini punta rasa'da ki deniz feneri simgesine bağlayan hayali çizgi , bu ikinci sınırdan dış sınıra kadar kalan kısım dır .	pun del este ki deniz feneri simge pun rasa ki deniz feneri simge bağla hayali çizgi , bu ikinci sınır dış sınır kadar kal _ _ .	PROPN;SG 2;PROPN;PRS;SG ESS;PROPN;SG ADP N;SG N;PSS3S;SG ACC;N;PSS3S;SG PROPN;SG ESS;PROPN;SG ADP N;SG N;PSS3S;SG DAT;N;PSS3S;SG ADJ;POS;SG ADJ;PSS3S;SG N;NOM;SG _ DEF;DET;POS;SG NUM;SG AT+ABL;N;SG ADJ;SG DAT;N;SG ADP ADJ;POS;SG N;SG 3;PFV;PRS;SG;V _
çek sınır muhafızları mayıs'ta sınır kontrolü için durmadan çekoslovakya sınırını geçmeye çalışan iki sudeten alman çiftçisini vurdu .	çek sınır muhafız mayıs sınır kontrolü için dur çekoslovakya sınır geç çalış iki sude alman çiftçi vur .	PROPN;SG N;SG N;NOM;PL;PSS3S ESS;N;SG N;SG N;PSS3S;SG ADP ADV;IND;NEG;PFV;PRS;V.CVB PROPN;SG ACC;N;PSS3S;SG DAT;IND;N;PFV;PRS;V.MSDR ADJ;POS;SG NUM;SG PROPN;SG PROPN;SG ACC;N;PSS3S;SG 3;IND;PFV;PST;SG;V _
i̇ş yerinde meydana gelen durumların çoğu tartışma olmadan çözülebilse de .	iş yer meydan gel durum çok tartış ol çözülebil de .	N;SG ESS;N;PSS3S;SG DAT;N;SG ADJ;POS;SG GEN;N;PL N;NOM;SG IND;N;NOM;PFV;PRS;V.MSDR ADV;IND;NEG;PFV;PRS;V.CVB 3;PASS;PRS;SG;V ADV _
genelde feci boyutta patlamalar şeklinde gerçekleşmezler .	genelde feci boyut patlama şekil gerçekleş .	ADV ADJ;SG ESS;N;SG N;NOM;PL;POS ESS;N;PSS3S;SG 3;IND;PL;PRS;V _
orta andlar , okyanus kabuğunun yutulmasıyla oluşan ve " andes de tipo andino " olarak adlandırılan yapıya ait tir .	orta andlar , okyanus kabuk yutulma oluş ve " andes de tipo andino " olarak adlandır yapı ait i .	N;SG NOM;PL;PROPN _ N;SG GEN;N;PSS3S;SG CAUS;IND;INS;N;PFV;PRS;PSS3S;V.MSDR ADJ;POS;SG CONJ _ PROPN;SG _ _ _ _ POS;V ADJ;POS;SG DAT;N;SG ADJ;SG 3;PFV;PRS;SG;V _
kılavuzun problemli olmasının ilk sebebi " olağanüstü hal kapsamında " oluşturulması dır .	kılavuzun problemli ol ilk sebebi " olağanüstü hal kapsam " oluş i .	GEN;N;SG ADJ;SG GEN;IND;PFV;PRS;PSS3S;V;V.MSDR ADJ;SG N;NOM;PSS3S;SG _ ADJ;SG N;SG ESS;N;PSS3S;SG _ IND;N;NOM;PFV;PRS;PSS3S;V.MSDR 3;PFV;PRS;SG;V _
karayipler ismi , 15. yüzyılın sonlarında avrupa'nın burayla temas kurduğu dönemde bölgede ki baskın konuma sahip yerli amerikan gruplarından cariblere dayanmakta dır .	karayip isim , 15 yüzyıl son avrupa bura temas kur dönem bölge ki baskı konu sahip yerli amerikan grup carib _ _ .	PROPN;SG N;NOM;PSS3S;SG _ NUM;SG GEN;N;SG ESS;N;PL;PSS3S GEN;PROPN;SG INS;POS;PRO;SG N;SG ADJ;POS;PSS3S;SG ESS;N;SG ESS;N;SG ADP ADJ;SG DAT;N;SG ADJ;SG ADJ;SG PROPN;SG AT+ABL;N;PL;PSS3S DAT;PL;PROPN 3;PASS;PROG;PRS;SG;V 3;PFV;PRS;SG;V _
belirtildiği gibi , karar ecb'nin imtiyazında dır ve bankanın diğer alternatifleri gözden geçirme şansını yok sayarak onun adına konuşması uygun olmaz .	belirtil gibi , karar ecb imtiyaz i ve banka diğer alternatifi göz geçir şans yok say o ad konuş uygun ol .	N;POS;PSS3S;SG ADP _ N;NOM;SG GEN;PROPN;SG ESS;N;PSS3S;SG 3;PFV;PRS;SG;V CONJ GEN;N;SG DEF;DET;POS;SG ACC;N;PL AT+ABL;N;SG IND;N;PFV;PRS;V.MSDR ACC;N;PSS3S;SG ADJ;NEG POS;V GEN;POS;PRO;SG DAT;N;PSS3S;SG IND;N;NOM;PFV;PRS;PSS3S;V.MSDR ADJ;SG 3;HAB;NEG;PRS;SG;V _
darius'un oldukça saygın komutanı megabazus , balkanlar'da ki fetihlerini gerçekleştirmekten sorumlu ydu .	darius ol saygı komutan megabazus , balkanlar ki fetih gerçekleştir sorumlu i .	GEN;PROPN;SG ADV ADJ;SG N;PSS3S;SG NOM;PROPN;SG _ ESS;PROPN;SG ADP ACC;N;PL;PSS3S AT+ABL;CAUS;IND;N;PFV;PRS;SG;V.MSDR ADJ;SG 3;IND;PFV;PST;SG;V _
şehrin polis departmanına göre , " kendilerini bölgenin hakimi olarak tanımlayan büyük bir grubun " salı günü seti basmasının ardından kavga çıktı .	şehir polis departman göre , " kendi bölge hak olarak tanımla büyük bir grup " salı gün set basmas ardından kavga çık .	GEN;N;SG N;SG DAT;N;PSS3S;SG ADP _ _ ACC;PRO;PSS3P;SG GEN;N;SG N;PSS3S;SG POS;V ADJ;POS;SG ADJ;SG DET;INDF;POS;SG GEN;N;SG _ N;SG N;PSS3S;SG ACC;N;SG GEN;IND;N;PFV;PRS;PSS3S;V.MSDR ADP N;NOM;SG 3;IND;PFV;PST;SG;V _
carcassonne'in tarihi , surlarla çevrili şehriyle doğrudan bağlantılı dır .	carcassonne tarih , sur çevrili şehr doğru _ _ .	GEN;PROPN;SG N;NOM;PSS3S;SG _ INS;N;PL ADJ;SG INS;N;PSS3S;SG ADJ;SG ADJ;SG 3;PFV;PRS;SG;V _
yakın tarihli bir röportajda zay ve zayion sıradan bir dizüstü bilgisayarında kaydettikleri " knuck if you buck " versiyonundan bahsetti .	yak _ bir röportaj zay ve zayion sıradan bir dizüst bilgisayar kaydet " knuck if you buck " versiyonun bahset .	ADJ;SG ADJ;SG DET;INDF;POS;SG ESS;N;SG PROPN;SG CONJ PROPN;SG ADJ;AT+ABL;SG DET;INDF;POS;SG N;SG ESS;N;PSS3S;SG ADJ;POS;PSS3P;SG _ SG _ _ SG _ AT+ABL;N;PSS3S;SG 3;IND;PFV;PST;SG;V _
bu şehir devlet , sukhothai ile aynı dönemde ortaya çıktı .	bu şehir devlet , sukhothai ile aynı dönem orta çık .	DEF;DET;POS;SG N;SG N;NOM;SG _ PROPN;SG ADP ADJ;SG ESS;N;SG DAT;N;SG 3;IND;PFV;PST;SG;V _
2013 sezonundan sonra ctv montreal'de misafir hava durumu sunucusu olarak göründü .	2013 sezon sonra ctv montreal misafir hava durum sunucu olarak görün .	NUM;SG AT+ABL;N;PSS3S;SG ADP PROPN;SG ESS;PROPN;SG N;SG N;SG N;PSS3S;SG N;PSS3S;SG POS;V 3;IND;PFV;PST;SG;V _
yere indiklerinde diğer partiküllere çarparak onların havaya kalkmalarına neden olurlar ve bir zincirleme reaksiyon başlatırlar .	yer in diğer partikül çarp o hava kalk neden ol ve bir zincirlem reaksiyon başlatı .	DAT;N;SG ESS;N;PL;POS;PSS3S DEF;DET;POS;SG DAT;N;PL ADV;POS GEN;PL;POS;PRO DAT;N;SG DAT;IND;N;PFV;PRS;PSS3P;V.MSDR N;SG 3;HAB;PL;PRS;V CONJ DET;INDF;POS;SG IND;N;NOM;PFV;PRS;V.MSDR N;SG 3;CAUS;HAB;PL;PRS;V _
belki de bu yüzden gözyaşı bulutları göz bebeklerini bulandırırken , zamanın akışı hasadını ortaya çıkarıp , gizemini durgun sulara salıyordu .	belki de bu yüz gözyaşı bulut göz bebek bulandırı , zaman akış hasad orta çıkar , gizem durgun su sal .	ADV ADV DEF;DET;POS;SG AT+ABL;N;SG N;PSS3S;SG N;NOM;PSS3P;SG N;SG ACC;N;PL;PSS3P ADV;POS _ GEN;N;SG N;NOM;POS;PSS3S;SG ACC;N;PSS3S;SG DAT;N;SG ADV;POS _ ACC;N;PSS3S;SG ADJ;SG DAT;N;PL 3;IND;PROG;PST;SG;V _
yıllık ankette ayrıca , yeni mali yük altına girmekle ilgili endişelerin oldukça arttığını da ortaya koydu .	yıllık anket ayrıca , yeni mali yük alt gir ilgili endişe oldukça art da orta koy .	N;SG ESS;N;SG ADV _ ADJ;SG ADJ;SG N;SG DAT;N;PSS3S;SG IND;INS;N;PFV;PRS;V.MSDR ADJ;SG GEN;N;PL ADV ACC;N;POS;PSS3S;SG ADV DAT;N;SG 3;IND;PFV;PST;SG;V _
elbette seçimlerden bahsediyoruz , " taht oyunları'ndan " değil .	elbet seçim bahsed , " taht oyunları'n " değil .	ADV AT+ABL;N;PL 1;IND;PL;PROG;PRS;V _ _ N;SG AT+ABL;N;PL;PSS3S _ 3;IND;NEG;PRS;SG;V _
hitchcock , bill gold ve saul bass gibi gün film poster tasarımcılarının en iyi yeteneği ile çalışmayı tercih etti ve filmleri doğru biçimde temsil eden posterler üretecekti .	hitchcock , bill gold ve saul bass gibi gün film poster tasarımcı en iyi yetenek ile çalış tercih et ve filmi doğru biçim temsil et poster üretecek .	NOM;PROPN;SG _ PROPN;SG PROPN;SG CONJ PROPN;SG PROPN;SG ADP N;SG N;SG N;SG GEN;N;PL ADV ADJ;SG N;PSS3S;SG ADP ACC;IND;N;PFV;PRS;V.MSDR N;SG 3;IND;PFV;PST;SG;V CONJ ACC;N;PL;PSS3S ADJ;SG ESS;N;SG N;SG ADJ;POS;SG N;PL 3;CAUS;IND;PROSP;PST;SG;V _
belki de uzun süre uğraşmayacağım için önemi olmaz .	belki de uzun süre uğraşmay için önem ol .	ADV ADV ADJ;SG N;SG 1;FUT;IND;N;NEG;PFV;SG ADP N;NOM;PSS3S;SG 3;HAB;NEG;PRS;SG;V _
i̇zlanda'nın çok daha sonra ki bir tarihe kadar ( 1918 ) danimarka'nın siyasi denetimi altında olmasına rağmen , i̇zlandaca dili danimarkacadan çok az etkilenip çok az kelime almıştır .	i̇zlanda çok daha sonra ki bir tarih kadar ( 1918 ) danimarka siyasi denetim alt ol rağmen , i̇zlandaca dili danimarkaca çok az etkilen çok az kelime al .	GEN;PROPN;SG ADV ADV ADP ADP DET;INDF;POS;SG DAT;N;SG ADP _ NUM;SG _ GEN;PROPN;SG ADJ;SG N;PSS3S;SG ESS;N;PSS3S;SG DAT;IND;N;PFV;PRS;PSS3S;V.MSDR ADP _ PROPN N;NOM;PSS3S;SG AT+ABL;PROPN;SG ADV ADV;SG ADV;POS ADV ADJ;SG N;SG 3;NFH;PFV;PST;SG;V _
örnekler , pasifik'te ki line adaları ve hint okyanusu'nda ki maldivler dir .	örnekler , pasifik ki line adaı ve hint okyanus ki _ _ .	N;NOM;PL _ ESS;PROPN;SG ADP DAT;PROPN;SG N;PL;PSS3S CONJ PROPN;SG ESS;N;PSS3S;SG ADP PROPN;SG 3;PFV;PRS;SG;V _
sesini gerçek anlamda tüm dünyaya duyurdu . dedi leive .	ses gerçek anlam tüm dünya duy . de leive .	ACC;N;PSS3S;SG N;SG ESS;N;SG DEF;DET;POS;SG DAT;N;SG 3;IND;PFV;PST;SG;V _ 3;IND;PFV;PST;SG;V PROPN;SG _
sanırım bu yüzden kendilerini desen ve renge bulamışlar .	san bu yüz kendi de ve renge bula .	1;HAB;PRS;SG;V DEF;DET;POS;SG AT+ABL;N;SG ACC;PL;PRO N;SG CONJ DAT;N;SG 3;IND;NFH;PFV;PL;PST;V _
primli tahvillere ve diğer ulusal tasarruf ve yatırım hesaplarına yatırılan paralar , devlet harcamalarını finanse etmek için kullanılır .	primli tahviller ve diğer ulusal tasarruf ve yatırım hesap yatır para , devlet harca finanse et için kullan .	ADJ;SG DAT;N;PL CONJ DEF;DET;POS;SG ADJ;SG N;SG CONJ N;SG DAT;N;PL;PSS3S ADJ;POS;SG N;NOM;PL _ N;SG ACC;N;PL;POS;PSS3P ADJ;SG 3;FUT;IND;PFV;SG;V ADP 3;HAB;PASS;PRS;SG;V _
henüz sadece 20 yaşında olmasına rağmen , zorbalığın karşısında duran ve genç kızların kendi güzellik standartlarını benimsemelerine yardımcı olan güçlü ve pozitif bir sima .	henüz sadece 20 yaş ol rağmen , zorbalık karşı dur ve genç kız kendi güzellik standart benimsemeleri yardımcı ol güçlü ve pozitif bir si .	ADV ADV NUM;SG ESS;N;PSS3S;SG DAT;IND;N;PFV;PRS;PSS3S;V.MSDR ADP _ GEN;N;SG ESS;N;SG ADJ;POS;SG CONJ ADJ;SG GEN;N;PL PRO;REFL;SG N;SG ACC;N;PL;PSS3S DAT;IND;N;PFV;PRS;PSS3P;V.MSDR N;SG POS;SG;V ADJ;SG CONJ ADJ;SG DET;INDF;POS;SG N;SG _
antonio gaudí 20. yüzyılda , 1904 - 1914 yılları arasında on yıl süren bir reform süreci getirmiştir .	antonio gaudí 20 yüzyıl , 1904 - 1914 yıl ara on yıl sür bir reform süreç getir .	PROPN;SG NOM;PROPN;SG NUM;SG ESS;N;SG _ NUM;SG _ NUM;SG N;PL;PSS3S ESS;N;PSS3S;SG NUM;SG N;SG ADJ;POS;SG DET;INDF;POS;SG N;SG N;PSS3S;SG 3;NFH;PFV;PST;SG;V _
i̇ki olgu bakımından önemli dir .	iki olgu bakım önemli i .	NUM;SG N;SG AT+ABL;N;PSS3S;SG ADJ;SG 3;PFV;PRS;SG;V _
ek olarak , bakır yaldızlama süreci teknolojik açıdan dikkate değer dir .	ek olarak , bak yaldızla süreç teknolojik açı dikkat _ _ .	N;SG POS;V _ N;SG IND;N;PFV;PRS;V.MSDR N;NOM;PSS3S;SG ADJ;SG AT+ABL;N;SG DAT;N;SG ADJ;SG 3;PFV;PRS;SG;V _
bu , şehir merkezinde i̇kinci dünya savaşı'nın sona ermesiyle yok olmaktan kurtulan birkaç binadan biriyle ilgili dir .	bu , şehir merkez ikinci dünya savaşı son ermes yok ol kurtul birkaç bina _ ilgili i .	DEF;NOM;POS;PRO;SG _ N;SG ESS;N;SG NUM;SG N;SG GEN;N;PSS3S;SG DAT;N;SG IND;INS;N;PFV;PRS;PSS3S;V.MSDR ADJ;NEG AT+ABL;CAUS;IND;PFV;PRS;V;V.MSDR ADJ;POS;SG DET;INDF;POS;SG AT+ABL;N;SG INS;POS;PRO;SG ADJ;SG 3;PFV;PRS;SG;V _
makedonya ordusu , yunanistan'ı ikiye ayıran thermopylae'nin geçidine kadar ilerledi ; ancak atinalılar , spartalılar ve akhalar'dan oluşan ortak bir kuvvet tarafından güçlü bir şekilde korunduğundan alma girişiminde bulunmadı .	makedonya ordus , yunanistan iki ayır thermopylae geçidin kadar ilerle ; ancak atinalı , spartalı ve akhalar oluş ortak bir kuvvet taraf güçlü bir şekil korunduğun al girişim bulun .	PROPN;SG N;NOM;PSS3S;SG _ ACC;PROPN;SG DAT;N;SG ADJ;POS;SG GEN;PROPN;SG DAT;N;PSS3S;SG ADP 3;IND;PFV;PST;SG;V _ ADV PL;PROPN _ PL;PROPN CONJ AT+ABL;PROPN;SG ADJ;POS;SG N;SG DET;INDF;POS;SG N;SG AT+ABL;N;PSS3S;SG ADJ;SG DET;INDF;POS;SG ESS;N;SG AT+ABL;N;POS;PSS3S;SG IND;N;NOM;PFV;PRS;V.MSDR ESS;N;PSS3S;SG 3;IND;NEG;PFV;PST;SG;V _
cep telefonlarımız bugünlerde bir telefondan çok daha fazlasını vaat ediyor .	cep telefon bugün bir telefon çok daha fazla vaat et .	N;SG N;NOM;PL;PSS1P ESS;N;PL DET;INDF;POS;SG AT+ABL;N;SG ADV ADV ACC;N;SG N;SG 3;IND;PROG;PRS;SG;V _
donald trump başkan olursa , burada ki hükumet kanada firmaları ve menfaatlerinin washington'da temsil edilmesini sağlamak için ortak gündemde yer alan konularda onunla birlikte çalışmak zorunda kalacaktır .	donald trump başkan ol , bura ki hükumet kana fir ve menfaat washington temsil et sağla için ortak gündem yer al konu o birlikte çalış zor kal .	PROPN;SG NOM;PROPN;SG N;SG 3;HAB;PRS;SG;V _ ESS;POS;PRO;SG ADP N;NOM;SG PROPN;SG N;PL;PSS3S CONJ GEN;N;PL;PSS3S ESS;PROPN;SG N;SG ACC;IND;N;PASS;PFV;PRS;PSS3S;SG;V.MSDR 3;FUT;IND;N;PFV;SG ADP N;SG ESS;N;SG N;SG ADJ;POS;SG ESS;N;PL INS;POS;PRO;SG ADP 3;FUT;IND;N;PFV;SG ESS;N;PSS3S;SG 3;FUT;PFV;SG;V _
fen bilgisini ayrı bir ünite olarak görmek yerine , öğrenciler bu dersi bizzat uygulayarak öğreniyorlar .	fen bilgi ayrı bir ünite olarak gör yer , öğrenci bu dersi bizzat uygula öğren .	N;SG ACC;N;PSS3S;SG ADJ;SG DET;INDF;POS;SG N;SG POS;V IND;N;NOM;PFV;PRS;V.MSDR DAT;N;PSS3S;SG _ N;NOM;PL DEF;DET;POS;SG ACC;N;SG ADV ADV;POS 3;IND;PL;PROG;PRS;V _
son altı yıldır ilk kez işsizlik oranı yüzde 20'nin altına düştü ve bir yıl öncesine göre 600.000 kişi daha istihdam edildi .	son altı _ ilk kez işsizlik oran yüz 20 alt düş ve bir yıl önce göre 600.000 kişi daha istihdam et .	ADJ;SG NUM;SG ADV ADJ;SG N;SG N;SG N;NOM;PSS3S;SG ESS;N;SG GEN;N;SG DAT;N;PSS3S;SG 3;IND;PFV;PST;SG;V CONJ INDF;NUM;POS;SG N;SG DAT;N;PSS3S;SG ADP NUM;SG N;NOM;SG ADV N;SG 3;IND;PASS;PFV;PST;SG;V _
28 ekim'deki ki mektubun aksine , comey'in mektubu ile ilgili neredeyse hiç yorum yapılmadı .	28 _ _ mektup ak , comey mektup ile ilgili neredeyse hiç yorum yap .	NUM;SG ESS;N;SG ADP GEN;N;SG ADP _ GEN;PROPN;SG N;PSS3S;SG ADP ADJ;SG ADV ADV N;NOM;SG 3;IND;NEG;PASS;PFV;PST;SG;V _
sessiz tonlama hem fince , hem de kuzey sami lehçelerinde bulunan bir özellik tir , ancak farklı bir dil tarihine sahip olduğu düşünülen güney sami'de mevcut değildir .	_ tonla hem fince , hem de kuzey sami lehçe bul bir özellik i , ancak farklı bir dil tarih sahip ol düşün güney sami mevcut değil .	ADJ;SG IND;N;NOM;PFV;PRS;V.MSDR CONJ PROPN;SG _ CONJ ADV N;SG PROPN;SG ESS;N;PL;PSS3S ADJ;POS;SG DET;INDF;POS;SG N;SG V _ ADV ADJ;SG DET;INDF;POS;SG N;SG DAT;N;PSS3S;SG ADJ;SG NOM;PFV;POS;PSS3S;PST;SG;V ADJ;POS;SG N;SG ESS;PROPN;SG ADJ;SG 3;NEG;PRS;SG;V _
kansas'ta ki olaylara verilen ulusal tepkiler ülkenin ne kadar derinden bölündüğünü göstermiştir .	kansas ki olay ver ulusal tepki ülke ne kadar derin bölündük göster .	ESS;PROPN;SG ADP DAT;N;PL ADJ;POS;SG ADJ;SG N;NOM;PL GEN;N;SG PRO;SG ADP AT+ABL;N;PSS2S;SG ACC;N;POS;PSS3S;SG 3;NFH;PFV;PST;SG;V _
savunma bakanı , şimdilik partinin genel sekreteri olarak kalmasına izin verdi .	savun bakan , şimdilik parti genel sekreter olarak kal izin ver .	IND;N;NOM;PFV;PRS;V.MSDR N;NOM;PSS3S;SG _ ADV GEN;N;SG ADJ;SG N;PSS3S;SG POS;V DAT;IND;N;PFV;PRS;PSS3S;V.MSDR N;SG 3;IND;PFV;PST;SG;V _
dünyanın en iyisi olmaya ilişkin kutsal hakları artık garanti değil miydi ?	dünya en iyi ol ilişkin kutsal hak artık garanti değil mi ?	GEN;N;SG ADV N;SG DAT;IND;PFV;PRS;V;V.MSDR ADP ADJ;SG N;NOM;PL;PSS3S ADV N;SG 3;IND;NEG;PRS;SG;V 3;PST;SG;V _
yüksek rakım iklimi soğutmaya yarar , aksi takdirde çok sıcak olacak .	yüksek rakım iklim soğut yarar , aksi takdir çok sıcak ol .	ADJ;SG N;NOM;SG ACC;N;PSS3S;SG DAT;IND;N;PFV;PRS;V.MSDR SG;V _ N;SG ADP ADV ADJ;SG 3;FUT;IND;PFV;SG;V _
doğa politikaları başkanı jeff knott , " arkasından bir yasak veya avlanma ruhsatı gelirse çok şaşırırım . " dedi .	doğa politika başkan jeff knott , " arka bir yasak veya avla ruhsat gel çok şaşır _ _ de .	N;SG N;PL;PSS3S N;PSS3S;SG PROPN;SG NOM;PROPN;SG _ _ AT+ABL;N;PSS3S;SG DET;INDF;POS;SG N;SG CONJ IND;N;NOM;PFV;PRS;V.MSDR N;PSS3S;SG 3;HAB;PRS;SG;V ADV 1;HAB;PRS;SG;V _ _ 3;IND;PFV;PST;SG;V _
eski i̇ngiliz güney kamerunları 1 ekim 1961'de kamerun federal cumhuriyeti'ni kurmak üzere fransız kamerun'u ile birleşmiştir .	eski i̇ngiliz güney kamerun 1 ekim 1961 kamerun federal cumhuriyeti'n kur üzere fransız kamerun' ile birleş .	ADJ;SG PROPN;SG N;SG NOM;PL;PROPN;PSS3S NUM;SG N;SG ESS;N;SG PROPN;SG ADJ;SG ACC;PROPN;PSS3S;SG 3;FUT;IND;N;PFV;SG ADP PROPN;SG PROPN;PSS3S;SG ADP 3;NFH;PFV;PST;SG;V _
i̇klim çok kuru olduğundan bu ovalar bazen sahra'nın bir parçası olarak düşünülür .	iklim çok kuru ol bu ova bazen sahra bir parça olarak düşün .	N;NOM;SG ADV ADJ;SG AT+ABL;POS;PSS3S;SG;V DEF;DET;POS;SG N;NOM;PL ADV GEN;PROPN;SG DET;INDF;POS;SG N;PSS3S;SG POS;V 3;HAB;PASS;PRS;SG;V _
başka bir deyişle : genç erkeklerin ( iç savaşlarda savaşanların büyük çoğunluğunu oluştururlar ) , eğitim almaları veya rahat bir maaş almaları ve gelecekte başarılı olabileceklerini düşünmeleri durumunda isyana katılma ihtimalleri daha düşük .	başka bir deyiş : genç erkek ( iç savaş savaşan büyük çoğunluk oluşturu ) , eğitim al veya rahat bir maaş al ve gelecek başarılı olabilecekler düşün durum isyan kat ihtimal daha düşük .	ADJ;SG DET;INDF;POS;SG INS;N;SG _ ADJ;SG GEN;N;PL _ N;SG ESS;N;PL GEN;N;PL;POS ADJ;SG ACC;N;PSS3S;SG 3;CAUS;HAB;PL;PRS;V _ _ N;SG IND;N;NOM;PFV;PRS;PSS3P;V.MSDR CONJ ADJ;SG DET;INDF;POS;SG N;SG IND;N;NOM;PFV;PRS;PSS3P;V.MSDR CONJ ESS;N;SG ADJ;SG ACC;PL;POS;PSS3P;V IND;N;NOM;PFV;PRS;PSS3P;V.MSDR ESS;N;PSS3S;SG DAT;N;SG IND;N;NOM;PFV;PRS;V.MSDR N;NOM;PL;PSS3S ADV ADJ;SG _
bu arada , bank of scotland müşterileri , hesaplarına ücretsiz vantage seçeneğini eklediklerinde 3.000 - 5.000 sterlinlik bakiyeleri üzerinden yüzde üç faiz getirisi elde ediyorlar .	bu ara , bank of scotland müşteri , hesap _ vantage seçenek ekle 3.000 - _ sterlinlik bakiye üzer yüz üç faiz getiri el et .	DEF;DET;POS;SG ESS;N;SG _ N;SG _ PROPN;SG N;NOM;PL;PSS3S _ DAT;N;PL;PSS3S ADJ;SG _ ACC;N;PSS3S;SG ESS;N;PL;POS;PSS3S NUM;SG _ NUM;SG ADJ;SG N;PL;PSS3S AT+ABL;N;PSS3S;SG ESS;N;SG NUM;SG N;SG N;PSS3S;SG ESS;N;SG 3;IND;PL;PROG;PRS;V _
gaunt'lı john , 1399'da öldü .	_ john , 1399 öl .	PROPN;SG NOM;PROPN;SG _ ESS;N;SG 3;IND;PFV;PST;SG;V _
teselya'da düşmanlarını mağlup etti ve 352 yılı itibarıyla bu bölgenin kontrolünü sıkı biçimde ele geçirdi .	teselya düşman mağlup et ve 352 yıl itibar bu bölge kontrol sık biçim el geç .	ESS;PROPN;SG ACC;N;PL;PSS3S ADJ;SG 3;IND;PFV;PST;SG;V CONJ NUM;SG N;PSS3S;SG ADP;PSS3S DEF;DET;POS;SG GEN;N;SG ACC;N;PSS3S;SG ADJ;SG ESS;N;SG DAT;N;SG 3;CAUS;IND;PFV;PST;SG;V _
büyük güçler osmanlı i̇mparatorluğu'nun tüm makedonya'yı ve arnavutluk'la olan toprak bağlantısını kaybedeceği anlaşıldıktan sonra kararlarını değiştirmeleri gerektiğini fark ettiler .	büyük güç osmanlıca i̇mparatorluğu tüm makedonya ve arnavutluk ol toprak bağlantı kaybed anlaşıl sonra karar değiştir gerek fark et .	ADJ;SG N;NOM;PL PROPN;SG GEN;PROPN;SG DEF;DET;POS;SG ACC;PROPN;SG CONJ INS;PROPN;SG ADJ;POS;SG N;SG ACC;N;PSS3S;SG N;NOM;POS;PSS3S;SG AT+ABL;N;POS;SG ADP ACC;N;PL;PSS3S IND;N;NOM;PFV;PRS;PSS3P;V.MSDR ACC;N;POS;PSS3S;SG N;SG 3;IND;PFV;PL;PST;V _
her iki durumda da ab'nin zirvesinde olan bir seviye .	her iki durum da ab zirve ol bir seviye .	DEF;DET;POS;SG NUM;SG ESS;N;SG ADV GEN;PROPN;SG ESS;N;PSS3S;SG ADJ;POS;SG DET;INDF;POS;SG N;SG _
bir ab yetkilisi , önerilen kısıtlamalar olmadan " kelt denizinde ki morina balığı nüfusu yok olabilir . " dedi .	bir ab yetkili , öner kısıtlama ol " kelt deniz ki morina balık nüfus yok ol _ _ de .	DET;INDF;POS;SG PROPN;SG N;PSS3S;SG _ ADJ;POS;SG N;NOM;PL;POS ADV;IND;NEG;PFV;PRS;V.CVB _ PROPN;SG ESS;N;PSS3S;SG ADP N;SG N;PSS3S;SG N;NOM;PSS3S;SG ADJ;NEG 3;HAB;PRS;SG;V _ _ 3;IND;PFV;PST;SG;V _
hispania sözcüğünün kökeni çok tartışmalı dır ve çeşitli spekülasyonlara ilişkin kanıtlar , en iyi ihtimalle sadece benzerlik olan tesadüfi durumlara dayanmaktadır ve destekleyici kanıtlar şüpheli dir .	hispania sözcük köken çok _ _ ve çeşitli spekülasyon ilişkin kanıt , en iyi ihtimalle sadece benzerlik ol tesadüf durum dayan ve destekleyici kanıt şüphel i .	PROPN;SG GEN;N;PSS3S;SG N;NOM;PSS3S;SG ADV 3;ADJ;PRS;SG 3;PFV;PRS;SG;V CONJ ADJ;SG DAT;N;PL ADP N;NOM;PL _ ADV ADJ;SG INS;N;SG ADV N;NOM;SG ADJ;POS;SG ADJ DAT;N;PL 3;PROG;PRS;SG;V CONJ ADJ;POS;SG N;NOM;PL ADJ;SG 3;PFV;PRS;SG;V _
yani teoride , bir çift dört tesco hesabı açabilir ve 12.000 sterlin üzerinden yüzde üçlük , yani 360 sterlinlik kazanç sağlayabilir .	yani teori , bir çift dört tesco hesap aç ve 12.000 sterl üzer yüz _ , yani _ sterlinlik kazanç sağla .	ADV ESS;N;SG _ DET;INDF;POS;SG N;NOM;SG NUM;SG PROPN;SG N;PSS3S;SG 3;HAB;PRS;SG;V CONJ NUM;SG N;SG AT+ABL;N;PSS3S;SG ESS;N;SG ADJ;SG _ ADV NUM;SG ADJ;SG N;SG 3;HAB;PRS;SG;V _
stalin , bir sonra ki sayıyı çiziciye devretti ve kötü thanos'u merkez alan ve çeşitli marvel başlıklarına yayılmış ayrıntılı bir hikaye yayına başladı .	stal , bir sonra ki sayı çiziciye devrett ve kötü thanos merkez al ve çeşitli marvel başlık yay _ bir hikaye yayın başla .	NOM;PROPN;SG _ DET;INDF;POS;SG N ADP ACC;N;SG DAT;N;SG 3;IND;PFV;PST;SG;V CONJ ADJ;SG ACC;PROPN;SG ADJ;SG POS;SG;V CONJ ADJ;SG PROPN;SG DAT;N;PL;PSS3S 3;ADJ;IND;NFH;PASS;PFV;PST;SG ADJ;SG DET;INDF;POS;SG N;NOM;SG DAT;N;SG 3;IND;PFV;PST;SG;V _
rona , polonyum kaynaklarını hazırlama ve alfa emisyonları üretmeye yönelik ileri bir yöntem geliştirdi .	ron , polonyum kaynaklar hazırla ve alfa emisyon üre yönelik ileri bir yöntem geliş .	NOM;PROPN;SG _ N;SG ACC;N;PL;PSS3S IND;N;PFV;PRS;V.MSDR CONJ N;SG N;PL;PSS3S DAT;IND;N;PFV;PRS;V.MSDR ADP ADJ;SG DET;INDF;POS;SG N;SG 3;CAUS;IND;PFV;PST;SG;V _
winstone , 4 ekim 1988'de ve yine 19 mart 1993'te iflas ilan etti .	winstone , 4 ekim 1988 ve yine 19 mart 1993 iflas ilan et .	NOM;PROPN;SG _ NUM;SG N;SG ESS;N;SG CONJ ADV NUM;SG N;SG ESS;N;SG N;SG N;SG 3;IND;PFV;PST;SG;V _
merkezde ki alan , güneşin ve dolunayın yükselişini gözlemlemek için kullanılmıştır .	merkezde ki al , güneşin ve dolunayın yükseliş gözlemle için kullan .	ESS;N;SG ADP N;NOM;POS;SG _ GEN;N;SG CONJ GEN;N;SG ACC;N;POS;PSS3S;SG 3;FUT;IND;N;PFV;SG ADP 3;NFH;PASS;PFV;PST;SG;V _
28 yaşında ki oyuncu , australian open'daki sansasyondan sonra , serena williams'a karşı ilk kez final maçında kaybetti .	28 yaş ki oyuncu , australian _ sansasyon sonra , seren williams karşı ilk kez final maç kaybet .	NUM;SG ESS;N;PSS3S;SG ADP N;NOM;SG _ PROPN;SG _ AT+ABL;N;SG ADP _ PROPN;SG DAT;PROPN;SG ADP ADJ;SG N;SG N;SG ESS;N;PSS3S;SG 3;IND;PFV;PST;SG;V _
uzun yıllar boyunca radyo ve televizyon haberleri ve güncel olaylarda çalıştı .	uzun yıl boyunca radyo ve televizyon haber ve güncel olay çalış .	ADJ;SG N;PL ADP;PSS3S N;SG CONJ N;SG ACC;N;PL CONJ ADJ;SG ESS;N;PL 3;IND;PFV;PST;SG;V _
caplan geriye dönük oy vermeyi , " nil taşmayınca firavunu öldürmekten daha mantıklı değil . " yorumunu yapan iki bilim insanından alıntı yaparak eleştirdi .	caplan geri dönük oy ver , " nil taşmayınca firav öldür daha mantıklı değil _ _ yorum yap iki bilim insan alın yap eleştir .	NOM;PROPN;SG DAT;N;SG ADJ;SG N;SG ACC;IND;N;PFV;PRS;V.MSDR _ _ NOM;PROPN;SG ADV;NEG N;PSS3S;SG AT+ABL;CAUS;IND;N;PFV;PRS;V.MSDR ADV ADJ;SG 3;IND;NEG;PRS;SG;V _ _ ACC;N;PSS3S;SG ADJ;POS;SG NUM;SG N;SG AT+ABL;N;PSS3S;SG N;SG ADV;POS 3;IND;PFV;PST;SG;V _
kızları cecily , york 3. dükü richard plantagenet'le evlendiğinde ve edward iv ile richard iii dahil birkaç çocuk sahibi olduklarında , joan i̇ngiltere'de ki iki york kralının büyükannesi oldu .	kız cecily , york 3 dükü richard plantagenet evlendiğ ve edward iv ile richard iii dahil birkaç çocuk sahip olduklar , joan ingiltere ki iki york kral büyükanne ol .	3;N;PL;PSS3 NOM;PROPN;SG _ PROPN;SG NUM;SG N;PSS3S;SG PROPN;SG INS;PROPN;SG ESS;N;POS;PSS3S;SG CONJ PROPN;SG NUM;SG CONJ PROPN;SG NUM;SG ADP;SG DET;INDF;POS;SG N;SG N;SG ESS;PL;POS;PSS3S;V _ NOM;PROPN;SG ESS;PROPN;SG ADP NUM;SG PROPN;SG GEN;N;PSS3S;SG N;PSS3S;SG 3;IND;PFV;PST;SG;V _
obama'nın özel asistanı kori schulman pazartesi günü yayınladığı blog yazısında " abd'de ki dijital dönüşümün büyük bir kısmı emsalsiz olsa da , başkanlık görevinin sorunsuz şekilde devredildiği görülmemiştir " dedi .	obama özel asistan kori schulman pazartesi gün yayınla blog yazı " abd' ki dijital dönüş büyük bir kısım emsalsiz ol da , başkanlık görev sorunsuz şekil devredil görülme " de .	GEN;PROPN;SG ADJ;SG N;PSS3S;SG PROPN;SG NOM;PROPN;SG N;SG N;PSS3S;SG ADJ;POS;PSS3S;SG N;SG ESS;N;PSS3S;SG _ ESS;PROPN;SG ADP ADJ;SG GEN;N;SG ADJ;SG DET;INDF;POS;SG N;NOM;PSS3S;SG ADJ;SG 3;COND;PRS;SG;V ADV _ N;SG GEN;N;PSS3S;SG ADJ;SG ESS;N;SG N;NOM;POS;PSS3S;SG 3;NEG;NFH;PASS;PFV;PST;SG;V _ 3;IND;PFV;PST;SG;V _
