son olimpiyat oyunlarının 393'te yapıldığı düşünülüyor .	son olimpiyat oyun 393 yap düşün .	ADJ;SG N;SG GEN;N;PL;PSS3S ESS;N;SG N;NOM;POS;PSS3S;SG 3;IND;PASS;PROG;PRS;SG;V _
i̇ki yıl sonra hong kong'un yüksek mahkemesine çıkan jutting büyük ölçüde sakin görünüyordu .	iki yıl sonra hong kong yüksek mahkeme çık jutting büyük ölçüt sakin görün .	NUM;SG N;SG ADP PROPN;SG GEN;PROPN;SG ADJ;SG DAT;N;PSS3S;SG ADJ;POS;SG NOM;PROPN;SG ADJ;SG ESS;N;SG ADJ;SG 3;IND;PROG;PST;SG;V _
çok sayıda yerli halk alaska'da , avrupa halklarının bölgeye gelmesinden önce binlerce yıl boyunca yaşadı .	çok sayı yerli halk alaska , avrupa halk bölge gelmes önce binlerce yıl boyunca yaşa .	ADV ESS;N;SG ADJ;SG N;NOM;SG ESS;PROPN;SG _ PROPN;SG GEN;N;PL;PSS3S DAT;N;SG AT+ABL;IND;N;PFV;PRS;PSS3S;V.MSDR ADP ADJ;SG N;SG ADP;PSS3S 3;IND;PFV;PST;SG;V _
eşi alice , " kendi sağlığını tamamen ihmal etmesi . " dedi .	eş _ , " kendi sağlık tamamen ihmal et _ _ de .	N;PSS3S;SG PROPN _ _ PRO;REFL;SG ACC;N;PSS3S;SG ADV N;SG IND;N;NOM;PFV;PRS;PSS3S;V.MSDR _ _ 3;IND;PFV;PST;SG;V _
ekim'in ilk günlerinde dönüşüm ekibi aynı yerde uber , motion picture association of america , the consumer technology association ve diğer derneklerin temsilcilerini de davet ederek teknoloji lobicileriyle buluştu .	ekim ilk gün dönüş ekip aynı yer uber , motion picture association of america , the consumer technology association ve diğer _ temsilci de davet et teknoloji lobici buluş .	GEN;N;SG ADJ;SG ESS;N;PL;PSS3S N;SG N;NOM;PSS3S;SG ADJ;SG ESS;N;SG _ _ _ _ _ _ _ _ _ _ _ _ CONJ DEF;DET;POS;SG GEN;N;PL ACC;N;PL;PSS3P ADV N;SG ADV;POS N;SG INS;N;PL 3;IND;PFV;PST;SG;V _
rus i̇mparatorluğu , birinci dünya savaşı'ndan önceki ki yıllarda önemli uyuşmazlık belirtileri gösteren farklı etnik gruplardan müteşekkil bir topluluk tu .	rus imparatorluk , birinci dünya savaşı'n _ _ yıl _ uyuşmazlık belirtii göster farklı etnik grup müteşekkil bir _ _ .	PROPN;SG N;NOM;SG _ NUM;SG N;SG AT+ABL;N;PSS3S;SG N ADP ESS;N;PL ADJ;SG N;NEG;SG N;PL;PSS3S ADJ;POS;SG ADJ;SG ADJ;SG AT+ABL;N;PL ADJ;SG DET;INDF;POS;SG N;SG 3;IND;PFV;PST;SG;V _
reagan , daha büyük bir hedefi gerçekleştirmesi için tanrı'nın hayatını kurtardığına inanıyordu .	reagan , daha büyük bir hedef gerçekleştir için tanrı hayat kurtardık inan .	NOM;PROPN;SG _ ADV ADJ;SG DET;INDF;POS;SG ACC;N;PSS3S;SG CAUS;IND;PFV;PRS;PSS3S;SG;V;V.MSDR ADP GEN;PROPN;SG ACC;N;PSS3S;SG DAT;N;POS;PSS3S;SG 3;IND;PROG;PST;SG;V _
i̇ngiltere'yi yenerek kurtulmak için küçük bir şansları var .	i̇ngiltere ye kurtul için küçük bir şans var .	ACC;PROPN;SG ADV;POS 3;FUT;IND;N;PFV;SG ADP ADJ;SG DET;INDF;POS;SG N;NOM;PSS3P;SG ADJ;POS _
ancak bu durum , julian'ın 363 yılında savaşta öldürülmesiyle tersine döndü .	ancak bu durum , julian 363 yıl savaş öldürülmes ters dön .	ADV DEF;DET;POS;SG N;NOM;SG _ GEN;PROPN;SG NUM;SG ESS;N;PSS3S;SG ESS;N;SG CAUS;IND;INS;N;PFV;PRS;PSS3S;V.MSDR ADV 3;IND;PFV;PST;SG;V _
simon krätschmer , harap olmuş ve fena kışlayla yalnız başına uğraşıyor .	simon krätschmer , harap ol ve fena kışla yalnız baş uğraş .	PROPN;SG NOM;PROPN;SG _ ADJ;SG 3;IND;NFH;PFV;PST;SG;V CONJ ADJ;SG INS;N;SG ADJ;SG DAT;N;PSS3S;SG 3;IND;PROG;PRS;SG;V _
de gaulle , churchill'e karşı kamuya olan sevgisinin aşırı görüntüsünün ve önceden verilen anlaşma olmadan resmi bir ödülün bulunmamasını talimat vermişti .	de gaul , churchill karşı kamu ol sevgi aşırı görüntü ve önce ver anlaşma ol resmi bir ödül bulunma talimat ver .	PROPN NOM;PROPN;SG _ DAT;PROPN;SG ADP DAT;N;SG ADJ;POS;SG GEN;N;PSS3S;SG ADJ;SG GEN;N;PSS3S;SG CONJ ADV ADJ;POS;SG N;NOM;SG IND;N;NEG;PFV;PRS;V.CVB ADJ;SG DET;INDF;POS;SG GEN;N;SG ACC;IND;N;NEG;PFV;PRS;PSS3S;V.MSDR N;SG 3;IND;NFH;PFV;PST+PRF;SG;V _
kum ve toz fırtınaları , arazinin bitki örtüsüyle korunmadığı kurak bölgelerde meydana gelen doğal olaylar dır .	kum ve toz fırtına , arazi bitki örtüsüyle korunma kurak bölge meydan gel doğal olay i .	N;SG CONJ N;SG N;NOM;PL;PSS3S _ GEN;N;SG N;SG INS;N;PSS3S;SG ADJ;NEG;PSS3S;SG ADJ;SG ESS;N;PL DAT;N;SG ADJ;POS;SG ADJ;SG N;PL 3;PFV;PRS;SG;V _
georgetown i̇ş geliştirme bölgesi başkanı joe sternlieb , " çok fazla rekabete maruz kalıyoruz ve yeni taşıma sisteminin bu durumu hafifletebileceğini düşünüyoruz . " dedi .	georgetown iş geliştir bölge başkan joe sternlieb , " çok fazla rekabet maruz kal ve yeni taşım sistem bu durum hafifletebil düşün _ _ de .	PROPN;SG N;SG IND;N;NOM;PFV;PRS;V.MSDR N;PSS3S;SG N;PSS3S;SG PROPN;SG NOM;PROPN;SG _ _ ADV ADJ;SG DAT;N;SG ADJ;SG 1;IND;PL;PROG;PRS;V CONJ ADJ;SG IND;N;NOM;PFV;PRS;V.MSDR GEN;N;PSS3S;SG DEF;DET;POS;SG ACC;N;SG ACC;N;POS;PSS3S;SG 1;IND;PL;PROG;PRS;V _ _ 3;IND;PFV;PST;SG;V _
bu , yerleşimcilerin bağımsızlıklarını kazanmaları için gerekli son darbe ydi .	bu , yerleşimci bağımsızlık kazan için gerekli son darb i .	DEF;NOM;POS;PRO;SG _ GEN;N;PL ACC;N;PSS3P;SG IND;N;NOM;PFV;PRS;PSS3P;V.MSDR ADP ADJ;SG ADJ;SG N;SG 3;IND;PFV;PST;SG;V _
o tarihte bir artık ay bile söz konusu olsa son tarih sadece bir cuma gününe denk gelebilir ancak bu newton'un tarih ettiği bir durum du .	o tarih bir artık ay bile söz konu ol son tarih sadece bir cuma gün denk gel ancak bu newton tarih et bir _ _ .	DEF;DET;POS;SG ESS;N;SG DET;INDF;POS;SG ADJ N;NOM;SG ADV N;SG N;PSS3S;SG 3;COND;PRS;SG;V ADJ;SG N;NOM;SG ADV DET;INDF;POS;SG N;SG DAT;N;PSS3S;SG ADJ 3;HAB;PRS;SG;V ADV DEF;NOM;POS;PRO;SG GEN;PROPN;SG N;SG ADJ;POS;PSS3S;SG DET;INDF;POS;SG N;SG 3;PFV;PRS;SG;V _
fakat bazı güvenlik uzmanları kursun gerekliliği ve arkasında yatan niyetle ilgili şüphelerini gündeme getirdi .	fakat bazı güvenlik uzman kursun gereklilik ve arka yat niyet ilgili şüphe gündem getir .	ADV DET;INDF;POS;SG N;SG N;NOM;PL;PSS3S GEN;N;SG N;PSS3S;SG CONJ ESS;N;PSS3S;SG ADJ;POS;SG INS;N;SG ADJ;SG ACC;N;PL;PSS3P DAT;N;SG 3;IND;PFV;PST;SG;V _
1350'lerde , kral gongmin , yuan hanedanı çökmeye başladığında goryeo hükümetini reform etmede özgürleşti .	1350' , kral gongm , yuan hanedan çök başladığ goryeo hükümet reform et özgürleş .	ESS;N;PL _ N;SG NOM;PROPN;SG _ PROPN;SG N;NOM;PSS3S;SG DAT;IND;N;PFV;PRS;V.MSDR ESS;N;POS;PSS3S;SG PROPN;SG ACC;N;PSS3S;SG N;SG ESS;IND;N;PFV;PRS;V.MSDR 3;IND;PFV;PST;SG;V _
saqib " bir adet domuz da dahil olmak üzere , diğer ülkelerden hayvanat bahçesinde ki çeşitliliği artırmak için yardım istedik " dedi .	saqib " bir adet domuz da dahil ol üzere , diğer ülke hayvanat bahçe ki çeşitlilik artır için yardım iste " de .	NOM;PROPN;SG _ INDF;NUM;POS;SG N;SG N;NOM;SG ADV N;SG IND;NOM;PFV;PRS;V;V.MSDR ADP _ DEF;DET;POS;SG AT+ABL;N;PL N;SG ESS;N;PSS3S;SG ADP ACC;N;SG IND;N;NOM;PFV;PRS;V.MSDR ADP N;SG 1;IND;PFV;PL;PST;V _ 3;IND;PFV;PST;SG;V _
joseph schenck , romeo ve juliet'in bir versiyonunda valentino'nun karşısında eşi norma talmadge'yi canlandırmakla ilgilendi .	joseph schenck , romeo ve juliet bir versiyon valentino karşı eş norma talmadge canlandır ilgilen .	PROPN;SG NOM;PROPN;SG _ PROPN;SG CONJ GEN;PROPN;SG DET;INDF;POS;SG ESS;N;PSS3S;SG GEN;PROPN;SG ESS;N;SG N;PSS3S;SG DAT;PROPN;SG ACC;PROPN;SG IND;INS;N;PFV;PRS;V.MSDR 3;IND;PFV;PST;SG;V _
ancak yapılan tarama sonucunda bayan pugh'nun sağ akciğerinde ki tümörün büyümekte olduğu ortaya çıktı ve deneme tedavisini bırakmak zorunda kaldı .	ancak yap tarama sonuç bay pugh sağ akciğer ki tümör büyü ol orta çık ve dene tedavi bırak zor kal .	ADV ADJ;POS;SG N;SG ESS;N;PSS3S;SG N;SG GEN;PROPN N;SG ESS;N;PSS3S;SG ADP GEN;N;SG 3;IND;PROG;PRS;SG;V N;NOM;POS;PSS3S;SG DAT;N;SG 3;IND;PFV;PST;SG;V CONJ N;SG ACC;N;PSS3S;SG 3;FUT;IND;N;PFV;SG ESS;N;PSS3S;SG 3;IND;PFV;PST;SG;V _
sonuçta , internet bir lüks değil ; hayati bir araç .	sonuçta , internet bir lüks değil ; hayati bir araç .	ESS;N;SG _ N;NOM;SG DET;INDF;POS;SG N;SG 3;IND;NEG;PRS;SG;V _ ADJ;SG DET;INDF;POS;SG N;SG _
1976'da parkur artık kullanılmıyordu ; 1990'da ise bir yangın , daha sonraları ahırlarla birlikte yıkılacak olan tahta tribünlerden geri kalanları da yok etmişti .	1976 parkur artık kullanılm ; 1990' ise bir yangın , daha sonraları ahırlarla birlikte yık ol tahta tribün geri kalanı da yok et .	ESS;N;SG N;NOM;SG ADV 3;IND;NEG;PASS;PROG;PST;SG;V _ ESS;N;SG 3;COND;POS;SG;V DET;INDF;POS;SG N;NOM;SG _ ADV N;PL;PSS3S INS;N;PL ADP 3;FUT;IND;PASS;PFV;SG;V ADJ;POS;SG N;SG AT+ABL;N;PL ADV ACC;N;PL ADV ADJ;NEG 3;IND;NFH;PFV;PST+PRF;SG;V _
akıllı telefon modelinin üretimi tamamen durduruldu .	akıllı telefon model üretim tamamen durdur .	ADJ;SG N;SG GEN;N;PSS3S;SG N;NOM;PSS3S;SG ADV 3;IND;PFV;PST;SG;V _
i̇şletmeler temmuz ayından itibaren , yani brexit oylamasından hemen sonra küçülmeye gideceklerini düşünüyorlardı ; ama bunun yerine istikrarlı bir şekilde büyümeyi başardılar .	i̇şletme temmuz ay itibaren , yani brexit oyla hemen sonra küçül gidecek düşünüyorlar ; ama bu yer istikrarlı bir şekil büyü başar .	N;NOM;PL;POS N;SG AT+ABL;N;PSS3S;SG ADP _ ADV PROPN;SG AT+ABL;N;POS;PSS3S;SG ADV ADV DAT;IND;N;PFV;PRS;V.MSDR ACC;N;PL;POS;PSS2S 3;IND;PL;PROG;PST;V _ ADV GEN;POS;PRO;SG DAT;N;PSS3S;SG ADJ;SG DET;INDF;POS;SG ESS;N;SG ACC;IND;N;PFV;PRS;V.MSDR 3;IND;PFV;PL;PST;V _
dünya öfke uyandırıcı ve saçma olabilir - ancak en azından birileri bu gerçeği protesto edecek öz saygıya sahip .	dünya öfke uyandırıcı ve saç ol - ancak en az biri bu gerçek protesto ed öz saygı sah .	N;NOM;SG N;SG ADJ;POS;SG CONJ ADJ;SG 3;HAB;PRS;SG;V _ ADV ADV AT+ABL;N;PSS2S;SG 3;NOM;POS;PRO;PSS3P;SG DEF;DET;POS;SG ACC;N;SG N;SG 3;ADJ;FUT;IND;PFV;SG N;SG DAT;N;SG ADJ;SG _
ayrıca , makedon ve fars elitlerinin birçoğu kendi aralarında evlilikler yapmıştır .	ayrıca , makedon ve fars elit birçoğu kendi ara evlilik yap .	ADV _ PROPN;SG CONJ PROPN;SG GEN;N;PL;PSS3P NOM;POS;PRO;PSS3S;SG PRO;REFL;SG ESS;N;PL;PSS3S N;PL 3;NFH;PFV;PST;SG;V _
konsey'in lord başkanı lord halifax , almanya'yı kasım'da gizlice ziyaret edip hitler ve diğer alman yetkililerle bir araya geldi .	konsey lord başkan lord _ _ almanya kasım _ ziyaret et hit ve diğer alman yetkili bir ara gel .	GEN;N;SG N;SG N;PSS3S;SG N;SG PROPN;SG _ ACC;PROPN;SG ESS;N;SG ADV;SG N;SG ADV;POS PROPN;SG CONJ DEF;DET;POS;SG PROPN;SG INS;N;PL DET;INDF;POS;SG DAT;N;SG 3;IND;PFV;PST;SG;V _
ancak , ba ve iag'nin bunu çözdüğünü ve biraz da olsa güvenilir bir şey sunabileceğini düşünüyoruz .	ancak , ba ve iag bu çöz ve biraz da ol güven bir şey sunabil düşün .	ADV _ PROPN;SG CONJ GEN;PROPN;SG ACC;POS;PRO;SG ACC;N;POS;PSS3S;SG CONJ ADV ADV 3;COND;PRS;SG;V 3;ADJ;HAB;PASS;PRS;SG DET;INDF;POS;SG N;SG ACC;N;POS;PSS3S;SG 1;IND;PL;PROG;PRS;V _
olay , paris'te biliniyordu ve halihazırda ekmek fiyatının oldukça yüksek olması ve erzak bulunmaması nedeniyle zaten kötü olan genel havayı iyice olumsuz etkiledi .	olay , paris bilin ve halihazır ekmek fiyat ol yüksek ol ve erzak bulun neden zaten kötü ol genel hava _ olumsuz etkile .	N;NOM;SG _ ESS;PROPN;SG 3;IND;PASS;PROG;PST;SG;V CONJ ADV N;SG GEN;N;PSS3S;SG ADV ADJ;SG IND;PFV;PRS;PSS3S;V;V.MSDR CONJ N;NOM;SG IND;N;NEG;PASS;PFV;PRS;PSS3S;V.MSDR INS;N;PSS3S;SG ADV ADJ;SG POS;SG;V ADJ;SG ACC;N;SG ADV;SG ADV;SG 3;IND;PFV;PST;SG;V _
bu hipotezi destekleyen bir unsur , sesto san giovanni'de ki villa pelucca'da gerçekleştirilen yoğun kraliyet atı yetiştiriciliği dir .	bu hipotezi destekle bir unsur , sesto san giovanni ki villa pelucca gerçekleş yoğun kraliyet at yetiştiricilik i .	DEF;DET;POS;SG ACC;N;SG ADJ;POS;SG DET;INDF;POS;SG N;NOM;SG _ PROPN;SG PROPN;SG ESS;PROPN;SG ADP N;SG ESS;PROPN;SG ADJ;IND;PFV;PRS;SG;V.PTCP ADJ;SG N;SG N;PSS3S;SG N;PSS3S;SG 3;PFV;PRS;SG;V _
milano gibi şehirler alp kolundan gelen suya yüzde 80 oranında bağımlı dır .	milano gibi şehir alp kol gel su yüz 80 oran bağımlı i .	PROPN;SG ADP N;NOM;PL PROPN;SG AT+ABL;N;PSS3S;SG ADJ;POS;SG DAT;N;SG ESS;N;SG NUM;SG ESS;N;PSS3S;SG ADJ;SG 3;PFV;PRS;SG;V _
doğal olarak , ofis alanında çok sayıda kıyafet ve çok az yiyecek yer alıyor .	doğal olarak , ofis alan çok sayı kıyafet ve çok az yiyecek yer al .	ADJ;SG POS;V _ N;SG ESS;N;PSS3S;SG ADJ ESS;N;SG N;SG CONJ ADV ADJ;SG N;NOM;SG N;SG 3;IND;PROG;PRS;SG;V _
londra'nın simgesi south bank tower , iç mimar rachel winham'ı gösteri salonunu tasarlamakla görevlendirdi .	londra simge south bank tower , iç mimar rachel winham göster salon tasarlamak görevlend .	GEN;PROPN;SG N;PSS3S;SG _ N;SG N;NOM;SG _ N;SG N;SG PROPN;SG ACC;PROPN;SG N;SG ACC;N;PSS3S;SG IND;INS;N;PFV;PRS;V.MSDR 3;CAUS;IND;PFV;PST;SG;V _
i̇skender'in tavsiyesi üzerine bir uzlaşmaya varmıştı : bir üniversiteye girecek ancak edebiyat okuyacaktı .	i̇skender tavsiye üzer bir uzlaş var : bir üniversite gir ancak edebiyat okuyacak .	GEN;PROPN;SG N;PSS3S;SG DAT;N;PSS3S;SG DET;INDF;POS;SG DAT;IND;N;PFV;PRS;V.MSDR 3;IND;NFH;PFV;PST+PRF;SG;V _ DET;INDF;POS;SG DAT;N;SG 3;FUT;IND;PFV;SG;V ADV N;SG 3;IND;PROSP;PST;SG;V _
cumhuriyetçi iktisatçılar , bu verilerin partilerinin ekonomik politikada berbat olduğunun bir kanıtı olarak görülmemesine önem veriyor .	cumhuriyetçi iktisatçı , bu veri parti ekonomik politikada berbat olduğu bir kanıt olarak görülme önem ver .	N;SG N;NOM;PL _ DEF;DET;POS;SG GEN;N;PL GEN;N;PL;PSS3S ADJ;SG ESS;N;SG ADJ;SG GEN;POS;PSS3S;SG;V DET;INDF;POS;SG N;PSS3S;SG POS;V DAT;IND;N;NEG;PFV;PRS;PSS3S;V.MSDR N;SG 3;IND;PROG;PRS;SG;V _
maksimum miktar kişi başı 5.000 dolar dır .	maksimum miktar kişi baş 5.000 do i .	ADJ;SG N;NOM;SG N;SG N;PSS3S;SG NUM;SG N;SG 3;PFV;PRS;SG;V _
yeni yetenekleri belirlemek için northampton üniversitesi'nde ki derece programlarını ziyaret ediyorum . dedi .	yeni yetenek belirle için northampton üniversite ki derece program ziyaret et . de .	ADJ;SG ACC;N;PL 3;FUT;IND;N;PFV;SG ADP PROPN;SG ESS;N;PSS3S;SG ADP N;SG ACC;N;PL;PSS3S N;SG 1;IND;PROG;PRS;SG;V _ 3;IND;PFV;PST;SG _
bu alanda ki yatırımlar 2015 yılında yüzde 6 artarak 221 milyar dolara yükseldi .	bu alan ki yatırım 2015 yıl yüz 6 art 221 milyar dolar yüksel .	DEF;DET;POS;SG ESS;N;SG ADP N;NOM;PL NUM;SG ESS;N;PSS3S;SG ESS;N;SG NUM;SG ADV;POS NUM;SG NUM;SG DAT;N;SG 3;IND;PFV;PST;SG;V _
1916'da başlayan arap i̇syanı , başta savaşın ilk iki yılında orta doğu cephesinde üstünlük kuran osmanlı aleyhine döndürmüştür .	1916 başla arap i̇syan , baş savaş ilk iki yıl or doğu cephe üstünlük kur osmanlıca aleyh döndür .	ESS;N;SG ADJ;POS;SG PROPN;SG N;PSS3S;SG _ ESS;N;SG GEN;N;SG ADJ;SG NUM;SG ESS;N;PSS3S;SG N;SG N;SG ESS;N;PSS3S;SG N;SG ADJ;POS;SG PROPN;SG DAT;N;PSS3S;SG 3;CAUS;NFH;PFV;PST;SG;V _
ordu küba'da ki savaşta iyi performans gösterdi .	ordu küba ki savaş iyi performans göster .	N;NOM;SG ESS;PROPN;SG ADP ESS;N;SG ADJ;SG N;SG 3;IND;PFV;PST;SG;V _
o yıl ayrıca , disney'in the muppets yapımında miss piggy'nin resepsiyonisti olarak kısa bir süre göründü .	o yıl ayrıca , disney the muppets yapım miss piggy resepsiyonist olarak kısa bir süre görün .	DEF;DET;POS;SG N;SG ADV _ GEN;PROPN;SG _ _ ESS;N;PSS3S;SG PROPN;SG GEN;PROPN;SG N;PSS3S;SG POS;V ADJ;SG DET;INDF;POS;SG N;SG 3;IND;PFV;PST;SG;V _
1992 yılında , topluluğa bırakılan eski kukla tiyatrosunun arsası oyuncular ve çalışanlar tarafından devralındı .	1992 yıl , topluluk bırak eski kukla tiyatro arsa oyuncu ve çalışan taraf devralı .	NUM;SG ESS;N;PSS3S;SG _ DAT;N;SG ADJ;POS;SG ADJ;SG N;SG GEN;N;PSS3S;SG N;NOM;PSS3S;SG N;PL CONJ N;PL AT+ABL;N;PSS3S;SG 3;IND;PASS;PFV;PST;SG;V _
birçok yapıtının tamamlanmamasından da anlaşıldığı üzere sadece on beş yıl hüküm sürmüştür .	birçok yapıt tamamlanmamas da anlaş üzere sadece on beş yıl hüküm sür .	DET;INDF;POS;SG GEN;N;PSS3S;SG AT+ABL;IND;N;NEG;PASS;PFV;PRS;PSS3S;V.MSDR ADV N;POS;PSS3S;SG ADP ADV NUM;SG NUM;SG N;SG N;SG 3;NFH;PFV;PST;SG;V _
1610'da yayınlanan jin ping mei , daha önce ki materyalleri içeriyor olmasına rağmen , bağımsız kompozisyon eğilimine ve psikoloji ile ilgili endişeye işaret ediyor .	1610 yayınla jin ping mei , daha önce ki materyal içer ol rağmen , bağımsız kompozisyon eğilim ve psikoloji ile ilgili endişe işaret et .	ESS;N;SG ADJ;POS;SG PROPN;SG PROPN;SG NOM;PROPN;SG _ ADV N ADP ACC;N;PL;PSS3S 3;IND;PROG;PRS;SG;V DAT;IND;N;PFV;PRS;PSS3S;V.MSDR ADP _ ADJ;SG N;SG DAT;N;PSS3S;SG CONJ N;SG ADP ADJ;SG DAT;N;SG N;SG 3;IND;PROG;PRS;SG;V _
gelişimin ilk yüzyılı boyunca , bölgede ki i̇spanyolların baskın konumu kesin di .	gelişim ilk yüzyılı boyunca , bölge ki i̇spanyol baskı konu _ _ .	GEN;N;SG ADJ;SG N;PSS3S;SG ADP;PSS3S _ ESS;N;SG ADP GEN;PL;PROPN ADJ;SG N;NOM;PSS3S;SG ADJ;SG 3;IND;PFV;PST;SG;V _
2009 yılına gelindiğinde , the power of now and a new earth'ün kuzey amerika'da ki toplam satışları tahmini olarak sırasıyla üç milyon ve beş milyona ulaştı .	2009 yıl gelindiğ , the power of now and a new earth kuzey amerika ki topla satış tahm olarak sıra üç milyon ve beş milyon ulaş .	NUM;SG DAT;N;PSS3S;SG ESS;N;POS;PSS3S;SG _ _ _ _ _ N;SG PROPN PROPN;SG GEN;PROPN;SG N;SG ESS;PROPN;SG ADP ADJ;SG N;NOM;PL;POS;PSS3S N;PSS3S;SG POS;V INS;N;PSS3S;SG NUM;SG NUM;SG CONJ NUM;SG DAT;N;SG 3;IND;PFV;PST;SG;V _
demiryolları tarihi üzerine çeşitli kitaplar yazan christian wolmar , 1 aralık'ta yapılacak yarışmaya katılacak .	demiryol tarih üzer çeşitli kitap yaz christian wolmar , 1 aralık yap yarış kat .	N;PL N;PSS3S;SG DAT;N;PSS3S;SG ADJ;SG N;PL ADJ;POS;SG PROPN;SG PROPN;SG _ NUM;SG ESS;N;SG 3;ADJ;FUT;IND;PASS;PFV;SG DAT;N;SG 3;FUT;IND;PASS;PFV;SG;V _
mailis , perşembe günü cbc news ile yaptığı bir röportajda , " bu ağrılı hastalar için bir felaket . " dedi .	mailis , perşembe gün cbc news ile yap bir röportaj , " bu ağrılı hasta için bir felaket _ _ de .	NOM;PROPN;SG _ N;SG N;PSS3S;SG PROPN;SG _ ADP ADJ;POS;PSS3S;SG DET;INDF;POS;SG ESS;N;SG _ _ DEF;NOM;POS;PRO;SG ADJ;SG N;PL ADP DET;INDF;POS;SG N;SG _ _ 3;IND;PFV;PST;SG;V _
harley - davidson sözcüsü , medyada yer alan zaman çizelgelerinin ( 2017 veya 2020 ) doğru olmadığını bildirdi .	harley - davidson sözcü , medya yer al zaman çizelge ( 2017 veya 2020 ) doğru ol bil .	PROPN;SG _ PROPN;SG N;NOM;PSS3S;SG _ ESS;N;SG N;SG ADJ;POS;SG N;SG GEN;N;PL;PSS3S _ NUM;SG CONJ NUM;SG _ ADJ;SG ACC;NEG;PSS3S;SG;V 3;CAUS;IND;PFV;PST;SG;V _
i̇lk saatte yapılan iş süresi ise yaklaşık 45 dakika dır .	ilk saat yap iş süre ise yaklaşık 45 _ _ .	ADJ;SG ESS;N;SG ADJ;POS;SG N;SG N;NOM;PSS3S;SG 3;COND;POS;SG;V ADJ;SG NUM;SG N;SG 3;PFV;PRS;SG;V _
kıyafetleri modern .	kıyafet modern .	N;NOM;PL;PSS3 ADJ;SG _
kim bu insanlar ?	kim bu insan ?	PRO;SG DEF;DET;POS;SG N;NOM;PL _
remis hepsinden kurtulmak için 1947 yazının büyük bölümünde i̇sviçre'de ikamet etti .	remis hepsi kurtul için 1947 yaz büyük bölüm i̇sviçre ikamet et .	NOM;PROPN;SG AT+ABL;N;SG 3;FUT;IND;N;PFV;SG ADP NUM;SG GEN;N;PSS3S;SG ADJ;SG ESS;N;PSS3S;SG ESS;PROPN;SG N;SG 3;IND;PFV;PST;SG;V _
bu uygulamanın amacı , ulaşım süresini hesaplamakla uğraşmak yerine ulaşım süresini tamamlanan çalışma saatlerinden çıkartarak hesaplamak tır .	bu uygulama amaç , ulaş süre hesapla uğraş yer ulaş süre tamamla çalış saat çıkar hesapla i .	DEF;DET;POS;SG GEN;N;SG N;NOM;PSS3S;SG _ N;SG ACC;N;PSS3S;SG IND;INS;N;PFV;PRS;V.MSDR 3;FUT;IND;N;PFV;SG DAT;N;PSS3S;SG N;SG ACC;N;PSS3S;SG ADJ;POS;SG IND;N;PFV;PRS;V.MSDR AT+ABL;N;PL;PSS3S ADV;POS IND;N;PFV;PRS;V.MSDR 3;PFV;PRS;SG;V _
vergi mükellefleri için cevap alma becerisi çok özlenecek .	vergi mükellef için cevap al becer çok özle .	N;SG N;PL ADP N;SG IND;N;NOM;PFV;PRS;V.MSDR N;PSS3S;SG ADV 3;FUT;IND;PASS;PFV;SG;V _
m.ö. 14. yüzyıldan kalma tell amarna mektuplarında mısır firavununa sadakat yemini eden gezer krallarının on mektubu yer alır .	m.ö. 14 yüzyıl kal tell amarna mektup mısır firavun sadakat ye et gezer kral on mektup yer al .	N;SG NUM;SG AT+ABL;N;SG ADJ;IND;NOM;PFV;PRS;V.MSDR PROPN;SG PROPN;SG ESS;N;PL;PSS3S PROPN;SG DAT;N;PSS3S;SG N;SG ACC;N;PSS3S;SG ADJ;POS;SG 3;HAB;PROPN;PRS;SG GEN;N;PL;PSS3S NUM;SG N;NOM;PSS3S;SG N;SG 3;HAB;PRS;SG;V _
jokowi görevi kabul etmeden önce devlet başkanı yudhoyono'nun daha çok sübvansiyon kaldırarak yakıt fiyatlarını daha fazla artırma kararının sorumluluğunu almasını istedi .	jokowi görevi kabul et önce devlet başkan yudhoyono daha çok sübvansiyon kal yakıt fiyat daha fazla artır karar sorumluluk al iste .	NOM;PROPN;SG ACC;N;PSS3S;SG N;SG IND;N;NEG;PFV;PRS;V.CVB ADP N;SG N;PSS3S;SG GEN;PROPN;SG ADV ADV N;SG ADV;POS N;SG ACC;N;PL;PSS3S ADV ADJ;SG IND;N;PFV;PRS;V.MSDR GEN;N;PSS3S;SG ACC;N;PSS3S;SG ACC;IND;N;PFV;PRS;PSS3S;V.MSDR 3;IND;PFV;PST;SG;V _
ancak , bu abd çevre koruma ajansı'nın dünyayı bu konularda uyarmasının ardından ortaya çıktı .	ancak , bu abd çevre koru ajansı dünya bu konu uyarmas ardından orta çık .	ADV _ DEF;NOM;POS;PRO;SG PROPN;SG N;SG IND;N;NOM;PFV;PRS;V.MSDR GEN;N;PSS3S;SG ACC;N;SG DEF;DET;POS;SG ESS;N;PL GEN;IND;N;PFV;PRS;PSS3S;V.MSDR ADP DAT;N;SG 3;IND;PFV;PST;SG;V _
seferi albany'ye ulaşmayı amaçlayan general joseph burgoyne yönetmiştir .	sefer albany ulaş amaçlay general joseph burgoyne yönet .	ACC;N;SG DAT;PROPN;SG ACC;IND;N;PFV;PRS;V.MSDR ADJ;POS;SG N;SG PROPN;SG NOM;PROPN;SG 3;NFH;PFV;PST;SG;V _
çok yüksek açısal çözünürlük elde etmek için alvarez'in dipol antenini kullanarak , gca , zemin temelli radar operatörlerine , pilotlara sözlü talimatlar göndererek bir iniş uçağını piste kılavuzlamak için özel hassas ekranlar izlemesine olanak tanır .	çok yüksek açısal çözünürlük el et için alvarez dipol anten kullan , gca , ze temelli radar operatör , pilot _ talimat gönder bir iniş uçak pist kılavuzla için özel hassas _ izle olanak tanı .	ADV ADJ;SG ADJ;SG N;SG ESS;N;SG 3;FUT;IND;N;PFV;SG ADP GEN;PROPN;SG ADJ;SG ACC;N;PSS3S;SG ADV;POS _ NOM;PROPN;SG _ N;SG ADJ;SG N;SG DAT;N;PL;PSS3S _ DAT;N;PL ADJ;SG N;PL ADV;POS DET;INDF;POS;SG N;SG ACC;N;PSS3S;SG DAT;N;SG 3;FUT;IND;N;PFV;SG ADP ADJ;SG ADJ;SG N;PL DAT;IND;N;PFV;PRS;PSS3S;V.MSDR N;SG 3;HAB;PRS;SG;V _
dahiyane bir ameliyat ve zorlu bir rehabilitasyon sürecinden sonra , tamamen iyileştim .	dahiyane bir ameliyad ve zorlu bir rehabilitasyon sürec sonra , tamamen iyileş .	ADJ;SG DET;INDF;POS;SG N;SG CONJ ADJ;SG DET;INDF;POS;SG N;SG AT+ABL;N;PSS3S;SG ADP _ ADV 1;IND;PFV;PST;SG;V _
ayrıca , ona gizli bilgiler sağlayan birçok hükümet bilimciyle kişisel bağlantılarından yararlandı .	ayrıca , o gizli bilgi sağla birçok hükümet bilimc kişisel bağlantı yararlan .	ADV _ DAT;POS;PRO;SG ADJ;SG N;PL ADJ;POS;SG DET;INDF;POS;SG N;SG INS;N;SG ADJ;SG AT+ABL;N;PL;PSS3S 3;IND;PFV;PST;SG;V _
mevcut arazi ıslah projeleri , fontvieille bölgesinin genişletilmesini içeriyor .	mevcut arazi ıslah proje , fontvieil bölge genişletil içer .	ADJ;SG N;SG N;SG N;NOM;PL;PSS3S _ PROPN;SG GEN;N;PSS3S;SG ACC;IND;N;PASS;PFV;PRS;PSS3S;V.MSDR 3;IND;PROG;PRS;SG;V _
çalışanların masalarına dini nesneler koyması serbest mi ?	çalışan masa din nesne koy serbest mi ?	GEN;N;PL DAT;N;PL;PSS3S ADJ;PSS3S;SG N;PL IND;N;NOM;PFV;PRS;PSS3S;V.MSDR ADJ;SG 3;SG;V _
araba alevlerin içinde kalırken kenseth uzaklaşıyordu .	araba alevler iç kal kenseth uzaklaş .	N;NOM;SG GEN;N;PL ESS;N;PSS3S;SG ADV;POS NOM;PROPN;SG 3;IND;PROG;PST;SG;V _
seri 1 artık eski olmadığından birçok kullanıcı artık 100 euro tasarruf edebilir .	seri 1 artık eski ol birçok kullanıcı artık 100 euro tasarruf et .	N;NOM;SG NUM;SG ADV ADJ;SG AT+ABL;NEG;PSS3S;SG;V DET;INDF;POS;SG N;NOM;POS;SG ADV NUM;SG N;SG N;SG 3;HAB;PRS;SG;V _
undersea olarak yayınlanan deneme , okyanus tabanında geçen bir yolculuğun canlı bir anlatımı ydı .	undersea olarak yayınla dene , okyanus taban geç bir yolculuk canlı bir anlat i .	PROPN;SG POS;V ADJ;POS;SG N;NOM;SG _ N;SG ESS;N;PSS3S;SG ADJ;POS;SG DET;INDF;POS;SG GEN;N;SG ADJ;SG DET;INDF;POS;SG N;PSS3S;SG 3;IND;PFV;PST;SG;V _
yine de hâlâ cevaplanamamış bazı sorular var .	yine de hâlâ cevaplanama bazı soru var .	ADV ADV ADV 3;ADJ;NEG;NFH;PASS;PFV;PST;SG DET;INDF;POS;SG N;NOM;PL ADJ;POS _
1960'ların başından bu yana buraya yerleşen müslüman vatandaşların çoğu türkiye'den göç etmiştir .	1960' baş bu yan bura yerleş müslüman vatandaş çok türkiye göç et .	GEN;N;PL AT+ABL;N;PSS3S;SG DEF;DET;POS;SG 3;DAT;N;OPT;PRS;SG DAT;POS;PRO;SG ADJ;POS;SG ADJ;SG GEN;N;PL NOM;PRO;SG AT+ABL;PROPN;SG N;SG 3;NFH;PFV;PST;SG;V _
harika bir ekibimiz var ve bu daha ileriye gidebilmemiz için bir fırsat .	harika bir ekib var ve bu daha ileri gidebil için bir fırsat .	ADJ;SG DET;INDF;POS;SG N;NOM;PSS1P;SG ADJ;POS CONJ DEF;NOM;POS;PRO;SG ADV DAT;N;SG N;NOM;PFV;PRS;PSS1P;V.MSDR ADP DET;INDF;POS;SG N;SG _
bu arada , tribünde ki yeri , aralık'a kadar görevde kalan marcus antonius tarafından işgal edilmiştir .	bu ara , trib ki yer , aralık kadar görev kal marcus antonius taraf işgal et .	DEF;DET;POS;SG ESS;N;SG _ ESS;N;SG ADP N;NOM;PSS3S;SG _ DAT;N;SG ADP ESS;N;SG ADJ;POS;SG PROPN;SG PROPN;SG AT+ABL;N;PSS3S;SG N;SG 3;NFH;PASS;PFV;PST;SG;V _
1917 rus devrimi'nden sonra finlandiya , polonya ve baltık devletleri gibi bazı ülkeler bağımsızlıklarını kazandılar .	1917 rus devrimi'n sonra finlandiya , polonya ve baltık devlet gibi bazı ülke bağımsızlık kazan .	NUM;SG PROPN;SG AT+ABL;N;PSS3S;SG ADP PROPN;SG _ PROPN;SG CONJ PROPN;SG N;PL;PSS3S ADP DET;INDF;POS;SG N;NOM;PL ACC;N;SG 3;IND;PFV;PL;PST;V _
para basma ağırlıklı olarak nümismatik tir ve esas olarak koleksiyonculara satılmak amacıyla gerçekleştirilen .	para bas _ olarak nümismatik i ve esas olarak koleksiyoncu sat amaç gerçekleş .	N;SG IND;N;NOM;PFV;PRS;V.MSDR ADJ;SG POS;V N;SG 3;PFV;PRS;SG;V CONJ N;SG POS;V DAT;N;PL 3;FUT;IND;N;PFV;SG INS;N;PSS3S;SG 3;ADJ;HAB;PRS;SG _
