yine de , i̇ngiliz kanunları kabul edilmiş olsaydı , 10. luis , 5. felipe ve 4. carlos'un kızları , fransa'dan isabella teyzeleri karşısında daha çok taht iddiasında olacaklardı .	yine de , i̇ngiliz kanun kabul et ol , 10 luis , _ felipe ve 4 carlos kız , fransa isabella teyze karşı daha çok taht iddia olacaklar .	ADV ADV _ PROPN;SG N;NOM;PL;PSS3S N;SG 3;IND;NFH;PASS;PFV;PST;SG;V 3;COND;PST;SG;V _ NUM;SG PROPN;SG _ NUM;SG PROPN;SG CONJ NUM;SG GEN;PROPN;SG N;NOM;PL;PSS3P _ AT+ABL;PROPN;SG PROPN;SG N;PSS3P;SG ESS;N;SG ADV ADV N;SG ESS;N;PSS3S;SG 3;PL;PROSP;PST;V _
bira , mead , bjorr ( güçlü bir meyve şarabı ) gibi alkollü içecekler ve zenginler için ithal şaraplar servis edilmiştir .	bira , mead , bjorr ( güçlü bir meyve şarap ) gibi alkollü içecek ve zengin için ithal şarap servis et .	N;SG _ N;SG _ N;SG _ ADJ;SG DET;INDF;POS;SG N;SG N;PSS3S;SG _ ADP ADJ;SG N;PL;POS CONJ N;PL ADP ADJ;SG N;NOM;PL N;SG 3;NFH;PASS;PFV;PST;SG;V _
shen orijinal bir teknik kullanarak kanalı başarıyla taradı ve gübre olarak toplanan kumun müthiş değerini gösterdi .	shen orijinal bir teknik kullan kanalı başarı tara ve gübre olarak topla kum müthiş değer göster .	NOM;PROPN;SG ADJ;SG DET;INDF;POS;SG N;SG ADV;POS ACC;N;SG INS;N;SG 3;IND;PFV;PST;SG;V CONJ N;SG POS;V ADJ;POS;SG GEN;N;SG ADJ;SG ACC;N;PSS3S;SG 3;IND;PFV;PST;SG;V _
1981'de çıkardığı wild west albümü , en çok satan çalışmalarından biri ydi .	1981 çıkar wild west albüm , en çok sat çalışmaların biri i .	ESS;N;SG ADJ;POS;PSS3S;SG PROPN;SG PROPN;SG N;NOM;PSS3S;SG _ ADV ADV ADJ;POS;SG AT+ABL;N;PL;PSS3S POS;PRO;SG 3;IND;PFV;PST;SG;V _
m.ö. 1900 civarında bir bronz çağı astronomi gözlemevi inşa edilmiş ve orada m.ö. 700 yılına kadar yaşayan topluluğa hizmet etmiştir .	m.ö. 1900 civar bir bronz çak astronomi gözlemevi inşa et ve ora m.ö. 700 yıl kadar yaşa topluluk hizmet et .	N;SG NUM;SG ESS;N;PSS3S;SG DET;INDF;POS;SG N;SG N;PSS3S;SG N;SG N;NOM;PSS3S;SG N;SG 3;IND;NFH;PASS;PFV;PST;SG;V CONJ ESS;POS;PRO;SG N;SG NUM;SG DAT;N;PSS3S;SG ADP ADJ;POS;SG DAT;N;SG N;SG 3;NFH;PFV;PST;SG;V _
ancak yasama çerçevesi olmadan ve esrarın ruh halini değiştiren doğal bir ilaç olarak tarihi de hesaba katıldığında , şirketler ancak tahmin yürütebiliyor .	ancak yasama çerçeves ol ve esrar ruh hal değiş doğal bir ilaç olarak tarih de hesaba katıldığ , şirket ancak tahmin yürütebil .	ADV N;SG N;NOM;PSS3S;SG ADV;IND;NEG;PFV;PRS;V.CVB CONJ GEN;N;SG N;SG ACC;N;PSS3S;SG ADJ;POS;SG ADJ;SG DET;INDF;POS;SG N;SG POS;V N;PSS3S;SG ADV DAT;N;SG ESS;N;POS;PSS3S;SG _ N;NOM;PL ADV N;SG 3;PROG;PRS;SG;V _
2000'li yılların başında 100.000 sakin başına beş doktor düşüyordu .	_ yıl baş 100.000 sakin baş beş doktor düş .	ADJ;SG GEN;N;PL ESS;N;PSS3S;SG NUM;SG N;SG DAT;N;PSS3S;SG NUM;SG N;NOM;SG 3;IND;PROG;PST;SG;V _
i̇spanya 1492'de sefarad nüfusunu kovdu ; bu i̇spanyol yahudilerin birçoğu i̇spanya'yı terk ederek portekiz'e yöneldi , ancak sonunda orada da hedef alındı .	i̇spanya 1492 sefarad nüfus kov ; bu i̇spanyol yahudiler birçoğu i̇spanya terk et portekiz yönel , ancak sonunda ora da hedef al .	NOM;PROPN;SG ESS;N;SG PROPN;SG ACC;N;PSS3S;SG 3;IND;PFV;PST;SG;V _ DEF;DET;POS;SG PROPN;SG GEN;PL;PROPN NOM;POS;PRO;SG ACC;PROPN;SG N;SG ADV;POS DAT;PROPN;SG 3;IND;PFV;PST;SG;V _ ADV ADV ESS;POS;PRO;SG ADV N;SG 3;IND;PASS;PFV;PST;SG;V _
bu bölüm şimdi yeni zorluklarla karşı karşıya .	bu bölüm şimdi yeni zorluk karşı karşı .	DEF;DET;POS;SG N;NOM;SG ADV ADJ;SG INS;N;PL N;SG DAT;N;SG _
i̇kinci dizi şimdilik nasıl gidiyor ?	ikinci diz şimdilik nasıl git ?	NUM;SG N;NOM;SG ADV ADV 3;IND;PROG;PRS;SG;V _
beyaz saray için mevcut aday hillary clinton'ın kocası , rich dahil bir grup kişiyi 20 ocak 2001 tarihinde , başkanlığının son gününde , affetti .	beyaz saray için mevcut aday hillary clinton koca , rich dahil bir grup kişiy 20 ocak 2001 tarih , başkanlığ son gün , affet .	ADJ;SG PROPN;SG ADP ADJ;SG N;SG PROPN;SG GEN;PROPN;SG N;NOM;PSS3S;SG _ PROPN;SG N;SG DET;INDF;POS;SG N;SG ACC;N;SG NUM;SG N;SG NUM;SG ESS;N;PSS3S;SG _ GEN;N;SG ADJ;SG ESS;N;PSS3S;SG _ 3;IND;PFV;PST;SG;V _
burayı terk etme nedenleri hakkında farklı teoriler var .	buray terk et neden hak farklı teori var .	ACC;POS;PRO;SG N;SG IND;N;PFV;PRS;V.MSDR N;PL ESS;N;PSS3S;SG ADJ;SG N;NOM;PL ADJ;POS _
çoğunlukla tepelerde duruyorlardı .	çoğunluk tepe dur .	INS;N;SG ESS;N;PL 3;IND;PL;PROG;PST;V _
dahası , hükumet başka bir kriz ile daha baş etmek zorunda kalacak .	dahası , hükumet başka bir kriz ile daha baş et zor kal .	ADV _ N;NOM;SG ADJ;SG DET;INDF;POS;SG N;SG ADP ADV N;SG 3;FUT;IND;N;PFV;SG ESS;N;SG 3;FUT;IND;PFV;SG;V _
rüzgar hızının artması bazı partikülleri kaldırarak hava akımına dahil eder .	rüzgar hız art bazı partikül kal hava akım dahil et .	N;SG GEN;N;PSS3S;SG IND;N;NOM;PFV;PRS;PSS3S;V.MSDR DET;INDF;POS;SG ACC;N;PL ADV;POS N;SG DAT;N;PSS3S;SG N;SG 3;HAB;PRS;SG;V _
norman benim yakın arkadaşlarımdan biri , bu yüzden onu bu duygusal halde görmek beni çok zorladı .	norman ben yak arkadaşlarım biri , bu yüz o bu duygusal hal gör ben çok zorla .	NOM;PROPN;SG 1;GEN;POS;PRO;PSS1;SG ADJ;SG AT+ABL;N;PL;PSS1S POS;PRO;PSS3;SG _ DEF;DET;POS;SG AT+ABL;N;SG 3;ACC;POS;PRO;SG DEF;DET;POS;SG ADJ;SG ESS;N;SG 3;FUT;IND;N;NOM;PFV;SG 1;ACC;POS;PRO;SG ADV 3;IND;PFV;PST;SG;V _
davis kupası'nın bunda rol oynayıp oynamadığını merak ediyorum .	davis kupası bu rol oyna oyna merak et .	PROPN;SG GEN;N;PSS3S;SG ESS;POS;PRO;SG N;SG ADV;POS ACC;N;NEG;PSS3S;SG N;SG 1;IND;PROG;PRS;SG;V _
başkenti bütün görkemiyle görmek isteyenler için , kasım ayı burayı ziyaret etmek için mükemmel bir zaman .	başkent bütün görkem gör _ için , kasım ayı bura ziyaret et için mükemmel bir zaman .	ACC;N;PSSS;SG ADJ;SG INS;N;PSS3S;SG 3;FUT;IND;N;PFV;SG N;PL;POS ADP _ N;SG N;NOM;PSS3S;SG ACC;POS;PRO;SG N;SG 3;FUT;IND;N;PFV;SG ADP ADJ;SG DET;INDF;POS;SG N;SG _
daha sonra ki çağlarda oyun yazarları , tarihçiler ve diğer entelektüeller truva savaşı'ndan esinlenerek eserler yaratacaktı .	daha sonra ki çağ oyun yazar , tarihçi ve diğer entelektüel truva savaşı'n esinle eser yarat .	ADV ADV ADP ESS;N;PL N;SG N;PL;PSS3S _ N;PL CONJ DEF;DET;POS;SG N;NOM;PL PROPN;SG AT+ABL;N;PSS3S;SG ADV;POS N;PL 3;IND;PROSP;PST;SG;V _
ekim 2015'te , yani skandalın ortaya çıkmasından bir ay sonra başkanlığa terfi etmişti .	ekim 2015 , yani skandal orta çık bir ay sonra başkanlık terif et .	N;SG ESS;N;SG _ ADV GEN;N;SG DAT;N;SG AT+ABL;IND;N;PFV;PRS;PSS3S;V.MSDR DET;INDF;POS;SG N;SG ADP DAT;N;SG N;SG 3;IND;NFH;PFV;PST+PRF;SG;V _
bu dönemde piaf ve mômone sokaklarda ya da kulüpte şarkı söylerken marcelle genelde odada kendi başına kalırdı .	bu dönem piaf ve mômone sokaklar ya da kulüp şarkı söyle marcel genel oda kendi baş kal .	DEF;DET;POS;SG ESS;N;SG PROPN;SG CONJ NOM;PROPN;SG ESS;N;PL CONJ ADV ESS;N;SG N;SG ADV;POS NOM;PROPN;SG ADV ESS;N;SG PRO;REFL;SG DAT;N;PSS3S;SG 3;HAB;PST;SG;V _
charles katı tutumlarına rağmen hollanda'nın ihtiyaçları için empati kuran bir hükümdar olarak görülüyordu .	charles kat tutum rağmen hollanda ihtiyaç için empati kur bir hükümdar olarak gör .	NOM;PROPN;SG ADJ;SG DAT;N;PL;PSS3S ADP GEN;PROPN;SG N;PL;PSS3S ADP N;SG ADJ;POS;SG DET;INDF;POS;SG N;SG POS;V 3;IND;PASS;PROG;PST;SG;V _
essen polisi , banka kartı verilerinin yardımıyla , bir emeklinin bankada öldüğü sırada orada durup izleyen dört kişiyi soruşturuyor .	essen polis , banka kart veri yardım , bir emekli banka öl sıra ora dur izle dört kişi soruştura .	PROPN;SG N;NOM;PSS3S;SG _ N;SG N;PSS3S;SG GEN;N;PL;PSS3S INS;N;PSS3S;SG _ DET;INDF;POS;SG GEN;N;SG ESS;N;SG ADJ;POS;PSS3S;SG ESS;N;SG ESS;POS;PRO;SG ADV;POS ADJ;POS;SG NUM;SG ACC;N;SG 3;IND;PROG;PRS;SG;V _
editör stephen wheeler , kipling'i zorlamıştır ancak kipling'in yazma ihtiyacı durdurulamazdı .	editör stephan whee , kipling zorla ancak kipling yaz ihtiyaç durdurula .	N;SG PROPN;SG NOM;PROPN;SG _ ACC;PROPN;SG 3;NFH;PFV;PST;SG;V ADV GEN;PROPN;SG IND;N;NOM;PFV;PRS;V.MSDR N;NOM;PSS3S;SG 3;HAB;NEG;PST;SG;V _
winstone , 1979'da that summer'ı çekerken karısı elaine ile tanıştı .	winstone , 1979 that summer çek karı ela ile tanış .	NOM;PROPN;SG _ ESS;N;SG _ ACC;PROPN;SG 3;ADV;IND;IPFV;SG;V.CVB N;PSS3S;SG PROPN;SG ADP 3;IND;PFV;PST;SG;V _
cgi mestre bir notta en azından 2017 senesinde kdv artışı olmayacağını belirtti .	cgi mestre bir not en az 2017 sene kdv artışı ol belir .	PROPN;SG NOM;PROPN;SG DET;INDF;POS;SG ESS;N;SG ADV AT+ABL;N;PSS2S;SG NUM;SG ESS;N;PSS3S;SG N;SG N;NOM;POS;PSS3S;SG ACC;N;NEG;PSS3S;SG 3;CAUS;IND;PFV;PST;SG;V _
bir ss subayı olan joseph darnand , direniş üyelerini avlayan milice paramiliterleri yönetti , ekim 1945'te idam edildi .	bir ss subay ol joseph darnand , direniş üye avlay _ paramiliter yönet , ekim 1945 idam et .	DET;INDF;POS;SG PROPN;SG N;PSS3S;SG POS;SG;V PROPN;SG NOM;PROPN;SG _ N;POS;SG ACC;N;PL;PSS3S ADJ;POS;SG PROPN;SG ACC;N;PL 3;IND;PFV;PST;SG;V _ N;SG ESS;N;SG N;SG 3;IND;PASS;PFV;PST;SG;V _
really really love you ağustos'ta çıkarılmış ve ilk 50'ye girmişti ; ilgili single olan " shaky ground " ise eylül'de çıktı ancak geyer zaten abd'de ydi .	really really love you ağustos çıkar ve ilk 50 gir ; ilgili sing ol " shaky ground " ise eylül çık ancak geyer zaten abd' i .	_ _ PROPN;SG NOM ESS;N;SG 3;IND;NFH;PFV;PST;SG;V CONJ ADJ;SG DAT;N;SG 3;IND;NFH;PFV;PST+PRF;SG;V _ ADJ;SG N;SG POS;SG;V _ _ NOM;PROPN;SG _ 3;COND;POS;SG;V ESS;N;SG 3;IND;PFV;PST;SG;V ADV NOM;PROPN;SG ADV ESS;PROPN;SG 3;IND;PFV;PST;SG;V _
bu durum en çok şöhret sahibi bir ünlünün adı başlangıçta oldukça nadir rastlanan bir isim olduğunda belirgin hale gelir .	bu durum en çok şöhret sahip bir ünlü ad başlangıç ol nadir rastla bir isim ol belirgin hal gel .	DEF;DET;POS;SG N;NOM;SG ADV ADV N;SG N;PSS3S;SG DET;INDF;POS;SG GEN;N;SG N;NOM;PSS3S;SG ESS;N;SG ADV ADJ;SG POS;SG;V DET;INDF;POS;SG N;SG ESS;POS;PSS3S;SG;V ADJ;SG DAT;N;SG 3;PSS3;V _
woods ile yazışarak , bir etimoloji ortaya çıkarmaya çalıştım .	woods ile yazış , bir etimoloji orta çıkar çalış .	PROPN;SG ADP ADV;POS _ DET;INDF;POS;SG N;SG DAT;N;SG DAT;IND;N;PFV;PRS;V.MSDR 1;IND;PFV;PST;SG;V _
görgü tanığı , mağdurun nisan'da şüpheliye saldırdığını polise söyledi .	görgü tanık , mağdurun nisan şüpheliye saldır polise söyle .	N;SG N;NOM;PSS3S;SG _ GEN;N;SG ESS;N;SG DAT;N;SG ACC;N;POS;PSS3S;SG DAT;N;SG 3;IND;PFV;PST;SG;V _
valentino , karakteri bir arap'ın basmakalıp tasvirinden uzaklaştırmaya çalıştı .	valentino , karakteri bir arap basmakal tasvir uzaklaş çalış .	NOM;PROPN;SG _ ACC;N;PSS3S;SG DET;INDF;POS;SG GEN;PROPN;SG ADJ;SG AT+ABL;N;PSS3S;SG CAUS;DAT;IND;PFV;PRS;SG;V;V.MSDR 3;IND;PFV;PST;SG;V _
ayrıca burası , alaska'da kış aylarında gündüzleri görülen yüksek sıcaklığının donma seviyesinin üstünde bulunduğu tek bölge .	ayrıca bura , alaska kış ay gündüz gör yüksek sıcaklık don seviye üst bul tek bölge .	ADV NOM;POS;PRO;PSS3S;SG _ ESS;PROPN;SG N;SG ESS;N;PL;PSS3S ADV ADJ;POS;SG ADJ;SG GEN;N;SG IND;N;NOM;PFV;PRS;V.MSDR GEN;N;PSS3S;SG ESS;N;PSS3S;SG ADJ;POS;PSS3S;SG ADJ;SG N;SG _
aynı zamanda , bangkok'un en yüksek binası olan öngörü sahibi mahanakhon gibi modern çok katlı binaların ortaya çıkışını hızlandırmıştır .	aynı zaman , bangkok en yüksek bina ol öngör sahip mahanakhon gibi modern çok _ bina orta çıkış hızlandır .	ADJ;SG ESS;N;SG _ GEN;PROPN;SG ADV ADJ;SG N;PSS3S;SG POS;SG;V N;SG N;SG PROPN;SG ADP ADJ;SG ADV ADJ;SG GEN;N;PL DAT;N;SG ACC;N;POS;PSS3S;SG 3;CAUS;NFH;PFV;PST;SG;V _
" bu , hormonsal erkek doğum kontrolü için doğru kombinasyonu bulmak adına uzun bir yolculukta atılan bir adım oldu . " diye ekledi .	" bu , hormonsal erkek doğum kontrol için doğru kombinasyon bul ad uzun bir yolculuk atıl bir adım ol _ _ diye ekle .	_ DEF;NOM;POS;PRO;SG _ ADJ;SG N;SG N;SG N;PSS3S;SG ADP ADJ;SG ACC;N;SG 3;FUT;IND;N;PFV;SG ADP;DAT;PSS3S;SG ADJ;SG DET;INDF;POS;SG ESS;N;SG ADJ;POS;SG DET;INDF;POS;SG N;SG 3;IND;PFV;PST;SG;V _ _ ADP 3;IND;PFV;PST;SG;V _
pyongyang'da akıllı telefon kullanan bazı insanlar gördüm , ancak çok daha az dı .	pyongyang akıllı telefon kullan bazı insan gör , ancak çok daha _ _ .	ESS;PROPN;SG ADJ;SG N;SG ADJ;POS;SG DET;INDF;POS;SG N;PL 1;IND;PFV;PST;SG;V _ ADV ADV ADV ADJ;SG 3;IND;PFV;PST;SG;V _
bu crtc oturumlarının amacı , endüstri paydaşları ve kamuoyundan gelen tepkilere cevap vermek .	bu crtc oturum amaç , endüstri paydaş ve kamuoyun gel _ cevap ver .	DEF;DET;POS;SG PROPN;SG GEN;N;PL;PSS3S N;NOM;PSS3S;SG _ N;SG N;PL;PSS3S CONJ AT+ABL;N;PSS3S;SG ADJ;POS;SG DAT;N;PL N;SG 3;FUT;IND;N;PFV;SG _
burası birçok topluluk için çağlar boyunca gıdanın ( balık tutma ve diğer deniz ürünlerinin toplanması ) yanı sıra ticaret , sömürgeleştirme ve savaş yolları sağlamıştır .	bura birçok topluluk için çağ boyunca gıdan ( balık tut ve diğer deniz ürün topla ) yan sıra ticaret , sömürgeleştir ve savaş yol sağla .	NOM;POS;PRO;PSS3S;SG DET;INDF;POS;SG N;SG ADP N;PL ADP;PSS3S GEN;N;SG _ N;SG IND;N;NOM;PFV;PRS;V.MSDR CONJ DEF;DET;POS;SG N;SG GEN;N;PL;PSS3S IND;N;NOM;PFV;PRS;PSS3S;V.MSDR _ N;PSS3S;SG ADP;SG N;SG _ CAUS;IND;N;NOM;PFV;PRS;SG;V.MSDR CONJ N;SG N;PL;PSS3S 3;NFH;PFV;PST;SG;V _
aynı zamanda rogers'ın son zamanlarda müşterilerin veri kullanımını izlemelerine yardımcı olan yeni bir uygulama aracı çıkardığına dikkat çekti .	aynı zaman rogers son zaman müşteri ver kullanım izleme yardımcı ol yeni bir uygulama araç çıkardık dikkat çek .	ADJ;SG ESS;N;SG GEN;PROPN;SG ADJ;SG ESS;N;PL GEN;N;PL N;SG ACC;N;PSS3S;SG DAT;N;PL;POS;PSS2S N;SG POS;SG;V ADJ;SG DET;INDF;POS;SG N;SG N;PSS3S;SG DAT;N;POS;PSS3S;SG N;SG 3;IND;PFV;PST;SG;V _
bbc için on yıl çalıştı .	bbc için on yıl çalış .	PROPN;SG ADP NUM;SG N;SG 3;IND;PFV;PST;SG;V _
lamarr'ın en eski icatları , geliştirilmiş trafik sinyal lambası ve karbonatlı bir içecek oluşturmak için suda çözülebilecek bir tableti içeriyor .	lamarr en eski icat , geliş trafik sinyal lamba ve karbonatlı bir iç oluştur için su çözülebil bir tablet içer .	GEN;PROPN;SG ADV ADJ;SG N;NOM;PL;PSS3S _ 3;ADJ;IND;NFH;PFV;PST;SG N;SG N;SG N;PSS3S;SG CONJ ADJ;SG DET;INDF;POS;SG N;POS;SG 3;FUT;IND;N;PFV;SG ADP ESS;N;SG 3;ADJ;FUT;PASS;PFV;SG DET;INDF;POS;SG ACC;N;PSS3S;SG 3;IND;PROG;PRS;SG;V _
bununla birlikte , kendisi ile linares arasında ki kopuş ve ilerici hattın kesintiye uğraması , 1879'da kendisini deviren vindication devrini tetiklemiştir .	bu birlikte , kendi ile linares ara ki kopuş ve _ hatt kesinti uğra , 1879 kendi devir vindication devr tetikle .	INS;POS;PRO;SG ADP _ 3;PRO;REFL;SG CONJ PROPN;SG ESS;N;PSS3S;SG ADP N;POS;SG CONJ ADJ;SG GEN;N;SG DAT;N;SG IND;N;NOM;PFV;PRS;PSS3S;V.MSDR _ ESS;N;SG 3;ACC;PRO;PSS3S;REFL;SG ADJ;POS;SG PROPN;SG ACC;N;PSS3S;SG 3;NFH;PFV;PST;SG;V _
georges ve eşi yazın , germaine'nin arkadaşlarından birinin kızı olan 18 yaşında ki rosane eşliğinde , i̇sviçre'ye döndü .	georges ve eş yaz , germaine arkadaş biri kız ol 18 yaş ki rosane eşliğ , i̇sviçre dön .	PROPN;SG CONJ N;NOM;PSS3S;SG N;SG _ GEN;PROPN;SG AT+ABL;N;PL;PSS3S GEN;POS;PRO;SG N;PSS3S;SG POS;SG;V NUM;SG ESS;N;PSS3S;SG ADP PROPN;SG ESS;N;PSS3S;SG _ DAT;PROPN;SG 3;IND;PFV;PST;SG;V _
tema , palma'da yaşayan çok sayıda ahdet etmiş yahudi'den ötürü geleneksel olarak bilinçli seçilirdi .	tema , palma yaşa çok sayı ahdet et yahudi ötürü geleneksel olarak bilinçli seçilir .	N;NOM;SG _ ESS;PROPN;SG ADJ;POS;SG ADV ESS;N;SG 2;IMP;N;PRS;SG 3;ADJ;IND;NFH;PFV;PST;SG AT+ABL;N;SG ADP ADJ;SG POS;V ADJ;SG 3;HAB;PASS;PST;SG;V _
yunanistan m.ö. 8. yüzyılda , miken uygarlığının yıkılışının ardından karanlık çağlardan itibaren karanlık çağ'dan çıkmaya başlamıştır .	yunanistan m.ö. _ yüzyıl , miken uygarlık yıkılış ardından karanlık çağ itibaren karanlık çağ çık başla .	NOM;PROPN;SG N;SG NUM;SG ESS;N;SG _ PROPN;SG GEN;N;PSS3S;SG GEN;N;POS;PSS3S;SG ADP;AT+ABL;PSS3S ADJ;SG AT+ABL;N;PL ADP ADJ;SG AT+ABL;N;SG DAT;IND;N;PFV;PRS;V.MSDR 3;NFH;PFV;PST;SG;V _
kısa bir süre önce aktris gloria holden'den boşandı ama evlilikte ki bu çatlaktan sonra meşaleyi taşımaya devam etti .	kısa bir süre önce aktris gloria holden boşa ama evlilik ki bu çatlak sonra meşale taşı devam et .	ADJ;SG DET;INDF;POS;SG N;SG ADP N;SG PROPN;SG AT+ABL;PROPN;SG 3;IND;PASS;PFV;PST;SG;V CONJ ESS;N;SG ADP DEF;DET;POS;SG AT+ABL;N;SG ADP ACC;N;SG DAT;IND;N;PFV;PRS;V.MSDR N;SG 3;IND;PFV;PST;SG;V _
rafferty , 1990'lı yıllarda tom robinson'un daha sonra " forma önemli bir dönüş " olarak nitelendirdiği iki albüm daha çıkardı .	rafferty , _ yıl tom robinson daha sonra " forma _ bir dönüş " olarak nitelendir iki albüm daha çıkar .	NOM;PROPN;SG _ ADJ;SG ESS;N;PL PROPN;SG GEN;PROPN;SG ADV ADV _ DAT;N;SG ADJ;SG DET;INDF;POS;SG N;POS;SG _ POS;V ADJ;POS;PSS3S;SG NUM;SG N;SG ADV 3;CAUS;IND;PFV;PST;SG;V _
muson , birkaç ay süren ve bir bölgeye yağmurlu mevsim getiren mevsimlik bir rüzgar dır .	muson , birkaç ay sür ve bir bölge _ mevsim getir mevsimlik bir rüzgar i .	N;NOM;SG _ DET;INDF;POS;SG N;SG ADJ;POS;SG CONJ DET;INDF;POS;SG DAT;N;SG ADJ;SG N;SG ADJ;POS;SG ADJ;SG DET;INDF;POS;SG N;SG 3;PFV;PRS;SG;V _
mr. panvalkar o an binayı terk etmeleri gerektiğini hissettiğini söyledi .	_ panvalkar o an bina terk et gerek hisset söyle .	N;SG NOM;PROPN;SG DEF;DET;POS;SG N;SG ACC;N;SG N;SG IND;N;NOM;PFV;PRS;PSS3P;V.MSDR ACC;N;POS;PSS3S;SG ACC;N;POS;PSS3S;SG 3;IND;PFV;PST;SG;V _
wright , yönetmen garth jennings'in bir arkadaşı ve the hitchhiker's guide to the galaxy ve son of rambow filmlerinde küçük roller üstlendi .	wright , yönetmen garth jennings bir arkadaş ve the hitchhiker's gui to the galaxy ve son of rambow film küçük rol üstlen .	NOM;PROPN;SG _ N;SG PROPN;SG GEN;PROPN;SG DET;INDF;POS;SG N;PSS3S;SG CONJ _ _ _ _ _ PROPN;SG CONJ SG _ PROPN;SG ESS;N;PL;PSS3S ADJ;SG N;PL 3;IND;PFV;PST;SG;V _
tabii ki , dokunsal eğilim , bir şeyleri kendimiz yapma konusunda ki artan saplantımız ile yakından ilişkili dir .	tabii ki , dokunsal eğilim , bir şey kend yap konu ki art saplant ile yakın ilişkili i .	ADJ;SG CONJ _ ADJ;SG N;NOM;SG _ DET;INDF;POS;SG ACC;N;PL N;SG IND;N;NOM;PFV;PRS;V.MSDR ESS;N;PSS3S;SG ADP ADJ;POS;SG N;PSS1P;SG ADP AT+ABL;N;SG ADJ;SG 3;PFV;PRS;SG;V _
müziğin menşei ile ilgili açıklamalar , müziğin nasıl tanımlandığına bağlı dır .	müzik menşe ile ilgili açıkla , müzik nasıl tanımla _ _ .	GEN;N;SG N;PSS3S;SG ADP ADJ;SG N;NOM;PL;POS _ GEN;N;SG ADV DAT;N;POS;SG ADJ;SG 3;PFV;PRS;SG;V _
eski adalet bakanı mesajda brice hortefeux'u ' faşist ' , ' moron i̇çişleri bakanı ' ve ' eşkıya ' olmakla suçladı .	eski adalet bakan mesaj brice hortefeux _ _ _ , _ _ i̇çiş _ _ ve _ _ _ ol suçla .	ADJ;SG N;SG N;NOM;PSS3S;SG ESS;N;SG PROPN;SG ACC;PROPN;SG _ N;SG _ _ _ ADJ;SG N;PL;PSS3P N;PSS3S;SG _ CONJ _ N;SG _ IND;INS;PFV;PRS;V;V.MSDR 3;IND;PFV;PST;SG;V _
i̇mtiyaz'ın ardından , i̇mparator ve kral franz joseph i. her iki monarşisine de eşit muamele etmeye özen gösterdi .	i̇mtiyaz ardından , i̇mparator ve kral franz joseph _ her iki monarşi de eşit muamele et özen göster .	GEN;N;SG ADP _ N;SG CONJ N;SG PROPN;SG PROPN;SG NOM;PROPN;SG DEF;DET;POS;SG NUM;SG DAT;N;PSS3S;SG ADV ADJ;SG N;SG DAT;IND;N;PFV;PRS;V.MSDR N;SG 3;IND;PFV;PST;SG;V _
marcus antonius m.ö. 1 ocak 49'da , sezar'dan vali'nin kendisini barış dostu ilan ettiği bir bildiri yayınlamıştır .	marcus antonius _ 1 ocak 49 , sezar vali'nin kendi barış dost ilan et bir bildiri yayınla .	PROPN;SG NOM;PROPN;SG N;SG NUM;SG N;SG ESS;N;SG _ AT+ABL;PROPN;SG GEN;N;SG 3;ACC;PRO;REFL;SG N;SG N;PSS3S;SG N;SG POS;PSS3S;SG;V DET;INDF;POS;SG N;SG 3;NFH;PFV;PST;SG;V _
buna ek olarak , doğu deltası bölgesinde walls of the ruler'ı inşa ederek mısır ve asya arasında ki savunmayı güçlendirmiştir .	bu ek olarak , doğu delta bölge walls of the ruler inşa et mısır ve asya ara ki savunma güçlendir .	DAT;POS;PRO;SG N;SG POS;V _ N;SG N;PSS3S;SG ESS;N;PSS3S;SG PROPN;SG _ _ ACC;PROPN;SG N;SG ADV;POS PROPN;SG CONJ PROPN;SG ESS;N;PSS3S;SG ADP ACC;N;POS;SG 3;CAUS;NFH;PFV;PST;SG;V _
tematik olarak jasmine yaşam , özgürlük ve mutluluk arayışının yanı sıra sivil hakları , ırk konusunda hoşgörülü olmayı , toplumsal hiyerarşiyi de temsil ediyor .	tematik olarak jasm yaşam , özgürlük ve mutluluk arayış yan sıra sivil hak , ırk konu _ ol , toplumsal hiyerarşi de temsil et .	ADJ;SG POS;V NOM;PROPN;SG N;SG _ N;SG CONJ N;SG GEN;N;POS;PSS3S;SG N;PSS3S;SG N;SG ADJ;SG ACC;N;PL;PSS3S _ N;SG ESS;N;PSS3S;SG ADJ;SG ACC;IND;PFV;PRS;V;V.MSDR _ ADJ;SG ACC;N;SG ADV N;SG 3;IND;PROG;PRS;SG;V _
bir yanda , pazar günü öğleden sonra izlemek için biçilmiş kaftan , samimi , içinizi ısıtacak bir film .	bir yan , pazar gün öğle sonra izle için biçil kaf , sam , iç ısıt bir film .	DET;INDF;POS;SG ESS;N;SG _ N;SG N;PSS3S;SG AT+ABL;N;SG ADP 3;FUT;IND;N;PFV;SG ADP 3;ADJ;IND;NFH;PASS;PFV;PST;SG N;SG _ ADJ;SG _ ACC;N;SG ADJ;POS;SG DET;INDF;POS;SG N;SG _
bu , sterlinde ki düşüşün yurt dışı varlıklara kattığı değerden faydalanmadıkları anlamına geliyor .	bu , sterl ki düşüş yurt dış varlık kat değer faydalanma anlam gel .	DEF;NOM;POS;PRO;SG _ ESS;N;SG ADP GEN;N;POS;SG N;SG N;PSS3S;SG DAT;N;PL ADJ;POS;PSS3S;SG AT+ABL;N;SG N;NEG;PL DAT;N;PSS3S;SG 3;IND;PROG;PRS;SG;V _
üçüncü gün , emicro'ya geri döndüm .	üçüncü gün , emicro geri dön .	NUM;SG N;SG _ DAT;PROPN;SG ADV 1;IND;PFV;PST;SG;V _
olaysız bir yaşamın ardından ya yaşlı yken öleceği ya da bir savaş meydanında genç ken ölüp şiirle ölümsüzleşeceği söylenmişti .	olaysız bir yaşam ardından ya yaşlı i öl ya da bir savaş meydan _ _ öl şiir ölümsüzleş söyle .	ADJ;SG DET;INDF;POS;SG GEN;N;SG ADP CONJ ADJ IND;PFV;PRS;V;V.CVB N;POS;PSS3S;SG CONJ ADV DET;INDF;POS;SG N;SG ESS;N;PSS3S;SG ADJ;SG IND;PFV;PRS;V;V.CVB ADV;POS INS;N;SG FUT;N;NOM;PFV;PSS3S;SG;V.PTCP 3;IND;NFH;PASS;PFV;PST+PRF;SG;V _
klasik antik dönemin en önemli iki akdeniz medeniyeti , yunan şehir devletleri ve fenikeliler dir ; her ikisi de akdeniz kıyı şeridini kapsamlı bir şekilde kolonize etmiştir .	klasik antik dönem en _ iki akdeniz medeniyet , yunan şehir devlet ve fenikeli i ; her iki de akdeniz kıyı şeridin _ bir şekil koloniz et .	ADJ;SG ADJ;SG GEN;N;SG ADV ADJ;SG NUM;SG PROPN;SG N;NOM;PSS3S;SG _ PROPN;SG N;SG N;PL;PSS3S CONJ PL;PROPN 3;PFV;PRS;SG;V _ DEF;DET;POS;SG N;NOM;PSS3S;SG ADV PROPN;SG N;SG ACC;N;PSS3S;SG ADJ;SG DET;INDF;POS;SG ESS;N;SG N;SG 3;NFH;PFV;PST;SG;V _
bloch , umudu marksizminin yönlendirici ilkesi olarak ortaya koymaya dikkat edip mistik geleneğe özgü örtülü hümanizmi vurgular .	bloch , umu marksizm _ ilke olarak orta koy dikkat et mistik gelenek özgü _ hümanizm vurgu .	NOM;PROPN;SG _ ACC;N;PSS3S;SG GEN;PROPN;PSS3S;SG ADJ;POS;SG N;PSS3S;SG POS;V DAT;N;SG DAT;IND;N;PFV;PRS;V.MSDR N;SG ADV;POS N;SG DAT;N;SG ADJ;SG ADJ;SG ACC;N;PSS3S;SG PL;V _
sonuç olarak , birçok kişi sonuçlarını düşünmeden gelen e-postaları çabucak açar veya bağlantılara ve eklere tıklar .	sonuç olarak , birçok kişi sonuç düşün gel _ çabucak aç veya bağlantı ve eklere tık .	N;SG POS;V _ DET;INDF;POS;SG N;NOM;SG ACC;N;PL;PSS3S ADV;IND;NEG;PFV;PRS;V.CVB ADJ;POS;SG ACC;N;PL;PSS3S ADV 3;HAB;PRS;SG;V CONJ DAT;N;PL CONJ DAT;N;PL 3;HAB;PRS;SG;V _
barışı sağlamaya yönelik girişimler nihayet 1415 ilkbaharında sona ermiş ve enrique planını yürürlüğe koymaya karar vermiştir : tüm fransa krallığına yapılan bir istila .	barış sağla yönelik girişim nihayet 1415 ilkbahar son er ve enrique plan yürürlük koy karar ver : tüm fransa krallık yap bir isti .	ACC;N;SG DAT;IND;N;PFV;PRS;V.MSDR ADP N;NOM;PL N;SG NUM;SG ESS;N;PSS3S;SG DAT;N;SG 3;IND;NFH;PFV;PST;SG;V CONJ NOM;PROPN;SG ACC;N;PSS3S;SG DAT;N;SG DAT;IND;N;PFV;PRS;V.MSDR N;SG 3;NFH;PFV;PST;SG;V _ DEF;DET;POS;SG PROPN;SG DAT;N;PSS3S;SG ADJ;POS;SG DET;INDF;POS;SG N;SG _
ayrıca , buenos aires şehri'nin federalleştirilmesini , ticari kanunun uzatılmasını ve orduya yeni generallerin atanmasını da ele almıştır .	ayrıca , buenos aires şehri federalleştiril , ticari kan uzatıl ve ordu yeni general ata da el al .	ADV _ PROPN;SG PROPN;SG GEN;N;PSS3S;SG ACC;IND;N;PFV;PRS;PSS3S;SG;V.MSDR _ ADJ;SG GEN;N;SG ACC;IND;N;PASS;PFV;PRS;PSS3S;V.MSDR CONJ DAT;N;SG ADJ;SG GEN;N;PL ACC;IND;N;PASS;PFV;PRS;PSS3S;V.MSDR ADV DAT;N;SG 3;NFH;PFV;PST;SG;V _
ortalama şansa ve 10.000 sterlin değerinde tahvillere sahip bir yatırımcı yılda 125 sterlin ikramiye kazanabilir .	ortalama şansa ve 10.000 sterl değer tahvil sahip bir yatırımcı yıl 125 sterl ikrami kazan .	N;SG DAT;N;SG CONJ NUM;SG N;SG ESS;N;PSS3S;SG DAT;N;PL ADJ;SG DET;INDF;POS;SG N;NOM;SG ESS;N;SG NUM;SG N;SG N;SG 3;HAB;PRS;SG;V _
barrie , edinburgh evening courant için drama incelemeleri yazdığı edinburgh üniversitesi'ne kaydoldu .	barrie , edinburgh evening courant için dram incele yaz edinburgh üniversitesi'ne kaydol .	NOM;PROPN;SG _ PROPN;SG _ PROPN;SG ADP DAT;N;SG N;PL;POS ADJ;POS;PSS3S;SG PROPN;SG DAT;N;PSS3S;SG 3;IND;PFV;PST;SG;V _
137 uluslararası maçta 71 gol kaydederek dfb için rekor sayıda gol attı .	137 uluslarara maç 71 gol kaydet dfb için rekor sayı gol at .	NUM;SG ADJ;SG ESS;N;SG NUM;SG N;SG ADV;POS PROPN;SG ADP N;SG ESS;N;SG N;SG 3;IND;PFV;PST;SG;V _
