1566'da 400 asilden oluşan bir topluluk , zulmü geri kalan kişiler dönene kadar durdurmak üzere parma valisi margaret'a bir dilekçe sundu .	1566 400 asil oluş bir topluluk , zulm geri kal kişi dönen kadar durdur üzere parma valis margaret bir dilekçe sun .	ESS;N;SG NUM;SG AT+ABL;N;SG ADJ;POS;SG DET;INDF;POS;SG N;NOM;SG _ ACC;N;PSS3S;SG ADV ADJ;POS;SG N;NOM;PL 3;N;OPT;PRS;SG ADP 3;FUT;IND;N;PFV;SG ADP PROPN;SG N;PSS3S;SG DAT;PROPN;SG DET;INDF;POS;SG N;SG 3;IND;PFV;PST;SG;V _
dr. lee " agora'ya yalnızca davetiyeyle girilebiliyordu , ancak nereye bakacağınızı biliyorsanız bu pazarların çoğuna kolayca erişilebilir diniz . " diye ekliyor .	_ lee " agora yalnızca davetiye girilebil , ancak nere bakacağ biliyor bu pazarlar çok _ _ _ . " diye ekle .	N;SG NOM;PROPN;SG _ DAT;PROPN;SG ADV INS;N;SG 3;PASS;PROG;PST;SG;V _ ADV DAT;PRO;SG ACC;N;POS;PSS2P;SG 2;COND;PL;PROG;PRS;V DEF;DET;POS;SG GEN;N;PL DAT;N;PSS3S;SG ADV;SG N;POS;SG 2;IND;PFV;PL;PST;V _ _ ADP 3;IND;PROG;PRS;SG;V _
trump'ın eşi melania trump , temmuz ayında ki cumhuriyet kongresinden bu yana ilk defa halkın karşısına çıktı .	trump eş melania trump , temmuz ay ki cumhuriyet kongre bu yan ilk defa halk karşı çık .	GEN;PROPN;SG N;PSS3S;SG PROPN;SG NOM;PROPN;SG _ N;SG ESS;N;PSS3S;SG ADP N;SG AT+ABL;N;PSS3S;SG DEF;DET;POS;SG 3;N;OPT;PRS;SG ADJ;SG N;SG GEN;N;SG DAT;N;SG 3;IND;PFV;PST;SG;V _
asya'da görülen iyi rakamlar piyasaları hemen yukarıya doğru itti .	asya gör iyi rakam piyasa hemen yukarı doğru i .	ESS;PROPN;SG ADJ;POS;SG ADJ;SG N;NOM;PL ACC;N;PL ADV DAT;N;SG ADP;SG 3;IND;PFV;PST;SG;V _
parker'a göre , i̇ngiltere'de çok sayıda rus gizli servisi ajanı faaliyet göstermektedir .	parker'a göre , i̇ngiltere çok sayı rus gizli servi ajan faaliyet göster .	DAT;PROPN;SG ADP _ ESS;PROPN;SG ADV ESS;N;SG PROPN;SG ADJ;SG N;PSS3S;SG N;NOM;PSS3S;SG N;SG 3;PROG;PRS;SG;V _
george koyu bir dindar dı ve saatlerce ibadet ederdi ancak kardeşleri aynı dindarlığı göstermiyordu .	george koyu bir _ _ ve saat ibadet et ancak kardeş aynı dindarlık göster .	NOM;PROPN;SG ADJ;SG DET;INDF;POS;SG ADJ;SG 3;IND;PFV;PST;SG;V CONJ ADV N;SG 3;HAB;PST;SG;V ADV N;NOM;PL;PSS3S ADJ;SG ACC;N;SG 3;IND;NEG;PROG;PST;SG;V _
2016'ya hızlıca geri dönecek olursak , bu konuya giderek daha fazla önem verilmesi gerekiyor .	2016' hızlı geri dön olur , bu konu git daha fazla önem ver gerek .	DAT;N;SG ADV;SG ADV 3;FUT;IND;PFV;SG;V 1;HAB;PL;PRS;V _ DEF;DET;POS;SG DAT;N;SG ADV;POS ADV ADJ;SG N;NOM;SG IND;N;NOM;PASS;PFV;PRS;PSS3S;V.MSDR 3;IND;PROG;PRS;SG;V _
louis post dispatch bunu labeouf'un en iyi performanslarından biri olarak adlandırdı .	louis post dispatch bu labeouf en iyi performans biri olarak adlandır .	PROPN;SG PROPN;SG PROPN ACC;POS;PRO;SG GEN;PROPN;SG ADV ADJ;SG AT+ABL;N;PL;PSS3P POS;PRO;SG POS;V 3;CAUS;IND;PFV;PST;SG;V _
i̇ki yılın ardından şimdi 31 yaşında olan jutting , iki cinayet ve bir cenazenin yasalara uygun şekilde defnedilmesine engel olma suçlarıyla hong kong yüksek mahkemesinde yargılanıyor .	iki yıl ardından şimdi 31 yaş ol jutting , iki cinayet ve bir cenaze yasa uygun şekil defnedil engel ol suç hong kong yüksek mahkeme yargılan .	NUM;SG GEN;N;SG ADP ADV NUM;SG ESS;N;PSS3S;SG POS;SG;V NOM;PROPN;SG _ NUM;SG N;SG CONJ INDF;NUM;POS;SG GEN;N;SG DAT;N;PL ADJ;SG ESS;N;SG DAT;IND;N;PASS;PFV;PRS;PSS3S;V.MSDR N;SG IND;NOM;PFV;PRS;V;V.MSDR INS;N;PL;PSS3S PROPN;SG PROPN;SG ADJ;SG ESS;N;PSS3S;SG 3;IND;PASS;PROG;PRS;SG;V _
kipling orada geçirdiği süre boyunca , ( trix'in geri döndüğü ) southsea'de trix ile gemiye binen floransa garrard'ına aşık olmuştu .	kipling ora geçir süre boyunca , ( trix geri dön ) southsea trix ile gemiye binen flora garrard' aşık ol .	NOM;PROPN;SG ESS;POS;PRO;SG ADJ;POS;PSS3S;SG N;SG ADP;PSS3S _ _ GEN;PROPN;SG ADV ADJ;POS;PSS3S;SG _ ESS;PROPN;SG PROPN;SG ADP DAT;N;SG ADJ;POS;SG PROPN;SG DAT;PROPN;PSS3S;SG N;SG 3;IND;NFH;PFV;PST+PRF;SG;V _
ardından bush house'da bbc world service radyosu ile dört yıl geçirdi .	ardından bush house bbc world service radyo ile dört yıl geçir .	ADV PROPN;SG SG PROPN;SG PROPN;SG N;SG N;PSS3S;SG ADP NUM;SG N;SG 3;CAUS;IND;PFV;PST;SG;V _
zengin banliyölerini 2010'a kadar temsil eden liberal demokratlar kendi adayları sarah olney ile bunu geri almayı umuyorlar .	zengin banliyö 2010'a kadar temsil et liberal demokrat kendi adayı sarah olney ile bu geri al um .	N;SG ACC;N;PL;PSS3S DAT;N;SG ADP N;SG ADJ;POS;SG ADJ;SG N;NOM;PL PRO;REFL;SG N;PL;PSS3S PROPN;SG PROPN;SG ADP ACC;POS;PRO;SG ADV ACC;IND;N;PFV;PRS;V.MSDR 3;IND;PL;PROG;PRS;V _
cumhuriyetçi parti başkan adayı trump , göç kısıtlamasına dair yaptığı önce ki açıklamaların aksine , başkan olursa " liyakat sistemi"ne dayanarak " muazzam sayıda " yasal göçmenin ülkeye girişini onaylayacağını açıkladı .	cumhuriyetçi parti başkan aday trump , göç kısıtla dair yap önce ki açıkla ak , başkan ol " liyakat _ dayan " muazzam sayı " yasal göçmen ülke giriş onaylay açıkla .	N;SG N;SG N;SG N;PSS3S;SG NOM;PROPN;SG _ N;SG DAT;N;POS;PSS3S;SG ADP ADJ;POS;PSS3S;SG ADP ADP GEN;N;PL;POS ADP _ N;SG 3;HAB;PRS;SG;V _ N;SG 3;DAT;N;PSS3S;SG ADV;POS _ ADJ;SG ESS;N;SG _ ADJ;SG GEN;N;SG DAT;N;SG ACC;N;POS;PSS3S;SG ACC;N;POS;PSS3S;SG 3;IND;PFV;PST;SG;V _
petén bölgesinden ve uaxactun'dan gelen verilerin ortaya koyduğu yapılar , bu alanların maya arazisinin kültürel gelişimine uymasını sağladı .	petén bölge ve uaxactun gel _ orta koy yapı , bu alan ma arazi kültürel gelişim uy sağla .	PROPN;SG AT+ABL;N;PSS3S;SG CONJ AT+ABL;PROPN;SG ADJ;POS;SG GEN;N;PL DAT;N;SG ADJ;POS;PSS3S;SG N;NOM;PL _ DEF;DET;POS;SG GEN;N;PL PROPN;SG GEN;N;PSS3S;SG ADJ;SG DAT;N;PSS3S;SG ACC;IND;N;PFV;PRS;PSS3S;V.MSDR 3;IND;PFV;PST;SG;V _
sabit bir rüzgar esmeye başlayınca , açık alanda ki ince parçacıklar titreşim oluşturmaya başlar .	sabit bir rüzgar es başla , açık alan ki ince parçacık titreşim oluştur başla .	ADJ;SG DET;INDF;POS;SG N;NOM;SG DAT;IND;N;PFV;PRS;V.MSDR ADV;POS _ ADJ;SG ESS;N;SG ADP ADJ;SG N;NOM;PL N;SG DAT;IND;N;PFV;PRS;V.MSDR 3;HAB;PRS;SG;V _
alanında uzman olarak tanındıktan sonra , bu becerileri küçük bir polonyum diski ile radony enstitüsüne aktardı .	alan uzman olarak tanın sonra , bu beceri küçük bir polonyum diski ile radony enstitüüs aktar .	ESS;N;PSS3S;SG N;SG POS;V AT+ABL;N;POS;SG ADP _ DEF;DET;POS;SG ACC;N;PL ADJ;SG DET;INDF;POS;SG N;SG N;PSS3S;SG ADP PROPN;SG DAT;N;PSS3S;SG 3;IND;PFV;PST;SG;V _
bununla birlikte , herhangi bir yeni mevzuata karşı çıkan güçlü dini inançlara sahip pek çok meclis üyesi var dır .	bu birlikte , herhangi bir yeni mevzuata karşı çık güçlü din inanç sahip pek çok meclis üye var i .	INS;POS;PRO;SG ADP _ DET;INDF;POS;SG DET;INDF;POS;SG ADJ;SG DAT;N;SG ADP ADJ;POS;SG ADJ;SG ADJ;PSS3S;SG DAT;N;PL ADJ;SG ADV ADJ N;SG N;NOM;PSS3S;SG ADJ;POS 3;PFV;PRS;SG;V _
daha sonra savunma oyunu oynayan şampiyon sara errani ile karşılaştı ancak mağlup oldu .	daha sonra savun oyun oyna şampiyon sar errani ile karşılaş ancak mağlup ol .	ADV ADV IND;N;PFV;PRS;V.MSDR N;PSS3S;SG ADJ;POS;SG N;SG PROPN;SG PROPN;SG ADP 3;IND;PFV;PST;SG;V CONJ ADJ;SG 3;IND;PFV;PST;SG;V _
bunlar genellikle bir sürü şey yapmak isteyen sanatçılar .	bu genellikle bir sür şey yap iste sanatçı .	NOM;PL;POS;PRO ADV DET;INDF;POS;SG N;SG N;SG 3;FUT;IND;N;PFV;SG ADJ;POS;SG N;PL _
korku yönetimi baskısını hafifleten iii. pluviose ( ocak - şubat 1794) 'da , şüphelileri kurtarmak için çeşitli önlemler almıştır .	korku yönetim baskı hafiflet _ pluviose ( ocak - şubat _ ' , şüpheli kurtar için çeşitli önlem al .	N;SG N;PSS3S;SG ACC;N;PSS3S;SG ADJ;POS;SG NUM;SG NOM;PROPN;SG _ N;SG _ N;SG SG ESS;SG _ ACC;N;PL 3;FUT;IND;N;PFV;SG ADP ADJ;SG N;PL 3;NFH;PFV;PST;SG;V _
yemin , meclis üyelerinin çin halk cumhuriyeti'nin bir parçası olarak hong kong'a bağlılık sözünü içeriyor .	yemin , meclis üye çin halk cumhuriyet bir parça olarak hong kong bağlılık söz içer .	N;NOM;SG _ N;SG GEN;N;PL;PSS3S PROPN;SG N;SG GEN;N;PSS3S;SG DET;INDF;POS;SG N;PSS3S;SG POS;V PROPN;SG DAT;PROPN;SG N;SG ACC;N;PSS3S;SG 3;IND;PROG;PRS;SG;V _
barroso'ların alışverişi büyük bir heyecana yol açtı .	barroso' alışveriş büyük bir heyecan yol aç .	GEN;PL;PROPN N;NOM;PSS3S;SG ADJ;SG DET;INDF;POS;SG DAT;N;SG N;SG 3;IND;PFV;PST;SG;V _
romanov monarşisinin idealize edilmiş vizyonu , onun ülkesinin gerçek durumunu görmesini engelledi .	romanov monarşi idealize et vizyon , o ülke gerçek durum gör engelle .	PROPN;SG GEN;N;PSS3S;SG ADJ;SG 3;ADJ;IND;NFH;PASS;PFV;PST;SG N;NOM;PSS3S;SG _ GEN;POS;PRO;SG GEN;N;PSS3S;SG N;SG ACC;N;PSS3S;SG ACC;IND;N;PFV;PRS;PSS3S;V.MSDR 3;IND;PFV;PST;SG;V _
yeni bütçe clinton'un kabarık banka hesabından sağlanıyor .	yeni bütçe clinton kabarık banka hesab sağla .	ADJ;SG N;NOM;SG GEN;PROPN;SG ADJ;SG N;SG AT+ABL;N;PSS3S;SG 3;IND;PASS;PROG;PRS;SG;V _
kral kaçarken özel önlemler almadı ve kaldığı yerlerde defalarca tanındı .	kral kaç özel önlem al ve kal yer defalarca tanı .	N;NOM;SG ADV;POS ADJ;SG N;PL 3;IND;NEG;PFV;PST;SG;V CONJ ADJ;POS;PSS3S;SG ESS;N;PL ADV 3;IND;PASS;PFV;PST;SG;V _
bu çizim roma hukukunun , roma cumhuriyeti kurumlarının ve mos maiorum'un kurucu kanunu olmuştur .	bu çiz roma hukuk , roma cumhuriyet kurum ve mos maiorum' kurucu kanun ol .	DEF;DET;POS;SG N;NOM;SG PROPN;SG GEN;N;PSS3S;SG _ PROPN;SG N;PSS3S;SG GEN;N;PL;PSS3S CONJ _ GEN;PROPN;SG ADJ;SG N;PSS3S;SG 3;NFH;PFV;PST;SG;V _
programa göre , 23 : 45'te konuşma yapacak .	program göre , 23 : 45 konuş yap .	DAT;N;SG ADP _ NUM;SG _ ESS;N;SG IND;N;PFV;PRS;V.MSDR 3;FUT;IND;PFV;SG;V _
bazı hıristiyan alimler tolle'un öğretilerini eleştirirken , bazıları överler .	bazı hıristiyan alim tolle öğreti eleştiri , bazı över .	DET;INDF;POS;SG PROPN;SG N;NOM;PL GEN;PROPN;SG ACC;N;PL;PSS3S ADV;POS _ NOM;POS;PRO;SG 3;HAB;PL;PRS;V _
akp'nin i̇slami muhafazakarları bu reddi ( 17 aralık ) soruşturmaların gerekçesi olarak gördü .	akp i̇slami muhafazakar bu reddi ( 17 aralık ) soruşturma gerekçe olarak gör .	GEN;PROPN;SG ADJ;SG N;NOM;PL DEF;DET;POS;SG ACC;N;SG _ NUM;SG N;SG _ GEN;N;PL;POS N;PSS3S;SG POS;V 3;IND;PFV;PST;SG;V _
ontario bağımsız polis değerlendirme direktörü gerry mcneilly , polis memurlarının yerli halklarla etkileşimi konusunda " endişe verici sorular " ortaya atılmasının ardından bu hafta yaptığı incelemenin şartlarını belirledi .	ontario bağımsız polis değerlendir direktör gerry mcneilly , polis memur yerli halk etkileşim konu " endişe _ soru " orta atılmas ardından bu hafta yap incele şart belirle .	PROPN;SG ADJ;SG N;SG IND;N;NOM;PFV;PRS;V.MSDR N;PSS3S;SG PROPN;SG PROPN;SG _ N;SG GEN;N;PL;PSS3S ADJ;SG INS;N;PL N;PSS3S;SG ESS;N;PSS3S;SG _ N;SG ADJ;SG N;NOM;PL _ DAT;N;SG GEN;IND;N;PASS;PFV;PRS;PSS3S;V.MSDR ADP DEF;DET;POS;SG N;SG ADJ;POS;PSS3S;SG GEN;N;POS;SG ACC;N;PL;PSS3S 3;IND;PFV;PST;SG;V _
bu durum capitol hill hakkında ki sosyal medya hareketlerini takip edenler için biraz daha farklı olacak .	bu durum capitol hill hak ki sosyal medya hareket takip _ için biraz daha farklı ol .	DEF;DET;POS;SG HAB;N;NOM;SG PROPN;SG PROPN;SG ESS;N;PSS3S;SG ADP ADJ;SG N;SG ACC;N;PL;PSS3S N;SG N;PL;POS ADP ADV ADV ADJ;SG 3;FUT;IND;PFV;SG;V _
herod antipas ve herodias'ın tam evlilik yılı akademisyenler arasında tartışmalı dır .	herod antipas ve herodias tam evlilik yıl akademisyen ara _ _ .	PROPN;SG PROPN;SG CONJ GEN;PROPN;SG ADJ;SG N;SG N;NOM;PSS3S;SG N;PL ESS;N;PSS3S;SG ADJ;SG 3;PFV;PRS;SG;V _
tartışmaların patlamadığı yerlerde ve yeni fikirlerin eski fikirlerle kesişimlerinde seçimin etrafında ki etkilerini hissedebiliyordu .	tartışma patla yer ve yeni fikir eski fikir kesişimler seçim etraf ki etki hissedebil .	GEN;N;PL;POS ADJ;NEG;PSS3S;SG ESS;N;PL CONJ ADJ;SG GEN;N;PL ADJ;SG INS;N;PL ESS;N;PL;PSS3S GEN;N;SG ESS;N;PSS3S;SG ADP ACC;N;PL;PSS3S 3;PROG;PST;SG;V _
tanıdığım birçok insan gibi ben de son ayları sabahlara kadar dehşet içerisinde anketleri okuyarak geçirdim .	tanı birçok insan gibi ben de son ayı sabah kadar dehşet içeri anket oku geç .	ADJ;POS;PSS1S;SG DET;INDF;POS;SG N;SG ADP 1;POS;PRO;SG ADV ADJ;SG N;PL;PSS3S DAT;N;PL ADP N;SG ESS;N;PSS3S;SG N;PL;PSS3S ADV;POS 1;CAUS;IND;PFV;PST;SG;V _
bu kitap , kimya endüstrisinin ve lobicilerin yanı sıra amerikan halkının geniş bir kesiminin dikkatine sunuldu .	bu kitap , kimya endüstri ve _ yan sıra amerikan halkı geniş bir kesim dikkat sun .	DEF;DET;POS;SG N;NOM;SG _ N;SG GEN;N;PSS3S;SG CONJ GEN;N;PL N;PSS3S;SG ADP PROPN;SG GEN;N;PSS3S;SG ADJ;SG DET;INDF;POS;SG GEN;N;PSS3S;SG DAT;N;PSS3S;SG 3;IND;PASS;PFV;PST;SG;V _
cumhuriyetçiler senato'yu 1952'den beri ilk kez ele geçirdi ve 34 sandalye aldı ancak demokratlar çoğunluğu ellerinde tuttu .	cumhuriyetçiler senato'yu 1952' beri ilk kez el geç ve 34 sandal al ancak demokrat çoğunluk el tut .	N;NOM;PL ACC;N;SG AT+ABL;N;SG ADP ADJ;SG N;SG DAT;N;SG 3;CAUS;IND;PFV;PST;SG;V CONJ NUM;SG N;SG 3;IND;PFV;PST;SG;V CONJ N;NOM;PL ACC;N;PSS3S;SG ESS;N;PL;PSS3P 3;IND;PFV;PST;SG;V _
bu yüzde üç oranı , iki ile üç yıl arasında bir süreyle 15.001 - 19.999 sterlin arası kredi çekmek isteyen nectar kart sahibi müşteriler için de geçerli dir .	bu yüz üç oran , iki ile üç yıl ara bir süre _ _ 19.999 sterl ara kredi çek iste nectar kart sahip müşteri için de geçerli i .	DEF;DET;POS;SG ESS;N;SG NUM;SG N;NOM;PSS3S;SG _ NUM;SG CONJ NUM;SG N;SG ESS;N;PSS3S;SG DET;INDF;POS;SG INS;N;SG NUM;SG _ NUM;SG N;SG N;PSS3S;SG N;SG 3;FUT;IND;N;PFV;SG ADJ;POS;SG PROPN N;SG N;SG N;PL ADP ADV ADJ;SG 3;IND;PFV;PST;SG;V _
paris anlaşması'nı yapmış olmaları harika , ama şu an ki katkıları 1,5 derece hedefinin yakınından bile geçmiyor .	paris anlaşması'n yap ol harika , ama şu _ _ katkı 1,5 derece hedef yakın bile geç .	PROPN;SG ACC;N;PSS3S;SG 3;IND;NFH;PFV;PST;SG;V IND;N;NOM;PFV;PRS;PSS3P;V.MSDR ADJ;SG _ ADV DEF;DET;POS;SG N;SG ADP N;NOM;PL;PSS3P NUM;SG N;SG GEN;N;PSS3S;SG AT+ABL;N;PSS3S;SG ADV 3;IND;NEG;PROG;PRS;SG;V _
lucas cranach the elder'ın sergilediği iki tablo özellikle göz alıcı .	lucas cranach the elder sergile iki tablo özellikle göz _ .	PROPN;SG PROPN;SG PROPN GEN;PROPN;SG ADJ;POS;PSS3S;SG NUM;SG N;NOM;SG ADV N;SG ADJ;POS;SG _
monako'ya karşı sınırlı fransız koruması sağlayan franco - monegasque antlaşması temmuz 1918'de imzalanmıştır .	monako' karşı _ fransız koru sağla franco - monegasque antlaş temmuz 1918 imzalan .	DAT;PROPN;SG ADP ADJ;SG PROPN;SG N;PSS3S;SG ADJ;POS;SG PROPN;SG _ PROPN;SG N;NOM;PSS3S;SG N;SG ESS;N;SG 3;NFH;PASS;PFV;PST;SG;V _
bunu yatırımcıların sırasıyla 2 milyar sterlin ve 1.4 milyar sterlin para yatırdığı aviva yatırımcılar çoklu stratejisi hedef getiri ve gelir fonları izledi .	bu yatırımcı sıra 2 milyar sterl ve 1.4 milyar sterl para yatır aviva yatırımcı _ strateji hedef getir ve gel fonı izle .	ACC;POS;PRO;SG GEN;N;PL INS;N;PSS3S;SG NUM;SG NUM;SG N;SG CONJ NUM;SG NUM;SG N;SG N;SG ADJ;POS;PSS3S;SG PROPN;SG N;PL ADJ;SG N;PSS3S;SG N;SG N;SG CONJ N;SG N;NOM;PL;PSS3S 3;IND;PFV;PST;SG;V _
bu arada hong kong , bir protesto dalgasını destekler gibi görünüyor .	bu ara hong kong , bir protesto dalga destek gibi görün .	DEF;DET;POS;SG ESS;N;SG PROPN;SG NOM;PROPN;SG _ DET;INDF;POS;SG N;SG ACC;N;PSS3S;SG V ADP 3;IND;PROG;PRS;SG;V _
tay kültüründe günün uğurlu renkleri , hafta içinde ki günler için verilir ve bunu hafta için günlere karşılık gelen buda imgelerine yönelik bir bağlantı takip eder .	tay kültür gün uğurlu renk , hafta iç ki gün için ver ve bu hafta için gün karşılık gel buda imge yönelik bir bağlantı tak et .	PROPN;SG ESS;N;PSS3S;SG GEN;N;SG ADJ;SG N;NOM;PL;PSS3S _ N;SG ESS;N;PSS3S;SG ADP N;PL ADP 3;HAB;PASS;PRS;SG;V CONJ ACC;POS;PRO;SG N;SG ADP DAT;N;PL N;SG ADJ;POS;SG PROPN;SG DAT;N;PL;PSS3S ADP DET;INDF;POS;SG N;NOM;SG N;SG 3;HAB;PRS;SG;V _
halihazırda , reco'nun bir emlakçıya verebileceği azami ceza miktarı 25.000 dolar dır .	halihazır , reco bir emlakçı verebil azami ceza miktar 25.000 do i .	ADV _ GEN;PROPN;SG DET;INDF;POS;SG DAT;N;SG ADJ;POS;PSS3S;SG ADJ;SG N;SG N;NOM;PSS3S;SG NUM;SG N;SG 3;PFV;PRS;SG;V _
çing hanedanının 1911'de yıkılmasıyla bogd han yönetiminde ki moğolistan bağımsızlığını ilan etti .	çing hanedan 1911 yıkılma bogd han yönetim ki moğolistan bağımsızlık ilan et .	PROPN;SG GEN;N;PSS3S;SG ESS;N;SG IND;INS;N;PASS;PFV;PRS;PSS3S;SG;V.MSDR PROPN;SG N;SG ESS;N;PSS3S;SG ADP NOM;PROPN;SG ACC;N;PSS3S;SG N;SG 3;IND;PFV;PST;SG;V _
vega , yaşlarından dolayı çoğu insanının tarihinin farkında olmayacağını ileri sürdü .	vega , yaşlar dolayı çok insan tarih fark ol ileri sür .	NOM;PROPN;SG _ AT+ABL;N;PSS3P;SG ADP ACC;DET;SG GEN;N;PSS3S;SG GEN;N;PSS3S;SG ESS;N;PSS3S;SG ACC;NEG;PSS3S;SG;V N;SG 3;IND;PFV;PST;SG;V _
son olarak , insanların ihlal şüphelerini ve kötü amaçlı e-postaları bildirmesini kolaylaştırmamız gerekir .	son olarak , insan ihlal şüphe ve kötü amaçlı _ bildirme kolaylaştır gerek .	ADJ;SG POS;V _ GEN;N;PL N;SG ACC;N;PL;PSS3S CONJ ADJ;SG ADJ;SG ACC;N;PL;PSS3S ACC;IND;N;PFV;PRS;PSS3S;V.MSDR CAUS;IND;N;NOM;PFV;PRS;PSS1P;SG;V.MSDR 3;HAB;PRS;SG;V _
i̇mparatorluk ailesinde ise göbek adının kullanılması son derece uygunsuz kabul edilir .	imparatorluk aile ise göbek ad kullan son derece uygunsuz kabul ed .	N;SG ESS;N;PSS3S;SG 3;COND;POS;SG;V N;SG GEN;N;PSS3S;SG IND;N;NOM;PASS;PFV;PRS;PSS3S;V.MSDR ADJ;SG N;SG ADJ;SG N;SG 3;HAB;PASS;PRS;SG;V _
aynı zamanda , 1970'lerin ortalarında starlin , bağımsız olarak yayınlanmış bilim kurgu antolojisi star reach'a hikayelerin önbelleğine katkıda bulundu .	aynı zaman , 1970' orta starl , bağımsız olarak yayınla bilim kurgu antoloji star reach hikaye önbellek katkı bulun .	ADJ;SG ESS;N;SG _ GEN;N;PL ESS;N;PL;PSS3S NOM;PROPN;SG _ ADJ;SG POS;V 3;ADJ;IND;NFH;PASS;PFV;PST;SG N;SG N;SG N;PSS3S;SG N;SG DAT;PROPN;SG GEN;N;PL DAT;N;PSS3S;SG ESS;N;SG 3;IND;PFV;PST;SG;V _
obermarsberg'de ki tarihi belediye binası 13. yüzyıldan kalma dır ve otuz yıl savaşı'nın ardından yenilenmiştir .	obermarsberg ki tarih belediye bina 13 yüzyıl kal i ve otuz yıl savaşı ardından yenilen .	ESS;PROPN;SG ADP ADJ;PSS3S;SG N;SG N;NOM;PSS3S;SG NUM;SG AT+ABL;N;SG IND;N;PFV;PRS;V.MSDR 3;PFV;PRS;SG;V CONJ NUM;SG N;SG GEN;N;PSS3S;SG ADP 3;NFH;PASS;PFV;PST;SG;V _
ayrıca fince'den türetilip ayrı gelişim gösteren ve i̇sveç'te meänkieli , norveç'te ise kven olarak bilinen diller de var dır .	ayrıca fince türetilip ayrı geliş göster ve i̇sveç meänkieli , norveç ise kven olarak bil dil de var i .	ADV AT+ABL;PROPN;SG ADV;POS ADJ;SG N;SG ADJ;POS;SG CONJ ESS;PROPN;SG PROPN;SG _ ESS;PROPN;SG 3;COND;POS;SG;V PROPN;SG POS;V ADJ;POS;SG N;NOM;PL ADV ADJ;POS 3;PFV;PRS;SG;V _
ayrıca vw'yi büyük tazminat iddialarına ve yasal işlemlere açık hale getirdi ve bunun 16 milyar avrodan fazla fona mal olacağı görüldü .	ayrıca vw büyük tazminat iddia ve yasal işlem açık hal getir ve bu 16 milyar avro fazla fon mal ol gör .	ADV ACC;PROPN;SG ADJ;SG N;SG DAT;N;PL;PSS3S CONJ ADJ;SG DAT;N;PL ADJ;SG DAT;N;SG 3;IND;PFV;PST;SG;V CONJ GEN;POS;PRO;SG NUM;SG NUM;SG AT+ABL;N;SG ADJ;SG DAT;N;SG N;SG N;NOM;POS;PSS3S;SG 3;IND;PASS;PFV;PST;SG;V _
ancak bir seyahat uzmanı uçak içi internetin genellikle güvenilmez olduğu ve yolcuların hava yolu tercihlerini muhtemelen etkilemeyeceği konusunda uyarıda bulundu .	ancak bir seyahad uzman uçak iç internet genellikle güven ol ve yolcu hava yol tercihler muhtemel etkilemey konu uyarı bulun .	ADV DET;INDF;POS;SG N;SG N;NOM;PSS3S;SG N;SG N;PSS3S;SG GEN;N;SG ADV 3;ADJ;HAB;NEG;PASS;PRS;SG POS;PSS3S;SG;V CONJ GEN;N;PL N;SG N;PSS3S;SG ACC;N;PL;PSS3P ADV N;NEG;PSS3S;SG ESS;N;PSS3S;SG ESS;N;SG 3;IND;PFV;PST;SG;V _
apulia ismi , onüçüncü yüzyılda bazı yazarlar tarafından i̇talyan yarımadasının güneyini simgelemek için kullanılmıştı .	apulia isim , onüçüncü yüzyıl bazı yazar taraf i̇talyan yarımadas güney simgele için kullan .	PROPN;SG N;NOM;PSS3S;SG _ NUM;SG ESS;N;SG DET;INDF;POS;SG N;PL AT+ABL;N;PSS3S;SG PROPN;SG GEN;N;PSS3S;SG ACC;N;PSS3S;SG 3;FUT;IND;N;PFV;SG ADP 3;IND;NFH;PASS;PFV;PST+PRF;SG;V _
seyircinin karşısında tek başına dikiliyor ve nihayetinde seyirciyi güldürmek için elinden gelenin en iyisini yapmak zorunda kalıyor .	seyirc karşı tek baş dik ve nihayet seyirci gül için el gele en iyi yap zorun kal .	GEN;N;SG ESS;N;PSS3S;SG ADJ;SG DAT;N;PSS3S;SG 3;IND;PROG;PRS;SG;V CONJ ESS;N;PSS3S;SG ACC;N;SG 3;FUT;IND;N;PFV;SG ADP AT+ABL;N;PSS3S;SG GEN;N;SG ADV ACC;N;PSS3S;SG 3;FUT;IND;N;PFV;SG ESS;N;PSS3S;SG 3;IND;PROG;PRS;SG;V _
die zeit adlı gazete öncelikle emlak şirketiyle şüpheli nakit akışlarını ve temmuz ayında ki iflas tehdidini araştırdı .	die zeit _ gazete öncelik emlak şirket _ nakit akış ve temmuz ay ki iflas tehdit araştır .	PROPN;SG PROPN ADJ;SG N;NOM;SG INS;N;SG N;SG INS;N;PSS3S;SG ADJ;SG N;SG ACC;N;PL;POS;PSS3P CONJ N;SG ESS;N;PSS3S;SG ADP N;SG ACC;N;PSS3S;SG 3;IND;PFV;PST;SG;V _
bay osborne , temmuz ayında görevden alınmasının ardından abd'li bir konuşmacı ajansı ile anlaşma imzaladı .	bay osborne , temmuz ay görev alınmas ardından _ bir konuşmaç ajans ile anlaşma imzala .	N;SG NOM;PROPN;SG _ N;SG ESS;N;PSS3S;SG AT+ABL;N;SG GEN;IND;N;PASS;PFV;PRS;PSS3S;V.MSDR ADP ADJ;SG DET;INDF;POS;SG N;SG N;PSS3S;SG ADP N;SG 3;IND;PFV;PST;SG;V _
gemide 330'dan fazla mürettebat var .	gemide 330 fazla mürettebat var .	ESS;N;SG AT+ABL;N;SG ADJ;SG N;NOM;SG ADJ;POS _
dünya - ve bunun bir uzantısı olarak birleşik krallık - etkili bir savunmanın oluşturulması için gereken becerilere sahip insan eksikliği ile karşı karşıya .	dünya - ve bu bir uzantı olarak birleşik krallık - etkili bir savunma oluş için gerek beceri sahip insan eksiklik ile karşı karşı .	N;SG _ CONJ GEN;POS;PRO;SG DET;INDF;POS;SG N;PSS3S;SG POS;V ADJ;SG N;NOM;SG _ ADJ;SG DET;INDF;POS;SG GEN;N;POS;SG IND;N;NOM;PASS;PFV;PRS;PSS3S;V.MSDR ADP ADJ;POS;SG DAT;N;PL ADJ;SG N;SG N;SG ADP N DAT;N;SG _
bu açıdan bakıldığında , abd'de ki sağlık sisteminin , eğitimin ve dış ticaretin böylesine kötü bir halde olmasının nedeni , eski yapılar ve kendinden emin bir elit tir .	bu açı bak , abd' ki sağlık sistem , eğitim ve dış ticaret böylesine kötü bir hal ol neden , eski yapı ve kendi emin bir elit i .	DEF;DET;POS;SG AT+ABL;N;SG ESS;N;POS;PSS3S;SG _ ESS;PROPN;SG ADP N;SG GEN;N;PSS3S;SG _ GEN;N;SG CONJ N;SG GEN;N;SG ADV ADJ;SG DET;INDF;POS;SG ESS;N;SG GEN;IND;PFV;PRS;PSS3S;V;V.MSDR N;NOM;PSS3S;SG _ ADJ;SG N;PL CONJ AT+ABL;PRO;REFL;SG ADJ;SG DET;INDF;POS;SG N;SG 3;PFV;PRS;SG;V _
i̇nsanlar , habitat yok edildiğinde doğal yaşam alanlarının doğrudan kullanımını da kaybederler .	insan , habitat yok et doğal yaşam alan doğrudan kullanım da kaybede .	N;NOM;PL _ N;NOM;SG ADJ;NEG ESS;POS;PSS3S;SG;V ADJ;SG SG;V GEN;N;PL;PSS3S ADJ;SG ACC;N;PSS3S;SG ADV 3;HAB;PL;PRS;V _
erkeklerin ortaöğretime kaydolması , kişi başına gelir ve ekonomik büyüme oranında ki artışlar iç savaş olasılığını azaltmada önemli etkiye sahip tir .	erkek ortaöğret kaydol , kişi baş gel ve ekonomik büyü oran ki artış iç savaş olasılık azalt _ etki sahip i .	GEN;N;PL DAT;N;SG IND;N;NOM;PFV;PRS;PSS3S;V.MSDR _ N;SG DAT;N;PSS3S;SG N;SG CONJ ADJ;SG IND;N;NOM;PFV;PRS;V.MSDR ESS;N;PSS3S;SG ADP N;NOM;PL;POS N;SG N;SG ACC;N;SG ESS;N;POS;SG ADJ;SG DAT;N;SG ADJ;SG V _
i̇mparator meiji'den önce , dönemin isimleri daha sık değiştirildi ve imparatorların ölümünden sonra ki isimler farklı bir şekilde seçilirdi .	i̇mparator meiji önce , dönem isim daha sık değiştiril ve imparator ölüm sonra ki isim farklı bir şekil seçilir .	N;SG AT+ABL;PROPN;SG ADP _ GEN;N;SG N;NOM;PL ADV ADV 3;IND;PFV;PST;SG;V CONJ GEN;N;PL AT+ABL;N;PSS3S;SG N ADP N;NOM;PL ADJ;SG DET;INDF;POS;SG ESS;N;SG 3;HAB;PASS;PST;SG;V _
bölgede ki tüm dönüşümler başarılı olmamıştır .	bölge ki tüm dönüşüm başarılı olmamış .	ESS;N;SG ADP DEF;DET;POS;SG N;NOM;PL ADJ;SG 3;NEG;NFH;PFV;PST;SG;V _
disney ayrıca universal'in oswald'a ait fikri mülkiyet haklarına sahip olduğunu öğrendi .	disney ayrıca universal oswald ait fikir mülkiyet hak sahip ol öğren .	NOM;PROPN;SG ADV GEN;PROPN;SG DAT;PROPN;SG ADP N;PSS3S;SG N;SG DAT;N;PL;PSS3S ADJ;SG ACC;POS;PSS3S;SG;V 3;IND;PFV;PST;SG;V _
facebook'ta ki yas tutan yorumlardan birinde chris'in çok hoşuna gidecek bir satır var dı : " senden daha afrikalısını tanımadım . "	facebook ki yas tut yorum bir chris çok hoşuna git bir satır _ _ : " senden daha afrikalı tanı _ _	ESS;N;SG ADP N;SG ADJ;POS;SG AT+ABL;N;PL ESS;POS;PRO;SG GEN;PROPN;SG ADV DAT;N;SG 3;FUT;IND;PFV;SG;V DET;INDF;POS;SG N;NOM;SG ADJ;POS 3;IND;PFV;PST;SG;V _ _ 2;AT+ABL;POS;PRO;SG ADV ACC;N;SG 1;IND;NEG;PFV;PST;SG;V _ _
büyük güçler arnavutluk'un tanınmasına ilişkin talepleri yerine getirmedi .	büyük güç arnavutluk tanı ilişkin talep yer getir .	ADJ;SG N;NOM;PL GEN;PROPN;SG DAT;IND;N;PFV;PRS;PSS3S;V.MSDR ADP ACC;N;PL;PSS3S DAT;N;PSS3S;SG 3;IND;NEG;PFV;PST;SG;V _
bu arada , clinton ve müttefikleri , kadınlar ve azınlıklar hakkında ki aşağılayıcı yorumları ve mizacının onun görev için uygun kişi olmadığını kanıtlaması için spot ışığını trump'ın üzerinde tutmaya çalışıyor .	bu ara , clinton ve müttefik , kadın ve azınlık hak ki _ yorum ve mizac o görev için uygun kişi ol kanıtla için spot ışık trump üzer tut çalış .	DEF;DET;POS;SG ESS;N;SG _ PROPN;SG CONJ N;NOM;PL _ N;PL CONJ N;PL ESS;N;PSS3S;SG ADP ADJ;POS;SG N;PL;PSS3S CONJ GEN;N;PSS3S;SG GEN;POS;PRO;SG N;SG ADP ADJ;SG N;SG ACC;NEG;PSS3S;SG;V IND;N;NOM;PFV;PRS;PSS3S;V.MSDR ADP N;SG ACC;N;PSS3S;SG GEN;PROPN;SG ESS;N;PSS3S;SG DAT;IND;N;PFV;PRS;V.MSDR 3;IND;PROG;PRS;SG;V _
