" den färdigställdes ganska sent under kriget ; fastän ett antal b-29:or utrustades med eagle och den fungerade bra kom den för sent för att göra någon stor skillnad . "	" den färdigställa ganska sent under krig ; fastän en antal b-29 utrusta med eagle och den fungera bra komma den för sent för att göra någon stor skillnad . "	_ DEF;MASC+FEM;PRO;SG FIN;IND;PASS;PST;V ADV ADV ADP DEF;N;NEUT;NOM;SG _ CONJ DET;INDF;NEUT;SG INDF;N;NEUT;NOM;SG INDF;MASC+FEM;N;NOM;PL FIN;IND;PASS;PST;V ADP NOM;PROPN CONJ DEF;MASC+FEM;PRO;SG ACT;FIN;IND;PST;V ADV ACT;FIN;IND;PST;V DEF;MASC+FEM;PRO;SG ADV ADV ADP PART ACT;NFIN;V DET;INDF;MASC+FEM;SG ADJ;INDF;MASC+FEM;NOM;SG INDF;MASC+FEM;N;NOM;SG _ _
och vad är det med partierna i vad , i historiska rättigheter ?	och vad vara det med parti i vad , i historisk rättighet ?	CONJ INDF;NEUT;PRO;SG ACT;FIN;IND;PRS;V DEF;NEUT;PRO;SG ADP DEF;N;NEUT;NOM;PL ADP INDF;NEUT;PRO;SG _ ADP ADJ;NOM;PL INDF;MASC+FEM;N;NOM;PL _
under hans administration godkändes den kvinnliga rösträtten , legaliserades politiska partier , tilläts alla som tvingats i exil att återvända och de återstående politiska fångarna frigavs .	under hans administration godkänna den kvinnlig rösträtt , legalisera politisk parti , tillåta alla som tvinga i exil att återvända och den återstående politisk fånge frige .	ADP DEF;PRO INDF;MASC+FEM;N;NOM;SG FIN;IND;PASS;PST;V DEF;DET;MASC+FEM;SG ADJ;DEF;NOM;SG DEF;MASC+FEM;N;NOM;SG _ FIN;IND;PASS;PST;V ADJ;NOM;PL INDF;N;NEUT;NOM;PL _ FIN;IND;PASS;PST;V INDF;PL;PRO PRO PASS;V;V.CVB ADP INDF;MASC+FEM;N;NOM;SG PART ACT;NFIN;V CONJ DEF;DET;PL ADJ;IND;NOM;PRS;V.PTCP ADJ;NOM;PL DEF;MASC+FEM;N;NOM;PL FIN;IND;PASS;PST;V _
den kanadensiske utredaren av flygplanskraschen larry vance berättade för spiegel att han är övertygad att en av piloterna avsåg att landa maskinen på havsytan – så den skulle sjunka .	den kanadensisk utredare av flygplanskrasch larry vance berätta för spiegel att han vara övertygad att en av pilot avse att landa maskin på havsyta – så den skola sjunka .	DEF;DET;MASC+FEM;SG ADJ;DEF;MASC;NOM;SG DEF;MASC+FEM;N;NOM;SG ADP DEF;MASC+FEM;N;NOM;SG NOM;PROPN NOM;PROPN ACT;FIN;IND;PST;V ADP NOM;PROPN CONJ DEF;MASC+FEM;NOM;PRO;SG ACT;FIN;IND;PRS;V ADJ;INDF;MASC+FEM;NOM;PST;SG;V.PTCP CONJ INDF;MASC+FEM;PRO;SG ADP DEF;MASC+FEM;N;NOM;PL ACT;FIN;IND;PST;V PART ACT;NFIN;V DEF;MASC+FEM;N;NOM;SG ADP DEF;MASC+FEM;N;NOM;SG _ CONJ DEF;MASC+FEM;PRO;SG ACT;FIN;IND;PST;V ACT;NFIN;V _
1538 varnade den spanska inkvisitionen sina medlemmar för att tro på allting som malleus sade .	1538 varna den spansk inkvisition sin medlem för att tro på allting som malleus säga .	NOM;NUM ACT;FIN;IND;PST;V DEF;DET;MASC+FEM;SG ADJ;DEF;NOM;SG DEF;MASC+FEM;N;NOM;SG DEF;PL;PRO INDF;MASC+FEM;N;NOM;PL ADP PART ACT;NFIN;V ADP INDF;NEUT;PRO;SG PRO NOM;PROPN ACT;FIN;IND;PST;V _
från regissörens synvinkel är filmen en oviss balansakt mellan gladlynt familjestoj och slagkraftigt samhällsdrama .	från regissör synvinkel vara film en oviss balansakt mellan gladlynt familjestoj och slagkraftig samhällsdrama .	ADP DEF;GEN;MASC+FEM;N;SG INDF;MASC+FEM;N;NOM;SG ACT;FIN;IND;PRS;V DEF;MASC+FEM;N;NOM;SG DET;INDF;MASC+FEM;SG ADJ;INDF;MASC+FEM;NOM;SG INDF;MASC+FEM;N;NOM;SG ADP ADJ;INDF;NEUT;NOM;SG INDF;N;NEUT;NOM;SG CONJ ADJ;INDF;NEUT;NOM;SG INDF;N;NEUT;NOM;SG _
" spanien hade kastat ut sin sefardiska befolkning 1492 ; många av dessa spanska judar lämnade spanien för portugal men blev så småningom till måltavlor där med . "	" spanien ha kasta ut sin sefardiska befolkning 1492 ; många av denna spansk jude lämna spanien för portugal men bli så småningom till måltavla där med . "	_ NOM;PROPN ACT;FIN;IND;PST;V ACT;V;V.CVB ADV DEF;MASC+FEM;PRO;SG ADJ;DEF;NOM;SG INDF;MASC+FEM;N;NOM;SG NOM;NUM _ INDF;PL;PRO ADP DEF;DET;PL ADJ;NOM;PL INDF;MASC+FEM;N;NOM;PL ACT;FIN;IND;PST;V NOM;PROPN ADP NOM;PROPN CONJ ACT;FIN;IND;PST;V ADV ADV ADP INDF;MASC+FEM;N;NOM;PL ADV ADP _ _
den diskuterar särskilt i flera passager de socialt och kulturellt degenerativa effekter krig har på själva mänskligheten .	den diskutera särskilt i flera passage de socialt och kulturellt degenerativ effekt krig ha på själv mänsklighet .	DEF;MASC+FEM;PRO;SG ACT;FIN;IND;PRS;V ADV ADP ADJ;INDF;NOM;PL INDF;MASC+FEM;N;NOM;PL DEF;NOM;PL;PRO ADV CONJ ADV ADJ;NOM;PL INDF;MASC+FEM;N;NOM;PL INDF;N;NEUT;NOM;SG ACT;FIN;IND;PRS;V ADP ADJ;DEF;NOM;SG DEF;MASC+FEM;N;NOM;SG _
rebeller från alliansen av demokratiska krafter för befrielsen av kongo intog lubumbashi i april 1997 .	rebell från allians av demokratisk kraft för befrielse av kongo inta lubumbashi i april 1997 .	INDF;MASC+FEM;N;NOM;PL ADP DEF;MASC+FEM;N;NOM;SG ADP ADJ;NOM;PL INDF;MASC+FEM;N;NOM;PL ADP DEF;MASC+FEM;N;NOM;SG ADP NOM;PROPN ACT;FIN;IND;PST;V NOM;PROPN ADP INDF;MASC+FEM;N;NOM;SG NOM;NUM _
vega föreslog att många , på grund av sin ålder , skulle vara omedvetna om dess historia .	vega föreslå att många , på grund av sin ålder , skola vara omedveten om dess historia .	NOM;PROPN ACT;FIN;IND;PST;V PART INDF;PL;PRO _ ADP INDF;MASC+FEM;N;NOM;SG ADP DEF;PRO INDF;MASC+FEM;N;NOM;SG _ ACT;FIN;IND;PST;V ACT;NFIN;V ADJ;NOM;PL ADP DEF;PRO INDF;MASC+FEM;N;NOM;SG _
bytet av barrosos orsakade en stor uppståndelse .	byte av barroso orsaka en stor uppståndelse .	DEF;N;NEUT;NOM;SG ADP GEN;PROPN ACT;FIN;IND;PST;V DET;INDF;MASC+FEM;SG ADJ;INDF;MASC+FEM;NOM;SG INDF;MASC+FEM;N;NOM;SG _
trumps fru , melania trump , gjorde sitt första framträdande på turnén sedan det republikanska partikonventet i juli .	trump fru , melania trump , göra sin första framträdande på turné sedan den republikansk partikonvent i juli .	GEN;PROPN INDF;MASC+FEM;N;NOM;SG _ NOM;PROPN NOM;PROPN _ ACT;FIN;IND;PST;V DEF;NEUT;PRO;SG ADJ;NOM INDF;N;NEUT;NOM;SG ADP DEF;MASC+FEM;N;NOM;SG ADP DEF;DET;NEUT;SG ADJ;DEF;NOM;SG DEF;N;NEUT;NOM;SG ADP INDF;MASC+FEM;N;NOM;SG _
ön hong kong överläts åt storbritannien och vissa hamnar , inklusive shanghai och guangzhou , öppnades för brittisk handel och residens .	ö hong kong överlåta åt storbritannien och viss hamn , inklusive shanghai och guangzhou , öppna för brittisk handel och residens .	DEF;MASC+FEM;N;NOM;SG NOM;PROPN NOM;PROPN FIN;IND;PASS;PST;V ADP NOM;PROPN CONJ ADJ;NOM;PL INDF;MASC+FEM;N;NOM;PL _ ADP NOM;PROPN CONJ NOM;PROPN _ FIN;IND;PASS;PST;V ADP ADJ;INDF;MASC+FEM;NOM;SG INDF;MASC+FEM;N;NOM;SG CONJ INDF;N;NEUT;NOM;SG _
och de måste hälsas med ett öppet sinnelag och klart tankesätt för de utgör den nya generationen av skönhet och hopp .	och de måste hälsa med en öppen sinnelag och klar tankesätt för de utgöra den ny generation av skönhet och hopp .	CONJ DEF;NOM;PL;PRO ACT;FIN;IND;PRS;V NFIN;PASS;V ADP DET;INDF;NEUT;SG ADJ;INDF;NEUT;NOM;SG INDF;N;NEUT;NOM;SG CONJ ADJ;INDF;NEUT;NOM;SG INDF;N;NEUT;NOM;SG CONJ DEF;NOM;PL;PRO ACT;FIN;IND;PRS;V DEF;DET;MASC+FEM;SG ADJ;DEF;NOM;SG DEF;MASC+FEM;N;NOM;SG ADP INDF;MASC+FEM;N;NOM;SG CONJ INDF;N;NEUT;NOM;SG _
ett sacrococcygealt teratom är en tumör som utvecklas före födseln och växer från ett spädbarns svanskota .	en sacrococcygealt teratom vara en tumör som utveckla före födsel och växa från en spädbarn svanskota .	DET;INDF;NEUT;SG ADJ;INDF;NEUT;NOM;SG INDF;N;NEUT;NOM;SG ACT;FIN;IND;PRS;V DET;INDF;MASC+FEM;SG INDF;MASC+FEM;N;NOM;SG PRO FIN;IND;PASS;PRS;V ADP DEF;MASC+FEM;N;NOM;SG CONJ ACT;FIN;IND;PRS;V ADP DET;INDF;NEUT;SG GEN;INDF;N;NEUT;SG INDF;MASC+FEM;N;NOM;SG _
ford t utropades till den mest inflytelserika bilen under 1900-talet vid de internationella car of the century-utmärkelserna .	ford t utropa till den mycket inflytelserik bil under 1900-tal vid den internationell car of the century-utmärkelserna .	NOM;PROPN INDF;N;NEUT;NOM;SG FIN;IND;PASS;PST;V ADP DEF;DET;MASC+FEM;SG ADV;RL ADJ;DEF;NOM;SG DEF;MASC+FEM;N;NOM;SG ADP DEF;N;NEUT;NOM;SG ADP DEF;DET;PL ADJ;NOM;PL NOM;PROPN NOM;PROPN NOM;PROPN NOM;PROPN _
men utan ett rättsligt ramverk , och med marijuanans gräsrotsursprung som humör-ändrande folkmedicin står företagen och gissar .	men utan en rättslig ramverk , och med marijuana gräsrotsursprung som humör-ändrande folkmedicin stå företag och gissa .	CONJ ADP DET;INDF;NEUT;SG ADJ;INDF;NEUT;NOM;SG INDF;N;NEUT;NOM;SG _ CONJ ADP DEF;GEN;MASC+FEM;N;SG INDF;MASC+FEM;N;NOM;SG CONJ ADJ;IND;NOM;PRS;V.PTCP INDF;MASC+FEM;N;NOM;SG ACT;FIN;IND;PRS;V DEF;N;NEUT;NOM;PL CONJ ACT;FIN;IND;PRS;V _
emellertid finns det viktiga skillnader i lag och rättsprocesser mellan nordirland och england och wales .	emellertid finnas det viktig skillnad i lag och rättsprocess mellan nordirland och england och wales .	ADV FIN;IND;PASS;PRS;V DEF;NEUT;PRO;SG ADJ;NOM;PL INDF;MASC+FEM;N;NOM;PL ADP INDF;MASC+FEM;N;NOM;SG CONJ INDF;MASC+FEM;N;NOM;PL ADP NOM;PROPN CONJ NOM;PROPN CONJ NOM;PROPN _
varje dikt återberättar bara en del av kriget .	varje dikt återberätta bara en del av krig .	DET;INDF;SG INDF;MASC+FEM;N;NOM;SG ACT;FIN;IND;PRS;V ADV DET;INDF;MASC+FEM;SG INDF;MASC+FEM;N;NOM;SG ADP DEF;N;NEUT;NOM;SG _
han tror att ingen som väntar på oss väntar på oss .	han tro att ingen som vänta på vi vänta på vi .	DEF;MASC+FEM;NOM;PRO;SG ACT;FIN;IND;PRS;V CONJ INDF;MASC+FEM;PRO;SG PRO ACT;FIN;IND;PRS;V ADP ACC;DEF;MASC+FEM;PL;PRO ACT;FIN;IND;PRS;V ADP ACC;DEF;MASC+FEM;PL;PRO _
så småningom , ungefär 512–511 f.kr. , accepterade den makedoniske kungen amyntas i den akemenidiska överhögheten och överlämnade sitt land som en vassalstat till det akamenidiska persien .	så småningom , ungefär 512–511 f.kr. , acceptera den makedonisk kung amyntas i den akemenidiska överhöghet och överlämna sin land som en vassalstat till den akamenidiska persien .	ADV ADV _ ADV NOM;NUM N _ ACT;FIN;IND;PST;V DEF;DET;MASC+FEM;SG ADJ;DEF;MASC;NOM;SG DEF;MASC+FEM;N;NOM;SG NOM;PROPN ADP DEF;DET;MASC+FEM;SG ADJ;DEF;NOM;SG DEF;MASC+FEM;N;NOM;SG CONJ ACT;FIN;IND;PST;V DEF;NEUT;PRO;SG INDF;N;NEUT;NOM;SG CONJ DET;INDF;MASC+FEM;SG INDF;MASC+FEM;N;NOM;SG ADP DEF;DET;NEUT;SG ADJ;DEF;NOM;SG NOM;PROPN _
fler än 330 besättningsmän är ombord på skeppet .	fler än 330 besättningsman vara ombord på skepp .	ADJ;INDF;NOM;PL CONJ NOM;NUM INDF;MASC+FEM;N;NOM;PL ACT;FIN;IND;PRS;V ADV ADP DEF;N;NEUT;NOM;SG _
1832 såldes det före detta klostret till fabrikören georg reichenbach av staten württemberg under villkoret att etablera en bomullsfabrik där .	1832 sälja den före denna kloster till fabrikör georg reichenbach av stat württemberg under villkor att etablera en bomullsfabrik där .	NOM;NUM FIN;IND;PASS;PST;V DEF;DET;NEUT;SG ADP DEF;DET;NEUT;SG DEF;N;NEUT;NOM;SG ADP DEF;MASC+FEM;N;NOM;SG NOM;PROPN NOM;PROPN ADP DEF;MASC+FEM;N;NOM;SG NOM;PROPN ADP DEF;N;NEUT;NOM;SG PART ACT;NFIN;V DET;INDF;MASC+FEM;SG INDF;MASC+FEM;N;NOM;SG ADV _
format av globala plattektoniska krafter som skapat den östafrikanska riften , är östra afrika platsen för kilimanjaro och mount kenya , de två högsta bergtopparna i afrika .	formad av global plattektonisk kraft som skapa den östafrikansk riften , vara öster afrika plats för kilimanjaro och mount kenya , den två hög bergtopp i afrika .	ADJ;INDF;NEUT;NOM;PST;SG;V.PTCP ADP ADJ;NOM;PL ADJ;NOM;PL INDF;MASC+FEM;N;NOM;PL PRO ACT;V;V.CVB DEF;DET;MASC+FEM;SG ADJ;DEF;NOM;SG DEF;MASC+FEM;N;NOM;SG _ ACT;FIN;IND;PRS;V ADJ;DEF;NOM;SG NOM;PROPN DEF;MASC+FEM;N;NOM;SG ADP NOM;PROPN CONJ NOM;PROPN NOM;PROPN _ DEF;DET;PL NOM;NUM ADJ;DEF;NOM;RL DEF;MASC+FEM;N;NOM;PL ADP NOM;PROPN _
åskstormar är sällsynta , då staden rapporterar åska bara sju dagar per år .	åskstorm vara sällsynt , då stad rapportera åska bara sju dag per år .	INDF;MASC+FEM;N;NOM;PL ACT;FIN;IND;PRS;V ADJ;NOM;PL _ CONJ DEF;MASC+FEM;N;NOM;SG ACT;FIN;IND;PRS;V INDF;MASC+FEM;N;NOM;SG ADV NOM;NUM INDF;MASC+FEM;N;NOM;PL ADP INDF;N;NEUT;NOM;SG _
låg inkomst per capita har föreslagits som en anledning till missnöje , som leder till beväpnat uppror .	låg inkomst per capita ha föreslå som en anledning till missnöje , som leda till beväpnad uppror .	ADJ;INDF;MASC+FEM;NOM;SG INDF;MASC+FEM;N;NOM;SG ADP INDF;MASC+FEM;N;NOM;SG ACT;FIN;IND;PRS;V PASS;V;V.CVB CONJ DET;INDF;MASC+FEM;SG INDF;MASC+FEM;N;NOM;SG ADP INDF;N;NEUT;NOM;SG _ PRO ACT;FIN;IND;PRS;V ADP ADJ;INDF;NEUT;NOM;PST;SG;V.PTCP INDF;N;NEUT;NOM;SG _
kungen vidtog inga särskilda försiktighetsåtgärder under sin flykt och blev igenkänd flera gånger vid sina anhalter .	kung vidta ingen särskild försiktighetsåtgärd under sin flykt och bli igenkänd flera gång vid sin anhalt .	DEF;MASC+FEM;N;NOM;SG ACT;FIN;IND;PST;V DET;INDF;PL ADJ;NOM;PL;PST;V.PTCP INDF;MASC+FEM;N;NOM;PL ADP DEF;MASC+FEM;PRO;SG INDF;MASC+FEM;N;NOM;SG CONJ ACT;FIN;IND;PST;V ADJ;INDF;MASC+FEM;NOM;PST;SG;V.PTCP ADJ;INDF;NOM;PL INDF;MASC+FEM;N;NOM;PL ADP DEF;PL;PRO INDF;MASC+FEM;N;NOM;PL _
elliot var på faderns begravning på dagen för loppet .	elliot vara på fader begravning på dag för lopp .	NOM;PROPN ACT;FIN;IND;PST;V ADP DEF;GEN;MASC+FEM;N;SG INDF;MASC+FEM;N;NOM;SG ADP DEF;MASC+FEM;N;NOM;SG ADP DEF;N;NEUT;NOM;SG _
ramses , som inte hade logistiska möjligheter att upprätthålla en lång belägring , återvände till egypten .	ramses , som inte ha logistiska möjlighet att upprätthålla en lång belägring , återvända till egypten .	NOM;PROPN _ PRO NEG;PART ACT;FIN;IND;PST;V ADJ;NOM;PL INDF;MASC+FEM;N;NOM;PL PART ACT;NFIN;V DET;INDF;MASC+FEM;SG ADJ;INDF;MASC+FEM;NOM;SG INDF;MASC+FEM;N;NOM;SG _ ACT;FIN;IND;PST;V ADP NOM;PROPN _
under sin tid där mötte kipling även , och blev förälskad i , florence garrard som steg ombord med trix vid southsea ( dit trix hade återvänt ) .	under sin tid där möta kipling även , och bli förälskad i , florence garrard som stiga ombord med trix vid southsea ( dit trix ha återvända ) .	ADP DEF;MASC+FEM;PRO;SG INDF;MASC+FEM;N;NOM;SG ADV ACT;FIN;IND;PST;V NOM;PROPN ADV _ CONJ ACT;FIN;IND;PST;V ADJ;INDF;MASC+FEM;NOM;PST;SG;V.PTCP ADP _ NOM;PROPN NOM;PROPN PRO ACT;FIN;IND;PST;V ADV ADP NOM;PROPN ADP NOM;PROPN _ ADV NOM;PROPN ACT;FIN;IND;PST;V ACT;V;V.CVB _ _
eftersom serie 1 inte längre är den gamla , kan många användare spara 100 euro .	eftersom serie 1 inte länge vara den gammal , kunna mången användare spara 100 euro .	CONJ INDF;MASC+FEM;N;NOM;SG NOM;NUM NEG;PART ADV;CMPR ACT;FIN;IND;PRS;V DEF;DET;MASC+FEM;SG ADJ;DEF;NOM;SG _ ACT;FIN;IND;PRS;V ADJ;NOM;PL INDF;MASC+FEM;N;NOM;PL ACT;NFIN;V NOM;NUM INDF;MASC+FEM;N;NOM;SG _
men de kan åtminstone gillra fällor för att förvirra och avskräcka – ett koncept känt som ” aktivt försvar ” .	men de kunna åtminstone gillra fälla för att förvirra och avskräcka – en koncept känd som ” aktiv försvar ” .	CONJ DEF;NOM;PL;PRO ACT;FIN;IND;PRS;V ADV ACT;NFIN;V INDF;MASC+FEM;N;NOM;PL ADP PART ACT;NFIN;V CONJ ACT;NFIN;V _ DET;INDF;NEUT;SG INDF;N;NEUT;NOM;SG ADJ;INDF;NEUT;NOM;PST;SG;V.PTCP ADP _ ADJ;INDF;NEUT;NOM;SG INDF;N;NEUT;NOM;SG _ _
på en nivå fungerar den som en vänlig opretentiös hjärtevärmare som verkar skräddarsydd för att ses en söndag eftermiddag .	på en nivå fungera den som en vänlig opretentiös hjärtevärmare som verka skräddarsydd för att se en söndag eftermiddag .	ADP DET;INDF;MASC+FEM;SG INDF;MASC+FEM;N;NOM;SG ACT;FIN;IND;PRS;V DEF;MASC+FEM;PRO;SG ADP DET;INDF;MASC+FEM;SG ADJ;INDF;MASC+FEM;NOM;SG ADJ;INDF;MASC+FEM;NOM;SG INDF;MASC+FEM;N;NOM;SG PRO ACT;FIN;IND;PRS;V ADJ;INDF;MASC+FEM;NOM;PST;SG;V.PTCP ADP PART NFIN;PASS;V DET;INDF;MASC+FEM;SG INDF;MASC+FEM;N;NOM;SG INDF;MASC+FEM;N;NOM;SG _
med en varning om att nhs nu var under ” enormt tryck ” bad han allmänheten att ta mer ansvar för sin egen hälsa .	med en varning om att nhs nu vara under ” enorm tryck ” be han allmänhet att ta mycken ansvar för sin egen hälsa .	ADP DET;INDF;MASC+FEM;SG INDF;MASC+FEM;N;NOM;SG ADP CONJ NOM;PROPN ADV ACT;FIN;IND;PST;V ADP _ ADJ;INDF;NEUT;NOM;SG INDF;N;NEUT;NOM;SG _ ACT;FIN;IND;PST;V DEF;MASC+FEM;NOM;PRO;SG DEF;MASC+FEM;N;NOM;SG PART ACT;NFIN;V ADJ;CMPR;NOM INDF;N;NEUT;NOM;SG ADP DEF;MASC+FEM;PRO;SG ADJ;MASC+FEM;NOM;SG INDF;MASC+FEM;N;NOM;SG _
det historiska rådhuset i obermarsberg härstammar från 1200-talet och renoverades efter trettioåriga kriget .	den historisk rådhus i obermarsberg härstamma från 1200-tal och renovera efter trettioårig krig .	DEF;DET;NEUT;SG ADJ;DEF;NOM;SG DEF;N;NEUT;NOM;SG ADP NOM;PROPN ACT;FIN;IND;PRS;V ADP DEF;N;NEUT;NOM;SG CONJ FIN;IND;PASS;PST;V ADP ADJ;DEF;NOM;SG DEF;N;NEUT;NOM;SG _
aldrin har varit gift tre gånger .	aldrin ha vara gift tre gång .	NOM;PROPN ACT;FIN;IND;PRS;V ACT;V;V.CVB ADJ;INDF;MASC+FEM;NOM;PST;SG;V.PTCP NOM;NUM INDF;MASC+FEM;N;NOM;PL _
filmen utgör en krönika över förstörelsen av carangis liv och karriär som en följd av hennes beroende av heroin , och hennes förfall och död i aids i mitten av 1980-talet .	film utgöra en krönika över förstörelse av carangi liv och karriär som en följd av hennes beroende av heroin , och hennes förfall och död i aids i mitt av 1980-tal .	DEF;MASC+FEM;N;NOM;SG ACT;FIN;IND;PRS;V DET;INDF;MASC+FEM;SG INDF;MASC+FEM;N;NOM;SG ADP DEF;MASC+FEM;N;NOM;SG ADP GEN;PROPN INDF;N;NEUT;NOM;SG CONJ INDF;MASC+FEM;N;NOM;SG CONJ DET;INDF;MASC+FEM;SG INDF;MASC+FEM;N;NOM;SG ADP DEF;PRO INDF;N;NEUT;NOM;SG ADP INDF;N;NEUT;NOM;SG _ CONJ DEF;PRO INDF;N;NEUT;NOM;SG CONJ INDF;MASC+FEM;N;NOM;SG ADP N ADP DEF;MASC+FEM;N;NOM;SG ADP DEF;N;NEUT;NOM;SG _
kanske spelar det ingen roll då jag inte kommer oroas särskilt länge .	kanske spela det ingen roll då jag inte komma oroa särskilt länge .	ADV ACT;FIN;IND;PRS;V DEF;NEUT;PRO;SG DET;INDF;MASC+FEM;SG INDF;MASC+FEM;N;NOM;SG CONJ DEF;MASC+FEM;NOM;PRO;SG NEG;PART ACT;FIN;IND;PRS;V NFIN;PASS;V ADV ADV _
vid varje station har en vakt i röd mössa uppsikt över perrongen och en hjulknackare går längs tåget med en hammare och knackar försiktigt på underredet .	vid varje station ha en vakt i röd mössa uppsikt över perrong och en hjulknackare gå längs tåg med en hammare och knacka försiktigt på underrede .	ADP DET;INDF;SG INDF;MASC+FEM;N;NOM;SG ACT;FIN;IND;PRS;V DET;INDF;MASC+FEM;SG INDF;MASC+FEM;N;NOM;SG ADP ADJ;INDF;MASC+FEM;NOM;SG INDF;MASC+FEM;N;NOM;SG INDF;MASC+FEM;N;NOM;SG ADP DEF;MASC+FEM;N;NOM;SG CONJ DET;INDF;MASC+FEM;SG INDF;MASC+FEM;N;NOM;SG ACT;FIN;IND;PRS;V ADP DEF;N;NEUT;NOM;SG ADP DET;INDF;MASC+FEM;SG INDF;MASC+FEM;N;NOM;SG CONJ ACT;FIN;IND;PRS;V ADV ADP DEF;N;NEUT;NOM;SG _
en monsun är en årstidsbunden dominerande vind som håller i sig i flera månader , och för in en regions regnperiod .	en monsun vara en årstidsbunden dominerande vind som hålla i sig i flera månad , och för in en region regnperiod .	DET;INDF;MASC+FEM;SG INDF;MASC+FEM;N;NOM;SG ACT;FIN;IND;PRS;V DET;INDF;MASC+FEM;SG ADJ;INDF;MASC+FEM;NOM;PST;SG;V.PTCP ADJ;IND;NOM;PRS;V.PTCP INDF;MASC+FEM;N;NOM;SG PRO ACT;FIN;IND;PRS;V ADV ACC;DEF;PRO ADP ADJ;INDF;NOM;PL INDF;MASC+FEM;N;NOM;PL _ CONJ ADP ADV DET;INDF;MASC+FEM;SG GEN;INDF;MASC+FEM;N;SG INDF;MASC+FEM;N;NOM;SG _
viguer och la conte-distrikten innehåller majoriteten av stadens sociala boenden , där befolkningen i huvudsak utgörs av invandrare eller dem med invandrarbakgrund .	viguer och la conte-distrikten innehålla majoritet av stad social boende , där befolkning i huvudsak utgöra av invandrare eller de med invandrarbakgrund .	NOM;PROPN CONJ NOM;PROPN DEF;MASC+FEM;N;NOM;SG ACT;FIN;IND;PRS;V DEF;MASC+FEM;N;NOM;SG ADP DEF;GEN;MASC+FEM;N;SG ADJ;NOM;PL INDF;N;NEUT;NOM;PL _ ADV DEF;MASC+FEM;N;NOM;SG ADP INDF;MASC+FEM;N;NOM;SG FIN;IND;PASS;PRS;V ADP INDF;MASC+FEM;N;NOM;PL CONJ ACC;DEF;PL;PRO ADP INDF;MASC+FEM;N;NOM;SG _
analyser påvisade att historiska mängder data hade använts för att orsaka störningen .	analys påvisa att historisk mängd data ha använda för att orsaka störning .	INDF;MASC+FEM;N;NOM;PL ACT;FIN;IND;PST;V CONJ ADJ;NOM;PL INDF;MASC+FEM;N;NOM;PL INDF;N;NEUT;NOM;PL ACT;FIN;IND;PST;V PASS;V;V.CVB ADP PART ACT;NFIN;V DEF;MASC+FEM;N;NOM;SG _
sannerligen prisade den första vetenskapliga rapporten om slaget av james henry breasted från 1903 källorna som möjliggjorde rekonstruktionen av slaget med säkerhet .	sannerligen prisa den första vetenskaplig rapport om slag av james henry breasted från 1903 källa som möjliggöra rekonstruktion av slag med säkerhet .	ADV ACT;FIN;IND;PST;V DEF;DET;MASC+FEM;SG ADJ;NOM ADJ;DEF;NOM;SG DEF;MASC+FEM;N;NOM;SG ADP DEF;N;NEUT;NOM;SG ADP NOM;PROPN NOM;PROPN NOM;PROPN ADP NOM;NUM DEF;MASC+FEM;N;NOM;PL PRO ACT;FIN;IND;PST;V DEF;MASC+FEM;N;NOM;SG ADP DEF;N;NEUT;NOM;SG ADP INDF;MASC+FEM;N;NOM;SG _
graftons regering upplöstes 1770 vilket lät torypartiet under ledning av lord north återta makten .	graftons regering upplösa 1770 vilket låta torypartiet under ledning av lord north återta makt .	DEF;GEN;MASC+FEM;N;SG INDF;MASC+FEM;N;NOM;SG FIN;IND;PASS;PST;V NOM;NUM INDF;NEUT;PRO;SG ACT;FIN;IND;PST;V NOM;PROPN ADP INDF;MASC+FEM;N;NOM;SG ADP INDF;MASC+FEM;N;NOM;SG NOM;PROPN ACT;NFIN;V DEF;MASC+FEM;N;NOM;SG _
seagal skapade rubriker när han beskrev rysslands agerande på krim , som landet annekterade 2014 , som ” väldigt rimliga ” .	seagal skapa rubrik när han beskriva ryssland agerande på krim , som land annektera 2014 , som ” väldigt rimlig ” .	NOM;PROPN ACT;FIN;IND;PST;V INDF;MASC+FEM;N;NOM;PL CONJ DEF;MASC+FEM;NOM;PRO;SG ACT;FIN;IND;PST;V GEN;PROPN INDF;N;NEUT;NOM;SG ADP NOM;PROPN _ PRO DEF;N;NEUT;NOM;SG ACT;FIN;IND;PST;V NOM;NUM _ CONJ _ ADV ADJ;NOM;PL _ _
barrie skrev in sig vid university of edinburgh där han skrev teaterrecensioner för edinburgh evening courant .	barrie skriva in sig vid university of edinburgh där han skriva teaterrecension för edinburgh evening courant .	NOM;PROPN ACT;FIN;IND;PST;V ADV ACC;DEF;PRO ADP NOM;PROPN NOM;PROPN NOM;PROPN ADV DEF;MASC+FEM;NOM;PRO;SG ACT;FIN;IND;PST;V INDF;MASC+FEM;N;NOM;PL ADP NOM;PROPN NOM;PROPN NOM;PROPN _
fast luftmasseidentifiering ursprungligen användes i väderprognoser under 1950-talet , började klimatologer etablera synoptiska klimatologier baserat på denna idé 1973 .	fast luftmasseidentifiering ursprungligen använda i väderprognos under 1950-tal , börja klimatologe etablera synoptisk klimatologier basera på denna idé 1973 .	CONJ INDF;MASC+FEM;N;NOM;SG ADV FIN;IND;PASS;PST;V ADP INDF;MASC+FEM;N;NOM;PL ADP DEF;N;NEUT;NOM;SG _ ACT;FIN;IND;PST;V INDF;MASC+FEM;N;NOM;PL ACT;NFIN;V ADJ;NOM;PL INDF;MASC+FEM;N;NOM;PL ACT;V;V.CVB ADP DEF;DET;MASC+FEM;SG INDF;MASC+FEM;N;NOM;SG NOM;NUM _
en mental konflikt grep herzl , mellan lusten för litterär framgång och en vilja att agera som en offentlig person .	en mental konflikt gripa herzl , mellan lust för litterär framgång och en vilja att agera som en offentlig person .	DET;INDF;MASC+FEM;SG ADJ;INDF;MASC+FEM;NOM;SG INDF;MASC+FEM;N;NOM;SG ACT;FIN;IND;PST;V NOM;PROPN _ ADP DEF;MASC+FEM;N;NOM;SG ADP ADJ;INDF;MASC+FEM;NOM;SG INDF;MASC+FEM;N;NOM;SG CONJ DET;INDF;MASC+FEM;SG INDF;MASC+FEM;N;NOM;SG PART ACT;NFIN;V CONJ DET;INDF;MASC+FEM;SG ADJ;INDF;MASC+FEM;NOM;SG INDF;MASC+FEM;N;NOM;SG _
" nicolai samarbetar på olika filmers musik av morricone som metti , en kväll vid middagen ; några av dem skrevs av båda tillsammans . "	" nicolai samarbeta på olik film musik av morricone som metti , en kväll vid middag ; några av de skriva av båda tillsammans . "	_ NOM;PROPN ACT;FIN;IND;PRS;V ADP ADJ;NOM;PL GEN;INDF;MASC+FEM;N;PL INDF;MASC+FEM;N;NOM;SG ADP NOM;PROPN ADP NOM;PROPN _ DET;INDF;MASC+FEM;SG INDF;MASC+FEM;N;NOM;SG ADP DEF;MASC+FEM;N;NOM;SG _ INDF;PL;PRO ADP ACC;DEF;PL;PRO FIN;IND;PASS;PST;V ADP DEF;PL;PRO ADV _ _
domaren i rättegången om duffys bedrägeri och trolöshet mot huvudman dömde till sist att de alla var inom senatens regler när han friade duffy på alla åtalspunkter .	domare i rättegång om duffy bedrägeri och trolöshet mot huvudman döma till sist att den alla vara inom senat regel när han fria duffy på all åtalspunkt .	DEF;MASC+FEM;N;NOM;SG ADP DEF;MASC+FEM;N;NOM;SG ADP GEN;PROPN INDF;N;NEUT;NOM;SG CONJ INDF;MASC+FEM;N;NOM;SG ADP INDF;MASC+FEM;N;NOM;SG ACT;FIN;IND;PST;V ADP ADV;RL CONJ DEF;DET;PL INDF;PL;PRO ACT;FIN;IND;PST;V ADP DEF;GEN;MASC+FEM;N;SG INDF;MASC+FEM;N;NOM;PL CONJ DEF;MASC+FEM;NOM;PRO;SG ACT;FIN;IND;PST;V NOM;PROPN ADP DET;PL INDF;MASC+FEM;N;NOM;PL _
efter kompromissen var kejsare och kung frans josef i mycket noga med att behandla båda sina monarkier lika .	efter kompromiss vara kejsare och kung frans josef i mycket noga med att behandla båda sin monarki lika .	ADP DEF;MASC+FEM;N;NOM;SG ACT;FIN;IND;PST;V INDF;MASC+FEM;N;NOM;SG CONJ INDF;MASC+FEM;N;NOM;SG NOM;PROPN NOM;PROPN NOM;PROPN ADV ADJ;NOM ADP PART ACT;NFIN;V DEF;PL;PRO DEF;PL;PRO INDF;MASC+FEM;N;NOM;PL ADV _
i augusti 1969 tog påve paulus vi bort dödstraffet ur vatikansk lag och drog tillbaka det för alla lagöverträdelser .	i augusti 1969 ta påve paulus vi bort dödstraff ur vatikansk lag och dra tillbaka det för all lagöverträdelse .	ADP INDF;MASC+FEM;N;NOM;SG NOM;NUM ACT;FIN;IND;PST;V INDF;MASC+FEM;N;NOM;SG NOM;PROPN NOM;PROPN ADV DEF;N;NEUT;NOM;SG ADP ADJ;INDF;MASC+FEM;NOM;SG INDF;MASC+FEM;N;NOM;SG CONJ ACT;FIN;IND;PST;V ADV DEF;NEUT;PRO;SG ADP DET;PL INDF;MASC+FEM;N;NOM;PL _
men stora minskningar har redan skissats ned vad gäller torsk , sjötunga , spätta , glasvar och sej i keltiska havet och irländska sjön .	men stor minskning ha redan skissa ned vad gälla torsk , sjötunga , spätta , glasvar och sig i keltisk hav och irländsk sjö .	CONJ ADJ;NOM;PL INDF;MASC+FEM;N;NOM;PL ACT;FIN;IND;PRS;V ADV PASS;V;V.CVB ADP INDF;NEUT;PRO;SG ACT;FIN;IND;PRS;V INDF;MASC+FEM;N;NOM;SG _ INDF;MASC+FEM;N;NOM;SG _ INDF;MASC+FEM;N;NOM;SG _ INDF;MASC+FEM;N;NOM;SG CONJ ACC;DEF;PRO ADP ADJ;DEF;NOM;SG DEF;N;NEUT;NOM;SG CONJ ADJ;DEF;NOM;SG DEF;MASC+FEM;N;NOM;SG _
