karibiska havet hade varit okänt för befolkningarna i eurasien fram till 1492 när christofer columbus först seglade in i karibiska vatten med uppdraget att hitta en sjöväg till asien .	karibiska hav ha vara okänd för befolkning i eurasien fram till 1492 när christofer columbus först segla in i karibiska vatten med uppdrag att hitta en sjöväg till asien .	ADJ;DEF;NOM;SG DEF;N;NEUT;NOM;SG ACT;FIN;IND;PST;V ACT;V;V.CVB ADJ;INDF;NEUT;NOM;SG ADP DEF;MASC+FEM;N;NOM;PL ADP NOM;PROPN ADV ADP NOM;NUM ADV NOM;PROPN NOM;PROPN ADV ACT;FIN;IND;PST;V ADV ADP ADJ;DEF;NOM;SG INDF;N;NEUT;NOM;SG ADP DEF;N;NEUT;NOM;SG PART ACT;NFIN;V DET;INDF;MASC+FEM;SG INDF;MASC+FEM;N;NOM;SG ADP NOM;PROPN _
det är svårt att tänka sig att italien har färre kilometrar tunnelbana än madrid .	det vara svår att tänka sig att italien ha få kilometer tunnelbana än madrid .	DEF;NEUT;PRO;SG ACT;FIN;IND;PRS;V ADJ;INDF;NEUT;NOM;SG PART ACT;NFIN;V ACC;DEF;PRO CONJ NOM;PROPN ACT;FIN;IND;PRS;V ADJ;CMPR;NOM INDF;MASC+FEM;N;NOM;PL INDF;MASC+FEM;N;NOM;SG ADP NOM;PROPN _
clinton med allierade försöker under tiden hålla strålkastarljuset på trump , och menar att hans nedsättande kommentarer om kvinnor och minoriteter , samt hans temperament gör honom olämplig som president .	clinton med allierad försöka under tid hålla strålkastarljus på trump , och mena att hans nedsättande kommentar om kvinna och minoritet , samt hans temperament göra han olämplig som president .	NOM;PROPN ADP ADJ;NOM;PL;PST;V.PTCP ACT;FIN;IND;PRS;V ADP DEF;MASC+FEM;N;NOM;SG ACT;NFIN;V DEF;N;NEUT;NOM;SG ADP NOM;PROPN _ CONJ ACT;FIN;IND;PRS;V CONJ DEF;PRO ADJ;IND;NOM;PRS;V.PTCP INDF;MASC+FEM;N;NOM;PL ADP INDF;MASC+FEM;N;NOM;PL CONJ INDF;MASC+FEM;N;NOM;PL _ CONJ DEF;PRO INDF;N;NEUT;NOM;SG ACT;FIN;IND;PRS;V ACC;DEF;MASC+FEM;PRO;SG ADJ;INDF;MASC+FEM;NOM;SG CONJ INDF;MASC+FEM;N;NOM;SG _
vid sin återkomst lekte de med tanken att bo i sydamerika , långt borta från problemen i efterkrigstidens belgien .	vid sin återkomst leka de med tanke att bo i sydamerika , långt borta från problem i efterkrigstid belgien .	ADP DEF;MASC+FEM;PRO;SG INDF;MASC+FEM;N;NOM;SG ACT;FIN;IND;PST;V DEF;NOM;PL;PRO ADP DEF;MASC+FEM;N;NOM;SG PART ACT;NFIN;V ADP NOM;PROPN _ ADV ADV ADP DEF;N;NEUT;NOM;PL ADP DEF;GEN;MASC+FEM;N;SG NOM;PROPN _
johan av gent dog 1399 .	johan av gen dö 1399 .	NOM;PROPN ADP ADJ;INDF;NEUT;NOM;SG ACT;FIN;IND;PST;V NOM;NUM _
film hade förändrats så drastiskt att hollywood hade alienerat familjepubliken .	film ha förändra så drastiskt att hollywood ha alienera familjepublik .	INDF;MASC+FEM;N;NOM;SG ACT;FIN;IND;PST;V PASS;V;V.CVB ADV ADV CONJ NOM;PROPN ACT;FIN;IND;PST;V ACT;V;V.CVB DEF;MASC+FEM;N;NOM;SG _
han återvände sedan till kirriemuir .	han återvända sedan till kirriemuir .	DEF;MASC+FEM;NOM;PRO;SG ACT;FIN;IND;PST;V ADV ADP NOM;PROPN _
den avser att ta restiden med i beräkningen efter att ha dragit av denna från den arbetstid som faktiskt utförts , utan att kunna mäta den faktiska restiden .	den avse att ta restid med i beräkning efter att ha dra av denna från den arbetstid som faktiskt utföra , utan att kunna mäta den faktisk restid .	DEF;MASC+FEM;PRO;SG ACT;FIN;IND;PRS;V PART ACT;NFIN;V DEF;MASC+FEM;N;NOM;SG ADP ADP DEF;MASC+FEM;N;NOM;SG ADP PART ACT;NFIN;V ACT;V;V.CVB ADP DEF;MASC+FEM;PRO;SG ADP DEF;DET;MASC+FEM;SG INDF;MASC+FEM;N;NOM;SG PRO ADV PASS;V;V.CVB _ ADP PART ACT;NFIN;V ACT;NFIN;V DEF;DET;MASC+FEM;SG ADJ;DEF;NOM;SG DEF;MASC+FEM;N;NOM;SG _
de senare spred även islam till kustbandet , men de flesta bantufolken hade aldrig kontakt med islam och förblev anhängare av afrikansk traditionell religion .	den sent sprida även islam till kustband , men den fler bantufolk ha aldrig kontakt med islam och förbli anhängare av afrikansk traditionell religion .	DEF;DET;PL ADV;CMPR ACT;FIN;IND;PST;V ADV INDF;MASC+FEM;N;NOM;SG ADP DEF;N;NEUT;NOM;SG _ CONJ DEF;DET;PL ADJ;DEF;NOM;PL;RL DEF;N;NEUT;NOM;PL ACT;FIN;IND;PST;V ADV;NEG INDF;MASC+FEM;N;NOM;SG ADP INDF;MASC+FEM;N;NOM;SG CONJ ACT;FIN;IND;PST;V INDF;MASC+FEM;N;NOM;SG ADP ADJ;INDF;MASC+FEM;NOM;SG ADJ;INDF;MASC+FEM;NOM;SG INDF;MASC+FEM;N;NOM;SG _
hon åtalas även för att ha försökt mörda sin tvååriga dotter .	hon åtala även för att ha försöka mörda sin tvåårig dotter .	DEF;MASC+FEM;NOM;PRO;SG FIN;IND;PASS;PRS;V ADV ADP PART ACT;NFIN;V ACT;V;V.CVB ACT;NFIN;V DEF;MASC+FEM;PRO;SG ADJ;DEF;NOM;SG INDF;MASC+FEM;N;NOM;SG _
en ordentlig teologi skulle därför behöva konstrueras i ljuset av dess framtida mål .	en ordentlig teologi skola därför behöva konstruera i ljus av dess framtida mål .	DET;INDF;MASC+FEM;SG ADJ;INDF;MASC+FEM;NOM;SG INDF;MASC+FEM;N;NOM;SG ACT;FIN;IND;PST;V ADV ACT;NFIN;V NFIN;PASS;V ADP DEF;N;NEUT;NOM;SG ADP DEF;PRO ADJ;NOM INDF;N;NEUT;NOM;SG _
talesmannen uteslöt inte möjligheten att andra också skulle utredas .	talesman utesluta inte möjlighet att andra också skola utreda .	DEF;MASC+FEM;N;NOM;SG ACT;FIN;IND;PST;V NEG;PART DEF;MASC+FEM;N;NOM;SG CONJ INDF;PL;PRO ADV ACT;FIN;IND;PST;V NFIN;PASS;V _
de två organisationerna skickade in ett överklagande som förkastades av kassationsdomstolen den 12 oktober .	den två organisation skicka in en överklagande som förkasta av kassationsdomstol den 12 oktober .	DEF;DET;PL NOM;NUM DEF;MASC+FEM;N;NOM;PL ACT;FIN;IND;PST;V ADV DET;INDF;NEUT;SG INDF;N;NEUT;NOM;SG PRO FIN;IND;PASS;PST;V ADP DEF;MASC+FEM;N;NOM;SG DEF;DET;MASC+FEM;SG NOM;NUM INDF;MASC+FEM;N;NOM;SG _
med detta kan du , i teorin , komma åt dina pengar när du än vill .	med detta kunna du , i teori , komma åt din peng när du än vilja .	ADP DEF;NEUT;PRO;SG ACT;FIN;IND;PRS;V DEF;MASC+FEM;NOM;PRO;SG _ ADP DEF;MASC+FEM;N;NOM;SG _ ACT;NFIN;V ADP DEF;PL;PRO INDF;MASC+FEM;N;NOM;PL CONJ DEF;MASC+FEM;NOM;PRO;SG ADV ACT;FIN;IND;PRS;V _
företag kan försöka ställa upp en brandvägg mellan känsliga system och främmande makt , men det fungerar inte alltid .	företag kunna försöka ställa upp en brandvägg mellan känslig system och främmande makt , men det fungera inte alltid .	INDF;N;NEUT;NOM;PL ACT;FIN;IND;PRS;V ACT;NFIN;V ACT;NFIN;V ADV DET;INDF;MASC+FEM;SG INDF;MASC+FEM;N;NOM;SG ADP ADJ;NOM;PL INDF;N;NEUT;NOM;PL CONJ ADJ;NOM INDF;MASC+FEM;N;NOM;SG _ CONJ DEF;NEUT;PRO;SG ACT;FIN;IND;PRS;V NEG;PART ADV _
jag kan bara göra det med mitt liv .	jag kunna bara göra det med min liv .	DEF;MASC+FEM;NOM;PRO;SG ACT;FIN;IND;PRS;V ADV ACT;NFIN;V DEF;NEUT;PRO;SG ADP DEF;NEUT;PRO;SG INDF;N;NEUT;NOM;SG _
mishima stödde en väldigt individuell sorts nationalism mot slutet av sitt liv .	mishima stöda en väldigt individuell sort nationalism mot slut av sin liv .	NOM;PROPN ACT;FIN;IND;PST;V DET;INDF;MASC+FEM;SG ADV ADJ;INDF;MASC+FEM;NOM;SG GEN;INDF;MASC+FEM;N;SG INDF;MASC+FEM;N;NOM;SG ADP DEF;N;NEUT;NOM;SG ADP DEF;NEUT;PRO;SG INDF;N;NEUT;NOM;SG _
vi har ett jättebra lag och det är en möjlighet för oss att föra skeppet framåt .	vi ha en jättebra lag och det vara en möjlighet för vi att föra skepp framåt .	DEF;MASC+FEM;NOM;PL;PRO ACT;FIN;IND;PRS;V DET;INDF;NEUT;SG ADJ;NOM INDF;N;NEUT;NOM;SG CONJ DEF;NEUT;PRO;SG ACT;FIN;IND;PRS;V DET;INDF;MASC+FEM;SG INDF;MASC+FEM;N;NOM;SG ADP ACC;DEF;MASC+FEM;PL;PRO PART ACT;NFIN;V DEF;N;NEUT;NOM;SG ADV _
efter maktövertagandet av nationalsocialisterna 1933 förekom spridda försök att återfå de gamla kolonierna .	efter maktövertagande av nationalsocialist 1933 förekomma spridd försök att återfå den gammal koloni .	ADP DEF;N;NEUT;NOM;SG ADP DEF;MASC+FEM;N;NOM;PL NOM;NUM ACT;FIN;IND;PST;V ADJ;NOM;PL INDF;N;NEUT;NOM;PL PART ACT;NFIN;V DEF;DET;PL ADJ;NOM;PL DEF;MASC+FEM;N;NOM;PL _
före kejsar meiji byttes namnen på erorna mer frekvent och de postuma namnen för kejsarna valdes på ett annat sätt .	före kejsar meiji byta namn på era mycket frekvent och den postum namn för kejsare välja på en annan sätt .	ADP INDF;MASC+FEM;N;NOM;SG NOM;PROPN FIN;IND;PASS;PST;V DEF;N;NEUT;NOM;PL ADP DEF;MASC+FEM;N;NOM;PL ADV;CMPR ADV CONJ DEF;DET;PL ADJ;NOM;PL DEF;N;NEUT;NOM;PL ADP DEF;MASC+FEM;N;NOM;PL FIN;IND;PASS;PST;V ADP DET;INDF;NEUT;SG ADJ;INDF;NEUT;NOM;SG INDF;N;NEUT;NOM;SG _
detta var nådastöten och den uppmuntran bosättarna behövde för att få sin självständighet .	detta vara nådastöt och den uppmuntran bosättare behöva för att få sin självständighet .	DEF;NEUT;PRO;SG ACT;FIN;IND;PST;V DEF;MASC+FEM;N;NOM;SG CONJ DEF;DET;MASC+FEM;SG INDF;MASC+FEM;N;NOM;SG DEF;MASC+FEM;N;NOM;PL ACT;FIN;IND;PST;V ADP PART ACT;NFIN;V DEF;MASC+FEM;PRO;SG INDF;MASC+FEM;N;NOM;SG _
det finns fortfarande en ”usch”-faktor i hela tanken med att köpa och bära andra människors kroppsdelar , säger hon .	det finnas fortfarande en ”usch”-faktor i hel tanke med att köpa och bära annan människa kroppsdel , säga hon .	DEF;NEUT;PRO;SG FIN;IND;PASS;PRS;V ADV DET;INDF;MASC+FEM;SG INDF;MASC+FEM;N;NOM;SG ADP ADJ;DEF;NOM;SG DEF;MASC+FEM;N;NOM;SG ADP PART ACT;NFIN;V CONJ ACT;NFIN;V ADJ;NOM;PL GEN;INDF;MASC+FEM;N;PL INDF;MASC+FEM;N;NOM;PL _ ACT;FIN;IND;PRS;V DEF;MASC+FEM;NOM;PRO;SG _
vid den här tiden bodde endast runt fyrtio familjer där med mängder av god jordbruksmark och bete för boskap .	vid den här tid bo endast runt fyrtio familj där med mängd av god jordbruksmark och bete för boskap .	ADP DEF;DET;MASC+FEM;SG ADV DEF;MASC+FEM;N;NOM;SG ACT;FIN;IND;PST;V ADV ADP NOM;NUM INDF;MASC+FEM;N;NOM;PL ADV ADP INDF;MASC+FEM;N;NOM;PL ADP ADJ;INDF;MASC+FEM;NOM;SG INDF;MASC+FEM;N;NOM;SG CONJ INDF;N;NEUT;NOM;SG ADP INDF;MASC+FEM;N;NOM;SG _
detta har att göra med en av de få byggnaderna i stadskärnan som undgick förstörelse vid slutet av andra världskriget .	detta ha att göra med en av den få byggnad i stadskärna som undgå förstörelse vid slut av andra världskrig .	DEF;NEUT;PRO;SG ACT;FIN;IND;PRS;V PART ACT;NFIN;V ADP INDF;MASC+FEM;PRO;SG ADP DEF;DET;PL ADJ;INDF;NOM;PL DEF;MASC+FEM;N;NOM;PL ADP DEF;MASC+FEM;N;NOM;SG PRO ACT;FIN;IND;PST;V INDF;MASC+FEM;N;NOM;SG ADP DEF;N;NEUT;NOM;SG ADP ADJ;NOM DEF;N;NEUT;NOM;SG _
2003 dominerade han i poängställningen och ledde de sista 33 av 36 lopp och blev 2003 års nascar winston cup-mästare , den siste föraren att någonsin få den titeln .	2003 dominera han i poängställning och leda den sist 33 av 36 lopp och bli 2003 år nascar winston cup-mästare , den sist förare att någonsin få den titel .	NOM;NUM ACT;FIN;IND;PST;V DEF;MASC+FEM;NOM;PRO;SG ADP DEF;MASC+FEM;N;NOM;SG CONJ ACT;FIN;IND;PST;V DEF;DET;PL ADJ;DEF;NOM;RL NOM;NUM ADP NOM;NUM INDF;N;NEUT;NOM;PL CONJ ACT;FIN;IND;PST;V NOM;NUM GEN;INDF;N;NEUT;SG NOM;PROPN NOM;PROPN NOM;PROPN _ DEF;DET;MASC+FEM;SG ADJ;DEF;MASC;NOM;RL;SG DEF;MASC+FEM;N;NOM;SG PART ADV ACT;NFIN;V DEF;DET;MASC+FEM;SG DEF;MASC+FEM;N;NOM;SG _
fungerar serie två så här långt ?	fungera serie två så här långt ?	ACT;FIN;IND;PRS;V INDF;MASC+FEM;N;NOM;SG NOM;NUM ADV ADV ADV _
men det kan vara så att ba och iag har knäckt det och kan erbjuda något som kan verka pålitligt .	men det kunna vara så att ba och iag ha knäcka det och kunna erbjuda något som kunna verka pålitligt .	CONJ DEF;NEUT;PRO;SG ACT;FIN;IND;PRS;V ACT;NFIN;V ADV CONJ N CONJ NOM;PROPN ACT;FIN;IND;PRS;V ACT;V;V.CVB DEF;NEUT;PRO;SG CONJ ACT;FIN;IND;PRS;V ACT;NFIN;V INDF;NEUT;PRO;SG PRO ACT;FIN;IND;PRS;V ACT;NFIN;V ADV _
vissa män förstår och bono är en av de killarna , sade leive i en intervju nyligen .	viss man förstå och bono vara en av den kille , säga leive i en intervju nyligen .	ADJ;NOM;PL INDF;MASC+FEM;N;NOM;PL ACT;FIN;IND;PRS;V CONJ NOM;PROPN ACT;FIN;IND;PRS;V INDF;MASC+FEM;PRO;SG ADP DEF;DET;PL DEF;MASC+FEM;N;NOM;PL _ ACT;FIN;IND;PST;V NOM;PROPN ADP DET;INDF;MASC+FEM;SG INDF;MASC+FEM;N;NOM;SG ADV _
han kunde upptäcka effekterna av valet runt om honom , i de utbrott av konflikter och de underliga skärningspunkter som nya idéer bildade med gamla .	han kunna upptäcka effekt av val runt om han , i den utbrott av konflikt och den underlig skärningspunkt som ny idé bilda med gammal .	DEF;MASC+FEM;NOM;PRO;SG ACT;FIN;IND;PST;V ACT;NFIN;V DEF;MASC+FEM;N;NOM;PL ADP DEF;N;NEUT;NOM;SG ADV ADP ACC;DEF;MASC+FEM;PRO;SG _ ADP DEF;DET;PL INDF;N;NEUT;NOM;PL ADP INDF;MASC+FEM;N;NOM;PL CONJ DEF;DET;PL ADJ;NOM;PL INDF;MASC+FEM;N;NOM;PL CONJ ADJ;NOM;PL INDF;MASC+FEM;N;NOM;PL ACT;FIN;IND;PST;V ADP ADJ;NOM;PL _
klänningen är samtida .	klänning vara samtida .	DEF;MASC+FEM;N;NOM;SG ACT;FIN;IND;PRS;V ADJ;NOM _
det fanns även ett alternativ för att skicka emojin , gif:ar , egenskapade mem och klistermärken via plattformen , och att ansluta ens twitterflöde .	det finnas även en alternativ för att skicka emojin , gif , egenskapad mem och klistermärke via plattform , och att ansluta ens twitterflöde .	DEF;NEUT;PRO;SG FIN;IND;PASS;PST;V ADV DET;INDF;NEUT;SG INDF;N;NEUT;NOM;SG ADP PART ACT;NFIN;V DEF;MASC+FEM;N;NOM;SG _ INDF;MASC+FEM;N;NOM;PL _ ADJ;NOM;PL;PST;V.PTCP INDF;N;NEUT;NOM;PL CONJ INDF;N;NEUT;NOM;PL ADP DEF;MASC+FEM;N;NOM;SG _ CONJ PART ACT;NFIN;V DEF;PRO INDF;N;NEUT;NOM;SG _
det lade grunden för integration där statens ekonomiska och juridiska maskineri kunde tillämpas genom hela medelhavet på samma sätt som en gång gjordes från latium för hela italien .	det lägga grund för integration där stat ekonomisk och juridisk maskineri kunna tillämpa genom hel medelhavet på samma sätt som en gång göra från latium för hel italien .	DEF;NEUT;PRO;SG ACT;FIN;IND;PST;V DEF;MASC+FEM;N;NOM;SG ADP INDF;MASC+FEM;N;NOM;SG ADV DEF;GEN;MASC+FEM;N;SG ADJ;DEF;NOM;SG CONJ ADJ;DEF;NOM;SG INDF;N;NEUT;NOM;SG ACT;FIN;IND;PST;V NFIN;PASS;V ADP ADJ;DEF;NOM;SG NOM;PROPN ADP DET;INDF INDF;N;NEUT;NOM;SG CONJ DET;INDF;MASC+FEM;SG INDF;MASC+FEM;N;NOM;SG FIN;IND;PASS;PST;V ADP NOM;PROPN ADP ADJ;DEF;NOM;SG NOM;PROPN _
detta har inte hindrat investerare från att flockas för att sätta in sina pengar i fonderna .	detta ha inte hindra investerare från att flockas för att sätta in sin peng i fond .	DEF;NEUT;PRO;SG ACT;FIN;IND;PRS;V NEG;PART ACT;V;V.CVB INDF;MASC+FEM;N;NOM;PL ADP PART NFIN;PASS;V ADP PART ACT;NFIN;V ADV DEF;PL;PRO INDF;MASC+FEM;N;NOM;PL ADP DEF;MASC+FEM;N;NOM;PL _
stadieväxling är ett fenomen i både finska och nordsamiska dialekter , men saknas i sydsamiskan , vilken anses ha en annan språkhistoria .	stadieväxling vara en fenomen i både finsk och nordsamisk dialekt , men sakna i sydsamiska , vilken anse ha en annan språkhistoria .	INDF;MASC+FEM;N;NOM;SG ACT;FIN;IND;PRS;V DET;INDF;NEUT;SG INDF;N;NEUT;NOM;SG ADP CONJ ADJ;DEF;NOM;SG CONJ ADJ;DEF;NOM;SG INDF;MASC+FEM;N;NOM;PL _ CONJ FIN;IND;PASS;PRS;V ADP DEF;MASC+FEM;N;NOM;SG _ INDF;MASC+FEM;PRO;SG FIN;IND;PASS;PRS;V ACT;NFIN;V DET;INDF;MASC+FEM;SG ADJ;INDF;MASC+FEM;NOM;SG INDF;MASC+FEM;N;NOM;SG _
under romaniseringens första steg delades halvön i två delar av romarna i administrativa syften .	under romanisering första steg dela halvö i två del av romare i administrativ syfte .	ADP DEF;GEN;MASC+FEM;N;SG ADJ;NOM INDF;N;NEUT;NOM;SG FIN;IND;PASS;PST;V DEF;MASC+FEM;N;NOM;SG ADP NOM;NUM INDF;MASC+FEM;N;NOM;PL ADP DEF;MASC+FEM;N;NOM;PL ADP ADJ;NOM;PL INDF;N;NEUT;NOM;PL _
sydafrika är nästan bortom återvändo och vi måste kunna matcha deras längtan .	sydafrika vara nästan bortom återvändo och vi måste kunna matcha deras längtan .	NOM;PROPN ACT;FIN;IND;PRS;V ADV ADP N CONJ DEF;MASC+FEM;NOM;PL;PRO ACT;FIN;IND;PRS;V ACT;NFIN;V ACT;NFIN;V DEF;PRO INDF;MASC+FEM;N;NOM;SG _
det skapas en voucher som kan sparas på din smartphone eller uppvisas i kassan .	det skapa en voucher som kunna spara på din smartphone eller uppvisa i kassa .	DEF;NEUT;PRO;SG FIN;IND;PASS;PRS;V DET;INDF;MASC+FEM;SG INDF;MASC+FEM;N;NOM;SG PRO ACT;FIN;IND;PRS;V NFIN;PASS;V ADP DEF;MASC+FEM;PRO;SG INDF;MASC+FEM;N;NOM;SG CONJ FIN;IND;PASS;PRS;V ADP DEF;MASC+FEM;N;NOM;SG _
spillrorna bildade en ring runt jordens ekvator och drogs så småningom samman av gravitation för att bilda månen .	spillra bilda en ring runt jord ekvator och dra så småningom samman av gravitation för att bilda måne .	DEF;MASC+FEM;N;NOM;PL ACT;FIN;IND;PST;V DET;INDF;MASC+FEM;SG INDF;MASC+FEM;N;NOM;SG ADP DEF;GEN;MASC+FEM;N;SG INDF;MASC+FEM;N;NOM;SG CONJ FIN;IND;PASS;PST;V ADV ADV ADV ADP INDF;MASC+FEM;N;NOM;SG ADP PART ACT;NFIN;V DEF;MASC+FEM;N;NOM;SG _
australien , som härdats av sina matcher i rugbymästerskapen nyligen , hade en högre växel .	australien , som härda av sin match i rugbymästerskapen nyligen , ha en hög växel .	NOM;PROPN _ PRO PASS;V;V.CVB ADP DEF;PL;PRO INDF;MASC+FEM;N;NOM;PL ADP DEF;MASC+FEM;N;NOM;SG ADV _ ACT;FIN;IND;PST;V DET;INDF;MASC+FEM;SG ADJ;CMPR;NOM INDF;MASC+FEM;N;NOM;SG _
bouchard led en chockerande tresetsförlust .	bouchard lida en chockerande tresetsförlust .	NOM;PROPN ACT;FIN;IND;PST;V DET;INDF;MASC+FEM;SG ADJ;IND;NOM;PRS;V.PTCP INDF;MASC+FEM;N;NOM;SG _
företaget berättade för bbc att det skulle vara varje flygbolags ansvar att besluta om att debitera passagerarna en åtkomstavgift .	företag berätta för bbc att det skola vara varje flygbolag ansvar att besluta om att debitera passagerare en åtkomstavgift .	DEF;N;NEUT;NOM;SG ACT;FIN;IND;PST;V ADP NOM;PROPN CONJ DEF;NEUT;PRO;SG ACT;FIN;IND;PST;V ACT;NFIN;V DET;INDF;SG GEN;INDF;N;NEUT;SG INDF;N;NEUT;NOM;SG PART ACT;NFIN;V ADP PART ACT;NFIN;V DEF;MASC+FEM;N;NOM;PL DET;INDF;MASC+FEM;SG INDF;MASC+FEM;N;NOM;SG _
det är den vanligast förekommande tumören hos spädbarn , och uppkommer i en per 35000 födslar .	det vara den vanlig förekommande tumör hos spädbarn , och uppkomma i en per 35 000 födsel .	DEF;NEUT;PRO;SG ACT;FIN;IND;PRS;V DEF;DET;MASC+FEM;SG ADJ;INDF;NOM;RL ADJ;IND;NOM;PRS;V.PTCP DEF;MASC+FEM;N;NOM;SG ADP INDF;N;NEUT;NOM;PL _ CONJ ACT;FIN;IND;PRS;V ADP DET;INDF;MASC+FEM;SG ADP NOM;NUM INDF;MASC+FEM;N;NOM;PL _
det ledde till avslöjanden över de senaste två dagarna att åtminstone sex andra journalister i quebec var föremål för provinspolisens övervakningsverksamhet .	det leda till avslöjande över den sen två dag att åtminstone sex annan journalist i quebec vara föremål för provinspolis övervakningsverksamhet .	DEF;NEUT;PRO;SG ACT;FIN;IND;PST;V ADP INDF;N;NEUT;NOM;PL ADP DEF;DET;PL ADJ;DEF;NOM;RL NOM;NUM DEF;MASC+FEM;N;NOM;PL CONJ ADV NOM;NUM ADJ;NOM;PL INDF;MASC+FEM;N;NOM;PL ADP NOM;PROPN ACT;FIN;IND;PST;V INDF;N;NEUT;NOM;SG ADP DEF;GEN;MASC+FEM;N;SG INDF;MASC+FEM;N;NOM;SG _
bilden visar tydligt den smala pekskärmsstrimman ovanför tangentbordet som har förutsetts i rykten .	bild visa tydligt den smal pekskärmsstrimma ovanför tangentbord som ha förutse i rykte .	DEF;MASC+FEM;N;NOM;SG ACT;FIN;IND;PRS;V ADV DEF;DET;MASC+FEM;SG ADJ;DEF;NOM;SG DEF;MASC+FEM;N;NOM;SG ADP DEF;N;NEUT;NOM;SG PRO ACT;FIN;IND;PRS;V PASS;V;V.CVB ADP INDF;N;NEUT;NOM;PL _
det första världskriget förde med sig förändringar och nya utvecklingar i kolonialpolitik .	den första världskrig föra med sig förändring och ny utveckling i kolonialpolitik .	DEF;DET;NEUT;SG ADJ;NOM DEF;N;NEUT;NOM;SG ACT;FIN;IND;PST;V ADP ACC;DEF;PRO INDF;MASC+FEM;N;NOM;PL CONJ ADJ;NOM;PL INDF;MASC+FEM;N;NOM;PL ADP INDF;MASC+FEM;N;NOM;SG _
inhemska amerikaner över hela amerika förlitade sig på den som en basvara i sina medicinska kurer .	inhemsk amerikan över hel amerika förlita sig på den som en basvara i sin medicinsk kur .	ADJ;NOM;PL INDF;MASC+FEM;N;NOM;PL ADP ADJ;DEF;NOM;SG NOM;PROPN ACT;FIN;IND;PST;V ACC;DEF;PRO ADP DEF;MASC+FEM;PRO;SG ADP DET;INDF;MASC+FEM;SG INDF;MASC+FEM;N;NOM;SG ADP DEF;PL;PRO ADJ;NOM;PL INDF;MASC+FEM;N;NOM;PL _
det har betonats att vi absolut inte kan fortsätta med de som är helt emot italien .	det ha betona att vi absolut inte kunna fortsätta med de som vara helt emot italien .	DEF;NEUT;PRO;SG ACT;FIN;IND;PRS;V PASS;V;V.CVB CONJ DEF;MASC+FEM;NOM;PL;PRO ADV NEG;PART ACT;FIN;IND;PRS;V ACT;NFIN;V ADP DEF;NOM;PL;PRO PRO ACT;FIN;IND;PRS;V ADV ADP NOM;PROPN _
åtgärden belyste företagets önskan att användare ska börja se på dess produkter som mer än bara produktivitetsverktyg .	åtgärd belysa företag önskan att användare skola börja se på dess produkt som mycket än bara produktivitetsverktyg .	DEF;MASC+FEM;N;NOM;SG ACT;FIN;IND;PST;V DEF;GEN;N;NEUT;SG INDF;MASC+FEM;N;NOM;SG CONJ INDF;MASC+FEM;N;NOM;PL ACT;FIN;IND;PRS;V ACT;NFIN;V ACT;NFIN;V ADP DEF;PRO INDF;MASC+FEM;N;NOM;PL CONJ ADV;CMPR CONJ ADV INDF;N;NEUT;NOM;PL _
vad än reglerna var slutade ofta striderna med att en av hingstarna dog .	vad än regel vara sluta ofta strid med att en av hingst dö .	INDF;NEUT;PRO;SG ADV DEF;MASC+FEM;N;NOM;PL ACT;FIN;IND;PST;V ACT;FIN;IND;PST;V ADV DEF;MASC+FEM;N;NOM;PL ADP CONJ INDF;MASC+FEM;PRO;SG ADP DEF;MASC+FEM;N;NOM;PL ACT;FIN;IND;PST;V _
blockaden av villeneuves flotta resulterade i att man gav upp planen på invasion av de brittiska öarna , även på grund av nya händelseutvecklingar som skedde på kontinenten .	blockad av villeneuve flotta resultera i att man giva upp plan på invasion av den brittisk ö , även på grund av ny händelseutveckling som ske på kontinent .	DEF;MASC+FEM;N;NOM;SG ADP GEN;PROPN INDF;MASC+FEM;N;NOM;SG ACT;FIN;IND;PST;V ADP CONJ INDF;MASC+FEM;NOM;PRO;SG ACT;FIN;IND;PST;V ADV DEF;MASC+FEM;N;NOM;SG ADP INDF;MASC+FEM;N;NOM;SG ADP DEF;DET;PL ADJ;NOM;PL DEF;MASC+FEM;N;NOM;PL _ ADV ADP INDF;MASC+FEM;N;NOM;SG ADP ADJ;NOM;PL INDF;MASC+FEM;N;NOM;PL PRO ACT;FIN;IND;PST;V ADP DEF;MASC+FEM;N;NOM;SG _
ett element som stöder denna hypotes skulle vara den intensiva uppfödning av hästar som ägde rum vid villa pelucca , i sesto san giovanni .	en element som stöda denna hypotes skola vara den intensiv uppfödning av häst som äga rum vid villa pelucca , i sesto san giovanni .	DET;INDF;NEUT;SG INDF;N;NEUT;NOM;SG PRO ACT;FIN;IND;PRS;V DEF;DET;MASC+FEM;SG INDF;MASC+FEM;N;NOM;SG ACT;FIN;IND;PST;V ACT;NFIN;V DEF;DET;MASC+FEM;SG ADJ;DEF;NOM;SG INDF;MASC+FEM;N;NOM;SG ADP INDF;MASC+FEM;N;NOM;PL PRO ACT;FIN;IND;PST;V INDF;N;NEUT;NOM;SG ADP NOM;PROPN NOM;PROPN _ ADP NOM;PROPN NOM;PROPN NOM;PROPN _
den här gången nådde det honom , men han vägrade att tro att hon inte längre ville vara gift med honom .	den här gång nå det han , men han vägra att tro att hon inte länge vilja vara gift med han .	DEF;DET;MASC+FEM;SG ADV DEF;MASC+FEM;N;NOM;SG ACT;FIN;IND;PST;V DEF;NEUT;PRO;SG ACC;DEF;MASC+FEM;PRO;SG _ CONJ DEF;MASC+FEM;NOM;PRO;SG ACT;FIN;IND;PST;V PART ACT;NFIN;V CONJ DEF;MASC+FEM;NOM;PRO;SG NEG;PART ADV;CMPR ACT;FIN;IND;PST;V ACT;NFIN;V ADJ;INDF;MASC+FEM;NOM;PST;SG;V.PTCP ADP ACC;DEF;MASC+FEM;PRO;SG _
som tur är var någon hos sony australien typ ” jo , förresten , märkte ni det här ? ” , säger pall .	som tur vara vara någon hos sony australien typ ” jo , förresten , märka ni det här ? ” , säga pall .	CONJ INDF;MASC+FEM;N;NOM;SG ACT;FIN;IND;PRS;V ACT;FIN;IND;PST;V INDF;MASC+FEM;PRO;SG ADP NOM;PROPN NOM;PROPN INDF;MASC+FEM;N;NOM;SG _ INTJ _ ADV _ ACT;FIN;IND;PST;V DEF;MASC+FEM;NOM;PRO;SG DEF;NEUT;PRO;SG ADV _ _ _ ACT;FIN;IND;PRS;V INDF;MASC+FEM;N;NOM;SG _
en mångfald av germanska och stora slaviska stammar korsade genom mähren under folkvandringsperioden innan slaverna etablerade sig under 500-talet e.kr.	en mångfald av germansk och stor slavisk stam korsa genom mähren under folkvandringsperiod innan slav etablera sig under 500-tal e.kr.	DET;INDF;MASC+FEM;SG INDF;MASC+FEM;N;NOM;SG ADP ADJ;NOM;PL CONJ ADJ;NOM;PL ADJ;NOM;PL INDF;MASC+FEM;N;NOM;PL ACT;FIN;IND;PST;V ADP NOM;PROPN ADP DEF;MASC+FEM;N;NOM;SG CONJ DEF;MASC+FEM;N;NOM;PL ACT;FIN;IND;PST;V ACC;DEF;PRO ADP DEF;N;NEUT;NOM;SG ADV
1519 blev han härskare över det habsburgska kejsardömet och fick titeln helig romersk kejsare 1530 .	1519 bli han härskare över den habsburgsk kejsardöme och få titel helig romersk kejsare 1530 .	NOM;NUM ACT;FIN;IND;PST;V DEF;MASC+FEM;NOM;PRO;SG INDF;MASC+FEM;N;NOM;SG ADP DEF;DET;NEUT;SG ADJ;DEF;NOM;SG DEF;N;NEUT;NOM;SG CONJ ACT;FIN;IND;PST;V DEF;MASC+FEM;N;NOM;SG ADJ;INDF;MASC+FEM;NOM;SG ADJ;INDF;MASC+FEM;NOM;SG INDF;MASC+FEM;N;NOM;SG NOM;NUM _
han återhämtade sig och skrevs ut från sjukhuset 11 april , vilket gjorde honom till första sittande president att överleva att bli skjuten i ett lönnmordsförsök .	han återhämta sig och skriva ut från sjukhus 11 april , vilket göra han till första sittande president att överleva att bli skjuten i en lönnmordsförsök .	DEF;MASC+FEM;NOM;PRO;SG ACT;FIN;IND;PST;V ACC;DEF;PRO CONJ FIN;IND;PASS;PST;V ADV ADP DEF;N;NEUT;NOM;SG NOM;NUM INDF;MASC+FEM;N;NOM;SG _ INDF;NEUT;PRO;SG ACT;FIN;IND;PST;V ACC;DEF;MASC+FEM;PRO;SG ADP ADJ;NOM ADJ;IND;NOM;PRS;V.PTCP INDF;MASC+FEM;N;NOM;SG PART ACT;NFIN;V PART ACT;NFIN;V ADJ;INDF;MASC+FEM;NOM;PST;SG;V.PTCP ADP DET;INDF;NEUT;SG INDF;N;NEUT;NOM;SG _
tillbaka på tåget fortsätter vi söderut .	tillbaka på tåg fortsätta vi söderut .	ADV ADP DEF;N;NEUT;NOM;SG ACT;FIN;IND;PRS;V DEF;MASC+FEM;NOM;PL;PRO ADV _
jag vet inte varför jag valde henne ...	jag veta inte varför jag välja hon …	DEF;MASC+FEM;NOM;PRO;SG ACT;FIN;IND;PRS;V NEG;PART ADV DEF;MASC+FEM;NOM;PRO;SG ACT;FIN;IND;PST;V ACC;DEF;MASC+FEM;PRO;SG _
det är valet , så klart , inte ” game of thrones ” .	det vara val , så klart , inte ” game of thrones ” .	DEF;NEUT;PRO;SG ACT;FIN;IND;PRS;V DEF;N;NEUT;NOM;SG _ ADV ADV _ NEG;PART _ INDF;N;NEUT;NOM;SG NOM;PROPN NOM;PROPN _ _
nationella reaktioner på händelserna i kansas visade hur djupt delat landet hade blivit .	nationell reaktion på händelse i kansas visa hur djupt delad land ha bliva .	ADJ;NOM;PL INDF;MASC+FEM;N;NOM;PL ADP DEF;MASC+FEM;N;NOM;PL ADP NOM;PROPN ACT;FIN;IND;PST;V ADV ADV ADJ;INDF;NEUT;NOM;PST;SG;V.PTCP DEF;N;NEUT;NOM;SG ACT;FIN;IND;PST;V ACT;V;V.CVB _
