adidas hjälper till att städa jordens hav genom att använda det skräp som flyter omkring i världen för att göra skor .	adidas hjälpa till att städa jord hav genom att använda den skräp som flyta omkring i värld för att göra sko .	NOM;PROPN ACT;FIN;IND;PRS;V ADP PART ACT;NFIN;V DEF;GEN;MASC+FEM;N;SG INDF;N;NEUT;NOM;SG ADP PART ACT;NFIN;V DEF;DET;NEUT;SG INDF;N;NEUT;NOM;SG PRO ACT;FIN;IND;PRS;V ADV ADP DEF;MASC+FEM;N;NOM;SG ADP PART ACT;NFIN;V INDF;MASC+FEM;N;NOM;PL _
australiens royal national park , upprättad 1879 , var världens andra officiellt upprättade nationalpark .	australien royal national park , upprättad 1879 , vara värld andra officiellt upprättad nationalpark .	GEN;PROPN NOM;PROPN NOM;PROPN NOM;PROPN _ ADJ;INDF;MASC+FEM;NOM;PST;SG;V.PTCP NOM;NUM _ ACT;FIN;IND;PST;V DEF;GEN;MASC+FEM;N;SG ADJ;NOM ADV ADJ;DEF;NOM;PST;SG;V.PTCP INDF;MASC+FEM;N;NOM;SG _
dareios högt skattade befälhavare megabazus hade ansvaret för att fullborda erövringen i balkan .	dareios högt skattad befälhavare megabazus ha ansvar för att fullborda erövring i balkan .	NOM;PROPN ADV ADJ;DEF;NOM;PST;SG;V.PTCP INDF;MASC+FEM;N;NOM;SG NOM;PROPN ACT;FIN;IND;PST;V DEF;N;NEUT;NOM;SG ADP PART ACT;NFIN;V DEF;MASC+FEM;N;NOM;SG ADP NOM;PROPN _
von beust rättfärdigade kostnadsökningarna som en brist på detaljerad planering .	von beust rättfärdiga kostnadsökning som en brist på detaljerad planering .	NOM;PROPN NOM;PROPN ACT;FIN;IND;PST;V DEF;MASC+FEM;N;NOM;PL ADP DET;INDF;MASC+FEM;SG INDF;MASC+FEM;N;NOM;SG ADP ADJ;INDF;MASC+FEM;NOM;PST;SG;V.PTCP INDF;MASC+FEM;N;NOM;SG _
jordbruksmark kan faktiskt lida av förstörelsen av det omgivande landskapet .	jordbruksmark kunna faktiskt lida av förstörelse av den omgivande landskap .	INDF;MASC+FEM;N;NOM;SG ACT;FIN;IND;PRS;V ADV ACT;NFIN;V ADP DEF;MASC+FEM;N;NOM;SG ADP DEF;DET;NEUT;SG ADJ;IND;NOM;PRS;V.PTCP DEF;N;NEUT;NOM;SG _
resultatet sedan är knappast något kalas .	resultat sedan vara knappast någon kalas .	DEF;N;NEUT;NOM;SG ADV ACT;FIN;IND;PRS;V ADV;NEG;RL DET;INDF;NEUT;SG INDF;N;NEUT;NOM;SG _
uppsatsen , utgiven som undersea , var en livfull berättelse om en resa längs havets botten .	uppsats , utgiven som undersea , vara en livfull berättelse om en resa längs hav botten .	DEF;MASC+FEM;N;NOM;SG _ ADJ;INDF;MASC+FEM;NOM;PST;SG;V.PTCP ADP NOM;PROPN _ ACT;FIN;IND;PST;V DET;INDF;MASC+FEM;SG ADJ;INDF;MASC+FEM;NOM;SG INDF;MASC+FEM;N;NOM;SG ADP DET;INDF;MASC+FEM;SG INDF;MASC+FEM;N;NOM;SG ADP DEF;GEN;N;NEUT;SG INDF;MASC+FEM;N;NOM;SG _
han påpekade också att rogers nyligen introducerade ett nytt appverktyg som hjälper kunder att övervaka sin dataanvändning .	han påpeka också att rogers nyligen introducera en ny appverktyg som hjälpa kund att övervaka sin dataanvändning .	DEF;MASC+FEM;NOM;PRO;SG ACT;FIN;IND;PST;V ADV CONJ NOM;PROPN ADV ACT;FIN;IND;PST;V DET;INDF;NEUT;SG ADJ;INDF;NEUT;NOM;SG INDF;N;NEUT;NOM;SG PRO ACT;FIN;IND;PRS;V INDF;MASC+FEM;N;NOM;PL PART ACT;NFIN;V DEF;MASC+FEM;PRO;SG INDF;MASC+FEM;N;NOM;SG _
chaleten brann ner fullständigt .	chaleten brinna ner fullständigt .	DEF;MASC+FEM;N;NOM;SG ACT;FIN;IND;PST;V ADV ADV _
den utropades till naturskyddsområde 1975 .	den utropa till naturskyddsområde 1975 .	DEF;MASC+FEM;PRO;SG FIN;IND;PASS;PST;V ADP INDF;N;NEUT;NOM;SG NOM;NUM _
trots publiceringen av ett foto i morse säger polisen i b.c. att de har fler frågor än svar i ett fall där en till synes hemlös man åtalas för en dödlig knivattack på en tonårig flicka vid hennes high school i abbotsford .	trots publicering av en foto i morse säga polis i b.c. att de ha fler fråga än svar i en fall där en till synes hemlös man åtala för en dödlig knivattack på en tonårig flicka vid hennes high school i abbotsford .	ADP DEF;MASC+FEM;N;NOM;SG ADP DET;INDF;NEUT;SG INDF;N;NEUT;NOM;SG ADP N ACT;FIN;IND;PRS;V DEF;MASC+FEM;N;NOM;SG ADP NOM;PROPN CONJ DEF;NOM;PL;PRO ACT;FIN;IND;PRS;V ADJ;INDF;NOM;PL INDF;MASC+FEM;N;NOM;PL ADP INDF;N;NEUT;NOM;PL ADP DET;INDF;NEUT;SG INDF;N;NEUT;NOM;SG ADV INDF;MASC+FEM;PRO;SG ADP N ADJ;INDF;MASC+FEM;NOM;SG INDF;MASC+FEM;N;NOM;SG FIN;IND;PASS;PRS;V ADP DET;INDF;MASC+FEM;SG ADJ;INDF;MASC+FEM;NOM;SG INDF;MASC+FEM;N;NOM;SG ADP DET;INDF;MASC+FEM;SG ADJ;INDF;MASC+FEM;NOM;SG INDF;MASC+FEM;N;NOM;SG ADP DEF;PRO N NOM;PROPN ADP NOM;PROPN _
i fallet med kejsarfamiljen anses det extremt olämpligt att använda förnamnet .	i fall med kejsarfamilj anse det extremt olämpligt att använda förnamn .	ADP DEF;N;NEUT;NOM;SG ADP DEF;MASC+FEM;N;NOM;SG FIN;IND;PASS;PRS;V DEF;NEUT;PRO;SG ADV ADV PART ACT;NFIN;V DEF;N;NEUT;NOM;SG _
lite mer än 70 % av plantorna som odlats med jordfröer var vid liv efter 17 dagar – bara lite mer än plantorna som odlats från rymdfröer – just över 66 % .	litet mycket än 70 % av planta som odla med jordfröer vara vid liv efter 17 dag – bara litet mycket än planta som odla från rymdfröer – just över 66 % .	ADV ADV;CMPR CONJ NOM;NUM N ADP DEF;MASC+FEM;N;NOM;PL PRO PASS;V;V.CVB ADP INDF;MASC+FEM;N;NOM;PL ACT;FIN;IND;PST;V ADP INDF;N;NEUT;NOM;SG ADP NOM;NUM INDF;MASC+FEM;N;NOM;PL _ ADV ADV ADV;CMPR ADP DEF;MASC+FEM;N;NOM;PL PRO PASS;V;V.CVB ADP INDF;MASC+FEM;N;NOM;PL _ ADV ADP NOM;NUM N _
allt eftersom brisbane växte förvärrades flodens tillstånd tills när den som värst inte var mer än ett öppet avlopp och en soptipp .	allt eftersom brisbane växa förvärra flod tillstånd tills när den som illa inte vara mycken än en öppen avlopp och en soptipp .	ADV CONJ NOM;PROPN ACT;FIN;IND;PST;V FIN;IND;PASS;PST;V DEF;GEN;MASC+FEM;N;SG INDF;N;NEUT;NOM;SG CONJ CONJ DEF;MASC+FEM;PRO;SG CONJ ADV;RL NEG;PART ACT;FIN;IND;PST;V ADJ;CMPR;NOM ADP DET;INDF;NEUT;SG ADJ;INDF;NEUT;NOM;SG INDF;N;NEUT;NOM;SG CONJ DET;INDF;MASC+FEM;SG INDF;MASC+FEM;N;NOM;SG _
kühn kan bara skaka på huvudet .	kühn kunna bara skaka på huvud .	NOM;PROPN ACT;FIN;IND;PRS;V ADV ACT;NFIN;V ADP DEF;N;NEUT;NOM;SG _
konsumenten kan öka efterfrågan på förändring .	konsument kunna öka efterfrågan på förändring .	DEF;MASC+FEM;N;NOM;SG ACT;FIN;IND;PRS;V ACT;NFIN;V DEF;MASC+FEM;N;NOM;SG ADP INDF;MASC+FEM;N;NOM;SG _
detta kommer sätta nya begränsningar för de klimatförändringar som skedde över jorden och för så många arter – inte bara dinosaurierna – innebar undergången .	detta komma sätta ny begränsning för den klimatförändring som ske över jord och för så mången art – inte bara dinosaurie – innebära undergång .	DEF;NEUT;PRO;SG ACT;FIN;IND;PRS;V ACT;NFIN;V ADJ;NOM;PL INDF;MASC+FEM;N;NOM;PL ADP DEF;DET;PL INDF;MASC+FEM;N;NOM;PL PRO ACT;FIN;IND;PST;V ADP DEF;MASC+FEM;N;NOM;SG CONJ ADP ADV ADJ;NOM;PL INDF;MASC+FEM;N;NOM;PL _ NEG;PART ADV DEF;MASC+FEM;N;NOM;PL _ ACT;FIN;IND;PST;V DEF;MASC+FEM;N;NOM;SG _
dündar varnade europa för att ha för mycket förståelse för erdogans sätt .	dündag varna europa för att ha för mycken förståelse för erdogan sätt .	INDF;MASC+FEM;N;NOM;PL ACT;FIN;IND;PST;V NOM;PROPN ADP PART ACT;NFIN;V ADV ADJ;INDF;NEUT;NOM;SG INDF;MASC+FEM;N;NOM;SG ADP GEN;PROPN INDF;N;NEUT;NOM;SG _
detta är också den enda regionen i alaska med medeltopptemperatur över fryspunkten under vintermånaderna .	detta vara också den enda region i alaska med medeltopptemperatur över fryspunkt under vintermånad .	DEF;NEUT;PRO;SG ACT;FIN;IND;PRS;V ADV DEF;DET;MASC+FEM;SG ADJ;NOM DEF;MASC+FEM;N;NOM;SG ADP NOM;PROPN ADP INDF;MASC+FEM;N;NOM;SG ADP DEF;MASC+FEM;N;NOM;SG ADP DEF;MASC+FEM;N;NOM;PL _
det bör inte finnas något företräde i regeringens tillgänglighet , eller sken av företräde i tillgängligheten , som tilldelas individer eller organisationer för att de har givit finansiella bidrag till politiker och politiska partier , lyder riktlinjerna .	det böra inte finnas någon företräde i regering tillgänglighet , eller sken av företräde i tillgänglighet , som tilldela individ eller organisation för att de ha giva finansiell bidrag till politiker och politisk parti , lyda riktlinje .	DEF;NEUT;PRO;SG ACT;FIN;IND;PRS;V NEG;PART NFIN;PASS;V DET;INDF;NEUT;SG INDF;N;NEUT;NOM;SG ADP DEF;GEN;MASC+FEM;N;SG INDF;MASC+FEM;N;NOM;SG _ CONJ INDF;N;NEUT;NOM;SG ADP INDF;N;NEUT;NOM;SG ADP DEF;MASC+FEM;N;NOM;SG _ PRO FIN;IND;PASS;PRS;V INDF;MASC+FEM;N;NOM;PL CONJ INDF;MASC+FEM;N;NOM;PL ADP CONJ DEF;NOM;PL;PRO ACT;FIN;IND;PRS;V ACT;V;V.CVB ADJ;NOM;PL INDF;N;NEUT;NOM;PL ADP INDF;MASC+FEM;N;NOM;PL CONJ ADJ;NOM;PL INDF;N;NEUT;NOM;PL _ ACT;FIN;IND;PRS;V DEF;MASC+FEM;N;NOM;PL _
det centrala utrymmet användes för att observera solens och fullmånens uppgång .	den central utrymme använda för att observera sol och fullmåne uppgång .	DEF;DET;NEUT;SG ADJ;DEF;NOM;SG DEF;N;NEUT;NOM;SG FIN;IND;PASS;PST;V ADP PART ACT;NFIN;V DEF;GEN;MASC+FEM;N;SG CONJ DEF;GEN;MASC+FEM;N;SG INDF;MASC+FEM;N;NOM;SG _
är det tillåtet för arbetare att ha religiösa föremål på sina skrivbord ?	vara det tillåten för arbetare att ha religiös föremål på sin skrivbord ?	ACT;FIN;IND;PRS;V DEF;NEUT;PRO;SG ADJ;INDF;NEUT;NOM;PST;SG;V.PTCP ADP INDF;MASC+FEM;N;NOM;PL PART ACT;NFIN;V ADJ;NOM;PL INDF;N;NEUT;NOM;PL ADP DEF;PL;PRO INDF;N;NEUT;NOM;PL _
rspb:s ståndpunkt har även gjort att det kommit i konflikt med flera ledande naturvårdare , från namninsamlingens författare mark avery till tv-presentatören chris packham .	rspb ståndpunkt ha även göra att det komma i konflikt med flera ledande naturvårdare , från namninsamling författare mark avery till tv-presentatör chris packham .	GEN;N INDF;MASC+FEM;N;NOM;SG ACT;FIN;IND;PRS;V ADV ACT;V;V.CVB CONJ DEF;NEUT;PRO;SG ACT;V;V.CVB ADP INDF;MASC+FEM;N;NOM;SG ADP ADJ;INDF;NOM;PL ADJ;IND;NOM;PRS;V.PTCP INDF;MASC+FEM;N;NOM;SG _ ADP DEF;GEN;MASC+FEM;N;SG INDF;MASC+FEM;N;NOM;SG NOM;PROPN NOM;PROPN ADP DEF;MASC+FEM;N;NOM;SG NOM;PROPN NOM;PROPN _
liberaldemokraterna , som representerade den välbärgade förorten fram till 2010 , hoppas att rycka tillbaka den med sin kandidat sarah olney .	liberaldemokrat , som representera den välbärgad förort fram till 2010 , hoppas att rycka tillbaka den med sin kandidat sarah olney .	DEF;MASC+FEM;N;NOM;PL _ PRO ACT;FIN;IND;PST;V DEF;DET;MASC+FEM;SG ADJ;DEF;NOM;PST;SG;V.PTCP DEF;MASC+FEM;N;NOM;SG ADV ADP NOM;NUM _ FIN;IND;PASS;PRS;V PART ACT;NFIN;V ADV DEF;MASC+FEM;PRO;SG ADP DEF;MASC+FEM;PRO;SG INDF;MASC+FEM;N;NOM;SG NOM;PROPN NOM;PROPN _
han spelade humphrey bogarts yngre bror , en sorglös playboy , i sabrina ( 1954 ) mot audrey hepburn .	han spela humphrey bogart ung bror , en sorglös playboy , i sabrina ( 1954 ) mot audrey hepburn .	DEF;MASC+FEM;NOM;PRO;SG ACT;FIN;IND;PST;V NOM;PROPN GEN;PROPN ADJ;CMPR;NOM INDF;MASC+FEM;N;NOM;SG _ DET;INDF;MASC+FEM;SG ADJ;INDF;MASC+FEM;NOM;SG INDF;MASC+FEM;N;NOM;SG _ ADP NOM;PROPN _ NOM;NUM _ ADP NOM;PROPN NOM;PROPN _
nevadas industriella produktion består av turism , gruvdrift , maskinindustri , tryckeri och förlag , livsmedelstillverkning och elektronisk utrustning .	nevada industriell produktion bestå av turism , gruvdrift , maskinindustri , tryckeri och förlag , livsmedelstillverkning och elektronisk utrustning .	GEN;PROPN ADJ;DEF;NOM;SG INDF;MASC+FEM;N;NOM;SG ACT;FIN;IND;PRS;V ADP INDF;MASC+FEM;N;NOM;SG _ INDF;MASC+FEM;N;NOM;SG _ INDF;MASC+FEM;N;NOM;SG _ INDF;N;NEUT;NOM;SG CONJ INDF;N;NEUT;NOM;SG _ INDF;MASC+FEM;N;NOM;SG CONJ ADJ;INDF;MASC+FEM;NOM;SG INDF;MASC+FEM;N;NOM;SG _
den höga höjden hjälper till att svalka klimatet , som annars skulle vara mycket varmt .	den hög höjd hjälpa till att svalka klimat , som annars skola vara mycket varm .	DEF;DET;MASC+FEM;SG ADJ;DEF;NOM;SG DEF;MASC+FEM;N;NOM;SG ACT;FIN;IND;PRS;V ADP PART ACT;NFIN;V DEF;N;NEUT;NOM;SG _ PRO ADV ACT;FIN;IND;PST;V ACT;NFIN;V ADV ADJ;INDF;NEUT;NOM;SG _
tyvärr har en snabb befolkningstillväxt och stadsspridning täckt mycket av dessa ekosystem med bebyggelse .	tyvärr ha en snabb befolkningstillväxt och stadsspridning täcka mycket av denna ekosystem med bebyggelse .	ADV ACT;FIN;IND;PRS;V DET;INDF;MASC+FEM;SG ADJ;INDF;MASC+FEM;NOM;SG INDF;MASC+FEM;N;NOM;SG CONJ INDF;MASC+FEM;N;NOM;SG ACT;V;V.CVB INDF;NEUT;PRO;SG ADP DEF;DET;PL INDF;N;NEUT;NOM;PL ADP INDF;MASC+FEM;N;NOM;SG _
han befordrades till ordförande i oktober 2015 , månaden efter att skandalen uppdagades .	han befordra till ordförande i oktober 2015 , månad efter att skandal uppdaga .	DEF;MASC+FEM;NOM;PRO;SG FIN;IND;PASS;PST;V ADP INDF;MASC+FEM;N;NOM;SG ADP INDF;MASC+FEM;N;NOM;SG NOM;NUM _ DEF;MASC+FEM;N;NOM;SG ADP CONJ DEF;MASC+FEM;N;NOM;SG FIN;IND;PASS;PST;V _
granskningen undersöker också uppviglande facebook-meddelanden från september som påstås komma från poliser i staden i norra ontario .	granskning undersöka också uppviglande facebook-meddeland från september som påstå komma från polis i stad i norr ontario .	DEF;MASC+FEM;N;NOM;SG ACT;FIN;IND;PRS;V ADV ADJ;IND;NOM;PRS;V.PTCP DEF;N;NEUT;NOM;PL ADP INDF;MASC+FEM;N;NOM;SG PRO FIN;IND;PASS;PRS;V ACT;NFIN;V ADP INDF;MASC+FEM;N;NOM;PL ADP DEF;MASC+FEM;N;NOM;SG ADP ADJ;DEF;NOM;SG NOM;PROPN _
detta kort ger ett underhåll som kan tas ut från bankomater för att köpa nödvändiga skolartiklar såsom böcker och uniformer .	denna kort ge en underhåll som kunna ta ut från bankomat för att köpa nödvändig skolartikel såsom bok och uniform .	DEF;DET;NEUT;SG INDF;N;NEUT;NOM;SG ACT;FIN;IND;PRS;V DET;INDF;NEUT;SG INDF;N;NEUT;NOM;SG PRO ACT;FIN;IND;PRS;V NFIN;PASS;V ADV ADP INDF;MASC+FEM;N;NOM;PL ADP PART ACT;NFIN;V ADJ;NOM;PL INDF;MASC+FEM;N;NOM;PL CONJ INDF;MASC+FEM;N;NOM;PL CONJ INDF;MASC+FEM;N;NOM;PL _
norman är en av mina bra kompisar , så det sög fullständigt att se honom i det känsloläget .	norman vara en av min bra kompis , så det suga fullständigt att se han i den känsloläge .	NOM;PROPN ACT;FIN;IND;PRS;V INDF;MASC+FEM;PRO;SG ADP DEF;PL;PRO ADJ;NOM INDF;MASC+FEM;N;NOM;PL _ CONJ DEF;NEUT;PRO;SG ACT;FIN;IND;PST;V ADV PART ACT;NFIN;V ACC;DEF;MASC+FEM;PRO;SG ADP DEF;DET;NEUT;SG DEF;N;NEUT;NOM;SG _
på 1900-talet , mellan 1904 och 1914 , frambringade antonio gaudí en reform som varade tio år .	på 1900-tal , mellan 1904 och 1914 , frambringa antonio gaudí en reform som vara tio år .	ADP DEF;N;NEUT;NOM;SG _ ADP NOM;NUM CONJ NOM;NUM _ ACT;FIN;IND;PST;V NOM;PROPN NOM;PROPN DET;INDF;MASC+FEM;SG INDF;MASC+FEM;N;NOM;SG PRO ACT;FIN;IND;PST;V NOM;NUM INDF;N;NEUT;NOM;PL _
jag tror det är därför de fördjupat sig i mönster och färg .	jag tro det vara därför de fördjupa sig i mönster och färg .	DEF;MASC+FEM;NOM;PRO;SG ACT;FIN;IND;PRS;V DEF;NEUT;PRO;SG ACT;FIN;IND;PRS;V ADV DEF;NOM;PL;PRO ACT;V;V.CVB ACC;DEF;PRO ADP INDF;N;NEUT;NOM;SG CONJ INDF;MASC+FEM;N;NOM;SG _
när millican dog antog vi att det var det sista vi skulle se av buggiga , ryckiga odi också .	när millican dö anta vi att det vara den sist vi skola se av buggiga , ryckig odi också .	CONJ NOM;PROPN ACT;FIN;IND;PST;V ACT;FIN;IND;PST;V DEF;MASC+FEM;NOM;PL;PRO CONJ DEF;NEUT;PRO;SG ACT;FIN;IND;PST;V DEF;DET;NEUT;SG ADJ;DEF;NOM;RL DEF;MASC+FEM;NOM;PL;PRO ACT;FIN;IND;PST;V ACT;NFIN;V ADP ADJ;NOM;PL _ ADJ;NOM;PL NOM;PROPN ADV _
expeditionen leddes av general joseph burgoyne som avsåg att nå albany .	expedition leda av general joseph burgoyne som avse att nå albany .	DEF;MASC+FEM;N;NOM;SG FIN;IND;PASS;PST;V ADP INDF;MASC+FEM;N;NOM;SG NOM;PROPN NOM;PROPN PRO ACT;FIN;IND;PST;V PART ACT;NFIN;V NOM;PROPN _
hennes djur enligt zodiaken är apa och året för hennes traditionellt viktiga sextonde födelsedag var 1992 .	hennes djur enligt zodiak vara apa och år för hennes traditionellt viktig sextonde födelsedag vara 1992 .	DEF;PRO INDF;N;NEUT;NOM;PL ADP DEF;MASC+FEM;N;NOM;SG ACT;FIN;IND;PRS;V INDF;MASC+FEM;N;NOM;SG CONJ DEF;N;NEUT;NOM;SG ADP DEF;PRO ADV ADJ;DEF;NOM;SG ADJ;NOM INDF;MASC+FEM;N;NOM;SG ACT;FIN;IND;PST;V NOM;NUM _
man vet inte på vilket sätt de båda dramatikerna skulle ha arbetat tillsammans .	man veta inte på vilken sätt den båda dramatiker skola ha arbeta tillsammans .	INDF;MASC+FEM;NOM;PRO;SG ACT;FIN;IND;PRS;V NEG;PART ADP DET;INDF;NEUT;SG INDF;N;NEUT;NOM;SG DEF;DET;PL ADJ;NOM;PL DEF;MASC+FEM;N;NOM;PL ACT;FIN;IND;PST;V ACT;NFIN;V ACT;V;V.CVB ADV _
i juni 2012 släppte det isländska bandet sigur rós en video till låten ” fjögur píanó ” med labeouf i , där han uppträder naken .	i juni 2012 släppa den isländsk band sigur rós en video till låt ” fjögur píanó ” med labeouf i , där han uppträda naken .	ADP INDF;MASC+FEM;N;NOM;SG NOM;NUM ACT;FIN;IND;PST;V DEF;DET;NEUT;SG ADJ;DEF;NOM;SG DEF;N;NEUT;NOM;SG NOM;PROPN NOM;PROPN DET;INDF;MASC+FEM;SG INDF;MASC+FEM;N;NOM;SG ADP DEF;MASC+FEM;N;NOM;SG _ NOM;PROPN NOM;PROPN _ ADP NOM;PROPN ADP _ ADV DEF;MASC+FEM;NOM;PRO;SG ACT;FIN;IND;PRS;V ADJ;INDF;MASC+FEM;NOM;SG _
vi är så besvikna eftersom vi har tappat sex poäng när vi spelat hemma .	vi vara så besviken eftersom vi ha tappa sex poäng när vi spela hemma .	DEF;MASC+FEM;NOM;PL;PRO ACT;FIN;IND;PRS;V ADV ADJ;NOM;PL CONJ DEF;MASC+FEM;NOM;PL;PRO ACT;FIN;IND;PRS;V ACT;V;V.CVB NOM;NUM INDF;MASC+FEM;N;NOM;PL CONJ DEF;MASC+FEM;NOM;PL;PRO ACT;V;V.CVB ADV _
men cottons mörka dåd uppstod inte på grund av någon sorts tvång att döda .	men cotton mörk dåd uppstå inte på grund av någon sort tvång att döda .	CONJ GEN;PROPN ADJ;DEF;NOM;SG INDF;N;NEUT;NOM;SG ACT;FIN;IND;PST;V NEG;PART ADP INDF;MASC+FEM;N;NOM;SG ADP DET;INDF;MASC+FEM;SG GEN;INDF;MASC+FEM;N;SG INDF;N;NEUT;NOM;SG PART ACT;NFIN;V _
han sade även att klein inte ville kommunicera , samarbeta eller ville gå upp från celler under domstolen för att närvara vid sitt förhör .	han säga även att klein inte vilja kommunicera , samarbeta eller vilja gå upp från cell under domstol för att närvara vid sin förhör .	DEF;MASC+FEM;NOM;PRO;SG ACT;FIN;IND;PST;V ADV CONJ NOM;PROPN NEG;PART ACT;FIN;IND;PST;V ACT;NFIN;V _ ACT;NFIN;V CONJ ACT;FIN;IND;PST;V ACT;NFIN;V ADV ADP INDF;MASC+FEM;N;NOM;PL ADP DEF;MASC+FEM;N;NOM;SG ADP PART ACT;NFIN;V ADP DEF;NEUT;PRO;SG INDF;N;NEUT;NOM;SG _
osmanerna ville förhindra att spannmål fraktas vidare eftersom de hade ett stort behov av det .	osman vilja förhindra att spannmål frakta vidare eftersom de ha en stor behov av det .	DEF;MASC+FEM;N;NOM;PL ACT;FIN;IND;PST;V ACT;NFIN;V CONJ INDF;MASC+FEM;N;NOM;SG FIN;IND;PASS;PRS;V ADV;CMPR CONJ DEF;NOM;PL;PRO ACT;FIN;IND;PST;V DET;INDF;NEUT;SG ADJ;INDF;NEUT;NOM;SG INDF;N;NEUT;NOM;SG ADP DEF;NEUT;PRO;SG _
pengarna som investeras i premieobligationer , och i andra national savings & investments-konton , används för att hjälpa till att finansiera statliga utgifter .	peng som investera i premieobligation , och i annan national saving & investments-konton , använda för att hjälpa till att finansiera statlig utgift .	DEF;MASC+FEM;N;NOM;PL PRO FIN;IND;PASS;PRS;V ADP INDF;MASC+FEM;N;NOM;PL _ CONJ ADP ADJ;DEF;NOM;SG NOM;PROPN GEN;PROPN CONJ NOM;PROPN _ FIN;IND;PASS;PRS;V ADP PART ACT;NFIN;V ADP PART ACT;NFIN;V ADJ;NOM;PL INDF;MASC+FEM;N;NOM;PL _
emellertid blev de genskjutna och tvingades till strid i freeman , nära hudsonfloden .	emellertid bli den genskjuten och tvinga till strid i freema , nära hudsonfloden .	ADV ACT;FIN;IND;PST;V DEF;DET;PL ADJ;NOM;PL;PST;V.PTCP CONJ FIN;IND;PASS;PST;V ADP INDF;MASC+FEM;N;NOM;SG ADP NOM;PROPN _ ADP NOM;PROPN _
en stor rapport i januari sade att haven skulle innehålla mer plast än fisk år 2050 om inte världen vidtog radikala åtgärder för att hindra att skräp läcker ut i haven .	en stor rapport i januari säga att hav skola innehålla mycken plast än fisk år 2050 om inte värld vidta radikal åtgärd för att hindra att skräp läcka ut i hav .	DET;INDF;MASC+FEM;SG ADJ;INDF;MASC+FEM;NOM;SG INDF;MASC+FEM;N;NOM;SG ADP INDF;MASC+FEM;N;NOM;SG ACT;FIN;IND;PST;V CONJ DEF;N;NEUT;NOM;PL ACT;FIN;IND;PST;V ACT;NFIN;V ADJ;CMPR;NOM INDF;MASC+FEM;N;NOM;SG CONJ INDF;MASC+FEM;N;NOM;SG INDF;N;NEUT;NOM;SG NOM;NUM CONJ NEG;PART DEF;MASC+FEM;N;NOM;SG ACT;FIN;IND;PST;V ADJ;NOM;PL INDF;MASC+FEM;N;NOM;PL ADP PART ACT;NFIN;V CONJ INDF;N;NEUT;NOM;SG ACT;FIN;IND;PRS;V ADV ADP DEF;N;NEUT;NOM;PL _
hitchcocks filmer innehåller ibland rollkaraktärer som kämpar med sina förhållanden till sina mödrar .	hitchcock film innehålla ibland rollkaraktär som kämpa med sin förhållande till sin moder .	GEN;PROPN INDF;MASC+FEM;N;NOM;PL ACT;FIN;IND;PRS;V ADV INDF;MASC+FEM;N;NOM;PL PRO ACT;FIN;IND;PRS;V ADP DEF;PL;PRO INDF;N;NEUT;NOM;PL ADP DEF;PL;PRO INDF;MASC+FEM;N;NOM;PL _
1928 uppfördes en golfbana på 90 hektar i den nordöstra delen av parken , intill kapplöpningsbanan .	1928 uppföra en golfbana på 90 hektar i den nordöstra del av park , intill kapplöpningsbana .	NOM;NUM FIN;IND;PASS;PST;V DET;INDF;MASC+FEM;SG INDF;MASC+FEM;N;NOM;SG ADP NOM;NUM INDF;MASC+FEM;N;NOM;PL ADP DEF;DET;MASC+FEM;SG ADJ;DEF;NOM;SG DEF;MASC+FEM;N;NOM;SG ADP DEF;MASC+FEM;N;NOM;SG _ ADP DEF;MASC+FEM;N;NOM;SG _
den norra delen av kaukasus är känd som nordkaukasus och den södra delen känd som transkaukasus .	den norr del av kaukasus vara känd som nordkaukasus och den söder del känd som transkaukasus .	DEF;DET;MASC+FEM;SG ADJ;DEF;NOM;SG DEF;MASC+FEM;N;NOM;SG ADP NOM;PROPN ACT;FIN;IND;PRS;V ADJ;INDF;MASC+FEM;NOM;PST;SG;V.PTCP ADP NOM;PROPN CONJ DEF;DET;MASC+FEM;SG ADJ;DEF;NOM;SG DEF;MASC+FEM;N;NOM;SG ADJ;INDF;MASC+FEM;NOM;PST;SG;V.PTCP CONJ NOM;PROPN _
i nederländerna har myndigheterna tagit till ett lågteknologiskt angreppssätt för att spåra drönare .	i nederländerna ha myndighet ta till en lågteknologisk angreppssätt för att spåra drönare .	ADP NOM;PROPN ACT;FIN;IND;PRS;V DEF;MASC+FEM;N;NOM;PL ACT;V;V.CVB ADP DET;INDF;NEUT;SG ADJ;INDF;NEUT;NOM;SG INDF;N;NEUT;NOM;SG ADP PART ACT;NFIN;V INDF;MASC+FEM;N;NOM;PL _
efter ryska revolutionen 1917 vann några länder , såsom finland , polen och de baltiska staterna , sin självständighet .	efter rysk revolution 1917 vinna någon land , såsom finland , polen och den baltisk stat , sin självständighet .	ADP ADJ;DEF;NOM;SG DEF;MASC+FEM;N;NOM;SG NOM;NUM ACT;FIN;IND;PST;V DET;INDF;PL INDF;N;NEUT;NOM;PL _ CONJ NOM;PROPN _ NOM;PROPN CONJ DEF;DET;PL ADJ;NOM;PL DEF;MASC+FEM;N;NOM;PL _ DEF;MASC+FEM;PRO;SG INDF;MASC+FEM;N;NOM;SG _
på danska kan ordet även tillämpas på grunda laguner .	på danska kunna ord även tillämpa på grund lagun .	ADP INDF;MASC+FEM;N;NOM;SG ACT;FIN;IND;PRS;V DEF;N;NEUT;NOM;SG ADV NFIN;PASS;V ADP ADJ;NOM;PL INDF;MASC+FEM;N;NOM;PL _
en fundamental förändring av arbetsprinciper orsakades av skotten james watt .	en fundamental förändring av arbetsprincip orsaka av skotte james watt .	DET;INDF;MASC+FEM;SG ADJ;INDF;MASC+FEM;NOM;SG INDF;MASC+FEM;N;NOM;SG ADP INDF;MASC+FEM;N;NOM;PL FIN;IND;PASS;PST;V ADP DEF;MASC+FEM;N;NOM;SG NOM;PROPN INDF;MASC+FEM;N;NOM;SG _
denna avdelning står nu inför nya utmaningar .	denna avdelning stå nu inför ny utmaning .	DEF;DET;MASC+FEM;SG INDF;MASC+FEM;N;NOM;SG ACT;FIN;IND;PRS;V ADV ADP ADJ;NOM;PL INDF;MASC+FEM;N;NOM;PL _
vid mitten av 1962 hade brooks och carson i stort sett avslutat redigeringsarbetet och höll på att lägga grunden för att marknadsföra boken genom att skicka ut manuskriptet till utvalda individer för slutliga förslag .	vid mitt av 1962 ha brooks och carson i stor sedd avsluta redigeringsarbete och hålla på att lägga grund för att marknadsföra bok genom att skicka ut manuskript till utvald individ för slutlig förslag .	ADP DEF;MASC+FEM;N;NOM;SG ADP NOM;NUM ACT;FIN;IND;PST;V NOM;PROPN CONJ NOM;PROPN ADP ADJ;INDF;NEUT;NOM;SG ADJ;INDF;NEUT;NOM;PST;SG;V.PTCP ACT;V;V.CVB DEF;N;NEUT;NOM;SG CONJ ACT;FIN;IND;PST;V ADP PART ACT;NFIN;V DEF;MASC+FEM;N;NOM;SG ADP PART ACT;NFIN;V DEF;MASC+FEM;N;NOM;SG ADP PART ACT;NFIN;V ADV DEF;N;NEUT;NOM;SG ADP ADJ;NOM;PL;PST;V.PTCP INDF;MASC+FEM;N;NOM;PL ADP ADJ;NOM;PL INDF;N;NEUT;NOM;PL _
hans färdighet i att få svar för skattebetalarnas räkning kommer att saknas djupt .	hans färdighet i att få svar för skattebetalare räkning komma att sakna djupt .	DEF;PRO INDF;MASC+FEM;N;NOM;SG ADP PART ACT;NFIN;V INDF;N;NEUT;NOM;SG ADP DEF;GEN;MASC+FEM;N;PL INDF;MASC+FEM;N;NOM;SG ACT;FIN;IND;PRS;V PART NFIN;PASS;V ADV _
mönstren som presenteras av datan från petén-regionen och uaxactun gjorde att dessa platser kunde passas in i den kulturella utvecklingen av de mayanska lågländerna .	mönster som presentera av data från petén-region och uaxactun göra att denna plats kunna passa in i den kulturell utveckling av den mayanska lågländ .	DEF;N;NEUT;NOM;PL PRO FIN;IND;PASS;PRS;V ADP DEF;MASC+FEM;N;NOM;SG ADP DEF;MASC+FEM;N;NOM;SG CONJ NOM;PROPN ACT;FIN;IND;PST;V CONJ DEF;DET;PL INDF;MASC+FEM;N;NOM;PL ACT;FIN;IND;PST;V NFIN;PASS;V ADV ADP DEF;DET;MASC+FEM;SG ADJ;DEF;NOM;SG DEF;MASC+FEM;N;NOM;SG ADP DEF;DET;PL ADJ;NOM;PL DEF;MASC+FEM;N;NOM;PL _
under 2010 års allmänna val lyckades arbetarpartiet vinna alla sju röstningsdistrikt .	under 2010 år allmän val lyckas arbetarparti vinna all sju röstningsdistrikt .	ADP NOM;NUM GEN;INDF;N;NEUT;SG ADJ;DEF;NOM;SG INDF;MASC+FEM;N;NOM;SG FIN;IND;PASS;PST;V DEF;N;NEUT;NOM;SG ACT;NFIN;V DET;PL NOM;NUM INDF;N;NEUT;NOM;PL _
dessutom kommer regeringen behöva hantera ännu en ” het potatis ” .	dessutom komma regering behöva hantera ännu en ” het potatis ” .	ADV ACT;FIN;IND;PRS;V DEF;MASC+FEM;N;NOM;SG ACT;NFIN;V ACT;NFIN;V ADV DET;INDF;MASC+FEM;SG _ ADJ;INDF;MASC+FEM;NOM;SG INDF;MASC+FEM;N;NOM;SG _ _
lenny är en ihärdig ungkarl som har otur med kvinnor .	lenny vara en ihärdig ungkarl som ha otur med kvinna .	NOM;PROPN ACT;FIN;IND;PRS;V DET;INDF;MASC+FEM;SG ADJ;INDF;MASC+FEM;NOM;SG INDF;MASC+FEM;N;NOM;SG PRO ACT;FIN;IND;PRS;V INDF;MASC+FEM;N;NOM;SG ADP INDF;MASC+FEM;N;NOM;PL _
då herodes var i jerusalem vid den tidpunkten bestämde pilatus att skicka jesus till herodes för att ställas inför rätta .	då herodes vara i jerusalem vid den tidpunkt bestämma pilatus att skicka jesus till herodes för att ställa inför rätta .	CONJ NOM;PROPN ACT;FIN;IND;PST;V ADP NOM;PROPN ADP DEF;DET;MASC+FEM;SG DEF;MASC+FEM;N;NOM;SG ACT;FIN;IND;PST;V NOM;PROPN PART ACT;NFIN;V NOM;PROPN ADP NOM;PROPN ADP PART NFIN;PASS;V ADP MASC+FEM;N _
