in risposta a i progressi compiuti da il nuovo stato membro interessato in l' adempimento di i propri impegni , la commissione può adeguare opportunamente le misure .	in risposta a il progresso compiere da il nuovo stato membro interessato in il adempimento di il proprio impegno , il commissione potere adeguare opportunamente il misura .	ADP FEM;N;SG ADP DEF;DET;MASC;PL MASC;N;PL MASC;PL;PST;V;V.PTCP ADP DEF;DET;MASC;SG ADJ;MASC;SG MASC;N;SG MASC;N;SG ADJ;MASC;SG ADP DEF;DET;SG MASC;N;SG ADP DEF;DET;MASC;PL DET;MASC;PL MASC;N;PL _ DEF;DET;FEM;SG FEM;N;SG 3;FIN;IND;PRS;SG;V NFIN;V ADV DEF;DET;FEM;PL FEM;N;PL _
tra i diritti di cui sopra si intende compreso il diritto di apportare a l' opera le modifiche che si rendessero tecnicamente necessarie per l' esercizio di detti diritti tramite altri mezzi di comunicazione o su altri formati .	tra il diritto di cui sopra si intendere comprendere il diritto di apportare a il opera il modifica che si rendere tecnicamente necessario per il esercizio di detto diritto tramite altro mezzo di comunicazione o su altro formato .	ADP DEF;DET;MASC;PL MASC;N;PL ADP PRO ADV 3;PRO 3;FIN;IND;PRS;SG;V MASC;PST;SG;V;V.PTCP DEF;DET;MASC;SG MASC;N;SG ADP NFIN;V ADP DEF;DET;SG FEM;N;SG DEF;DET;FEM;PL FEM;N;PL PRO 3;PRO 3;FIN;IPFV;PL;SBJV;V ADV ADJ;FEM;PL ADP DEF;DET;SG MASC;N;SG ADP ADJ;MASC;PL MASC;N;PL ADP ADJ;MASC;PL MASC;N;PL ADP FEM;N;SG CONJ ADP ADJ;MASC;PL MASC;N;PL _
il mandato di uno di i giudici di il tribunale nominati conformemente a il paragrafo 1 scade il 31 agosto 2007 .	il mandato di uno di il giudice di il tribunale nominare conformemente a il paragrafo 1 scadere il 31 agosto 2007 .	DEF;DET;MASC;SG MASC;N;SG ADP MASC;PRO;SG ADP DEF;DET;MASC;PL MASC;N;PL ADP DEF;DET;MASC;SG MASC;N;SG MASC;PL;PST;V;V.PTCP ADV ADP DEF;DET;MASC;SG MASC;N;SG NUM 3;FIN;IND;PRS;SG;V DEF;DET;MASC;SG NUM MASC;N;SG NUM _
ogni individuo ha diritto a la libertà di opinione e di espressione incluso il diritto di non essere molestato per la propria opinione e quello di cercare , ricevere e diffondere informazioni e idee attraverso ogni mezzo e senza riguardo a frontiere .	ogni individuo avere diritto a il libertà di opinione e di espressione includere il diritto di non essere molestare per il proprio opinione e quello di cercare , ricevere e diffondere informazione e idea attraverso ogni mezzo e senza riguardo a frontiera .	DET;SG MASC;N;SG 3;FIN;IND;PRS;SG;V MASC;N;SG ADP DEF;DET;FEM;SG FEM;N ADP FEM;N;SG CONJ ADP FEM;N;SG MASC;PST;SG;V;V.PTCP DEF;DET;MASC;SG MASC;N;SG ADP ADV NFIN;V MASC;PST;SG;V;V.PTCP ADP DEF;DET;FEM;SG DET;FEM;SG FEM;N;SG CONJ MASC;PRO;SG ADP NFIN;V _ NFIN;V CONJ NFIN;V FEM;N;PL CONJ FEM;N;PL ADP DET;SG MASC;N;SG CONJ ADP MASC;N;SG ADP FEM;N;PL _
in seguito , balzac divenne il soggetto di una statua monumentale di lo scultore francese auguste rodin , che si trova vicino a l' intersezione tra boulevard raspail e boulevard montparnasse .	in seguito , balzac divenire il soggetto di uno statua monumentale di il scultore francese auguste rodin , che si trovare vicino a il intersezione tra boulevard raspail e boulevard montparnasse .	ADP MASC;N;SG _ PROPN 3;FIN;IND;PST;SG;V DEF;DET;MASC;SG MASC;N;SG ADP DET;FEM;INDF;SG FEM;N;SG ADJ;SG ADP DEF;DET;MASC;SG MASC;N;SG ADJ;SG PROPN PROPN _ PRO 3;PRO 3;FIN;IND;PRS;SG;V ADP ADP DEF;DET;SG FEM;N;SG ADP PROPN PROPN CONJ PROPN PROPN _
le politiche fiscali e monetarie di gli stati uniti , ad esempio , si baseranno sempre innanzitutto ( e forse dopo tutto ) , su considerazioni di carattere nazionale .	il politica fiscale e monetario di il stati uniti , a esempio , si basare sempre innanzitutto ( e forse dopo tutto ) , su considerazione di carattere nazionale .	DEF;DET;FEM;PL FEM;N;PL ADJ;PL CONJ ADJ;FEM;PL ADP DEF;DET;MASC;PL PROPN PROPN _ ADP MASC;N;SG _ 3;PRO 3;FIN;FUT;IND;PL;V ADV ADV _ CONJ ADV ADP MASC;PRO;SG _ _ ADP FEM;N;PL ADP MASC;N;SG ADJ;SG _
i lavori di ricostruzione , durati mesi , hanno provocato l' interruzione di il transito in questa importante arteria di comunicazione fra il nord e il sud di l' europa .	il lavoro di ricostruzione , durare mese , avere provocare il interruzione di il transito in questo importante arteria di comunicazione fra il nord e il sud di il europa .	DEF;DET;MASC;PL MASC;N;PL ADP FEM;N;SG _ MASC;PL;PST;V;V.PTCP MASC;N;PL _ 3;FIN;IND;PL;PRS;V MASC;PST;SG;V;V.PTCP DEF;DET;SG FEM;N;SG ADP DEF;DET;MASC;SG MASC;N;SG ADP DET;FEM;SG ADJ;SG FEM;N;SG ADP FEM;N;SG ADP DEF;DET;MASC;SG MASC;N;SG CONJ DEF;DET;MASC;SG MASC;N;SG ADP DEF;DET;SG PROPN _
qualora tu crei una collezione di opere , su richiesta di qualsiasi licenziante , devi rimuovere da la collezione di opere stessa , ove materialmente possibile , ogni riferimento a tale licenziante o , su richiesta di qualsiasi autore originario , a tale autore originario , come da richiesta .	qualora tu creare uno collezione di opere , su richiesta di qualsiasi licenziante , dovere rimuovere da il collezione di opera stesso , ove materialmente possibile , ogni riferimento a tale licenziante o , su richiesta di qualsiasi autore originario , a tale autore originario , come da richiesta .	CONJ 2;PRO;SG 2;FIN;IND;PRS;SG;V DET;FEM;INDF;SG FEM;N;SG ADP PROPN _ ADP FEM;N;SG ADP DET;SG MASC;N;SG _ 2;FIN;IND;PRS;SG;V NFIN;V ADP DEF;DET;FEM;SG FEM;N;SG ADP FEM;N;PL ADJ;FEM;SG _ ADV ADV ADJ;SG _ DET;SG MASC;N;SG ADP DET;SG PROPN CONJ _ ADP FEM;N;SG ADP DET;SG MASC;N;SG ADJ;MASC;SG _ ADP DET;SG MASC;N;SG ADJ;MASC;SG _ ADP ADP FEM;N;SG _
gli standard di vita di tutto il mondo continuano a crescere .	il standard di vita di tutto il mondo continuare a crescere .	DEF;DET;MASC;PL MASC;N ADP FEM;N;SG ADP DET;MASC;SG DEF;DET;MASC;SG MASC;N;SG 3;FIN;IND;PL;PRS;V ADP NFIN;V _
in l' originale johannes factotum , " un tuttofare " , indica uno stagnino di seconda categoria che lavora con le opere di gli altri , piuttosto che indicare un " genio universale " .	in il originale johannes factotum , " uno tuttofare " , indicare uno stagnino di secondo categoria che lavorare con il opera di il altro , piuttosto che indicare uno " genio universale " .	ADP DEF;DET;SG ADJ;SG PROPN PROPN _ _ DET;INDF;MASC;SG N _ _ 3;FIN;IND;PRS;SG;V MASC;PRO;SG MASC;N;SG ADP ADJ;FEM;SG FEM;N;SG PRO 3;FIN;IND;PRS;SG;V ADP DEF;DET;FEM;PL FEM;N;PL ADP DEF;DET;MASC;PL MASC;PL;PRO _ ADV CONJ NFIN;V DET;INDF;MASC;SG _ MASC;N;SG ADJ;SG _ _
sostiene ( in un discorso da il titolo rivelatore " il contributo di il settore finanziario : miracolo o miraggio ? " ) che il contributo riportato di il settore finanziario a il pil è stato fortemente sovrastimato .	sostenere ( in uno discorso da il titolo rivelatore " il contributo di il settore finanziario : miracolo o miraggio ? " ) che il contributo riportare di il settore finanziario a il pil essere essere fortemente sovrastimare .	3;FIN;IND;PRS;SG;V _ ADP DET;INDF;MASC;SG MASC;N;SG ADP DEF;DET;MASC;SG MASC;N;SG ADJ;MASC;SG _ DEF;DET;MASC;SG MASC;N;SG ADP DEF;DET;MASC;SG MASC;N;SG ADJ;MASC;SG _ MASC;N;SG CONJ MASC;N;SG _ _ _ CONJ DEF;DET;MASC;SG MASC;N;SG MASC;PST;SG;V;V.PTCP ADP DEF;DET;MASC;SG MASC;N;SG ADJ;MASC;SG ADP DEF;DET;MASC;SG MASC;N 3;FIN;IND;PRS;SG;V MASC;PST;SG;V;V.PTCP ADV MASC;PST;SG;V;V.PTCP _
la mancanza di linee direttrici specifiche qui si fa sentire con particolare intensità , dato che l' idea di collegare gli aiuti di il fondo sociale a la strategia per l' occupazione verrà realizzata per la prima volta durante il periodo di programmazione 2000 - 2006 .	il mancanza di linea direttore specifico qui si fare sentire con particolare intensità , dato che il idea di collegare il aiuto di il fondo sociale a il strategia per il occupazione venire realizzare per il primo volta durante il periodo di programmazione 2000 - 2006 .	DEF;DET;FEM;SG FEM;N;SG ADP FEM;N;PL ADJ;FEM;PL ADJ;FEM;PL ADV 3;PRO 3;FIN;IND;PRS;SG;V NFIN;V ADP ADJ;SG FEM;N _ MASC;PST;SG;V;V.PTCP CONJ DEF;DET;SG FEM;N;SG ADP NFIN;V DEF;DET;MASC;PL MASC;N;PL ADP DEF;DET;MASC;SG MASC;N;SG ADJ;SG ADP DEF;DET;FEM;SG FEM;N;SG ADP DEF;DET;SG FEM;N;SG 3;FIN;FUT;IND;SG;V FEM;PST;SG;V;V.PTCP ADP DEF;DET;FEM;SG ADJ;FEM;SG FEM;N;SG ADP DEF;DET;MASC;SG MASC;N;SG ADP FEM;N;SG NUM _ NUM _
ma la povertà e l' ignoranza possono vanificare anche le migliori intenzioni .	ma il povertà e il ignoranza potere vanificare anche il migliore intenzione .	CONJ DEF;DET;FEM;SG FEM;N CONJ DEF;DET;SG FEM;N;SG 3;FIN;IND;PL;PRS;V NFIN;V ADV DEF;DET;FEM;PL ADJ;CMPR;PL FEM;N;PL _
infatti , anche in le civiltà antiche , un' adeguata nutrizione materna era ritenuta essenziale per garantire la sopravvivenza e la prosperità di le generazioni future .	infatti , anche in il civiltà antico , uno adeguato nutrizione materno essere ritenere essenziale per garantire il sopravvivenza e il prosperità di il generazione futuro .	ADV _ ADV ADP DEF;DET;FEM;PL FEM;N ADJ;FEM;PL _ DET;FEM;INDF;SG ADJ;FEM;SG FEM;N;SG ADJ;FEM;SG 3;FIN;IND;IPFV;SG;V FEM;PST;SG;V;V.PTCP ADJ;SG ADP NFIN;V DEF;DET;FEM;SG FEM;N;SG CONJ DEF;DET;FEM;SG FEM;N ADP DEF;DET;FEM;PL FEM;N;PL ADJ;FEM;PL _
un terzo poema narrativo , il lamento di un amante , in cui una giovane donna è afflitta perchè sedotta da un pretendente persecutorio , venne incluso in la prima edizione di i sonetti in il 1609 .	uno terzo poema narrativo , il lamento di uno amante , in cui uno giovane donna essere affliggere perché sedurre da uno pretendente persecutorio , venire includere in il primo edizione di il sonetto in il 1609 .	DET;INDF;MASC;SG ADJ;MASC;SG MASC;N;SG ADJ;MASC;SG _ DEF;DET;MASC;SG MASC;N;SG ADP DET;INDF;MASC;SG N;SG _ ADP PRO DET;FEM;INDF;SG ADJ;SG FEM;N;SG 3;FIN;IND;PRS;SG;V FEM;PST;SG;V;V.PTCP CONJ FEM;PST;SG;V;V.PTCP ADP DET;INDF;MASC;SG N;SG ADJ;MASC;SG _ 3;FIN;IND;PST;SG;V MASC;PST;SG;V;V.PTCP ADP DEF;DET;FEM;SG ADJ;FEM;SG FEM;N;SG ADP DEF;DET;MASC;PL MASC;N;PL ADP DEF;DET;MASC;SG NUM _
la maggior parte di i drammaturghi di il periodo tipicamente collaboravano gli uni con gli altri in qualche modo , e i critici concordano su il fatto che shakespeare fece lo stesso , principalmente a gli inizi e su il finire di la sua carriera .	il maggiore parte di il drammaturgo di il periodo tipicamente collaborare il uno con il altro in qualche modo , e il critico concordare su il fatto che shakespeare fare il stesso , principalmente a il inizio e su il finire di il suo carriera .	DEF;DET;FEM;SG ADJ;CMPR;SG FEM;N;SG ADP DEF;DET;MASC;PL MASC;N;PL ADP DEF;DET;MASC;SG MASC;N;SG ADV 3;FIN;IND;IPFV;PL;V DEF;DET;MASC;PL 3;MASC;PL;PRO ADP DEF;DET;MASC;PL MASC;PL;PRO ADP DET;SG MASC;N;SG _ CONJ DEF;DET;MASC;PL MASC;N;PL 3;FIN;IND;PL;PRS;V ADP DEF;DET;MASC;SG MASC;N;SG CONJ PROPN 3;FIN;IND;PST;SG;V DEF;DET;MASC;SG MASC;PRO;SG _ ADV ADP DEF;DET;MASC;PL MASC;N;PL CONJ ADP DEF;DET;MASC;SG NFIN;V ADP DEF;DET;FEM;SG DET;FEM;SG FEM;N;SG _
con le inserzioni di facebook , creare e gestire in modo rapido le campagne pubblicitarie è semplice e conveniente .	con il inserzione di facebook , creare e gestire in modo rapido il campagna pubblicitario essere semplice e conveniente .	ADP DEF;DET;FEM;PL FEM;N;PL ADP PROPN _ NFIN;V CONJ NFIN;V ADP MASC;N;SG ADJ;MASC;SG DEF;DET;FEM;PL FEM;N;PL ADJ;FEM;PL 3;FIN;IND;PRS;SG;V ADJ;SG CONJ ADJ;SG _
rispose acquistando un' inserzione segreta in la gazzetta di francia , sperando che la sua critica anonima la trovasse .	rispondere acquistare uno inserzione segreto in il gazzetta di francia , sperare che il suo critico anonimo la trovare .	3;FIN;IND;PST;SG;V V;V.MSDR DET;FEM;INDF;SG FEM;N;SG ADJ;FEM;SG ADP DEF;DET;FEM;SG FEM;N;SG ADP PROPN _ V;V.MSDR CONJ DEF;DET;FEM;SG DET;FEM;SG FEM;N;SG ADJ;FEM;SG 3;FEM;PRO;SG 3;FIN;IPFV;SBJV;SG;V _
ora , un delfino , madre delfino , ogni delfino - c' è un solo modo in cui un pcb possa uscire da il delfino .	ora , uno delfino , madre delfino , ogni delfino - ci essere uno solo modo in cui uno pcb potere uscire da il delfino .	ADV _ DET;INDF;MASC;SG MASC;N;SG _ FEM;N;SG MASC;N;SG _ DET;SG MASC;N;SG _ PRO 3;FIN;IND;PRS;SG;V DET;INDF;MASC;SG ADJ;MASC;SG MASC;N;SG ADP PRO DET;INDF;MASC;SG PROPN 3;FIN;PRS;SBJV;SG;V NFIN;V ADP DEF;DET;MASC;SG MASC;N;SG _
costruisci una comunità attorno a la tua attività .	costruire uno comunità attorno a il tuo attività .	2;FIN;IND;PRS;SG;V DET;FEM;INDF;SG FEM;N ADP ADP DEF;DET;FEM;SG DET;FEM;SG FEM;N _
spetta ora a le agenzie governative facilitar ne lo sviluppo .	spettare ora a il agenzia governativo facilitare ne lo sviluppo .	3;FIN;IND;PRS;SG;V ADV ADP DEF;DET;FEM;PL FEM;N;PL ADJ;FEM;PL NFIN;V PRO 3;MASC;PRO;SG MASC;N;SG _
questo , insieme a la mancanza di una rete previdenziale pubblica , rende i problemi sanitari una fonte di difficoltà economica anche per le famiglie di la classe media .	questo , insieme a il mancanza di uno rete previdenziale pubblico , rendere il problema sanitario uno fonte di difficoltà economico anche per il famiglia di il classe medio .	MASC;PRO;SG _ ADP ADP DEF;DET;FEM;SG FEM;N;SG ADP DET;FEM;INDF;SG FEM;N;SG ADJ;SG ADJ;FEM;SG _ 3;FIN;IND;PRS;SG;V DEF;DET;MASC;PL MASC;N;PL ADJ;MASC;PL DET;FEM;INDF;SG FEM;N;SG ADP FEM;N ADJ;FEM;SG ADV ADP DEF;DET;FEM;PL FEM;N;PL ADP DEF;DET;FEM;SG FEM;N;SG ADJ;FEM;SG _
- il programma ha contribuito a migliorare la consapevolezza di la dimensione comunitaria di l' euro ;	- il programma avere contribuire a migliorare il consapevolezza di il dimensione comunitario di il euro ;	_ DEF;DET;MASC;SG MASC;N;SG 3;FIN;IND;PRS;SG;V MASC;PST;SG;V;V.PTCP ADP NFIN;V DEF;DET;FEM;SG FEM;N;SG ADP DEF;DET;FEM;SG FEM;N;SG ADJ;FEM;SG ADP DEF;DET;SG MASC;N _
( 3 ) la progettazione ecologica di i prodotti costituisce un fattore essenziale di la strategia comunitaria su la politica integrata di i prodotti .	( 3 ) il progettazione ecologico di il prodotto costituire uno fattore essenziale di il strategia comunitario su il politica integrato di il prodotto .	_ NUM _ DEF;DET;FEM;SG FEM;N;SG ADJ;FEM;SG ADP DEF;DET;MASC;PL MASC;N;PL 3;FIN;IND;PRS;SG;V DET;INDF;MASC;SG MASC;N;SG ADJ;SG ADP DEF;DET;FEM;SG FEM;N;SG ADJ;FEM;SG ADP DEF;DET;FEM;SG FEM;N;SG ADJ;FEM;SG ADP DEF;DET;MASC;PL MASC;N;PL _
mi rallegro che si sia raggiunta un' intesa con il consiglio in materia di requisiti minimi per gli esami di i consulenti per la sicurezza , sebbene avrei preferito che fossero stati formulati norme e programmi uniformi atti a garantire l' uguaglianza di i diplomi a livello internazionale .	mi rallegrare che si essere raggiungere uno intesa con il consiglio in materia di requisito minimo per il esame di il consulente per il sicurezza , sebbene avere preferire che essere essere formulare norma e programma uniforme atto a garantire il uguaglianza di il diploma a livello internazionale .	1;PRO;SG 1;FIN;IND;PRS;SG;V CONJ 3;PRO 3;FIN;PRS;SBJV;SG;V FEM;PST;SG;V;V.PTCP DET;FEM;INDF;SG FEM;N;SG ADP DEF;DET;MASC;SG MASC;N;SG ADP FEM;N;SG ADP MASC;N;PL ADJ;MASC;PL ADP DEF;DET;MASC;PL MASC;N;PL ADP DEF;DET;MASC;PL N;PL ADP DEF;DET;FEM;SG FEM;N;SG _ CONJ 1;COND;FIN;PRS;SG;V MASC;PST;SG;V;V.PTCP CONJ 3;FIN;IPFV;PL;SBJV;V MASC;PL;PST;V;V.PTCP MASC;PL;PST;V;V.PTCP FEM;N;PL CONJ MASC;N;PL ADJ;PL ADJ;MASC;PL ADP NFIN;V DEF;DET;SG FEM;N;SG ADP DEF;DET;MASC;PL MASC;N;PL ADP MASC;N;SG ADJ;SG _
come articolare la politica di l' unione con le politiche nazionali sussidiarie di gestione di il territorio .	come articolare il politica di il unione con il politica nazionale sussidiario di gestione di il territorio .	CONJ NFIN;V DEF;DET;FEM;SG FEM;N;SG ADP DEF;DET;SG FEM;N;SG ADP DEF;DET;FEM;PL FEM;N;PL ADJ;PL ADJ;FEM;PL ADP FEM;N;SG ADP DEF;DET;MASC;SG MASC;N;SG _
la minaccia di le zanzare .	il minaccia di il zanzara .	DEF;DET;FEM;SG FEM;N;SG ADP DEF;DET;FEM;PL FEM;N;PL _
spero di sfatare questo pregiudizio per sempre , con voi .	sperare di sfatare questo pregiudizio per sempre , con voi .	1;FIN;IND;PRS;SG;V ADP NFIN;V DET;MASC;SG MASC;N;SG ADP ADV _ ADP 2;PL;PRO _
creative commons non è responsabile in i tuoi confronti o in i confronti di altre parti ad alcun titolo per alcun danno , incluso , senza limitazioni , qualsiasi danno generale , speciale , incidentale o consequenziale che sorga in connessione a la presente licenza .	creativo commons non essere responsabile in il tuo confronto o in il confronto di altro parte a alcuno titolo per alcuno danno , includere , senza limitazione , qualsiasi danno generale , speciale , incidentale o consequenziale che sorgere in connessione a il presente licenza .	ADJ;FEM;PL PROPN ADV 3;FIN;IND;PRS;SG;V ADJ;SG ADP DEF;DET;MASC;PL DET;MASC;PL MASC;N;PL CONJ ADP DEF;DET;MASC;PL MASC;N;PL ADP ADJ;FEM;PL FEM;N;PL ADP DET;MASC;SG MASC;N;SG ADP DET;MASC;SG MASC;N;SG _ MASC;PST;SG;V;V.PTCP _ ADP FEM;N;PL _ DET;SG MASC;N;SG ADJ;SG _ ADJ;SG _ ADJ;SG CONJ ADJ;SG PRO 3;FIN;PRS;SBJV;SG;V ADP FEM;N;SG ADP DEF;DET;FEM;SG ADJ;SG FEM;N;SG _
( 34 ) la direttiva 92 / 42 / cee di il consiglio , di il 21 maggio 1992 , concernente i requisiti di rendimento per le nuove caldaie ad acqua calda alimentate con combustibili liquidi o gassosi [ 13 ] , la direttiva 96 / 57 / ce di il parlamento europeo e di il consiglio , di il 3 settembre 1996 , su i requisiti di rendimento energetico di frigoriferi , congelatori e loro combinazioni di uso domestico [ 14 ] , e la direttiva 2000 / 55 / ce di il parlamento europeo e di il consiglio , di il 18 settembre 2000 , su i requisiti di efficienza energetica di gli alimentatori per lampade fluorescenti [ 15 ] , che già contengono disposizioni in merito a la revisione di i requisiti di rendimento energetico , devono essere integrate in il presente quadro .	( 34 ) il direttiva 92 / 42 / cee di il consiglio , di il 21 maggio 1992 , concernere il requisito di rendimento per il nuovo caldaia a acqua caldo alimentare con combustibile liquido o gassoso [ 13 ] , il direttiva 96 / 57 / ce di il parlamento europeo e di il consiglio , di il 3 settembre 1996 , su il requisito di rendimento energetico di frigorifero , congelatore e loro combinazione di uso domestico [ 14 ] , e il direttiva 2000 / 55 / ce di il parlamento europeo e di il consiglio , di il 18 settembre 2000 , su il requisito di efficienza energetico di il alimentatore per lampada fluorescente [ 15 ] , che già contenere disposizione in merito a il revisione di il requisito di rendimento energetico , dovere essere integrare in il presente quadro .	_ NUM _ DEF;DET;FEM;SG FEM;N;SG NUM _ NUM _ PROPN ADP DEF;DET;MASC;SG MASC;N;SG _ ADP DEF;DET;MASC;SG NUM MASC;N;SG NUM _ PRS;SG;V;V.PTCP DEF;DET;MASC;PL MASC;N;PL ADP MASC;N;SG ADP DEF;DET;FEM;PL ADJ;FEM;PL FEM;N;PL ADP FEM;N;SG ADJ;FEM;SG FEM;PL;PST;V;V.PTCP ADP MASC;N;PL ADJ;MASC;PL CONJ ADJ;MASC;PL _ NUM _ _ DEF;DET;FEM;SG FEM;N;SG NUM _ NUM _ PROPN ADP DEF;DET;MASC;SG MASC;N;SG ADJ;MASC;SG CONJ ADP DEF;DET;MASC;SG MASC;N;SG _ ADP DEF;DET;MASC;SG NUM MASC;N;SG NUM _ ADP DEF;DET;MASC;PL MASC;N;PL ADP MASC;N;SG ADJ;MASC;SG ADP MASC;N;PL _ MASC;N;PL CONJ DET FEM;N;PL ADP MASC;N;SG ADJ;MASC;SG _ NUM _ _ CONJ DEF;DET;FEM;SG FEM;N;SG NUM _ NUM _ PROPN ADP DEF;DET;MASC;SG MASC;N;SG ADJ;MASC;SG CONJ ADP DEF;DET;MASC;SG MASC;N;SG _ ADP DEF;DET;MASC;SG NUM MASC;N;SG NUM _ ADP DEF;DET;MASC;PL MASC;N;PL ADP FEM;N;SG ADJ;FEM;SG ADP DEF;DET;MASC;PL MASC;N;PL ADP FEM;N;PL ADJ;PL _ NUM _ _ PRO ADV 3;FIN;IND;PL;PRS;V FEM;N;PL ADP MASC;N;SG ADP DEF;DET;FEM;SG FEM;N;SG ADP DEF;DET;MASC;PL MASC;N;PL ADP MASC;N;SG ADJ;MASC;SG _ 3;FIN;IND;PL;PRS;V NFIN;V FEM;PL;PST;V;V.PTCP ADP DEF;DET;MASC;SG ADJ;SG MASC;N;SG _
le scrisse in un linguaggio ricercato che non sempre scaturisce in modo naturale da le necessità di i personaggi o di l' opera .	le scrivere in uno linguaggio ricercato che non sempre scaturire in modo naturale da il necessità di il personaggio o di il opera .	3;FEM;PRO;SG 3;FIN;IND;PST;SG;V ADP DET;INDF;MASC;SG MASC;N;SG ADJ;MASC;SG PRO ADV ADV 3;FIN;IND;PRS;SG;V ADP MASC;N;SG ADJ;SG ADP DEF;DET;FEM;PL FEM;N ADP DEF;DET;MASC;PL MASC;N;PL CONJ ADP DEF;DET;SG FEM;N;SG _
in la nostra economia di il " vincitore prende tutto " , una società innovatrice che sviluppa un migliore sito web per gli acquisti online e la consegna di cibo per cani può attirare chiunque in il mondo utilizzi internet per ordinare cibo per cani , facendo enormi profitti .	in il nostro economia di il " vincitore prendere tutto " , uno società innovatore che sviluppare uno migliore sito web per il acquisto online e il consegna di cibo per cane potere attirare chiunque in il mondo utilizzare internet per ordinare cibo per cane , fare enorme profitto .	ADP DEF;DET;FEM;SG DET;FEM;SG FEM;N;SG ADP DEF;DET;MASC;SG _ MASC;N;SG 3;FIN;IND;PRS;SG;V MASC;PRO;SG _ _ DET;FEM;INDF;SG FEM;N ADJ;FEM;SG PRO 3;FIN;IND;PRS;SG;V DET;INDF;MASC;SG ADJ;CMPR;SG MASC;N;SG MASC;N ADP DEF;DET;MASC;PL MASC;N;PL ADJ CONJ DEF;DET;FEM;SG FEM;N;SG ADP MASC;N;SG ADP MASC;N;PL 3;FIN;IND;PRS;SG;V NFIN;V PRO;SG ADP DEF;DET;MASC;SG MASC;N;SG 2;FIN;IND;PRS;SG;V N ADP NFIN;V MASC;N;SG ADP MASC;N;PL _ V;V.MSDR ADJ;PL MASC;N;PL _
in brasile , un programma televisivo su il ruolo che la supplementazione di acido folico potrebbe svolgere in la prevenzione di la spina bifida ( un difetto congenito di il tubo neurale ) ha subito catturato l' attenzione di i politici .	in brasile , uno programma televisivo su il ruolo che il supplementazione di acido folico potere svolgere in il prevenzione di il spina bifida ( uno difetto congenito di il tubo neurale ) avere subito catturare il attenzione di il politico .	ADP PROPN _ DET;INDF;MASC;SG MASC;N;SG ADJ;MASC;SG ADP DEF;DET;MASC;SG MASC;N;SG PRO DEF;DET;FEM;SG FEM;N;SG ADP MASC;N;SG ADJ;MASC;SG 3;COND;FIN;PRS;SG;V NFIN;V ADP DEF;DET;FEM;SG FEM;N;SG ADP DEF;DET;FEM;SG FEM;N;SG ADJ;FEM;SG _ DET;INDF;MASC;SG MASC;N;SG ADJ;MASC;SG ADP DEF;DET;MASC;SG MASC;N;SG ADJ;PL _ 3;FIN;IND;PRS;SG;V ADV MASC;PST;SG;V;V.PTCP DEF;DET;SG FEM;N;SG ADP DEF;DET;MASC;PL MASC;N;PL _
da il canto loro , gli stati uniti hanno fatto affidamento su i prodotti cinesi a basso costo per aumentare il potere d' acquisto di i consumatori ormai provati .	da il canto loro , il stati uniti avere fare affidamento su il prodotto cinese a basso costo per aumentare il potere di acquisto di il consumatore ormai provare .	ADP DEF;DET;MASC;SG MASC;N;SG DET _ DEF;DET;MASC;PL PROPN PROPN 3;FIN;IND;PL;PRS;V MASC;PST;SG;V;V.PTCP MASC;N;SG ADP DEF;DET;MASC;PL MASC;N;PL ADJ;PL ADP ADJ;MASC;SG MASC;N;SG ADP NFIN;V DEF;DET;MASC;SG MASC;N;SG ADP MASC;N;SG ADP DEF;DET;MASC;PL MASC;N;PL ADV MASC;PL;PST;V;V.PTCP _
e non è il kosovo , che divenne indipendente in lo stesso momento in cui venivano forgiate le sue strutture governative .	e non essere il kosovo , che divenire indipendente in il stesso momento in cui venire forgiare il suo struttura governativo .	CONJ ADV 3;FIN;IND;PRS;SG;V DEF;DET;MASC;SG PROPN _ PRO 3;FIN;IND;PST;SG;V ADJ;SG ADP DEF;DET;MASC;SG ADJ;MASC;SG MASC;N;SG ADP PRO 3;FIN;IND;IPFV;PL;V FEM;PL;PST;V;V.PTCP DEF;DET;FEM;PL DET;FEM;PL FEM;N;PL ADJ;FEM;PL _
in una risposta a la petizione di i partecipanti in il 1635 cuthbert burbage dichiarò che , dopo l' acquisto e l' affitto di il blackfriars theatre in il 1608 da parte di henry evans , la king's men sistemò lì di gli attori , tra i quali c' erano heminges , condell , shakespeare , ecc .	in uno risposta a il petizione di il partecipante in il 1635 cuthbert burbage dichiarare che , dopo il acquisto e il affitto di il blackfriars theatre in il 1608 da parte di henry evans , il king's men sistemare lì di il attore , tra il quale ci essere heminges , condell , shakespeare , eccetera .	ADP DET;FEM;INDF;SG FEM;N;SG ADP DEF;DET;FEM;SG FEM;N;SG ADP DEF;DET;MASC;PL N;PL ADP DEF;DET;MASC;SG NUM PROPN PROPN 3;FIN;IND;PST;SG;V CONJ _ ADP DEF;DET;SG MASC;N;SG CONJ DEF;DET;SG MASC;N;SG ADP DEF;DET;MASC;SG PROPN PROPN ADP DEF;DET;MASC;SG NUM ADP FEM;N;SG ADP PROPN PROPN _ DEF;DET;FEM;SG _ _ 3;FIN;IND;PST;SG;V ADV ADP DEF;DET;MASC;PL MASC;N;PL _ ADP DEF;DET;MASC;PL PL;PRO PRO 3;FIN;IND;IPFV;PL;V PROPN _ PROPN _ PROPN _ ADV _
i ritardi in i lavori di il cen hanno comportato problemi in l' applicazione di la suddetta direttiva .	il ritardo in il lavoro di il cen avere comportare problema in il applicazione di il suddetto direttiva .	DEF;DET;MASC;PL MASC;N;PL ADP DEF;DET;MASC;PL MASC;N;PL ADP DEF;DET;MASC;SG PROPN 3;FIN;IND;PL;PRS;V MASC;PST;SG;V;V.PTCP MASC;N;PL ADP DEF;DET;SG FEM;N;SG ADP DEF;DET;FEM;SG ADJ;FEM;SG FEM;N;SG _
ad esempio gli imponenti discorsi in tito andronico , secondo alcuni critici , spesso rafforzano l' azione ;	a esempio il imponente discorso in tito andronico , secondo alcuno critico , spesso rafforzare il azione ;	ADP MASC;N;SG DEF;DET;MASC;PL ADJ;PL MASC;N;PL ADP PROPN PROPN _ ADP DET;MASC;PL MASC;N;PL _ ADV 3;FIN;IND;PL;PRS;V DEF;DET;SG FEM;N;SG _
il critico george steiner ha descritto tutti i drammi in versi da coleridge a tennyson come " deboli variazioni su i temi shakespeariani " .	il critico george steiner avere descrivere tutto il dramma in verso da coleridge a tennyson come " debole variazione su il tema shakespeariani " .	DEF;DET;MASC;SG MASC;N;SG PROPN PROPN 3;FIN;IND;PRS;SG;V MASC;PST;SG;V;V.PTCP DET;MASC;PL DEF;DET;MASC;PL MASC;N;PL ADP MASC;N;PL ADP PROPN ADP PROPN ADP _ ADJ;PL FEM;N;PL ADP DEF;DET;MASC;PL MASC;N;PL ADJ;MASC;PL _ _
