non vi è dubbio che i principali programmi ue attuati fra il 1989 , il 1993 , il 1994 e il 1999 abbiano contribuito a migliorare la competitività economica di i paesi periferici e di le regioni di l' obiettivo 1. l' essenziale adesso è consolidare i progressi fatti finora e render li irreversibili , in modo da garantire che i paesi periferici e le regioni ultraperiferiche , le regioni più deboli in europa , possano operare con successo sia in la nuova zona di l' euro che in il mercato unico , che è in continua espansione e in cui la libera circolazione di merci , persone , servizi e capitali è ormai una realtà .	non vi essere dubbio che il principale programma ue attuare fra il 1989 , il 1993 , il 1994 e il 1999 avere contribuire a migliorare il competitività economico di il paese periferico e di il regione di il obiettivo 1. il essenziale adesso essere consolidare il progresso fare finora e rendere li irreversibile , in modo da garantire che il paese periferico e il regione ultraperiferiche , il regione più debole in europa , potere operare con successo sia in il nuovo zona di il euro che in il mercato unico , che essere in continuo espansione e in cui il libero circolazione di merce , persona , servizio e capitale essere ormai uno realtà .	ADV PRO 3;FIN;IND;PRS;SG;V MASC;N;SG CONJ DEF;DET;MASC;PL ADJ;PL MASC;N;PL PROPN MASC;PL;PST;V;V.PTCP ADP DEF;DET;MASC;SG NUM _ DEF;DET;MASC;SG NUM _ DEF;DET;MASC;SG NUM CONJ DEF;DET;MASC;SG NUM 3;FIN;PL;PRS;SBJV;V MASC;PST;SG;V;V.PTCP ADP NFIN;V DEF;DET;FEM;SG FEM;N ADJ;FEM;SG ADP DEF;DET;MASC;PL MASC;N;PL ADJ;MASC;PL CONJ ADP DEF;DET;FEM;PL FEM;N;PL ADP DEF;DET;SG MASC;N;SG NUM DEF;DET;SG ADJ;SG ADV 3;FIN;IND;PRS;SG;V NFIN;V DEF;DET;MASC;PL MASC;N;PL MASC;PL;PST;V;V.PTCP ADV CONJ NFIN;V 3;MASC;PL;PRO ADJ;PL _ ADP MASC;N;SG ADP NFIN;V CONJ DEF;DET;MASC;PL MASC;N;PL ADJ;MASC;PL CONJ DEF;DET;FEM;PL FEM;N;PL ADJ;FEM;PL _ DEF;DET;FEM;PL FEM;N;PL ADV ADJ;PL ADP PROPN _ 3;FIN;PL;PRS;SBJV;V NFIN;V ADP MASC;N;SG CONJ ADP DEF;DET;FEM;SG ADJ;FEM;SG FEM;N;SG ADP DEF;DET;SG MASC;N CONJ ADP DEF;DET;MASC;SG MASC;N;SG ADJ;MASC;SG _ PRO 3;FIN;IND;PRS;SG;V ADP ADJ;FEM;SG FEM;N;SG CONJ ADP PRO DEF;DET;FEM;SG ADJ;FEM;SG FEM;N;SG ADP FEM;N;PL _ FEM;N;PL _ MASC;N;PL CONJ FEM;N;PL 3;FIN;IND;PRS;SG;V ADV DET;FEM;INDF;SG FEM;N _
( 18 ) a i fini di la valutazione di accordi volontari o di altre misure di autoregolamentazione presentate come alternative a le misure di esecuzione , dovrebbe essere garantita l' informazione almeno su i seguenti punti :	( 18 ) a il fine di il valutazione di accordo volontario o di altro misura di autoregolamentazione presentare come alternativa a il misura di esecuzione , dovere essere garantire il informazione almeno su il seguente punto :	_ NUM _ ADP DEF;DET;MASC;PL MASC;N;PL ADP DEF;DET;FEM;SG FEM;N;SG ADP MASC;N;PL ADJ;MASC;PL CONJ ADP ADJ;FEM;PL FEM;N;PL ADP FEM;N;SG FEM;PL;PST;V;V.PTCP ADP FEM;N;PL ADP DEF;DET;FEM;PL FEM;N;PL ADP FEM;N;SG _ 3;COND;FIN;PRS;SG;V NFIN;V FEM;PST;SG;V;V.PTCP DEF;DET;SG FEM;N;SG ADV ADP DEF;DET;MASC;PL ADJ;PL MASC;N;PL _
e alcuni erano carne di balena pescata illegalmente .	e alcuno essere carne di balena pescare illegalmente .	CONJ MASC;PL;PRO 3;FIN;IND;IPFV;PL;V FEM;N;SG ADP FEM;N;SG FEM;PST;SG;V;V.PTCP ADV _
come ha detto il ministro indiano per il commercio , anand sharma , " è necessario fornire a i paesi in via di sviluppo le flessibilità inerenti " .	come avere dire il ministro indiano per il commercio , anand sharma , " essere necessario fornire a il paese in via di sviluppo il flessibilità inerente " .	CONJ 3;FIN;IND;PRS;SG;V MASC;PST;SG;V;V.PTCP DEF;DET;MASC;SG MASC;N;SG ADJ;MASC;SG ADP DEF;DET;MASC;SG MASC;N;SG _ PROPN PROPN _ _ 3;FIN;IND;PRS;SG;V ADJ;MASC;SG NFIN;V ADP DEF;DET;MASC;PL MASC;N;PL ADP FEM;N;SG ADP MASC;N;SG DEF;DET;FEM;PL FEM;N ADJ;PL _ _
in riferimento a gli aspetti di la protezione di l' euro di competenza di gli stati membri , sono stati sistematicamente consultati gli esperti di i rispettivi servizi specializzati .	in riferimento a il aspetto di il protezione di il euro di competenza di il stato membro , essere essere sistematicamente consultare il esperto di il rispettivo servizio specializzato .	ADP MASC;N;SG ADP DEF;DET;MASC;PL MASC;N;PL ADP DEF;DET;FEM;SG FEM;N;SG ADP DEF;DET;SG MASC;N ADP FEM;N;SG ADP DEF;DET;MASC;PL MASC;N;PL MASC;N;PL _ 3;FIN;IND;PL;PRS;V MASC;PL;PST;V;V.PTCP ADV MASC;PL;PST;V;V.PTCP DEF;DET;MASC;PL MASC;N;PL ADP DEF;DET;MASC;PL ADJ;MASC;PL MASC;N;PL ADJ;MASC;PL _
non è , infatti , né auspicabile né fattibile per la cina mantenere il trend di il 10 % di crescita annua che ha caratterizzato i tre decenni successivi a il 1980 .	non essere , infatti , né auspicabile né fattibile per il cina mantenere il trend di il 10 % di crescita annuo che avere caratterizzare il tre decennio successivo a il 1980 .	ADV 3;FIN;IND;PRS;SG;V _ ADV _ CONJ ADJ;SG CONJ ADJ;SG ADP DEF;DET;FEM;SG PROPN NFIN;V DEF;DET;MASC;SG MASC;N ADP DEF;DET;MASC;SG NUM _ ADP FEM;N;SG ADJ;FEM;SG PRO 3;FIN;IND;PRS;SG;V MASC;PST;SG;V;V.PTCP DEF;DET;MASC;PL NUM MASC;N;PL ADJ;MASC;PL ADP DEF;DET;MASC;SG NUM _
se l' assemblea è d' accordo seguirò il suggerimento di l' onorevole evans .	se il assemblea essere di accordo seguire il suggerimento di il onorevole evans .	CONJ DEF;DET;SG FEM;N;SG 3;FIN;IND;PRS;SG;V ADP MASC;N;SG 1;FIN;FUT;IND;SG;V DEF;DET;MASC;SG MASC;N;SG ADP DEF;DET;SG N;SG PROPN _
la sua inesperienza e mancanza di fondi causarono la sua rovina in queste attività .	il suo inesperienza e mancanza di fondo causare il suo rovina in questo attività .	DEF;DET;FEM;SG DET;FEM;SG FEM;N;SG CONJ FEM;N;SG ADP MASC;N;PL 3;FIN;IND;PL;PST;V DEF;DET;FEM;SG DET;FEM;SG FEM;N;SG ADP DET;FEM;PL FEM;N _
il mio piede sta coprendo oltre 480 chilometri di micelio .	il mio piede stare coprire oltre 480 chilometro di micelio .	DEF;DET;MASC;SG DET;MASC;SG MASC;N;SG 3;FIN;IND;PRS;SG;V V;V.MSDR ADV NUM MASC;N;PL ADP MASC;N;SG _
- i destinatari di il programma sono stati raggiunti solo parzialmente :	- il destinatario di il programma essere essere raggiungere solo parzialmente :	_ DEF;DET;MASC;PL MASC;N;PL ADP DEF;DET;MASC;SG MASC;N;SG 3;FIN;IND;PL;PRS;V MASC;PL;PST;V;V.PTCP MASC;PL;PST;V;V.PTCP ADV ADV _
forse il pil non coglie realmente i miglioramenti in gli standard di vita generati da l' innovazione in l' era informatica .	forse il pil non cogliere realmente il miglioramento in il standard di vita generare da il innovazione in il era informatico .	ADV DEF;DET;MASC;SG MASC;N ADV 3;FIN;IND;PRS;SG;V ADV DEF;DET;MASC;PL MASC;N;PL ADP DEF;DET;MASC;PL MASC;N ADP FEM;N;SG MASC;PL;PST;V;V.PTCP ADP DEF;DET;SG FEM;N;SG ADP DEF;DET;SG FEM;N;SG ADJ;FEM;SG _
prima e durante la sua carriera di scrittore , provò a fare l' editore , lo stampatore , l' uomo d' affari , il critico e il politico ;	prima e durante il suo carriera di scrittore , provare a fare il editore , il stampatore , il uomo di affare , il critico e il politico ;	ADV CONJ ADP DEF;DET;FEM;SG DET;FEM;SG FEM;N;SG ADP MASC;N;SG _ 3;FIN;IND;PST;SG;V ADP NFIN;V DEF;DET;SG MASC;N;SG _ DEF;DET;MASC;SG MASC;N;SG _ DEF;DET;SG MASC;N;SG ADP MASC;N;PL _ DEF;DET;MASC;SG MASC;N;SG CONJ DEF;DET;MASC;SG MASC;N;SG _
fu rimpiazzato da robert armin a cavallo di il xvi secolo , che recitò in parti come quella di touchstone in come vi piace e quella di il pazzo in re lear .	essere rimpiazzare da robert armin a cavallo di il sedicesimo secolo , che recitare in parte come quello di touchstone in come vi piacere e quello di il pazzo in re lear .	3;FIN;IND;PST;SG;V MASC;PST;SG;V;V.PTCP ADP PROPN PROPN ADP MASC;N;SG ADP DEF;DET;MASC;SG ADJ;SG MASC;N;SG _ PRO 3;FIN;IND;PST;SG;V ADP FEM;N;PL ADP FEM;PRO;SG ADP PROPN ADP ADP 2;PL;PRO 2;FIN;IND;PL;PRS;V CONJ FEM;PRO;SG ADP DEF;DET;MASC;SG ADJ;MASC;SG ADP PROPN PROPN _
l' incremento di i margini , di le garanzie di sicurezza in i trasporti è un processo che deve continuare a migliorare giorno dopo giorno .	il incremento di il margine , di il garanzia di sicurezza in il trasporto essere uno processo che dovere continuare a migliorare giorno dopo giorno .	DEF;DET;SG MASC;N;SG ADP DEF;DET;MASC;PL MASC;N;PL _ ADP DEF;DET;FEM;PL FEM;N;PL ADP FEM;N;SG ADP DEF;DET;MASC;PL MASC;N;PL 3;FIN;IND;PRS;SG;V DET;INDF;MASC;SG MASC;N;SG PRO 3;FIN;IND;PRS;SG;V NFIN;V ADP NFIN;V MASC;N;SG ADP MASC;N;SG _
" i vittoriani produssero le sue opere come degli spettacoli sfarzosi , su ampia scala .	" il vittoriani produrre il suo opera come di spettacolo sfarzoso , su ampio scala .	_ DEF;DET;MASC;PL MASC;N;PL 3;FIN;IND;PL;PST;V DEF;DET;FEM;PL DET;FEM;PL FEM;N;PL ADP DET;MASC;PL MASC;N;PL ADJ;MASC;PL _ ADP ADJ;FEM;SG FEM;N;SG _
signora presidente , intervengo per una mozione d' ordine .	signore presidente , intervenire per uno mozione di ordine .	FEM;N;SG N;SG _ 1;FIN;IND;PRS;SG;V ADP DET;FEM;INDF;SG FEM;N;SG ADP MASC;N;SG _
balzac fu sepolto a il cimitero di père lachaise a parigi .	balzac essere seppellire a il cimitero di père lachaise a parigi .	PROPN 3;FIN;IND;PST;SG;V MASC;PST;SG;V;V.PTCP ADP DEF;DET;MASC;SG MASC;N;SG ADP PROPN PROPN ADP PROPN _
e tutto questo è ancor più problematico in il caso di il controllo di le zanzare vista l' urgenza di il problema .	e tutto questo essere ancora più problematico in il caso di il controllo di il zanzara vedere il urgenza di il problema .	CONJ DET;MASC;SG MASC;PRO;SG 3;FIN;IND;PRS;SG;V ADV ADV ADJ;MASC;SG ADP DEF;DET;MASC;SG MASC;N;SG ADP DEF;DET;MASC;SG MASC;N;SG ADP DEF;DET;FEM;PL FEM;N;PL FEM;PST;SG;V;V.PTCP DEF;DET;SG FEM;N;SG ADP DEF;DET;MASC;SG MASC;N;SG _
occorre sufficiente flessibilità per consentire che tali fattori siano integrati in la progettazione di i prodotti pur tenendo conto di gli aspetti economici , tecnici e funzionali .	occorrere sufficiente flessibilità per consentire che tale fattore essere integrare in il progettazione di il prodotto pure tenere conto di il aspetto economico , tecnico e funzionale .	3;FIN;IND;PRS;SG;V ADJ;SG FEM;N ADP NFIN;V CONJ DET;PL MASC;N;PL 3;FIN;PL;PRS;SBJV;V MASC;PL;PST;V;V.PTCP ADP DEF;DET;FEM;SG FEM;N;SG ADP DEF;DET;MASC;PL MASC;N;PL ADV V;V.MSDR MASC;N;SG ADP DEF;DET;MASC;PL MASC;N;PL ADJ;MASC;PL _ ADJ;MASC;PL CONJ ADJ;PL _
cimbelino , il racconto d' inverno e la tempesta , così come pericle , principe di tiro , romance frutto di una collaborazione .	cimbelino , il racconto di inverno e il tempesta , così come pericle , principe di tiro , romance frutto di uno collaborazione .	PROPN _ DEF;DET;MASC;SG MASC;N;SG ADP MASC;N;SG CONJ DEF;DET;FEM;SG FEM;N;SG _ ADV ADP PROPN _ MASC;N;SG ADP PROPN _ FEM;N;SG MASC;N;SG ADP DET;FEM;INDF;SG FEM;N;SG _
5 . dichiarazioni , garanzie ed esonero da responsabilità .	5 . dichiarazione , garanzia e esonero da responsabilità .	NUM _ FEM;N;PL _ FEM;N;PL CONJ MASC;N;SG ADP FEM;N _
davvero l' ucraina dovrebbe essere costretta a creare un nuovo ordine costituzionale basato su la grande menzogna ?	davvero il ucraina dovere essere costringere a creare uno nuovo ordine costituzionale basato su il grande menzogna ?	ADV DEF;DET;SG PROPN 3;COND;FIN;PRS;SG;V NFIN;V FEM;PST;SG;V;V.PTCP ADP NFIN;V DET;INDF;MASC;SG ADJ;MASC;SG MASC;N;SG ADJ;SG ADJ;MASC;SG ADP DEF;DET;FEM;SG ADJ;SG FEM;N;SG _
l' uso che balzac fa di personaggi ripetuti , che entrano e escono da i libri di la comédie , rinforza la rappresentazione realista .	il uso che balzac fare di personaggio ripetuto , che entrare e uscire da il libro di il comédie , rinforzare il rappresentazione realista .	DEF;DET;SG MASC;N;SG PRO PROPN 3;FIN;IND;PRS;SG;V ADP MASC;N;PL ADJ;MASC;PL _ PRO 3;FIN;IND;PL;PRS;V CONJ 3;FIN;IND;PL;PRS;V ADP DEF;DET;MASC;PL MASC;N;PL ADP DEF;DET;FEM;SG PROPN _ 3;FIN;IND;PRS;SG;V DEF;DET;FEM;SG FEM;N;SG ADJ;FEM;SG _
una su l' incontrollabile desiderio per una donna sposata da la carnagione scura ( la " dark lady " ) , e una su l' amore conflittuale per un bel ragazzo ( il " fair youth " ) .	uno su il incontrollabile desiderio per uno donna sposare da il carnagione scuro ( il " dark lady " ) , e uno su il amore conflittuale per uno bello ragazzo ( il " fair youth " ) .	FEM;PRO;SG ADP DEF;DET;SG ADJ;SG MASC;N;SG ADP DET;FEM;INDF;SG FEM;N;SG FEM;PST;SG;V;V.PTCP ADP DEF;DET;FEM;SG FEM;N;SG ADJ;FEM;SG _ DEF;DET;FEM;SG _ ADJ N _ _ _ CONJ FEM;PRO;SG ADP DEF;DET;SG MASC;N;SG ADJ;SG ADP DET;INDF;MASC;SG ADJ;MASC;SG MASC;N;SG _ DEF;DET;MASC;SG _ ADJ N _ _ _
( quando ho lavorato presso il fmi in gli anni 2000 , la copertura di i nostri eventi da la terza pagina di i quotidiani più importanti era generalmente considerata preferibile ad una posizione in primo piano ) .	( quando avere lavorare presso il fmi in il anno 2000 , il copertura di il nostro evento da il terzo pagina di il quotidiano più importante essere generalmente considerare preferibile a uno posizione in primo piano ) .	_ CONJ 1;FIN;IND;PRS;SG;V MASC;PST;SG;V;V.PTCP ADP DEF;DET;MASC;SG PROPN ADP DEF;DET;MASC;PL MASC;N;PL NUM _ DEF;DET;FEM;SG FEM;N;SG ADP DEF;DET;MASC;PL DET;MASC;PL MASC;N;PL ADP DEF;DET;FEM;SG ADJ;FEM;SG FEM;N;SG ADP DEF;DET;MASC;PL MASC;N;PL ADV ADJ;PL 3;FIN;IND;IPFV;SG;V ADV FEM;PST;SG;V;V.PTCP ADJ;SG ADP DET;FEM;INDF;SG FEM;N;SG ADP ADJ;MASC;SG MASC;N;SG _ _
" la cristianità , ed in particolare il cattolicesimo , in quanto totale repressione di le depravate tendenze di l' uomo , è il più grande elemento di ordine sociale .	" il cristianità , e in particolare il cattolicesimo , in quanto totale repressione di il depravare tendenza di il uomo , essere il più grande elemento di ordine sociale .	_ DEF;DET;FEM;SG FEM;N _ CONJ ADP MASC;N;SG DEF;DET;MASC;SG MASC;N;SG _ ADP ADV ADJ;SG FEM;N;SG ADP DEF;DET;FEM;PL ADJ;FEM;PL FEM;N;PL ADP DEF;DET;SG MASC;N;SG _ 3;FIN;IND;PRS;SG;V DEF;DET;MASC;SG ADV ADJ;SG MASC;N;SG ADP MASC;N;SG ADJ;SG _
la storia di joyce è importante anche per un altro motivo .	il storia di joyce essere importante anche per uno altro motivo .	DEF;DET;FEM;SG FEM;N;SG ADP PROPN 3;FIN;IND;PRS;SG;V ADJ;SG ADV ADP DET;INDF;MASC;SG ADJ;MASC;SG MASC;N;SG _
eppure , mentre gli ucraini lavorano per ricostruire il nostro paese dopo il governo predatorio di viktor yanukovych , affrontiamo una nuova minaccia , sotto - forma di " offensiva di pace " - un vecchio fondamento di la diplomazia sovietica ideata per minare le decisioni di l' occidente .	eppure , mentre il ucraino lavorare per ricostruire il nostro paese dopo il governo predatorio di viktor yanukovych , affrontare uno nuovo minaccia , sotto - forma di " offensiva di pace " - uno vecchio fondamento di il diplomazia sovietico ideare per minare il decisione di il occidente .	CONJ _ CONJ DEF;DET;MASC;PL ADJ;MASC;PL 3;FIN;IND;PL;PRS;V ADP NFIN;V DEF;DET;MASC;SG DET;MASC;SG MASC;N;SG ADP DEF;DET;MASC;SG MASC;N;SG ADJ;MASC;SG ADP PROPN PROPN _ 1;FIN;IND;PL;PRS;V DET;FEM;INDF;SG ADJ;FEM;SG FEM;N;SG _ ADV _ FEM;N;SG ADP _ FEM;N;SG ADP FEM;N;SG _ _ DET;INDF;MASC;SG ADJ;MASC;SG MASC;N;SG ADP DEF;DET;FEM;SG FEM;N;SG ADJ;FEM;SG FEM;PST;SG;V;V.PTCP ADP NFIN;V DEF;DET;FEM;PL FEM;N;PL ADP DEF;DET;SG MASC;N;SG _
qual è la differenza fra effettuare l' accesso e registrar si ?	quale essere il differenza fra effettuare il accesso e registrare si ?	PRO;SG 3;FIN;IND;PRS;SG;V DEF;DET;FEM;SG FEM;N;SG ADP NFIN;V DEF;DET;SG MASC;N;SG CONJ NFIN;V 3;PRO _
pochi studiosi credono che in la collezione pubblicata sia seguito l' ordine di i sonetti che shakespeare intendeva pubblicare .	poco studioso credere che in il collezione pubblicare essere seguire il ordine di il sonetto che shakespeare intendere pubblicare .	DET;MASC;PL MASC;N;PL 3;FIN;IND;PL;PRS;V CONJ ADP DEF;DET;FEM;SG FEM;N;SG FEM;PST;SG;V;V.PTCP 3;FIN;PRS;SBJV;SG;V MASC;PST;SG;V;V.PTCP DEF;DET;SG MASC;N;SG ADP DEF;DET;MASC;PL MASC;N;PL PRO PROPN 3;FIN;IND;IPFV;SG;V NFIN;V _
dovremo analizzare una serie di indicatori che ci permettano di valutare la condizione e l' evoluzione di le società regionali che versano in situazioni peggiori di altre .	dovere analizzare uno serie di indicatore che ci permettere di valutare il condizione e il evoluzione di il società regionale che versare in situazione peggiore di altro .	1;FIN;FUT;IND;PL;V NFIN;V DET;FEM;INDF;SG FEM;N ADP MASC;N;PL PRO 1;PL;PRO 3;FIN;PL;PRS;SBJV;V ADP NFIN;V DEF;DET;FEM;SG FEM;N;SG CONJ DEF;DET;SG FEM;N;SG ADP DEF;DET;FEM;PL FEM;N ADJ;PL PRO 3;FIN;IND;PL;PRS;V ADP FEM;N;PL ADJ;CMPR;PL ADP FEM;PL;PRO _
deploriamo che quelle cifre in qualche modo siano state nascoste a l' interno di i dati relativi a tutto il regno unito .	deplorare che quello cifra in qualche modo essere essere nascondere a il interno di il dato relativo a tutto il regno unito .	1;FIN;IND;PL;PRS;V CONJ DET;FEM;PL FEM;N;PL ADP DET;SG MASC;N;SG 3;FIN;PL;PRS;SBJV;V FEM;PL;PST;V;V.PTCP FEM;PL;PST;V;V.PTCP ADP DEF;DET;MASC;SG MASC;N;SG ADP DEF;DET;MASC;PL MASC;N;PL ADJ;MASC;PL ADP DET;MASC;SG DEF;DET;MASC;SG PROPN PROPN _
in deroga a quanto precede , le procedure relative ad appalti pubblici avviate dopo l' adesione sono espletate in conformità di le pertinenti disposizioni di l' unione .	in deroga a quanto precedere , il procedura relativo a appalto pubblico avviare dopo il adesione essere espletare in conformità di il pertinente disposizione di il unione .	ADP FEM;N;SG ADP MASC;PRO;SG 3;FIN;IND;PRS;SG;V _ DEF;DET;FEM;PL FEM;N;PL ADJ;FEM;PL ADP MASC;N;PL ADJ;MASC;PL FEM;PL;PST;V;V.PTCP ADP DEF;DET;SG FEM;N;SG 3;FIN;IND;PL;PRS;V FEM;PL;PST;V;V.PTCP ADP FEM;N ADP DEF;DET;FEM;PL ADJ;PL FEM;N;PL ADP DEF;DET;SG FEM;N;SG _
tutti territori di la terra erano punteggiati da questi funghi giganti ;	tutto territorio di il terra essere punteggiare da questo fungo gigante ;	MASC;PL;PRO MASC;N;PL ADP DEF;DET;FEM;SG FEM;N;SG 3;FIN;IND;IPFV;PL;V MASC;PL;PST;V;V.PTCP ADP DET;MASC;PL MASC;N;PL ADJ;PL _
nessun individuo potrà essere arbitrariamente privato di la sua proprietà .	nessuno individuo potere essere arbitrariamente privare di il suo proprietà .	DET;MASC;SG MASC;N;SG 3;FIN;FUT;IND;SG;V NFIN;V ADV MASC;PST;SG;V;V.PTCP ADP DEF;DET;FEM;SG DET;FEM;SG FEM;N _
se non vuoi più ricevere inviti da i tuoi amici , puoi usare il link di annullamento di l' iscrizione situato in fondo a l' e-mail .	se non volere più ricevere invito da il tuo amico , potere usare il link di annullamento di il iscrizione situare in fondo a il e-mail .	CONJ ADV 2;FIN;IND;PRS;SG;V ADV NFIN;V MASC;N;PL ADP DEF;DET;MASC;PL DET;MASC;PL MASC;N;PL _ 2;FIN;IND;PRS;SG;V NFIN;V DEF;DET;MASC;SG MASC;N ADP MASC;N;SG ADP DEF;DET;SG FEM;N;SG MASC;PST;SG;V;V.PTCP ADP MASC;N;SG ADP DEF;DET;MASC;SG N _
di conseguenza , la commissione dovrà finalmente prendere in esame questo preciso argomento .	di conseguenza , il commissione dovere finalmente prendere in esame questo preciso argomento .	ADP FEM;N;SG _ DEF;DET;FEM;SG FEM;N;SG 3;FIN;FUT;IND;SG;V ADV NFIN;V ADP MASC;N;SG DET;MASC;SG ADJ;MASC;SG MASC;N;SG _
ma vi propongo l' idea che la varietà di microbi presenti su i funghi marcescenti è essenziale per la salute di la foresta .	ma vi proporre il idea che il varietà di microbo presente su il fungo marcire essere essenziale per il salute di il foresta .	CONJ 2;PL;PRO 1;FIN;IND;PRS;SG;V DEF;DET;SG FEM;N;SG CONJ DEF;DET;FEM;SG FEM;N ADP MASC;N;PL ADJ;PL ADP DEF;DET;MASC;PL MASC;N;PL PL;PRS;V;V.PTCP 3;FIN;IND;PRS;SG;V ADJ;SG ADP DEF;DET;FEM;SG FEM;N;SG ADP DEF;DET;FEM;SG FEM;N;SG _
oppure pensiamo a le navi provenienti da i paesi di l' europa orientale che navigano in condizioni chiaramente pericolose .	oppure pensare a il nave provenire da il paese di il europa orientale che navigare in condizione chiaramente pericoloso .	CONJ 1;FIN;IND;PL;PRS;V ADP DEF;DET;FEM;PL FEM;N;PL PL;PRS;V;V.PTCP ADP DEF;DET;MASC;PL MASC;N;PL ADP DEF;DET;SG PROPN ADJ;SG PRO 3;FIN;IND;PL;PRS;V ADP FEM;N;PL ADV ADJ;FEM;PL _
nessun rifugiato di lingua russa proveniente da l' ucraina orientale o da la crimea è fuggito in russia , e nessun abitante di lingua russa ha cercato asilo politico altrove a il di fuori di il paese .	nessuno rifugiato di lingua russo provenire da il ucraina orientale o da il crimea essere fuggire in russia , e nessuno abitante di lingua russo avere cercare asilo politico altrove a il di fuori di il paese .	DET;MASC;SG MASC;N;SG ADP FEM;N;SG ADJ;FEM;SG PRS;SG;V;V.PTCP ADP DEF;DET;SG PROPN ADJ;SG CONJ ADP DEF;DET;FEM;SG PROPN 3;FIN;IND;PRS;SG;V MASC;PST;SG;V;V.PTCP ADP PROPN _ CONJ DET;MASC;SG N;SG ADP FEM;N;SG ADJ;FEM;SG 3;FIN;IND;PRS;SG;V MASC;PST;SG;V;V.PTCP MASC;N;SG ADJ;MASC;SG ADV ADP DEF;DET;MASC;SG ADP ADV ADP DEF;DET;MASC;SG MASC;N;SG _
l' altra , invece , nasconde una grande opportunità :	il altro , invece , nascondere uno grande opportunità :	DEF;DET;SG FEM;PRO;SG _ ADV _ 3;FIN;IND;PRS;SG;V DET;FEM;INDF;SG ADJ;SG FEM;N _
sono quindi due i punti su cui vorrei richiamare l' attenzione di la commissione :	essere quindi due il punto su cui volere richiamare il attenzione di il commissione :	3;FIN;IND;PL;PRS;V ADV NUM DEF;DET;MASC;PL MASC;N;PL ADP PRO 1;COND;FIN;PRS;SG;V NFIN;V DEF;DET;SG FEM;N;SG ADP DEF;DET;FEM;SG FEM;N;SG _
si sottolinea inoltre la necessità di una maggiore trasparenza .	si sottolineare inoltre il necessità di uno maggiore trasparenza .	3;PRO 3;FIN;IND;PRS;SG;V ADV DEF;DET;FEM;SG FEM;N ADP DET;FEM;INDF;SG ADJ;CMPR;SG FEM;N;SG _
dopo aver sporulato , marciscono .	dopo avere sporulato , marcire .	CONJ NFIN;V MASC;PST;SG;V;V.PTCP _ 3;FIN;IND;PL;PRS;V _
tuttavia , non trascorreva molto tempo in i saloni letterari e in i circoli come facevano molti di i suoi personaggi .	tuttavia , non trascorrere molto tempo in il salone letterario e in il circolo come fare molto di il suo personaggio .	ADV _ ADV 3;FIN;IND;IPFV;SG;V ADV MASC;N;SG ADP DEF;DET;MASC;PL MASC;N;PL ADJ;MASC;PL CONJ ADP DEF;DET;MASC;PL MASC;N;PL CONJ 3;FIN;IND;IPFV;PL;V MASC;PL;PRO ADP DEF;DET;MASC;PL DET;MASC;PL MASC;N;PL _
il punto è che l' ingegneria genetica molecolare è molto più precisa e prevedibile di le tecniche tradizionali e più rudimentali come l' irradiazione .	il punto essere che il ingegneria genetico molecolare essere molto più preciso e prevedibile di il tecnica tradizionale e più rudimentale come il irradiazione .	DEF;DET;MASC;SG MASC;N;SG 3;FIN;IND;PRS;SG;V CONJ DEF;DET;SG FEM;N;SG ADJ;FEM;SG ADJ;SG 3;FIN;IND;PRS;SG;V ADV ADV ADJ;FEM;SG CONJ ADJ;SG ADP DEF;DET;FEM;PL FEM;N;PL ADJ;PL CONJ ADV ADJ;PL ADP DEF;DET;SG FEM;N;SG _
gli interventi pubblici ad oggi , soprattutto sotto - forma di un maggiore livello di istruzione , si sono rivelati perlopiù inefficaci .	il intervento pubblico a oggi , soprattutto sotto - forma di uno maggiore livello di istruzione , si essere rivelare perlopiù inefficace .	DEF;DET;MASC;PL MASC;N;PL ADJ;MASC;PL ADP ADV _ ADV ADP _ FEM;N;SG ADP DET;INDF;MASC;SG ADJ;CMPR;SG MASC;N;SG ADP FEM;N;SG _ 3;PRO 3;FIN;IND;PL;PRS;V MASC;PL;PST;V;V.PTCP ADV ADJ;PL _
in gli ultimi due anni , l' india ha invalidato o attaccato i brevetti di 15 farmaci prodotti da aziende internazionali per spianare la strada a i campioni locali , sostenendo che l' esclusività permetterebbe a le aziende di fissare dei prezzi alti a danno di i consumatori .	in il ultimo due anno , il india avere invalidare o attaccare il brevetto di 15 farmaco produrre da azienda internazionale per spianare il strada a il campione locale , sostenere che il esclusività permettere a il azienda di fissare di prezzo alto a danno di il consumatore .	ADP DEF;DET;MASC;PL ADJ;MASC;PL NUM MASC;N;PL _ DEF;DET;SG PROPN 3;FIN;IND;PRS;SG;V MASC;PST;SG;V;V.PTCP CONJ MASC;PST;SG;V;V.PTCP DEF;DET;MASC;PL MASC;N;PL ADP NUM MASC;N;PL MASC;PL;PST;V;V.PTCP ADP FEM;N;PL ADJ;PL ADP NFIN;V DEF;DET;FEM;SG FEM;N;SG ADP DEF;DET;MASC;PL MASC;N;PL ADJ;PL _ V;V.MSDR CONJ DEF;DET;SG FEM;N 3;COND;FIN;PRS;SG;V ADP DEF;DET;FEM;PL FEM;N;PL ADP NFIN;V DET;MASC;PL MASC;N;PL ADJ;MASC;PL ADP MASC;N;SG ADP DEF;DET;MASC;PL MASC;N;PL _
in il 1970 roland barthes pubblicò s / z , una dettagliata analisi di la storia di balzac di sarrasine ed un' opera chiave di la critica di lo strutturalismo letterario .	in il 1970 roland barthes pubblicare s / z , uno dettagliato analisi di il storia di balzac di sarrasine e uno opera chiave di il critico di il strutturalismo letterario .	ADP DEF;DET;MASC;SG NUM PROPN PROPN 3;FIN;IND;PST;SG;V PROPN _ PROPN _ DET;FEM;INDF;SG ADJ;FEM;SG FEM;N ADP DEF;DET;FEM;SG FEM;N;SG ADP PROPN ADP PROPN CONJ DET;FEM;INDF;SG FEM;N;SG FEM;N;SG ADP DEF;DET;FEM;SG FEM;N;SG ADP DEF;DET;MASC;SG MASC;N;SG ADJ;MASC;SG _
le zanzare maschio non mordono quindi non rappresentano alcun rischio per la salute e dato che le loro progenie muoiono nessuna zanzara geneticamente modificata continua a vivere in l' ambiente .	il zanzara maschio non mordere quindi non rappresentare alcuno rischio per il salute e dare che il loro progenie morire nessuno zanzara geneticamente modificare continuare a vivere in il ambiente .	DEF;DET;FEM;PL FEM;N;PL MASC;N;SG ADV 3;FIN;IND;PL;PRS;V CONJ ADV 3;FIN;IND;PL;PRS;V DET;MASC;SG MASC;N;SG ADP DEF;DET;FEM;SG FEM;N;SG CONJ MASC;PST;SG;V;V.PTCP CONJ DEF;DET;FEM;PL DET FEM;N 3;FIN;IND;PL;PRS;V DET;FEM;SG FEM;N;SG ADV FEM;PST;SG;V;V.PTCP 3;FIN;IND;PRS;SG;V ADP NFIN;V ADP DEF;DET;SG MASC;N;SG _
in altri casi , potrebbe invece comportare l' istituzione di centri infantili per la comunità , in modo tale che le lavoratrici agricole possano scegliere di dedicare più tempo a l' agricoltura .	in altro caso , potere invece comportare il istituzione di centro infantile per il comunità , in modo tale che il lavoratore agricolo potere scegliere di dedicare più tempo a il agricoltura .	ADP ADJ;MASC;PL MASC;N;PL _ 3;COND;FIN;PRS;SG;V ADV NFIN;V DEF;DET;SG FEM;N;SG ADP MASC;N;PL ADJ;PL ADP DEF;DET;FEM;SG FEM;N _ ADP MASC;N;SG DET;SG CONJ DEF;DET;FEM;PL FEM;N;PL ADJ;FEM;PL 3;FIN;PL;PRS;SBJV;V NFIN;V ADP NFIN;V DET MASC;N;SG ADP DEF;DET;SG FEM;N;SG _
connetti ti con oltre 800 milioni di potenziali clienti .	connettere ti con oltre 800 milione di potenziale cliente .	2;FIN;IMP;PRS;SG;V 2;PRO;SG ADP ADV NUM MASC;N;PL ADP ADJ;PL N;PL _
