non vi viene infatti attribuita la dovuta attenzione , e non è la prima volta che ciò accade :	non vi venire infatti attribuire la dovere attenzione , e non essere il primo volta che ciò accadere :	ADV 2;PL;PRO 3;FIN;IND;PRS;SG;V ADV FEM;PST;SG;V;V.PTCP DEF;DET;FEM;SG FEM;PST;SG;V;V.PTCP FEM;N;SG _ CONJ ADV 3;FIN;IND;PRS;SG;V DEF;DET;FEM;SG ADJ;FEM;SG FEM;N;SG CONJ MASC;PRO;SG 3;FIN;IND;PRS;SG;V _
tuttavia ben presto , shakespeare iniziò ad adattare lo stile tradizionale a i suoi scopi .	tuttavia bene presto , shakespeare iniziare a adattare il stile tradizionale a il suo scopo .	ADV ADV ADV _ PROPN 3;FIN;IND;PST;SG;V ADP NFIN;V DEF;DET;MASC;SG MASC;N;SG ADJ;SG ADP DEF;DET;MASC;PL DET;MASC;PL MASC;N;PL _
l' opera ( come sotto definita ) è messa a disposizione su la base di i termini di la presente licenza " creative commons public licence " ( ' ccpl ' o ' licenza ' ) .	il opera ( come sotto definire ) essere mettere a disposizione su il base di il termine di il presente licenza " creative commons public licence " ( ' ccpl ' o ' licenza ' ) .	DEF;DET;SG FEM;N;SG _ ADP ADV FEM;PST;SG;V;V.PTCP _ 3;FIN;IND;PRS;SG;V FEM;PST;SG;V;V.PTCP ADP FEM;N;SG ADP DEF;DET;FEM;SG FEM;N;SG ADP DEF;DET;MASC;PL MASC;N;PL ADP DEF;DET;FEM;SG ADJ;SG FEM;N;SG _ PROPN PROPN PROPN PROPN _ _ _ PROPN _ CONJ _ FEM;N;SG _ _ _
signora presidente , mi permetta di far le innanzi tutto i miei complimenti per aver tenuto fede a la parola data .	signore presidente , mi permettere di fare le innanzi tutto il mio complimento per avere tenere fede a il parola dato .	FEM;N;SG N;SG _ 1;PRO;SG 3;FIN;PRS;SBJV;SG;V ADP NFIN;V 3;FEM;PRO;SG ADP PRO;SG DEF;DET;MASC;PL DET;MASC;PL MASC;N;PL ADP NFIN;V MASC;PST;SG;V;V.PTCP FEM;N;SG ADP DEF;DET;FEM;SG FEM;N;SG ADJ;FEM;SG _
in il first folio , ben jonson parla di shakespeare come " anima di l' epoca , acclamazione , delizia , e meraviglia di i nostri palchi " , anche se aveva sottolineato da qualche altra parte che " shakespeare ricercava l' arte " .	in il first folio , ben jonson parlare di shakespeare come " anima di il epoca , acclamazione , delizia , e meraviglia di il nostro palco " , anche se avere sottolineare da qualche altro parte che " shakespeare ricercare il arte " .	ADP DEF;DET;MASC;SG PROPN PROPN _ PROPN PROPN 3;FIN;IND;PRS;SG;V ADP PROPN ADP _ FEM;N;SG ADP DEF;DET;SG FEM;N;SG _ FEM;N;SG _ FEM;N;SG _ CONJ FEM;N;SG ADP DEF;DET;MASC;PL DET;MASC;PL MASC;N;PL _ _ ADV CONJ 3;FIN;IND;IPFV;SG;V MASC;PST;SG;V;V.PTCP ADP DET;SG ADJ;FEM;SG FEM;N;SG PRO _ PROPN 3;FIN;IND;IPFV;SG;V DEF;DET;SG FEM;N;SG _ _
" e' una grande scoperta scientifica " .	" essere uno grande scoperta scientifica " .	_ 3;FIN;IND;PRS;SG;V DET;FEM;INDF;SG ADJ;SG FEM;N;SG ADJ;FEM;SG _ _
le sue ultime tre opere teatrali furono delle collaborazioni , probabilmente con john fletcher , che gli successe come poeta drammatico presso i king's men .	il suo ultimo tre opera teatrale essere di collaborazione , probabilmente con john fletcher , che gli succedere come poeta drammatico presso il king's men .	DEF;DET;FEM;PL FEM;PL;PRO ADJ;FEM;PL NUM FEM;N;PL ADJ;PL 3;FIN;IND;PL;PST;V DET;FEM;PL FEM;N;PL _ ADV ADP PROPN PROPN _ PRO 3;MASC;PRO;SG 3;FIN;IND;PST;SG;V ADP MASC;N;SG ADJ;MASC;SG ADP DEF;DET;MASC;PL _ _ _
circa due anni dopo seguì la nascita di due gemelli , hamnet e la sorella judith , che vennero battezzati il 2 febbraio 1585 .	circa due anno dopo seguire il nascita di due gemello , hamnet e il sorella judith , che venire battezzare il 2 febbraio 1585 .	ADV NUM MASC;N;PL ADV 3;FIN;IND;PST;SG;V DEF;DET;FEM;SG FEM;N;SG ADP NUM MASC;N;PL _ PROPN CONJ DEF;DET;FEM;SG FEM;N;SG PROPN _ PRO 3;FIN;IND;PL;PST;V MASC;PL;PST;V;V.PTCP DEF;DET;MASC;SG NUM MASC;N;SG NUM _
il rompicapo di la crescita cinese .	il rompicapo di il crescita cinese .	DEF;DET;MASC;SG MASC;N;SG ADP DEF;DET;FEM;SG FEM;N;SG ADJ;SG _
non dobbiamo giocare davvero , possiamo solo immaginar lo .	non dovere giocare davvero , potere solo immaginare lo .	ADV 1;FIN;IND;PL;PRS;V NFIN;V ADV _ 1;FIN;IND;PL;PRS;V ADV NFIN;V 3;MASC;PRO;SG _
ma le passate performance di la crescita non sono garanzia di mantenimento di una traiettoria simile in il corso di questo secolo .	ma il passato performance di il crescita non essere garanzia di mantenimento di uno traiettoria simile in il corso di questo secolo .	CONJ DEF;DET;FEM;PL ADJ;FEM;PL FEM;N ADP DEF;DET;FEM;SG FEM;N;SG ADV 3;FIN;IND;PL;PRS;V FEM;N;SG ADP MASC;N;SG ADP DET;FEM;INDF;SG FEM;N;SG ADJ;SG ADP DEF;DET;MASC;SG MASC;N;SG ADP DET;MASC;SG MASC;N;SG _
ogni individuo , senza discriminazione , ha diritto ad eguale retribuzione per eguale lavoro .	ogni individuo , senza discriminazione , avere diritto a eguale retribuzione per eguale lavoro .	DET;SG MASC;N;SG _ ADP FEM;N;SG _ 3;FIN;IND;PRS;SG;V MASC;N;SG ADP ADJ;SG FEM;N;SG ADP ADJ;SG MASC;N;SG _
il suo captain ahab in moby - dick è un classico eroe tragico , ispirato a king lear .	il suo captain ahab in moby - dick essere uno classico eroe tragico , ispirato a king lear .	DEF;DET;MASC;SG DET;MASC;SG PROPN PROPN ADP PROPN _ PROPN 3;FIN;IND;PRS;SG;V DET;INDF;MASC;SG ADJ;MASC;SG MASC;N;SG ADJ;MASC;SG _ ADJ;MASC;SG ADP PROPN PROPN _
decidi se pagare solo quando le persone cliccano ( modello cpc ) o visualizzano ( modello cpm ) la tua inserzione .	decidere se pagare solo quando il persona cliccare ( modello cpc ) o visualizzare ( modello cpm ) il tuo inserzione .	2;FIN;IND;PRS;SG;V CONJ NFIN;V ADV CONJ DEF;DET;FEM;PL FEM;N;PL 3;FIN;IND;PL;PRS;V _ MASC;N;SG PROPN _ CONJ 3;FIN;IND;PL;PRS;V _ MASC;N;SG PROPN _ DEF;DET;FEM;SG DET;FEM;SG FEM;N;SG _
il primo progetto di balzac fu un libretto per un' opera comica intitolata le corsaire , basata su the corsair di lord byron .	il primo progetto di balzac essere uno libretto per uno opera comico intitolare le corsaire , basare su the corsair di lord byron .	DEF;DET;MASC;SG ADJ;MASC;SG MASC;N;SG ADP PROPN 3;FIN;IND;PST;SG;V DET;INDF;MASC;SG MASC;N;SG ADP DET;FEM;INDF;SG FEM;N;SG ADJ;FEM;SG FEM;PST;SG;V;V.PTCP _ _ _ FEM;PST;SG;V;V.PTCP ADP _ _ ADP PROPN PROPN _
la commissione può adottare qualsiasi provvedimento tecnico necessario a il funzionamento di lo strumento temporaneo per i flussi di tesoreria e strumento schengen .	il commissione potere adottare qualsiasi provvedimento tecnico necessario a il funzionamento di il strumento temporaneo per il flusso di tesoreria e strumento schengen .	DEF;DET;FEM;SG FEM;N;SG 3;FIN;IND;PRS;SG;V NFIN;V DET;SG MASC;N;SG ADJ;MASC;SG ADJ;MASC;SG ADP DEF;DET;MASC;SG MASC;N;SG ADP DEF;DET;MASC;SG MASC;N;SG ADJ;MASC;SG ADP DEF;DET;MASC;PL MASC;N;PL ADP FEM;N;SG CONJ MASC;N;SG PROPN _
siamo tutti d' accordo in il chiedere che il parlamento possa essere compartecipe di la valutazione di le linee direttrici a metà periodo di funzionamento di i programmi , visto che siamo i rappresentanti di i cittadini .	essere tutto di accordo in il chiedere che il parlamento potere essere compartecipe di il valutazione di il linea direttrice a metà periodo di funzionamento di il programma , vedere che essere il rappresentante di il cittadino .	1;FIN;IND;PL;PRS;V MASC;PL;PRO ADP MASC;N;SG ADP DEF;DET;MASC;SG NFIN;V CONJ DEF;DET;MASC;SG MASC;N;SG 3;FIN;PRS;SBJV;SG;V NFIN;V ADJ;FEM;PL ADP DEF;DET;FEM;SG FEM;N;SG ADP DEF;DET;FEM;PL FEM;N;PL ADJ;FEM;PL ADP FEM;N MASC;N;SG ADP MASC;N;SG ADP DEF;DET;MASC;PL MASC;N;PL _ MASC;PST;SG;V;V.PTCP CONJ 1;FIN;IND;PL;PRS;V DEF;DET;MASC;PL N;PL ADP DEF;DET;MASC;PL MASC;N;PL _
seoul - in gli ultimi cinquant' anni la corea di il sud ha compiuto notevoli progressi in campo economico , portando il reddito pro capite da 80 dollari in il 1960 a più di 22.000 dollari lo scorso anno .	seoul - in il ultimo cinquanta anno il corea di il sud avere compiere notevole progresso in campo economico , portare il reddito pro capite da 80 dollaro in il 1960 a più di 22.000 dollaro il scorso anno .	PROPN _ ADP DEF;DET;MASC;PL ADJ;MASC;PL NUM MASC;N;PL DEF;DET;FEM;SG PROPN ADP DEF;DET;MASC;SG MASC;N;SG 3;FIN;IND;PRS;SG;V MASC;PST;SG;V;V.PTCP ADJ;PL MASC;N;PL ADP MASC;N;SG ADJ;MASC;SG _ V;V.MSDR DEF;DET;MASC;SG MASC;N;SG _ _ ADP NUM MASC;N;PL ADP DEF;DET;MASC;SG NUM ADP ADV ADP NUM MASC;N;PL DEF;DET;MASC;SG ADJ;MASC;SG MASC;N;SG _
e questo in quasi tutte le masse terrestri .	e questo in quasi tutto il massa terrestre .	CONJ MASC;PRO;SG ADP ADV DET;FEM;PL DEF;DET;FEM;PL FEM;N;PL ADJ;PL _
le azioni di il programma pericle vengono per lo più intraprese a l' interno di l' ue .	il azione di il programma pericle venire per il più intraprendere a il interno di il ue .	DEF;DET;FEM;PL FEM;N;PL ADP DEF;DET;MASC;SG MASC;N;SG PROPN 3;FIN;IND;PL;PRS;V ADP DEF;DET;MASC;SG ADV FEM;PST;SG;V;V.PTCP ADP DEF;DET;MASC;SG MASC;N;SG ADP DEF;DET;SG PROPN _
" verso fine aprile i neo - sposi si stabilirono a parigi .	" verso fine aprile il neo - sposo si stabilire a parigi .	_ ADP ADJ;SG MASC;N;SG DEF;DET;MASC;PL ADJ _ MASC;N;PL 3;PRO 3;FIN;IND;PL;PST;V ADP PROPN _
quel giorno aveva ricevuto una visita da victor hugo , che più tardi a il funerale di balzac aiutò a portare la bara e tenne un elogio .	quello giorno avere ricevere uno visita da victor hugo , che più tardi a il funerale di balzac aiutare a portare il bara e tenere uno elogio .	DET;MASC;SG MASC;N;SG 3;FIN;IND;IPFV;SG;V MASC;PST;SG;V;V.PTCP DET;FEM;INDF;SG FEM;N;SG ADP PROPN PROPN _ PRO ADV ADV ADP DEF;DET;MASC;SG MASC;N;SG ADP PROPN 3;FIN;IND;PST;SG;V ADP NFIN;V DEF;DET;FEM;SG FEM;N;SG CONJ 3;FIN;IND;PST;SG;V DET;INDF;MASC;SG MASC;N;SG _
pertanto , una riduzione di il numero di agricoltori non avrebbe potuto far altro che creare povertà e accattonaggio .	pertanto , uno riduzione di il numero di agricoltore non avere potere fare altro che creare povertà e accattonaggio .	ADV _ DET;FEM;INDF;SG FEM;N;SG ADP DEF;DET;MASC;SG MASC;N;SG ADP MASC;N;PL ADV 3;COND;FIN;PRS;SG;V MASC;PST;SG;V;V.PTCP NFIN;V MASC;PRO;SG CONJ NFIN;V FEM;N CONJ MASC;N;SG _
se non c' è alcuna oppressione di gli abitanti di lingua russa in ucraina , non c' è alcun motivo di cambiare la struttura politica di il paese .	se non ci essere alcuno oppressione di il abitante di lingua russo in ucraina , non ci essere alcuno motivo di cambiare il struttura politico di il paese .	CONJ ADV PRO 3;FIN;IND;PRS;SG;V DET;FEM;SG FEM;N;SG ADP DEF;DET;MASC;PL N;PL ADP FEM;N;SG ADJ;FEM;SG ADP PROPN _ ADV PRO 3;FIN;IND;PRS;SG;V DET;MASC;SG MASC;N;SG ADP NFIN;V DEF;DET;FEM;SG FEM;N;SG ADJ;FEM;SG ADP DEF;DET;MASC;SG MASC;N;SG _
quando i bambini balzac tornarono a casa , furono tenuti a gelida distanza da i genitori , cosa che influenzò moltissimo il futuro autore .	quando il bambino balzac tornare a casa , essere tenere a gelido distanza da il genitore , cosa che influenzare molto il futuro autore .	CONJ DEF;DET;MASC;PL MASC;N;PL PROPN 3;FIN;IND;PL;PST;V ADP FEM;N;SG _ 3;FIN;IND;PL;PST;V MASC;PL;PST;V;V.PTCP ADP ADJ;FEM;SG FEM;N;SG ADP DEF;DET;MASC;PL MASC;N;PL _ PRO;SG PRO 3;FIN;IND;PST;SG;V AB;ADV DEF;DET;MASC;SG ADJ;MASC;SG MASC;N;SG _
l' anno seguente lo seguì la sorella laure e trascorsero quattro anni fuori casa .	il anno seguente lo seguire il sorella laure e trascorrere quattro anno fuori casa .	DEF;DET;SG MASC;N;SG ADJ;SG 3;MASC;PRO;SG 3;FIN;IND;PST;SG;V DEF;DET;FEM;SG FEM;N;SG PROPN CONJ 3;FIN;IND;PL;PST;V NUM MASC;N;PL ADP FEM;N;SG _
in realtà , l' amministrazione ha cercato di rendere il fmi più interessante , soprattutto per incoraggiare i repubblicani di la camera di i rappresentanti a sostenere le riforme .	in realtà , il amministrazione avere cercare di rendere il fmi più interessante , soprattutto per incoraggiare il repubblicano di il camera di il rappresentante a sostenere il riforma .	ADP FEM;N;SG _ DEF;DET;SG FEM;N;SG 3;FIN;IND;PRS;SG;V MASC;PST;SG;V;V.PTCP ADP NFIN;V DEF;DET;MASC;SG PROPN ADV ADJ;SG _ ADV ADP NFIN;V DEF;DET;MASC;PL MASC;N;PL ADP DEF;DET;FEM;SG PROPN ADP DEF;DET;MASC;PL N;PL ADP NFIN;V DEF;DET;FEM;PL FEM;N;PL _
a il contrario , la crescita di i mercati emergenti in gli ultimi due decenni si è fondata su una serie fortuita ( e provvisoria ) di circostanze esterne :	a il contrario , il crescita di il mercato emergere in il ultimo due decennio si essere fondare su uno serie fortuito ( e provvisorio ) di circostanza esterno :	ADP DEF;DET;MASC;SG MASC;N;SG _ DEF;DET;FEM;SG FEM;N;SG ADP DEF;DET;MASC;PL MASC;N;PL PL;PRS;V;V.PTCP ADP DEF;DET;MASC;PL ADJ;MASC;PL NUM MASC;N;PL 3;PRO 3;FIN;IND;PRS;SG;V FEM;PST;SG;V;V.PTCP ADP DET;FEM;INDF;SG FEM;N ADJ;FEM;SG _ CONJ ADJ;FEM;SG _ ADP FEM;N;PL ADJ;FEM;PL _
quando l' ho conosciuta in il 2012 , aveva appena portato a termine il primo raccolto di mais cresciuto da un seme adattato a il clima di la tanzania .	quando lo avere conoscere in il 2012 , avere appena portare a termine il primo raccolto di mais crescere da uno seme adattare a il clima di il tanzania .	CONJ 3;PRO;SG 1;FIN;IND;PRS;SG;V FEM;PST;SG;V;V.PTCP ADP DEF;DET;MASC;SG NUM _ 3;FIN;IND;IPFV;SG;V ADV MASC;PST;SG;V;V.PTCP ADP MASC;N;SG DEF;DET;MASC;SG ADJ;MASC;SG MASC;N;SG ADP MASC;N MASC;PST;SG;V;V.PTCP ADP DET;INDF;MASC;SG MASC;N;SG MASC;PST;SG;V;V.PTCP ADP DEF;DET;MASC;SG MASC;N;SG ADP DEF;DET;FEM;SG PROPN _
in la prefazione a la prima edizione de " scènes de la vie privée " , scrive :	in il prefazione a il primo edizione di " scènes de il vie privée " , scrivere :	ADP DEF;DET;FEM;SG FEM;N;SG ADP DEF;DET;FEM;SG ADJ;FEM;SG FEM;N;SG ADP _ PROPN ADP DEF;DET;FEM;SG PROPN ADJ;FEM;PL _ _ 3;FIN;IND;PRS;SG;V _
i genitori hanno diritto di priorità in la scelta di il genere di istruzione da impartire a i loro figli .	il genitore avere diritto di priorità in il scelta di il genere di istruzione da impartire a il loro figlio .	DEF;DET;MASC;PL MASC;N;PL 3;FIN;IND;PL;PRS;V MASC;N;SG ADP FEM;N ADP DEF;DET;FEM;SG FEM;N;SG ADP DEF;DET;MASC;SG MASC;N;SG ADP FEM;N;SG ADP NFIN;V ADP DEF;DET;MASC;PL DET MASC;N;PL _
molti altri lo hanno già fatto , ma lo merita davvero per la grande apertura e attenzione che ha dimostrato per le diverse proposte presentate da i colleghi ;	molto altro lo avere già fare , ma lo meritare davvero per il grande apertura e attenzione che avere dimostrare per il diverso proposta presentare da il collega ;	DET;MASC;PL MASC;PL;PRO 3;MASC;PRO;SG 3;FIN;IND;PL;PRS;V ADV MASC;PST;SG;V;V.PTCP _ CONJ 3;MASC;PRO;SG 3;FIN;IND;PRS;SG;V ADV ADP DEF;DET;FEM;SG ADJ;SG FEM;N;SG CONJ FEM;N;SG PRO 3;FIN;IND;PRS;SG;V MASC;PST;SG;V;V.PTCP ADP DEF;DET;FEM;PL ADJ;FEM;PL FEM;N;PL FEM;PL;PST;V;V.PTCP ADP DEF;DET;MASC;PL MASC;N;PL _
gli studiosi trovano prove di la sua fede , sia a favore che contro , a l' interno di le sue opere , ma la verità non è dimostrabile .	il studioso trovare prova di il suo fede , sia a favore che contro , a il interno di il suo opera , ma il verità non essere dimostrabile .	DEF;DET;MASC;PL MASC;N;PL 3;FIN;IND;PL;PRS;V FEM;N;PL ADP DEF;DET;FEM;SG DET;FEM;SG FEM;N;SG _ CONJ ADP MASC;N;SG CONJ ADP _ ADP DEF;DET;MASC;SG MASC;N;SG ADP DEF;DET;FEM;PL DET;FEM;PL FEM;N;PL _ CONJ DEF;DET;FEM;SG FEM;N ADV 3;FIN;IND;PRS;SG;V ADJ;SG _
pertanto , signora presidente , la prego di chiedere a la commissione di esprimer si subito e poi di procedere a il voto .	pertanto , signore presidente , la pregare di chiedere a il commissione di esprimere si subito e poi di procedere a il voto .	ADV _ FEM;N;SG N;SG _ 3;FEM;PRO;SG 1;FIN;IND;PRS;SG;V ADP NFIN;V ADP DEF;DET;FEM;SG FEM;N;SG ADP NFIN;V 3;PRO ADV CONJ ADV ADP NFIN;V ADP DEF;DET;MASC;SG MASC;N;SG _
mamma infelice , tutti infelici .	mamma infelice , tutto infelice .	FEM;N;SG ADJ;SG _ MASC;PL;PRO ADJ;PL _
ricevi questa e-mail perché un membro di facebook ti ha invitato a iscriver ti a facebook .	ricevere questo e-mail perché uno membro di facebook ti avere invitare a iscrivere ti a facebook .	2;FIN;IND;PRS;SG;V DET;FEM;SG N CONJ DET;INDF;MASC;SG MASC;N;SG ADP PROPN 2;PRO;SG 3;FIN;IND;PRS;SG;V MASC;PST;SG;V;V.PTCP ADP NFIN;V 2;PRO;SG ADP PROPN _
le conseguenze sono evidenti .	il conseguenza essere evidente .	DEF;DET;FEM;PL FEM;N;PL 3;FIN;IND;PL;PRS;V ADJ;PL _
in l' ambito di l' economia internazionale , essere percepiti come noiosi conferisce potere in quanto consente la possibilità di prendere importanti decisioni senza controlli rilevanti da l' esterno .	in il ambito di il economia internazionale , essere percepire come noioso conferire potere in quanto consentire il possibilità di prendere importante decisione senza controllo rilevante da il esterno .	ADP DEF;DET;SG MASC;N;SG ADP DEF;DET;SG FEM;N;SG ADJ;SG _ NFIN;V MASC;PL;PST;V;V.PTCP ADP ADJ;MASC;PL 3;FIN;IND;PRS;SG;V MASC;N;SG ADP ADV 3;FIN;IND;PRS;SG;V DEF;DET;FEM;SG FEM;N ADP NFIN;V ADJ;PL FEM;N;PL ADP MASC;N;PL ADJ;PL ADP DEF;DET;SG MASC;N;SG _
questa relazione è ottima e gode di il sostegno di il nostro gruppo .	questo relazione essere ottimo e godere di il sostegno di il nostro gruppo .	DET;FEM;SG FEM;N;SG 3;FIN;IND;PRS;SG;V ADJ;FEM;SG CONJ 3;FIN;IND;PRS;SG;V ADP DEF;DET;MASC;SG MASC;N;SG ADP DEF;DET;MASC;SG DET;MASC;SG MASC;N;SG _
ospitare un enorme centro finanziario , con banche nazionali di ampie dimensioni , può essere costoso per i contribuenti .	ospitare uno enorme centro finanziario , con banca nazionale di ampio dimensione , potere essere costoso per il contribuente .	NFIN;V DET;INDF;MASC;SG ADJ;SG MASC;N;SG ADJ;MASC;SG _ ADP FEM;N;PL ADJ;PL ADP ADJ;FEM;PL FEM;N;PL _ 3;FIN;IND;PRS;SG;V NFIN;V ADJ;MASC;SG ADP DEF;DET;MASC;PL N;PL _
- in relazione a l' impatto di il programma su la convergenza di la formazione ad alto livello per formatori , non è stato possibile procedere ad una valutazione in quanto non erano disponibili sufficienti informazioni su il legame tra le strategie nazionali e le attività di il programma pericle .	- in relazione a il impatto di il programma su il convergenza di il formazione a alto livello per formatore , non essere essere possibile procedere a uno valutazione in quanto non essere disponibile sufficiente informazione su il legame tra il strategia nazionale e il attività di il programma pericle .	_ ADP FEM;N;SG ADP DEF;DET;SG MASC;N;SG ADP DEF;DET;MASC;SG MASC;N;SG ADP DEF;DET;FEM;SG FEM;N;SG ADP DEF;DET;FEM;SG FEM;N;SG ADP ADJ;MASC;SG MASC;N;SG ADP MASC;N;PL _ ADV 3;FIN;IND;PRS;SG;V MASC;PST;SG;V;V.PTCP ADJ;SG NFIN;V ADP DET;FEM;INDF;SG FEM;N;SG ADP ADV ADV 3;FIN;IND;IPFV;PL;V ADJ;PL ADJ;PL FEM;N;PL ADP DEF;DET;MASC;SG MASC;N;SG ADP DEF;DET;FEM;PL FEM;N;PL ADJ;PL CONJ DEF;DET;FEM;PL FEM;N ADP DEF;DET;MASC;SG MASC;N;SG PROPN _
questa situazione complessivamente favorevole è il risultato di una lunga preparazione a livello sia legislativo che istituzionale ed evidenzia l' alto grado di cooperazione raggiunto in ambito comunitario e internazionale .	questo situazione complessivamente favorevole essere il risultato di uno lungo preparazione a livello sia legislativo che istituzionale e evidenziare il alto grado di cooperazione raggiungere in ambito comunitario e internazionale .	DET;FEM;SG FEM;N;SG ADV ADJ;SG 3;FIN;IND;PRS;SG;V DEF;DET;MASC;SG MASC;N;SG ADP DET;FEM;INDF;SG ADJ;FEM;SG FEM;N;SG ADP MASC;N;SG CONJ ADJ;MASC;SG CONJ ADJ;SG CONJ 3;FIN;IND;PRS;SG;V DEF;DET;SG ADJ;MASC;SG MASC;N;SG ADP FEM;N;SG MASC;PST;SG;V;V.PTCP ADP MASC;N;SG ADJ;MASC;SG CONJ ADJ;SG _
gli espressionisti in germania e i futuristi a mosca montarono delle produzioni di le sue opere .	il espressionista in germania e il futurista a mosca montare di produzione di il suo opera .	DEF;DET;MASC;PL MASC;N;PL ADP PROPN CONJ DEF;DET;MASC;PL MASC;N;PL ADP PROPN 3;FIN;IND;PL;PST;V DET;FEM;PL FEM;N;PL ADP DEF;DET;FEM;PL DET;FEM;PL FEM;N;PL _
possono essere diverse le spiegazioni in merito .	potere essere diverso il spiegazione in merito .	3;FIN;IND;PL;PRS;V NFIN;V FEM;PL;PRO DEF;DET;FEM;PL FEM;N;PL ADP MASC;N;SG _
i soliloqui di il romanziere americano herman melville devono molto a shakespeare ;	il soliloquio di il romanziere americano herman melville dovere molto a shakespeare ;	DEF;DET;MASC;PL MASC;N;PL ADP DEF;DET;MASC;SG MASC;N;SG ADJ;MASC;SG PROPN PROPN 3;FIN;IND;PL;PRS;V MASC;PRO;SG ADP PROPN _
e il micelio inspira ossigeno , proprio come noi .	e il micelio inspirare ossigeno , proprio come noi .	CONJ DEF;DET;MASC;SG MASC;N;SG 3;FIN;IND;PRS;SG;V MASC;N;SG _ ADV ADP 1;PL;PRO _
devo però invitare a la cautela .	dovere però invitare a il cautela .	1;FIN;IND;PRS;SG;V ADV NFIN;V ADP DEF;DET;FEM;SG FEM;N;SG _
la realtà è che la protezione di la proprietà intellettuale è un motore economico a cui i cittadini di i paesi in via di sviluppo non dovrebbero essere obbligati a rinunciare .	il realtà essere che il protezione di il proprietà intellettuale essere uno motore economico a cui il cittadino di il paese in via di sviluppo non dovere essere obbligare a rinunciare .	DEF;DET;FEM;SG FEM;N 3;FIN;IND;PRS;SG;V CONJ DEF;DET;FEM;SG FEM;N;SG ADP DEF;DET;FEM;SG FEM;N ADJ;SG 3;FIN;IND;PRS;SG;V DET;INDF;MASC;SG MASC;N;SG ADJ;MASC;SG ADP PRO DEF;DET;MASC;PL MASC;N;PL ADP DEF;DET;MASC;PL MASC;N;PL ADP FEM;N;SG ADP MASC;N;SG ADV 3;COND;FIN;PL;PRS;V NFIN;V MASC;PL;PST;V;V.PTCP ADP NFIN;V _
le interrogazioni cui è stata data risposta in precedenza riguardavano un intervento di la commissario de palacio in un caso determinato , non le dichiarazioni pubblicate da il giornale abc il 18 novembre scorso .	il interrogazione cui essere essere dare risposta in precedenza riguardare uno intervento di il commissario de palacio in uno caso determinato , non il dichiarazione pubblicare da il giornale abc il 18 novembre scorso .	DEF;DET;FEM;PL FEM;N;PL PRO 3;FIN;IND;PRS;SG;V FEM;PST;SG;V;V.PTCP FEM;PST;SG;V;V.PTCP FEM;N;SG ADP FEM;N;SG 3;FIN;IND;IPFV;PL;V DET;INDF;MASC;SG MASC;N;SG ADP DEF;DET;FEM;SG N;SG ADP PROPN ADP DET;INDF;MASC;SG MASC;N;SG ADJ;MASC;SG _ ADV DEF;DET;FEM;PL FEM;N;PL FEM;PL;PST;V;V.PTCP ADP DEF;DET;MASC;SG MASC;N;SG PROPN DEF;DET;MASC;SG NUM MASC;N;SG ADJ;MASC;SG _
adorava balzac e ne studiò attentamente le opere , anche se criticava quella che chiamava la " volgarità di balzac " .	adorare balzac e ne studiare attentamente il opera , anche se criticare quello che chiamare il " volgarità di balzac " .	3;FIN;IND;IPFV;SG;V PROPN CONJ PRO 3;FIN;IND;PST;SG;V ADV DEF;DET;FEM;PL FEM;N;PL _ ADV CONJ 3;FIN;IND;IPFV;SG;V FEM;PRO;SG PRO 3;FIN;IND;IPFV;SG;V DEF;DET;FEM;SG _ FEM;N ADP PROPN _ _
il quadro normativo è pronto , adesso dobbiamo occupar ci di la sua attuazione .	il quadro normativo essere pronto , adesso dovere occupare ci di il suo attuazione .	DEF;DET;MASC;SG MASC;N;SG ADJ;MASC;SG 3;FIN;IND;PRS;SG;V ADJ;MASC;SG _ ADV 1;FIN;IND;PL;PRS;V NFIN;V 1;PL;PRO ADP DEF;DET;FEM;SG DET;FEM;SG FEM;N;SG _
il parlamento dovrebbe pertanto inviare un messaggio , come auspica la stragrande maggioranza di i deputati .	il parlamento dovere pertanto inviare uno messaggio , come auspicare il stragrande maggioranza di il deputato .	DEF;DET;MASC;SG MASC;N;SG 3;COND;FIN;PRS;SG;V ADV NFIN;V DET;INDF;MASC;SG MASC;N;SG _ CONJ 3;FIN;IND;PRS;SG;V DEF;DET;FEM;SG ADJ;SG FEM;N;SG ADP DEF;DET;MASC;PL MASC;N;PL _
il ritiro da il lavoro non era comune in quel periodo .	il ritiro da il lavoro non essere comune in quello periodo .	DEF;DET;MASC;SG MASC;N;SG ADP DEF;DET;MASC;SG MASC;N;SG ADV 3;FIN;IND;IPFV;SG;V ADJ;SG ADP DET;MASC;SG MASC;N;SG _
questa omissione fa sembrare che la commissione stessa non sappia minimamente come garantire il massimo coordinamento fra il sostegno a titolo di il fondo sociale europeo , soggetto a revisione dopo tre anni e mezzo , e i piani d' azione nazionali annuali per l' occupazione di gli stati membri .	questo omissione fare sembrare che il commissione stesso non sapere minimamente come garantire il massimo coordinamento fra il sostegno a titolo di il fondo sociale europeo , soggetto a revisione dopo tre anno e mezzo , e il piano di azione nazionale annuale per il occupazione di il stato membro .	DET;FEM;SG FEM;N;SG 3;FIN;IND;PRS;SG;V NFIN;V CONJ DEF;DET;FEM;SG FEM;N;SG ADJ;FEM;SG ADV 3;FIN;PRS;SBJV;SG;V ADV CONJ NFIN;V DEF;DET;MASC;SG ADJ;MASC;SG MASC;N;SG ADP DEF;DET;MASC;SG MASC;N;SG ADP MASC;N;SG ADP DEF;DET;MASC;SG MASC;N;SG ADJ;SG ADJ;MASC;SG _ ADJ;MASC;SG ADP FEM;N;SG ADP NUM MASC;N;PL CONJ MASC;N;SG _ CONJ DEF;DET;MASC;PL MASC;N;PL ADP FEM;N;SG ADJ;PL ADJ;PL ADP DEF;DET;SG FEM;N;SG ADP DEF;DET;MASC;PL MASC;N;PL MASC;N;PL _
credo che dovremmo essere capaci di dir lo chiaro e forte .	credere che dovere essere capace di dire lo chiaro e forte .	1;FIN;IND;PRS;SG;V CONJ 1;COND;FIN;PL;PRS;V NFIN;V ADJ;PL ADP NFIN;V 3;MASC;PRO;SG ADJ;MASC;SG CONJ ADJ;SG _
come testamento , shakespeare lasciò l' enorme tenuta a la sua figlia maggiore , susanna .	come testamento , shakespeare lasciare il enorme tenuta a il suo figlio maggiore , susanna .	ADP MASC;N;SG _ PROPN 3;FIN;IND;PST;SG;V DEF;DET;SG ADJ;SG FEM;N;SG ADP DEF;DET;FEM;SG DET;FEM;SG FEM;N;SG ADJ;CMPR;SG _ PROPN _
sono di il tutto certo che quel codice sarà rispettato e che il parlamento sarà tenuto a il corrente di l' evoluzione in atto e di ogni dettaglio su l' applicazione di i programmi .	essere di il tutto certo che quello codice essere rispettare e che il parlamento essere tenere a il corrente di il evoluzione in atto e di ogni dettaglio su il applicazione di il programma .	3;FIN;IND;PL;PRS;V ADP DEF;DET;MASC;SG MASC;PRO;SG ADJ;MASC;SG CONJ DET;MASC;SG MASC;N;SG 3;FIN;FUT;IND;SG;V MASC;PST;SG;V;V.PTCP CONJ CONJ DEF;DET;MASC;SG MASC;N;SG 3;FIN;FUT;IND;SG;V MASC;PST;SG;V;V.PTCP ADP DEF;DET;MASC;SG FEM;N;SG ADP DEF;DET;SG FEM;N;SG ADP MASC;N;SG CONJ ADP DET;SG MASC;N;SG ADP DEF;DET;SG FEM;N;SG ADP DEF;DET;MASC;PL MASC;N;PL _
di conseguenza , fu mandato spesso a la " nicchia " , una cella di punizione riservata a gli studenti disobbedienti .	di conseguenza , essere mandare spesso a il " nicchia " , uno cella di punizione riservato a il studente disobbedienti .	ADP FEM;N;SG _ 3;FIN;IND;PST;SG;V MASC;PST;SG;V;V.PTCP ADV ADP DEF;DET;FEM;SG _ FEM;N;SG _ _ DET;FEM;INDF;SG FEM;N;SG ADP FEM;N;SG ADJ;FEM;SG ADP DEF;DET;MASC;PL MASC;N;PL ADJ;MASC;PL _
