infine l' estensione di il contenuto di il sostegno tecnico e operativo a l' assistenza amministrativa per le inchieste in corso , con l' intermediazione di europol .	infine il estensione di il contenuto di il sostegno tecnico e operativo a il assistenza amministrativo per il inchiesta in corso , con il intermediazione di europol .	ADV DEF;DET;SG FEM;N;SG ADP DEF;DET;MASC;SG MASC;N;SG ADP DEF;DET;MASC;SG MASC;N;SG ADJ;MASC;SG CONJ ADJ;MASC;SG ADP DEF;DET;SG FEM;N;SG ADJ;FEM;SG ADP DEF;DET;FEM;PL FEM;N;PL ADP MASC;N;SG _ ADP DEF;DET;SG FEM;N;SG ADP PROPN _
il tribunale , di concerto con la corte di giustizia , apporta a il suo regolamento di procedura gli adattamenti resi necessari da l' adesione .	il tribunale , di concerto con il corte di giustizia , apportare a il suo regolamento di procedura il adattamento rendere necessario da il adesione .	DEF;DET;MASC;SG MASC;N;SG _ ADP MASC;N;SG ADP DEF;DET;FEM;SG FEM;N;SG ADP FEM;N;SG _ 3;FIN;IND;PRS;SG;V ADP DEF;DET;MASC;SG DET;MASC;SG MASC;N;SG ADP FEM;N;SG DEF;DET;MASC;PL MASC;N;PL MASC;PL;PST;V;V.PTCP ADJ;MASC;PL ADP DEF;DET;SG FEM;N;SG _
thomas fu obbligato da il tribunale ecclesiastico a fare pubblica penitenza , fatto che avrebbe causato ulteriore disonore e imbarazzo a la famiglia shakespeare .	thomas essere obbligare da il tribunale ecclesiastico a fare pubblico penitenza , fare che avere causare ulteriore disonore e imbarazzo a il famiglia shakespeare .	PROPN 3;FIN;IND;PST;SG;V MASC;PST;SG;V;V.PTCP ADP DEF;DET;MASC;SG MASC;N;SG ADJ;MASC;SG ADP NFIN;V ADJ;FEM;SG FEM;N;SG _ MASC;PST;SG;V;V.PTCP PRO 3;COND;FIN;PRS;SG;V MASC;PST;SG;V;V.PTCP ADJ;SG MASC;N;SG CONJ MASC;N;SG ADP DEF;DET;FEM;SG FEM;N;SG PROPN _
shakespeare continuò a visitare londra durante gli anni 1611 - 1614 .	shakespeare continuare a visitare londra durante il anno 1611 - 1614 .	PROPN 3;FIN;IND;PST;SG;V ADP NFIN;V PROPN ADP DEF;DET;MASC;PL MASC;N;PL NUM _ NUM _
la storia di balzac une heure de ma vie ( un' ora di la mia vita , 1822 ) , in cui i dettagli minuziosi sono seguiti da profonde riflessioni personali è un chiaro antecedente di lo stile che proust ha usato in à la recherche du temps perdu .	il storia di balzac une heure de ma vie ( uno ora di il mio vita , 1822 ) , in cui il dettaglio minuzioso essere seguire da profondo riflessione personale essere uno chiaro antecedente di il stile che proust avere usare in à il recherche du temps perdu .	DEF;DET;FEM;SG FEM;N;SG ADP PROPN DET;FEM;INDF;SG N;SG ADP DET;SG N;SG _ DET;FEM;INDF;SG FEM;N;SG ADP DEF;DET;FEM;SG DET;FEM;SG FEM;N;SG _ NUM _ _ ADP PRO DEF;DET;MASC;PL MASC;N;PL ADJ;MASC;PL 3;FIN;IND;PL;PRS;V MASC;PL;PST;V;V.PTCP ADP ADJ;FEM;PL FEM;N;PL ADJ;PL 3;FIN;IND;PRS;SG;V DET;INDF;MASC;SG ADJ;MASC;SG MASC;N;SG ADP DEF;DET;MASC;SG MASC;N;SG PRO PROPN 3;FIN;IND;PRS;SG;V MASC;PST;SG;V;V.PTCP ADP ADP DEF;DET;FEM;SG FEM;N;SG ADP;MASC;SG MASC;N;SG ADJ;MASC;SG _
chiedo che venga riesaminata tale decisione , in quanto non è così .	chiedere che venire riesaminare tale decisione , in quanto non essere così .	1;FIN;IND;PRS;SG;V CONJ 3;FIN;PRS;SBJV;SG;V FEM;PST;SG;V;V.PTCP DET;SG FEM;N;SG _ ADP ADV ADV 3;FIN;IND;PRS;SG;V ADV _
la ricerca scientifica mirata a lo sviluppo di prodotti come gli insetti sterili irradiati o le zanzare oxitec è progredita passando da condizioni più limitate ad un contesto più agevole , ovvero da il laboratorio , ad ambienti ridotti per i test ad aree confinate in cui fare le sperimentazioni .	il ricerca scientifico mirare a il sviluppo di prodotto come il insetto sterile irradiare o il zanzara oxitec essere progredire passare da condizione più limitato a uno contesto più agevole , ovvero da il laboratorio , a ambiente ridotto per il test a area confinare in cui fare il sperimentazione .	DEF;DET;FEM;SG FEM;N;SG ADJ;FEM;SG FEM;PST;SG;V;V.PTCP ADP DEF;DET;MASC;SG MASC;N;SG ADP MASC;N;PL ADP DEF;DET;MASC;PL MASC;N;PL ADJ;PL MASC;PL;PST;V;V.PTCP CONJ DEF;DET;FEM;PL FEM;N;PL PROPN 3;FIN;IND;PRS;SG;V FEM;PST;SG;V;V.PTCP V;V.MSDR ADP FEM;N;PL ADV ADJ;FEM;PL ADP DET;INDF;MASC;SG MASC;N;SG ADV ADJ;SG _ CONJ ADP DEF;DET;MASC;SG MASC;N;SG _ ADP MASC;N;PL ADJ;MASC;PL ADP DEF;DET;MASC;PL MASC;N ADP FEM;N;PL FEM;PL;PST;V;V.PTCP ADP PRO NFIN;V DEF;DET;FEM;PL FEM;N;PL _
non c' è nulla di simulato , però , in gli sforzi profusi da noi ucraini per difendere il nostro paese e la nostra democrazia .	non ci essere nulla di simulare , però , in il sforzo profondere da noi ucraino per difendere il nostro paese e il nostro democrazia .	ADV PRO 3;FIN;IND;PRS;SG;V MASC;PRO;SG ADP MASC;PST;SG;V;V.PTCP _ ADV _ ADP DEF;DET;MASC;PL MASC;N;PL MASC;PL;PST;V;V.PTCP ADP 1;PL;PRO ADJ;MASC;PL ADP NFIN;V DEF;DET;MASC;SG DET;MASC;SG MASC;N;SG CONJ DEF;DET;FEM;SG DET;FEM;SG FEM;N;SG _
le sovvenzioni non bastano per costruire lo sviluppo se le infrastrutture e i servizi pubblici sono carenti .	il sovvenzione non bastare per costruire il sviluppo se il infrastruttura e il servizio pubblico essere carente .	DEF;DET;FEM;PL FEM;N;PL ADV 3;FIN;IND;PL;PRS;V ADP NFIN;V DEF;DET;MASC;SG MASC;N;SG CONJ DEF;DET;FEM;PL FEM;N;PL CONJ DEF;DET;MASC;PL MASC;N;PL ADJ;MASC;PL 3;FIN;IND;PL;PRS;V ADJ;PL _
questo evento segna uno di quei momenti storici che restano a lungo impressi in la memoria collettiva di una società .	questo evento segnare uno di quello momento storico che restare a lungo imprimere in il memoria collettivo di uno società .	DET;MASC;SG MASC;N;SG 3;FIN;IND;PRS;SG;V MASC;PRO;SG ADP DET;MASC;PL MASC;N;PL ADJ;MASC;PL PRO 3;FIN;IND;PL;PRS;V ADP MASC;N;SG MASC;PL;PST;V;V.PTCP ADP DEF;DET;FEM;SG FEM;N;SG ADJ;FEM;SG ADP DET;FEM;INDF;SG FEM;N _
e altre parti di l' economia che forniscono servizi a l' industria finanziaria - i rivenditori porsche e gli strip club , ad esempio - saranno similmente incoraggiati .	e altro parte di il economia che fornire servizio a il industria finanziario - il rivenditore porsche e il strip club , a esempio - essere similmente incoraggiare .	CONJ ADJ;FEM;PL FEM;N;PL ADP DEF;DET;SG FEM;N;SG PRO 3;FIN;IND;PL;PRS;V MASC;N;PL ADP DEF;DET;SG FEM;N;SG ADJ;FEM;SG _ DEF;DET;MASC;PL MASC;N;PL PROPN CONJ DEF;DET;MASC;PL N MASC;N _ ADP MASC;N;SG _ 3;FIN;FUT;IND;PL;V ADV MASC;PL;PST;V;V.PTCP _
la presente comunicazione tiene conto di le conclusioni e raccomandazioni di la relazione di valutazione , contiene informazioni su l' attuazione di il programma ed è corredata di una proposta di estensione e adattamento di la decisione iniziale .	il presente comunicazione tenere conto di il conclusione e raccomandazione di il relazione di valutazione , contenere informazione su il attuazione di il programma e essere corredare di uno proposta di estensione e adattamento di il decisione iniziale .	DEF;DET;FEM;SG ADJ;SG FEM;N;SG 3;FIN;IND;PRS;SG;V MASC;N;SG ADP DEF;DET;FEM;PL FEM;N;PL CONJ FEM;N;PL ADP DEF;DET;FEM;SG FEM;N;SG ADP FEM;N;SG _ 3;FIN;IND;PRS;SG;V FEM;N;PL ADP DEF;DET;SG FEM;N;SG ADP DEF;DET;MASC;SG MASC;N;SG CONJ 3;FIN;IND;PRS;SG;V FEM;PST;SG;V;V.PTCP ADP DET;FEM;INDF;SG FEM;N;SG ADP FEM;N;SG CONJ MASC;N;SG ADP DEF;DET;FEM;SG FEM;N;SG ADJ;SG _
sténie , falthurne e corsino .	sténie , falthurne e corsino .	PROPN _ PROPN CONJ PROPN _
ma visto il rapido sviluppo di le tecnologie di la governance e di il potere , anche la prospettiva pessimista merita una considerazione .	ma vedere il rapido sviluppo di il tecnologia di il governance e di il potere , anche il prospettiva pessimista meritare uno considerazione .	CONJ MASC;PST;SG;V;V.PTCP DEF;DET;MASC;SG ADJ;MASC;SG MASC;N;SG ADP DEF;DET;FEM;PL FEM;N;PL ADP DEF;DET;FEM;SG FEM;N;SG CONJ ADP DEF;DET;MASC;SG MASC;N;SG _ ADV DEF;DET;FEM;SG FEM;N;SG ADJ;SG 3;FIN;IND;PRS;SG;V DET;FEM;INDF;SG FEM;N;SG _
sotto molti aspetti , egli è l' opposto di il repubblicano democratico victor hugo .	sotto molto aspetto , egli essere il opposto di il repubblicano democratico victor hugo .	ADP DET;MASC;PL MASC;N;PL _ 3;MASC;PRO;SG 3;FIN;IND;PRS;SG;V DEF;DET;SG MASC;N;SG ADP DEF;DET;MASC;SG MASC;N;SG ADJ;MASC;SG PROPN PROPN _
i rapporti con la sua famiglia furono spesso stressati da difficoltà finanziarie e personali , e interruppe molte amicizie a causa di recensioni critiche .	il rapporto con il suo famiglia essere spesso stressati da difficoltà finanziario e personale , e interrompere molto amicizia a causa di recensione critico .	DEF;DET;MASC;PL MASC;N;PL ADP DEF;DET;FEM;SG DET;FEM;SG FEM;N;SG 3;FIN;IND;PL;PST;V ADV MASC;PL;PST;V;V.PTCP ADP FEM;N ADJ;FEM;PL CONJ ADJ;PL _ CONJ 3;FIN;IND;PST;SG;V DET;FEM;PL FEM;N;PL ADP FEM;N;SG ADP FEM;N;PL ADJ;FEM;PL _
devi mantenere intatte tutte le informative che si riferiscono a la presente licenza ed a l' esclusione di le garanzie .	dovere mantenere intatto tutto il informativo che si riferire a il presente licenza e a il esclusione di il garanzia .	2;FIN;IND;PRS;SG;V NFIN;V ADJ;FEM;PL DET;FEM;PL DEF;DET;FEM;PL ADJ;FEM;PL PRO 3;PRO 3;FIN;IND;PL;PRS;V ADP DEF;DET;FEM;SG ADJ;SG FEM;N;SG CONJ ADP DEF;DET;SG FEM;N;SG ADP DEF;DET;FEM;PL FEM;N;PL _
troppe persone lavorano in l' industria di i servizi tradizionali a bassa produttività , come il commercio a l' ingrosso e a il dettaglio e la ristorazione , lasciando in uno stato di arretratezza servizi moderni e ad alta produttività quali le comunicazioni , la salute , l' intermediazione finanziaria e i servizi aziendali .	troppo persona lavorare in il industria di il servizio tradizionale a basso produttività , come il commercio a il ingrosso e a il dettaglio e il ristorazione , lasciare in uno stato di arretratezza servizio moderno e a alto produttività quale il comunicazione , il salute , il intermediazione finanziario e il servizio aziendale .	DET;FEM;PL FEM;N;PL 3;FIN;IND;PL;PRS;V ADP DEF;DET;SG FEM;N;SG ADP DEF;DET;MASC;PL MASC;N;PL ADJ;PL ADP ADJ;FEM;SG FEM;N _ ADP DEF;DET;MASC;SG MASC;N;SG ADP DEF;DET;SG MASC;N;SG CONJ ADP DEF;DET;MASC;SG MASC;N;SG CONJ DEF;DET;FEM;SG FEM;N;SG _ V;V.MSDR ADP DET;INDF;MASC;SG MASC;N;SG ADP FEM;N;SG MASC;N;PL ADJ;MASC;PL CONJ ADP ADJ;FEM;SG FEM;N ADP DEF;DET;FEM;PL FEM;N;PL _ DEF;DET;FEM;SG FEM;N;SG _ DEF;DET;SG FEM;N;SG ADJ;FEM;SG CONJ DEF;DET;MASC;PL MASC;N;PL ADJ;PL _
non è concessa alcuna proroga di il periodo per l' assegnazione di i contratti .	non essere concedere alcuno proroga di il periodo per il assegnazione di il contratto .	ADV 3;FIN;IND;PRS;SG;V FEM;PST;SG;V;V.PTCP DET;FEM;SG FEM;N;SG ADP DEF;DET;MASC;SG MASC;N;SG ADP DEF;DET;SG FEM;N;SG ADP DEF;DET;MASC;PL MASC;N;PL _
se prendiamo come indicatore unico il prodotto interno lordo per abitante , possiamo anche sbagliar ci .	se prendere come indicatore unico il prodotto interno lordo per abitante , potere anche sbagliare ci .	CONJ 1;FIN;IND;PL;PRS;V ADP MASC;N;SG ADJ;MASC;SG DEF;DET;MASC;SG MASC;N;SG ADJ;MASC;SG ADJ;MASC;SG ADP N;SG _ 1;FIN;IND;PL;PRS;V ADV NFIN;V 1;PL;PRO _
in passato questo parlamento ha riconosciuto il grosso potenziale di creazione di occupazione di l' economia sociale .	in passato questo parlamento avere riconoscere il grosso potenziale di creazione di occupazione di il economia sociale .	ADP MASC;N;SG DET;MASC;SG MASC;N;SG 3;FIN;IND;PRS;SG;V MASC;PST;SG;V;V.PTCP DEF;DET;MASC;SG ADJ;MASC;SG MASC;N;SG ADP FEM;N;SG ADP FEM;N;SG ADP DEF;DET;SG FEM;N;SG ADJ;SG _
entrando in il merito , ritengo che i cittadini europei debbano poter essere certi che i trasporti in europa su strada , per ferrovia o con altri mezzi , avvengano in condizioni di massima sicurezza , anche in il caso in cui si tratti di merci pericolose .	entrare in il merito , ritenere che il cittadino europeo dovere potere essere certo che il trasporto in europa su strada , per ferrovia o con altro mezzo , avvenire in condizione di massimo sicurezza , anche in il caso in cui si trattare di merce pericoloso .	V;V.MSDR ADP DEF;DET;MASC;SG MASC;N;SG _ 1;FIN;IND;PRS;SG;V CONJ DEF;DET;MASC;PL MASC;N;PL ADJ;MASC;PL 3;FIN;PL;PRS;SBJV;V NFIN;V NFIN;V ADJ;MASC;PL CONJ DEF;DET;MASC;PL MASC;N;PL ADP PROPN ADP FEM;N;SG _ ADP FEM;N;SG CONJ ADP ADJ;MASC;PL MASC;N;PL _ 3;FIN;PL;PRS;SBJV;V ADP FEM;N;PL ADP ADJ;FEM;SG FEM;N;SG _ ADV ADP DEF;DET;MASC;SG MASC;N;SG ADP PRO 3;PRO 2;FIN;IND;PRS;SG;V ADP FEM;N;PL ADJ;FEM;PL _
e' quella piramide .	essere quello piramide .	3;FIN;IND;PRS;SG;V DET;FEM;SG FEM;N;SG _
signora presidente , sarebbe opportuno che inviasse una lettera a la presidente di il sri lanka per esprimere le condoglianze di il parlamento per questa e le altre morti violente verificate si in sri lanka e per invitar la a fare quanto in suo potere a il fine di giungere a una riconciliazione pacifica in questa situazione assai difficile .	signore presidente , essere opportuno che inviare uno lettera a il presidente di il sri lanka per esprimere il condoglianza di il parlamento per questo e il altro morte violento verificare si in sri lanka e per invitare la a fare quanto in suo potere a il fine di giungere a uno riconciliazione pacifico in questo situazione assai difficile .	FEM;N;SG N;SG _ 3;COND;FIN;PRS;SG;V ADJ;MASC;SG CONJ 3;FIN;IPFV;SBJV;SG;V DET;FEM;INDF;SG FEM;N;SG ADP DEF;DET;FEM;SG N;SG ADP DEF;DET;MASC;SG PROPN PROPN ADP NFIN;V DEF;DET;FEM;PL FEM;N;PL ADP DEF;DET;MASC;SG MASC;N;SG ADP FEM;PRO;SG CONJ DEF;DET;FEM;PL ADJ;FEM;PL FEM;N;PL ADJ;FEM;PL 3;FIN;IND;PRS;SG;V 3;PRO ADP PROPN PROPN CONJ ADP NFIN;V 3;FEM;PRO;SG ADP NFIN;V MASC;PRO;SG ADP DET;MASC;SG MASC;N;SG ADP DEF;DET;MASC;SG N;SG ADP NFIN;V ADP DET;FEM;INDF;SG FEM;N;SG ADJ;FEM;SG ADP DET;FEM;SG FEM;N;SG ADV ADJ;SG _
signora presidente , in questo parlamento , a ragione per altro , si pone regolarmente in risalto l' importanza di la sicurezza di i trasporti .	signore presidente , in questo parlamento , a ragione per altro , si porre regolarmente in risalto il importanza di il sicurezza di il trasporto .	FEM;N;SG N;SG _ ADP DET;MASC;SG MASC;N;SG _ ADP FEM;N;SG ADP MASC;PRO;SG _ 3;PRO 3;FIN;IND;PRS;SG;V ADV ADP MASC;N;SG DEF;DET;SG FEM;N;SG ADP DEF;DET;FEM;SG FEM;N;SG ADP DEF;DET;MASC;PL MASC;N;PL _
è stato elaborato un codice di condotta su le questioni attinenti a la stampa e a la comunicazione ;	essere essere elaborare uno codice di condotta su il questione attinente a il stampa e a il comunicazione ;	3;FIN;IND;PRS;SG;V MASC;PST;SG;V;V.PTCP MASC;PST;SG;V;V.PTCP DET;INDF;MASC;SG MASC;N;SG ADP FEM;N;SG ADP DEF;DET;FEM;PL FEM;N;PL ADJ;PL ADP DEF;DET;FEM;SG FEM;N;SG CONJ ADP DEF;DET;FEM;SG FEM;N;SG _
invece di migliorare l' accesso di i cittadini a la sanità , la protezione debole di la proprietà intellettuale sta infatti peggiorando le grandi sfide di l' india in il settore di la sanità .	invece di migliorare il accesso di il cittadino a il sanità , il protezione debole di il proprietà intellettuale stare infatti peggiorare il grande sfida di il india in il settore di il sanità .	ADP ADP NFIN;V DEF;DET;SG MASC;N;SG ADP DEF;DET;MASC;PL MASC;N;PL ADP DEF;DET;FEM;SG FEM;N _ DEF;DET;FEM;SG FEM;N;SG ADJ;SG ADP DEF;DET;FEM;SG FEM;N ADJ;SG 3;FIN;IND;PRS;SG;V ADV V;V.MSDR DEF;DET;FEM;PL ADJ;PL FEM;N;PL ADP DEF;DET;SG PROPN ADP DEF;DET;MASC;SG MASC;N;SG ADP DEF;DET;FEM;SG FEM;N _
il tasso di partecipazione a la forza lavoro di le donne con un' istruzione post secondaria è di il 64 % , molto superiore rispetto a quello di le donne che hanno completato solo le scuole elementari o medie , pari a il 35 % .	il tasso di partecipazione a il forza lavoro di il donna con uno istruzione post secondario essere di il 64 % , molto superiore rispetto a quello di il donna che avere completare solo il scuola elementare o medio , pari a il 35 % .	DEF;DET;MASC;SG MASC;N;SG ADP FEM;N;SG ADP DEF;DET;FEM;SG FEM;N;SG MASC;N;SG ADP DEF;DET;FEM;PL FEM;N;PL ADP DET;FEM;INDF;SG FEM;N;SG ADV ADJ;FEM;SG 3;FIN;IND;PRS;SG;V ADP DEF;DET;MASC;SG NUM _ _ ADV ADJ;CMPR;SG ADP ADP MASC;PRO;SG ADP DEF;DET;FEM;PL FEM;N;PL PRO 3;FIN;IND;PL;PRS;V MASC;PST;SG;V;V.PTCP ADV DEF;DET;FEM;PL FEM;N;PL ADJ;PL CONJ ADJ;FEM;PL _ ADJ ADP DEF;DET;MASC;SG NUM _ _
gli adattamenti proposti riguardano :	il adattamento proporre riguardare :	DEF;DET;MASC;PL MASC;N;PL MASC;PL;PST;V;V.PTCP 3;FIN;IND;PL;PRS;V _
le norme armonizzate non dovrebbero avere lo scopo di fissare limiti riguardo a gli aspetti ambientali .	il norma armonizzare non dovere avere il scopo di fissare limite riguardo a il aspetto ambientale .	DEF;DET;FEM;PL FEM;N;PL FEM;PL;PST;V;V.PTCP ADV 3;COND;FIN;PL;PRS;V NFIN;V DEF;DET;MASC;SG MASC;N;SG ADP NFIN;V MASC;N;PL ADP ADP DEF;DET;MASC;PL MASC;N;PL ADJ;PL _
per quella comunità l' inquinamento significava guadagno .	per quello comunità il inquinamento significare guadagno .	ADP DET;FEM;SG FEM;N DEF;DET;SG MASC;N;SG 3;FIN;IND;IPFV;SG;V MASC;N;SG _
spero che sarà esaminata con uno spirito positivo .	sperare che essere esaminare con uno spirito positivo .	1;FIN;IND;PRS;SG;V CONJ 3;FIN;FUT;IND;SG;V FEM;PST;SG;V;V.PTCP ADP DET;INDF;MASC;SG MASC;N;SG ADJ;MASC;SG _
poi si alzava e scriveva per molte ore , alimentato da innumerevoli tazze di caffé nero .	poi si alzare e scrivere per molto ora , alimentare da innumerevole tazza di caffè nero .	ADV 3;PRO 3;FIN;IND;IPFV;SG;V CONJ 3;FIN;IND;IPFV;SG;V ADP DET;FEM;PL FEM;N;PL _ MASC;PST;SG;V;V.PTCP ADP ADJ;PL FEM;N;PL ADP MASC;N ADJ;MASC;SG _
le sue opere teatrali sono state tradotte in tutte le maggiori lingue esistenti e sono messe in scena più spesso di quelle di qualsiasi altro drammaturgo .	il suo opera teatrale essere essere tradurre in tutto il maggiore lingua esistere e essere mettere in scena più spesso di quello di qualsiasi altro drammaturgo .	DEF;DET;FEM;PL DET;FEM;PL FEM;N;PL ADJ;PL 3;FIN;IND;PL;PRS;V FEM;PL;PST;V;V.PTCP FEM;PL;PST;V;V.PTCP ADP DET;FEM;PL DEF;DET;FEM;PL ADJ;CMPR;PL FEM;N;PL PL;PRS;V;V.PTCP CONJ 3;FIN;IND;PL;PRS;V FEM;PL;PST;V;V.PTCP ADP FEM;N;SG ADV ADV ADP FEM;PL;PRO ADP DET;SG ADJ;MASC;SG MASC;N;SG _
shakespeare è stato commemorato in molte statue e memoriali in giro per il mondo , inclusi i monumenti funerari di la cattedrale di southwark e il poet's corner di westminster abbey .	shakespeare essere essere commemorare in molto statua e memoriale in giro per il mondo , includere il monumento funerario di il cattedrale di southwark e il poet's corner di westminster abbey .	PROPN 3;FIN;IND;PRS;SG;V MASC;PST;SG;V;V.PTCP MASC;PST;SG;V;V.PTCP ADP DET;FEM;PL FEM;N;PL CONJ MASC;N;PL ADP MASC;N;SG ADP DEF;DET;MASC;SG MASC;N;SG _ MASC;PL;PST;V;V.PTCP DEF;DET;MASC;PL MASC;N;PL ADJ;MASC;PL ADP DEF;DET;FEM;SG FEM;N;SG ADP PROPN CONJ DEF;DET;MASC;SG PROPN PROPN ADP PROPN PROPN _
le differenze possono derivare da errori di copiatura o di stampa , da gli appunti di gli attori o di i membri di il pubblico , o infine da gli stessi scritti di shakespeare .	il differenza potere derivare da errore di copiatura o di stampa , da il appunto di il attore o di il membro di il pubblico , o infine da il stesso scritto di shakespeare .	DEF;DET;FEM;PL FEM;N;PL 3;FIN;IND;PL;PRS;V NFIN;V ADP MASC;N;PL ADP FEM;N;SG CONJ ADP FEM;N;SG _ ADP DEF;DET;MASC;PL MASC;N;PL ADP DEF;DET;MASC;PL MASC;N;PL CONJ ADP DEF;DET;MASC;PL MASC;N;PL ADP DEF;DET;MASC;SG MASC;N;SG _ CONJ ADV ADP DEF;DET;MASC;PL ADJ;MASC;PL MASC;N;PL ADP PROPN _
il licenziante non sarà vincolato ad alcuna altra disposizione addizionale che possa apparire in alcuna comunicazione da te proveniente .	il licenziante non essere vincolare a alcuno altro disposizione addizionale che potere apparire in alcuno comunicazione da te provenire .	DEF;DET;MASC;SG PROPN ADV 3;FIN;FUT;IND;SG;V MASC;PST;SG;V;V.PTCP ADP DET;FEM;SG ADJ;FEM;SG FEM;N;SG ADJ;MASC;SG PRO 3;FIN;PRS;SBJV;SG;V NFIN;V ADP DET;FEM;SG FEM;N;SG ADP 2;PRO;SG PRS;SG;V;V.PTCP _
in le sue pagine egli cercò di favorire la completa imparzialità ed un riconoscimento ragionato di le varie ideologie .	in il suo pagina egli cercare di favorire il completo imparzialità e uno riconoscimento ragionare di il vario ideologia .	ADP DEF;DET;FEM;PL DET;FEM;PL FEM;N;PL 3;MASC;PRO;SG 3;FIN;IND;PST;SG;V ADP NFIN;V DEF;DET;FEM;SG ADJ;FEM;SG FEM;N CONJ DET;INDF;MASC;SG MASC;N;SG MASC;PST;SG;V;V.PTCP ADP DEF;DET;FEM;PL ADJ;FEM;PL FEM;N;PL _
posso creare un account facebook congiunto o condividere un account facebook con qualcun altro ?	potere creare uno account facebook congiunto o condividere uno account facebook con qualcuno altro ?	1;FIN;IND;PRS;SG;V NFIN;V DET;INDF;MASC;SG N PROPN ADJ;MASC;SG CONJ NFIN;V DET;INDF;MASC;SG N PROPN ADP DET;MASC;SG MASC;PRO;SG _
in realtà , per essere efficace qualunque strategia di crescita deve cercare di promuovere maggiori e migliori opportunità economiche per le donne , anche attraverso la creazione di ambienti di lavoro più favorevoli e l' istituzione di un sistema educativo più diversificato e flessibile .	in realtà , per essere efficace qualunque strategia di crescita dovere cercare di promuovere maggiore e migliore opportunità economico per il donna , anche attraverso il creazione di ambiente di lavoro più favorevole e il istituzione di uno sistema educativo più diversificato e flessibile .	ADP FEM;N;SG _ ADP NFIN;V ADJ;SG DET;SG FEM;N;SG ADP FEM;N;SG 3;FIN;IND;PRS;SG;V NFIN;V ADP NFIN;V ADJ;CMPR;PL CONJ ADJ;CMPR;PL FEM;N ADJ;FEM;PL ADP DEF;DET;FEM;PL FEM;N;PL _ ADV ADP DEF;DET;FEM;SG FEM;N;SG ADP MASC;N;PL ADP MASC;N;SG ADV ADJ;PL CONJ DEF;DET;SG FEM;N;SG ADP DET;INDF;MASC;SG MASC;N;SG ADJ;MASC;SG ADV ADJ;MASC;SG CONJ ADJ;SG _
molti ricercatori preminenti in materia di salute , inclusi kelly brownell , david ludwig e walter willett , hanno documentato questi problemi .	molto ricercatore preminente in materia di salute , includere kelly brownell , david ludwig e walter willett , avere documentare questo problema .	DET;MASC;PL MASC;N;PL ADJ;PL ADP FEM;N;SG ADP FEM;N;SG _ MASC;PL;PST;V;V.PTCP PROPN PROPN _ PROPN PROPN CONJ PROPN PROPN _ 3;FIN;IND;PL;PRS;V MASC;PST;SG;V;V.PTCP DET;MASC;PL MASC;N;PL _
quindi verificheremo con estrema attenzione per essere certi che tutto sia corretto .	quindi verificare con estremo attenzione per essere certo che tutto essere correggere .	CONJ 1;FIN;FUT;IND;PL;V ADP ADJ;FEM;SG FEM;N;SG ADP NFIN;V ADJ;MASC;PL CONJ MASC;PRO;SG 3;FIN;PRS;SBJV;SG;V MASC;PST;SG;V;V.PTCP _
le disposizioni di tale protocollo costituiscono parte integrante di il presente trattato .	il disposizione di tale protocollo costituire parte integrare di il presente trattato .	DEF;DET;FEM;PL FEM;N;PL ADP DET;SG MASC;N;SG 3;FIN;IND;PL;PRS;V FEM;N;SG PRS;SG;V;V.PTCP ADP DEF;DET;MASC;SG ADJ;SG MASC;N;SG _
programmi di trasferimenti di denaro solo a determinate condizioni , iniziative basate su l' invio di sms , programmi alimentari in le scuole , programmi di fortificazione vitaminica , una leadership locale di qualità , si sono tutti dimostrati efficaci in il migliorare la nutrizione materna .	programma di trasferimento di denaro solo a determinato condizione , iniziativa basato su il invio di sms , programma alimentare in il scuola , programma di fortificazione vitaminico , uno leadership locale di qualità , si essere tutto dimostrare efficace in il migliorare il nutrizione materno .	MASC;N;PL ADP MASC;N;PL ADP MASC;N;SG ADV ADP DET;FEM;PL FEM;N;PL _ FEM;N;PL ADJ;FEM;PL ADP DEF;DET;SG MASC;N;SG ADP N _ MASC;N;PL ADJ;PL ADP DEF;DET;FEM;PL FEM;N;PL _ MASC;N;PL ADP FEM;N;SG ADJ;FEM;SG _ DET;FEM;INDF;SG FEM;N ADJ;SG ADP FEM;N _ 3;PRO 3;FIN;IND;PL;PRS;V MASC;PL;PRO MASC;PL;PST;V;V.PTCP ADJ;PL ADP DEF;DET;MASC;SG NFIN;V DEF;DET;FEM;SG FEM;N;SG ADJ;FEM;SG _
tali risultati sono a la base di i programmi europei di tutela di il mare di barents .	tale risultato essere a il base di il programma europeo di tutela di il mare di barents .	DET;PL MASC;N;PL 3;FIN;IND;PL;PRS;V ADP DEF;DET;FEM;SG FEM;N;SG ADP DEF;DET;MASC;PL MASC;N;PL ADJ;MASC;PL ADP FEM;N;SG ADP DEF;DET;MASC;SG MASC;N;SG ADP PROPN _
a diciotto anni sposò la ventiseienne anne hathaway , che era incinta .	a diciotto anno sposare il ventiseienne anne hathaway , che essere incinto .	ADP NUM MASC;N;PL 3;FIN;IND;PST;SG;V DEF;DET;FEM;SG ADJ;FEM;PL PROPN PROPN _ PRO 3;FIN;IND;IPFV;SG;V ADJ;FEM;SG _
ma la profondità e la persistenza di la crisi in corso hanno portato a galla le fragilità intrinseche di l' euro , un avvertimento che le odierne tamponature su il piano tecnocratico potrebbero non reggere a l' ennesimo shock .	ma il profondità e il persistenza di il crisi in corso avere portare a galla il fragilità intrinseco di il euro , uno avvertimento che il odierno tamponatura su il piano tecnocratico potere non reggere a il ennesimo shock .	CONJ DEF;DET;FEM;SG FEM;N CONJ DEF;DET;FEM;SG FEM;N;SG ADP DEF;DET;FEM;SG FEM;N ADP MASC;N;SG 3;FIN;IND;PL;PRS;V MASC;PST;SG;V;V.PTCP ADP FEM;N;SG DEF;DET;FEM;PL FEM;N ADJ;FEM;PL ADP DEF;DET;SG MASC;N _ DET;INDF;MASC;SG MASC;N;SG PRO DEF;DET;FEM;PL ADJ;FEM;PL FEM;N;PL ADP DEF;DET;MASC;SG MASC;N;SG ADJ;MASC;SG 3;COND;FIN;PL;PRS;V ADV NFIN;V ADP DEF;DET;SG ADJ;MASC;SG MASC;N _
è stato concordato un pacchetto di riforme .	essere essere concordare uno pacchetto di riforma .	3;FIN;IND;PRS;SG;V MASC;PST;SG;V;V.PTCP MASC;PST;SG;V;V.PTCP DET;INDF;MASC;SG MASC;N;SG ADP FEM;N;PL _
la recente telefonata di il presidente russo vladimir putin a il presidente americano barack obama per riaccendere le trattative diplomatiche , seguita da un documento russo su come risolvere la crisi da parte di il cremlino , è di fatto offensiva per la pace .	il recente telefonata di il presidente russo vladimir putin a il presidente americano barack obama per riaccendere il trattativa diplomatico , seguire da uno documento russo su come risolvere il crisi da parte di il cremlino , essere di fatto offensivo per il pace .	DEF;DET;FEM;SG ADJ;SG FEM;N;SG ADP DEF;DET;MASC;SG MASC;N;SG ADJ;MASC;SG PROPN PROPN ADP DEF;DET;MASC;SG MASC;N;SG ADJ;MASC;SG PROPN PROPN ADP NFIN;V DEF;DET;FEM;PL FEM;N;PL ADJ;FEM;PL _ FEM;PST;SG;V;V.PTCP ADP DET;INDF;MASC;SG MASC;N;SG ADJ;MASC;SG ADP CONJ NFIN;V DEF;DET;FEM;SG FEM;N ADP FEM;N;SG ADP DEF;DET;MASC;SG PROPN _ 3;FIN;IND;PRS;SG;V ADP MASC;N;SG ADJ;FEM;SG ADP DEF;DET;FEM;SG FEM;N;SG _
