пад асаблівым кантролем апынуцца дарогі р - 23 мінск - мікашэвічы , р - 58 мінск - калачы - мядзел , м - 5 мінск - гомель .	пад асаблівы кантроль апынуцца дарога р - 23 мінск - мікашэвіч , р - 58 мінск - калач - мядзел , м - 5 мінск - гомель .	ADP ADJ;INS;MASC;SG INAN;INS;MASC;N;SG 3;FIN;FUT;IND;MID;PFV;PL;V FEM;INAN;N;NOM;PL PROPN _ NOM;NUM INAN;MASC;NOM;PROPN;SG _ INAN;MASC;NOM;PROPN;SG _ PROPN _ NOM;NUM INAN;MASC;NOM;PROPN;SG _ INAN;MASC;NOM;PROPN;SG _ INAN;MASC;NOM;PROPN;SG _ PROPN _ NOM;NUM INAN;MASC;NOM;PROPN;SG _ INAN;MASC;NOM;PROPN;SG _
акрамя гэтага , спецыяліст паведаміў , што ў беларусі распрацаваны рэгламент вакуумавання бульбы .	акрамя гэта , спецыяліст паведаміць , што ў беларусь распрацаваць рэгламент вакуумаванне бульба .	ADP GEN;INAN;NEUT;PRO;SG _ ANIM;MASC;N;NOM;SG ACT;FIN;IND;MASC;PFV;PST;SG;V _ CONJ ADP ESS;FEM;INAN;PROPN;SG MASC;PASS;PFV;PST;SG;V;V.PTCP INAN;MASC;N;NOM;SG GEN;INAN;N;NEUT;SG GEN;INAN;MASC;N;SG _
калі я ўрэшце сустрэла беларускамоўных людзей , у мяне не было ніякіх праблемаў іх разумець .	калі я ўрэшце сустрэць беларускамоўны чалавек , у я не быць ніякi праблема яны разумець .	CONJ 1;NOM;PRO;SG ADV ACT;FEM;FIN;IND;PFV;PST;SG;V ACC;ADJ;ANIM;PL ACC;ANIM;MASC;N;PL _ ADP 1;GEN;PRO;SG NEG;PART ACT;FIN;IND;IPFV;NEUT;PST;SG;V DET;GEN;PL FEM;GEN;INAN;N;PL 3;ACC;PL;PRO ACT;IPFV;NFIN;V _
вранава : беларусы мне расказвалі аб сваёй слаўнай гісторыі .	вранава : беларус я расказваць аб свой слаўны гісторыя .	ANIM;FEM;NOM;PROPN;SG _ ANIM;MASC;N;NOM;PL 1;DAT;PRO;SG ACT;FIN;IND;IPFV;PL;PST;V ADP DET;ESS;FEM;SG ADJ;ESS;FEM;SG ESS;FEM;INAN;N;SG _
так , у 2010 і 2011 гадах таксама былі прыведзены ў выкананне смяротныя прысуды ў дачыненні да асоб , чые справы знаходзіліся на разглядзе камітэта па правах чалавека аан .	так , у 2010 і 2011 год таксама быць прывесцi ў выкананне смяротны прысуд ў дачыненне да асоба , чый справа знаходзіцца на разгляд камітэт па права чалавек аан .	ADV _ ADP ADJ;ESS;MASC;SG CONJ ADJ;ESS;MASC;SG ESS;INAN;MASC;N;PL ADV ACT;FIN;IND;IPFV;PL;PST;V PASS;PFV;PL;PST;V;V.PTCP ADP ACC;INAN;N;NEUT;SG ACC;ADJ;INAN;PL INAN;MASC;N;NOM;PL ADP ESS;INAN;N;NEUT;SG ADP ANIM;FEM;GEN;N;PL _ DET;NOM;PL FEM;INAN;N;NOM;PL FIN;IND;IPFV;MID;PL;PST;V ADP ESS;INAN;MASC;N;SG GEN;INAN;MASC;N;SG ADP ESS;INAN;N;NEUT;PL ANIM;GEN;MASC;N;SG FEM;GEN;INAN;PROPN;SG _
абсалютным пераможцам і ўладальніцай тытулу “ каралева вясна беларусі — 2017 ” стала студэнтка чацвёртага курса віцебскага дзяржаўнага тэхналагічнага ўніверсітэта сняжана міхейцава .	абсалютны пераможца і уладальніца тытул “ каралева вясна беларусь — 2017 ” стаць студэнтка чацвёрты курс віцебскi дзяржаўны тэхналагічны універсітэт сняжана міхейцава .	ADJ;INS;MASC;SG ANIM;INS;MASC;N;SG CONJ ANIM;INS;MASC;N;SG GEN;INAN;MASC;N;SG _ ANIM;FEM;N;NOM;SG FEM;INAN;N;NOM;SG FEM;GEN;INAN;PROPN;SG _ NUM _ FEM;FIN;IND;MID;PFV;PST;SG;V ANIM;FEM;N;NOM;SG ADJ;GEN;MASC;SG GEN;INAN;MASC;N;SG ADJ;GEN;MASC;SG ADJ;GEN;MASC;SG ADJ;GEN;MASC;SG GEN;INAN;MASC;N;SG ANIM;FEM;NOM;PROPN;SG ANIM;FEM;NOM;PROPN;SG _
з 3 чэрвеня " белавія " адкрывае новы рэйс мінск - новасібірск - мінск , які стане самым далёкім пунктам прызначэння для авіякампаніі , а з 15 чэрвеня рэйс мінск - батумі будзе выконвацца штодня .	з 3 чэрвень " белавія " адкрываць новы рэйс мінск - новасібірск - мінск , які стаць самы далёкі пункт прызначэнне для авіякампанія , а з 15 чэрвень рэйс мінск - батумі быць выконвацца штодня .	ADP ADJ;GEN;NEUT;SG GEN;INAN;MASC;N;SG _ FEM;INAN;NOM;PROPN;SG _ 3;ACT;FIN;IND;IPFV;PRS;SG;V ACC;ADJ;INAN;MASC;SG ACC;INAN;MASC;N;SG INAN;MASC;NOM;PROPN;SG _ INAN;MASC;NOM;PROPN;SG _ INAN;MASC;NOM;PROPN;SG _ MASC;NOM;PRO;SG 3;ACT;FIN;FUT;IND;PFV;SG;V ADJ;INS;MASC;SG ADJ;INS;MASC;SG INAN;INS;MASC;N;SG GEN;INAN;N;NEUT;SG ADP FEM;GEN;INAN;N;SG _ CONJ ADP ADJ;GEN;NEUT;SG GEN;INAN;MASC;N;SG INAN;MASC;N;NOM;SG INAN;MASC;NOM;PROPN;SG _ INAN;MASC;NOM;PROPN;SG 3;ACT;FIN;FUT;IND;PFV;SG;V IPFV;MID;NFIN;V ADV _
камітэт па ажыццяўленні канвенцыі аб ацэнцы ўздзеяння на навакольнае асяроддзе ў трансгранічным кантэксце ( эспо ) падрыхтуе рэкамендацыі па вырашэнні спрэчных пытанняў паміж беларуссю і літвой па будаўніцтве беларускай аэс да верасня 2012 года .	камітэт па ажыццяўленне канвенцыя аб ацэнка ўздзеянне на навакольны асяроддзе ў трансгранічны кантэкст ( эспо ) падрыхтаваць рэкамендацыя па вырашэнне спрэчны пытанне паміж беларусь і літва па будаўніцтва беларускі аэс да верасень 2012 год .	INAN;MASC;N;NOM;SG ADP DAT;INAN;N;NEUT;SG FEM;GEN;INAN;N;SG ADP ESS;FEM;INAN;N;SG GEN;INAN;N;NEUT;SG ADP ACC;ADJ;NEUT;SG ACC;INAN;N;NEUT;SG ADP ADJ;ESS;MASC;SG ESS;INAN;MASC;N;SG _ INAN;NEUT;NOM;PROPN;SG _ 3;ACT;FIN;FUT;IND;PFV;SG;V ACC;FEM;INAN;N;PL ADP DAT;INAN;N;NEUT;SG ADJ;GEN;PL GEN;INAN;N;NEUT;PL ADP FEM;INAN;INS;PROPN;SG CONJ FEM;INAN;INS;PROPN;SG ADP ESS;INAN;N;NEUT;SG ADJ;FEM;GEN;SG FEM;GEN;INAN;PROPN;SG ADP GEN;INAN;MASC;N;SG ADJ;GEN;MASC;SG GEN;INAN;MASC;N;SG _
як ужо перадаваў тэлеграф , прадстаўляць беларусь у песенным конкурсе будзе гурт litesound .	як ужо перадаваць тэлеграф , прадстаўляць беларусь у песенны конкурс быць гурт litesound .	CONJ ADV ACT;FIN;IND;IPFV;MASC;PST;SG;V INAN;MASC;NOM;PROPN;SG _ ACT;IPFV;NFIN;V ACC;FEM;INAN;PROPN;SG ADP ADJ;ESS;MASC;SG ESS;INAN;MASC;N;SG 3;ACT;FIN;FUT;IND;PFV;SG;V INAN;MASC;N;NOM;SG _ _
даі ў выходныя дні , 24 і 25 сакавіка , узмоцніць кантроль за выкананнем правілаў дарожнага руху на дарогах беларусі .	даі ў выходны дзень , 24 і 25 сакавік , узмоцніць кантроль за выкананне правіла дарожны рух на дарога беларусь .	FEM;GEN;INAN;PROPN;SG ADP ACC;ADJ;INAN;PL ACC;INAN;MASC;N;PL _ ADJ;GEN;NEUT;SG CONJ ADJ;GEN;NEUT;SG GEN;INAN;MASC;N;SG _ 3;ACT;FIN;FUT;IND;PFV;SG;V ACC;INAN;MASC;N;SG ADP INAN;INS;N;NEUT;SG GEN;INAN;N;NEUT;PL ADJ;GEN;MASC;SG GEN;INAN;MASC;N;SG ADP ESS;FEM;INAN;N;PL FEM;GEN;INAN;PROPN;SG _
задоўга працягваецца русіфікацыя ...	задоўга працягвацца русіфікацыя ...	ADV 3;FIN;IND;IPFV;MID;PRS;SG;V FEM;INAN;N;NOM;SG _
беларускія банкі гатовыя працаваць з 200-тысячнай купюрай .	беларускі банк гатовы працаваць з 200-тысячны купюра .	ADJ;NOM;PL INAN;MASC;N;NOM;PL ADJ;NOM;PL ACT;IPFV;NFIN;V ADP ADJ;FEM;INS;SG FEM;INAN;INS;N;SG _
даі ўзмоцніць кантроль за выкананнем пдр на дарогах беларусі	даі узмоцніць кантроль за выкананне пдр на дарога беларусь	FEM;INAN;NOM;PROPN;SG 3;ACT;FIN;FUT;IND;PFV;SG;V ACC;INAN;MASC;N;SG ADP INAN;INS;N;NEUT;SG GEN;INAN;N;NEUT;PL ADP ESS;FEM;INAN;N;PL FEM;GEN;INAN;PROPN;SG
як перадаваў тэлеграф , у лепельскім раёне ў рацэ 6 сакавіка патанула шасцігадовая дзяўчынка , якая пайшла да вадаёма гуляць разам з сяброўкай .	як перадаваць тэлеграф , у лепельскі раён ў рака 6 сакавік патануць шасцігадовы дзяўчынка , які пайсцi да вадаём гуляць разам з сяброўка .	CONJ ACT;FIN;IND;IPFV;MASC;PST;SG;V INAN;MASC;NOM;PROPN;SG _ ADP ADJ;ESS;MASC;SG ESS;INAN;MASC;N;SG ADP ESS;FEM;INAN;N;SG ADJ;GEN;NEUT;SG GEN;INAN;MASC;N;SG ACT;FEM;FIN;IND;PFV;PST;SG;V ADJ;FEM;NOM;SG ANIM;FEM;N;NOM;SG _ FEM;NOM;PRO;SG ACT;FEM;FIN;IND;PFV;PST;SG;V ADP GEN;INAN;MASC;N;SG ACT;IPFV;NFIN;V ADV ADP ANIM;FEM;INS;N;SG _
" мінпрыроды беларусі вымушаны канстатаваць , што літоўскі бок ў чарговы раз звяртаецца да адкрытага скажэння рэчаіснасці і фактычна дэзінфармуе міжнародную грамадскасць " , -- адзначыла прэс-сакратарка .	" мінпрыроды беларусь вымушаны канстатаваць , што літоўскі бок ў чарговы раз звяртацца да адкрыты скажэнне рэчаіснасць і фактычна дэзінфармаваць міжнародны грамадскасць " , -- адзначыць прэс-сакратарка .	_ GEN;INAN;MASC;PROPN;SG FEM;GEN;INAN;PROPN;SG ADJ;PL ACT;NFIN;PFV;V _ CONJ ADJ;MASC;NOM;SG INAN;MASC;N;NOM;SG ADP ACC;ADJ;INAN;MASC;SG ACC;INAN;MASC;N;SG 3;FIN;IND;IPFV;MID;PRS;SG;V ADP ADJ;GEN;NEUT;SG GEN;INAN;N;NEUT;SG FEM;GEN;INAN;N;SG CONJ ADV 3;ACT;FIN;IND;IPFV;PRS;SG;V ACC;ADJ;FEM;SG ACC;FEM;INAN;N;SG _ _ _ ACT;FEM;FIN;IND;PFV;PST;SG;V ANIM;FEM;N;NOM;SG _
арыштаваныя супрацоўнікі офіса ммм , якім ставіцца ў віну " ажыццяўленне незаконных фінансавых аперацый і завалоданне грашовымі сродкамі беларускіх грамадзян шляхам падману " .	арыштаваць супрацоўнік офіс ммм , які ставіцца ў віна " ажыццяўленне незаконны фінансавы аперацыя і завалоданне грашовы сродак беларускі грамадзянiн шляхам падман " .	NOM;PASS;PFV;PL;PST;V;V.PTCP ANIM;MASC;N;NOM;PL GEN;INAN;MASC;N;SG GEN;INAN;MASC;PROPN;SG _ INS;MASC;PRO;SG 3;FIN;IND;IPFV;MID;PRS;SG;V ADP ACC;FEM;INAN;N;SG _ INAN;N;NEUT;NOM;SG ADJ;GEN;PL ADJ;GEN;PL FEM;GEN;INAN;N;PL CONJ INAN;N;NEUT;NOM;SG ADJ;INS;PL INAN;INS;MASC;N;PL ADJ;GEN;PL ANIM;GEN;MASC;N;PL ADP GEN;INAN;MASC;N;SG _ _
думаю , што дачакаемся часу , калі яны раптам прачнуцца .	думаць , што дачакацца час , калі яны раптам прачнуцца .	1;ACT;FIN;IND;IPFV;PRS;SG;V _ CONJ 1;FIN;FUT;IND;MID;PFV;PL;V GEN;INAN;MASC;N;SG _ CONJ 3;NOM;PL;PRO ADV 3;FIN;FUT;IND;MID;PFV;PL;V _
але кожная краіна будзе прымаць рашэнне зыходзячы з уласнай пазіцыі " , -- заявіла крыніца агенцтва .	але кожны краіна быць прымаць рашэнне зыхадзiць з уласны пазіцыя " , -- заявіць крыніца агенцтва .	CONJ DET;FEM;NOM;SG FEM;INAN;N;NOM;SG 3;ACT;FIN;FUT;IND;PFV;SG;V ACT;IPFV;NFIN;V ACC;INAN;N;NEUT;SG ACT;IPFV;PRS;V;V.CVB ADP ADJ;FEM;GEN;SG FEM;GEN;INAN;N;SG _ _ _ ACT;FEM;FIN;IND;PFV;PST;SG;V FEM;INAN;N;NOM;SG GEN;INAN;N;NEUT;SG _
было даследавана 50 сартоў культуры , толькі два з іх прыдатныя да захавання без кансервантаў у вакуумнай упакоўцы .	быць даследаваць 50 сорт культура , толькі два з яны прыдатны да захаванне без кансервант у вакуумны ўпакоўка .	ACT;FIN;IND;IPFV;NEUT;PST;SG;V NEUT;PASS;PFV;PST;SG;V;V.PTCP NUM GEN;INAN;MASC;N;PL FEM;GEN;INAN;N;SG _ PART MASC;NOM;NUM ADP 3;GEN;PL;PRO ADJ;PL ADP DAT;INAN;N;NEUT;SG ADP GEN;INAN;MASC;N;PL ADP ADJ;ESS;FEM;SG ESS;FEM;INAN;N;SG _
з’явілася група інтэлектуалаў , чыя дзейнасць распаліла пажар нацыянальнага адраджэння .	з'явіцца група інтэлектуал , чый дзейнасць распаліць пажар нацыянальны адраджэнне .	FEM;FIN;IND;MID;PFV;PST;SG;V FEM;INAN;N;NOM;SG ANIM;GEN;MASC;N;PL _ DET;FEM;NOM;SG FEM;INAN;N;NOM;SG ACT;FEM;FIN;IND;PFV;PST;SG;V ACC;INAN;MASC;N;SG ADJ;GEN;NEUT;SG GEN;INAN;N;NEUT;SG _
да сваіх сяброў я гавару : зараз час падрыхтавацца .	да свой сябар я гаварыць : зараз час падрыхтавацца .	ADP DET;GEN;PL ANIM;GEN;MASC;N;PL 1;NOM;PRO;SG 1;ACT;FIN;IND;IPFV;PRS;SG;V _ ADV INAN;MASC;N;NOM;SG MID;NFIN;PFV;V _
сам фінал уяўляў тэатралізаванае прадстаўленне , асноўнай тэмай якога быў год навукі .	сам фінал уяўляць тэатралізаваны прадстаўленне , асноўны тэма які быць год навука .	ADJ;MASC;NOM;SG INAN;MASC;N;NOM;SG ACT;FIN;IND;IPFV;MASC;PST;SG;V ADJ;NEUT;NOM;SG ACC;INAN;N;NEUT;SG _ ADJ;FEM;INS;SG FEM;INAN;INS;N;SG GEN;PRO ACT;FIN;IND;IPFV;MASC;PST;SG;V INAN;MASC;N;NOM;SG FEM;GEN;INAN;N;SG _
публіку збіраюся здзіўляць сваёй харызмай і творчым нумарам — займаюся эстраднай харэаграфіяй , таму сёння прадэманструю гледачам лацінаамерыканскі танец .	публiка збірацца здзіўляць свой харызма і творчы нумар — займацца эстрадны харэаграфія , таму сёння прадэманстраваць гледач лацінаамерыканскі танец .	ACC;FEM;INAN;N;SG 1;FIN;IND;IPFV;MID;PRS;SG;V ACT;IPFV;NFIN;V DET;FEM;INS;SG FEM;INAN;INS;N;SG CONJ ADJ;INS;MASC;SG INAN;INS;MASC;N;SG _ 1;FIN;IND;IPFV;MID;PRS;SG;V ADJ;FEM;INS;SG FEM;INAN;INS;N;SG _ ADV ADV 1;ACT;FIN;FUT;IND;PFV;SG;V ANIM;DAT;MASC;N;PL ACC;ADJ;INAN;MASC;SG ACC;INAN;MASC;N;SG _
як паведамляў тэлеграф , 27 лютага ес пашырыў візавыя і эканамічныя санкцыі , якія дзейнічаюць у дачыненні да прадстаўнікоў афіцыйнага мінску .	як паведамляць тэлеграф , 27 люты ес пашырыць візавы і эканамічны санкцыя , які дзейнічаць у дачыненне да прадстаўнік афіцыйны мінск .	CONJ ACT;FIN;IND;IPFV;MASC;PST;SG;V INAN;MASC;NOM;PROPN;SG _ ADJ;GEN;NEUT;SG GEN;INAN;MASC;N;SG INAN;MASC;NOM;PROPN;SG ACT;FIN;IND;MASC;PFV;PST;SG;V ACC;ADJ;INAN;PL CONJ ACC;ADJ;INAN;PL ACC;FEM;INAN;N;PL _ NOM;PL;PRO 3;ACT;FIN;IND;IPFV;PL;PRS;V ADP ESS;INAN;N;NEUT;SG ADP ANIM;GEN;MASC;N;PL ADJ;GEN;MASC;SG GEN;INAN;MASC;PROPN;SG _
з мадэльным бізнесам звязваць жыццё не планую , мару працаваць у лагістычнай кампаніі .	з мадэльны бізнес звязваць жыццё не планаваць , марыць працаваць у лагістычны кампанія .	ADP ADJ;INS;MASC;SG INAN;INS;MASC;N;SG ACT;IPFV;NFIN;V ACC;FEM;INAN;N;SG NEG;PART 1;ACT;FIN;IND;IPFV;PRS;SG;V _ 1;ACT;FIN;IND;IPFV;PRS;SG;V ACT;IPFV;NFIN;V ADP ADJ;ESS;FEM;SG ESS;FEM;INAN;N;SG _
у лютым зарплата павялічылася ў параўнанні са студзенем на 2,9 % , або на 83,7 тыс. рублёў .	у люты зарплата павялічыцца ў параўнанне са студзень на 2,9 % , або на 83,7 тыс. рубель .	ADP ESS;INAN;MASC;N;SG FEM;INAN;N;NOM;SG FEM;FIN;IND;MID;PFV;PST;SG;V ADP DAT;INAN;N;NEUT;SG ADP INAN;INS;MASC;N;SG ADP NUM _ _ CONJ ADP NUM FEM;GEN;INAN;N;PL GEN;INAN;MASC;N;PL _
пры чым гэтыя рэкамендацыі будуць тычыцца абодвух бакоў .	пры чым гэты рэкамендацыя быць тычыцца абодва бок .	ADP CONJ DET;NOM;PL FEM;INAN;N;NOM;PL 3;ACT;FIN;FUT;IND;PFV;PL;V IPFV;MID;NFIN;V FEM;GEN;NUM GEN;INAN;MASC;N;PL _
" лукашэнка ( не ведаю -- чаму ) занадта перакананы ў падтрымцы крамля .	" лукашэнка ( не ведаць -- чаму ) занадта перакананы ў падтрымка крэмль .	_ ANIM;MASC;NOM;PROPN;SG _ NEG;PART 1;ACT;FIN;IND;IPFV;PRS;SG;V _ ADV _ ADV ADJ;MASC;SG ADP ESS;FEM;INAN;N;SG GEN;INAN;MASC;PROPN;SG _
дэлегацыя ж літвы , па словах алены пенязь , не змагла прадставіць выразных тлумачэнняў , чаму літоўскі бок не рэагуе на прапановы беларусі , якія датычацца заключэння двухбаковага пагаднення аб захаванні канвенцыі эспа , двухбаковага пагаднення аб аператыўнай абвестцы аб ядзерных аварыях , абмене інфармацыяй і супрацоўніцтве ў галіне ядзернай бяспекі і радыяцыйнай абароны , правядзенні двухбаковых кансультацый па пытаннях , звязаных з будаўніцтвам беларускай і вісагінскай аэс , наўмысна не дапусціла беларускіх прадстаўнікоў прыняць удзел у праводзіцца ў літве абмеркаванні праекту будаўніцтва беларускай аэс .	дэлегацыя ж літва , па слова алена пенязь , не змагчы прадставіць выразны тлумачэнне , чаму літоўскі бок не рэаговаць на прапанова беларусь , які датычацца заключэнне двухбаковы пагадненне аб захаванне канвенцыя эспа , двухбаковы пагадненне аб аператыўны абвестка аб ядзерны аварыя , абмен інфармацыя і супрацоўніцтва ў галіна ядзерны бяспека і радыяцыйны абарона , правядзенне двухбаковы кансультацыя па пытанне , звязаць з будаўніцтва беларускі і вісагінскi аэс , наўмысна не дапусціць беларускі прадстаўнік прыняць удзел у праводзіць ў літва абмеркаванне праект будаўніцтва беларускі аэс .	FEM;INAN;N;NOM;SG CONJ FEM;GEN;INAN;PROPN;SG _ ADP ESS;INAN;N;NEUT;PL ANIM;FEM;GEN;PROPN;SG ANIM;FEM;GEN;PROPN;SG _ NEG;PART ACT;FEM;FIN;IND;PFV;PST;SG;V ACT;NFIN;PFV;V ADJ;GEN;PL GEN;INAN;N;NEUT;PL _ ADV ADJ;MASC;NOM;SG INAN;MASC;N;NOM;SG NEG;PART 3;ACT;FIN;IND;IPFV;PRS;SG;V ADP ACC;FEM;INAN;N;PL FEM;GEN;INAN;PROPN;SG _ NOM;PL;PRO 3;FIN;IND;IPFV;MID;PL;PRS;V GEN;INAN;N;NEUT;SG ADJ;GEN;NEUT;SG GEN;INAN;N;NEUT;SG ADP ESS;INAN;N;NEUT;SG FEM;GEN;INAN;N;SG INAN;NEUT;NOM;PROPN;SG _ ADJ;GEN;NEUT;SG GEN;INAN;N;NEUT;SG ADP ADJ;ESS;FEM;SG ESS;FEM;INAN;N;SG ADP ADJ;ESS;PL ESS;FEM;INAN;N;PL _ ESS;INAN;MASC;N;SG FEM;INAN;INS;N;SG CONJ ESS;INAN;N;NEUT;SG ADP ESS;FEM;INAN;N;SG ADJ;FEM;GEN;SG FEM;GEN;INAN;N;SG CONJ ADJ;FEM;GEN;SG FEM;GEN;INAN;N;SG _ ESS;INAN;N;NEUT;SG ADJ;GEN;PL FEM;GEN;INAN;N;PL ADP ESS;INAN;N;NEUT;PL _ DAT;PASS;PFV;PL;PST;V;V.PTCP ADP INAN;INS;N;NEUT;SG ADJ;FEM;GEN;SG CONJ ADJ;FEM;GEN;SG FEM;GEN;INAN;PROPN;SG _ ADV NEG;PART ACT;FEM;FIN;IND;PFV;PST;SG;V ADJ;GEN;PL ACC;ANIM;MASC;N;PL ACT;NFIN;PFV;V ACC;INAN;MASC;N;SG ADP 3;FIN;IND;IPFV;PASS;PRS;SG;V ADP ESS;FEM;INAN;PROPN;SG ESS;INAN;N;NEUT;SG GEN;INAN;MASC;N;SG GEN;INAN;N;NEUT;SG ADJ;FEM;GEN;SG FEM;GEN;INAN;PROPN;SG _
трэцяе месяца і тытул “ другая віцэ-каралева вясна ” дасталася прадстаўніцы полацкага дзяржаўнага ўніверсітэта хрысціне нікіфаравай .	трэцi месяц і тытул “ другi віцэ-каралева вясна ” дастацца прадстаўніца полацкi дзяржаўны універсітэт хрысціна нікіфарава .	ADJ;NEUT;NOM;SG INAN;N;NEUT;NOM;SG CONJ INAN;MASC;N;NOM;SG _ ADJ;FEM;NOM;SG ANIM;FEM;N;NOM;SG FEM;INAN;N;NOM;SG _ FIN;IND;MID;NEUT;PFV;PST;SG;V ANIM;ESS;FEM;N;SG ADJ;GEN;MASC;SG ADJ;GEN;MASC;SG GEN;INAN;MASC;N;SG ANIM;MASC;NOM;PROPN;SG ANIM;MASC;NOM;PROPN;SG _
раптам аказалася , што “ мёртвая ” мова зусім не такая ўжо і мёртвая !	раптам аказацца , што “ мёртвы ” мова зусім не такi ўжо і мёртвы !	ADV FIN;IND;MID;NEUT;PFV;PST;SG;V _ CONJ _ ADJ;FEM;NOM;SG _ FEM;INAN;N;NOM;SG ADV NEG;PART DET;FEM;NOM;SG PART PART ADJ;FEM;NOM;SG _
як раней перадаваў тэлеграф , 17 сакавіка сваякі уладзіслава кавалёва атрымалі ліст з вярхоўнага суда ад 16 сакавіка , у якім паведамлялася , што прысуд у дачыненні да яго прыведзены ў выкананне .	як раней перадаваць тэлеграф , 17 сакавік сваяк уладзіслав кавалёв атрымаць ліст з вярхоўны суд ад 16 сакавік , у які паведамляцца , што прысуд у дачыненне да ён прывесцi ў выкананне .	CONJ ADV;CMPR ACT;FIN;IND;IPFV;MASC;PST;SG;V INAN;MASC;NOM;PROPN;SG _ ADJ;GEN;NEUT;SG GEN;INAN;MASC;N;SG ANIM;MASC;N;NOM;PL ANIM;GEN;MASC;PROPN;SG ANIM;GEN;MASC;PROPN;SG ACT;FIN;IND;PFV;PL;PST;V ACC;INAN;MASC;N;SG ADP ADJ;GEN;MASC;SG GEN;INAN;MASC;N;SG ADP ADJ;GEN;NEUT;SG GEN;INAN;MASC;N;SG _ ADP ESS;MASC;PRO;SG FIN;IND;IPFV;MID;NEUT;PST;SG;V _ CONJ INAN;MASC;N;NOM;SG ADP ESS;INAN;N;NEUT;SG ADP 3;GEN;MASC;PRO;SG MASC;NOM;PASS;PFV;PST;SG;V;V.PTCP ADP ACC;INAN;N;NEUT;SG _
тады сярэднямесячная тэмпература было ўсяго 2,5 °с .	тады сярэднямесячны тэмпература быць ўсяго 2,5 °с .	ADV ADJ;FEM;NOM;SG FEM;INAN;N;NOM;SG ACT;FIN;IND;IPFV;NEUT;PST;SG;V PART NUM ANIM;GEN;MASC;SG _
начная тэмпература ў сярэднім складзе каля 0 °с , днём паветра прагрэецца да + 8 .. + 13 °с .	начны тэмпература ў сярэдняе скласцi каля 0 °с , дзень паветра прагрэцца да + 8 .. + 13 °с .	ADJ;FEM;NOM;SG FEM;INAN;N;NOM;SG ADP ESS;INAN;N;NEUT;SG 3;ACT;FIN;FUT;IND;PFV;SG;V ADP GEN;NUM ANIM;GEN;MASC;SG _ INAN;INS;MASC;N;SG INAN;N;NEUT;NOM;SG 3;FIN;FUT;IND;MID;PFV;SG;V ADP _ GEN;NUM _ _ GEN;NUM ANIM;GEN;MASC;SG _
у далейшым нацыянальны банк мае намер працягваць праводзіць грашова-крэдытную палітыку , зыходзячы з інфляцыйных тэндэнцый , сітуацыі на грашовым рынку , у рэальным сектары эканомікі .	у далейшы нацыянальны банк мець намер працягваць праводзіць грашова-крэдытны палітыка , зыхадзiць з інфляцыйны тэндэнцыя , сітуацыя на грашовы рынак , у рэальны сектар эканоміка .	ADP ADJ;ESS;NEUT;SG ADJ;MASC;NOM;SG INAN;MASC;N;NOM;SG 3;ACT;FIN;IND;IPFV;PRS;SG;V ACC;INAN;MASC;N;SG ACT;IPFV;NFIN;V ACT;IPFV;NFIN;V ACC;ADJ;FEM;SG ACC;FEM;INAN;N;SG _ ACT;IPFV;PRS;V;V.CVB ADP ADJ;GEN;PL FEM;GEN;INAN;N;PL _ FEM;GEN;INAN;N;SG ADP ADJ;ESS;MASC;SG ESS;INAN;MASC;N;SG _ ADP ADJ;ESS;MASC;SG ESS;INAN;MASC;N;SG FEM;GEN;INAN;N;SG _
