у беларусі ў лютым гэтага года намінальная налічаная сярэдняя заработная плата работнікаў ( без выліку падаткаў ) была 2,96 млн рублёў , што складае 370 даляраў па курсе нацбанка на 23 сакавіка , рабочых і служачых -- 2,99 млн рублёў .	у беларусь ў люты гэты год намінальны налічыць сярэдні заработны плата работнік ( без вылік падатак ) быць 2,96 млн рубель , што складаць 370 даляр па курс нацбанк на 23 сакавік , рабочы і служачы -- 2,99 млн рубель .	ADP ESS;FEM;INAN;PROPN;SG ADP ESS;INAN;MASC;N;SG DET;GEN;MASC;SG GEN;INAN;MASC;N;SG ADJ;FEM;NOM;SG FEM;NOM;PASS;PFV;PST;SG;V;V.PTCP ADJ;FEM;NOM;SG ADJ;FEM;NOM;SG FEM;INAN;N;NOM;SG ANIM;GEN;MASC;N;PL _ ADP GEN;INAN;MASC;N;SG GEN;INAN;MASC;N;PL _ ACT;FEM;FIN;IND;IPFV;PST;SG;V NUM GEN;INAN;MASC;N;SG GEN;INAN;MASC;N;PL _ INAN;NEUT;NOM;PRO;SG 3;ACT;FIN;IND;IPFV;PRS;SG;V ACC;NUM GEN;INAN;MASC;N;PL ADP ESS;INAN;MASC;N;SG GEN;INAN;MASC;PROPN;SG ADP ACC;ADJ;NEUT;SG GEN;INAN;MASC;N;SG _ ANIM;GEN;MASC;N;PL CONJ ANIM;GEN;MASC;N;PL _ NUM GEN;INAN;MASC;N;SG GEN;INAN;MASC;N;PL _
" мы вымушаны неадкладна прыступіць да рэалізацыі комплексу мер рэагавання .	" мы вымушаны неадкладна прыступіць да рэалізацыя комплекс мера рэагаванне .	_ 1;NOM;PL;PRO ADJ;PL ADV ACT;NFIN;PFV;V ADP FEM;GEN;INAN;N;SG GEN;INAN;MASC;N;SG FEM;GEN;INAN;N;PL GEN;INAN;N;NEUT;SG _
згодна з экспертнымі ацэнакамі , у студзені - сакавіку гэтага года дзякуючы дзейсным і адэкватным стабілізацыйным мерам нацбанка і ўрада ўдалося " працягнуць паляпшэнне сітуацыі ў эканоміцы і грашова-крэдытнай сферы беларусі " .	згодна з экспертны ацэнка , у студзень - сакавік гэты год дзякуючы дзейсны і адэкватны стабілізацыйны мера нацбанк і ўрад удацца " працягнуць паляпшэнне сітуацыя ў эканоміка і грашова-крэдытны сфера беларусь " .	ADP ADP ADJ;INS;PL FEM;INAN;INS;N;PL _ ADP ESS;INAN;MASC;N;SG _ ESS;INAN;MASC;N;SG DET;GEN;MASC;SG GEN;INAN;MASC;N;SG ADP ADJ;DAT;PL CONJ ADJ;DAT;PL ADJ;DAT;PL DAT;FEM;INAN;N;PL GEN;INAN;MASC;PROPN;SG CONJ GEN;INAN;N;NEUT;SG FIN;IND;MID;NEUT;PFV;PST;SG;V _ ACT;NFIN;PFV;V ACC;INAN;N;NEUT;SG FEM;GEN;INAN;N;SG ADP ESS;FEM;INAN;N;SG CONJ ADJ;ESS;FEM;SG ESS;FEM;INAN;N;SG FEM;GEN;INAN;PROPN;SG _ _
па досведзе такіх краін , як зша , можна сказаць , што поўны пераход да экалагічнага земляробства прыводзіць да падаражання прадуктовага кошыка прыкладна ў пяць разоў .	па досвед такі краiна , як зша , можна сказаць , што поўны пераход да экалагічны земляробства прыводзіць да падаражанне прадуктовы кошык прыкладна ў пяць раз .	ADP ESS;INAN;MASC;N;SG DET;GEN;PL FEM;GEN;INAN;N;PL _ CONJ INAN;NOM;PL;PROPN _ ADV ACT;NFIN;PFV;V _ CONJ ADJ;MASC;NOM;SG INAN;MASC;N;NOM;SG ADP ADJ;DAT;MASC;SG DAT;INAN;MASC;N;SG 3;ACT;FIN;IND;IPFV;PRS;SG;V ADP DAT;INAN;N;NEUT;SG ADJ;FEM;GEN;SG GEN;INAN;MASC;N;SG ADV ADP ACC;NUM GEN;INAN;MASC;N;PL _
у нацбанку таксама адзначаюць узмацненне ашчадных працэсаў у эканоміцы .	у нацбанк таксама адзначаць узмацненне ашчадны працэс у эканоміка .	ADP ESS;INAN;MASC;PROPN;SG ADV 3;ACT;FIN;IND;IPFV;PL;PRS;V ACC;INAN;N;NEUT;SG ADJ;GEN;PL GEN;INAN;MASC;N;PL ADP ESS;FEM;INAN;N;SG _
у канцы месяца ў беларусі магчымыя ападкі , у тым ліку , мокры снег , перадае белапан .	у канец месяц ў беларусь магчымы ападкі , у той лік , мокры снег , перадаваць белапан .	ADP ESS;INAN;MASC;N;SG GEN;INAN;MASC;N;SG ADP ESS;FEM;INAN;PROPN;SG ADJ;NOM;PL INAN;MASC;N;NOM;PL _ ADP DET;ESS;MASC;SG ESS;INAN;MASC;N;SG _ ADJ;MASC;NOM;SG INAN;MASC;N;NOM;SG _ 3;ACT;FIN;IND;IPFV;PRS;SG;V INAN;MASC;NOM;PROPN;SG _
такія дзеянні супярэчаць нашай агульнай мэты па збліжэнні беларусі і рады еўропы " , -- гаворыцца ў заяве камітэта , апублікаваным 22 сакавіка .	такi дзеянне супярэчаць наш агульны мэта па збліжэнне беларусь і рада еўропа " , -- гаворыцца ў заява камітэт , апублікаваць 22 сакавік .	DET;NOM;PL INAN;N;NEUT;NOM;PL 3;ACT;FIN;IND;IPFV;PL;PRS;V DET;FEM;GEN;SG ADJ;DAT;FEM;SG FEM;GEN;INAN;N;SG ADP DAT;INAN;N;NEUT;SG FEM;GEN;INAN;PROPN;SG CONJ FEM;GEN;INAN;N;SG FEM;GEN;INAN;PROPN;SG _ _ _ 3;FIN;IND;IPFV;MID;PRS;SG;V ADP ESS;FEM;INAN;N;SG GEN;INAN;MASC;N;SG _ ESS;MASC;PASS;PFV;PST;SG;V;V.PTCP ADJ;GEN;NEUT;SG GEN;INAN;MASC;N;SG _
па словах экспертаў , гэта звязана з паляпшэннем стану знешняга гандлю і зніжэннем знешнеэканамічных дысбалансаў " у выніку правядзення збалансаванай макраэканамічнай , бюджэтна-падатковай і грашова-крэдытнай палітыкі " .	па слова эксперт , гэта звязаны з паляпшэнне стан знешні гандаль і зніжэнне знешнеэканамічны дысбаланс " у вынік правядзенне збалансаваны макраэканамічны , бюджэтна-падатковы і грашова-крэдытны палітыка " .	ADP ESS;INAN;N;NEUT;PL ANIM;GEN;MASC;N;PL _ INAN;NEUT;NOM;PRO;SG ADJ;NEUT;SG ADP INAN;INS;N;NEUT;SG GEN;INAN;MASC;N;SG ADJ;GEN;MASC;SG GEN;INAN;MASC;N;SG CONJ INAN;INS;N;NEUT;SG ADJ;GEN;PL GEN;INAN;MASC;N;PL _ ADP ESS;INAN;MASC;N;SG GEN;INAN;N;NEUT;SG ADJ;FEM;GEN;SG ADJ;FEM;GEN;SG _ ADJ;FEM;GEN;SG CONJ ADJ;FEM;GEN;SG FEM;GEN;INAN;N;SG _ _
камітэт міністраў ре заклікаў беларусь да мараторыя на смяротнае пакаранне	камітэт міністр ре заклікаць беларусь да мараторый на смяротны пакаранне	INAN;MASC;N;NOM;SG ANIM;GEN;MASC;N;PL GEN;INAN;MASC;PROPN;SG ACT;FIN;IND;MASC;PFV;PST;SG;V ACC;FEM;INAN;PROPN;SG ADP GEN;INAN;MASC;N;SG ADP ACC;ADJ;NEUT;SG ACC;INAN;N;NEUT;SG
telegraf.by : як вы ацэньваеце моўную сітуацыю ў беларусі ?	telegraf.by : як вы ацэньваць моўны сітуацыя ў беларусь ?	_ _ ADV 2;NOM;PL;PRO 2;ACT;FIN;IND;IPFV;PL;PRS;V ACC;ADJ;FEM;SG ACC;FEM;INAN;N;SG ADP ESS;FEM;INAN;PROPN;SG _
вранава : часткова я адказала раней .	вранава : часткова я адказаць раней .	ANIM;FEM;NOM;PROPN;SG _ ADV 1;NOM;PRO;SG ACT;FEM;FIN;IND;PFV;PST;SG;V ADV;CMPR _
спявак тэа і шоумен дзмітрый новік высвятлялі апошнія дэталі сцэнарыя , танцавальныя калектывы праводзілі апошнія “ прагоны ” сваіх выступленняў .	спявак тэа і шоумен дзмітрый новік высвятляць апошні дэталь сцэнарый , танцавальны калектыв праводзіць апошні “ прагон ” свой выступленне .	ANIM;MASC;N;NOM;SG ANIM;MASC;NOM;PROPN;SG CONJ ANIM;MASC;N;NOM;SG ANIM;MASC;NOM;PROPN;SG ANIM;MASC;NOM;PROPN;SG ACT;FIN;IND;IPFV;PL;PST;V ACC;ADJ;INAN;PL ACC;FEM;INAN;N;PL GEN;INAN;MASC;N;SG _ ADJ;NOM;PL INAN;MASC;N;NOM;PL ACT;FIN;IND;IPFV;PL;PST;V ACC;ADJ;INAN;PL _ ACC;INAN;MASC;N;PL _ DET;GEN;PL GEN;INAN;N;NEUT;PL _
у лютага 2012 года яна вырасла на 1,4 % у параўнанні з студзенем гэтага года .	у люты 2012 год яна вырасцi на 1,4 % у параўнанне з студзень гэты год .	ADP GEN;INAN;MASC;N;SG ADJ;GEN;MASC;SG GEN;INAN;MASC;N;SG 3;FEM;NOM;PRO;SG ACT;FEM;FIN;IND;PFV;PST;SG;V ADP NUM _ ADP ESS;INAN;N;NEUT;SG ADP INAN;INS;MASC;N;SG DET;GEN;MASC;SG GEN;INAN;MASC;N;SG _
у нас ёсць магчымасць зарабіць нармальныя грошы для таго , каб людзі адчулі паляпшэнне жыцця " , -- упэўнены беларускі лідар .	у мы быць магчымасць зарабіць нармальны грошы для тое , каб чалавек адчуць паляпшэнне жыццё " , -- упэўнены беларускі лідар .	ADP 1;GEN;PL;PRO 3;ACT;FIN;IND;IPFV;PRS;SG;V FEM;INAN;N;NOM;SG ACT;NFIN;PFV;V ACC;ADJ;INAN;PL ACC;INAN;MASC;N;PL ADP GEN;NEUT;PRO;SG _ COND;CONJ ANIM;MASC;N;NOM;PL ACT;FIN;IND;PFV;PL;PST;V ACC;INAN;N;NEUT;SG GEN;INAN;N;NEUT;SG _ _ _ ADJ;MASC;NOM;SG ADJ;MASC;NOM;SG ANIM;MASC;N;NOM;SG _
еўрасаюз таксама пасылае вельмі ясны паралельны палітычны сігнал адносна таго , што ўрад беларусі павінен зрабіць , адзначыла кэтрын эштан .	еўрасаюз таксама пасылаць вельмі ясны паралельны палітычны сігнал адносна тое , што ўрад беларусь павінен зрабіць , адзначыць кэтрын эштан .	INAN;MASC;NOM;PROPN;SG ADV 3;ACT;FIN;IND;IPFV;PRS;SG;V ADV ACC;ADJ;INAN;MASC;SG ACC;ADJ;INAN;MASC;SG ACC;ADJ;INAN;MASC;SG ACC;INAN;MASC;N;SG ADP GEN;NEUT;PRO;SG _ ACC;INAN;NEUT;PRO;SG INAN;MASC;N;NOM;SG FEM;GEN;INAN;PROPN;SG ADJ;MASC;SG ACT;NFIN;PFV;V _ ACT;FEM;FIN;IND;PFV;PST;SG;V ANIM;FEM;NOM;PROPN;SG ANIM;FEM;NOM;PROPN;SG _
у даі спадзяюцца , што прынятыя меры дапамогуць забяспечыць бяспеку на дарогах краіны , знізяць аварыйнасць ў выходныя дні .	у даі спадзявацца , што прыняць мера дапамагчы забяспечыць бяспека на дарога краіна , знізiць аварыйнасць ў выходны дзень .	ADP ESS;FEM;INAN;PROPN;SG 3;FIN;IND;IPFV;MID;PL;PRS;V _ CONJ NOM;PASS;PFV;PL;PST;V;V.PTCP FEM;INAN;N;NOM;PL 3;ACT;FIN;FUT;IND;PFV;PL;V ACT;NFIN;PFV;V ACC;FEM;INAN;N;SG ADP ESS;FEM;INAN;N;PL FEM;GEN;INAN;N;SG _ 3;ACT;FIN;FUT;IND;PFV;PL;V ACC;FEM;INAN;N;SG ADP ACC;ADJ;INAN;PL ACC;INAN;MASC;N;PL _
асобна можна размаўляць пра вытворчасць бульбы .	асобна можна размаўляць пра вытворчасць бульба .	ADV ADV ACT;IPFV;NFIN;V ADP ESS;INAN;N;NEUT;SG GEN;INAN;MASC;N;SG _
узворванне можа быць заменена паверхневай апрацоўкай .	узворванне магчы быць заменена паверхневы апрацоўка .	FEM;INAN;N;NOM;SG 3;ACT;FIN;IND;IPFV;PRS;SG;V ACT;IPFV;NFIN;V FEM;PASS;PFV;PST;SG;V;V.PTCP ADJ;FEM;INS;SG FEM;INAN;INS;N;SG _
аан вінаваціць беларусь у парушэнні міжнародных абавязацельстваў	аан вінаваціць беларусь у парушэнне міжнародны абавязацельства	FEM;INAN;NOM;PROPN;SG 3;ACT;FIN;IND;IPFV;PRS;SG;V ACC;FEM;INAN;PROPN;SG ADP ESS;INAN;N;NEUT;SG ADJ;GEN;PL GEN;INAN;N;NEUT;PL
пра гэта паведамляе afp са спасылкай на неназванага высокапастаўленага прадстаўніка ес .	пра гэта паведамляць afp са спасылка на неназваны высокапастаўлены прадстаўнік ес .	ADP ACC;INAN;NEUT;PRO;SG 3;ACT;FIN;IND;IPFV;PRS;SG;V _ ADP FEM;INAN;INS;N;SG ADP ACC;ADJ;ANIM;MASC;SG ACC;ADJ;ANIM;MASC;SG ANIM;GEN;MASC;N;SG GEN;INAN;MASC;PROPN;SG _
пэўнае пахаладанне сіноптыкі прагназуюць у 20-х датах красавіка .	пэўны пахаладанне сіноптык прагназоваць у 20-х дата красавік .	ACC;DET;INAN;NEUT;SG ACC;INAN;N;NEUT;SG ANIM;MASC;N;NOM;PL 3;ACT;FIN;IND;IPFV;PL;PRS;V ADP ADJ;ESS;PL ESS;FEM;INAN;N;PL GEN;INAN;MASC;N;SG _
пра гэта гаворыцца ў сумеснай пастанове савета міністраў і нацыянальнага банка беларусі no. 223 / 7 ад 12 сакавіка .	пра гэта гаворыцца ў сумесны пастанова савет міністр і нацыянальны банк беларусь № 223 / 7 ад 12 сакавік .	ADP ACC;INAN;NEUT;PRO;SG 3;FIN;IND;IPFV;MID;PRS;SG;V ADP ADJ;ESS;FEM;SG ESS;FEM;INAN;N;SG GEN;INAN;MASC;N;SG ANIM;GEN;MASC;N;PL CONJ ADJ;GEN;MASC;SG GEN;INAN;MASC;N;SG FEM;GEN;INAN;PROPN;SG _ NOM;NUM _ NOM;NUM ADP ADJ;GEN;NEUT;SG GEN;INAN;MASC;N;SG _
раней кэтрын эштан сказала , што амбасадарам ес варта вярнуцца ў беларусь да саміту кіраўнікоў мзс краін ес , які пройдзе 22 - 23 сакавіка ў брусэлі .	раней кэтрын эштан сказаць , што амбасадар ес варта вярнуцца ў беларусь да саміт кіраўнік мзс краіна ес , які прайсцi 22 - 23 сакавік ў брусэль .	ADV;CMPR ANIM;FEM;NOM;PROPN;SG ANIM;FEM;NOM;PROPN;SG ACT;FEM;FIN;IND;PFV;PST;SG;V _ CONJ ANIM;DAT;MASC;N;PL GEN;INAN;MASC;PROPN;SG V MID;NFIN;PFV;V ADP ACC;FEM;INAN;PROPN;SG ADP GEN;INAN;MASC;N;SG ANIM;GEN;MASC;N;PL GEN;INAN;MASC;PL;PROPN FEM;GEN;INAN;N;PL GEN;INAN;MASC;PROPN;SG _ MASC;NOM;PRO;SG 3;ACT;FIN;FUT;IND;PFV;SG;V ADJ;GEN;NEUT;SG _ ADJ;GEN;NEUT;SG GEN;INAN;MASC;N;SG ADP ESS;INAN;MASC;PROPN;SG _
telegraf.by : чым вас зацікавіла беларуская мова ?	telegraf.by : што вы зацікавіць беларускі мова ?	_ _ INAN;INS;NEUT;PRO;SG 2;ACC;PL;PRO ACT;FEM;FIN;IND;PFV;PST;SG;V ADJ;FEM;NOM;SG FEM;INAN;N;NOM;SG _
каля дзесяці імёнаў , як мяркуецца , будзе ўнесена ў " чорны спіс " сірыйскіх афіцыйных асоб і арганізацый , у дачыненні да якіх уведзеныя санкцыі , якія прадугледжваюць забарону на ўезд на тэрыторыю еўрасаюза і замарожванне іх актываў .	каля дзесяць імя , як мярковацца , быць ўнесцi ў " чорны спіс " сірыйскі афіцыйны асоба і арганізацыя , у дачыненне да які увесці санкцыя , які прадугледжваюць забарона на ўезд на тэрыторыя еўрасаюз і замарожванне іх актыў .	ADP GEN;NUM GEN;INAN;N;NEUT;PL _ CONJ 3;FIN;IND;IPFV;MID;PRS;SG;V _ 3;ACT;FIN;FUT;IND;PFV;SG;V NEUT;PASS;PFV;PST;SG;V;V.PTCP ADP _ ACC;ADJ;INAN;MASC;SG ACC;INAN;MASC;N;SG _ ADJ;GEN;PL ADJ;GEN;PL ANIM;FEM;GEN;N;PL CONJ FEM;GEN;INAN;N;PL _ ADP ESS;INAN;N;NEUT;SG ADP GEN;PL;PRO NOM;PASS;PFV;PL;PST;V;V.PTCP FEM;INAN;N;NOM;PL _ NOM;PL;PRO 3;ACT;FIN;IND;IPFV;PL;PRS;V ACC;FEM;INAN;N;SG ADP ACC;INAN;MASC;N;SG ADP ACC;FEM;INAN;N;SG GEN;INAN;MASC;PROPN;SG CONJ ACC;INAN;N;NEUT;SG DET GEN;INAN;MASC;N;PL _
на віцебшчыне вецер здзьмуў частку дома	на віцебшчына вецер здзьмуць частка дом	ADP ESS;FEM;INAN;PROPN;SG INAN;MASC;N;NOM;SG ACT;FIN;IND;MASC;PFV;PST;SG;V ACC;FEM;INAN;N;SG GEN;INAN;MASC;N;SG
далейшае развіццё канфлікту паміж мінскам і ес упіраецца менавіта ў гэта -- у вызваленне палітвязняў " , -- тлумачыць палітык .	далейшы развіццё канфлікт паміж мінскі і ес упірацца менавіта ў гэты -- у вызваленне палітвязень " , -- тлумачыць палітык .	ADJ;NEUT;NOM;SG INAN;N;NEUT;NOM;SG GEN;INAN;MASC;N;SG ADP INAN;INS;MASC;PROPN;SG CONJ INAN;INS;MASC;PROPN;SG 3;FIN;IND;IPFV;MID;PRS;SG;V PART ADP ACC;DET;INAN;NEUT;SG _ ADP ACC;INAN;N;NEUT;SG ANIM;GEN;MASC;N;PL _ _ _ 3;ACT;FIN;IND;IPFV;PRS;SG;V ANIM;MASC;N;NOM;SG _
трымацца на сцэне , спантанна адказваць на каверзныя пытанні суддзяў , дарыць публіцы шчаслівы эмоцыі — усё гэта трэба ўмець .	трымацца на сцэна , спантанна адказваць на каверзны пытанне суддзя , дарыць публіка шчаслівы эмоцыя — увесь гэта трэба ўмець .	IPFV;MID;NFIN;V ADP ESS;FEM;INAN;N;SG _ ADV ACT;IPFV;NFIN;V ADP ACC;ADJ;INAN;PL ACC;INAN;N;NEUT;PL ACC;ANIM;MASC;N;PL _ ACT;IPFV;NFIN;V DAT;FEM;INAN;N;SG ACC;ADJ;INAN;PL ACC;FEM;INAN;N;SG _ DET;NEUT;NOM;SG ACC;INAN;NEUT;PRO;SG ADV ACT;IPFV;NFIN;V _
калі я была другі раз у беларусі , я сказала , што наступным разам я буду размаўляць ужо толькі па-беларуску .	калі я быць другі раз у беларусь , я сказаць , што наступны раз я быць размаўляць ужо толькі па-беларуску .	CONJ 1;NOM;PRO;SG ACT;FEM;FIN;IND;IPFV;PST;SG;V ACC;ADJ;INAN;MASC;SG ACC;INAN;MASC;N;SG ADP ESS;FEM;INAN;PROPN;SG _ 1;NOM;PRO;SG ACT;FEM;FIN;IND;PFV;PST;SG;V _ CONJ ADJ;INS;MASC;SG INAN;INS;MASC;N;SG 1;NOM;PRO;SG 1;ACT;FIN;FUT;IND;PFV;SG;V ACT;IPFV;NFIN;V ADV PART ADV _
асаблівая ўвага даі надасць выкананне кіроўцамі хуткасці , выканання правіл абгону і праезду пешаходных пераходаў , выкарыстання рамянёў бяспекі , а таксама святлоадбівальных элементаў .	асаблівы увага даі надасць выкананне кіроўца хуткасць , выкананне правіла абгон і праезд пешаходны пераход , выкарыстанне рамень бяспека , а таксама святлоадбівальны элемент .	ADJ;FEM;NOM;SG FEM;INAN;N;NOM;SG FEM;GEN;INAN;PROPN;SG 3;ACT;FIN;FUT;IND;PFV;SG;V ACC;INAN;N;NEUT;SG ANIM;INS;MASC;N;PL FEM;GEN;INAN;N;SG _ GEN;INAN;N;NEUT;SG GEN;INAN;N;NEUT;PL GEN;INAN;MASC;N;SG CONJ GEN;INAN;MASC;N;SG ADJ;GEN;PL GEN;INAN;MASC;N;PL _ GEN;INAN;N;NEUT;SG GEN;INAN;MASC;N;PL FEM;GEN;INAN;N;SG _ CONJ PART ADJ;GEN;PL GEN;INAN;MASC;N;PL _
пры гэтым спосабе прапануецца , напрыклад , мінімізаваць апрацоўку глебы на асобных землях .	пры гэты спосаб прапанаваць , напрыклад , мінімізаваць апрацоўка глеба на асобны зямля .	ADP DET;ESS;MASC;SG ESS;INAN;MASC;N;SG 3;FIN;IND;IPFV;PASS;PRS;SG;V _ ADV _ ACT;IPFV;NFIN;V ACC;FEM;INAN;N;SG FEM;GEN;INAN;N;SG ADP ADJ;ESS;PL ESS;FEM;INAN;N;PL _
у выніку яго загінулі 15 чалавек , яшчэ больш за 200 чалавек атрымалі раненні .	у вынік ён загінуць 15 чалавек , яшчэ больш за 200 чалавек атрымаць раненне .	ADP ESS;INAN;MASC;N;SG 3;ACC;MASC;PRO;SG ACT;FIN;IND;PFV;PL;PST;V NOM;NUM ANIM;GEN;MASC;N;PL _ ADV ADV;CMPR ADP GEN;NUM ANIM;GEN;MASC;N;PL ACT;FIN;IND;PFV;PL;PST;V ACC;INAN;N;NEUT;PL _
прэзідэнт беларусі аляксандр лукашэнка заявіў , што падпісвае смяротныя прысуды толькі тым , у дачыненні да каго перакананы на 100 % , што яны здзейснілі тыя злачынствы , за якія прадугледжана пакаранне смерцю .	прэзідэнт беларусь аляксандр лукашэнка заявіць , што падпісваць смяротны прысуд толькі тое , у дачыненне да хто перакананы на 100 % , што яны здзейсніць той злачынства , за які прадугледзець пакаранне смерць .	ANIM;MASC;N;NOM;SG FEM;GEN;INAN;PROPN;SG ANIM;MASC;NOM;PROPN;SG ANIM;MASC;NOM;PROPN;SG ACT;FIN;IND;MASC;PFV;PST;SG;V _ CONJ 3;ACT;FIN;IND;IPFV;PRS;SG;V ACC;ADJ;INAN;PL ACC;INAN;MASC;N;PL PART INS;NEUT;PRO;SG _ ADP ESS;INAN;N;NEUT;SG ADP ANIM;GEN;MASC;PRO;SG ADJ;MASC;SG ADP ACC;NUM _ _ CONJ 3;NOM;PL;PRO ACT;FIN;IND;PFV;PL;PST;V ACC;DET;INAN;PL ACC;INAN;N;NEUT;PL _ ADP ACC;INAN;PL;PRO FEM;PASS;PFV;PST;SG;V;V.PTCP INAN;N;NEUT;NOM;SG FEM;INAN;INS;N;SG _
у той жа час лідар " гавары праўду ! " перакананы , што калі беларускі прэзідэнт зацягне з вызваленнем палітвязняў , чаго патрабуе ад яго еўрасаюз , " праблема вызвалення беларускіх палітвязняў стане ўжо не толькі пытаннем еўрапейскай палітыкі " .	у той жа час лідар " гаварыць праўда ! " перакананы , што калі беларускі прэзідэнт зацягнуць з вызваленне палітвязень , што патрабаваць ад ён еўрасаюз , " праблема вызваленне беларускі палітвязень стаць ўжо не толькі пытанне еўрапейскі палітыка " .	ADP ACC;DET;INAN;MASC;SG PART ACC;INAN;MASC;N;SG ANIM;MASC;N;NOM;SG _ 2;ACT;FIN;IMP;IPFV;SG;V ACC;FEM;INAN;N;SG _ _ ADJ;MASC;SG _ CONJ CONJ ADJ;MASC;NOM;SG ANIM;MASC;N;NOM;SG 3;ACT;FIN;FUT;IND;PFV;SG;V ADP INAN;INS;N;NEUT;SG ANIM;GEN;MASC;N;PL _ GEN;INAN;NEUT;PRO;SG 3;ACT;FIN;IND;IPFV;PRS;SG;V ADP 3;GEN;MASC;PRO;SG INAN;MASC;NOM;PROPN;SG _ _ FEM;INAN;N;NOM;SG GEN;INAN;N;NEUT;SG ADJ;GEN;PL ANIM;GEN;MASC;N;PL 3;ACT;FIN;FUT;IND;PFV;SG;V ADV NEG;PART PART INAN;INS;N;NEUT;SG ADJ;FEM;GEN;SG FEM;GEN;INAN;N;SG _ _
у сваю чаргу супрацоўнікі укдб па віцебскай вобласці ў ходзе праведзенай спецаперацыі канфіскавалі больш за 3,5 тыс. буклетаў , каля 7,5 тыс. налепак з лагатыпам гэтай кампаніі , кампутары , ноўтбукі , аргтэхніку і электронныя носьбіты .	у свой чарга супрацоўнік укдб па віцебскi вобласць ў ход правесцi спецаперацыя канфіскаваць больш за 3,5 тыс. буклет , каля 7,5 тыс. налепка з лагатып гэты кампанія , кампутар , ноўтбук , аргтэхніка і электронны носьбіт .	ADP ACC;DET;FEM;SG ACC;FEM;INAN;N;SG ANIM;MASC;N;NOM;PL GEN;INAN;NEUT;PROPN;SG ADP ADJ;DAT;FEM;SG DAT;FEM;INAN;N;SG ADP ESS;INAN;MASC;N;SG FEM;GEN;PASS;PFV;PST;SG;V;V.PTCP FEM;GEN;INAN;N;SG ACT;FIN;IND;PFV;PL;PST;V ADV;CMPR ADP NUM FEM;GEN;INAN;N;PL GEN;INAN;MASC;N;PL _ ADP NUM FEM;GEN;INAN;N;PL FEM;GEN;INAN;N;PL ADP INAN;INS;MASC;N;SG DET;FEM;GEN;SG FEM;GEN;INAN;N;SG _ ACC;INAN;MASC;N;PL _ ACC;INAN;MASC;N;PL _ ACC;FEM;INAN;N;SG CONJ ACC;ADJ;INAN;PL ACC;INAN;MASC;N;PL _
" ужыўшы гэтую меру пакарання , якая з'яўляецца незваротнай і непапраўнай , беларускія ўлады занядбалі адной з асноватворных каштоўнасцяў рады еўропы -- правам на жыццё .	" ужыць гэты мера пакаранне , які з'яўляцца незваротны і непапраўны , беларускі улада занядбаць адзін з асноватворны каштоўнасць рада еўропа -- права на жыццё .	_ ACT;PFV;PST;V;V.CVB ACC;DET;FEM;SG ACC;FEM;INAN;N;SG GEN;INAN;N;NEUT;SG _ FEM;NOM;PRO;SG 3;FIN;IND;IPFV;MID;PRS;SG;V ADJ;FEM;INS;SG CONJ ADJ;FEM;INS;SG _ ADJ;NOM;PL FEM;INAN;N;NOM;PL ACT;FIN;IND;PFV;PL;PST;V DET;FEM;INS;SG ADP ADJ;GEN;PL FEM;GEN;INAN;N;PL FEM;GEN;INAN;N;SG FEM;GEN;INAN;PROPN;SG _ INAN;INS;N;NEUT;SG ADP ACC;INAN;N;NEUT;SG _
