" для палітычных лідараў еўрасаюза , якія ўзялі апякунства над беларускімі палітвязнямі , іх вызваленне стане справай гонару , асабістай справай " , -- адзначае уладзімір някляеў .	" для палітычны лідар еўрасаюз , які ўзяць апякунства над беларускі палітвязень , іх вызваленне стаць справа гонар , асабісты справа " , -- адзначаць уладзімір някляеў .	_ ADP ADJ;GEN;PL ANIM;GEN;MASC;N;PL GEN;INAN;MASC;PROPN;SG _ NOM;PL;PRO ACT;FIN;IND;PFV;PL;PST;V ACC;INAN;N;NEUT;SG ADP ADJ;INS;PL ANIM;INS;MASC;N;PL _ DET INAN;N;NEUT;NOM;SG 3;ACT;FIN;FUT;IND;PFV;SG;V FEM;INAN;INS;N;SG GEN;INAN;MASC;N;SG _ ADJ;FEM;INS;SG FEM;INAN;INS;N;SG _ _ _ 3;ACT;FIN;IND;IPFV;PRS;SG;V ANIM;MASC;NOM;PROPN;SG ANIM;MASC;NOM;PROPN;SG _
і трэцяе , што я заўважыла з вялікім здзіўленнем , было тое , як шмат у чым беларуская мова падобная да польскай !	і трэцi , што я заўважыць з вялікі здзіўленне , быць тое , як шмат у што беларускі мова падобны да польскi !	CONJ ADJ;NEUT;NOM;SG _ CONJ 1;NOM;PRO;SG ACT;FEM;FIN;IND;PFV;PST;SG;V ADP ADJ;INS;NEUT;SG INAN;INS;N;NEUT;SG _ ACT;FIN;IND;IPFV;NEUT;PST;SG;V NEUT;NOM;PRO;SG _ ADV ADV ADP ESS;INAN;NEUT;PRO;SG ADJ;FEM;NOM;SG FEM;INAN;N;NOM;SG ADJ;FEM;NOM;SG ADP ADJ;FEM;GEN;SG _
пра гэта паведаміў 23 сакавіка першы намеснік міністра прыродных рэсурсаў і аховы навакольнага асяроддзя віталь кулік і падкрэсліў , што беларускі бок " адкрыта і разлічвае на канструктыўны дыялог " з літвой з нагоды будаўніцтва аэс у астраўцы , перадае белта .	пра гэта паведаміць 23 сакавік першы намеснік міністр прыродны рэсурс і ахова навакольны асяроддзе віталь кулік і падкрэсліць , што беларускі бок " адкрыты і разлічваць на канструктыўны дыялог " з літва з нагода будаўніцтва аэс у астравец , перадаваць белта .	ADP ACC;INAN;NEUT;PRO;SG ACT;FIN;IND;MASC;PFV;PST;SG;V ADJ;GEN;NEUT;SG GEN;INAN;MASC;N;SG ADJ;MASC;NOM;SG ANIM;MASC;N;NOM;SG ANIM;GEN;MASC;N;SG ADJ;GEN;PL GEN;INAN;MASC;N;PL CONJ FEM;GEN;INAN;N;SG ADJ;GEN;NEUT;SG GEN;INAN;N;NEUT;SG ANIM;MASC;NOM;PROPN;SG ANIM;MASC;NOM;PROPN;SG CONJ ACT;FIN;IND;MASC;PFV;PST;SG;V _ CONJ ADJ;MASC;NOM;SG INAN;MASC;N;NOM;SG _ ADJ;FEM;SG CONJ 3;ACT;FIN;IND;IPFV;PRS;SG;V ADP ACC;ADJ;INAN;MASC;SG ACC;INAN;MASC;N;SG _ ADP FEM;INAN;INS;PROPN;SG ADP FEM;GEN;INAN;N;SG GEN;INAN;N;NEUT;SG FEM;GEN;INAN;PROPN;SG ADP ESS;INAN;MASC;PROPN;SG _ 3;ACT;FIN;IND;IPFV;PRS;SG;V INAN;NEUT;NOM;PROPN;SG _
агулам юныя прыгажуні дэфіліравалі па сцэне ажно пяць разоў : у белых сукенках , адзенні са спецыяльнай “ касмічнай ” калекцыі , цёмных плашчах з магічнымі прадметамі , стылізаваных нацыянальных касцюмах і вячэрнім убранні .	агулам юны прыгажуня дэфіляваць па сцэна ажно пяць раз : у белы сукенка , адзенне са спецыяльны “ касмічны ” калекцыя , цёмны плашч з магічны прадмет , стылізаваны нацыянальны касцюм і вячэрні убранне .	PART ADJ;NOM;PL FEM;INAN;N;NOM;PL ACT;FIN;IND;IPFV;PL;PST;V ADP ESS;FEM;INAN;N;SG ADV ACC;NUM GEN;INAN;MASC;N;PL _ ADP ADJ;ESS;PL ESS;INAN;N;NEUT;PL _ ESS;FEM;INAN;N;SG ADP ADJ;ESS;FEM;SG _ ADJ;ESS;FEM;SG _ ESS;FEM;INAN;N;SG _ ADJ;ESS;PL ESS;INAN;MASC;N;PL ADP ADJ;INS;PL INAN;INS;MASC;N;PL _ ADJ;ESS;PL ADJ;ESS;PL ESS;INAN;MASC;N;PL CONJ ADJ;ESS;MASC;SG ESS;INAN;MASC;N;SG _
— у мяне ўсё пачалося з універсітэта — прыйшла на кастынг конкурсу “ міс бдэу ” , перамагла , потым удзельнічала ў гарадской “ каралеве вясне ” , дзе таксама атрымала перамогу , і вось я тут , — падзялілася студэнтка трэцяга курса факультэта менеджменту беларускага дзяржаўнага эканамічнага ўніверсітэта марта колб .	— у я ўсё пачацца з універсітэт — прыйсці на кастынг конкурсу “ мiс бдэу ” , перамагчы , потым ўдзельнічаць ў гарадскi “ каралева вясна ” , дзе таксама атрымаць перамога , і вось я тут , — падзяліцца студэнтка трэці курс факультэт менеджмент беларускi дзяржаўны эканамічны універсітэт марта колб .	_ ADP 1;GEN;PRO;SG INAN;NEUT;NOM;PRO;SG FIN;IND;MID;NEUT;PFV;PST;SG;V ADP GEN;INAN;MASC;N;SG _ ACT;FEM;FIN;IND;PFV;PST;SG;V ADP ACC;INAN;MASC;N;SG GEN;INAN;MASC;N;SG _ ANIM;FEM;N;NOM;SG ACC;INAN;NEUT;PROPN;SG _ _ ACT;FEM;FIN;IND;PFV;PST;SG;V _ ADV ACT;FEM;FIN;IND;IPFV;PST;SG;V ADP ADJ;ESS;FEM;SG _ ANIM;ESS;FEM;N;SG ESS;FEM;INAN;N;SG _ _ ADV ADV ACT;FEM;FIN;IND;PFV;PST;SG;V ACC;FEM;INAN;N;SG _ CONJ PART 1;NOM;PRO;SG ADV _ _ FEM;FIN;IND;MID;PFV;PST;SG;V ANIM;FEM;N;NOM;SG ADJ;GEN;MASC;SG GEN;INAN;MASC;N;SG GEN;INAN;MASC;N;SG GEN;INAN;MASC;N;SG ADJ;GEN;MASC;SG ADJ;GEN;MASC;SG ADJ;GEN;MASC;SG GEN;INAN;MASC;N;SG ANIM;FEM;NOM;PROPN;SG ANIM;FEM;NOM;PROPN;SG _
паводле дасягнутых дамоўленасцяў , нацыянальнае агенцтва інвестыцый і прыватызацыі беларусі і daeryook &amp; aju internatonal law firm маюць намер праводзіць двухбаковыя кансультацыі і абмен інфармацыяй з мэтай вывучэння магчымасцяў прыцягнення прамых замежных інвестыцый у беларусь .	паводле дасягнуць дамоўленасць , нацыянальны агенцтва інвестыцыя і прыватызацыя беларусь і daeryook &amp; aju internatonal law firm мець намер праводзіць двухбаковы кансультацыя і абмен інфармацыя з мэта вывучэнне магчымасць прыцягненне прамы замежны інвестыцыя у беларусь .	ADP DAT;PASS;PFV;PL;PST;V;V.PTCP FEM;GEN;INAN;N;PL _ ADJ;NEUT;NOM;SG INAN;N;NEUT;NOM;SG FEM;GEN;INAN;N;PL CONJ FEM;GEN;INAN;N;SG FEM;GEN;INAN;PROPN;SG CONJ _ _ _ _ _ _ 3;ACT;FIN;IND;IPFV;PL;PRS;V ACC;INAN;MASC;N;SG ACT;IPFV;NFIN;V ACC;ADJ;INAN;PL ACC;FEM;INAN;N;PL CONJ ACC;INAN;MASC;N;SG FEM;INAN;INS;N;SG ADP FEM;INAN;INS;N;SG GEN;INAN;N;NEUT;SG FEM;GEN;INAN;N;PL GEN;INAN;N;NEUT;SG ADJ;GEN;PL ADJ;GEN;PL FEM;GEN;INAN;N;PL ADP ACC;FEM;INAN;PROPN;SG _
" мы часта рухаемся дзесьці паміж гэтымі двума падыходамі .	" мы часта рухацца дзесьці паміж гэты два падыход .	_ 1;NOM;PL;PRO ADV 1;FIN;IND;IPFV;MID;PL;PRS;V ADV ADP DET;INS;PL INS;MASC;NUM INAN;INS;MASC;N;PL _
як паведамляў тэлеграф , выбух на станцыі метро " кастрычніцкая " ў мінску адбыўся 11 красавіка 2011 года .	як паведамляць тэлеграф , выбух на станцыя метро " кастрычніцкi " ў мінск адбыцца 11 красавік 2011 год .	CONJ ACT;FIN;IND;IPFV;MASC;PST;SG;V INAN;MASC;NOM;PROPN;SG _ INAN;MASC;N;NOM;SG ADP ESS;FEM;INAN;N;SG GEN;INAN;N;NEUT;SG _ ADJ;FEM;NOM;SG _ ADP ESS;INAN;MASC;PROPN;SG FIN;IND;MASC;MID;PFV;PST;SG;V ADJ;GEN;NEUT;SG GEN;INAN;MASC;N;SG ADJ;GEN;MASC;SG GEN;INAN;MASC;N;SG _
у школе нас беларускай вучаць замала ...	у школа мы беларускі вучыць замала ...	ADP ESS;FEM;INAN;N;SG 1;ACC;PL;PRO ADJ;DAT;FEM;SG 3;ACT;FIN;IND;IPFV;PL;PRS;V ADV _
па інфармацыі намесніка генеральнага дырэктара па навуковай рабоце навукова-вытворчага цэнтра нан беларусі па бульбаводстве і плодаагародніцтве вадзіма маханько , нягледзячы на зніжэнне пасяўных плошчаў « другога хлеба » , бульбы сёлета ў краіне « не шмат , а вельмі шмат » .	па інфармацыя намеснік генеральны дырэктар па навуковы работа навукова-вытворчы цэнтр нан беларусь па бульбаводства і плодаагародніцтва вадзім маханько , нягледзячы на зніжэнне пасяўны плошча « другi хлеб » , бульба сёлета ў краiна « не шмат , а вельмі шмат » .	ADP DAT;FEM;INAN;N;SG ANIM;GEN;MASC;N;SG ADJ;GEN;MASC;SG ANIM;GEN;MASC;N;SG ADP ADJ;ESS;FEM;SG ESS;FEM;INAN;N;SG ADJ;GEN;MASC;SG GEN;INAN;MASC;N;SG INAN;MASC;NOM;PROPN;SG FEM;GEN;INAN;PROPN;SG ADP ESS;INAN;N;NEUT;SG CONJ DAT;INAN;N;NEUT;SG ANIM;GEN;MASC;PROPN;SG ANIM;GEN;MASC;PROPN;SG _ ADP ADP ACC;INAN;N;NEUT;SG ADJ;GEN;PL FEM;GEN;INAN;N;PL _ ADJ;GEN;MASC;SG GEN;INAN;MASC;N;SG _ _ GEN;INAN;MASC;N;SG ADP ADP ESS;FEM;INAN;N;SG _ NEG;PART ADV _ CONJ ADV ADV _ _
па паведамленні укдб , у асноўным у галіне ўкладчыкі ўносілі ў набыццё акцый сумы да 10 тыс. даляраў .	па паведамленне укдб , у асноўнае у галіна ўкладчык ўносіць ў набыццё акцыя сума да 10 тыс. даляр .	ADP ESS;INAN;N;NEUT;SG GEN;INAN;NEUT;PROPN;SG _ ADP ESS;INAN;N;NEUT;SG ADP ESS;FEM;INAN;N;SG ANIM;MASC;N;NOM;PL ACT;FIN;IND;IPFV;PL;PST;V ADP ACC;INAN;N;NEUT;SG FEM;GEN;INAN;N;PL FEM;GEN;INAN;N;SG ADP GEN;NUM FEM;GEN;INAN;N;PL GEN;INAN;MASC;N;PL _
іспанія выступіць пад нумарам 19 , італія -- 10 , германія -- 20 , вялікабрытанія -- 1 , францыя -- 9 .	іспанія выступіць пад нумар 19 , італія -- 10 , германія -- 20 , вялікабрытанія -- 1 , францыя -- 9 .	FEM;INAN;NOM;PROPN;SG 3;ACT;FIN;FUT;IND;PFV;SG;V ADP INAN;INS;MASC;N;SG NOM;NUM _ FEM;INAN;NOM;PROPN;SG _ NOM;NUM _ FEM;INAN;NOM;PROPN;SG _ NOM;NUM _ FEM;INAN;NOM;PROPN;SG _ MASC;NOM;NUM _ FEM;INAN;NOM;PROPN;SG _ NOM;NUM _
пашкоджаны дахі двух жылых дамоў , аднаго вытворчага будынка і пяці сельскохозпостроек .	пашкодзіць дах два жылы дом , адзін вытворчы будынак і пяць сельскохозпостройка .	PASS;PFV;PL;PST;V;V.PTCP INAN;MASC;N;NOM;PL GEN;MASC;NUM ADJ;GEN;PL GEN;INAN;MASC;N;PL _ GEN;NEUT;NUM;SG ADJ;GEN;MASC;SG GEN;INAN;MASC;N;SG CONJ GEN;NUM FEM;GEN;INAN;N;PL _
ужо месяц , як на тэлеграфе існуе рубрыка , прымеркаваная да міжнароднага дня роднай мовы , удзельнікамі якога з'яўляюцца грамадзяне іншых краін , якія адмыслова і самастойна вывучылі беларускую мову .	ужо месяц , як на тэлеграф існаваць рубрыка , прымеркаваць да міжнародны дзень родны мова , удзельнік які з'яўляцца грамадзянiн іншы краіна , які адмыслова і самастойна вывучыць беларускі мова .	ADV INAN;MASC;N;NOM;SG _ CONJ ADP ESS;INAN;MASC;PROPN;SG 3;ACT;FIN;IND;IPFV;PRS;SG;V FEM;INAN;N;NOM;SG _ FEM;NOM;PASS;PFV;PST;SG;V;V.PTCP ADP ADJ;GEN;MASC;SG GEN;INAN;MASC;N;SG ADJ;FEM;GEN;SG FEM;GEN;INAN;N;SG _ ANIM;INS;MASC;N;PL GEN;MASC;PRO;SG 3;FIN;IND;IPFV;MID;PL;PRS;V ANIM;MASC;N;NOM;PL ADJ;GEN;PL FEM;GEN;INAN;N;PL _ NOM;PL;PRO ADV CONJ ADV ACT;FIN;IND;PFV;PL;PST;V ACC;ADJ;FEM;SG ACC;FEM;INAN;N;SG _
здзейснена 9 дтз , у якіх адзін чалавек загінуў і восем атрымалі раненні .	здзейсніць 9 дтз , у які адзін чалавек загінуць і восем атрымаць раненне .	NEUT;PASS;PFV;PST;SG;V;V.PTCP NOM;NUM GEN;INAN;N;NEUT;PL _ ADP ESS;PL;PRO MASC;NOM;NUM;SG ANIM;MASC;N;NOM;SG ACT;FIN;IND;MASC;PFV;PST;SG;V CONJ NOM;NUM ACT;FIN;IND;PFV;PL;PST;V ACC;INAN;N;NEUT;PL _
пастанова таксама прадугледжвае распрацоўку мінэканомікі , нацбанкам , мзс і мінфінам парадку ўліку і ўзгаднення прыцягнення знешніх пазык арганізацыямі з доляй дзяржавы ў статутным фондзе .	пастанова таксама прадугледжваць распрацоўка мінэканомікі , нацбанк , мзс і мінфін парадак улік і узгадненне прыцягненне знешні пазыка арганізацыя з доля дзяржава ў статутны фонд .	FEM;INAN;N;NOM;SG ADV 3;ACT;FIN;IND;IPFV;PRS;SG;V ACC;FEM;INAN;N;SG INAN;INS;MASC;N;SG _ INAN;INS;MASC;PROPN;SG _ INAN;INS;MASC;PROPN;SG CONJ INAN;INS;MASC;N;SG GEN;INAN;MASC;N;SG GEN;INAN;MASC;N;SG CONJ GEN;INAN;N;NEUT;SG GEN;INAN;N;NEUT;SG ADJ;GEN;PL FEM;GEN;INAN;N;PL FEM;INAN;INS;N;PL ADP FEM;INAN;INS;N;SG FEM;GEN;INAN;N;SG ADP ADJ;ESS;MASC;SG ESS;INAN;MASC;N;SG _
для таго каб дэмантаваць старую таблічку і ўсталяваць пастаянны мемарыял , падыход да яго абгарадзілі металапрофіляў .	для тое каб дэмантаваць стары таблічка і ўсталяваць пастаянны мемарыял , падыход да ён абгарадзіць металапрофіль .	ADP GEN;NEUT;PRO;SG COND;CONJ ACT;NFIN;PFV;V ACC;ADJ;FEM;SG ACC;FEM;INAN;N;SG CONJ ACT;NFIN;PFV;V ACC;ADJ;INAN;MASC;SG ACC;INAN;MASC;N;SG _ ACC;INAN;MASC;N;SG ADP 3;GEN;MASC;PRO;SG ACT;FIN;IND;PFV;PL;PST;V INAN;INS;MASC;N;SG _
" пазіцыя камітэта па правах чалавека з'яўляецца адназначнай -- беларусь здзейсніла сур'ёзныя парушэнні сваіх юрыдычных абавязацельстваў , пакарання уладзіслава кавалёва " , -- заявіла старшыня камітэта зонке занэле маёдзіна .	" пазіцыя камітэт па права чалавек з'яўляцца адназначны -- беларусь здзейсніць сур'ёзны парушэнне свой юрыдычны абавязацельства , пакаранне уладзіслав кавалёв " , -- заявіць старшыня камітэт зонке занэле маёдзіна .	_ FEM;INAN;N;NOM;SG GEN;INAN;MASC;N;SG ADP ESS;INAN;N;NEUT;PL ANIM;GEN;MASC;N;SG 3;FIN;IND;IPFV;MID;PRS;SG;V ADJ;FEM;INS;SG _ FEM;INAN;NOM;PROPN;SG ACT;FEM;FIN;IND;PFV;PST;SG;V ACC;ADJ;INAN;PL ACC;INAN;N;NEUT;PL DET;GEN;PL ADJ;GEN;PL GEN;INAN;N;NEUT;PL _ GEN;INAN;N;NEUT;SG ACC;ANIM;MASC;PROPN;SG ACC;ANIM;MASC;PROPN;SG _ _ _ ACT;FEM;FIN;IND;PFV;PST;SG;V ANIM;MASC;N;NOM;SG GEN;INAN;MASC;N;SG ANIM;FEM;NOM;PROPN;SG ANIM;FEM;NOM;PROPN;SG ANIM;FEM;NOM;PROPN;SG _
і любы разважны палітык зойме бок еўрапейскага саюза " , -- заяўляе лідар " гавары праўду ! "	і любы разважны палітык заняць бок еўрапейскі саюз " , -- заяўляць лідар " гаварыць праўда ! "	CONJ DET;MASC;NOM;SG ADJ;MASC;NOM;SG ANIM;MASC;N;NOM;SG 3;ACT;FIN;FUT;IND;PFV;SG;V ACC;INAN;MASC;N;SG ADJ;GEN;MASC;SG GEN;INAN;MASC;N;SG _ _ _ 3;ACT;FIN;IND;IPFV;PRS;SG;V ANIM;MASC;N;NOM;SG _ 2;ACT;FIN;IMP;IPFV;SG;V ACC;FEM;INAN;N;SG _ _
упраўленне кдб па гродзенскай вобласці ўгледзела ў дзейнасці гродзенскіх структур " ммм - 2011 " схемы " піраміда ў пірамідзе " .	упраўленне кдб па гродзенскі вобласць угледзець ў дзейнасць гродзенскі структура " ммм - 2011 " схема " піраміда ў піраміда " .	INAN;N;NEUT;NOM;SG GEN;INAN;MASC;PROPN;SG ADP ADJ;DAT;FEM;SG DAT;FEM;INAN;N;SG ACT;FIN;IND;NEUT;PFV;PST;SG;V ADP ESS;FEM;INAN;N;SG ADJ;GEN;PL FEM;GEN;INAN;N;PL _ GEN;INAN;MASC;PROPN;SG _ NOM;NUM _ FEM;GEN;INAN;N;SG _ FEM;INAN;N;NOM;SG ADP ESS;FEM;INAN;N;SG _ _
план мерапрыемстваў па рэалізацыі канцэпцыі кіравання валавым знешнім доўгам беларусі таксама прадугледжвае складанне справаздачы аб ввд і падрыхтоўку прагнозу аб маючых адбыцца плацяжах па пагашэнні і абслугоўванні знешняга доўгу ў разрэзе сектараў эканомікі ; падрыхтоўку і накіраванне ў саўмін і нацбанк беларусі аналітычнай запіскі аб стане ввд з ацэнкай паказчыкаў эканамічнай бяспекі па пытаннях ввд краіны ; інфармаванне замежных інвестараў аб макраэканамічнай сітуацыі ў беларусі , у тым ліку інфармацыю аб стане ввд ; павышэнне інфармаванасці кіраўнікоў прадпрыемстваў рэальнага сектара аб эфектыўных стратэгіях кіравання знешнім доўгам , магчымых інструментах мінімізацыі рызык знешніх пазык .	план мерапрыемства па рэалізацыя канцэпцыя кіраванне валавы знешні доўг беларусь таксама прадугледжваць складанне справаздача аб ввд і падрыхтоўка прагноз аб маючы адбыцца плацеж па пагашэнне і абслугоўванне знешні доўг ў разрэз сектар эканоміка ; падрыхтоўка і накіраванне ў саўмін і нацбанк беларусь аналітычны запіска аб стан ввд з ацэнка паказчык эканамічны бяспека па пытанне ввд краіна ; інфармаванне замежны інвестар аб макраэканамічны сітуацыя ў беларусь , у той лік інфармацыя аб стан ввд ; павышэнне інфармаванасць кіраўнік прадпрыемства рэальны сектар аб эфектыўны стратэгія кіраванне знешні доўг , магчымы інструмент мінімізацыя рызыка знешні пазыка .	INAN;MASC;N;NOM;SG GEN;INAN;N;NEUT;PL ADP DAT;FEM;INAN;N;SG FEM;GEN;INAN;N;SG GEN;INAN;N;NEUT;SG ADJ;INS;MASC;SG ADJ;INS;MASC;SG INAN;INS;MASC;N;SG FEM;GEN;INAN;PROPN;SG ADV 3;ACT;FIN;IND;IPFV;PRS;SG;V ACC;INAN;N;NEUT;SG FEM;GEN;INAN;N;SG ADP ESS;INAN;MASC;PROPN;SG CONJ ACC;FEM;INAN;N;SG GEN;INAN;MASC;N;SG ADP ADJ;ESS;PL MID;NFIN;PFV;V ESS;INAN;MASC;N;PL ADP DAT;INAN;N;NEUT;SG CONJ DAT;INAN;N;NEUT;SG ADJ;GEN;MASC;SG GEN;INAN;MASC;N;SG ADP ESS;INAN;MASC;N;SG GEN;INAN;MASC;N;PL FEM;GEN;INAN;N;SG _ ACC;FEM;INAN;N;SG CONJ ACC;INAN;N;NEUT;SG ADP ACC;INAN;MASC;PROPN;SG CONJ ACC;INAN;MASC;PROPN;SG FEM;GEN;INAN;PROPN;SG ADJ;FEM;GEN;SG FEM;GEN;INAN;N;SG ADP ESS;INAN;MASC;N;SG GEN;INAN;MASC;PROPN;SG ADP FEM;INAN;INS;N;SG GEN;INAN;MASC;N;PL ADJ;FEM;GEN;SG FEM;GEN;INAN;N;SG ADP ESS;INAN;N;NEUT;PL GEN;INAN;MASC;PROPN;SG FEM;GEN;INAN;N;SG _ ACC;INAN;N;NEUT;SG ADJ;GEN;PL ANIM;GEN;MASC;N;PL ADP ADJ;ESS;FEM;SG ESS;FEM;INAN;N;SG ADP ESS;FEM;INAN;PROPN;SG _ ADP DET;ESS;MASC;SG ESS;INAN;MASC;N;SG ACC;FEM;INAN;N;SG ADP ESS;INAN;MASC;N;SG GEN;INAN;MASC;PROPN;SG _ ACC;INAN;N;NEUT;SG FEM;GEN;INAN;N;SG ANIM;GEN;MASC;N;PL GEN;INAN;N;NEUT;PL ADJ;GEN;MASC;SG GEN;INAN;MASC;N;SG ADP ADJ;ESS;PL ESS;FEM;INAN;N;PL GEN;INAN;N;NEUT;SG ADJ;INS;MASC;SG INAN;INS;MASC;N;SG _ ADJ;ESS;PL ESS;INAN;MASC;N;PL FEM;GEN;INAN;N;SG FEM;GEN;INAN;N;PL ADJ;GEN;PL FEM;GEN;INAN;N;PL _
гаварылі , што яны вельмі добра разумеюць , як сябе адчувалі чэхі пасля 1968 году , таму што беларусь знаходзіцца пад пастаяннай акупацыяй .	гаварыць , што яны вельмі добра разумець , як сябе адчуваць чэх пасля 1968 год , таму што беларусь знаходзіцца пад пастаянны акупацыя .	ACT;FIN;IND;IPFV;PL;PST;V _ CONJ 3;NOM;PL;PRO ADV ADV 3;ACT;FIN;IND;IPFV;PL;PRS;V _ ADV ACC;PRO;REFL ACT;FIN;IND;IPFV;PL;PST;V ANIM;MASC;N;NOM;PL ADP ADJ;GEN;MASC;SG GEN;INAN;MASC;N;SG _ ADV CONJ FEM;INAN;NOM;PROPN;SG 3;FIN;IND;IPFV;MID;PRS;SG;V ADP ADJ;FEM;INS;SG FEM;INAN;INS;N;SG _
тады ў нас амаль увесь народ размаўляў па-нямецку , чэшская мова лічылася “ вульгарнай ” , прымітыўнай , школы былі нямецкія , па-нямецку друкаваліся кнігі і газеты , па-нямецку прапаведвалі ў цэрквах ...	тады ў мы амаль увесь народ размаўляць па-нямецку , чэшскi мова лічыцца “ вульгарны ” , прымітыўны , школа быць нямецкі , па-нямецку друкавацца кніга і газета , па-нямецку прапаведваць ў царква ...	ADV ADP 1;GEN;PL;PRO ADV DET;MASC;NOM;SG INAN;MASC;N;NOM;SG ACT;FIN;IND;IPFV;MASC;PST;SG;V ADV _ ADJ;FEM;NOM;SG FEM;INAN;N;NOM;SG FEM;FIN;IND;IPFV;MID;PST;SG;V _ ADJ;FEM;INS;SG _ _ ADJ;FEM;INS;SG _ FEM;INAN;N;NOM;PL ACT;FIN;IND;IPFV;PL;PST;V ADJ;NOM;PL _ ADV FIN;IND;IPFV;MID;PL;PST;V FEM;INAN;N;NOM;PL CONJ FEM;INAN;N;NOM;PL _ ADV ACT;FIN;IND;IPFV;PL;PST;V ADP ESS;FEM;INAN;N;PL _
санкцыі адпраўляюць вельмі моцны палітычны і эканамічны пасыл краіне .	санкцыя адпраўляць вельмі моцны палітычны і эканамічны пасыл краіна .	FEM;INAN;N;NOM;PL 3;ACT;FIN;IND;IPFV;PL;PRS;V ADV ACC;ADJ;INAN;MASC;SG ACC;ADJ;INAN;MASC;SG CONJ ACC;ADJ;INAN;MASC;SG ACC;INAN;MASC;N;SG DAT;FEM;INAN;N;SG _
— у мяне ўсё атрымалася спантанна — ва ўніверсітэце дзейнічае студэнцкі клуб , у якім мне прапанавалі паўдзельнічаць у конкурсе прыгажосці , — расказала першакурсніца эканамічнага факультэта беларуска-расійскага ўніверсітэта , што ў магілёве , вікторыя панцюхова .	— у я ўсё атрымацца спантанна — ва універсітэт дзейнічаць студэнцкі клуб , у які я прапанаваць паўдзельнічаць у конкурс прыгажосць , — расказаць першакурсніца эканамічны факультэт беларуска-расійскi універсітэт , што ў магілёв , вікторыя панцюхова .	_ ADP 1;GEN;PRO;SG INAN;NEUT;NOM;PRO;SG FIN;IND;MID;NEUT;PFV;PST;SG;V ADV _ ADP ESS;INAN;MASC;N;SG 3;ACT;FIN;IND;IPFV;PRS;SG;V ADJ;MASC;NOM;SG INAN;MASC;N;NOM;SG _ ADP ESS;PRO 1;DAT;PRO;SG ACT;FIN;IND;PFV;PL;PST;V ACT;NFIN;PFV;V ADP ESS;INAN;MASC;N;SG FEM;GEN;INAN;N;SG _ _ ACT;FEM;FIN;IND;PFV;PST;SG;V ANIM;FEM;N;NOM;SG ADJ;GEN;MASC;SG GEN;INAN;MASC;N;SG ADJ;GEN;MASC;SG GEN;INAN;MASC;N;SG _ V ADP ESS;INAN;MASC;PROPN;SG _ ANIM;FEM;NOM;PROPN;SG ANIM;FEM;NOM;PROPN;SG _
сірыя хоча выпускаць лекі разам з беларуссю	сірыя хацець выпускаць лекі разам з беларусь	FEM;INAN;NOM;PROPN;SG 3;ACT;FIN;IND;IPFV;PRS;SG;V ACT;IPFV;NFIN;V ACC;INAN;MASC;N;PL ADV ADP FEM;INAN;INS;PROPN;SG
вучыся зараз .	вучыцца зараз .	2;FIN;IMP;IPFV;MID;SG;V ADV _
