statilius et gabinius uti cum magna manu duodecim simul opportuna loca urbis incenderent , quo tumultu facilior aditus ad consulem que ceteros , quibus insidiae parabantur , fieret ;	statilius et gabinius uti cum magnus manus duodecim simul opportunus locum urbs incendo , quo tumultus facilis aditus ad consul que ceterus , qui insidiae paro , fio ;	MASC;N;NOM;SG CONJ MASC;N;NOM;SG CONJ ADP ADJ;AT+ABL;FEM;SG AT+ABL;FEM;N;SG NUM ADV ACC;ADJ;NEUT;PL ACC;N;NEUT;PL FEM;GEN;N;SG 3;ACT;FIN;IPFV;PL;PST;SBJV;V _ CONJ MASC;N;NOM;SG ADJ;CMPR;MASC;NOM;SG MASC;N;NOM;SG ADP ACC;MASC;N;SG CONJ ACC;ADJ;MASC;PL _ DAT;MASC;PL;PRO FEM;N;NOM;PL 3;FIN;IND;IPFV;PASS;PL;PST;V _ 3;ACT;FIN;SBJV;SG;V _
silva tum excepit ferum , in qua retentis impeditus cornibus lacerari coepit morsibus saevis canum .	silva tum excipio ferus , in qui retineo impedio cornu lacero coepio morsus saevus canis .	FEM;N;NOM;SG ADV 3;ACT;FIN;IND;PFV;PST;SG;V ACC;ADJ;MASC;SG _ ADP AT+ABL;FEM;PRO;SG AT+ABL;NEUT;PASS;PFV;PL;PST;V;V.PTCP MASC;NOM;PASS;PFV;PST;SG;V;V.PTCP AT+ABL;N;NEUT;PL NFIN;PASS;PRS;V 3;ACT;FIN;IND;PFV;PST;SG;V AT+ABL;MASC;N;PL ADJ;AT+ABL;MASC;PL GEN;MASC;N;PL _
quamlibet lambe otio ;	quamlibet lambo otium ;	ADV 2;ACT;FIN;IMP;PRS;SG;V AT+ABL;N;NEUT;SG _
populi recensum uicatim egit , ac ne plebs frumentationum causa frequentius ab negotiis auocaretur , ter in annum quaternum mensium tesseras dare destinauit ;	populus recensus vicatim ago , atque ne plebs frumentatio causa frequens ab negotium avoco , ter in annus quaterni mensis tessera do destino ;	GEN;MASC;N;SG ACC;MASC;N;SG ADV 3;ACT;FIN;IND;PFV;PST;SG;V _ CONJ CONJ FEM;N;NOM;SG FEM;GEN;N;PL AT+ABL;FEM;N;SG ADV;CMPR ADP AT+ABL;N;NEUT;PL 3;FIN;IPFV;PASS;PST;SBJV;SG;V _ ADV ADP ACC;MASC;N;SG GEN;MASC;NUM;PL GEN;MASC;N;PL ACC;FEM;N;PL ACT;NFIN;PRS;V 3;ACT;FIN;IND;PFV;PST;SG;V _
assem habeas , assem valeas ;	assis habeo , assis valeo ;	ACC;MASC;N;SG 2;ACT;FIN;PRS;SBJV;SG;V _ ACC;MASC;N;SG 2;ACT;FIN;PRS;SBJV;SG;V _
honeste vixit , honeste obiit .	honestus vivo , honestus obeo .	ADV 3;ACT;FIN;IND;PFV;PST;SG;V CONJ ADV 3;ACT;FIN;IND;PFV;PST;SG;V _
et dicit mihi :	et dico ego :	CONJ 3;ACT;FIN;IND;PRS;SG;V DAT;MASC;PRO;SG _
eodem die :	idem dies :	AT+ABL;MASC;PRO;SG AT+ABL;MASC;N;SG _
ea millia hominum paullo plura quam ducenta fuerunt .	is mille homo paulus multus quam ducenti sum .	NEUT;NOM;PL;PRO NEUT;NOM;NUM;PL GEN;MASC;N;PL ADJ;AT+ABL;NEUT;SG ADJ;CMPR;NEUT;NOM;PL ADV ADJ;NEUT;NOM;PL 3;ACT;FIN;IND;PFV;PL;PST;V _
quae pater ut summa vidit saturnius arce , ingemit et , facto nondum vulgata recenti , foeda lycaoniae referens convivia mensae , ingentes animo et dignas iove concipit iras , que concilium vocat :	qui pater ut summus video saturnius arx , ingemo et , factum nondum vulgo recens , foedus lycaonius refero convivium mensa , ingens animus et dignus iuppiter concipio ira , que concilium voco :	ACC;NEUT;PL;PRO MASC;N;NOM;SG CONJ ADJ;AT+ABL;FEM;SG 3;ACT;FIN;IND;PFV;PST;SG;V ADJ;MASC;NOM;SG AT+ABL;FEM;N;SG _ 3;ACT;FIN;IND;PRS;SG;V CONJ _ AT+ABL;N;NEUT;SG ADV ACC;NEUT;PASS;PFV;PL;PST;V;V.PTCP ADJ;AT+ABL;NEUT;SG _ ACC;ADJ;NEUT;PL ADJ;FEM;GEN;SG ACT;MASC;NOM;PRS;SG;V;V.PTCP ACC;N;NEUT;PL FEM;GEN;N;SG _ ACC;ADJ;FEM;PL AT+ABL;MASC;N;SG CONJ ACC;ADJ;FEM;PL AT+ABL;MASC;N;SG 3;ACT;FIN;IND;PRS;SG;V ACC;FEM;N;PL _ CONJ ACC;N;NEUT;SG 3;ACT;FIN;IND;PRS;SG;V _
ponticuli etiam ferruminati sustinebant glires melle ac papavere sparsos .	ponticulus etiam ferrumino sustineo glis mel atque papaver spargo .	MASC;N;NOM;PL CONJ MASC;NOM;PASS;PFV;PL;PST;V;V.PTCP 3;ACT;FIN;IND;IPFV;PL;PST;V ACC;MASC;N;PL AT+ABL;N;NEUT;SG CONJ AT+ABL;N;NEUT;SG ACC;MASC;PASS;PFV;PL;PST;V;V.PTCP _
atque utinam posito dicar amore rudis !	atque utinam pono dico amor rudis !	CONJ ADV AT+ABL;MASC;PASS;PFV;PST;SG;V;V.PTCP 1;FIN;PASS;PRS;SBJV;SG;V AT+ABL;MASC;N;SG ADJ;MASC;NOM;SG _
sed ut salubrem magis quam ambitiosum principem scires , querentem de inopia et caritate uini populum seuerissima coercuit uoce :	sed ut salubris magnus quam ambitiosus princeps scio , queror de inopia et caritas vinum populus severus coerceo vox :	CONJ CONJ ACC;ADJ;MASC;SG ADV;CMPR ADV ACC;ADJ;MASC;SG ACC;MASC;N;SG 2;ACT;FIN;IPFV;PST;SBJV;SG;V _ ACC;ACT;MASC;PRS;SG;V;V.PTCP ADP AT+ABL;FEM;N;SG CONJ AT+ABL;FEM;N;SG GEN;N;NEUT;SG ACC;MASC;N;SG ADJ;AT+ABL;FEM;RL;SG 3;ACT;FIN;IND;PFV;PST;SG;V AT+ABL;FEM;N;SG _
ita varie per omnem exercitum laetitia , maeror , luctus atque gaudia agitabantur .	ita varius per omnis exercitus laetitia , maeror , luctus atque gaudium agito .	ADV ADV ADP ACC;ADJ;MASC;SG ACC;MASC;N;SG FEM;N;NOM;SG _ MASC;N;NOM;SG _ MASC;N;NOM;SG CONJ N;NEUT;NOM;PL 3;FIN;IND;IPFV;PASS;PL;PST;V _
saepe ego multa tuae levitatis dura timebam , hac tamen excepta , cynthia , perfidia .	saepe ego multus tuus levitas durus timeo , hic tamen excipio , cynthia , perfidia .	ADV MASC;NOM;PRO;SG ACC;ADJ;NEUT;PL FEM;GEN;PRO;SG FEM;GEN;N;SG ACC;ADJ;NEUT;PL 1;ACT;FIN;IND;IPFV;PST;SG;V _ AT+ABL;FEM;PRO;SG ADV AT+ABL;FEM;PASS;PFV;PST;SG;V;V.PTCP _ FEM;N;SG;VOC _ AT+ABL;FEM;N;SG _
sed sibi quisque peccat .	sed sui quisque pecco .	CONJ DAT;MASC;PRO;SG MASC;NOM;PRO;SG 3;ACT;FIN;IND;PRS;SG;V _
ergo exploranda est veritas multum , prius quam stulta prave iudicet sententia .	ergo exploro sum veritas multus , prior quam stultus pravus judico sententia .	ADV FEM;NOM;SG;V;V.CVB 3;ACT;FIN;IND;PRS;SG;V FEM;N;NOM;SG ADV _ ADV;CMPR ADV ADJ;FEM;NOM;SG ADV 3;ACT;FIN;PRS;SBJV;SG;V FEM;N;NOM;SG _
sincerum mihi candore noto reddas iudicium peto .	sincerus ego candor nosco reddo judicium peto .	ACC;ADJ;NEUT;SG DAT;MASC;PRO;SG AT+ABL;MASC;N;SG AT+ABL;MASC;PASS;PFV;PST;SG;V;V.PTCP 2;ACT;FIN;PRS;SBJV;SG;V ACC;N;NEUT;SG 1;ACT;FIN;IND;PRS;SG;V _
finierat paean :	finio paean :	3;ACT;FIN;IND;PST+PRF;SG;V MASC;N;NOM;SG _
de nihilo crevit .	de nihilum cerno .	ADP AT+ABL;N;NEUT;SG 3;ACT;FIN;IND;PFV;PST;SG;V _
sis quodcumque voles , non aliena tamen .	sum quicumque volo , non alienus tamen .	2;ACT;FIN;PRS;SBJV;SG;V ACC;NEUT;PRO;SG 2;ACT;FIN;FUT;IND;SG;V _ ADV ADJ;FEM;NOM;SG ADV _
tamen me salvo cito aquam liberam gustabunt .	tamen ego salvus cito aqua liber gusto .	ADV AT+ABL;MASC;PRO;SG ADJ;AT+ABL;MASC;SG ADV ACC;FEM;N;SG ACC;ADJ;FEM;SG 3;ACT;FIN;FUT;IND;PL;V _
quinque dies aquam in os suum non coniecit , non micam panis .	quinque dies aqua in os suus non conicio , non mica panis .	NUM ACC;FEM;N;PL ACC;FEM;N;SG ADP ACC;N;NEUT;SG ACC;ADJ;NEUT;SG ADV 3;ACT;FIN;IND;PFV;PST;SG;V _ ADV ACC;FEM;N;SG GEN;MASC;N;SG _
ubi intenderis ingenium , valet ;	ubi intendo ingenium , valeo ;	CONJ 2;ACT;FIN;PFV;PST;SBJV;SG;V ACC;N;NEUT;SG _ 3;ACT;FIN;IND;PRS;SG;V _
ergo ad patrem decurrit laesura invicem magna que invidia criminatur filium , vir natus quod rem feminarum tetigerit .	ergo ad pater decurro laesura invicem magnus que invidia criminor filius , vir nascor quod res femina tango .	ADV ADP ACC;MASC;N;SG 3;ACT;FIN;IND;PRS;SG;V AT+ABL;FEM;N;SG ADV ADJ;AT+ABL;FEM;SG CONJ AT+ABL;FEM;N;SG 3;ACT;FIN;IND;PRS;SG;V ACC;MASC;N;SG _ MASC;N;NOM;SG ACT;MASC;NOM;PFV;PST;SG;V;V.PTCP CONJ ACC;FEM;N;SG FEM;GEN;N;PL 3;ACT;FIN;PFV;PST;SBJV;SG;V _
nox nulla intercessit :	nox nullus intercedo :	FEM;N;NOM;SG ADJ;FEM;NOM;SG 3;ACT;FIN;IND;PFV;PST;SG;V _
aliqua die te persuadeam , ut ad villam venias et videas casulas nostras ?	aliqui dies tu persuadeo , ut ad villa venio et video casula noster ?	AT+ABL;FEM;PRO;SG AT+ABL;FEM;N;SG ACC;MASC;PRO;SG 1;ACT;FIN;PRS;SBJV;SG;V _ CONJ ADP ACC;FEM;N;SG 2;ACT;FIN;PRS;SBJV;SG;V CONJ 2;ACT;FIN;PRS;SBJV;SG;V ACC;FEM;N;PL ACC;ADJ;FEM;PL _
facile est autem , ubi omnia quadrata currunt .	facilis sum autem , ubi omnis quadratum curro .	ADJ;NEUT;NOM;SG 3;ACT;FIN;IND;PRS;SG;V CONJ _ CONJ N;NEUT;NOM;PL N;NEUT;NOM;PL 3;ACT;FIN;IND;PL;PRS;V _
nuper cum morte superioris uxoris novis nuptiis locum vacuefecisses , nonne etiam alio incredibili scelere hoc scelus cumulavisti ?	nuper cum mors superus uxor novus nuptiae locum vacuefacio , nonne etiam alius incredibilis scelus hic scelus cumulo ?	ADV CONJ AT+ABL;FEM;N;SG ADJ;CMPR;FEM;GEN;SG FEM;GEN;N;SG ADJ;AT+ABL;FEM;PL AT+ABL;FEM;N;PL ACC;N;NEUT;SG 2;ACT;FIN;PST+PRF;SBJV;SG;V _ ADV ADV ADJ;AT+ABL;NEUT;SG ADJ;AT+ABL;NEUT;SG AT+ABL;N;NEUT;SG ACC;NEUT;PRO;SG ACC;N;NEUT;SG 2;ACT;FIN;IND;PFV;PST;SG;V _
amittit merito proprium qui alienum adpetit .	amitto mereo proprius qui alienus appeto .	3;ACT;FIN;IND;PRS;SG;V ADV ACC;ADJ;NEUT;SG MASC;NOM;PRO;SG ACC;ADJ;NEUT;SG 3;ACT;FIN;IND;PRS;SG;V _
itaque contione advocata huiusce modi orationem habuit :	ita contio advoco hic modus oratio habeo :	ADV AT+ABL;FEM;N;SG AT+ABL;FEM;PASS;PFV;PST;SG;V;V.PTCP GEN;MASC;PRO;SG GEN;MASC;N;SG ACC;FEM;N;SG 3;ACT;FIN;IND;PFV;PST;SG;V _
inaudito enim more pueri capillati attulerunt unguentum in argentea pelve que pedes recumbentium unxerunt , cum ante crura que talos corollis vinxissent .	inaudio enim mos puer capillatus affero unguentum in argenteus pelvis que pes recumbo ungo , cum ante crus que talus corolla vincio .	AT+ABL;MASC;PASS;PFV;PST;SG;V;V.PTCP CONJ AT+ABL;MASC;N;SG MASC;N;NOM;PL ADJ;MASC;NOM;PL 3;ACT;FIN;IND;PFV;PL;PST;V ACC;N;NEUT;SG ADP ADJ;AT+ABL;FEM;SG AT+ABL;FEM;N;SG CONJ ACC;MASC;N;PL GEN;MASC;PASS;PFV;PL;PST;V;V.PTCP 3;ACT;FIN;IND;PFV;PL;PST;V _ CONJ ADV ACC;N;NEUT;PL CONJ ACC;MASC;N;PL AT+ABL;FEM;N;PL 3;ACT;FIN;PL;PST+PRF;SBJV;V _
pro his nos habemus luxuriam atque avaritiam , publice egestatem , privatim opulentiam .	pro hic nos habeo luxuria atque avaritia , publicus egestas , privatim opulentia .	ADP AT+ABL;MASC;PL;PRO MASC;NOM;PL;PRO 1;ACT;FIN;IND;PL;PRS;V ACC;FEM;N;SG CONJ ACC;FEM;N;SG _ ADV ACC;FEM;N;SG _ ADV ACC;FEM;N;SG _
signa militaria complura per alios duces amissa devictis hostibus recepi ex hispania et gallia et a dalmateis .	signum militaris complures per alius dux amitto devinco hostis recipio ex hispania et gallia et ab dalmata .	ACC;N;NEUT;PL ACC;ADJ;NEUT;PL ACC;ADJ;NEUT;PL ADP ACC;MASC;N;PL ACC;MASC;N;PL ACC;NEUT;PASS;PFV;PL;PST;V;V.PTCP AT+ABL;MASC;PASS;PFV;PL;PST;V;V.PTCP AT+ABL;MASC;N;PL 1;ACT;FIN;IND;PFV;PST;SG;V ADP AT+ABL;FEM;N;SG CONJ AT+ABL;FEM;N;SG CONJ ADP AT+ABL;MASC;N;PL _
ego , litteratae qui sum propior graeciae , cur somno inerti deseram patriae decus ?	ego , litteratus qui sum propior graecia , cur somnus iners desero patria decus ?	MASC;NOM;PRO;SG _ ADJ;DAT;FEM;SG MASC;NOM;PRO;SG 1;ACT;FIN;IND;PRS;SG;V ADJ;CMPR;MASC;NOM;SG DAT;FEM;N;SG _ ADV DAT;MASC;N;SG ADJ;DAT;MASC;SG 1;ACT;FIN;PRS;SBJV;SG;V FEM;GEN;N;SG ACC;N;NEUT;SG _
nunc tu insanus medio flumine quaeris aquam .	nunc tu insanus medius flumen quaero aqua .	ADV MASC;NOM;PRO;SG ADJ;MASC;NOM;SG ADJ;AT+ABL;NEUT;SG AT+ABL;N;NEUT;SG 2;ACT;FIN;IND;PRS;SG;V ACC;FEM;N;SG _
et tibi non umquam nostros puer iste labores afferat et lacrimis omnia nota meis !	et tu non umquam noster puer iste labor affero et lacrima omnis nosco meus !	CONJ DAT;MASC;PRO;SG ADV ADV ACC;MASC;PL;PRO MASC;N;NOM;SG MASC;NOM;PRO;SG ACC;MASC;N;PL 3;ACT;FIN;PRS;SBJV;SG;V CONJ DAT;FEM;N;PL ACC;ADJ;NEUT;PL ACC;NEUT;PASS;PFV;PL;PST;V;V.PTCP DAT;FEM;PL;PRO _
et audivi quasi vocem turbae magnae et sicut vocem aquarum multarum et sicut vocem tonitruum magnorum dicentium :	et audio quasi vox turba magnus et sicut vox aqua multus et sicut vox tonitrus magnus dico :	CONJ 1;ACT;FIN;IND;PFV;PST;SG;V ADV ACC;FEM;N;SG FEM;GEN;N;SG ADJ;FEM;GEN;SG CONJ CONJ ACC;FEM;N;SG FEM;GEN;N;PL ADJ;FEM;GEN;PL CONJ CONJ ACC;FEM;N;SG GEN;MASC;N;PL ADJ;GEN;MASC;PL ACT;FEM;GEN;PL;PRS;V;V.PTCP _
dum versas te , nox fit .	dum verso tu , nox fio .	CONJ 2;ACT;FIN;IND;PRS;SG;V ACC;MASC;PRO;SG _ FEM;N;NOM;SG 3;ACT;FIN;IND;PRS;SG;V _
quam dulcis sit libertas , breviter proloquar .	quam dulcis sum libertas , brevis proloquor .	ADV ADJ;FEM;NOM;SG 3;ACT;FIN;PRS;SBJV;SG;V FEM;N;NOM;SG _ ADV 1;ACT;FIN;FUT;IND;SG;V _
tu enim beatior es et convivare melius soles .	tu enim beo sum et convivo melius soleo .	MASC;NOM;PRO;SG CONJ ADJ;CMPR;MASC;NOM;SG 2;ACT;FIN;IND;PRS;SG;V CONJ ACT;NFIN;PRS;V ADV 2;ACT;FIN;IND;PRS;SG;V _
iam scio , unde acceperit denarios mille aureos .	jam scio , unde accipio denarius mille aureus .	ADV 1;ACT;FIN;IND;PRS;SG;V _ ADV 3;ACT;FIN;PFV;PST;SBJV;SG;V ACC;MASC;N;PL NUM ACC;MASC;N;PL _
atque ipse erectis supra frontem manibus syrum histrionem exhibebat concinente tota familia :	atque ipse erigo supra frons manus syrus histrio exhibeo concino totus familia :	CONJ MASC;NOM;PRO;SG AT+ABL;FEM;PASS;PFV;PL;PST;V;V.PTCP ADP ACC;FEM;N;SG AT+ABL;FEM;N;PL ACC;MASC;N;SG ACC;MASC;N;SG 3;ACT;FIN;IND;IPFV;PST;SG;V ACT;AT+ABL;FEM;PRS;SG;V;V.PTCP ADJ;AT+ABL;FEM;SG AT+ABL;FEM;N;SG _
hoc admonere simplices etiam potest , opinione alterius ne quid ponderent :	hic admoneo simplex etiam possum , opinio alter ne quis pondero :	NEUT;NOM;PRO;SG ACT;NFIN;PRS;V ACC;ADJ;MASC;PL CONJ 3;ACT;FIN;IND;PRS;SG;V _ AT+ABL;FEM;N;SG ADJ;GEN;MASC;SG CONJ ACC;NEUT;PRO;SG 3;ACT;FIN;PL;PRS;SBJV;V _
darem inquit nisi soleres per te sumere :	do inquam nisi soleo per tu sumo :	1;ACT;FIN;IPFV;PST;SBJV;SG;V 3;ACT;FIN;IND;PFV;PST;SG;V CONJ 2;ACT;FIN;IPFV;PST;SBJV;SG;V ADP ACC;MASC;PRO;SG ACT;NFIN;PRS;V _
appellari singulos iussit , decima parte liberalitatis apud quemque eorum relicta .	appello singuli jubeo , decimus pars liberalitas apud quisque is relinquo .	NFIN;PASS;PRS;V ACC;MASC;NUM;PL 3;ACT;FIN;IND;PFV;PST;SG;V _ AT+ABL;FEM;NUM;SG AT+ABL;FEM;N;SG FEM;GEN;N;SG ADP ACC;MASC;PRO;SG GEN;MASC;PL;PRO AT+ABL;FEM;PASS;PFV;PST;SG;V;V.PTCP _
quemadmodum cassandra occidit filios suos , et pueri mortui iacent sic ut vivere putes .	quemadmodum cassandra occido filius suus , et puer mortuus jaceo sic ut vivo puto .	ADV FEM;N;NOM;SG 3;ACT;FIN;IND;PFV;PST;SG;V ACC;MASC;N;PL ACC;ADJ;MASC;PL _ CONJ MASC;N;NOM;PL ADJ;MASC;NOM;PL 3;ACT;FIN;IND;PL;PRS;V ADV CONJ ACT;NFIN;PRS;V 2;ACT;FIN;PRS;SBJV;SG;V _
et vos , qui sero lapsum revocatis , amici , quaerite non sani pectoris auxilia .	et tu , qui serus labor revoco , amicus , quaero non sanus pectus auxilium .	CONJ MASC;NOM;PL;PRO _ MASC;NOM;PL;PRO ADV ACC;ACT;MASC;PFV;PST;SG;V;V.PTCP 2;ACT;FIN;IND;PL;PRS;V _ MASC;N;PL;VOC _ 2;ACT;FIN;IMP;PL;PRS;V ADV ADJ;GEN;NEUT;SG GEN;N;NEUT;SG ACC;N;NEUT;PL _
quod tamen admissum , quae sit vindicta , docebo .	qui tamen admitto , qui sum vindicta , doceo .	NEUT;NOM;PRO;SG ADV NEUT;NOM;PASS;PFV;PST;SG;V;V.PTCP _ FEM;NOM;PRO;SG 3;ACT;FIN;PRS;SBJV;SG;V FEM;N;NOM;SG _ 1;ACT;FIN;FUT;IND;SG;V _
m . tulli , quid agis ?	marcus . tullius , quis ago ?	MASC;N;SG;VOC _ MASC;N;SG;VOC _ ACC;NEUT;PRO;SG 2;ACT;FIN;IND;PRS;SG;V _
qui nunc demum intellego utilia mihi quam fuerint quae despexeram , et quae laudaram quantum luctus habuerint .	qui nunc demum intellego utilis ego quam sum qui despicio , et qui laudo quantus luctus habeo .	MASC;NOM;PRO;SG ADV ADV 1;ACT;FIN;IND;PRS;SG;V ADJ;NEUT;NOM;PL DAT;MASC;PRO;SG ADV 3;ACT;FIN;PFV;PL;PST;SBJV;V ACC;NEUT;PL;PRO 1;ACT;FIN;IND;PST+PRF;SG;V _ CONJ ACC;NEUT;PL;PRO 1;ACT;FIN;IND;PST+PRF;SG;V ACC;ADJ;NEUT;SG GEN;MASC;N;SG 3;ACT;FIN;PFV;PL;PST;SBJV;V _
dixerat , et flebant .	dico , et fleo .	3;ACT;FIN;IND;PST+PRF;SG;V _ CONJ 3;ACT;FIN;IND;IPFV;PL;PST;V _
talia quaerentes ( sibi enim fore cetera curae ) rex superum trepidare vetat que subolem priori dissimilem populo promittit origine mira .	talis quaero ( sui enim sum ceterum cura ) rex superi trepido veto que suboles prior dissimilis populus promitto origo mirus .	ACC;ADJ;NEUT;PL ACC;ACT;MASC;PL;PRS;V;V.PTCP _ DAT;MASC;PL;PRO CONJ ACT;FUT;NFIN;V N;NEUT;NOM;PL DAT;FEM;N;SG _ MASC;N;NOM;SG GEN;MASC;N;PL ACT;NFIN;PRS;V 3;ACT;FIN;IND;PRS;SG;V CONJ ACC;FEM;N;SG ADJ;CMPR;DAT;MASC;SG ACC;ADJ;FEM;SG DAT;MASC;N;SG 3;ACT;FIN;IND;PRS;SG;V AT+ABL;FEM;N;SG ADJ;AT+ABL;FEM;SG _
disciplinam seuerissime rexit .	disciplina severus rego .	ACC;FEM;N;SG ADV;RL 3;ACT;FIN;IND;PFV;PST;SG;V _
non multum egisti et opera nequiquam perit :	non multus ago et opera nequiquam pereo :	ADV ACC;ADJ;NEUT;SG 2;ACT;FIN;IND;PFV;PST;SG;V CONJ FEM;N;NOM;SG ADV 3;ACT;FIN;IND;PFV;PST;SG;V _
nescit amor priscis cedere imaginibus .	nescio amor priscus cedo imago .	3;ACT;FIN;IND;PRS;SG;V MASC;N;NOM;SG ADJ;DAT;FEM;PL ACT;NFIN;PRS;V DAT;FEM;N;PL _
nam fodere terram quod vides cotidie aprum insidiosum , quercum vult evertere , ut nostram in plano facile progeniem opprimat .	nam fodio terra quod video cottidie aper insidiosus , quercus volo everto , ut noster in planus facilis progenies opprimo .	CONJ ACT;NFIN;PRS;V ACC;FEM;N;SG CONJ 2;ACT;FIN;IND;PRS;SG;V ADV ACC;MASC;N;SG ACC;ADJ;MASC;SG _ ACC;FEM;N;SG 3;ACT;FIN;IND;PRS;SG;V ACT;NFIN;PRS;V _ CONJ ACC;FEM;PRO;SG ADP ADJ;AT+ABL;NEUT;SG ADV ACC;FEM;N;SG 3;ACT;FIN;PRS;SBJV;SG;V _
inquit non vis citius progredi ?	inquam non volo cieo progredior ?	3;ACT;FIN;IND;PFV;PST;SG;V ADV 2;ACT;FIN;IND;PRS;SG;V ADV;CMPR ACT;NFIN;PRS;V _
hic manus heroum , placidis ut constitit oris , mollia composita litora fronde tegit .	hic manus heros , placidus ut consto ora , mollis compono litus frons tego .	ADV FEM;N;NOM;SG GEN;MASC;N;PL _ ADJ;AT+ABL;FEM;PL ADV 3;ACT;FIN;IND;PFV;PST;SG;V AT+ABL;FEM;N;PL _ ACC;ADJ;NEUT;PL AT+ABL;FEM;PASS;PFV;PST;SG;V;V.PTCP ACC;N;NEUT;PL AT+ABL;FEM;N;SG 3;ACT;FIN;IND;PRS;SG;V _
quando vicesimam numerasti ?	quando vicesimus numero ?	ADV ACC;ADJ;FEM;SG 2;ACT;FIN;IND;PFV;PST;SG;V _
id ut comesse extractum possent facilius , aquam coepere ebibere :	is ut comedo extraho possum facilis , aqua coepio ebibo :	ACC;NEUT;PRO;SG CONJ ACT;NFIN;PRS;V ACC;NEUT;PASS;PFV;PST;SG;V;V.PTCP 3;ACT;FIN;IPFV;PL;PST;SBJV;V ADV;CMPR _ ACC;FEM;N;SG 3;ACT;FIN;IND;PFV;PL;PST;V ACT;NFIN;PRS;V _
his amicis que sociis confisus catilina , simul quod aes alienum per omnis terras ingens erat et quod que pleri sullani milites , largius suo usi , rapinarum et victoriae veteris memores civile bellum exoptabant , opprimundae rei publicae consilium cepit .	hic amicus que socius confido catilina , simul quod aes alienus per omnis terra ingens sum et quod que plerus sullanus miles , largus suus utor , rapina et victoria vetus memor civilis bellum exopto , opprimo res publicus consilium capio .	DAT;MASC;PL;PRO DAT;MASC;N;PL CONJ DAT;MASC;N;PL MASC;NOM;PASS;PFV;PST;SG;V;V.PTCP MASC;N;NOM;SG _ ADV CONJ N;NEUT;NOM;SG ADJ;NEUT;NOM;SG ADP ACC;ADJ;FEM;PL ACC;FEM;N;PL ADJ;NEUT;NOM;SG 3;ACT;FIN;IND;IPFV;PST;SG;V CONJ CONJ CONJ ADJ;MASC;NOM;PL ADJ;MASC;NOM;PL MASC;N;NOM;PL _ ADV ADJ;AT+ABL;NEUT;SG MASC;NOM;PASS;PFV;PL;PST;V;V.PTCP _ FEM;GEN;N;PL CONJ FEM;GEN;N;SG ADJ;FEM;GEN;SG ADJ;MASC;NOM;PL ACC;ADJ;NEUT;SG ACC;N;NEUT;SG 3;ACT;FIN;IND;IPFV;PL;PST;V _ FEM;GEN;PASS;PRS;SG;V;V.CVB FEM;GEN;N;SG ADJ;FEM;GEN;SG N;NEUT;NOM;SG 3;ACT;FIN;IND;PFV;PST;SG;V _
parce , quaeso inquit mihi , quae tibi molestis muribus purgo domum .	parco , quaeso inquam ego , qui tu molestus mus purgo domus .	2;ACT;FIN;IMP;PRS;SG;V _ 1;ACT;FIN;IND;PRS;SG;V 3;ACT;FIN;IND;PFV;PST;SG;V DAT;FEM;PRO;SG _ FEM;NOM;PRO;SG DAT;MASC;PRO;SG ADJ;AT+ABL;MASC;PL AT+ABL;MASC;N;PL 1;ACT;FIN;IND;PRS;SG;V ACC;FEM;N;SG _
vires effundite vestras :	vis effundo vester :	ACC;FEM;N;PL 2;ACT;FIN;IMP;PL;PRS;V ACC;ADJ;FEM;PL _
pater deorum risit atque illis dedit parvum tigillum , missum quod subito vadi motu sono que terruit pavidum genus .	pater deus rideo atque ille do parvus tigillum , mitto qui subeo vadum motus sonus que terreo pavidus genus .	MASC;N;NOM;SG GEN;MASC;N;PL 3;ACT;FIN;IND;PFV;PST;SG;V CONJ AT+ABL;FEM;PL;PRO 3;ACT;FIN;IND;PFV;PST;SG;V ACC;ADJ;NEUT;SG ACC;N;NEUT;SG _ NEUT;NOM;PASS;PFV;PST;SG;V;V.PTCP NEUT;NOM;PRO;SG ADV GEN;N;NEUT;SG AT+ABL;MASC;N;SG AT+ABL;MASC;N;SG CONJ 3;ACT;FIN;IND;PFV;PST;SG;V ACC;ADJ;NEUT;SG ACC;N;NEUT;SG _
et potestatem habent super aquas convertendi eas in sanguinem et percutere terram omni plaga quotienscumque voluerint .	et potestas habeo super aqua converto is in sanguis et percutio terra omnis plaga quotienscumque volo .	CONJ ACC;FEM;N;SG 3;ACT;FIN;IND;PL;PRS;V ADP ACC;FEM;N;PL ACT;GEN;NEUT;PRS;SG;V;V.MSDR ACC;FEM;PL;PRO ADP ACC;MASC;N;SG CONJ ACT;NFIN;PRS;V ACC;FEM;N;SG ADJ;AT+ABL;FEM;SG AT+ABL;FEM;N;SG ADV 3;ACT;FIN;PFV;PL;PST;SBJV;V _
quid enim mihi aufert , qui ridet ?	quis enim ego aufero , qui rideo ?	ACC;NEUT;PRO;SG CONJ DAT;MASC;PRO;SG 3;ACT;FIN;IND;PRS;SG;V _ MASC;NOM;PRO;SG 3;ACT;FIN;IND;PRS;SG;V _
et giton quidem iam dudum se ratione acutissima redemerat a cane ;	et giton quidem jam dudum sui ratio acutus redemo ab canis ;	CONJ MASC;N;NOM;SG ADV ADV ADV ACC;MASC;PRO;SG AT+ABL;FEM;N;SG ADJ;AT+ABL;FEM;RL;SG 3;ACT;FIN;IND;PST+PRF;SG;V ADP AT+ABL;MASC;N;SG _
severitatem res ipsa flagitat .	severitas res ipse flagito .	ACC;FEM;N;SG FEM;N;NOM;SG FEM;NOM;PRO;SG 3;ACT;FIN;IND;PRS;SG;V _
tunc diviso tergore silvas petivit , homini ut accessum daret .	tunc divido tergum silva peto , homo ut accessus do .	ADV AT+ABL;NEUT;PASS;PFV;PST;SG;V;V.PTCP AT+ABL;N;NEUT;SG ACC;FEM;N;PL 3;ACT;FIN;IND;PFV;PST;SG;V _ DAT;MASC;N;SG CONJ ACC;MASC;N;SG 3;ACT;FIN;IPFV;PST;SBJV;SG;V _
cleopatrae , quam seruatam triumpho magnopere cupiebat , etiam psyllos admouit , qui uenenum ac uirus exugerent , quod perisse morsu aspidis putabatur .	cleopatra , qui servo triumphus magnopere cupio , etiam psylli admoveo , qui venenum atque virus exsugo , quod pereo morsus aspis puto .	DAT;FEM;N;SG _ ACC;FEM;PRO;SG ACC;FEM;PASS;PFV;PST;SG;V;V.PTCP DAT;MASC;N;SG ADV 3;ACT;FIN;IND;IPFV;PST;SG;V _ CONJ ACC;MASC;N;PL 3;ACT;FIN;IND;PFV;PST;SG;V _ MASC;NOM;PL;PRO ACC;N;NEUT;SG CONJ ACC;N;NEUT;SG 3;ACT;FIN;IPFV;PL;PST;SBJV;V _ CONJ ACT;NFIN;PFV;PST;V AT+ABL;MASC;N;SG FEM;GEN;N;SG 3;FIN;IND;IPFV;PASS;PST;SG;V _
dixit et inplicuit materno bracchia collo que per suum que meropis caput que taedas sororum traderet oravit veri sibi signa parentis .	dico et implico maternus bracchium collum que per suus que merops caput que taeda soror trado oro verus sui signum parens .	3;ACT;FIN;IND;PFV;PST;SG;V CONJ 3;ACT;FIN;IND;PFV;PST;SG;V ADJ;DAT;NEUT;SG ACC;N;NEUT;PL DAT;N;NEUT;SG CONJ ADP ACC;ADJ;NEUT;SG CONJ GEN;MASC;N;SG ACC;N;NEUT;SG CONJ ACC;FEM;N;PL FEM;GEN;N;PL 3;ACT;FIN;IPFV;PST;SBJV;SG;V 3;ACT;FIN;IND;PFV;PST;SG;V ADJ;GEN;MASC;SG DAT;MASC;PRO;SG ACC;N;NEUT;PL GEN;MASC;N;SG _
ita eorum qui fecere virtus tanta habetur , quantum eam verbis potuere extollere praeclara ingenia .	ita is qui facio virtus tantus habeo , quantum is verbum possum extollo praeclarus ingenium .	ADV GEN;MASC;PL;PRO MASC;NOM;PL;PRO 3;ACT;FIN;IND;PFV;PL;PST;V FEM;N;NOM;SG ADJ;FEM;NOM;SG 3;FIN;IND;PASS;PRS;SG;V _ ADV ACC;FEM;PRO;SG AT+ABL;N;NEUT;PL 3;ACT;FIN;IND;PFV;PL;PST;V ACT;NFIN;PRS;V ADJ;NEUT;NOM;PL N;NEUT;NOM;PL _
post ubi eorum famam atque pudorem adtriverat , maiora alia imperabat .	post ubi is fama atque pudor attero , magnus alius impero .	ADV CONJ GEN;MASC;PL;PRO ACC;FEM;N;SG CONJ ACC;MASC;N;SG _ _ ACC;ADJ;CMPR;NEUT;PL ACC;ADJ;NEUT;PL 3;ACT;FIN;IND;IPFV;PST;SG;V _
induxi te ad legendum ;	induco tu ad lego ;	1;ACT;FIN;IND;PFV;PST;SG;V ACC;MASC;PRO;SG ADP ACC;ACT;V;V.MSDR _
et exivit vox magna de templo a throno dicens :	et exeo vox magnus de templum ab thronus dico :	CONJ 3;ACT;FIN;IND;PFV;PST;SG;V FEM;N;NOM;SG ADJ;FEM;NOM;SG ADP AT+ABL;N;NEUT;SG ADP AT+ABL;MASC;N;SG ACT;FEM;NOM;PRS;SG;V;V.PTCP _
nostra memoria victor sulla quom damasippum et alios eius modi , qui malo rei publicae creverant , iugulari iussit , quis non factum eius laudabat ?	noster memoria victor sulla cum damasippus et alius is modus , qui malus res publicus cerno , jugulo jubeo , quis non factum is laudo ?	ADJ;AT+ABL;FEM;SG AT+ABL;FEM;N;SG MASC;N;NOM;SG MASC;N;NOM;SG CONJ ACC;MASC;N;SG CONJ ACC;ADJ;MASC;PL GEN;MASC;PRO;SG GEN;MASC;N;SG _ MASC;NOM;PL;PRO ADJ;AT+ABL;NEUT;SG FEM;GEN;N;SG ADJ;FEM;GEN;SG 3;ACT;FIN;IND;PL;PST+PRF;V _ NFIN;PASS;PRS;V 3;ACT;FIN;IND;PFV;PST;SG;V _ MASC;NOM;PRO;SG ADV ACC;N;NEUT;SG GEN;MASC;PRO;SG 3;ACT;FIN;IND;IPFV;PST;SG;V _
sed haec lupatria providet omnia et ubi non putes .	sed hic lupatria provideo omnis et ubi non puto .	CONJ FEM;NOM;PRO;SG FEM;N;NOM;SG 3;ACT;FIN;IND;PRS;SG;V ACC;ADJ;NEUT;PL ADV CONJ ADV 2;ACT;FIN;PRS;SBJV;SG;V _
aesopus auctor quam materiam repperit , hanc ego polivi versibus senariis .	aesopus auctor qui materia reperio , hic ego polio versus senarius .	MASC;N;NOM;SG MASC;N;NOM;SG ACC;FEM;PRO;SG ACC;FEM;N;SG 3;ACT;FIN;IND;PFV;PST;SG;V _ ACC;FEM;PRO;SG MASC;NOM;PRO;SG 1;ACT;FIN;IND;PFV;PST;SG;V AT+ABL;MASC;N;PL ADJ;AT+ABL;MASC;PL _
ergo velocem potuit domuisse puellam :	ergo velox possum domo puella :	ADV ACC;ADJ;FEM;SG 3;ACT;FIN;IND;PFV;PST;SG;V ACT;NFIN;PFV;PST;V ACC;FEM;N;SG _
nec ullum orationi aut lenocinium addit aut pretium .	neque ullus oratio aut lenocinium addo aut pretium .	CONJ ACC;ADJ;NEUT;SG DAT;FEM;N;SG CONJ ACC;N;NEUT;SG 3;ACT;FIN;IND;PRS;SG;V CONJ ACC;N;NEUT;SG _
non me chaoniae vincant in amore columbae dicere , quos iuvenes quaeque puella domet .	non ego chaonius vinco in amor columba dico , qui juvenis quisque puella domo .	ADV ACC;MASC;PRO;SG ADJ;FEM;NOM;PL 3;ACT;FIN;PL;PRS;SBJV;V ADP AT+ABL;MASC;N;SG FEM;N;NOM;PL ACT;NFIN;PRS;V _ ACC;MASC;PL;PRO ACC;ADJ;MASC;PL FEM;NOM;PRO;SG FEM;N;NOM;SG 3;ACT;FIN;PRS;SBJV;SG;V _
quocumque ire placet , ferro iter aperiundum est .	quocumque eo placeo , ferrum iter aperio sum .	ADV ACT;NFIN;PRS;V 3;ACT;FIN;IND;PRS;SG;V _ AT+ABL;N;NEUT;SG N;NEUT;NOM;SG NEUT;NOM;PASS;PRS;SG;V;V.CVB 3;ACT;FIN;IND;PRS;SG;V _
modo solebat collo suo ligna portare .	modo soleo collum suus lignum porto .	ADV 3;ACT;FIN;IND;IPFV;PST;SG;V AT+ABL;N;NEUT;SG ADJ;AT+ABL;NEUT;SG ACC;N;NEUT;PL ACT;NFIN;PRS;V _
aspera , qua properas , loca sunt .	asper , qua propero , locum sum .	ADJ;NEUT;NOM;PL _ ADV 2;ACT;FIN;IND;PRS;SG;V _ N;NEUT;NOM;PL 3;ACT;FIN;IND;PL;PRS;V _
quo magis properandum est .	quis magis propero sum .	AT+ABL;NEUT;PRO;SG ADV NEUT;NOM;PASS;PRS;SG;V;V.CVB 3;ACT;FIN;IND;PRS;SG;V _
de bove nil superest formae nisi candor in illa .	de bos nihil supersum forma nisi candor in ille .	ADP AT+ABL;FEM;N;SG N;NEUT;SG 3;ACT;FIN;IND;PRS;SG;V FEM;GEN;N;SG CONJ MASC;N;NOM;SG ADP AT+ABL;FEM;PRO;SG _
