o nata , merito sapiens dicere omnibus !	o natus , mereo sapio dico omnis !	INTJ ADJ;FEM;SG;VOC _ ADV FEM;NOM;PRS;SG;V;V.PTCP 2;FIN;IND;PASS;PRS;SG;V ADJ;AT+ABL;MASC;PL _
recepta cocus tunica cultrum arripuit que porci ventrem hinec atque illinc timida manu secuit .	recipio coquus tunica culter arripio que porcus venter hinc atque illinc timidus manus seco .	AT+ABL;FEM;PASS;PFV;PST;SG;V;V.PTCP MASC;N;NOM;SG AT+ABL;FEM;N;SG ACC;MASC;N;SG 3;ACT;FIN;IND;PFV;PST;SG;V CONJ GEN;MASC;N;SG ACC;MASC;N;SG ADV CONJ ADV ADJ;AT+ABL;FEM;SG AT+ABL;FEM;N;SG 3;ACT;FIN;IND;PFV;PST;SG;V _
igitur ex divitiis iuventutem luxuria atque avaritia cum superbia invasere :	igitur ex divitiae juventus luxuria atque avaritia cum superbia invado :	CONJ ADP AT+ABL;FEM;N;PL ACC;FEM;N;SG FEM;N;NOM;SG CONJ FEM;N;NOM;SG ADP AT+ABL;FEM;N;SG 3;ACT;FIN;IND;PFV;PL;PST;V _
si lubido possidet , ea dominatur , animus nihil valet .	si libido possideo , is dominor , animus nihil valeo .	CONJ FEM;N;NOM;SG 3;ACT;FIN;IND;PRS;SG;V _ FEM;NOM;PRO;SG 3;FIN;IND;PASS;PRS;SG;V _ MASC;N;NOM;SG ADV 3;ACT;FIN;IND;PRS;SG;V _
ne ista vobis mansuetudo et misericordia , si illi arma ceperint , in miseriam convortat .	ne iste tu mansuetudo et misericordia , si ille arma capio , in miseria converto .	ADV FEM;NOM;PRO;SG DAT;MASC;PL;PRO FEM;N;NOM;SG CONJ FEM;N;NOM;SG _ CONJ MASC;NOM;PL;PRO ACC;N;NEUT;PL 3;ACT;FIN;PFV;PL;PST;SBJV;V _ ADP ACC;FEM;N;SG 3;ACT;FIN;PRS;SBJV;SG;V _
ecquid te mediis cessantem , cynthia , bais , qua iacet herculeis semita litoribus , et modo thesproti mirantem subdita regno proxima misenis aequora nobilibus , nostri cura subit memores adducere noctes ?	ecquis tu medius cesso , cynthia , baiae , qua jaceo herculeus semita litus , et modo thesprotus miror subdo regnum propior misenum aequor nobilis , nos cura subeo memor duco nox ?	ADV ACC;FEM;PRO;SG ADJ;AT+ABL;FEM;PL ACC;ACT;FEM;PRS;SG;V;V.PTCP _ FEM;N;SG;VOC _ AT+ABL;FEM;N;PL _ ADV 3;ACT;FIN;IND;PRS;SG;V ADJ;AT+ABL;NEUT;PL FEM;N;NOM;SG AT+ABL;N;NEUT;PL _ CONJ ADV GEN;MASC;N;SG ACC;FEM;PRS;SG;V;V.PTCP ACC;NEUT;PASS;PFV;PL;PST;V;V.PTCP DAT;N;NEUT;SG ACC;ADJ;NEUT;PL;RL DAT;N;NEUT;PL ACC;N;NEUT;PL ADJ;DAT;NEUT;PL _ GEN;MASC;PL;PRO FEM;N;NOM;SG 3;ACT;FIN;IND;PRS;SG;V ACC;ADJ;FEM;PL ACT;NFIN;PRS;V ACC;FEM;N;PL _
inveniemus ergo unde saturi fiamus .	invenio ergo unde satur fio .	1;ACT;FIN;FUT;IND;PL;V ADV ADV ADJ;MASC;NOM;PL 1;ACT;FIN;PL;PRS;SBJV;V _
plura locuturum timido peneia cursu fugit cumque ipso verba inperfecta reliquit , tum quoque visa decens .	multus loquor timidus peneius cursus fugio cum ipse verbum imperfectus relinquo , tum quoque video decet .	ACC;ADJ;NEUT;PL ACC;ACT;FUT;MASC;SG;V;V.PTCP ADJ;AT+ABL;MASC;SG ADJ;FEM;NOM;SG AT+ABL;MASC;N;SG 3;ACT;FIN;IND;PFV;PST;SG;V ADP AT+ABL;MASC;PRO;SG ACC;N;NEUT;PL ACC;ADJ;NEUT;PL 3;ACT;FIN;IND;PFV;PST;SG;V _ ADV ADV FEM;NOM;PASS;PFV;PST;SG;V;V.PTCP ACT;FEM;NOM;PRS;SG;V;V.PTCP _
nos eam rem in medio relinquemus .	nos is res in medium relinquo .	MASC;NOM;PL;PRO ACC;FEM;PRO;SG ACC;FEM;N;SG ADP AT+ABL;N;NEUT;SG 1;ACT;FIN;FUT;IND;PL;V _
hanc ego , nondum etiam sensus deperditus omnis , molliter impresso conor adire toro ;	hic ego , nondum etiam sensus deperdo omnis , mollis imprimo conor adeo torus ;	ACC;FEM;PRO;SG MASC;NOM;PRO;SG _ ADV CONJ MASC;N;NOM;SG MASC;NOM;PASS;PFV;PST;SG;V;V.PTCP ADJ;MASC;NOM;SG _ ADV AT+ABL;MASC;PASS;PFV;PST;SG;V;V.PTCP 1;ACT;FIN;IND;PRS;SG;V ACT;NFIN;PRS;V AT+ABL;MASC;N;SG _
inquit dominus .	inquam dominus .	3;ACT;FIN;IND;PFV;PST;SG;V MASC;N;NOM;SG _
vos illud oportet bonum faciatis .	tu ille oportet bonus facio .	MASC;NOM;PL;PRO ACC;NEUT;PRO;SG 3;ACT;FIN;IND;PRS;SG;V ACC;ADJ;NEUT;SG 2;ACT;FIN;PL;PRS;SBJV;V _
id esse verum parva haec fabella indicat .	is sum verus parvus hic fabella indico .	ACC;NEUT;PRO;SG ACT;NFIN;PRS;V ACC;ADJ;NEUT;SG ADJ;FEM;NOM;SG FEM;NOM;PRO;SG FEM;N;NOM;SG 3;ACT;FIN;IND;PRS;SG;V _
quae modo vena fuit , sub eodem nomine mansit ;	qui modo vena sum , sub idem nomen maneo ;	FEM;NOM;PRO;SG ADV FEM;N;NOM;SG 3;ACT;FIN;IND;PFV;PST;SG;V _ ADP AT+ABL;NEUT;PRO;SG AT+ABL;N;NEUT;SG 3;ACT;FIN;IND;PFV;PST;SG;V _
stant patroni fortiter causam tuentes innocentis feminae .	sto patronus fortis causa tueor innocens femina .	3;ACT;FIN;IND;PL;PRS;V MASC;N;NOM;PL ADV ACC;FEM;N;SG MASC;NOM;PL;PRS;V;V.PTCP ADJ;FEM;GEN;SG FEM;GEN;N;SG _
patere tua consilia non sentis , constrictam iam horum omnium scientia teneri coniurationem tuam non vides ?	pateo tuus consilium non sentio , constringo jam hic omnis scientia teneo conjuratio tuus non video ?	ACT;NFIN;PRS;V ACC;NEUT;PL;PRO ACC;N;NEUT;PL ADV 2;ACT;FIN;IND;PRS;SG;V _ ACC;FEM;PASS;PFV;PST;SG;V;V.PTCP ADV GEN;MASC;PL;PRO ADJ;GEN;MASC;PL AT+ABL;FEM;N;SG NFIN;PASS;PRS;V ACC;FEM;N;SG ACC;FEM;PRO;SG ADV 2;ACT;FIN;IND;PRS;SG;V _
et qui sedet in throno habitabit super illos .	et qui sedeo in thronus habito super ille .	CONJ MASC;NOM;PRO;SG 3;ACT;FIN;IND;PRS;SG;V ADP AT+ABL;MASC;N;SG 3;ACT;FIN;FUT;IND;SG;V ADP ACC;MASC;PL;PRO _
sic erimus cuncti , postquam nos auferet orcus .	sic sum cunctus , postquam nos aufero orcus .	ADV 1;ACT;FIN;FUT;IND;PL;V ADJ;MASC;NOM;PL _ CONJ ACC;MASC;PL;PRO 3;ACT;FIN;FUT;IND;SG;V MASC;N;NOM;SG _
plane si filiam haberem , auriculas illi praeciderem .	planus si filia habeo , auricula ille praecido .	ADV CONJ ACC;FEM;N;SG 1;ACT;FIN;IPFV;PST;SBJV;SG;V _ ACC;FEM;N;PL DAT;FEM;PRO;SG 1;ACT;FIN;IPFV;PST;SBJV;SG;V _
at si laxaris , cum voles erit utilis .	at si laxo , cum volo sum utilis .	CONJ CONJ 2;ACT;FIN;FUT;IND;PFV;SG;V _ CONJ 2;ACT;FIN;FUT;IND;SG;V 3;ACT;FIN;FUT;IND;SG;V ADJ;MASC;NOM;SG _
non est illa vagis similis collata puellis :	non sum ille vagus similis confero puella :	ADV 3;ACT;FIN;IND;PRS;SG;V FEM;NOM;PRO;SG ADJ;DAT;FEM;PL ADJ;FEM;NOM;SG FEM;NOM;PASS;PFV;PST;SG;V;V.PTCP DAT;FEM;N;PL _
interim proelio equestri inter duas acies contendebatur .	interim proelium equester inter duo acies contendo .	ADV AT+ABL;N;NEUT;SG ADJ;AT+ABL;NEUT;SG ADP ACC;FEM;NUM;PL ACC;FEM;N;PL 3;FIN;IND;IPFV;PASS;PST;SG;V _
magna mihi copia est memorandi , patres conscripti , quae reges atque populi ira aut misericordia inpulsi male consuluerint .	magnus ego copia sum memoro , pater conscribo , qui rex atque populus ira aut misericordia inpello malus consulo .	ADJ;FEM;NOM;SG DAT;MASC;PRO;SG FEM;N;NOM;SG 3;ACT;FIN;IND;PRS;SG;V ACT;GEN;NEUT;PRS;SG;V;V.PTCP _ MASC;N;PL;VOC MASC;PASS;PFV;PL;PST;V;V.PTCP;VOC _ ACC;NEUT;PL;PRO MASC;N;NOM;PL CONJ MASC;N;NOM;PL AT+ABL;FEM;N;SG CONJ AT+ABL;FEM;N;SG MASC;NOM;PASS;PFV;PL;PST;V;V.PTCP ADV 3;ACT;FIN;PFV;PL;PST;SBJV;V _
nisi utile est quod facimus , stulta est gloria .	nisi utilis sum qui facio , stultus sum gloria .	CONJ ADJ;NEUT;NOM;SG 3;ACT;FIN;IND;PRS;SG;V ACC;NEUT;PRO;SG 1;ACT;FIN;IND;PL;PRS;V _ ADJ;FEM;NOM;SG 3;ACT;FIN;IND;PRS;SG;V FEM;N;NOM;SG _
recreatus hoc sermone reposui cubitum , habinnamque intrantem cumadmiratione ingenti spectabam .	recreo hic sermo repono cubitum , habinnas intro admiratio ingens specto .	MASC;NOM;PASS;PFV;PST;SG;V;V.PTCP AT+ABL;MASC;PRO;SG AT+ABL;MASC;N;SG 1;ACT;FIN;IND;PFV;PST;SG;V ACC;N;NEUT;SG _ ACC;MASC;N;SG ACC;ACT;MASC;PRS;SG;V;V.PTCP _ ADJ;AT+ABL;FEM;SG 1;ACT;FIN;IND;IPFV;PST;SG;V _
sequebatur puer cum tabula terebinthina et crystallinis tesseris , que notavi rem omnium delicatissimam .	sequor puer cum tabula terebinthinus et crystallinus tessera , que noto res omnis delicatus .	3;FIN;IND;IPFV;PASS;PST;SG;V MASC;N;NOM;SG ADP AT+ABL;FEM;N;SG ADJ;AT+ABL;FEM;SG CONJ ADJ;AT+ABL;FEM;PL AT+ABL;FEM;N;PL _ CONJ 1;ACT;FIN;IND;PFV;PST;SG;V ACC;FEM;N;SG ADJ;GEN;MASC;PL ACC;ADJ;FEM;RL;SG _
cum ille homo audacissimus conscientia convictus primo reticuisset , patefeci cetera :	cum ille homo audax conscientia convinco primo reticeo , patefacio ceterus :	CONJ MASC;NOM;PRO;SG MASC;N;NOM;SG ADJ;MASC;NOM;RL;SG AT+ABL;FEM;N;SG MASC;NOM;PASS;PFV;PST;SG;V;V.PTCP ADV 3;ACT;FIN;PST+PRF;SBJV;SG;V _ 1;ACT;FIN;IND;PFV;PST;SG;V ACC;ADJ;NEUT;PL _
uni si qua placet , culta puella sat est ;	unus si aliquis placeo , colo puella satis sum ;	DAT;MASC;NUM;SG CONJ FEM;NOM;PRO;SG 3;ACT;FIN;IND;PRS;SG;V _ FEM;NOM;PASS;PFV;PST;SG;V;V.PTCP FEM;N;NOM;SG ADV 3;ACT;FIN;IND;PRS;SG;V _
non impropero illi .	non impropero ille .	ADV 1;ACT;FIN;IND;PRS;SG;V DAT;MASC;PRO;SG _
tunc ego crediderim vobis et sidera et amnis posse cytaeines ducere carminibus .	tunc ego credo tu et sidus et amnis possum cytaeinis duco carmen .	ADV MASC;NOM;PRO;SG 1;ACT;FIN;PFV;PST;SBJV;SG;V DAT;FEM;PL;PRO CONJ ACC;N;NEUT;PL CONJ ACC;MASC;N;PL ACT;NFIN;PRS;V ACC;ADJ;MASC;PL ACT;NFIN;PRS;V AT+ABL;N;NEUT;PL _
te atque senatum obtestamur , consulatis miseris civibus , legis praesidium quod iniquitas praetoris eripuit restituatis , neve nobis eam neccessitudinem inponatis , ut quaeramus , quonam modo maxume ulti sanguinem nostrum pereamus . '	tu atque senatus obtestor , consulo miser civis , lex praesidium qui iniquitas praetor eripio restituo , neve nos is neccessitudino inpono , ut quaero , quonam modus magnus ulciscor sanguis nos pereo . '	ACC;MASC;PRO;SG CONJ ACC;MASC;N;SG 1;FIN;IND;PASS;PL;PRS;V _ 2;ACT;FIN;PL;PRS;SBJV;V ADJ;DAT;MASC;PL DAT;MASC;N;PL _ FEM;GEN;N;SG ACC;N;NEUT;SG ACC;NEUT;PRO;SG FEM;N;NOM;SG GEN;MASC;N;SG 3;ACT;FIN;IND;PFV;PST;SG;V 2;ACT;FIN;PL;PRS;SBJV;V _ ADV DAT;MASC;PL;PRO ACC;FEM;PRO;SG ACC;FEM;N;SG 2;ACT;FIN;PL;PRS;SBJV;V _ CONJ 1;ACT;FIN;PL;PRS;SBJV;V _ ADV AT+ABL;MASC;N;SG ADV MASC;NOM;PASS;PFV;PL;PST;V;V.PTCP ACC;MASC;N;SG GEN;MASC;PL;PRO 1;ACT;FIN;PL;PRS;SBJV;V _ _
sed fortunata vetat .	sed fortunata veto .	CONJ FEM;N;NOM;SG 3;ACT;FIN;IND;PRS;SG;V _
non insequor hostis :	non insequor hostis :	ADV 1;FIN;IND;PASS;PRS;SG;V MASC;N;NOM;SG _
et modo gaudebam lapsos formare capillos ;	et modo gaudeo labor formo capillus ;	CONJ ADV 1;ACT;FIN;IND;IPFV;PST;SG;V ACC;ACT;MASC;PFV;PL;PST;V;V.PTCP ACT;NFIN;PRS;V ACC;MASC;N;PL _
is consilio intercessit .	is consilium intercedo .	MASC;NOM;PRO;SG DAT;N;NEUT;SG 3;ACT;FIN;IND;PFV;PST;SG;V _
praedator intervenit partem postulans .	praedator intervenio pars postulo .	MASC;N;NOM;SG 3;ACT;FIN;IND;PFV;PST;SG;V ACC;FEM;N;SG MASC;NOM;PRS;SG;V;V.PTCP _
ipsa canas oro . '	ipse cano oro . '	FEM;NOM;PRO;SG 2;ACT;FIN;PRS;SBJV;SG;V 1;ACT;FIN;IND;PRS;SG;V _ _
sed mihi multa legenti , multa audienti , quae populus romanus domi que militiae , mari atque terra praeclara facinora fecit , forte lubuit attendere , quae res maxume tanta negotia sustinuisset .	sed ego multus lego , multus audio , quis populus romanus domus que militia , mare atque terra praeclarus facinus facio , fors libet attendo , qui res magnus tantus negotium sustineo .	CONJ DAT;MASC;PRO;SG ACC;ADJ;NEUT;PL ACT;DAT;MASC;PRS;SG;V;V.PTCP _ ACC;ADJ;NEUT;PL ACT;DAT;MASC;PRS;SG;V;V.PTCP _ ACC;NEUT;PL;PRO MASC;N;NOM;SG ADJ;MASC;NOM;SG ESS;FEM;N;SG CONJ ESS;FEM;N;SG _ AT+ABL;N;NEUT;SG CONJ AT+ABL;FEM;N;SG ACC;ADJ;NEUT;PL ACC;N;NEUT;PL 3;ACT;FIN;IND;PFV;PST;SG;V _ AT+ABL;FEM;N;SG 3;ACT;FIN;IND;PFV;PST;SG;V ACT;NFIN;PRS;V _ FEM;NOM;PRO;SG FEM;N;NOM;SG ADV ACC;ADJ;NEUT;PL ACC;N;NEUT;PL 3;ACT;FIN;PST+PRF;SBJV;SG;V _
at mehercules narrabit quod quis voluerit , oliva nobis propter fructum est gratior .	at hercules narro qui quis volo , oliva nos propter fructus sum gratus .	CONJ INTJ 3;ACT;FIN;FUT;IND;SG;V ACC;NEUT;PRO;SG MASC;NOM;PRO;SG 3;ACT;FIN;FUT;IND;PFV;SG;V _ FEM;N;NOM;SG DAT;FEM;PL;PRO ADP ACC;MASC;N;SG 3;ACT;FIN;IND;PRS;SG;V ADJ;CMPR;FEM;NOM;SG _
quae tametsi animus aspernabatur insolens malarum artium , tamen inter tanta vitia imbecilla aetas ambitione corrupta tenebatur ;	qui tametsi animus aspernor insoleo malus ars , tamen inter tantus vitium imbecillus aetas ambitio corrumpo teneo ;	ACC;NEUT;PL;PRO CONJ MASC;N;NOM;SG 3;FIN;IND;IPFV;PASS;PST;SG;V ACT;MASC;NOM;PRS;SG;V;V.PTCP ADJ;FEM;GEN;PL FEM;GEN;N;PL _ ADV ADP ACC;ADJ;NEUT;PL ACC;N;NEUT;PL ADJ;FEM;NOM;SG FEM;N;NOM;SG AT+ABL;FEM;N;SG FEM;NOM;PASS;PFV;PST;SG;V;V.PTCP 3;FIN;IND;IPFV;PASS;PST;SG;V _
quippe secundae res sapientium animos fatigant :	quippe secundus res sapiens animus fatigo :	ADV ADJ;FEM;NOM;PL FEM;N;NOM;PL GEN;MASC;N;PL ACC;MASC;N;PL 3;ACT;FIN;IND;PL;PRS;V _
loci natura erat haec , quem locum nostri castris delegerant .	locus natura sum hic , qui locus noster castrum deligo .	GEN;MASC;N;SG FEM;N;NOM;SG 3;ACT;FIN;IND;IPFV;PST;SG;V FEM;NOM;PRO;SG _ ACC;MASC;PRO;SG ACC;MASC;N;SG MASC;NOM;PL;PRO DAT;N;NEUT;PL 3;ACT;FIN;IND;PL;PST+PRF;V _
quibus rebus confectis omnia propere per nuntios consuli declarantur .	qui res conficio omnis properus per nuntius consul declaro .	AT+ABL;FEM;PL;PRO AT+ABL;FEM;N;PL AT+ABL;FEM;PASS;PFV;PL;PST;V;V.PTCP ADJ;NEUT;NOM;PL ADV ADP ACC;MASC;N;PL DAT;MASC;N;SG 3;FIN;IND;PASS;PL;PRS;V _
nonnulla etiam ex antiquis caerimonis paulatim abolita restituit , ut salutis augurium , diale flaminium , sacrum lupercale , ludos saeculares et compitalicios .	nonnullus etiam ex antiquus caerimonium paulatim aboleo restituo , ut salus augurium , dialis flaminius , sacer lupercal , ludus saecularis et compitalicius .	ACC;ADJ;NEUT;PL CONJ ADP ADJ;AT+ABL;NEUT;PL AT+ABL;N;NEUT;PL ADV ACC;NEUT;PASS;PFV;PL;PST;V;V.PTCP 3;ACT;FIN;IND;PFV;PST;SG;V _ CONJ FEM;GEN;N;SG ACC;N;NEUT;SG _ ACC;ADJ;NEUT;SG ACC;ADJ;NEUT;SG _ ACC;ADJ;NEUT;SG ACC;N;NEUT;SG _ ACC;MASC;N;PL ACC;ADJ;MASC;PL CONJ ACC;ADJ;MASC;PL _
quas ut vitemus versus subiecti monent .	qui ut vito versus subicio moneo .	ACC;FEM;PL;PRO CONJ 1;ACT;FIN;PL;PRS;SBJV;V MASC;N;NOM;PL MASC;NOM;PASS;PFV;PL;PST;V;V.PTCP 3;ACT;FIN;IND;PL;PRS;V _
aspice quos summittat humus formosa colores , ut veniant hederae sponte sua melius , surgat et in solis formosius arbutus antris , et sciat indocilis currere lympha vias .	aspicio qui summitto humus formosus color , ut venio hedera sponte suus bonus , surgo et in solus formosus arbutus antrum , et scio indocilis curro lympha via .	2;ACT;FIN;IMP;PRS;SG;V ACC;MASC;PL;PRO 3;ACT;FIN;PRS;SBJV;SG;V FEM;N;NOM;SG ADJ;FEM;NOM;SG ACC;MASC;N;PL _ ADV 3;ACT;FIN;PL;PRS;SBJV;V FEM;N;NOM;PL AT+ABL;FEM;N;SG AT+ABL;FEM;PRO;SG ADV;CMPR _ 3;ACT;FIN;PRS;SBJV;SG;V CONJ ADP ADJ;AT+ABL;NEUT;PL ADV;CMPR FEM;N;NOM;SG AT+ABL;N;NEUT;PL _ CONJ 3;ACT;FIN;PRS;SBJV;SG;V ACC;ADJ;FEM;PL ACT;NFIN;PRS;V FEM;N;NOM;SG ACC;FEM;N;PL _
uno mehercule catilina exhausto levata mihi et recreata res publica videtur .	unus hercules catilina exhaurio levo ego et recreo res publicus video .	AT+ABL;MASC;NUM;SG INTJ AT+ABL;MASC;N;SG AT+ABL;MASC;PASS;PFV;PST;SG;V;V.PTCP FEM;NOM;PASS;PFV;PST;SG;V;V.PTCP DAT;MASC;PRO;SG CONJ FEM;NOM;PASS;PFV;PST;SG;V;V.PTCP FEM;N;NOM;SG ADJ;FEM;NOM;SG 3;FIN;IND;PASS;PRS;SG;V _
vide ne dolone collum compungam tibi .	video ne dolo collum compungo tu .	2;ACT;FIN;IMP;PRS;SG;V CONJ AT+ABL;MASC;N;SG ACC;N;NEUT;SG 1;ACT;FIN;PRS;SBJV;SG;V DAT;FEM;PRO;SG _
sine dubio paulisper trepidavimus , ne contra praeceptum aliquis nostrum limen transiret .	sine dubius paulisper trepido, , ne contra praeceptum aliquis nos limen transeo .	ADP ADJ;AT+ABL;NEUT;SG ADV 1;ACT;FIN;IND;PFV;PL;PST;V _ CONJ ADP ACC;N;NEUT;SG MASC;NOM;PRO;SG GEN;MASC;PL;PRO ACC;N;NEUT;SG 3;ACT;FIN;IPFV;PST;SBJV;SG;V _
constiterat quocumque modo , spectabat ad io .	consto quicumque modus , specto ad io .	3;ACT;FIN;IND;PST+PRF;SG;V AT+ABL;MASC;PRO;SG AT+ABL;MASC;N;SG _ 3;ACT;FIN;IND;IPFV;PST;SG;V ADP ACC;FEM;N;SG _
 vos quoque , o cives , ait , hoc sustinete , maius ne veniat malum .	 tu quoque , o civis , aio , hic sustineo , magnus ne venio malus .	_ MASC;PL;PRO;VOC ADV _ INTJ MASC;N;PL;VOC _ 3;ACT;FIN;IND;PRS;SG;V _ NEUT;NOM;PRO;SG 2;ACT;FIN;IMP;PL;PRS;V _ ADJ;CMPR;NEUT;NOM;SG CONJ 3;ACT;FIN;PRS;SBJV;SG;V ADJ;NEUT;NOM;SG _
in prospectu habuimus ursinae frustum , de quo cum imprudens scintilla gustasset , paene intestina sua vomuit ;	in prospectus habeo ursina frustum , de quo cum imprudens scintilla gusto , paene intestinum suum vomo ;	ADP AT+ABL;MASC;N;SG 1;ACT;FIN;IND;PFV;PL;PST;V FEM;GEN;N;SG ACC;N;NEUT;SG _ ADV ADV ADP ADJ;FEM;NOM;SG FEM;N;NOM;SG 3;ACT;FIN;PST+PRF;SBJV;SG;V _ ADV ACC;N;NEUT;PL ACC;N;NEUT;PL 3;ACT;FIN;IND;PFV;PST;SG _
quid relevant variis serica textilibus ?	quis relevo varius sericum textilis ?	ACC;NEUT;PRO;SG 3;ACT;FIN;IND;PL;PRS;V ADJ;AT+ABL;NEUT;PL N;NEUT;NOM;PL ADJ;AT+ABL;NEUT;PL _
flebat et fortunata , flebat et habinnas , tota denique familia , tanquam in funus rogata , lamentatione triclinium implevit .	fleo et fortunata , fleo et habinnas , totus denique familia , tamquam in funus rogo , lamentatio triclinium impleo .	3;ACT;FIN;IND;IPFV;PST;SG;V ADV FEM;N;NOM;SG _ 3;ACT;FIN;IND;IPFV;PST;SG;V ADV FEM;N;NOM;SG _ ADJ;FEM;NOM;SG ADV FEM;N;NOM;SG _ ADV ADP ACC;N;NEUT;SG FEM;NOM;PASS;PFV;PST;SG;V;V.PTCP _ AT+ABL;FEM;N;SG ACC;N;NEUT;SG 3;ACT;FIN;IND;PFV;PST;SG;V _
que nova ut conspexit in unda cornua , pertimuit que se exsternata refugit .	que novus ut conspicio in unda cornu , pertimesco que sui exsterno refugio .	CONJ ACC;ADJ;NEUT;PL CONJ 3;ACT;FIN;IND;PFV;PST;SG;V ADP AT+ABL;FEM;N;SG ACC;N;NEUT;PL _ 3;ACT;FIN;IND;PFV;PST;SG;V CONJ ACC;FEM;PRO;SG FEM;NOM;PASS;PFV;PST;SG;V;V.PTCP 3;ACT;FIN;IND;PFV;PST;SG;V _
ecquid attendis , ecquid animadvertis horum silentium ?	ecquis attendo , ecquis animadverto hic silentium ?	ADV 2;ACT;FIN;IND;PRS;SG;V _ ADV 2;ACT;FIN;IND;PRS;SG;V GEN;MASC;PL;PRO ACC;N;NEUT;SG _
dicere quo pereas saepe in amore levat .	dico quo pereo saepe in amor levo .	ACT;NFIN;PRS;V ADV 2;ACT;FIN;PRS;SBJV;SG;V ADV ADP AT+ABL;MASC;N;SG 3;ACT;FIN;IND;PRS;SG;V _
non enim iam inter latera nostra sica illa versabitur , non in campo , non in foro , non in curia , non denique intra domesticos parietes pertimescemus .	non enim jam inter latus noster sica ille verso , non in campus , non in forum , non in curia , non denique intra domesticus paries pertimesco .	ADV CONJ ADV ADP ACC;N;NEUT;PL ACC;NEUT;PL;PRO FEM;N;NOM;SG FEM;NOM;PRO;SG 3;FIN;FUT;IND;PASS;SG;V _ ADV ADP AT+ABL;MASC;N;SG _ ADV ADP AT+ABL;N;NEUT;SG _ ADV ADP AT+ABL;FEM;N;SG _ ADV ADV ADP ACC;ADJ;MASC;PL ACC;MASC;N;PL 1;ACT;FIN;FUT;IND;PL;V _
postquam dies comitiorum venit et catilinae que ne petitio que ne insidiae quas consulibus in campo fecerat prospere cessere , constituit bellum facere et extrema omnia experiri , quoniam quae occulte temptaverat aspera que foeda evenerant .	postquam dies comitium venio et catilina que ne petitio que ne insidiae qui consul in campus facio prosperus cedo , constituo bellum facio et extremus omnia experior , quoniam qui occulte tento asperum que foedus evenio .	CONJ FEM;N;NOM;SG GEN;N;NEUT;PL 3;ACT;FIN;IND;PRS;SG;V CONJ GEN;MASC;N;SG CONJ ADV FEM;N;NOM;SG CONJ ADV FEM;N;NOM;PL ACC;FEM;PL;PRO DAT;MASC;N;PL ADP AT+ABL;MASC;N;SG 3;ACT;FIN;IND;PST+PRF;SG;V ADV 3;ACT;FIN;IND;PFV;PL;PST;V _ 3;ACT;FIN;IND;PRS;SG;V ACC;N;NEUT;SG ACT;NFIN;PRS;V CONJ ACC;ADJ;NEUT;PL ACC;N;NEUT;PL NFIN;PASS;PRS;V _ CONJ ACC;NEUT;PL;PRO ADV 3;ACT;FIN;IND;PST+PRF;SG;V ACC;N;NEUT;PL CONJ ACC;N;NEUT;PL 3;ACT;FIN;IND;PL;PST+PRF;V _
quibus lavari iam coeperat votum esse ?	qui lavo jam coepio votum sum ?	DAT;MASC;PL;PRO NFIN;PASS;PRS;V ADV 3;ACT;FIN;IND;PST+PRF;SG;V N;NEUT;NOM;SG ACT;NFIN;PRS;V _
hypsipyle nullos post illos sensit amores , ut semel haemonio tabuit hospitio .	hypsipyle nullus post ille sentio amor , ut semel haemonius tabesco hospitium .	FEM;N;NOM;SG ACC;ADJ;MASC;PL ADP ACC;MASC;PL;PRO 3;ACT;FIN;IND;PFV;PST;SG;V ACC;MASC;N;PL _ ADV ADV ADJ;AT+ABL;NEUT;SG 3;ACT;FIN;IND;PFV;PST;SG;V AT+ABL;N;NEUT;SG _
et audivi angelum aquarum dicentem :	et audio angelus aqua dico :	CONJ 1;ACT;FIN;IND;PFV;PST;SG;V ACC;MASC;N;SG FEM;GEN;N;PL ACC;ACT;MASC;PRS;SG;V;V.PTCP _
rem me professum dicet fors aliquis gravem .	res ego profiteor dico fors aliquis gravis .	ACC;FEM;N;SG ACC;MASC;PRO;SG ACC;ACT;MASC;PFV;PST;SG;V;V.PTCP 3;ACT;FIN;FUT;IND;SG;V ADV;FEM;NOM;SG MASC;NOM;PRO;SG ACC;ADJ;FEM;SG _
vos timere absistite ;	tu timeo absisto ;	MASC;NOM;PL;PRO ACT;NFIN;PRS;V 2;ACT;FIN;IMP;PL;PRS;V _
quarum nulla tua fuerit mihi , cynthia , forma gratior , et ( tellus hoc ita iusta sinat ) quamvis te longae remorentur fata senectae , cara tamen lacrimis ossa futura meis .	qui nullus tuus sum ego , cynthia , forma gratus , et ( tellus hic ita justus sino ) quamvis tu longus remoror fatum senecta , carus tamen lacrima os sum meus .	FEM;GEN;PL;PRO ADJ;FEM;NOM;SG AT+ABL;FEM;PRO;SG 3;ACT;FIN;PFV;PST;SBJV;SG;V DAT;MASC;PRO;SG _ FEM;N;SG;VOC _ AT+ABL;FEM;N;SG ADJ;CMPR;FEM;NOM;SG _ CONJ _ FEM;N;NOM;SG ACC;NEUT;PRO;SG ADV ADJ;FEM;NOM;SG 3;ACT;FIN;PRS;SBJV;SG;V _ ADV ACC;FEM;PRO;SG ADJ;FEM;GEN;SG 3;FIN;PASS;PL;PRS;SBJV;V N;NEUT;NOM;PL FEM;N;NOM;PL _ ADJ;NEUT;NOM;PL ADV DAT;FEM;N;PL N;NEUT;NOM;PL ACT;FUT;NEUT;NOM;PL;V;V.PTCP DAT;FEM;PL;PRO _
et videbunt faciem eius et nomen eius in frontibus eorum .	et video facies is et nomen is in frons is .	CONJ 3;ACT;FIN;FUT;IND;PL;V ACC;FEM;N;SG GEN;MASC;PRO;SG CONJ ACC;N;NEUT;SG GEN;MASC;PRO;SG ADP AT+ABL;FEM;N;PL GEN;MASC;PL;PRO _
si vixerit , habebis ad latus servulum .	si vivo , habeo ad latus servulus .	CONJ 3;ACT;FIN;FUT;IND;PFV;SG;V _ 2;ACT;FIN;FUT;IND;SG;V ADP ACC;N;NEUT;SG ACC;MASC;N;SG _
eorum ego vitam que mortem iuxta aestumo , quoniam de utraque siletur .	is ego vita que mors juxta aestimo , quoniam de uterque sileo .	GEN;MASC;PL;PRO MASC;NOM;PRO;SG ACC;FEM;N;SG CONJ ACC;FEM;N;SG ADV 1;ACT;FIN;IND;PRS;SG;V _ ADV ADP ADJ;AT+ABL;FEM;SG 3;FIN;IND;PASS;PRS;SG;V _
nunc mihi , qua totum nereus circumsonat orbem , perdendum est mortale genus :	nunc ego , qua totus nereus circumsono orbis , perdo sum mortalis genus :	ADV DAT;MASC;PRO;SG _ ADV ACC;ADJ;MASC;SG MASC;N;NOM;SG 3;ACT;FIN;IND;PRS;SG;V ACC;MASC;N;SG _ NEUT;NOM;PASS;PRS;SG;V;V.CVB 3;ACT;FIN;IND;PRS;SG;V ADJ;NEUT;NOM;SG N;NEUT;NOM;SG _
ipse equo circumiens unum quemque nominans appellat , hortatur , rogat , ut meminerint se contra latrones inermis pro patria , pro liberis , pro aris atque focis suis certare .	ipse equus circumeo unus quisque nomino appello , hortor , rogo , ut memini sui contra latro inermis pro patria , pro liberi , pro ara atque focus suus certo .	MASC;NOM;PRO;SG AT+ABL;MASC;N;SG ACT;MASC;NOM;PRS;V;V.PTCP ACC;ADJ;MASC;SG ACC;MASC;PRO;SG ACT;MASC;NOM;PRS;SG;V;V.PTCP 3;ACT;FIN;IND;PRS;SG;V _ 3;FIN;IND;PASS;PRS;SG;V _ 3;ACT;FIN;IND;PRS;SG;V _ CONJ 3;ACT;FIN;PFV;PL;PST;SBJV;V ACC;MASC;PL;PRO ADP ACC;MASC;N;PL ACC;ADJ;MASC;PL ADP AT+ABL;FEM;N;SG _ ADP AT+ABL;MASC;N;PL _ ADP AT+ABL;FEM;N;PL CONJ AT+ABL;MASC;N;PL ADJ;AT+ABL;MASC;PL ACT;NFIN;PRS;V _
me quaeso teste negare potes ?	ego quaeso testis nego possum ?	AT+ABL;MASC;PRO;SG 1;ACT;FIN;IND;PRS;SG;V AT+ABL;MASC;N;SG ACT;NFIN;PRS;V 2;ACT;FIN;IND;PRS;SG;V _
quo audacius aggredimini memores pristinae virtutis .	quo audax aggredior memor pristinus virtus .	ADV ADV 2;FIN;IMP;PASS;PL;PRS;V ADJ;MASC;NOM;PL ADJ;FEM;GEN;SG FEM;GEN;N;SG _
ego puto medicum et nummularium :	ego puto medicus et nummularius :	MASC;NOM;PRO;SG 1;ACT;FIN;IND;PRS;SG;V ACC;MASC;N;SG CONJ ACC;MASC;N;SG _
petauristarii autem tandem venerunt .	petauristarius autem tandem venio .	MASC;N;NOM;PL CONJ ADV 3;ACT;FIN;IND;PFV;PL;PST;V _
et stygias iubet hoc audire paludes .	et stygius jubeo hic audio palus .	CONJ ACC;ADJ;FEM;PL 3;ACT;FIN;IND;PRS;SG;V ACC;NEUT;PRO;SG ACT;NFIN;PRS;V ACC;FEM;N;PL _
at aliae leges item condemnatis civibus non animam eripi , sed exilium permitti iubent .	at alius lex item condemno civis non anima eripio , sed exsilium permitto jubeo .	CONJ ADJ;FEM;NOM;PL FEM;N;NOM;PL ADV AT+ABL;MASC;PASS;PFV;PL;PST;V;V.PTCP AT+ABL;MASC;N;PL ADV ACC;FEM;N;SG NFIN;PASS;PRS;V _ CONJ N;NEUT;NOM;SG NFIN;PASS;PRS;V 3;ACT;FIN;IND;PL;PRS;V _
heu nullo limine carus eris .	heu! nullus limen carus sum .	INTJ ADJ;AT+ABL;NEUT;SG AT+ABL;N;NEUT;SG ADJ;MASC;NOM;SG 2;ACT;FIN;FUT;IND;SG;V _
quibus unda pepercit , illos longa domant inopi ieiunia victu .	qui unda parco , ille longus domo inops jejunium victus .	DAT;MASC;PL;PRO FEM;N;NOM;SG 3;ACT;FIN;IND;PFV;PST;SG;V _ ACC;MASC;PL;PRO ADJ;NEUT;NOM;PL 3;ACT;FIN;IND;PL;PRS;V ADJ;AT+ABL;MASC;SG N;NEUT;NOM;PL AT+ABL;MASC;N;SG _
prorsus multae facetiae que multus lepos inerat .	prorsus multus facetia que multus lepos insum .	ADV ADJ;FEM;NOM;PL FEM;N;NOM;PL CONJ ADJ;MASC;NOM;SG MASC;N;NOM;SG 3;ACT;FIN;IND;IPFV;PST;SG;V _
carmina mansuetus lenia quaerit amor .	carmen mansuetus lenis quaero amor .	ACC;N;NEUT;PL ADJ;MASC;NOM;SG ACC;ADJ;NEUT;PL 3;ACT;FIN;IND;PRS;SG;V MASC;N;NOM;SG _
annos undeviginti natus exercitum privato consilio et privata impensa comparavi , per quem rem publicam a dominatione factionis oppressam in libertatem vindicavi .	annus undevigniti nascor exercitus privo consilium et privo impensa comparo , per qui res publicus ab dominatio factio opprimo in libertas vindico .	ACC;MASC;N;PL NUM ACT;MASC;NOM;PFV;PST;SG;V;V.PTCP ACC;MASC;N;SG AT+ABL;NEUT;PASS;PFV;PST;SG;V;V.PTCP AT+ABL;N;NEUT;SG CONJ AT+ABL;FEM;PASS;PFV;PST;SG;V;V.PTCP AT+ABL;FEM;N;SG 1;ACT;FIN;IND;PFV;PST;SG;V _ ADP ACC;MASC;N;SG ACC;FEM;N;SG ACC;ADJ;FEM;SG ADP AT+ABL;FEM;N;SG FEM;GEN;N;SG ACC;FEM;PASS;PFV;PST;SG;V;V.PTCP ADP ACC;FEM;N;SG 1;ACT;FIN;IND;PFV;PST;SG;V _
exonerata ille vesica aquam poposcit ad manus , que digitos paululum adspersos in capite pueri tersit .	exonero ille vesica aqua posco ad manus , que digitus paululum aspergo, in caput puer tergeo, .	AT+ABL;FEM;PASS;PFV;PST;SG;V;V.PTCP MASC;NOM;PRO;SG AT+ABL;FEM;N;SG ACC;FEM;N;SG 3;ACT;FIN;IND;PFV;PST;SG;V ADP ACC;FEM;N;PL _ CONJ ACC;MASC;N;PL ADV ACC;MASC;PASS;PFV;PL;PST;V;V.PTCP ADP AT+ABL;N;NEUT;SG GEN;MASC;N;SG 3;ACT;FIN;IND;PFV;PST;SG;V _
quod si in vino et alea comissationes solum et scorta quaererent , essent illi quidem desperandi , sed tamen essent ferendi :	quod si in vinum et alea comissatio solus et scortum quaero , sum ille quidem despero , sed tamen sum fero :	CONJ CONJ ADP AT+ABL;N;NEUT;SG CONJ AT+ABL;FEM;N;SG ACC;FEM;N;PL ADV CONJ ACC;N;NEUT;PL 3;ACT;FIN;IPFV;PL;PST;SBJV;V _ 3;ACT;FIN;IPFV;PL;PST;SBJV;V MASC;NOM;PL;PRO ADV MASC;NOM;PL;V;V.CVB _ CONJ ADV 3;ACT;FIN;IPFV;PL;PST;SBJV;V MASC;NOM;PL;V;V.CVB _
idem facit hostium exercitus .	idem facio hostis exercitus .	ACC;NEUT;PRO;SG 3;ACT;FIN;IND;PRS;SG;V GEN;MASC;N;PL MASC;N;NOM;SG _
