rivos aquarum compluribus locis vetustate labentes refeci , et aquam quae marcia appellatur duplicavi fonte novo in rivum eius inmisso .	rivus aqua complura locus vetustas labor reficio , et aqua qui marcius appello duplico fons novus in rivus is in-mitto .	ACC;MASC;N;PL FEM;GEN;N;PL AT+ABL;N;NEUT;PL AT+ABL;N;NEUT;PL AT+ABL;FEM;N;SG ACC;MASC;PL;PRS;V;V.PTCP 1;ACT;FIN;IND;PFV;PST;SG;V _ CONJ ACC;FEM;N;SG FEM;N;NOM;SG ADJ;FEM;NOM;SG 3;FIN;IND;PASS;PRS;SG;V 1;ACT;FIN;IND;PFV;PST;SG;V AT+ABL;MASC;N;SG ADJ;AT+ABL;MASC;SG ADP ACC;MASC;N;SG FEM;GEN;PRO;SG AT+ABL;MASC;PASS;PFV;PST;SG;V;V.PTCP _
sed iuventutem , quam , ut supra diximus , illexerat , multis modis mala facinora edocebat .	sed juventus , qui , ut supra dico , illicio , multus modus malus facinus edoceo .	CONJ ACC;FEM;N;SG _ ACC;FEM;PRO;SG _ CONJ ADV 1;ACT;FIN;IND;PFV;PL;PST;V _ 3;ACT;FIN;IND;PST+PRF;SG;V _ ADJ;AT+ABL;MASC;PL AT+ABL;MASC;N;PL ACC;ADJ;NEUT;PL ACC;N;NEUT;PL 3;ACT;FIN;IND;IPFV;PST;SG;V _
non illo tempore cuiquam contigit ut simili posset amare fide .	non ille tempus quisquam contingo ut similis possum amo fides .	ADV AT+ABL;NEUT;PRO;SG AT+ABL;N;NEUT;SG DAT;MASC;PRO;SG 3;ACT;FIN;IND;PFV;PST;SG;V ADV ADJ;AT+ABL;FEM;SG 3;ACT;FIN;IPFV;PST;SBJV;SG;V ACT;NFIN;PRS;V AT+ABL;FEM;N;SG _
per eas se catilina credebat posse servitia urbana sollicitare , urbem incendere , viros earum vel adiungere sibi vel interficere .	per is sui catilina credo possum servitium urbanus sollicito , urbs incendo , vir is vel adjungo sui vel interficio .	ADP ACC;FEM;PL;PRO ACC;MASC;PRO;SG MASC;N;NOM;SG 3;ACT;FIN;IND;IPFV;PST;SG;V ACT;NFIN;PRS;V ACC;N;NEUT;PL ACC;ADJ;NEUT;PL ACT;NFIN;PRS;V _ ACC;FEM;N;SG ACT;NFIN;PRS;V _ ACC;MASC;N;PL FEM;GEN;PL;PRO CONJ ACT;NFIN;PRS;V DAT;MASC;PRO;SG CONJ ACT;NFIN;PRS;V _
quale inquit caput est , talis praestatur sapor .	qualis inquam caput sum , talis praesto sapor .	ADJ;NEUT;NOM;SG 3;ACT;FIN;IND;PFV;PST;SG;V N;NEUT;NOM;SG 3;ACT;FIN;IND;PRS;SG;V _ ADJ;MASC;NOM;SG 3;FIN;IND;PASS;PRS;SG;V MASC;N;NOM;SG _
apud maiores nostros a . manlius torquatus bello gallico filium suom , quod is contra imperium in hostem pugnaverat , necari iussit , atque ille egregius adulescens inmoderatae fortitudinis morte poenas dedit ;	apud majores noster aulus . manlius torquatus bellum gallicus filius suus , quod is contra imperium in hostis pugno , neco jubeo , atque ille egregius adulescens immoderatus fortitudo mors poena do ;	ADP ACC;MASC;N;PL ACC;ADJ;MASC;PL _ _ ADJ;MASC;NOM;SG MASC;N;NOM;SG AT+ABL;N;NEUT;SG ADJ;AT+ABL;NEUT;SG ACC;MASC;N;SG ACC;ADJ;MASC;SG _ CONJ MASC;NOM;PRO;SG ADP ACC;N;NEUT;SG ADP ACC;FEM;N;SG 3;ACT;FIN;IND;PST+PRF;SG;V _ NFIN;PASS;PRS;V 3;ACT;FIN;IND;PFV;PST;SG;V _ CONJ MASC;NOM;PRO;SG ADJ;MASC;NOM;SG MASC;N;NOM;SG ADJ;FEM;GEN;SG FEM;GEN;N;SG AT+ABL;FEM;N;SG ACC;FEM;N;PL 3;ACT;FIN;IND;PFV;PST;SG;V _
et vidi in dextera sedentis super thronum librum scriptum intus et foris signatum sigillis septem .	et video in dextera sedeo super thronus liber scribo intus et foris signo sigillum septem .	CONJ 1;ACT;FIN;IND;PFV;PST;SG;V ADP AT+ABL;FEM;N;SG ACT;GEN;MASC;PRS;SG;V;V.PTCP ADP ACC;MASC;N;SG ACC;MASC;N;SG ACC;MASC;PASS;PFV;PST;SG;V;V.PTCP ADV CONJ ADV ACC;MASC;PASS;PFV;PST;SG;V;V.PTCP AT+ABL;N;NEUT;PL NUM _
et qui loquebatur mecum habebat mensuram harundinem auream ut metiretur civitatem et portas eius et murum .	et qui loquor ego habeo mensura harundo aureus ut metior civitas et porta is et murus .	CONJ MASC;NOM;PRO;SG 3;FIN;IND;IPFV;PASS;PST;SG;V AT+ABL;MASC;PRO;SG 3;ACT;FIN;IND;IPFV;PST;SG;V ACC;FEM;N;SG ACC;FEM;N;SG ACC;ADJ;FEM;SG CONJ 3;FIN;IPFV;PASS;PST;SBJV;SG;V ACC;FEM;N;SG CONJ ACC;FEM;N;PL FEM;GEN;PRO;SG CONJ ACC;MASC;N;SG _
novissime succumbit .	novus succumbo .	ADV;RL 3;ACT;FIN;IND;PRS;SG;V _
legibus novis me auctore latis multa exempla maiorum exolescentia iam ex nostro saeculo reduxi et ipse multarum rerum exempla imitanda posteris tradidi .	lex novus ego auctor fero multus exemplum magnus exolesco jam ex noster saeculum reduco et ipse multus res exemplum imito posterus trado .	AT+ABL;FEM;N;PL ADJ;AT+ABL;FEM;PL AT+ABL;MASC;PRO;SG AT+ABL;MASC;N;SG AT+ABL;FEM;PASS;PFV;PL;PST;V;V.PTCP ACC;ADJ;NEUT;PL ACC;N;NEUT;PL ADJ;CMPR;GEN;MASC;PL ACC;NEUT;PL;PRS;V;V.PTCP ADV ADP ADJ;AT+ABL;NEUT;SG AT+ABL;N;NEUT;SG 1;ACT;FIN;IND;PFV;PST;SG;V CONJ MASC;NOM;PRO;SG ADJ;FEM;GEN;PL FEM;GEN;N;PL ACC;N;NEUT;PL ACC;NEUT;PL;V;V.CVB ADJ;DAT;MASC;PL 1;ACT;FIN;IND;PFV;PST;SG;V _
solent mendaces luere poenas malefici .	soleo mendax luo poena maleficium .	3;ACT;FIN;IND;PL;PRS;V ADJ;MASC;NOM;PL ACT;NFIN;PRS;V ACC;FEM;N;PL GEN;N;NEUT;SG _
cum eo se consulem initium agundi facturum .	cum is sui consul initium ago facio .	ADP AT+ABL;MASC;PRO;SG ACC;MASC;PRO;SG ACC;MASC;N;SG ACC;N;NEUT;SG ACT;GEN;NEUT;PRS;SG;V;V.PTCP ACC;ACT;FUT;MASC;SG;V;V.PTCP _
haec ut dixit trimalchio , flere coepit ubertim .	hic ut dico trimalchio , fleo coepio ubertim .	ACC;NEUT;PL;PRO CONJ 3;ACT;FIN;IND;PFV;PST;SG;V MASC;N;NOM;SG _ ACT;NFIN;PRS;V 3;ACT;FIN;IND;PFV;PST;SG;V ADV _
o canis , merito iaces , qui concupisti subito regales opes , trivio conceptus , educatus stercore .	o canis , mereo jaceo , qui concupio subeo regalis ops , trivium concipio , educo stercus .	INTJ MASC;N;SG;VOC _ ADV 2;ACT;FIN;IND;PRS;SG;V _ MASC;NOM;PRO;SG 2;ACT;FIN;IND;PFV;PST;SG;V ADV ACC;ADJ;FEM;PL ACC;FEM;N;PL _ AT+ABL;N;NEUT;SG MASC;NOM;PASS;PFV;PST;SG;V;V.PTCP _ MASC;NOM;PASS;PFV;PST;SG;V;V.PTCP AT+ABL;N;NEUT;SG _
agnoscit hominem caesar rem que intellegit .	agnosco homo caesar res que intellego .	3;ACT;FIN;IND;PRS;SG;V ACC;MASC;N;SG MASC;N;NOM;SG ACC;FEM;N;SG CONJ 3;ACT;FIN;IND;PRS;SG;V _
virtutis expers , verbis iactans gloriam , ignotos fallit , notis est derisui .	virtus expers , verbum jacto gloria , ignotus fallo , nosco sum derisus .	FEM;GEN;N;SG ADJ;MASC;NOM;SG _ AT+ABL;N;NEUT;PL MASC;NOM;PRS;SG;V;V.PTCP ACC;FEM;N;SG _ ACC;ADJ;MASC;PL 3;ACT;FIN;IND;PRS;SG;V _ DAT;MASC;PASS;PFV;PL;PST;V;V.PTCP 3;ACT;FIN;IND;PRS;SG;V DAT;MASC;N;SG _
alioquin experieris cerebrum meum .	alioqui experior cerebrum meus .	ADV 2;FIN;FUT;IND;PASS;SG;V ACC;N;NEUT;SG ACC;ADJ;NEUT;SG _
et unus de senioribus dicit mihi :	et unus de senex dico ego :	CONJ ADJ;MASC;NOM;SG ADP AT+ABL;N;PL 3;ACT;FIN;IND;PRS;SG;V DAT;MASC;PRO;SG _
tu cave ne tristi cupias pugnare puellae , neve superba loqui , neve tacere diu ;	tu caveo ne tristis cupio pugno puella , neve superbus loquor , neve taceo diu ;	MASC;NOM;PRO;SG 2;ACT;FIN;IMP;PRS;SG;V ADV ADJ;DAT;FEM;SG 2;ACT;FIN;PRS;SBJV;SG;V ACT;NFIN;PRS;V DAT;FEM;N;SG _ CONJ ACC;ADJ;NEUT;PL ACT;NFIN;PRS;V _ CONJ ACT;NFIN;PRS;V ADV _
sub tiberio et gaio et claudio unius familiae quasi hereditas fuimus :	sub tiberius et gaius et claudius unus familia quasi hereditas sum :	ADP AT+ABL;MASC;N;SG CONJ AT+ABL;MASC;N;SG CONJ AT+ABL;MASC;N;SG FEM;GEN;NUM;SG FEM;GEN;N;SG ADV FEM;N;NOM;SG 1;ACT;FIN;IND;PFV;PL;PST;V _
c ne contentus eo est :	que ne contineo is sum :	CONJ ADV MASC;NOM;PASS;PFV;PST;SG;V;V.PTCP AT+ABL;NEUT;PRO;SG 3;ACT;FIN;IND;PRS;SG;V _
thurinum cognominatum satis certa probatione tradiderim nactus puerilem imagunculam eius aeream ueterem ferreis et paene iam exolescentibus litteris hoc nomine inscriptam , quae dono a me principi data inter cubiculi lares colitur .	thurii cognomino satis certus probatio trado nanciscor puerilis imaguncula is aereus vetus ferreus et paene jam exolesco littera hic nomen inscribo , qui donum ab ego princeps do inter cubiculum lares colo .	ACC;ADJ;MASC;SG ACC;MASC;PASS;PFV;PST;SG;V;V.PTCP ADV ADJ;AT+ABL;FEM;SG AT+ABL;FEM;N;SG 1;ACT;FIN;PFV;PST;SBJV;SG;V ACT;MASC;NOM;PFV;PST;SG;V;V.PTCP ACC;ADJ;FEM;SG ACC;FEM;N;SG GEN;MASC;PRO;SG ACC;ADJ;FEM;SG ACC;ADJ;FEM;SG ADJ;AT+ABL;FEM;PL CONJ ADV ADV AT+ABL;FEM;PL;PRS;V;V.PTCP AT+ABL;FEM;N;PL AT+ABL;NEUT;PRO;SG AT+ABL;N;NEUT;SG ACC;FEM;PASS;PFV;PST;SG;V;V.PTCP _ FEM;NOM;PRO;SG DAT;N;NEUT;SG ADP AT+ABL;MASC;PRO;SG DAT;MASC;N;SG FEM;NOM;PASS;PFV;PST;SG;V;V.PTCP ADP GEN;N;NEUT;SG ACC;MASC;N;PL 3;FIN;IND;PASS;PRS;SG;V _
et conversus vidi septem candelabra aurea .	et converto video septem candelabrum aureus .	CONJ MASC;NOM;PASS;PFV;PST;SG;V;V.PTCP 1;ACT;FIN;IND;PFV;PST;SG;V NUM ACC;N;NEUT;PL ACC;ADJ;NEUT;PL _
ambiguum , clymene , precibus phaethontis an ira mota magis dicti sibi criminis utraque caelo bracchia porrexit que spectans ad lumina solis ' per iubar hoc ' inquit ' radiis insigne coruscis , nate , tibi iuro , quod nos que audit que videt , hoc te , quem spectas , hoc te , qui temperat orbem , sole satum .	ambiguus , clymene , prex phaethon an ira moveo magis dictum sui crimen uter caelum bracchium porrigo que specto ad lumen sol ' per iubar hic ' inquam ' radius insignis coruscus , natus , tu juro , qui nos que audio que video , hic tu , quis specto , hic tu , qui tempero orbis , sol sero .	ADJ;NEUT;NOM;SG _ FEM;N;NOM;SG _ AT+ABL;FEM;N;PL GEN;MASC;N;SG CONJ AT+ABL;FEM;N;SG FEM;NOM;PASS;PFV;PST;SG;V;V.PTCP ADV GEN;N;NEUT;SG DAT;MASC;PL;PRO GEN;N;NEUT;SG ACC;ADJ;NEUT;PL DAT;N;NEUT;SG ACC;N;NEUT;PL 3;ACT;FIN;IND;PFV;PST;SG;V CONJ ACT;FEM;NOM;PRS;SG;V;V.PTCP ADP ACC;N;NEUT;PL GEN;MASC;N;SG _ ADP ACC;N;NEUT;SG ACC;NEUT;PRO;SG _ 3;ACT;FIN;IND;PRS;SG;V _ AT+ABL;MASC;N;PL ACC;ADJ;NEUT;SG ADJ;AT+ABL;MASC;PL _ MASC;N;SG;VOC _ DAT;MASC;PRO;SG 1;ACT;FIN;IND;PRS;SG;V _ NEUT;NOM;PRO;SG ACC;MASC;PL;PRO CONJ 3;ACT;FIN;IND;PRS;SG;V CONJ 3;ACT;FIN;IND;PRS;SG;V _ AT+ABL;MASC;PRO;SG ACC;MASC;PRO;SG _ ACC;MASC;PRO;SG 2;ACT;FIN;IND;PRS;SG;V _ AT+ABL;MASC;PRO;SG ACC;MASC;PRO;SG _ MASC;NOM;PRO;SG 3;ACT;FIN;IND;PRS;SG;V ACC;MASC;N;SG _ AT+ABL;MASC;N;SG ACC;MASC;PASS;PFV;PST;SG;V;V.PTCP _
ego etiam si causas non ago , in domusionem tamen litteras didici .	ego etiam si causa non ago , in domusio tamen littera disco .	MASC;NOM;PRO;SG ADV CONJ ACC;FEM;N;PL ADV 1;ACT;FIN;IND;PRS;SG;V _ ADP ACC;FEM;N;SG ADV ACC;FEM;N;PL 1;ACT;FIN;IND;PFV;PST;SG;V _
quae modo decerpens tenero pueriliter ungui proposito florem praetulit officio , et modo formosis incumbens nescius undis errorem blandis tardat imaginibus .	qui modo decerpo tener puerilis unguis propono flos praefero officium , et modo formosus incumbo nescius unda error blandus tardo imago .	ACC;NEUT;PL;PRO ADV ACT;MASC;NOM;PRS;SG;V;V.PTCP ADJ;AT+ABL;MASC;SG ADV AT+ABL;MASC;N;SG DAT;NEUT;PASS;PFV;PST;SG;V;V.PTCP ACC;MASC;N;SG 3;ACT;FIN;IND;PFV;PST;SG;V DAT;N;NEUT;SG _ CONJ ADV ADJ;AT+ABL;FEM;PL ACT;MASC;NOM;PRS;SG;V;V.PTCP ADJ;MASC;NOM;SG AT+ABL;FEM;N;PL ACC;MASC;N;SG ADJ;AT+ABL;FEM;PL 3;ACT;FIN;IND;PRS;SG;V AT+ABL;FEM;N;PL _
quanto vos attentius ea agetis , tanto illis animus infirmior erit ;	quanto tu attendo is ago , tanto ille animus infirmus sum ;	ADV MASC;NOM;PL;PRO ADV ACC;NEUT;PL;PRO 2;ACT;FIN;FUT;IND;PL;V _ ADV DAT;MASC;PL;PRO MASC;N;NOM;SG ADJ;CMPR;MASC;NOM;SG 3;ACT;FIN;FUT;IND;SG;V _
c ne intra rixam tumultus constitit , sed candelabrum etiam super mensam eversum et vasa omnia crystallina comminuit et oleo ferventi aliquot convivas respersit .	que ne intra rixa tumultus consto , sed candelabrum etiam super mensa everto et vasum omnis crystallinum comminuo et oleum ferveo aliquot conviva respergo .	CONJ CONJ ADP ACC;FEM;N;SG MASC;N;NOM;SG 3;ACT;FIN;IND;PFV;PST;SG;V _ CONJ N;NEUT;NOM;SG ADV ADP ACC;FEM;N;SG NEUT;NOM;PASS;PFV;PST;SG;V;V.PTCP CONJ ACC;N;NEUT;PL ACC;N;NEUT;PL ACC;N;NEUT;PL 3;ACT;FIN;IND;PFV;PST;SG;V CONJ AT+ABL;N;NEUT;SG ACT;AT+ABL;NEUT;PRS;SG;V;V.PTCP PRO ACC;FEM;N;PL 3;ACT;FIN;IND;PFV;PST;SG;V _
fit lupus et veteris servat vestigia formae .	fio lupus et vetus servo vestigium forma .	3;ACT;FIN;IND;PRS;SG;V MASC;N;NOM;SG CONJ ADJ;FEM;GEN;SG 3;ACT;FIN;IND;PRS;SG;V ACC;N;NEUT;PL FEM;GEN;N;SG _
nam id facinus in primis ego memorabile existumo sceleris atque periculi novitate .	nam is facinus in prima ego memorabilis existimo scelus atque periculum novitas .	CONJ ACC;NEUT;PRO;SG ACC;N;NEUT;SG ADP AT+ABL;N;NEUT;PL MASC;NOM;PRO;SG ACC;ADJ;NEUT;SG 1;ACT;FIN;IND;PRS;SG;V GEN;N;NEUT;SG CONJ GEN;N;NEUT;SG AT+ABL;FEM;N;SG _
phoebus amat que visae cupit conubia daphnes , quodque cupit , sperat , que sua illum oracula fallunt .	phoebus amo que video cupio conubium daphne , quisque cupio , spero , que suus ille oraculum fallo .	MASC;N;NOM;SG 3;ACT;FIN;IND;PRS;SG;V CONJ FEM;GEN;PASS;PFV;PST;SG;V;V.PTCP 3;ACT;FIN;IND;PRS;SG;V ACC;N;NEUT;PL FEM;GEN;N;SG _ ACC;NEUT;PRO;SG 3;ACT;FIN;IND;PRS;SG;V _ 3;ACT;FIN;IND;PRS;SG;V _ CONJ ADJ;NEUT;NOM;PL ACC;MASC;PRO;SG N;NEUT;NOM;PL 3;ACT;FIN;IND;PL;PRS;V _
nos libertatem sine tyranno nacti coepimus invitare convivarum sermones .	nos libertas sine tyrannus nanciscor coepio invito conviva sermo .	MASC;NOM;PL;PRO ACC;FEM;N;SG ADP AT+ABL;MASC;N;SG MASC;NOM;PASS;PFV;PL;PST;V;V.PTCP 1;ACT;FIN;IND;PL;PRS;V ACT;NFIN;PRS;V GEN;MASC;N;PL ACC;MASC;N;PL _
laudatis utiliora quae contempseris saepe inveniri haec asserit narratio .	laudo utilis qui contemno saepe invenio hic assero narratio .	AT+ABL;NEUT;PASS;PFV;PL;PST;V;V.PTCP ADJ;CMPR;NEUT;NOM;PL ACC;NEUT;PL;PRO 2;ACT;FIN;PFV;PST;SBJV;SG;V ADV NFIN;PASS;PRS;V FEM;NOM;PRO;SG 3;ACT;FIN;IND;PRS;SG;V FEM;N;NOM;SG _
hoc si quis pretii cupidus vidisset tui , olim redisses ad splendorem pristinum .	hic si quis pretium cupidus video tuus , olim redeo ad splendor pristinus .	ACC;NEUT;PRO;SG CONJ MASC;NOM;PRO;SG GEN;N;NEUT;SG ADJ;MASC;NOM;SG 3;ACT;FIN;PST+PRF;SBJV;SG;V GEN;NEUT;PRO;SG _ ADV 2;ACT;FIN;PST+PRF;SBJV;SG;V ADP ACC;MASC;N;SG ACC;ADJ;MASC;SG _
me legat assidue post haec neglectus amator , et prosint illi cognita nostra mala .	ego lego assiduus post hic neglego amator , et prosum ille cognosco noster malus .	ACC;MASC;PRO;SG 3;ACT;FIN;PRS;SBJV;SG;V ADV ADP ACC;NEUT;PL;PRO MASC;NOM;PASS;PFV;PST;SG;V;V.PTCP MASC;N;NOM;SG _ CONJ 3;ACT;FIN;PL;PRS;SBJV;V DAT;MASC;PRO;SG NEUT;NOM;PASS;PFV;PL;PST;V;V.PTCP NEUT;NOM;PL;PRO ADJ;NEUT;NOM;PL _
talibus inde modis ora indignantia solvit :	talis inde modus os indignor solvo :	ADJ;AT+ABL;MASC;PL ADV AT+ABL;MASC;N;PL ACC;N;NEUT;PL ACC;ACT;NEUT;PL;PRS;V;V.PTCP 3;ACT;FIN;IND;PFV;PST;SG;V _
rursus intendit cutem maiore nisu et simili quaesivit modo , quis maior esset .	rursus intendo cutis magnus nisus et similis quaero modus , quis magnus sum .	ADV 3;ACT;FIN;IND;PFV;PST;SG;V ACC;FEM;N;SG ADJ;AT+ABL;CMPR;MASC;SG AT+ABL;MASC;N;SG CONJ ADJ;AT+ABL;MASC;SG 3;ACT;FIN;IND;PFV;PST;SG;V AT+ABL;MASC;N;SG _ MASC;NOM;PRO;SG ADJ;CMPR;MASC;NOM;SG 3;ACT;FIN;IPFV;PST;SBJV;SG;V _
quid tibi vis , insane ?	quis tu volo , insanus ?	ACC;NEUT;PRO;SG DAT;MASC;PRO;SG 2;ACT;FIN;IND;PRS;SG;V _ ADJ;MASC;SG;VOC _
quantum homo bilinguis saepe concinnet mali , documentum habere stulta credulitas potest .	quantus homo bilinguis saepe concinno malus , documentum habeo stultus credulitas possum .	ACC;ADJ;NEUT;SG MASC;N;NOM;SG ADJ;MASC;NOM;SG ADV 3;ACT;FIN;PRS;SBJV;SG;V ADJ;GEN;NEUT;SG _ ACC;N;NEUT;SG ACT;NFIN;PRS;V ADJ;FEM;NOM;SG FEM;N;NOM;SG 3;ACT;FIN;IND;PRS;SG;V _
sed aduersante conatibus suis m. antonio consule , quem uel praecipuum adiutorem sperauerat , ac ne publicum quidem et translatiuum ius ulla in re sibi sine pactione grauissimae mercedis impertiente , ad optimates se contulit , quibus eum inuisum sentiebat , maxime quod d. brutum obsessum mutinae prouincia a caesare data et per senatum confirmata expellere armis niteretur .	sed adverto conatus suus marcus antonius consul , qui uel praecipuus adjutor spero , atque ne publicus quidem et translativus jus ullus in res sui sine pactio gravis merces impertio , ad optimas sui confero , qui is invideo sentio , magnus quod decimus brutus obsideo mutina provincia ab caesar do et per senatus confirmo expello arma nitor .	CONJ ACT;AT+ABL;MASC;PRS;SG;V;V.PTCP DAT;MASC;N;PL DAT;MASC;PL;PRO AT+ABL;MASC;N;SG AT+ABL;MASC;N;SG AT+ABL;MASC;N;SG _ ACC;MASC;PRO;SG CONJ ACC;ADJ;MASC;SG ACC;MASC;N;SG 3;ACT;FIN;IND;PST+PRF;SG;V _ CONJ CONJ ACC;ADJ;NEUT;SG ADV CONJ ACC;ADJ;NEUT;SG ACC;N;NEUT;SG ADJ;AT+ABL;FEM;SG ADP AT+ABL;FEM;N;SG DAT;MASC;PRO;SG ADP AT+ABL;FEM;N;SG ADJ;FEM;GEN;RL;SG FEM;GEN;N;SG ACT;AT+ABL;MASC;PRS;SG;V;V.PTCP _ ADP ACC;ADJ;MASC;PL ACC;MASC;PRO;SG 3;ACT;FIN;IND;PFV;PST;SG;V _ DAT;MASC;PL;PRO ACC;MASC;PRO;SG ACC;MASC;PASS;PFV;PST;SG;V;V.PTCP 3;ACT;FIN;IND;IPFV;PST;SG;V _ ADV;RL CONJ ACC;MASC;N;SG ACC;MASC;N;SG ACC;MASC;PASS;PFV;PST;SG;V;V.PTCP FEM;GEN;N;SG AT+ABL;FEM;N;SG ADP AT+ABL;MASC;N;SG AT+ABL;FEM;PASS;PFV;PST;SG;V;V.PTCP CONJ ADP ACC;MASC;N;SG AT+ABL;FEM;PASS;PFV;PST;SG;V;V.PTCP ACT;NFIN;PRS;V AT+ABL;N;NEUT;PL 3;ACT;FIN;IPFV;PST;SBJV;SG;V _
ita nunc homeros dicit , quemadmodum inter se pugnent troiani et parentini .	ita nunc homeros dico , quemadmodum inter sui pugno trojani et parentinus .	ADV ADV MASC;N;NOM;SG 3;ACT;FIN;IND;PRS;SG;V _ ADV ADP ACC;MASC;PL;PRO 3;ACT;FIN;PL;PRS;SBJV;V MASC;N;NOM;PL CONJ ADJ;MASC;NOM;PL _
et dixit :	et dico :	CONJ 3;ACT;FIN;IND;PRS;SG;V _
et aperuit os suum in blasphemias ad deum blasphemare nomen eius et tabernaculum eius et eos qui in caelo habitant .	et aperio os suus in blasphemia ad deus blasphemo nomen is et tabernaculum is et is qui in caelum habito .	CONJ 3;ACT;FIN;IND;PFV;PST;SG;V ACC;N;NEUT;SG ACC;ADJ;NEUT;SG ADP ACC;FEM;N;PL ADP ACC;MASC;N;SG ACT;NFIN;PRS;V ACC;N;NEUT;SG GEN;MASC;PRO;SG CONJ ACC;N;NEUT;SG GEN;MASC;PRO;SG CONJ ACC;MASC;PL;PRO MASC;NOM;PL;PRO ADP AT+ABL;N;NEUT;SG 3;ACT;FIN;IND;PL;PRS;V _
hic iuvenum quicumque manu ve pedibus ve rota vicerat , aesculeae capiebat frondis honorem :	hic juvenis quicumque manus ve pes ve rota vinco , aesculeus capio frons honor :	ADV GEN;MASC;N;PL MASC;NOM;PRO;SG AT+ABL;FEM;N;SG CONJ AT+ABL;MASC;N;PL CONJ AT+ABL;FEM;N;SG 3;ACT;FIN;IND;PST+PRF;SG;V _ ADJ;FEM;GEN;SG 3;ACT;FIN;IND;IPFV;PST;SG;V FEM;GEN;N;SG ACC;MASC;N;SG _
aliter non viribus ullis vincere , nec duro poteris convellere ferro .	alius non vis ullus vinco , neque durus possum convello ferrum .	ADV ADV AT+ABL;FEM;N;PL ADJ;AT+ABL;FEM;PL ACT;NFIN;PRS;V _ CONJ ADJ;AT+ABL;NEUT;SG 2;ACT;FIN;FUT;IND;SG;V ACT;NFIN;PRS;V AT+ABL;N;NEUT;SG _
ita imperium semper ad optumum quemque a minus bono transfertur .	ita imperium semper ad bonus quisque ab parvus bonus transfero .	ADV N;NEUT;NOM;SG ADV ADP ACC;ADJ;MASC;SG ACC;MASC;PRO;SG ADP ADV ADJ;AT+ABL;MASC;SG 3;FIN;IND;PASS;PRS;SG;V _
illae timore posito certatim adnatant lignum que supera turba petulans insilit .	ille timor pono certatim adnato lignum que supra turba petulans insilio .	FEM;NOM;PL;PRO AT+ABL;MASC;N;SG AT+ABL;MASC;PASS;PFV;PST;SG;V;V.PTCP ADV 3;ACT;FIN;IND;PL;PRS;V ACC;N;NEUT;SG CONJ ADP FEM;N;NOM;SG ADJ;FEM;NOM;SG 3;ACT;FIN;IND;PRS;SG;V _
lupus arguebat vulpem furti crimine ;	lupus arguo vulpes furtum crimen ;	MASC;N;NOM;SG 3;ACT;FIN;IND;IPFV;PST;SG;V ACC;FEM;N;SG GEN;N;NEUT;SG AT+ABL;N;NEUT;SG _
dux deerat abducto verginio per simulationem amicitiae ;	dux desum abduco verginius per simulatio amicitia ;	MASC;N;NOM;SG 3;ACT;FIN;IND;IPFV;PST;SG;V AT+ABL;MASC;PASS;PFV;PST;SG;V;V.PTCP AT+ABL;MASC;N;SG ADP ACC;FEM;N;SG FEM;GEN;N;SG _
non est saepius in uno homine summa salus periclitanda rei publicae .	non sum saepe in unus homo superus salus periclitor res publicus .	ADV 3;ACT;FIN;IND;PRS;SG;V ADV;CMPR ADP AT+ABL;MASC;NUM;SG AT+ABL;MASC;N;SG ADJ;FEM;NOM;RL;SG FEM;N;NOM;SG FEM;NOM;SG;V;V.CVB FEM;GEN;N;SG ADJ;FEM;GEN;SG _
refugit tamen oscula lignum .	refugio tamen osculum lignum .	3;ACT;FIN;IND;PFV;PST;SG;V ADV ACC;N;NEUT;PL N;NEUT;NOM;SG _
arietes a tarento emit , et eos culavit in gregem .	aries ab tarentum emo , et is culo in grex .	ACC;FEM;N;PL ADP AT+ABL;N;NEUT;SG 3;ACT;FIN;IND;PRS;SG;V _ CONJ ACC;MASC;PL;PRO 3;ACT;FIN;IND;PFV;PST;SG;V ADP ACC;MASC;N;SG _
eos mores que eam modestiam viri cognovi .	is mos que is modestia vir cognosco .	ACC;MASC;PL;PRO ACC;MASC;N;PL CONJ ACC;FEM;PRO;SG ACC;FEM;N;SG GEN;MASC;N;SG 1;ACT;FIN;IND;PFV;PST;SG;V _
tumens inani graculus superbia , pennas pavoni quae deciderant sustulit se que exornavit .	tumeo inanis graculus superbia , penna pavo qui decido tollo sui que exorno .	MASC;NOM;PRS;SG;V;V.PTCP ADJ;AT+ABL;FEM;SG MASC;N;NOM;SG AT+ABL;FEM;N;SG _ ACC;FEM;N;PL DAT;MASC;N;SG FEM;NOM;PL;PRO 3;ACT;FIN;IND;PL;PST+PRF;V 3;ACT;FIN;IND;PFV;PST;SG;V ACC;MASC;PRO;SG CONJ 3;ACT;FIN;IND;PFV;PST;SG;V _
unde sic , quaeso , nites ?	unde sic , quaeso , niteo ?	ADV ADV _ 1;ACT;FIN;IND;PRS;SG;V _ 2;ACT;FIN;IND;PRS;SG;V _
non mehercules hodie buccam panis invenire potui .	non hercules hodie bucca panis invenio possum .	ADV INTJ ADV ACC;FEM;N;SG GEN;MASC;N;SG ACT;NFIN;PRS;V 1;ACT;FIN;IND;PFV;PST;SG;V _
an satis , o superi , tutos fore creditis illos , cum mihi , qui fulmen , qui vos que habeo que rego , struxerit insidias notus feritate lycaon ? '	an satis , o superi , tueor sum credo ille , cum ego , qui fulmen , qui tu que habeo que rego , struo insidiae notus feritas lycaon ? '	CONJ ADV _ INTJ MASC;N;PL;VOC _ ACC;MASC;PASS;PFV;PL;PST;V;V.PTCP ACT;FUT;NFIN;V 2;ACT;FIN;IND;PL;PRS;V ACC;MASC;PL;PRO _ CONJ DAT;MASC;PRO;SG _ MASC;NOM;PRO;SG ACC;N;NEUT;SG _ MASC;NOM;PRO;SG ACC;MASC;PL;PRO CONJ 1;ACT;FIN;IND;PRS;SG;V CONJ 1;ACT;FIN;IND;PRS;SG;V _ 3;ACT;FIN;FUT;IND;PFV;SG;V ACC;FEM;N;PL MASC;N;NOM;SG AT+ABL;FEM;N;SG MASC;N;NOM;SG _ _
et puto , cum vicensimariis magnam mantissam habet ;	et puto , cum vicensimarius magnus mantissa habeo ;	CONJ 1;ACT;FIN;IND;PRS;SG;V _ CONJ AT+ABL;MASC;N;PL ACC;ADJ;FEM;SG ACC;FEM;N;SG 3;ACT;FIN;IND;PRS;SG;V _
cordus cremutius scribit ne admissum quidem tunc quemquam senatorum nisi solum et praetemptato sinu .	cordus cremutius scribo ne admitto quidem tunc quisquam senator nisi solus et praetempto sinus .	MASC;N;NOM;SG MASC;N;NOM;SG 3;ACT;FIN;IND;PRS;SG;V CONJ ACC;MASC;PASS;PFV;PST;SG;V;V.PTCP ADV ADV ACC;MASC;PRO;SG GEN;MASC;N;PL CONJ ACC;ADJ;MASC;SG CONJ AT+ABL;MASC;PASS;PFV;PST;SG;V;V.PTCP AT+ABL;MASC;N;SG _
qualis videtur opera tibi vocis meae ?	qualis video opera tu vox meus ?	ADJ;FEM;NOM;SG 3;FIN;IND;PASS;PRS;SG;V FEM;N;NOM;SG DAT;MASC;PRO;SG FEM;GEN;N;SG FEM;GEN;PRO;SG _
patrono meo ossa bene quiescant , qui me hominem inter homines voluit esse .	patronus meus ossum benus quiesco , qui ego homo inter homo volo sum .	DAT;MASC;N;SG ADJ;DAT;MASC;SG N;NEUT;NOM;PL ADV 3;ACT;FIN;PL;PRS;SBJV;V _ MASC;NOM;PRO;SG ACC;MASC;PRO;SG ACC;MASC;N;SG ADP ACC;MASC;N;PL 3;ACT;FIN;IND;PFV;PST;SG;V ACT;NFIN;PRS;V _
illic phylacides iucundae coniugis heros non potuit caecis immemor esse locis , sed cupidus falsis attingere gaudia palmis thessalus antiquam venerat umbra domum .	illic phylacides jucundus conjunx heros non possum caecus immemor sum locus , sed cupidus fallo attingo gaudium palma thessalus antiquus venio umbra domus .	ADV MASC;N;NOM;SG ADJ;FEM;GEN;SG FEM;GEN;N;SG MASC;N;NOM;SG ADV 3;ACT;FIN;IND;PFV;PST;SG;V ADJ;AT+ABL;MASC;PL ADJ;MASC;NOM;SG ACT;NFIN;PRS;V AT+ABL;MASC;N;PL _ CONJ ADJ;MASC;NOM;SG AT+ABL;FEM;PASS;PFV;PL;PST;V;V.PTCP ACT;NFIN;PRS;V ACC;N;NEUT;PL AT+ABL;FEM;N;PL ADJ;MASC;NOM;SG ACC;ADJ;FEM;SG 3;ACT;FIN;IND;PST+PRF;SG;V FEM;N;NOM;SG ACC;FEM;N;SG _
et pseudoprophetes et cruciabuntur die ac nocte in saecula saeculorum .	et pseudoprophes et crucio dies atque nox in saeculum saeculum .	CONJ MASC;N;NOM;PL CONJ 3;FIN;FUT;IND;PASS;PL;V AT+ABL;FEM;N;SG CONJ AT+ABL;FEM;N;SG ADP ACC;N;NEUT;PL GEN;N;NEUT;PL _
cave , maiorem maledicas .	caveo , magnus maledico .	2;ACT;FIN;IMP;PRS;SG;V _ ACC;ADJ;CMPR;MASC;SG 2;ACT;FIN;PRS;SBJV;SG;V _
ego nullum puto tam magnum tormentum esse quam continere .	ego nullus puto tam magnus tormentum sum quam contineo .	MASC;NOM;PRO;SG ACC;ADJ;NEUT;SG 1;ACT;FIN;IND;PRS;SG;V ADV ACC;ADJ;NEUT;SG ACC;N;NEUT;SG ACT;NFIN;PRS;V ADV ACT;NFIN;PRS;V _
horum soror erat helena .	hic soror sum helena .	GEN;MASC;PL;PRO FEM;N;NOM;SG 3;ACT;FIN;IND;IPFV;PST;SG;V FEM;N;NOM;SG _
ita civitas servitute oppressa stultae laetitiae gravis poenas dedit .	ita civitas servitus opprimo stultus laetitia gravis poena do .	ADV FEM;N;NOM;SG AT+ABL;FEM;N;SG FEM;NOM;PASS;PFV;PST;SG;V;V.PTCP ADJ;DAT;FEM;SG DAT;FEM;N;SG ACC;ADJ;FEM;PL ACC;FEM;N;PL 3;ACT;FIN;IND;PFV;PST;SG;V _
lupercalibus uetuit currere inberbes , item saecularibus ludis iuuenes utriusque sexus prohibuit ullum nocturnum spectaculum frequentare nisi cum aliquo maiore natu propinquorum .	lupercalis veto curro imberbis , item saecularis ludus juvenis uterque sexus prohibeo ullus nocturnus spectaculum frequento nisi cum aliquis magnus natus propinquus .	AT+ABL;N;NEUT;PL 3;ACT;FIN;IND;PFV;PST;SG;V ACT;NFIN;PRS;V ACC;ADJ;MASC;PL _ ADV ADJ;AT+ABL;MASC;PL AT+ABL;MASC;N;PL ACC;ADJ;MASC;PL GEN;MASC;PRO;SG GEN;MASC;N;SG 3;ACT;FIN;IND;PFV;PST;SG;V ACC;ADJ;NEUT;SG ACC;ADJ;NEUT;SG ACC;N;NEUT;SG ACT;NFIN;PRS;V CONJ ADP AT+ABL;MASC;PRO;SG ADJ;AT+ABL;CMPR;MASC;SG AT+ABL;MASC;N;SG ADJ;GEN;MASC;PL _
si vero accessit consiliator maleficus , vis et nequitia quicquid oppugnant , ruit .	si verus accedo consiliator maleficus , vis et nequitia quisquis oppugno , ruo .	CONJ ADV 3;ACT;FIN;IND;PFV;PST;SG;V MASC;N;NOM;SG ADJ;MASC;NOM;SG _ FEM;N;NOM;SG CONJ FEM;N;NOM;SG ACC;NEUT;PRO;SG 3;ACT;FIN;IND;PL;PRS;V _ 3;ACT;FIN;IND;PRS;SG;V _
scissa lautum novendiale servo suo misello faciebat , quem mortuum manu miserat .	scissa lautus novendialus servus suus misellus facio , quis mortuus manus mitto .	FEM;N;NOM;SG ACC;ADJ;NEUT;SG ACC;N;NEUT;SG DAT;MASC;N;SG ADJ;DAT;MASC;SG ADJ;DAT;MASC;SG 3;ACT;FIN;IND;IPFV;PST;SG;V _ ACC;MASC;PRO;SG ACC;ADJ;MASC;SG AT+ABL;FEM;N;SG 3;ACT;FIN;IND;PST+PRF;SG;V _
ab lentulo , cethego , statilio , item cassio postulant ius iurandum , quod signatum ad civis perferant :	ab lentulus , cethegus , statilius , item cassius postulo jus juro , qui signo ad civis perfero :	ADP AT+ABL;MASC;N;SG _ AT+ABL;MASC;N;SG _ AT+ABL;MASC;N;SG _ ADV ADJ;AT+ABL;MASC;SG 3;ACT;FIN;IND;PL;PRS;V ACC;N;NEUT;SG ACC;NEUT;PASS;PRS;SG;V;V.CVB _ ACC;NEUT;PRO;SG ACC;NEUT;PASS;PFV;PST;SG;V;V.PTCP ADP ACC;MASC;N;PL 3;ACT;FIN;PL;PRS;SBJV;V _
non semel et satyros eluserat illa sequentes et quoscumque deos que umbrosa silva que ferax rus habet .	non semel et satyrus eludo ille sequor et quicumque deus que umbrosus silva que ferax rus habeo .	ADV ADV CONJ ACC;MASC;N;PL 3;ACT;FIN;IND;PST+PRF;SG;V FEM;NOM;PRO;SG ACC;ACT;MASC;PL;PRS;V;V.PTCP CONJ ACC;MASC;PL;PRO ACC;MASC;N;PL CONJ ADJ;FEM;NOM;SG FEM;N;NOM;SG CONJ ADJ;NEUT;NOM;SG N;NEUT;NOM;SG 3;ACT;FIN;IND;PRS;SG;V _
